,press company,date,title,url,abstract,date detail,head article,main article
111,https://www.forbes.com/,"Jan 22, 2018","Tax Return 2.0: How Blockchain Technology Can Bring America's Budget Into 
The Future",https://www.forbes.com/sites/forbestechcouncil/2018/01/22/tax-return-2-0-how-blockchain-technology-can-bring-americas-budget-into-the-future/,"The most well-known use of blockchain technology right now is likely 
Bitcoin, the cryptocurrency established in 2008. But what is blockchain ...","Jan 22, 2018,08:15am EST",Shutterstock,"As the holidays wind down, many Americans start anticipating what can be a dreaded time of year for individuals and business alike: tax season. 2018 brings a fresh wave of worry and hope with the latest changes to the tax code, but one key issue stays the same — citizens have very little input into how their taxes are used by the federal government. For those unwilling to go full Thoreau on the problem (i.e., refuse to pay taxes and risk jail time), we typically just grumble about the injustice and submit our forms by April 15 anyway. But what if there was another way? To consider a unique solution, we must first understand the revolutionary technology that can get us there — blockchain.Blockchain BasicsThe most well-known use of blockchain technology right now is likely Bitcoin, the cryptocurrency established in 2008. But what is blockchain technology, and how does it allow our digital transactions to be more secure than ever before?Put simply, blockchain technology eliminates the current system of transactions in which every party involved has their own record of what happened during the transaction. Instead, blockchain creates a single, unalterable record of transactions that make up “blocks.” This is a permanent, indisputable record of authenticity and authorization that allows transactions to be secure and trusted over a digital network.As BlockGeeks puts it, “Picture a spreadsheet that is duplicated thousands of times across a network of computers. Then imagine that this network is designed to regularly update this spreadsheet and you have a basic understanding of the blockchain.”The key idea here is that everyone involved is engaging with the same record. A single record of the transaction means less wiggle room for altering the information that occurs when we rely on multiple copies of redundant records.The record of transactions itself becomes the form of trust. Not even a system administrator can delete a digital sequence in the chain, so users have full transparency around the transactions that are occurring. And what, exactly, are these data “sequences”? They are defined as: “a kind of self-auditing ecosystem of digital value, the network reconciles every transaction that happens in ten-minute intervals. Each group of these transactions is referred to as a 'block.'""Federal Tax Spending: Where We Are (And How Blockchain Can Help)So, what does blockchain technology have to do with taxes? Since this technology is both secure and robust enough to deal with a range of transaction types, it could actually be used to allow each taxpayer to set their own preference ratios of our national budget when filing. The result is that people would feel much more engaged when paying their taxes, and we’d have a stronger democratic society overall.Before we get into an example of how this works, let’s take a quick review of how our current federal budget is allocated, courtesy of the Center on Budget and Policy Priorities. Our budget is divided into mandatory spending programs and discretionary spending programs, but the total breakdown is as follows:• Social Security: In 2016, 24% of the federal budget, or $916 billion, paid for Social Security, a program which provides for retirement income, as well as income for disabled workers and the families of deceased and disabled workers.• Healthcare Subsidies: The combined total of Medicaid, Medicare, CHIP and healthcare marketplace subsidies amounted to 26 percent of the budget in 2016, or $1 trillion.• Defense and International Security: In 2016, 16% of the budget, or $605 billion, was used for defense and international security.• Safety Net programs: 9% of the federal budget, or $366 billion, supports programs for families facing hardship, including SNAP food assistance and the Earned Income Tax Credit program (EITC).• Interest on Debt: In 2016, interest payments on debt owed took up $240 billion, or about 6% of the budget.• Everything Else: The remaining 19% of our federal budget is tasked with covering all other needs, including benefits for federal retirees and veterans (8%), infrastructure (2%), education (2%), science and medical research (2%), non-security related international programs (1%) and the remaining 3% is for all other federal spending.If blockchain technology was used for tax returns, a dedicated portion of each tax return would go to the mandatory spending, which includes social security, healthcare, veteran’s benefits, transportation and food and agriculture. The remaining amount (discretionary spending, of which over 50% is devoted to military and defense) could be categorized and the filer will be able to determine what percentage of their taxable income would go toward which area of need. As an example, an individual who really values STEM education could direct 75% of their discretionary amount towards K-12 education, which currently receives a tiny sliver of the overall federal budget.With blockchain as a way to authenticate and authorize these allocations, we can look at a family who owes $10,000 in federal taxes. 60% would go toward mandatory spending, or approximately $6,000 of their annual taxes, which is allocated as needed for the programs listed above. The remaining $4,000 would be divvied up based upon the interests of the taxpayer, but no category would be left completely blank. With every taxpayer contributing at least something to every category, we could get a better sense of our shared priorities and feel that we’re contributing to the budget in a meaningful way that truly reflects our values.Technology experts agree that blockchain will continue to serve as a powerful tool in a range of industries, so why can’t we use it to overhaul our democracy? Not only would this approach boost engagement and allow voters to have a real say in government spending, but it could create powerful shifts in how we fund the programs that matter to us most.."
112,https://www.forbes.com/,"Jan 10, 2018",8 Tips For CMOs From Top Digital Entrepreneurs,https://www.forbes.com/sites/steveolenski/2018/01/10/8-tips-for-cmos-from-top-digital-entrepreneurs/,"With Bitcoin and popular “Alt-Coins” like Ethereum, Ripple, Bitcoin Cash 
and Litecoin exceeding $300 billion dollars in market cap, that is a lot ...","Jan 10, 2018,02:28pm EST",Entrepreneurs can show even the most seasoned CMO a thing or two that can greatly benefit their... [+] brand.,"There’s no doubt that 2017 was the year social media and Google heavily influenced consumers online buying decisions. Black Friday online sales actually broke a record surpassing five billion dollars. As the new year begins, it’s more important now than ever before to establish and execute a successful digital strategy.While not all marketing campaigns succeed, especially online, the ones that are successful often have many things in common. But who are the entrepreneurs behind many of these successful internet advertising campaigns? What do the successful campaigns have in common? Here is the advice these 8 digital marketing trendsetters have to offer that business can apply to improve the chances of their campaigns succeeding in the coming year.Plus a lesson from yours truly on what each means for CMOs.1. Don't Make It Personal 
Many entrepreneurs and marketers alike pick out a product they personally think is cool or have some kind of personal attachment to and then build campaigns that appeal to their personal interests, wondering why their campaign failed. To succeed in eCommerce you are better off ignoring your personal opinions and tastes and going with researched data and facts about niches that are having success being marketed online. Connecting those audiences with products that appeal to them by advertising is a much better way to affirm their interest and get them to buy from you. This is hard for a lot of entrepreneurs to get past, but as soon as they stop putting what they think is cool ahead of what the audience needs and wants, they start seeing a lot more success much faster. - Adrian Morrison, online marketer CMO Lesson: This has long been a pet peeve of mine. I have seen countless examples where CMOs and thus their teams look a given product, campaign, etc. from their personal vantage point instead of via the lens of the consumer AKA the one the people who will keep them employed in the first place. Think of them. Not you. 2. Build A CommunityThanks to the Internet, people are more connected and accessible than ever, but personally more disconnected. Since so much time is spent online, and advertising is so competitive, businesses have to reevaluate how they plan to build a relationship with customers in 2018. Building an online community of potential customers around topics that people are passionate about, and that also aligns with your business, is a sure way to build a tribe of fans and customers that are loyal to your brand. Giving valuable content around the topic, giving customers the ability to have a voice and providing a platform for them to build relationships with other customers who share the same interests is a sure strategy that will stop them from straying to the competition and keep customers loyal to the brand. - Steve Howe, Founder, Yoga LifestylesCMO Lesson: Great lesson here kids re: communities. I would caution however re: the whole aligning with your business part Steve refers to. Of course there has to be some connection but do not make the mistake of using communities to sell. Ever. 3. Be Your Brand Customers like to do business with people they know and like. Successful corporate leaders like Virgin’s Richard Branson and T-Mobile’s John Legere have mastered this, but it applies to entrepreneurs and smaller brands too. With the rise and dominance in social media, it has never been more important to build a personal brand and position yourself as an authority in your space. Also, thanks to social media, it has never been easier. To survive as a business leader in 2018, a strong personal brand is more of a necessity than an option. Show the audience of customers you are trying to appeal to that you relate to them, share the same views and values, and are someone they would want to personally do business with.Create a web presence that is in line with that personal brand and give customers the ability to interact, experience, and engage your brand. Connect with customers and deliver content worth following and sharing on social media to build an ongoing relationship with them. Follow up consistently with direct engagements to give customers the ability to do business with your brand. A personal brand does not have to mean trying to get internet famous or have the most followers online, it means positioning yourself as a credible leader and authority in the specific industry you are most qualified to deliver the most value in. - Vito Glazers, WE TV's Season 1 Mystery Millionaire™, actor and entrepreneurCMO Lesson: Much like the previous tip I like this but there is a caveat to what Vito says. You can't be everything to everyone. So where he says ""Show the audience of customers you are trying to appeal to that you relate to them, share the same views and values..."" stay true to YOURS and YOUR BRAND's values. Don't flip flop to try and appeal to everyone for then you will appeal to no one. 4. Integrate CryptocurrencyTechnology is disrupting everything, even money. Every time there is a massive change, there is opportunity for entrepreneurs. One of the potentially biggest opportunities for forward thinking entrepreneurs in 2018 is integrating the ability to pay with crypto currencies into their e-commerce business models. With Bitcoin and popular “Alt-Coins” like Ethereum, Ripple, Bitcoin Cash and Litecoin exceeding $300 billion dollars in market cap, that is a lot of money on its own. Then take into consideration that this currency is completely online, and has limited ways that it can be spent, and you get a clearer picture of the opportunity in being in on the ground floor of merchants who are willing to accept these types of currencies. - Mitch Sanders, real estate investor and entrepreneurCMO Lesson: What was once reserved for startups or ""those other companies"" cryptocurrency is becoming more mainstream with brands like Burger King getting in on the action. Just be sure to start with the baby pool vs. diving into the deep end. 5. Let Data DecideToo many online entrepreneurs leave too many variables to chance. When putting together a marketing strategy for an online business in 2018, three things should take the highest priority: Data, Targeting and Analytics. Make sure to measure every aspect of a campaign in a way that can be segmented to give a perspective of what worked and what did not. Every dollar spent on advertising should also be considered a dollar spent on data. Take the time to research the audience, see the way they do business online and find strategic advantages in targeting and interacting with them. Then analyze everything and let the metrics be the guide to success. - Rosen Minchev, business coach and consultantCMO Lesson: The lesson here is if this news to ANY CMO you may want to strongly consider a career change. We all know there is no shortage of data. The challenge has become what to do with all of it: what to do with the data you DON'T need while maximizing the data you DO need. All data is not created equal. Wow, that's pretty profound, huh? 6. Content Is Still KingThere is one main reason people love to be on their computers, tablets and phones, and that is people love to consume content. Everyday 1 billion hours worth of content is watched on YouTube and American consumers spend up to 5 hours per day on their mobile phones. Consumers are programmed to not like ads, but advertising that connects the message of a product or brand to content that customers will love to watch and be excited to share, is going to be one of the most important trends to follow for forward thinking companies in 2018. - Ronnie Sandlin, President, Temet Nosce, LLCCMO Lesson: With all due respect to Mr. Sandlin, content is NOT king. Relevant content is king. It is not only king, it is queen, prince, princess and all the townspeople too! Your content MUST connect with your customers and prospects and given the aforementioned data that is in abundance there is literally no reason to deliver content that is anything but relevant. 7. Artificial Intelligence AI is not new. In fact, you probably already interact with marketing AI on a regular basis when you see ads in search results and on social media. And, 57% of marketers already use AI. However, the use of AI for marketing is only going to grow as the technology improves. It's projected to grow by 53% in the next couple of years. I know there are pros and cons to AI with staunch supporters on each side of the aisle. On one hand machine learning and improved technology can make all our lives better and easier, especially when it comes to dealing with data. On the other hand though there many who fear losing their jobs to a machine or robot. There is no standard pat answer when it comes to AI. The key will be to understand how your particular company or brand can best benefit from it. - Rob Lundquist CMO of Henriksen Butler.CMO Lesson: I don't have a lot to add here other than to reiterate what Mr. Lundquist said. I hear it all the time re: the good and bad side of AI. My fear is that it will become the new 'buzz word' meaning marketers across the globe will rush to jump into the AI pool without taking swimming lessons. Yes that's my second pool analogy if you're keeping score at home. 8. Mobile Video ConsumptionIf your website, and your marketing strategy more broadly, isn't optimized for mobile yet in 2017, 2018 is the year to start. Put simply, search engines will penalize you if your website isn’t mobile friendly. Besides, it’s no secret that consumers spend much of their lives staring at their phones. In 2018, mobile video consumption is expected to grow by 25% (and video consumption is supposed to decline on laptops and desktop computers for the first time ever), so get ahead of the competition now by planning a mobile video strategy. - Brett Juhl CMO of Spacesaver Intermountain.CMO Lesson: This is not a knock on Mr. Juhl whatsoever but it blows my mind that this even has to be said/written in the year 2018. I find it hard to believe there is a marketer in the world right this very second who doesn't realize the magnitude of mobile in every possible manner including video. But while I find hard to believe I also realize it still needs to be said/written which is frightening. "
