,press company,date,title,url,abstract,date detail,head article,main article
40,https://www.forbes.com/,"Jan 22, 2018","Beyond Bitcoin: What Blockchain Really Means And What That Means For 
Retailers",https://www.forbes.com/sites/paularosenblum/2018/01/22/beyond-bitcoin-what-blockchain-really-means-and-what-that-means-for-retailers/,"Everyone is talking about Bitcoin, but the currency is just the visible 
edge of a technological iceberg. Beyond the noise and hum, we are just ...","Jan 22, 2018,08:00am EST","Everyone is talking about Bitcoin, but the currency is just the visible edge of a technological iceberg. Beyond the noise and hum, we are just barely scratching the surface of uses for the underlying technology, blockchain. The opportunity for retailers is really interesting. Blockchain in the supply chain is one useful tool. Customer engagement is the bigger opportunity.","I was a CIO in Boston during the heady days of the dot-com expansion. I heard stories of VC companies pestering their new start-ups...”Have you used up the $25 million I gave you yet?” and wondered what the heck they were thinking.  I also knew I was missing something. I wanted in, but a CIO was not desirable in the dot-com space at that time. CTO’s were the rage.Certainly, we can say that over the past twenty years, the world of the internet has stabilized. Particularly in the world of retail, digital channels are generally a part of a retailers’ overall strategy.  And as an excellent recent New York Times article argues, while the open protocols underpinning the internet still exist, at the next layer, proprietary protocols and standards have filled any gaps in the original standard. So Facebook, with more than two billion users, has become a de facto personal identity standard. LinkedIn aspires to be the de facto business identity standard. And Amazon, well…you know. It would like to rule the commerce world entirely.So, in many ways, aspects of what was meant to be standard and widespread have become consolidated and proprietary. As such, they are also open to attack and/or coopting, as Facebook apparently was, by foreign agents seeking to influence the US elections. This has proven to be more than a little problematic.The world is changing again. This past week in Miami, I think I got a sniff into what I missed in the 1990’s, as I found myself in the middle of a feeding frenzy, the North American Bitcoin Conference, now a part of the World Blockchain Forum, Investments and ICO’s. For the uninitiated, an ICO is an “Initial Coin Offering.”  There were a lot of ICO offerings in the midst of the speeches, and truly, Venture Capitalists were panting over the possibilities. I was sitting at one booth where quite literally, a Venture Capitalist introduced himself as such and basically said “I want in.  Who do I give my money to?”I should mention four years ago I went to the Bitcoin conference in Miami, and it was not part of anything else. It also was attended by about 600 people (mostly young guys), in a very warm room upstairs from the Miami Beach Convention Center. The Bitcoin was worth $600 a coin at that time.  This year’s conference filled the 4,600 seat James L. Knight Center in downtown Miami and additionally filled about 50,000 square feet of exhibit space (all booths were 10*10, for reference). It's true that after a crazy ride, the Bitcoin is settling in at around $11,000 per coin, but that no way dampened enthusiasm. The event is still not NRF Big Show size, but it’s pretty big, and the investment money was flowing like water.In fact, the Bitcoin conference re-branded as a part of the World Blockchain Forum actually tells you a lot. Behind the noise, blockchain is the crown jewel of this new era. So while the world at large is focused on Bitcoin’s wild valuation swings, and no less than Jamie Dimon, CEO of J.P. Morgan Chase’s announcement that he regrets calling Bitcoin a fraud, they might miss the second part of his statement, “The blockchain is real,” and they miss the way dollars and fiat currencies in all flavors are flowing into blockchain-based start-ups. In fact, J.P Morgan Chase announced a blockchain based system last October that will significantly reduce the number of parties needed to verify global payments, reducing transaction times from weeks to hours (and no doubt making their transactions more profitable).IBM has thrown money behind blockchain, so has JDA. But there are boatloads of start-ups out there, and there is a lot of work to be done, particularly on the ledger’s ability to process a lot of transactions at the same time (scale).Blockchain is distributed, which is to say it is replicated in multiple locations around the world, and activity/transactions are irrevocable. The distributed aspect has both positive and negative implications. Because the entire chain is distributed (i.e. lives in more than one place), it has latency built in.  That is to say that it takes time to replicate transactions into every blockchain ledger around the world. That’s the downside. But because it is distributed, it is also hard to destroy, just like the internet. Just as the internet was original designed by the defense department to avoid single points of failure, a blockchain is hard to destroy.Because transactions are irrevocable, debates about who did what to whom, when, tend to disappear. It is meant to be the true “permanent record.” As such, it is designed for exchanges between parties that do not trust each other and who would be happy to be anonymous.Now that I’ve presented this probably overlong explanation of blockchain, I want to describe one blockchain-based retail application that could solve a somewhat intractable problem: the desire for consumers to experience more personalized offers from retailers, coupled with their desire to maintain their privacy. In other words, I'm talking about customer engagement. By all accounts, personalization is a Holy Grail in retail. Today’s consumer simply doesn’t want to see extraneous “stuff.” She wants to see things that are relevant to her lifestyle, budget and overall tastes. But she’s not keen to “open the kimono” and let you know everything about her.Enter Shopin. It’s early stage, and just now took its Initial Coin Offering live. It is actually being called a “private token pre-sale.”  The concept is simple.I spoke with Shopin’s Blockchain Technology Officer, Jeremy Harkness, at the show. Shopin has modified blockchain to have qualities of both a ledger (the original blockchain design), and a database.  It is built on Ethereum, which appears to be the most widely used blockchain implementation (with an associated cryptocurrency, of course). According to Harkness, Shopin’s implementation can process millions of transactions. They have clocked it at between one million and two million transactions per second, so it should be adequate for retailers. It's an interesting concept.The consumer owns the key to her data and can permission it out if she wants to. If she agrees to permission it out (and she could theoretically be given Shopin tokens by the retailer for doing so), the retailer is given anonymized information so it can understand the shoppers needs and wants. The technology will include a bit of Artificial Intelligence (AI), so that it can match up what a retailer has available for sale with the shopper’s tastes. At any point along the way, a Shopin token can be exchanged either as a reward or as an incentive.The retailer only sees what the AI engine’s recommendation is, based on what’s in stock vs. what the customer’s past purchase history is. Privacy is maintained, relevancy is achieved.Shopin also plans to include a wallet, which would give the consumer a single sign on and one click checkout.  Two-factor authentication is included to help insure privacy and accuracy.I initially had some concerns about data accuracy, since having looked at Acxiom’s aboutthedata.com I discovered numerous errors in their recording of my tastes. I also know a core tenet of blockchain is irrevocability. However, I would later see from looking at Shopin’s web site, that they plan to allow the consumer to pre-enter her own tastes along with reviewing previous purchase data passed into the system. In other words, the consumer is in control, and the retailer can respond accordingly.This is an interesting way to get to personalization without sacrificing privacy. It’s important because notwithstanding continual statements that “Millennials don’t care about their privacy,” most studies seem to tell us that they certainly do. Really, what they want is control.Shopin isn’t fully ready for prime time, but it does give you a taste of the possibilities. Couple with that some of the core tenets of blockchain: distributed data, knowing no geographic borders or fees and fundamentally almost impossible to hack and it starts to become intriguing.Long story short, blockchain offers a lot of possibilities to fulfill the original promise of the internet. It beats back arbitrary geographic and political boundaries, so it is of great interest to populists and anarchists alike. It’s private, safe and in no one individual’s control.  The promise is huge."
41,https://www.forbes.com/,"Jan 22, 2018","Explaining Directed Acylic Graph (DAG), The Real Blockchain 3.0",https://www.forbes.com/sites/shermanlee/2018/01/22/explaining-directed-acylic-graph-dag-the-real-blockchain-3-0/,"Bitcoin's rise into popularity resulted in it being categorized as 
Blockchain 1.0. With Ethereum making waves as a decentralized platform 
for ...","Editors' Pick|Jan 22, 2018,03:13am EST",Coins of the cryptocurrencies Ethereum and Bitcoin stand on a table. (Photo by Thomas... [+] Trutschel/Photothek via Getty Images),"The concept of blockchain as a standalone technology started gaining popularity in 2015. Prior to that, it was just known as a data structure underlying Bitcoin technology. In Satoshi Nakamoto’s white paper, the two words “block” and “chain” appeared together. It was only called “a chain of blocks.”Bitcoin’s rise into popularity resulted in it being categorized as Blockchain 1.0. With Ethereum making waves as a decentralized platform for applications that run exactly as programmed, more and more people began to categorize Ethereum as Blockchain 2.0. Now the market is battling to see who will be named Blockchain 3.0. Direct Acyclic Graph or DAG may be it.What is DAG?DAG is a directed graph data structure that uses a topological ordering. The sequence can only go from earlier to later. DAG is often applied to problems related to data processing, scheduling, finding the best route in navigation, and data compression.Bitcoin Blockchain Storage StructureBitcoin has always been inefficient due to the proof-of-work (POW) system. Blocks can’t be created simultaneously. The linked storage structure allows for only one chain on the whole network. All the transactions occurring around the same time are kept in the same block. Miners then compete for the block validation. One single block is created about every 10 minutes.The first community to come up with the idea of changing the chain-like storage structure into a DAG of blocks was NXT. If the time of mining remains unchanged, the storage could be extended by X times with X blocks on the network at the same time.DAG of Blocks StructureThe blockchain combination with DAG still comes from the idea of side-chains. Different types of transactions are running on different chains simultaneously. DAG of blocks still relies on the concept of blocks.IoT Chain (ITC), IOTA, and Byteball are the blockless projects currently shining in the market. With Bitcoin or Ethereum, the block creation speed is a bottleneck. Bitcoin generates a new block every 10 minutes. Ethereum is better, but it takes around 15-20 seconds for block validation. But why do we even need a block? On the bitcoin network, many transactions are mined into blocks and the transaction sequence is maintained by the prehashes between blocks. What if you combine blocks and transactions together? Make every transaction directly involved in maintaining the sequences. After the transaction is placed, you can skip the process of mining. This makes it blockless and more efficient. Concepts in the DAG BlockchainThe Double-Spending Issue, from a Probabilistic PerspectiveThe Bitcoin network uses the UTXO (Unspent Transaction Output) model. Users are only allowed to have one transaction placement under their UTXO. There might be more than one miner who solves the hash function at the same time to acquire the right of block validation. This might develop forks temporarily. The validation of a certain transaction is decided by the number of transactions behind it. The rate of transactions coming back into the network is lower with more transactions behind it, which makes the transaction safer.The Width of the NetworkWhen each transaction is validated, it needs to be linked to an existing and relatively new transaction on the DAG network. If it links to earlier transactions every time, it would make the network too wide to validate the new transactions. Ideally, the DAG network chooses an existing later transaction to link to when a new transaction happens. The goal is to keep the network width within a certain range that can support quick transaction validation. IOTA also proposed its own algorithm controlling the width on the tangle network.Quick TransactionsDue to its blockless nature, the transactions run directly into the DAG networks. The whole process is much faster than those of blockchains based on PoW and PoS. No Mining InvolvedThere are no miners on DAG networks. The validation of transactions goes directly to the transactions themselves. For users, this means transactions go through almost instantly. Friendly to Small PaymentsWith the advancement of DAG, we’re looking at a future where high functioning and minimum transaction fee chains are possible. That means users can send micro-payments without heavy fees like Bitcoin or Ethereum.One project in China looks to be taking a serious swing at being the leader in this space. IoT Chain (ITC) is built on DAG and can handle over 10,000 transactions per second. It has a strong vision, strong community, and is backed by leading blockchain funds like ChainFunder and FBG. IoT Chain has a solid shot at becoming categorized as Blockchain 3.0.DAG will be used for applications that require scalability in the thousands of transactions per second. The launch of CryptoKitties clogged the Ethereum network which resulted in slow transactions and high fees. Ethereum has a solution to this called sharding, but it is 5 years out. Applications will soon, I think, be turning to DAG to scale."
42,https://www.forbes.com/,"Jan 9, 2018","Millennials, Here's How Cryptocurrency Could Transform Your Future",https://www.forbes.com/sites/julesschroeder/2018/01/09/millennials-heres-how-cryptocurrency-could-transform-your-future/,"Some call cryptocurrency the “digital gold rush,” magnetizing thousands 
around the world to invest in digital currencies like Bitcoin and other ...","Jan 9, 2018,06:31pm EST",Source: www.pexels.com,"To be completely honest, conversations about finances and investments usually tend to put me to sleep. But for some reason, all of this buzz about cryptocurrency really has my attention.Some call cryptocurrency the “digital gold rush,” magnetizing thousands around the world to invest in digital currencies like Bitcoin and other alternative coins like Litecoin and TRON. Although skeptics have their concerns, there’s no denying cryptocurrency has an exponential growth trend that appears to be steadily rising.For millennials, cryptocurrency could be the investment opportunity of a lifetime. Not to mention, it’s ushering in a tidal wave of technological innovation. The biggest barrier to entry for most? Decoding all of that tech jargon. It’s about time someone explained cryptocurrency to you in a language you can actually understand. That’s why I’ve just launched one of the world’s first online crypto and blockchain summits, where 21 industry-leading experts will be sharing everything you need to know about cryptocurrency over the course of three days.This week on the Unconventional Life Podcast, I spoke with a cryptocurrency geek who’s done all of the heavy lifting for you. Meet Michael Graziano, the founder of Global Degree, one of the largest online communities for millennial travelers worldwide. He’s racing to become the youngest North American male to visit all 193 countries in the world, documenting all of his adventures online. Across his social channels, and including collaborations with Discovery Channel and MTV, Graziano has a combined reach of 50 million+. “I’ve been to over 100 different countries and seen all different types of economies, people, and ways of life. Some of these countries’ databases are incredibly inefficient and outdated. Can you imagine what the world will look like when everyone’s on one database?” Graziano says. Enter the blockchain. If you don’t yet know what that is, don’t sweat it—below, I’ve transcribed my Q&A with Graziano where he breaks down the fundamentals of cryptocurrency, blockchain, and more, so you can finally get up to speed on everything crypto.Jules Schroeder: What is blockchain?Michael Graziano: A blockchain is a global online database that anyone, anywhere, with an internet connection, can use. The cool thing is traditional databases are owned by a central authority like banks, companies, or governments, but blockchain isn’t owned by anyone. It has a peer-to-peer network looking after it, so cheating the system is nearly impossible. Blockchain stores information permanently across a network of personal computers, which decentralizes, distributes, and records it onto a public ledger that anyone can see. The transactions are verified by miners, who maintain the ledger. These bundles of records on personal computers are called blocks. Each block has a timestamp, and a form to a previous block, forming a chronological chain.Schroeder: What is Bitcoin?Graziano: Bitcoin is blockchain’s first and most widely known application.. People send Bitcoin freely to each other, and blockchain comes in to verify that only one person claims to own each coin at one time.Schroeder: How are businesses and governments reacting to cryptocurrency?Graziano: Big players like eBay, Microsoft, Expedia, McDonald’s and Subway are all starting to accept Bitcoin and other digital currencies. The Swiss government is accepting Bitcoin for tax payments. Dubai has announced that they want to become the world’s first ‘blockchain city.’ These are major statements from major economies… all of this is happening so fast and I expect these changes to really amplify in 2018.Schroeder: What will change in the future with everyone using these blockchain technologies?Graziano: When it all boils down, blockchain allows us all to share a single source of truth. Take the sharing economy, for example, which has given rise to Uber, Lyft, Airbnb, etc. These companies have profited on the idea of a sharing economy, but instead of sharing, they’ve acquired or eliminated competitors and collected all the profits. Where blockchain could step in is to create a public marketplace where people can share cars, homes, or whatever, with no intermediary. Another application is the recapturing of our identities. The most powerful asset of the digital age is data. Perhaps more valuable than money, land, or anything else you own. Everywhere you go and everything you do online is recorded. It creates a virtual you. But the biggest problem is that you don’t own the virtual you. It’s owned and exchanged by big companies like Google. Blockchain is one new technology that will allow you to have privacy and to monetize and control where your information goes.Schroeder: So what are some of the top cryptocurrencies to look out for in 2018?Graziano: I encourage people interested to do your research, but here are five projects that I think have a lot of potential: Skycoin, which has the ability to give each company or application their own blockchain, helping to combat high traffic and loading times with no transaction fees. Xaurum, the only cryptocurrency backed by gold, which provides intrinsic value and makes growth much more secure with less volatility. Stratis, a blockchain development platform that allows people to create custom uses for blockchains that haven’t even been thought of yet. Shift, another alternative blockchain that includes peer-to-peer storage, an uncensorable internet, and seamless monetization removing the need for third parties like Facebook or Youtube for content creators. Then there’s DOVU, which is embracing the emerging smart car industry where cars are predicted to generate up to 25GB of data per hour. With DOVU you can manage and sell your car’s data at your discretion in exchange for tokens.Disclaimer: the opinions expressed in this article are not intended to replace the advice of an investment advisor. Invest at your own risk.Enjoyed this post? Check out more of my tools for creating a life by your own design."
