,press company,date,title,url,abstract,date detail,head article,main article
76,https://www.forbes.com/,"Jan 8, 2018",Venezuela's 'Cryptocurrency' Isn't Really A Cryptocurrency At All,https://www.forbes.com/sites/francescoppola/2018/01/08/venezuelas-cryptocurrency-isnt-really-a-cryptocurrency-at-all/,"Venezuelans who mine Bitcoin can sell their bitcoins for dollars, bypassing 
the government, while Venezuelans who want to get their money out ...","Jan 8, 2018,10:42am EST","To many, “government cryptocurrency” is an oxymoron. The whole point of cryptocurrencies like Bitcoin is that they aren’t “issued” by any government, central bank or other “authority.” No-one controls them. They are decentralized, anonymous and subversive.","But that doesn’t bother President Maduro of Venezuela. He is planning to issue a Venezuelan government cryptocurrency, backed by the country’s reserves of oil, gas, gold and diamonds. One unit of the new cryptocurrency – the “petro” – will be backed by one barrel from Venezuela’s Orinoco oilfield, currently valued at $59. Maduro is planning to issue 100 million petros. If the entire issue sells at par, that’s $5.9 billion. That would shore up the cash-strapped country’s FX reserves for a while.People shout slogans during a protest against the shortage of food, on Fuerzas Armadas avenue in... [+] Caracas on December 28, 2017. President Nicolas Maduro attributes the shortage to international sabotage. FEDERICO PARRA/AFP/Getty ImagesHowever, the fact that Maduro sees the need to back his cryptocurrency with hard assets should immediately give potential investors pause for thought. Real cryptocurrencies rely on network effects for their value. People use them because they trust them. Yes, they are supposed to be trust-free, but as I have pointed out before, cryptocurrency users do trust the technology, even if they don’t trust each other. Backing a cryptocurrency with hard assets is hardly a ringing endorsement of either the issuer or the technology.There’s a second problem, too. Both the country and its state-owned oil company PDVSA defaulted on their U.S. dollar debt in November 2017: the International Swaps and Derivatives Association (ISDA) declared the default a “credit event,” triggering payment of credit default swaps. Clearly, Venezuela is not producing enough oil to meet its existing U.S. dollar obligations. Why would anyone buy claims to an additional $5.9 billion worth of Venezuelan oil?Of course, as the new cryptocurrency confers not a claim on Venezuela’s oil production, but a claim on oil still in the ground, in theory the new cryptocurrency owners could call in their claims and drill for oil themselves. But Venezuela’s record on allowing outsiders to drill for oil on its territory is abysmal. What value does oil still in the ground really have, if the only way of extracting it is through a joint venture with the appallingly mismanaged and possibly bankrupt PDVSA?And how much of this oil is really available to back a new currency, anyway? Much of Venezuela’s oil is already pledged, particularly to China, in return for previous loans. Venezuela has form for pledging assets that are already encumbered by existing claims. How do we know this isn’t more of the same?Despite all these reservations, it seems that Venezuelans, at any rate, are interested in the new cryptocurrency. Online cryptocurrency magazines report that over 860,000 Venezuelans have registered with Venezuela’s new Registry of Cryptocurrency Miners, which is the only portal through which the petro can be mined. Yes, you read that right - in Venezuela, government licenses its cryptocurrency miners, just as it licenses its banks. Furthermore, the operation of the new currency will be supervised by the Superintendency of Cryptocurrencies and Related Assets.  Government controls mining, government supervises operations, government sets the price … the petro is looking less and less like a real cryptocurrency, isn’t it?In fact, why are we calling this a cryptocurrency at all? Really, it’s a digital oil-backed security. Recording transactions on a blockchain and adding some cryptography doesn’t make it a cryptocurrency. It isn’t decentralized, it isn’t anonymous, and it isn’t going to be used to buy and sell goods and services in Venezuela, although there are suggestions that it could be used to pay international suppliers. And above all, its value depends on the trustworthiness of a government already in default on its international obligations. Trustless, it isn’t.So why is Maduro calling this a cryptocurrency? On the face of it, this is about the country’s dire financial situation. Although Russia and China seem to have agreed to a restructuring of Venezuela’s debt, issuing more bonds is probably a non-starter. So Maduro has hit on a clever wheeze to ease Venezuela’s crippling FX shortage and stave off further defaults. Wealthy Venezuelans (yes, they do exist) have been using Bitcoin to protect their wealth from hyperinflation.  Venezuelans who mine Bitcoin can sell their bitcoins for dollars, bypassing the government, while Venezuelans who want to get their money out of Venezuela can buy bitcoins. Forcing Bitcoin miners to register with the government doesn't necessarily help the government to get its hands on their dollars. Why not encourage them to use a government cryptocurrency instead?But although reducing capital flight might help the government stave off dollar bankruptcy, it won’t end the hyperinflation that is now causing starvation among Venezuela’s population. Only those who can mine the currency, or have US dollars to sell on the “virtual exchanges” where the issue will be placed, can obtain it. And because this is a government issue, the dollars will go to the government, not to the people. So not only will there be no digital currency for ordinary Venezuelans, there won’t be more dollars either. It’s hard not to see this as an opportunity missed: introducing a new domestic currency backed by hard assets, or dollarizing, can be a good way of ending hyperinflation. But it seems Maduro is more interested in getting his hands on sufficient U.S. dollars to pay his Chinese and Russian paymasters than easing the humanitarian crisis in his country.However, Maduro has stated that the new cryptocurrency is not just a way of easing Venezuela’s financial crisis. It is also about bypassing U.S. sanctions. And it is telling that Maduro is doing this now, when Russia is reportedly considering something very similar, also as a means of evading U.S. sanctions. Maduro has made no secret of the fact that he would like to break the U.S. dollar’s dominance in the oil market. Putin would no doubt like to do so too, and Russia and Venezuela have strong ties. Could this be a coordinated attack on the dollar by two of the world’s largest oil and gas producers?Full disclosure: I don't own any cryptocurrencies and have no plans to do so, Venezuelan or otherwise."
77,https://www.forbes.com/,"Jan 10, 2018",Why Investors Are Flocking To Ether,https://www.forbes.com/sites/cbovaird/2018/01/10/why-investors-are-flocking-to-ether/,"This is ""Ether's moment in the sun,"" said Koyen, adding that it is very 
interesting to ""see Bitcoin stay flat while the air comes out of Ripple."".","Jan 10, 2018,02:36pm EST","Investors have been buying ether, pushing it to a fresh, new high. Shutterstock","Investors have been piling in to Ether lately, a trend that caused this digital currency's price to reach an all-time high of more than $1,400 earlier today.Ether rose to as much as $1,417.38, representing a more than 17,000% gain since the start of 2017, according to CoinMarketCap. At the time of report, the digital asset had pulled back somewhat, trading at $1,304.03, additional CoinMarketCap figures reveal.[Ed note: Investing in cryptocoins or tokens is highly speculative and the market is largely unregulated. Anyone considering it should be prepared to lose their entire investment.]Cryptocurrency RotationThe digital currency has been benefiting lately as investors rotate out of other cryptocurrencies and put their money into Ether, said analysts. ""It's the Ether show,"" said Arthur Hayes, co-founder and CEO of BitMEX, a Seychelles based P2P crypto-coin trading platform. ""Traders are profit taking on [Ripple], and now rotating to another altcoin."" Marius Rupysus, a digital currency trader, offered a similar assessment:""Ethereum is now getting the attention and speculators are exiting other cryptocurrencies to buy the best looking asset now."" ""Traders have been rotating out of BTC for a while,"" said Tim Enneking, managing director of Crypto Asset Management. Now, they are ""definitely rotating out of Ripple into ETH."" ""Cross-Crypto Speculation""Jeff Koyen, CEO of 360 Blockchain USA, described the flow of money from other digital currencies to Ether as ""cross-crypto speculation."" ""Investors aren’t taking money out of the market into fiat,"" he emphasized, a development that ""bodes very well for crypto on the whole."" This is ""Ether’s moment in the sun,"" said Koyen, adding that it is very interesting to ""see Bitcoin stay flat while the air comes out of Ripple."" Ether OptimismSeveral analysts voiced positive sentiment regarding Ether, lauding it for having a very bright future.""The Ethereum blockchain. Is currently the most widely used and the most stable network,"" said Mati Greenspan, senior market analyst for social trading platform eToro.""So investors shifting funds to Ether is similar to what we would call a 'flight to safety' in traditional markets,"" he added. Enneking also spoke to the digital currency's value proposition, stating that:""The use case of ETH is simply far more compelling that the use case for BTC.""Going forward, Ether's price could continue to experience notable upside, emphasized Koyen.""ETH at $2,500 is an astounding number for those who bought at single digits,"" he stated. ""But it's a very reasonable number for newcomers sick with envy over BTC's price exactly one year ago.""Disclosure: I own some Bitcoin, Bitcoin Cash and Ether."
78,https://www.forbes.com/,"Jan 11, 2018","For Ripple, MoneyGram Deal Trumps Talks Of South Korea's Crypto Ban",https://www.forbes.com/sites/kenrapoza/2018/01/11/for-ripple-coin-moneygram-deal-trumps-talks-of-south-koreas-crypto-ban/,"Ripple has been rising from a small, relatively unknown cryptocurrency to a 
top-three behind heavyweights bitcoin and ether. Major venture ...","Jan 11, 2018,11:35am EST",Ripple coin lives another day. (Shutterstock),"Once again, another Asian nation is no match for the blockchain.South Korea's talk of banning cryptocurrency trading sent all of the top traded coins down yesterday and again on Thursday. But one major stands out today, and that's Ripple (XRP). The token tied to the digital payments startup is back trading over $2 thanks to an announced deal with Dallas-based MoneyGram. MoneyGram shares rose over 6% on the news.MoneyGram will allow their customers to send and complete cross-border payments with the XRP token instead of fiat currencies like the dollar. MoneyGram will use the company's xRapid, Ripple’s on-demand liquidity product, Ripple said today.  The system permits real-time foreign exchange settlement through ripple coin, ""which gives financial institutions the ability to unlock liquidity and access multiple corridors with one pre-funded originating account.""Ripple has been rising from a small, relatively unknown cryptocurrency to a top-three behind heavyweights bitcoin and ether. Major venture capital firms and banks have invested in the company, including Google Ventures and Standard Chartered bank.This week, word that the South Korean government would ban trading sent ripples through the crypto market. South Korea, Japan and China account for the lion's share of trading on cryptocurrency exchanges. Demand for cryptocurrency has grown so fast, top exchanges like Bitstamp and Okex are closed to new accounts.  The Korean government still seems noncommittal to the idea of the outright ban of exchanges, something China did late last year. Cryptocurrencies fever is rampant in South Korea. Demand tends to push prices of many tokens nearly 30%  higher than they are on exchanges in other countries, leading to arbitrage purchases by risk-taking locals.The country’s Justice Minister Park Sang-ki said the decision to curb trading is multi-departmental, including members of the Finance Ministry and securities regulators. “There are great concerns regarding virtual currencies and the justice ministry is basically preparing a bill to ban cryptocurrency trading through exchanges,” Sang-Ki was quoted saying in Reuters.Asia headlines have been a mixed blessing for MoneyGram. The company made headlines this month following a failed China acquisition.Jack Ma, chairman of Alibaba Group Holding. His company, Ant Financial, was banned from acquiring... [+] Texas-based MoneyGram International this month. Now, in a very different type of deal, MoneyGram is partnering with Ripple, a company whose cryptocurrency may end up being banned from South Korea's cryptocurrency exchanges. (Photographer: Qilai Shen/Bloomberg)The company's attempt to sell to China's Ant Financial, a unit of Alibaba, the e-commerce giant founded by billionaire Jack Ma, was banned just last week by the U.S. government.  MoneyGram said it was unable to obtain the required approval for the transaction from the Committee on Foreign Investment in the United States, or CFIUS.""The geopolitical environment has changed considerably since we first announced the proposed transaction with Ant Financial nearly a year ago,” MoneyGram CEO Alex Holmes said in a statement. “Despite our best efforts to work cooperatively with the U.S. government, it has now become clear that CFIUS will not approve this merger. We are disappointed in the termination of this compelling transaction,” he said.MoneyGram is a popular service in emerging markets like China and Brazil, where expats often use it to repatriate cash to family members back home or to pay bills. They can now do so in XRP.This week, two Goldman Sachs economists issued a report titled ""Bitcoin as Money"" arguing that cryptocurrencies, led by bitcoin, were more apt to be used as a source of payment in weak currency nations where dollars are scarce.Ripple rose to fame after it announced a pilot program signed between two South Korean banks and a consortium of 61 Japanese banks. It's been on a tear ever since. South Korea pulled a rug out from under it this week, but the MoneyGram news kept it from falling further.That might not hold.Seoul is preparing a bill which will ban all cryptocurrencies from trading on local exchanges. It is unclear how this would impact Ripple's pilot project. The company was unavailable for immediate comment.""Banning cryptocurrencies altogether would be difficult given that the country is one of the biggest markets in the world, especially for bitcoin and ethereum,"" says Forbes contributor Naeem Aslam, chief market strategist for ThinkMarkets in London. ""Keep in mind that this is not the first time that the regulators have gone after the cryptocurrency market.  During this week alone, we have seen two headlines emerging from South Korea aimed at bitcoin. There is no doubt that the demand for bitcoin in South Korea is massive and some elements of the public's behavior — when it comes to trading the cryptocurrencies — aren’t far from gambling habits.""Traders should not read too much into the South Korean situation, Aslam wrote in a note to clients on Thursday. Once the bill is drafted, it would require a backing of 297 members of the National Assembly, a process which could take months or even years.""Ripple's growth over the past year has been stellar and it has acquired multiple institutional customers who are seriously considering using it for cross-border settlements,"" says Abhishek Pitti, founder of Nucleus.Vision, a visual data company using blockchain technology based in Palo Alto and Hyderabad, India. Mumbai-based Reliance Capital serves as both an advisor and early investor to the company. Draper Ventures founder Tim Draper is also a lead investor in Pitti's company. ""Ripple has shown that they can facilitate double-digit million dollars worth of transactions in seconds, at a fraction of the cost of a bitcoin transaction,"" he says.Pitti thinks XRP will escape South Korea's crypto ban.""I don't think South Korea is banning cryptocurrencies altogether,"" he says. ""They are clamping down on unregulated exchanges so that shouldn't effect ripple because their primary users are regulated financial institutions."""
79,https://www.forbes.com/,"Jan 31, 2018",The Blockchain That Could Disrupt Google's Ad Monopoly,https://www.forbes.com/sites/forbescommunicationscouncil/2018/01/31/the-blockchain-that-could-disrupt-googles-ad-monopoly/,"[Disclosure: The author invests in several cryptocurrencies including 
Bitcoin, Ethereum and IOTA and consults on ICO launches. Investing in 
any ...","Jan 31, 2018,08:00am EST",Shutterstock,"In the past year, cryptocurrencies like Bitcoin transformed from geeky passion projects on Reddit into a speculative boom that has leading experts scrambling to get up to speed. Just last week, finance luminaries Warren Buffett and Jamie Dimon contradicted each other, with Dimon saying he regretted calling Bitcoin a fraud and Buffet warning that cryptocurrencies would end badly.[Disclosure: The author invests in several cryptocurrencies including Bitcoin, Ethereum and IOTA and consults on ICO launches. Investing in any cryptocurrency is very risky --you can lose your entire investment.]For the most part, everyone I talk to (who is not an engineer) doesn’t really get what blockchain is and how it can actually be used (besides as a currency). To those of you who are unaware that there is any other purpose for blockchain, it is important to note that while the press has focused on the 1300% increase in Bitcoin’s value, most of the actual work being done is in creating applications for blockchain that have little to do with currency -- or at least currency is only a component of the applications’ larger purpose. Ethereum, for example, is the platform on which several new applications are being developed, from universally-accessible (but private) medical records to distributed cloud storage (think Airbnb for extra hard-drive space) to licensing royalty management apps. What these future applications have in common is that humans have been removed as the middlemen who are too costly or inefficient to allow these applications to currently exist. With blockchain technology, the machines transact among themselves, so a patient’s full health history is recorded automatically, you can earn money storing a stranger’s stuff on unused hard drives and you don’t need an agent to protect your photo copyrights.All of this sounds great, of course, but what does any of it have to do with marketing? You may have heard this, but the Internet of Things is coming. Quickly. Gartner predicts that by 2020, we’ll have over 20 billion smart devices, many with sensors, cameras and microphones connected to the internet. These are items like smart thermostats, smart TVs, baby monitors and security cameras that alert you when movement is detected, as well as any product you can control with an app.Right now they’re collecting data, but that data isn’t captured anywhere that can help you understand the person using these devices. But what if all of the behavioral usage data from each of those independent smart objects was captured into a user and household profile? And what if those profiles were connected to a machine-learning AI that could deliver nuanced profiles based on real-world data (rather than 12-person focus groups or surveys of people who may not actually use your product)? You’d know that the 42-year-old guy in 94904 uses the treadmill his wife bought him for Christmas only once a month. You’d also know his favorite beer (always stocked by his smart fridge), that he has a child under two (baby monitor), is a fan of ""Stranger Things,"" commutes 20 minutes to work each day and regularly reorders hemorrhoid pads on Amazon. Amazing for marketers. Creepy for citizens.With this insight, you'd create much more targeted campaigns, form promotional partnerships you'd never have considered and increase the overall ROI of every marketing dollar spent. To be clear, this is coming one way or another -- which means a lot of the art of marketing will be supplanted by the science of AI targeting. If you've used Facebook’s Custom Audiences you've seen a glimpse of how powerful this can be.So how will we get this data? It’s no accident that Amazon, Google and Apple are locked in an arms race to get their home hubs into as many homes as possible. If their hub is the one used to control all your connected devices, they become the data monopoly that all marketing revenue will flow to in five years. But not if a German nonprofit developing a cryptocurrency called IOTA can get there first. IOTA’s proponents describe it as “post-blockchain” technology and it is technologically different from blockchain but based on its same principles. It wants to be the future method of information exchange between smart products and is developing something called the data warehouse. Don’t go nuts and invest your 401k here just yet -- it’s still early and the technology is not proven -- but it’s promising enough to have attracted some big-name collaborators. In this concept, data from all of the smart devices in your life would flow through a sort of data bazaar where bits and pieces of it could be purchased by people who want it -- like marketers. In this scheme, the user controls access to personally identifiable data and gets paid if they choose to sell it. Your home hub would still collect data but would no longer have a monopoly. And because the system might create the ability for individual smart devices to interact with each other without going through a central hub or the cloud for instructions, not all usage data might be shared with the home hub.Aside from the hurdles of engineering this new technology, implementation would require broad adoption across manufacturers of smart devices and security will be a key development and PR challenge (these devices can take video from inside your home!). In the U.S., the market influence of big tech will likely slow implementation, but Europe just passed legislation giving consumers ownership of their personal data so it is more likely to take root there first.As marketers, either way we’ll waste less money trying to identify who we’re targeting and testing ads with the wrong customers. And we’ll be able to create promotional offers that have real value to customers because they'll be tailored in a way that’s currently not possible. Marketing and product development will continue to meld together as both share the same goal of anticipating and serving the needs of well-defined users. As a citizen, though, I’m hoping the consumer-as-data-owner blockchain model wins out."
