,press company,date,title,url,abstract,date detail,head article,main article
0,https://www.forbes.com/,"Jan 17, 2018",A Complete Beginner's Guide To Bitcoin In 2018,https://www.forbes.com/sites/bernardmarr/2018/01/17/a-complete-beginners-guide-to-bitcoin-in-2018/,"To help you wrap your head around what it is, what it does and how to earn 
Bitcoins, I pulled together this complete beginner's guide to Bitcoin.","Jan 17, 2018,12:38am EST","When you dig into the details of Bitcoin, it’s almost an unbelievable tale about how to create money. Although it seems like fiction, it’s actually the best-known version of digital currency in use today. To help you wrap your head around what it is, what it does and how to earn Bitcoins, I pulled together this complete beginner’s guide to Bitcoin.","Adobe StockBefore we go any further I just want to reiterate that investing in cryptocoins or tokens is highly speculative and the market is largely unregulated. Anyone considering it should be prepared to lose their entire investment.A bit of bitcoin historyBitcoin was the first established cryptocurrency—a digital asset that is secured with cryptography and can be exchanged like currency. Other versions of cryptocurrency had been launched but never fully developed when Bitcoin became available to the public in 2009. The anonymous Satoshi Nakamoto—possibly an individual or a group whose real identity is still unknown—is behind the development of Bitcoin who stated the goal of the technology was to create “a new electronic cash system” that was “completely decentralized with no server or central authority.” In 2010, someone decided to sell their Bitcoins for the first time to purchase two pizzas for 10,000 Bitcoins. I hope the pizza was good, because if that person would have held onto those Bitcoins, they would be worth more than $100 million today. In 2011, Nakamoto shared the source code and domains with the Bitcoin community and hasn’t been heard from again.What is Bitcoin, really?Bitcoin is a digital currency, so there are no coins to mint or bills to print. There is not a government, financial institution or any other authority that controls it, so it’s decentralized. The owners who have Bitcoins in the system are anonymous—there are no account numbers, names, social security numbers or any other identifying features that connect Bitcoins to its owners. Bitcoin uses blockchain technology and encryption keys to connect buyers and sellers. And, just like diamonds or gold, a Bitcoin gets “mined.”How do you “mine” Bitcoins?People—or more accurately extremely powerful, energy-intense computers—“mine” Bitcoins to make more of them. There are currently about 16 million Bitcoins in existence, and that leaves only 5 more million available to mine because Bitcoins developers capped the quantity to 21 million. Ultimately, each Bitcoin can be divided into smaller parts with the smallest fraction being one hundred millionth of a Bitcoin called a “Satoshi,” after the founder Nakamoto. The mining process involves computers solving an extremely challenging mathematical problem that progressively gets harder over time. Every time a problem is solved, one block of the Bitcoin is processed and the miner gets a new Bitcoin. A user establishes a Bitcoin address to receive the Bitcoins they mine; sort of like a virtual mailbox with a string of 27-34 numbers and letters. Unlike a mailbox, the user’s identity isn’t attached to it.How are Bitcoins used?In addition to mining Bitcoins, there are other ways to earn Bitcoins. First, you can accept Bitcoins as a means of payment for goods or services. Setting up your Bitcoin wallet is a simple as setting up a PayPal account and it’s the way you store, keep track of and spend your digital money. They are free and available through a provider such as Coinbase. While this might take more time than it’s worth, there are websites that will pay you in Bitcoins for completing certain tasks. Once you’ve earned Bitcoins, there are ways to lend them out and earn interest. There are even ways to earn Bitcoins through trading and recently Bitcoin futures were launched as a legitimate asset class. In addition, you can trade your regular currency for Bitcoins at Bitcoin exchanges, the largest one being Japan-based Mt. Gox that handles 70 percent of all Bitcoin transactions. There are more than 100,000 merchants who accept Bitcoin for payment for everything from gift cards to pizza and even Overstock.com accepts it.What are the risks?There’s risk as well as a great opportunity with Bitcoin. While it has been appealing to criminals due to its anonymity and lack of regulation, there are lots of benefits to all of us if you’re willing to accept some risk to jump into the Bitcoin marketplace. Since there is no governing body, it can be difficult to resolve issues if Bitcoins get stolen or lost. In 2014 Mt. Gox went offline, and 850,000 Bitcoins were never recovered. Once a transaction hits the blockchain it’s final. Since Bitcoin is relatively new, there are still a lot of unknowns and its value is very volatile and can change significantly daily.So, the jury’s still out if Bitcoin will accomplish what its proponents predict, the replacement of government-controlled, centralized money. I fully expect 2018 to give us even more insight about the future of Bitcoin as the technology continues to grow and mature."
1,https://www.forbes.com/,"Feb 5, 2018",What Is The Difference Between Bitcoin and Ethereum?,https://www.forbes.com/sites/bernardmarr/2018/02/05/what-is-the-difference-between-bitcoin-and-ethereum/,"Last year, thanks to stratospheric rises in value, lots of people became 
aware of the existence of Bitcoin, as well as another often-cited ...","Feb 5, 2018,12:28am EST","Last year, thanks to stratospheric rises in value, lots of people became aware of the existence of Bitcoin, as well as another often-cited up-and-coming cryptocurrency, Ethereum.","By market cap they are the two most valuable cryptocurrencies – as of writing (and please note that these numbers fluctuate quite a lot), the total value of all the Bitcoin in existence is $143 billion, while Ethereum sits at $88 billion.Adobe StockFor perspective – that means Bitcoin is currently held at around the same value as Unilever, whereas Ethereum has around the same market value as Starbucks or Walgreens Boots Alliance. I know that you can’t really compare a digital currency to a company but it gives some perspective.Also, before we go any further I just want to reiterate that investing in cryptocoins or tokens is highly speculative and the market is largely unregulated. Anyone considering it should be prepared to lose their entire investment.While to many Bitcoin and Ethereum are both simply examples of cryptocurrencies – digital money transfer systems which use blockchain technology and encryption – there are subtle differences in how they work and what they can be used for.If you are looking to invest for speculative reasons, or even more so if you are considering using either platform for business – it’s important to understand those differences, because they could be the deciding factor in which coin (if either) goes on to become a widely accepted standard, and which will disappear into obscurity and worthlessness.What is a cryptocurrency?So, starting with the basics – cryptocurrency is a term that has come to be used to identify a newly emerging asset class. In some ways it is a slight misnomer – currencies are stores of value which we can use to purchase goods or services, and most cryptocurrencies cannot yet be exchanged for anything, other than other cryptocurrencies.So, while not currencies in the strict sense – they are certainly assets, as they hold value and can be sold for dollars, pounds and euros. Much like gold – which not everyone will accept in trade, but everyone agrees has a value.Unlike gold, however, cryptocurrency exists only in the digital world. So, how can we trust it is real?Well, basically, cryptocurrency stores value via mathematics. A simplified way of looking at it is that each cryptocurrency (and there are over 1,000 of them) is a very complex algorithm. The output of each algorithm tells us who owns each unit of that particular cryptocurrency – and is known as a blockchain.Bitcoin was the first success at creating a blockchain-based currency (or asset) which beat the double-spend problem inherent with digital assets. Digital data can be replicated and distributed indefinitely – so how do you stop people simply “copy and pasting” themselves more money?It overcame this issue in two ways – encryption, and distribution. The use of public and private key encryption means that although all the transactions on the network are public (essential for verification purposes), only those with permission can edit the data on the parts of the blockchain where they are authorized to do so.Simultaneously, its distributed nature – the fact that the blockchain algorithm is running on not just one, but potentially millions of machines – means that consensus must be established before updates to the blockchain are accepted across the wider network.In other words, if I take the data representing my five bitcoins and copy and paste it to give myself 10 bitcoins, it won’t work – because the changes I have made to my local blockchain will be rejected by the network consensus which knows (as I don’t have the correct private keys) that I don’t have ownership of those five extra bitcoins.How are Bitcoin and Ethereum different?Bitcoin was the first true cryptocurrency and has been in circulation since 2009. Ethereum is a far more recent development, going live in 2015.In the time between Bitcoin and Ethereum’s release, lots of other cryptocurrencies emerged. Mostly, however, they were limited to trying to improve on aspects of Bitcoin’s performance – for example, increasing speed of transactions or improving the security or anonymity of transactions.Ethereum is certainly faster than Bitcoin – with transactions typically settling in seconds, rather than minutes. But it also takes things further. While still blockchain based, and operating as a store of value, its fans and evangelists see it as a platform for distributed computing, which comes with its own built-in currency, called Ether.While the Bitcoin blockchain can simply be pictured as a database of accounts (or wallets) with an amount of currency stored in each, the Ethereum network blockchain is a more sophisticated construction, capable of storing computer code – applications – that can use the CPU power going into the network to execute.The currency – Ether – represents this CPU power – so the idea is that Ether will be bought and sold by businesses, governments or individuals to allow them to tap into the vast, distributed resources of the Ethereum network to run their own apps.The first of these applications are known as “smart contracts”. This is a way of automating contracts and agreements so they will execute when consensus says that conditions have been filled. Though simple, their uses are potentially widespread – such as enabling payment systems which will release funds on completion of work, or authorizing the transfer of ownership of good when payment has been made.The Ethereum network also allows the creation of other cryptocurrencies, or tokens, using the same protocol as Ether but distributed on different blockchains, which can be public or private. This means they can be created by organizations to represent shares, voting rights or as means of proving identity or authorization credentials.Should I invest in Bitcoin or Ethereum?Well, as I am not a financial advisor I wouldn’t tell you where to put your money. What I can do is suggest some things that you should bear in mind, if you are looking to make speculative investments in cryptocurrency.Ultimately, the long-term growth of any cryptocurrency (or indeed business) depends on useful applications being found for its assets.If Bitcoin goes on to become a widely accepted form of currency, or the Ethereum network becomes an established standard for distributed computing, then the value of these assets is likely to continue to grow.On the other hand, in technology, there is always something snapping at the heels of the front-runners. Newer and more efficient algorithms could replace either Bitcoin or Ethereum.Additionally, both face the threat of government regulation. The value of many cryptocurrencies (including Bitcoin and Ethereum) have moved downwards since the start of the year, which has been attributed to threats of their trade being regulated by governments in China and Korea.What is clear is that the huge increases in value we have seen over the last five years has largely been due to speculative investment – people buying them in the hope that they will be able to sell them for more money to someone else in the future.This is often a recipe for inflated prices and an inevitable crash back down to earth – something that many believe could happen at any time and may have already started.Ultimately, achieving sustainable growth will be dependent on useful applications. More businesses accepting Bitcoin as a method of payment, and more applications becoming widely used and supported on the Ethereum network."
2,https://www.forbes.com/,"Jan 16, 2018","12 Reasons Bitcoin Could Fall Below $1,000",https://www.forbes.com/sites/chuckjones/2018/01/16/12-reasons-bitcoin-could-fall-below-1000/,"Bitcoin continues on its roller coaster ride falling from a high of 
$19,870.62 on December 17 to around $12,000 this morning. 
Cryptocurrencies ...","Jan 16, 2018,11:48am EST","Bitcoin continues on its roller coaster ride falling from a high of $19,870.62 on December 17 to around $12,000 this morning. Cryptocurrencies and especially Bitcoin more than caught the attention of investors in 2017 when they became infatuated with it. Bitcoin started 2017 at $963.38 and ended at $13,850.40 for a gain of 1,338%. It nearly reached $20,000, coming close at $19,870.62 on December 17. This has led to Bitcoin and other cryptocurrencies getting huge media exposure and the creation of thousands of new ones. (Note for this article I’ve abbreviated cryptocurrencies as CCs.)","[Ed note: Investing in cryptocoins or tokens is highly speculative and the market is largely unregulated. Anyone considering it should be prepared to lose their entire investment.]A visual representation of the digital cryptocurrency, Bitcoin. Photo by Dan Kitwood/Getty ImagesThere are many reasons that Bitcoin and CCs could increase or fall in value but the underlying reasons should be supply and demand. I wrote an article with 9 reasons that Bitcoin’s price could rise to $100,000 or more. However since Bitcoin and the other CCs are in a nascent stage, I believe there are at least 12 reasons that Bitcoin could fall back to $1,000. It was not even a year ago, March 26, 2017, to be exact that it traded for under $1,000. To get a handle on what could drive the price of Bitcoin significantly lower I’ve outlined the reasons below.#1) Regulation could have the biggest impactRegulators could have the biggest impact on Bitcoin and CC prices as multiple countries have either implemented some regulations or have discussed plans to limit them. If the regulations become too burdensome they could negatively impact the usage and therefore price of CCs.South KoreaSouth Korea has implemented some regulations and is considering additional ones. A few days ago it announced that CC traders would be fined if they do not convert from virtual accounts where they could trade anonymously to real-name accounts.One indication on how much regulations could impact a CCs price is when South Korea’s Ministry of Justice issued a premature statement on banning CC trading. After the statement was corrected the price of EOS, a popular CC in South Korea, jumped 40%.JapanJapan started to regulate Bitcoin and other CCs after Mt. Gox, a Bitcoin trading platform, collapsed and went out of business in 2014. It also passed legislation last year that legalized Bitcoin and other CCs as legal currency and an asset. These were positive steps in helping them become more mainstream but as with any legislation additional rules could be put in place to hurt them.ChinaThere is a Reuters article this morning saying “authorities should ban centralized trading of virtual currencies as well as individuals and businesses that provide related services.” This would be in addition to the country’s ban on ICOs or Initial Coin Offerings, CC trading exchanges and limits on Bitcoin mining.U.S. regulationThe SEC Chairman released a statement last month on “Cryptocurrencies and Initial Coin Offerings.” It laid out where the market is currently (wide open so investors should be very careful), what questions an investor could ask and that the SEC is very interested in this new technology.The U.S. Senate is planning on meeting with the SEC Chairman and the Commodity Futures Trading Commission or CFTC Chairman next month. While I wouldn’t expect much to come from the discussion, at least initially it could bring CCs more into the regulatory framework.The challenge with many of the current and potential regulations is that even though one or multiple countries could ban trading or exchanges it doesn’t necessarily keep investors from executing trades in another country.#2) There is no “value” to itBitcoin or CCs don’t generate revenues or profits in the traditional sense. Miners do create revenue for themselves and traders charge a commission but a Bitcoin doesn’t do anything. There isn’t a physical presence to it (pictures such as the one at the beginning of this article are just representations) as it and other CCs are bits in computers.Since it doesn’t generate profits or cash it can’t be valued in ways that most other assets are. While a commodity such as gold can be used to create something of value, a Bitcoin resides in a computer. If enough uses aren’t eventually developed for them their demand could decrease.#3) Volatility can create nervousness Goldman Sachs has a chart that shows the daily volatility of Bitcoin vs. other investments such as WTI (West Texas Intermediate or oil), Gold, the S&P 500 and a few others. Bitcoin has been much more volatile than any of the other assets. This is good for traders (as long as they know what they are doing) but is mentally tough for longer-term investors. If this continues I believe it dampens demand from a wide range of investors.Bitcoin volatility#4) Leverage can be very badThe CBOE, or Chicago Board Options Exchange, and the CME Group started to make a market in Bitcoin options last December. These can be leveraged investments where only 44% of the total value needs to be covered. While the 44% is higher — too much higher — than other future contracts, given the volatility and risks involved it makes sense. However if Bitcoin’s price moves too much it could force contract holders to liquidate, putting more pressure on Bitcoin’s price.#5) A shakeout is comingThere were 1,450 CCs listed on coinmarketcap.com as of Tuesday morning with over half of them having a market cap under $10 million (note that Bitcoin’s was over $200 billion even with the price down to $12,300).There may be some legitimate uses for the “smaller” CCs but I suspect that hundreds of them will disappear. This would in theory decrease the supply of CCs which could mean investors may move their money to other CCs. Or the investments could be wiped out and the stain of so many going under would decrease demand.#6) ICOs (Initial Coin Offerings)The rapid increase in Bitcoin’s price has led to hundreds of ICOs, or Initial Coin Offerings, launching in the past few months. Dentacoin was launched in August last year for the dental industry. The value of all its coins spiked to $2 billion last week and has fallen to $600 million.While Dentacoin may be legimate and survive, there are also instances of what appear to be outright fraud. The SEC has warned about ICO fraud, and this CNN article describes three potential ones. While there aren’t any assets behind Bitcoin or other well-known cryptocurrencies, a huge percentage of the new ICOs really could be all fluff. If too many ICOs are fraudulent this will hurt investor demand for CCs in general.#7) Hacking theft of CCsProbably the most well-known and largest theft of Bitcoins was Mt. Gox, a Bitcoin exchange in Japan. It was handling over 70% of all Bitcoin transactions but was hacked in February 2014 and 850,000 Bitcoins were stolen. At the time they were valued at $450 million and would currently be worth about $10 billion.Just last month Youbit, a South Korean Bitcoin exchange, was hacked. Almost 4,000 Bitcoins or 17% of its assets, worth about $48 million, were stolen. A Reuters article said that all customers CC assets would be marked down by 25%. That isn’t very comforting to CC investors.#8) FOMO or Fear of missing outThe fear of missing out, or FOMO, has helped to create a lemming effect. Investors don’t want to miss out on the next big thing and to a degree also want bragging rights that they own Bitcoin.It was reported by CNBC that Coinbase, a CC exchange, had 11.7 million accounts in October last year compared to Schwab’s 10.6 million. It increased in November, adding 300,000 in one week to get to 13.3 million. If this isn’t a rush to participate, nothing is.However, this could turn on itself. If enough Bitcoin owners decide they want or need to get out the value of a Bitcoin could drop dramatically.#9) Bitcoin mining scamsFrom an article I read on 99bitcoins.com about Bitcoin mining, there was a section about scams. It said, “There is a new concept called “cloud mining.” This means that you do not buy a physical mining rig but rather rent computing power from a different company and get paid according to how much power you own. At first this sounds like a really good idea, since you don’t have all of the hassle of buying expensive equipment, storing it, cooling it, etc.”It went on to add, “However, when you do the math it seems that none of these cloud mining sites are profitable in the long run. Those that do seem profitable are usually scams that don’t even own any mining equipment, they are just elaborate Ponzi schemes.”It wouldn’t surprise me that this is true given all the hype around Bitcoins. If this burns too many people it helps to break down the trust in Bitcoin and CCs.#10) Becomes too associated with criminals and rogue statesOne of the reasons that governments are concerned about Bitcoin and cryptocurrencies is that they could and are being used by criminals and money launderers. It has also been speculated that countries such as North Korea and Russia will or have been using Bitcoin and CCs to circumvent sanctions.Since Bitcoin users can remain anonymous and can work from anywhere in the world, this could lead to an increase in demand for them at the margin. However, if governments are able to find a way to regulate them due to the above concerns then the demand would be lessened.#11) Third parties changing their mindsThere have been Bitcoin debit cards available from various providers. However, on January 5 it appears that Visa Europe told many of them to close their debit cards immediately due to being out of compliance with its regulations. While this was probably a very small market it is not a positive step in CCs becoming more broadly accepted.#12) Bitcoin & Blockchain movie looks a lot like dot-com in 1999Kodak and Long Island Ice Tea (now Long Blockchain Corp) are two companies that have recently changed their names or announced that they were creating cryptocurrencies or a digital currency platform. Both of them saw their stocks jump after they revealed they were getting into digital currencies.While Kodak’s initiatives potentially have some merit, Long Island Ice Tea’s is pretty much beyond the realm of any imagination. If too many other companies jump on the CC bandwagon, it feels very similar to the dot-com era in 1999. That movie didn’t end well.It all comes down to trustIn many ways the global financial system is based on trust between individuals, companies and governments. One thought to kick around is that we trust all the computer bits that show how many shares of a company we own, how much cash we have at the bank and the credit card charges and payments for the stuff we buy. To a large degree these are computer bits stored as various locations. Bitcoin and other CCs are similar in this respect. However, if the trust in CCs falls apart it will lead to a fall in their prices.Please feel free to check out my other Forbes articles, “9 Reasons Bitcoin Could Hit $100,000 Or More” and “3 Reasons To Not Get Excited About Seagate’s Investment In Ripple/XRP,” regarding digital currencies."
