,press company,date,title,url,abstract,date detail,head article,main article
6,https://cryptonews.com/,"Nov 27, 2018",Bitcoin Wallet Vulnerability Discovered,https://cryptonews.com/news/bitcoin-wallet-vulnerability-discovered-2987.htm,"A module called event-stream, used in millions of web applications but 
notably in BitPay's open-source Bitcoin wallet Copay has reportedly ...","
November 27, 2018
","A module called event-stream, used in millions of web applications but notably in BitPay’s open-source Bitcoin wallet Copay has reportedly been compromised, potentially leaving some other wallets vulnerable as well. ","BitPay published an advisory saying Copay versions 5.0.2 through 5.1.0 were affected by the malicious code and that users with these versions installed should avoid running or opening the app until they install Copay version 5.2.0.“Our team is continuing to investigate this issue and the extent of the vulnerability,” the official announcement reads. “Currently, we have only confirmed that the malicious code was deployed on versions 5.0.2 through 5.1.0 of our Copay and BitPay apps. However, the BitPay app was not vulnerable to the malicious code. We are still investigating whether this code vulnerability was ever exploited against Copay users.”Copay, the affected wallet, has more than 100,000 downloads of Android, while the number of users from other platforms like iOS or Windows is unknown.Any other wallets using this module might be affected as well, although as of the time of writing, none of them have come forward. The problem stems from a GitHub user volunteering to take over the library in question, inject malware and patch it up to avoid detection.The user, known only as “right9ctrl,” took over maintenance of the module from its original creator, developer Dominic Tarr, who said that he had not maintained the repository in years. In short, the developer updated the module with malware and then hid it from view, but the numerous people who had already installed it remain affected. Well known developer Jameson Lopp explained: The npm ""event-stream"" repository has been compromised; if you are using it in a project along with ""copay-dash"" then the malware will steal any private keys it can find. https://t.co/fAnH6ik1n9___
Jackson Palmer, an Australian entrepreneur and technologist best known for creating the infamously successful ""joke"" cryptocurrency Dogecoin, added:This is one of the major issues with JavaScript-based cryptocurrency wallets with heavy up-stream dependencies coming from NPM. @BitPay essentially trusted all the up-stream developers to never inject malicious code into their wallet.@dominictarr also let the attacker in, sadlyEvent-stream is downloaded roughly two million times a week by application programmers for many different uses. The version with the malware in it, Event-Stream v 3.3.6, was published on September 9 via Node Package Manager (NPM) repository, and had since been downloaded by nearly 8 million application programmers. The malicious code supposedly attempted to steal digital coins stored in the Dash Copay Bitcoin wallets - distributed through the NPM - and transfer them to a server located in Kuala Lumpur. Officials from NPM removed the backdoor from NPM's listing on Monday this week."
7,https://cryptonews.com/,"Nov 27, 2018",Bitcoin and Altcoins Trimmed Gains,https://cryptonews.com/news/bitcoin-and-altcoins-trimmed-gains-2984.htm,"Bitcoin price failed to break the USD 4,200 resistance and declined below 
USD 3,800. Ethereum and ripple trimmed gains and moved back in a ...","
November 27, 2018
","Bitcoin price started a short term correction recently after a drop below USD 3,800. BTC/USD corrected above USD 4,000 and USD 4,100, but it struggled to clear the USD 4,200 barrier. Later, the price declined again and settled below USD 4,000, which is a bearish sign. Similarly, ethereum price failed to break an important resistance near USD 120 and started a fresh downward move. Ripple price also struggled to gain traction above USD 0.400, resulting in bearish moves. Going forward, if bitcoin and altcoins struggle to break key pivot levels, there could be yet another bearish wave below recent lows in the near term.","Total market capitalization Recently, there was a recovery above the USD 4,000 resistance in bitcoin price , but buyers struggled to retain strength. BTC/USD topped near the USD 4,200 level and started a fresh downward move. It broke the USD 4,000 and USD 3,800 levels to move back in a bearish zone.
The price is down around 6% (UTC 08:30 AM) and it seems like it could decline further below the USD 3,750 and USD 3,620 support levels. In the worst case scenario, the price may even break the recent low and trade below the USD 3,500 level.Ethereum price  recovered more than USD 15, but it struggled near a crucial resistance at USD 120. ETH/USD faced a solid selling interest near USD 120, which resulted in a bearish reaction.
The price declined below USD 115 and USD 110 and it is currently down around 6%. An immediate support is at USD 105, below which there is a risk of a downside break below the key USD 100 support. The main resistances on the upside are at USD 115 and USD 120.Bitcoin cash  ABC rallied above the USD 200 and USD 220 resistance levels. However, BCHABC failed to stay above USD 200 and later declined heavily. The price is currently trading near USD 180 and it seems like it could test the USD 170 support. On the other hand, BCHSV rallied above the USD 100 level and traded as high as USD 140. It is currently consolidating above USD 100 with positive moves.
Ripple price  recovered above the USD 0.385 resistance, but it struggled to clear the USD 0.400 resistance. XRP/USD is down 5% to USD 0.358 and it could revisit the USD 0.340 support.Many small cap altcoins declined recently more than 10%, including SRN, FCT, MITH, STEEM, ONT, MAID, REP, WAN, GNT and ODE. Out of these, SRN declined around 26% and FCT is down nearly 25%.Overall, bitcoin price is back below the key USD 4,000 support, which is a bearish sign. If BTC/USD fails to jump above USD 4,000 and USD 4,200, there is a risk of more losses below the USD 3,500 level in the near term. Similarly, there could be an increase in selling pressure on altcoins like ethereum, ripple, BCH, neo and litecoin if they fail to start a fresh rebound in the next few hours.
_____"
8,https://cryptonews.com/,"Dec 7, 2018",XYO Coin Jumped by More Than 120% in a Week. Why?,https://cryptonews.com/news/xyo-coin-gaining-while-others-are-dropping-why-3039.htm,"... trading against Bitcoin, Ethereum and Tether. The hype surrounding XYO 
Network started much earlier. In November, the first official full XYO ...","
December 07, 2018
","What does it take to rise in spite of a heavy-handed bear market that brings much bigger players down? Listing on an exchange is a good first step, at least by the example of XYO Network (XYO). The coin has jumped by more than 120% in the past week and was up by around 14% on Friday before trimming it's gains to 7% (UTC 10:20 AM).","The coin, with market capitalization of USD 27 million, even broke through the top 100 by market cap for a short while, before settling back down. XYO price chart: ___XYO Network, dubbed “the people-powered location network” by its team, is looking to solve the problem of trust in location data sharing by using blockchain technology. The XYO Network aims to make it possible for smart contracts to access the real world by using its ecosystem of devices to determine if an object is at a specific coordinate and deploy specific smart contracts accordingly.In the past week, XYO Network has completed their gamma stage of the token sale and launched their mainnet, and claim to have received “proposals from 10 leading exchanges thus far.” They go on to explain, “By ‘leading,’ I mean they’re in the Top 100 Exchanges according to the exchange market cap listing websites.” The first one they accepted and went live on is LATOKEN, an exchange that has around USD 37 million in daily trading volume, trading against Bitcoin, Ethereum and Tether.The hype surrounding XYO Network started much earlier. In November, the first official full XYO Network transaction went through live on stage when they landed a drone next to their CEO using their own location data technology. However, more notable than the news they’ve been announcing is the hype that’s been following them. Neither their Telegram channel nor dedicated subreddit have a large following - around 13,000 and 1,400 followers, respectively - but the community is certainly excited about the project. That’s the same vibe that their Twitter account and blog posts give: it seems like XYO does not see the bear market that’s brought everyone else down, and not a single post reads in a somber tone. All of them are excited, and interactive with their community."
9,https://cryptonews.com/,"Dec 5, 2018",Vertcoin Becomes Another Victim of a 51% Attack,https://cryptonews.com/news/vertcoin-becomes-another-victim-of-a-51-attack-3027.htm,"51% attacks occurred in Bitcoin Gold, Verge, and Monacoin earlier this 
year. ""This is merely another incident that shows that threat actors 
exist ...","
December 05, 2018
",The cryptoverse just saw another example of a so-called 51% double spending attack and it might be not the last one. ,"This time, Vertcoin, a peer-to-peer cryptocurrency currently ranked 187th by market capitalization, has suffered four distinct 51% attacks that resulted in the malicious actor double-spending an estimated USD 100,000. According to a blog post by the company, the developers are close to implementing a fork to mitigate the damage.The incidents first started in October, with the first lasting from the 12th until the 18th of October. The last one started 29th November and was supposedly ongoing at the time of the report on December 2nd.Price chart of Vertcoin:“I am not aware of the victim or culprit, but several members of the Vertcoin community and developers are keeping a close eye on the network and I would advise everyone to do the same thing,” wrote one of the Vertcoin developers in a Medium post addressing the issue, adding, “Different members of the team and community have approached exchanges with the request to increase deposit confirmations and the developers have been working on two bespoke algorithms.”One of the two algorithm changes - and what the team considers the more important one - is implementing stricter resistance to application-specific integrated circuit (ASIC) chips, which can mine more efficiently than GPUs (graphics processing units) and CPUs (central processing units). The Vertcoin team argues that the usage of ASICs centralized the hashpower, or flooding the renting market with cheap hashrate, meaning that anyone who can afford to rent hashpower (or computing power) can perhaps stage a 51% attack on the network. The team’s official response concludes, “Finally, I want to say that Vertcoin is here to stay. We will NOT compromise on decentralization by implementing centralized controls and we will not give up on fighting ASICS. We ambitiously aim to become the dominant mining algorithm for GPUs in the future.”According to Crypto51.app, a website that calculates how much a 51% attack might cost, one hour of such attack on Vertcoin costs USD 181.51% attacks occurred in Bitcoin Gold, Verge, and Monacoin earlier this year. ""This is merely another incident that shows that threat actors exist that are both resourced and sophisticated enough to execute this kind of attack,"" Mark Nesbitt, security engineer at Coinbase, wrote in Medium post.According to him, exchanges make an ideal target for this sort of attack.""This is because exchanges allow deposits to be quickly traded into different assets and then withdrawn. An attacker can make a soon-to-be-reversed deposit, trade for another asset, move the new asset off platform, and then reverse the original deposit,"" Nesbitt explained.He concludes that as long as exchanges are willing to provide customers with assets in response to the deposit of a reversible currency, there’s no reason for attackers to stop this behavior. ""Expect to see more of these attacks"", the security engineer said.____A malicious miner with enough computing power can mine enough coins in private, without telling anyone else, that their chain becomes the legitimate one. This is called selfish mining. When other miners find this longer, “selfish” chain, they will discard the “honest” one that they’ve been working on, thus also discarding any transactions in those blocks, and start working on the new one. This is called a chain reorganization, or “reorg.” All reorgs have a “depth,” which is the number of blocks that were replaced, and a “length,” which is the number of new blocks that did the replacing.The discarded chain now contains transactions that are no longer valid, even though the funds potentially already went through - and including the same transaction in the new, longer chain means that the same funds are being spend again. This is called a double spending attack.In the case of Vertcoin, one of the reorgs went quite deep - with a depth of 307 blocks and a length of 310 blocks. The total number of reorgs, spanning these four incidents, was 22, and 15 of those included double spending. The total value of the double spends was over USD 100,000.
______"
10,https://cryptonews.com/,"Nov 29, 2018","Japan: Exchanges, FSA and Bank Step up Crypto ...",https://cryptonews.com/news/japan-exchanges-fsa-and-bank-step-up-crypto-developments-2995.htm,"DMM Bitcoin says it will introduce the new cap after it has completed 
scheduled maintenance work on its website. Elsewhere, there has been ...","
November 29, 2018
","Tumbling prices appear to have done little to deter Japanese businesses, banks and regulators in their efforts to breathe new life into the country’s cryptocurrency industry.","Exchanges have been leading the way, with DMM Bitcoin, a platform operating under a Financial Services Agency (FSA) license, announcing yesterday that it will cut margin trading leverages from 5:1 to 4:1 as of December 26. Margin trading refers to funds customers can access in order to increase their buying capacity.DMM Bitcoin’s move appears to demonstrate that exchanges are falling in line with the requirements of the self-regulating Japan Virtual Currency Exchange Association (JVCEA), an association comprising all of Japan’s FSA-registered platforms.As previously reported, the JVCEA has been pushing for its members to accept a margin trading leverages cap of 4:1 as of next year. DMM Bitcoin says it will introduce the new cap after it has completed scheduled maintenance work on its website. Elsewhere, there has been good news this week for customers of two exchanges crippled by hacks earlier this year. Fisco, the new owner of the Zaif platform, which was hit with a major hack in September has confirmed that customers whose money was stolen in the heist will be reimbursed by the end of this week. Fisco is also considering integrating the Zaif platform with its own exchange business.And Coincheck, now owned by the Monex Group after the biggest hack in exchange history, earlier this week confirmed it had resumed a full range of services for all of the cryptocurrencies it handles – for the first time since January.The FSA, meanwhile, is likely to begin work on a new set of cryptocurrency regulations, and is currently holding exhaustive study group sessions with blockchain experts. Per the FSA, its study group has been looking at issues including ways to wipe out insider trading, shore up wallet service security – and possibly rename “cryptocurrencies” as “encrypted asset” in legal documents.The financial sector is also pushing ahead with developments. The First Bank of Toyama, which  earlier this month announced it would launch a blockchain-powered stablecoin called FBC, has revealed details about the coin’s pilot.The bank hopes to commercialize its token in October 2019, and yesterday launched the pilot, which it says will run until April 23, 2019. The bank says it is running the pilot in conjunction with Intec, a Toyama-based IT firm. The coin will operate on the Japanese Bankers Association’s newly developed JBA Blockchain Collaboration Platform, and will allow FBC holders to pay in the stablecoin at restaurants and stores in the First Bank of Toyama’s headquarters."
11,https://cryptonews.com/,"Dec 5, 2018",Waves Turns into Tsunami as it Surged by More than 50%,https://cryptonews.com/news/waves-turns-into-tsunami-as-it-surged-by-more-than-50-3024.htm,"Cryptonews · News · Bitcoin NewsEthereum NewsAltcoin NewsBlockchain 
NewsPress ReleasesSponsoredIndustry TalkICO news · Exclusives.","
December 05, 2018
","Even in the midst of depressed crypto prices and a stagnant market, one blockchain project is getting attention. Smart contract, decentralized exchange, and token development platform Waves has just seen a surge of interest from investors, despite the stagnation that the rest of the market appears to be stuck in.","It seems that the new wallet release was the trigger behind the current rally in Waves’ price, propelling it from USD 1.46 to a high of USD 2.25 (+54%) on Tuesday, before falling back and trimming its gains to 38% (UTC 06:10 AM). In either case, it’s the best-performing coin in the top 50 cryptocurrencies by market capitalization.Waves price chart:The company has announced a range of positive news recently, including several new exchange listings, a full integration with the Ledger Nano S hardware wallet, and most recently the roll-out of its new Waves Mobile Wallet.We are excited to announce a long-awaited update of the #Waves Mobile app! Deposit, store and withdraw your #crypto securely, trade your assets on DEX, lease your $WAVES — everything is now available right on your smartphone! Read more about it here: https://t.co/5Qp7YKTa8r pic.twitter.com/y5hsCXj2GVThe Waves Mobile Wallet now includes a fully integrated decentralized exchange and allows for purchases of Waves tokens directly with credit cards from within the app, making the token much more accessible with fiat currencies than it has been in the past. So far, the app has more than 100,000 installs in Google’s Play store for Android devices. However, the price rally started several days before the news were announced, suggesting that there was a possible trading based on “tips” from insiders in the crypto market. As Cryptonews.com reported on previously, similar suspicions trading activity was also seen prior to the listing of Basic Attention Token (BAT) on Coinbase in late November.So far, the price rally has been sharp for Waves, which makes it unlikely that it will continue this way in the short-term. Long-term, however, there may be an opportunity for Waves to prove that it can truly match up with its better-known smart contracts competitors Ethereum, EOS, and 0x.Waves is a platform that was founded by the Russian entrepreneur Alexander Ivanov back in 2016, and has been operating out of its Moscow office ever since."
12,https://cryptonews.com/,"Dec 2, 2018",ConsenSys' Kavita Gupta: Crypto Promise Still Alive as Ever,https://cryptonews.com/exclusives/consensys-kavita-gupta-crypto-promise-still-alive-as-ever-3009.htm,"“The promise of an open financial system, cross-border transactions for 
all, that was sparked by Bitcoin, is still as alive as ever,” Kavita 
Gupta, ...","
December 02, 2018
","“The promise of an open financial system, cross-border transactions for all, that was sparked by Bitcoin, is still as alive as ever,” Kavita Gupta, who runs a USD 50 million investment fund as Founding Managing Partner at ConsenSys Ventures, told Cryptonews.com. ","The company is an external investment arm of ConsenSys, a major blockchain software technology firm. It invests in pre-seed and seed stage Ethereum projects across the Web 3.0 stack.Over the years, Gupta has held several senior investment roles and in this exclusive interview she shares her thoughts on the evolution of cryptocurrencies, how the funding landscape is changing —  and the importance of creating a healthy environment for women to flourish in the tech sector.Cryptonews.com: As the crypto landscape evolves what is your view on digital currencies?  Kavita Gupta: I think that the promise of an open financial system, cross-border transactions for all, that was sparked by Bitcoin, is still as alive as ever. Digital currencies and the promise of anyone being able to access their assets from anywhere in the world are as tantalizing today as it was in 2008, perhaps even more so. You can point to crises in Venezuela, Cuba, the friction of cross-border remittance or constant hacks (such as the one experienced by Equifax) as a proof of this. Now, do I think that tokenizing fiat in the way Circle, Coinbase, and Gemini have done recently is super revolutionary? (Here, Kavita Gupta is referencing to the stablecoins launched by the mentioned companies - Cryptonews.com) Not really. Although, I do think these will serve as a massive user experience upgrade to the decentralized web and these fiat backed tokens is definitely innovative for institutions. How is the venture capital (VC), funding landscape changing? I think VC investors are getting comfortable with this new paradigm of investing. Crypto investing looks a lot different: liquidity, duration, risk profile, volatility etc. are very different than the long-term traditional investment fund. The landscape is also changing for blockchain investors and the profile of entrepreneurs is changing. We see a shift from majority of young technologists serving as CEOs to a lot of  seasoned engineers and serial entrepreneurs entering the space. Product's vision, roadmap and especially the thought of adoption and user friendly interface have become a big part of the conversation. Some of the big VC's are setting up crypto dedicated funds bringing Web 2.0 and Web 3.0 worlds closer and validating lots of early tech in the space, which just a year ago would have looked fake. What type of projects have you recently invested in? Our two newest publicly announced investments are both incredibly exciting. The first, Unlock, is a protocol that allows content publishers to set up paywalls for their content without a middleman. It will eventually lead to people being able to micro-monetize their content, charge a few cents for an article or even a fraction of that for a tweet, etc. With only a few lines of code, anyone on the web can integrate Unlock's paywall-as-a-service, and they'll pivot into other areas of digital monetization, too.Another in Starkware, an innovative cryptography project out of Israel that's making major waves in the crypto industry. Without getting too technical, Starkware's Zero-Knowledge Proofs have drastically improved on the Snark technology (used by Zcash and others), allowing for private and highly scalable transactions. Once they reach full industrial grade, Starks will be a part of every blockchain, and can eventually even serve as the base layer for a new protocol.We started with the investment thesis of investing across the whole Ethereum stack, but the space is becoming very exciting for infrastructure, scalability and security products right now. What advice can you share with aspiring women in tech? What challenges have you faced as a female in tech?  Tech is like any other field in this world. It may look male dominated right now but doesn't mean we can't change it. As individuals, our first responsibility is to pursue what you really love and excel in it. Be strong and speak up if someone or something is making you uncomfortable.  Have a non defensive and honest conversation with your colleagues or seniors over coffee the first time you notice a pattern which makes you uncomfortable. If that doesn't solve the problem then speak up in [public] if the pattern continues. Find other women in the space and create a safe environment to have a support system and open conversation. The more you support each other and stand up - the more you would contribute in creating a healthy space for more women to follow. I have been blessed with some of the most supporting mentors and bosses in my life, but irrespective, I have never stayed quiet if I saw a pattern of rejection based on sex or color. I did question myself on my abilities at first, but having a confidence in my work and support system at work has always helped me to see through situations and gave me confidence to stand up as needed."
