,press company,date,title,url,abstract,date detail,head article,main article
0,https://cryptonews.com/,"Nov 19, 2018","Bitcoin, Ethereum and Altcoins Decline Further",https://cryptonews.com/news/bitcoin-ethereum-and-altcoins-decline-further-2945.htm,"This past week, we saw heavy declines in bitcoin below the USD 6,000 
support area. BTC/USD remained in a bearish zone and opened with a ...","
November 19, 2018
","This past week, we saw heavy declines in bitcoin below the USD 6,000 support area. BTC/USD remained in a bearish zone and opened with a negative tone this week. The price recently broke the USD 5,500 support and traded to a new 2018 low. Similarly, ethereum was under a lot of selling pressure as it broke the USD 175 support. It is currently (UTC 08:30 AM) down more than 10% and it seems like sellers are in control below USD 160. Both BCHABC and BCHSV declined heavily below the USD 250 and USD 100 supports respectively. The current market sentiment is clearly bearish and it seems like bitcoin could extend declines towards USD 5,000 in the coming sessions.","Total market capitalization There were heavy bearish moves below the USD 5,600 level in bitcoin price . BTC/USD traded below the USD 5,550 and USD 5,400 support levels recently to move further into a bearish zone. A new 2018 high was formed near USD 5,300 and it seems like the price could continue to move down in the near term.
The main weekly support level is at USD 5,000, below which there is an open space up to USD 4,400. On the upside, an immediate resistance is at USD 5,500, above which the price could recover towards the USD 5,750 level. The key weekly resistance is at USD 6,000, which was a crucial support earlier.Ethereum price  fell during the past few hours and declined below the USD 170 and USD 160 support levels. ETH/USD is currently down around 13% to USD 155.
An immediate support is at USD 150, below which the price could tumble towards the USD 130 level. On the upside, an initial resistance is at USD 170, above which the price could test USD 180. The main weekly hurdle for buyers is near the USD 195 level.Both Bitcoin cash  coins are down significantly. BCHABC is down around 15% and it recently traded below the USD 250 support. The next major support for buyers is near the USD 200 level. BCHSV collapsed and declined roughly 30% to USD 90. If it continues to decline, it could test the USD 80 level in the near term.
Ripple price  recovered recently, but buyers failed to hold gains above the USD 0.520 and USD 0.505 levels. XRP/USD followed bitcoinâ€™s path and declined around 5%. It is currently trading near USD 0.475 and it could test the USD 0.450 level.Many altcoins declined heavily and registered losses between 15%-20%, including LRC, ICX, WAN, AION, ELF, SRN, VET, IOST and MKR. Out of these, LRC is down 18% and ICX declined 17%.To sum up, bitcoin and altcoins moved further into the red zone. BTC/USD may perhaps continue to decline towards USD 5,000 and if buyers fail to defend more losses, the price could tumble. Similarly, ethereum must stay above the USD 150 level to avoid a drop towards the USD 130 and USD 125 levels in the near future.
_____"
1,https://cryptonews.com/,"Dec 4, 2018",What Does Bitcoin's Second Largest Difficulty Drop Mean?,https://cryptonews.com/news/what-does-bitcoin-s-second-largest-difficulty-drop-mean-3020.htm,"The mining difficulty of Bitcoin is adjusted every two weeks (every 2016 
blocks, to be precise) to maintain the normal 10-minute block time. This ...","
December 04, 2018
","As many Bitcoin miners have turned off their machines, mining difficulty saw its second largest drop in history at -15% on December 3rd. It has helped to increase profitability for those who still run their mining rigs, but strengthened fears of centralization. ","The mining difficulty of Bitcoin is adjusted every two weeks (every 2016 blocks, to be precise) to maintain the normal 10-minute block time. This means that if there are many miners competing amongst themselves and propagating blocks in less than ten minutes, the difficulty of the next puzzle will be increased; if there are few miners and it takes them much longer to find a solution, the difficulty is decreased - both times just enough to keep block times at around 10 minutes. Now, the difficulty might drop another 16% after two weeks, according to estimations by major mining pool BTC.com. In that case, it would almost reach the difficulty levels seen in May/June. According to previous reports, between 600,000 and 800,000 Bitcoin miners have pulled the plug on their operations in the second half of November. Market analysis firm Autonomous Research estimates that at least 100,000 individual miners have shut down, and advisory firm Fundstrat Global Advisors adds that since early September, about 1.4 million servers have been unplugged, Bloomberg reported on Monday. This flush out took the Bitcoin’s hash rate (or computing power) with it, as it is down 36% from its all-time high this September.As reported, miners are under growing pressure as the bitcoin price dropped by 80% since its all-time high in December of 2017. In November bitcoin lost 37% of its value, dropping below USD 4,000. The CEO of China-based crypto mining pool F2Pool Shixing Mao said back in September that the break-even point for Bitcoin mining was between USD 3,891 and USD 11,581, depending on the equipment being used. At that time, BTC traded for around USD 6,400. However, popular economist and Bitcoin investor Tuur Demeester stressed: ""Bitcoin Mining breakeven cost"" is confusing as a general concept, because it implies a static BTC revenue per hash. However hashrate rewards adjust dynamically, via biweekly difficulty adjustment and the fee market.With the mining difficulty down as well, the remaining miners should have an easier job. However, Malachi Salcido, head of Wenatchee, one of the largest North American miners, told Bloomberg that only a select few can afford to stay in the game: miners with scale, very specific business models and extremely low electricity costs, which is the case in Douglas County where his own miners are based. Margins before costs like depreciation and taxes dropped from about 40% to 20% during the slide, but they jumped back up at the company to around 40% as smaller rivals shuttered operations, Salcido said.However, some fear a 51% attack in case some of the remaining mining companies decide to band together. The community is much more optimistic, though: they remind that the biggest ever drop of -18% back in 2011 brought to a price increase of 150% - from USD 2 to USD 5 in around 60 days. Although many say that previous patterns are no guarantee for the future - “Just because it happened before, it does not mean it will happen again,” writes Reddit user u/Red5point1 - not all agree with that sentiment. As u/Mowglio points out, “Sure, historical data does not guarantee future results, but it is literally what all scientific analysis is based on. Throwing it to the wind as if it doesn't matter is one of the dumbest things you can do.”
_____
Watch Andreas M. Antonopoulos, a technologist and serial entrepreneur, discussing whether sudden changes in mining hash power would kill Bitcoin:"
2,https://cryptonews.com/,"Dec 10, 2018",Bitcoin Price Predictions - Where Are They Now?,https://cryptonews.com/news/bitcoin-price-predictions-where-are-they-now-3049.htm,"However, some predictions garner special attention: for example, software 
tycoon John McAfee first said Bitcoin would reach USD 500,000 by ...","
December 10, 2018
","Everyone has their own guess as to what Bitcoin will be worth in any amount of time. However, some predictions garner special attention: for example, software tycoon John McAfee first said Bitcoin would reach USD 500,000 by the end of 2020 and promised he’d eat his external genitalia on national television if that doesn’t happen, later amending his prediction to say it’d go up to USD 1 million while the previous promise still stands. Because this is the internet, there is a website that follows McAfee’s prediction and measures how much Bitcoin would have to rise for McAfee’s nethers to stay intact.","Also, the website, called bircoin.top, lets you add your own parameters to see how your own prediction would pan out, or even check other famous predictions. __McAfee announced his prediction on July 17th, 2017, and according to mathematics, the price would need to grow at a rate of around 0.5% per day from that day on to reach the predicted million. Although half a percent may not sound like much, it is still an exponential growth curve that gets steeper the further it goes. With this steady growth rate, Bitcoin would have to be worth USD 26,400 today for it to be on track for the end of 2020 - but it is scarcely above USD 3,500, around 86% less than what the prediction needs, or around 416 days behind.And there are many predictions: from Tom Lee, of Fundstrat Advisors, expecting USD 15,000 per bitcoin by the end of 2018, to Tim Draper betting on USD 250,000 per bitcoin by 2022. Meanwhile, data analyst Nick Maggiulli says that their mistake was making a prediction in the first place. “You CANNOT predict chaotic systems,” he adds in a tweet.Where did all these people go wrong?   When they made a Bitcoin price prediction in the first place. You CANNOT predict chaotic systems.  It’s the Three Body Problem. pic.twitter.com/IeMJQ761SwCo-founder of first Chinese cryptocurrency exchange BTCC, Bobby Lee, took to Twitter to share his own opinion and ask the community to do the same.If history repeats perfectly, then the current bear market for #Bitcoin would bottom out at $2,500 next month, in Jan 2019.And then the next rally would start in late 2020, peak out in Dec 2021 at $333,000, and then crash back down to $41,000 in Jan 2023.Something like that?🙂 https://t.co/M8ljIVnt73Later, Lee asked his followers whether this will happen - 59% of respondents believe in this, by the way, and over half believe that the peak of USD 333,000 is the least likely to happen out of all four predictions.However, all this proves is that anyone can make predictions. The community has always been skeptical, however, and many predictions (and the people making them) are notoriously wrong. Still, if you’re craving some fun, make your own prediction - there are no prerequisites to it - and if you get something right, maybe you’ll get famous."
3,https://cryptonews.com/,"Nov 22, 2018","DataDash on Bitcoin: ""It Was Like a Slap in the Face""",https://cryptonews.com/exclusives/datadash-on-bitcoin-it-was-like-a-slap-in-the-face-2968.htm,"How did you get into crypto? I found out about Bitcoin in 2011. At the 
time, I was trying to understand the global financial system and I was 
going ...","
November 22, 2018
","This article was originally published by our French franchise partner fr.cryptonews.com.
__________","Nicholas Merten, a.k.a DataDash, is a young entrepreneur with libertarian ideas and one of the most popular YouTubers in the crypto industry with over 315,000 subscribers.  Here is what he has to say about himself and his journey into crypto.When people ask you “What is your job?”, what do you answer?My job is to take the interests that I share with my audience to the next level. On a daily basis, I spend hours researching cryptocurrency and other markets such as equities, commodities, and traditional currencies. The reason I do this is because I trade markets from a macro perspective. I’m trying to give a big picture and show how intermingled crypto is with the world’s economy. It's rare that someone can turn their passion into their day-to-day job, but I’m one of those lucky individuals. How did you get into crypto? I found out about Bitcoin in 2011. At the time, I was trying to understand the global financial system and I was going back to the same conclusion that we need to find an alternative system that would not leave banking institutions with the mantle of responsibility over our money. Then, by chance, I stumbled upon Bitcoin. Sadly, my cynical nature kept me from exploring the technology further and for years I had no idea what it is. This was the case until 2016, when I read the Bitcoin whitepaper. It was like a slap in the face. I wasn't mad that I missed a wonderful investment opportunity, rather, I was upset that the important thing in dismantling the archaic banking system had been in front of my eyes for years.What is your educational and professional background?For more than seven years, I've immersed myself in just about every documentary, book, and Medium in order to understand economics, finance, business, and politics. Just a few years ago, I was pursuing a double major in business with a focus on finance, however, even ending the last semester of my freshman year with a 3.5 GPA, I dropped out. Then I joined Praxis [a 12 month startup apprenticeship], which lead me to working for a startup in Silicon Valley and founding the largest channel on cryptocurrencies.The first DataDash YouTube video that we found was posted on July 12th 2017. Is it the first crypto video you ever made?Yes, and with great humility, I thought no one would ever care to watch it.What was your initial goal with this channel? Is it still the same?The original goal of my channel was to teach people data analytics and SQL [a domain-specific language used in programming.] The channel was a part of a personal development project for an educational platform as I was pursuing a career in data analytics. However, it turned out that my two videos I did on crypto markets were very popular for a channel with no subscribers. So, I kept doing my research and producing videos. The rest is history. I would have never guessed that people would want to hear me ramble about markets on a daily basis.I've started to provide more of a macro-perspective in my videos, covering different areas of finance, such as the stock market and commodities. This was not only to broaden content I produce, but also to demonstrate how many of these markets correlate with crypto, which excites me the most.In your opinion, what problems cryptocurrencies could fix? Many believe that blockchain will help revolutionize the way companies operate, and I don't doubt it will. However, I feel that crypto will mostly affect even more important thing in our daily live - it’s currencies. Controlled by central authorities, traditional currencies have yet to see challengers to their dominance. Now, as many economies are experiencing debt, currency, and geopolitical crises, I think it's only a matter of time until we see a massive wealth transfer from fiat to the new era of decentralized cryptocurrencies. Cryptocurrency properties such as immutability, censorship resistance, and finite supply will change the game.If you had a chance, what would you tell Satoshi Nakamoto?""Thank you for giving me hope that financial sovereignty in the 21st century can become a reality. Are you satisfied where Bitcoin is heading?""
_____"
4,https://cryptonews.com/,"Dec 3, 2018","A Simple Way to ""Immortalize"" Your Message on the Bitcoin ...",https://cryptonews.com/news/a-simple-way-to-immortalize-your-message-on-the-bitcoin-bloc-3014.htm,"It's not the best service for private messaging as every single message is 
recorded on the Bitcoin blockchain, which means that they are public ...","
December 03, 2018
","Do you want to leave an immutable message for future generations? Then check out the Blockchainsareforever.com project. It’s not the best service for private messaging as every single message is recorded on the Bitcoin blockchain, which means that they are public and can never be modified or deleted.","This fun service isn’t that revolutionary, as it has been possible to add messages on the Bitcoin blockchain since its inception. For example, Satoshi Nakamoto, the mysterious creator of Bitcoin, included this message in the Genesis Block, or the first-ever block of Bitcoin: ""The Times 03/Jan/2009 Chancellor on brink of second bailout for banks."" Meanwhile, this year, TD Ameritrade, an online broker, planted their literal flag on the Bitcoin’s blockchain, effectively making an advertisement for themselves.However, “Blockchains are forever” makes this much easier. Just type in your message, choose whether you want your message to show on the Bitcoin blockchain or testnet, choose your payment method (via the Lightning Network or the regular Bitcoin payment), pay, and voilá! Your message is “immortalized.”This is what people are sending into eternity:It won’t cost you a lot to try “Blockchains are forever” as sending one message is less than 5 US dollar cents. However, you are only allowed to send 80 characters in a single message. So, if you are planning to add a wall of text to the Bitcoin blockchain, be sure to stock up with BTC first.Cryptonews.com covered two similarly creative crypto projects previously. The first one is Steem Whale, which allows you to make an artificial whale fountain squirt by sending the Steem cryptocurrency. Another fun project is Satoshi’s Place, a graffiti board to show the power and capabilities of the Lightning Network. There’re one million pixels on the canvas with each costing 1 satoshi to paint. Even if you draw something large, it won’t cost you a lot. But be aware: others can respray your art!Hower, immutability of public blockchains is being used to send serious messages, also. As reported in April, activists have posted a student of Peking University's #MeToo movement letter on the Ethereum blockchain in an attempt to avoid government censorship."
5,https://cryptonews.com/,"Nov 25, 2018",How Bitcoin Made One Man's Life Journey Worthwhile,https://cryptonews.com/exclusives/how-bitcoin-made-one-man-s-life-journey-worthwhile-2970.htm,"When I look back over the past 3 years, it is staggering how much my life 
has changed, and Bitcoin was a huge factor in that. Late 2015/early ...","
November 25, 2018
","This year, November rain proved to be very cold for the crypto market. However, inspiring stories from people in crypto might help the cryptoverse to warm up a bit. 
Mario Gibney, Blockstream, a blockchain startup, employee and co-host of the Unhashed Podcast, just offered one of those stories by sharing his personal experience and telling how Bitcoin has changed his life for better.  
Originally shared on Twitter, you can read about Mario’s journey below.
________","This year, November rain proved to be very cold for the crypto market. However, inspiring stories from people in crypto might help the cryptoverse to warm up a bit. Mario Gibney, Blockstream, a blockchain startup, employee and co-host of the Unhashed Podcast, just offered one of those stories by sharing his personal experience and telling how Bitcoin has changed his life for better.  Originally shared on Twitter, you can read about Mario’s journey below.*Deep breath*When I look back over the past 3 years, it is staggering how much my life has changed, and Bitcoin was a huge factor in that. Late 2015/early 2016 was the darkest period of my life.I was falling further into debt failing out of a university program I didn't yet realize I hated, my social life was little more than getting drunk several nights a week, and I had no constructive hobbies - nights alone were often spent compulsively playing computer games.I felt like I hadn't made progress on any long-term plans in years. Serious depression had started to take hold, which led to increasingly erratic sleeping patterns. My ability to focus was almost non-existent, as was my appetite.I knew things had gotten really bad by January 2016 when I found myself contemplating suicide.
I started seeking psychotherapy, and thanks to that and the support of my friends and family, I managed to stabilize myself, bit by bit, in the following months.Realizing how it was draining me, I quit my studies. But I was still generally aimless, in debt, and with a ton of time on my hands.That spring, this thing called 'bitcoin' popped back into my mind. About a year earlier, a guy I'd met at a bar had raved about it.I hopped on meetup and was excited to find an English-speaking Bitcoin group only a 15 minute walk from my apartment. (In a city like Seoul, that's basically next door.) I showed up to @seoulbitcoin for my first meetup in May 2016, and was hooked from the start.The Bitcoin meetup in Seoul, 2016:Bitcoin itself is interesting. But a bigger deal for me was the people there. You couldn't ask for a better person than @SomsenRuben to welcome newcomers and show them the ropes.I remembered that once upon a time I had been interested in computers other as a means to argue on internet forums, so I started learning coding. Having experts like @BenMcDonald___ and @abeikverdi give me tips and guidance as I struggled with C++ was invaluable.Soon after me, @Sanket1729 showed up as another regular, and he patiently filled in more of my technical gaps in comprehension.I suddenly had friends and a hobby that challenged me intellectually. Instead of obsessively slamming beers and hoping to get laid, weekend hours were spent huddled in a cafe, figuring out why the UTXO set was important, or why deploying SegWit was so complicated.When alone, I progressed from video games, to binge-watching @aantonop presentations, to taking Dan Boneh's cryptography courses.There were still dark periods during those months. I grappled with visa uncertainties and the aftermath of a traffic accident. I would fall back into my old ways at times. But I always had something constructive to come back to.By 2017, things had started to look up a lot more. I had found myself a stable day-job teaching English again, and I rarely felt the urge to go clubbing on weekends.I had been lucky enough in 2016 to set aside an investment in bitcoin which by 2017 allowed me to pay off my remaining debts. I'll never forget that feeling of weight being lifted off my shoulders.As crypto-mania gripped Korea in 2017, our meetup grew more popular, and I built confidence as we took turns presenting to larger and larger groups of enthusiasts or curious visitors. I began to think maybe I could make a career out of this Bitcoin thing.The Bitcoin meetup in Seoul, 2017:Another turning point came in November 2017. After our meetup garnered a bit of attention for speaking out against the Segwit2x fork, @wtogami paid us a visit since he was in town.Before he left, I told him that I was planning to quit teaching soon to try to work somewhere in the Bitcoin industry. He responded with something along the lines of ""I don't know if we're hiring at the moment, but we can stay in touch.""I was rather embarrassed. I had just been asking if he knew of anywhere else that might take me. I wouldn't have even thought to apply to Blockstream - of course there were far more qualified people than me that they could choose from.As it turns out, Warren saw more in me than I did - he had been quite serious. Within two months, I was on a flight back to Canada for my final interview. That was January this year.As the new year approaches, I look back at where I was less than three short years ago, and it's overwhelming.It's incredible being welcomed and working alongside intimidatingly competent people like @larrybitcoin, @excellion, @selenejin, and many others (you know who you are if you're reading this).The depression still comes back at times, and startup life can be immensely stressful. Less than a month ago, I came close to fully burning out. But I have a deeper drive these days, and I can pick myself back up faster each time.My life is so much better in almost every way than any other time in my life, and I'm beyond grateful.Bitcoin certainly wasn't the only thing that dragged me out of that mess a few years back. The support of my loved ones, psychotherapy, and my own perseverance were huge.But yes, the bitcoin community and the people I've met along the way have been the kind of thing that make this whole life journey worthwhile."
