,press company,date,title,url,abstract,date detail,head article,main article
65,https://www.forbes.com/,"Nov 25, 2018",Bernie Madoff Move Over: 'Stablecoins' Have You Beat,https://www.forbes.com/sites/jasonbloomberg/2018/11/25/bernie-madoff-move-over-stablecoins-have-you-beat/,"But with the price of Bitcoin and other cryptocurrencies in the doldrums, a 
new scam is rising to the top, like bits of toilet paper in sewage: ...","Nov 25, 2018,11:16am EST","Everybody is familiar with the Ponzi scheme: the scammer dupes investors into giving him their money, paying out early investors with incoming investments, thus presenting a veneer of respectability.","The great thing about Ponzi schemes? They really work. Investors are all happy with their returns, whether they stay in or get out.Ponzi schemes work, that is, until they don’t. Eventually losses steamroll, and the Ponzi schemer is quickly out of business.Today’s cryptocurrency world is rife with scammers to be sure, and the number of different scams is as great as the number of marks willing to fall for them.But with the price of Bitcoin and other cryptocurrencies in the doldrums, a new scam is rising to the top, like bits of toilet paper in sewage: stablecoins.How the Con WorksA stablecoin is a cryptocurrency whose value is pegged to an existing asset – potentially gold or some other commodity, but most commonly to a fiat currency like the US dollar.The stablecoin con begins with a simple value proposition. “[Stablecoins’] main use case is to provide cryptocurrency users with the ability to convert volatile crypto positions into anti-fragile or ‘stable’ alternatives,” explains Sam Ouimet, market analyst at CoinDesk.In other words, if Bitcoin or some other crypto is too volatile for your liking, move your crypto investment into a stablecoin. Its value will go up or down with the value of the underlying asset, but will be far more stable than the crypto you had invested in before.Just one problem: as with any Ponzi scheme, the value of your investment is stable until the bottom falls out, and it becomes worthless. Your money, meanwhile, is in the pockets of the scammers.The Three Types of Stablecoin: From Bad to WorseConfusion about the inner workings of a con is itself part of the confidence game – and stablecoin is no different. Case in point: stablecoins can be algorithmic, crypto-based, or collateralized with fiat (or potentially gold or other commodities with value).With algorithmic stablecoin, the vendor of the coin in question maintains its market value by buying its coins on the open market when its value goes down while selling them when its value goes up, thus bringing its value back to whatever fiat value it has pegged each coin to (typically $1). Furthermore, the vendor pays for its coins with IOUs, or ‘crypto-bonds.’Even Stablecoin aficionados see risk in the algorithmic approach. “The smart contracts and sometimes the incentivized participants of the network will affect the supply and demand of the available tokens and fix the price around a predetermined amount,” explain analysts at BlockShow. “This particular approach carries the advantages of decentralization and doesn’t require the trust of the main issuing entity but could be prone to the attacks that affect the price of the stablecoin.”Such attacks, however, are the least of this approach’s problems. “The bonds are supposed to appeal to investors because they trade at a discount — so that, in principle, their price can rise,” explains Barry Eichengreen, professor of economics at the University of California, Berkeley, and a former senior policy adviser at the 
 
International Monetary Fund
. “Here, too, the flaw in the model will be obvious to even a novice central banker. The issuer’s ability to service the bonds depends on the growth of the platform, which is not guaranteed. If the outcome becomes less certain, the price of the bonds will fall. More bonds will then have to be issued to prevent a given fall in the value of the coin, making it even harder to meet interest obligations.”In other words, a Ponzi scheme.Crypto-Based Stablecoins: ‘Perpetual Motion Machines’Crypto-based stablecoins are no better. In this approach, the vendor of the stablecoin collateralizes its coins with other crypto. Take, for example, the Dai stablecoin from MakerDAO, which runs on the Ethereum blockchain. “[The MakerDAO Dai stablecoin] system makes zero sense and is broken to the core: it only works if the price of Ether goes up,” says Preston Byrne, attorney/solicitor at Byrne & Storm, P.C. “Unfortunately for them, history shows that this investment thesis has been wrong 100% of the time, and Ethereum is as user-friendly and scalable as an angry rhinoceros experiencing heroin withdrawal.”The bottom line: “Crypto-collateralized stablecoins are the perpetual motion machines of modern finance,” according to Byrne. In fact, MakerDAO has a plan it calls ‘emergency shutdown’ for when the bottom falls out and it is no longer able to maintain Dai’s stable value – which, in fact, happens to every Ponzi scheme sooner or later.The Fiat Collateral Shell GameThe third approach to implementing a stablecoin is to collateralize it with real money (or other assets with value). In other words, for every stablecoin worth $1 the vendor issues, it maintains at least $1 in the bank, held against the eventuality that there will be a ‘run’ on the stablecoin, where everybody wants their money back.Just one problem: many vendors choose to partially collateralize their stablecoins, maintaining a reserve of cash insufficient to cover such a run, vaguely similar to the fractional reserve system that banks use to lend more money than they receive in deposits.Only the fractional reserve system is heavily regulated, the US Government (as well as many other governments around the world) guarantees many deposits, and banks pay interest and/or provide value-added services to depositors – characteristics that no stablecoin can offer.What, then, are the benefits to holders of partially collateralized stablecoins? They get to give up control of their hard-earned real money in exchange for tokens that at best return their deposit, while at worst they lose everything. They even give up the possibility of another run-up in the price of their crypto.Ask yourself: why would anyone take such a deal? And more importantly, why would any on-the-level business ever think it could make money offering such a value proposition to its customers?From Tether to CircleThe most popular stablecoin, USDT from Tether, is an example of a supposedly fully collateralized stablecoin – only it has heretofore been unwilling to submit to a public audit of its fiat reserves.In November 2017, Tether experienced an inevitable meltdown characteristic of all Ponzi schemes, as it was unable to maintain its peg to the US dollar, as the chart below illustrates.The price of Tether’s USDT stablecoin relative to the US dollar from June through October 2018,... [+] showing its loss of peg to the dollar on October 15.Note that in the chart above, USDT’s price relative to the dollar was quite stable – until suddenly it wasn’t. “Tether, which is pegged one-to-one to the dollar, claims to hold dollar deposits equal to the value of its circulation. But the veracity of this claim has been disputed,” Eichengreen continues. “This points to yet another problem with this model: expense. To issue one dollar’s worth of Tether to you or me, the platform must attract one dollar of investment capital from you or me, and place it in a dollar bank account. One of us then will have traded a perfectly liquid dollar, supported by the full faith and credit of the U.S. government, for a cryptocurrency with questionable backing that is awkward to use.”Eichengreen concludes: “This exchange may be attractive to money launderers and tax evaders, but not to others.”In response to Tether’s woes, Circle Internet Financial touts that its reserves exceed the dollar value of its ‘USD Coin’ stablecoin in circulation – and even posted a letter from accounting firm Grant & Thornton attesting to the fact.However, the letter’s contents are fishier than week-old mackerel, as careful reading of the letter’s intentionally obscure fine print reveals that it states that the accounting firm essentially took Circle Internet Financial’s word on how much money it had in its accounts. (A Grant Thornton spokesperson confirmed that the letter is a legitimate Grant Thornton document, but stated that the firm’s policy is not to comment on client work.)Propping Up Value of BitcoinEver wonder why Bitcoin experienced such a dramatic spike in its price in late 2017? While feverish speculative interest is certainly partly to blame, one researcher has concluded that illegal market manipulation using Tether’s stablecoin was the primary culprit.In their report Is Bitcoin Really Un-Tethered?, University of Texas at Austin McCombs School of Business professor John M. Griffin and his student Amin Shams uncovered the fraud. “Purchases with Tether are timed following market downturns and result in sizable increases in Bitcoin prices. Less than 1% of hours with such heavy Tether transactions are associated with 50% of the meteoric rise in Bitcoin and 64% of other top cryptocurrencies,” write Griffin and Shams. “These patterns cannot be explained by investor demand proxies but are most consistent with the supply-based hypothesis where Tether is used to provide price support and manipulate cryptocurrency prices.”Another well-known economist and crypto naysayer, Nouriel Roubini, takes issue with how Tether props up the value of Bitcoin. “Tether Printing Press in High Gear, Issuing $400 [million] of Fake USD in 4 Days to Manipulate and Prop Up the Price of Bitcoin,” Roubini tweets. “Without this criminal manipulation Bitcoin would crash by 80% based on a recent econometric study. And regulators are asleep at the wheel.” (See my recent article on Nouriel Roubini.)Tether, however, disputes the claim of fraudulent price manipulation. “The entire study relies on the assumption that USDT is unbacked and therefore not sufficiently driven by trader demand,” explains Leonardo Real, chief compliance officer at Tether. “This is flawed, and claims which suggest that USDT transactions aren’t driven by demand when it is consistently in the top 2 of traded cryptocurrencies in the space with regards to volume, are simply ridiculous by now.”I am reminded of the scene in The Wizard of Lies where Robert DeNiro as Bernie Madoff receives redemption requests he can’t handle, signaling the unraveling of his massive Ponzi scheme.Today, Madoff no longer lives in luxury – but I’m sure he’d welcome company. It looks like stablecoins will sooner or later grant that wish.Intellyx publishes the Agile Digital Transformation Roadmap poster, advises companies on their digital transformation initiatives, and helps vendors communicate their agility stories. As of the time of writing, none of the organizations mentioned in this article are Intellyx customers. The author does not own, nor does he intend to own, any cryptocurrency or other cryptotokens, neither long nor short. Image credit: TradingView."
66,https://www.forbes.com/,"Nov 30, 2018",Floyd 'Crypto' Mayweather & DJ Pay SEC $0.75M Over 'Unlawful' ICO Promotion,https://www.forbes.com/sites/rogeraitken/2018/11/30/floyd-crypto-mayweather-dj-pay-sec-0-75m-over-unlawful-ico-promotion/,"As if the cryptocurrency and Initial Coin Offerings (ICO) markets did not 
have enough to contend with of late and given bitcoin's price being ...","Nov 30, 2018,03:54pm EST","Floyd Mayweather Jr. sits in his corner during the super welterweight boxing match against Conor... [+] McGregor in Las Vegas on August 26, 2017. (Photo: Eric Jamison/Associated Press).","As if the cryptocurrency and Initial Coin Offerings (ICO) markets did not have enough to contend with of late and given bitcoin’s price being down around 75% since its peak in 2017, now the U.S. Securities and Exchange Commission (SEC) has announced charges against Floyd Mayweather Jr., one of the best defensive boxers in history, and music producer Khaled Khaled (aka DJ Khaled), have been settled for failing to disclose payments they received for promoting investments in Initial Coin Offerings (ICOs).It is also hardly likely to reassure investors in the cryptocurrency space, already shaken since leading crypto currencies have fallen back to earth since last December. Nor - for that matter - potential new investors to the sector for that matter.The settlements involving Mayweather - who apparently has the nicknames ‘Pretty Boy’ and ‘Money’ - represent the SEC's first cases to charge touting violations involving ICOs. They are also probably not the last given that the SEC looks at such ICO issuance retrospectively.The SEC’s orders found that Mayweather, who was reported by Forbes to have made $285 million in prize money, salary, bonuses and endorsements between June 1, 2017, and June 1, 2018 (attributing $275 million of that to fighting Conor McGregor in August last year), failed to disclose promotional payments from three ICO issuers, including $100,000 from Centra Tech Inc., and that Khaled failed to disclose a $50,000 payment from Centra Tech, which he touted on his social media accounts as a “Game changer.”He topped the Forbes and Sports Illustrated lists of the 50 highest-paid athletes for 2012 and 2013, plus the Forbes list again in both 2014 and 2015, which listed him as the highest paid athlete in the world.And, he had generated around 23.8 million Pay-per view (PPV) buys and $1.67 billion in revenue throughout his career, which put in perspective surpasses the likes of Mike Tyson, Evander Holyfield, Lennox Lewis, Oscar De La Hoya and Manny Pacquiao.On one level you might argue that the settlements made by the two parties were more than what they gained in terms of the inducements, but has it gone far enough to dissuade others?Moreover, is the settlement with the SEC really going to dent Mayweather’s financial standing - it represents around 0.11% of what his average weekly earnings were in the 12 months to June 1, 2018 (as cited above). And, after all it is not like he actually needed to rely on that extra cash.Mayweather's promotions included a message to his Twitter followers that Centra's ICO “starts in a few hours. Get yours before they sell out, I got mine…”And, a post on his Instagram account predicted that he would make a substantial amount of money on another ICO. In a post via Twitter it was stated: ""You can call me Floyd Crypto Mayweather from now on.""  The SEC order found that Mayweather failed to disclose that he was paid $200,000 to promote the other two ICOs.Mayweather and Khaled's promotions came after the SEC issued its DAO Report back in 2017 warning that coins sold in ICOs may be securities and that those who offer and sell securities in the U.S. must comply with federal securities laws.Subsequently in April 2018, the Commission filed a civil action against Centra’s founders, alleging that the ICO was fraudulent. The U.S. Attorney's Office for the Southern District of New York filed parallel criminal charges.Without admitting or denying the findings, Mayweather and Khaled agreed to pay disgorgement, penalties and interest in aggregate totalling $767,510.In Mayweather’s case, the boxer agreed to pay $300,000 in disgorgement, a $300,000 penalty as well as $14,775 in “prejudgment” interest. Khaled agreed to pay $50,000 in disgorgement, a $100,000 penalty and $2,725 in prejudgment interest.In addition, Mayweather agreed not to promote any securities, digital or otherwise, for three years, and Khaled agreed to a similar ban for two years. He also agreed to continue to cooperate with the investigation, which is continuing.Stephanie Avakian, Enforcement Division Co-Director at the SEC and formerly a partner at Wilmer Cutler Pickering Hale and Dorr LLP, commenting in the wake of the settlement said: “These cases highlight the importance of full disclosure to investors. With no disclosure about the payments, Mayweather and Khaled's ICO promotions may have appeared to be unbiased, rather than paid endorsements.”Investors should be “skeptical of investment advice” posted to social media platforms, Steven Peikin, Enforcement Division Co-Director stressed.A former Managing Partner of Sullivan & Cromwell LLP’s criminal defense and investigations group, where his practice focused on white-collar criminal defense, regulatory enforcement and internal investigations, he added: “They [investors] should not make decisions based on celebrity endorsements. Social media influencers are often paid promoters, not investment professionals, and the securities they’re touting, regardless of whether they are issued using traditional certificates or on the blockchain, could be frauds.""Steven Peikin, Co-Director of the SEC’s Division of Enforcement, who served as an Assistant U.S.... [+] Attorney in the Southern District of New York from 1996 to 2004. (Source: U.S. SEC).SEC's Other Recent ActionsIt has certainly been a busy November for the SEC in terms of actions. On November 28 the financial regulator charged self-described promoter Eric Landis from Charlottesville, Virginia, with micro-cap market manipulation scheme. Some two weeks earlier (November 16) two ICO issuers - CarrierEQ Inc. (Airfox) and Paragon Coin Inc - settled SEC registration charges and agreed to register tokens as securities.Boston-based start-up Airfox raised around $15 million worth of digital assets in order to finance their development of a token-denominated “ecosystem” starting with a mobile application, which would allow users in emerging markets to earn tokens and exchange them for data by interacting with advertisements.Paragon, an online entity, raised approximately $12 million worth of digital assets to develop and implement its business plan to add blockchain technology to the cannabis industry and work toward legalization of cannabis. Neither entities registered their ICOs pursuant to the federal securities laws, nor did they qualify for an exemption to the registration requirements.And, among a total of seventeen similar SEC actions communicated during the month, on November 7 it was announced that Citibank N.A. was to pay more than $38.7 million for “improper handling” of ADRs (American Depositary Receipts), U.S. securities representing foreign shares of a foreign company, in relation to what were described “pre-released” ADRs.On the same day brokerage ITG was charged with misleading dark pool subscribers with its POSIT dark pool and agreed to pay $12 million to settle. Furthermore, additional charges were brought against a New York boiler room scheme that targeted senior citizens and generated over $3.3 million of illegal profits (November 15).Add to all the above, on November 8 Zachary Coburn, founder of EtherDelta, a digital token trading platform, was charged with operating an unregistered exchange (November 8), for secondary market trading of ERC20 tokens, a type of blockchain-based token commonly issued in ICOs. Over an 18-month period, EtherDelta's users executed over 3.6 million orders for ERC20 tokens, including tokens that are securities under the federal securities laws.The SEC has previously brought enforcement actions relating to unregistered broker-dealers and unregistered ICOs, including some of the tokens traded on EtherDelta.In light of this case, the SEC’s Steven Peikin noted at the time: “We are witnessing a time of significant innovation in the securities markets with the use and application of distributed ledger technology (DLT). But to protect investors, this innovation necessitates the SEC's thoughtful oversight of digital markets and enforcement of existing laws.”Whatever else, the SEC has got its work cut out in monitoring the crypto/digital/DLT sector given all the aforementioned misdemeanors. If anything, this might point to increasing the levels of fines and settlements, as it would appear that adverse forces - or even bad actors - have been at work and it shows little sign of abating any time soon.Charles Hoskinson, co-founder of IOHK and formerly of Ethereum (shown seated second from the left),... [+] speaking at a global ICO summit in Zurich, Switzerland, October 2017. (Source: Smart Valor).As Charles Hoskinson, formerly of Ethereum who in 2015 co-founded IOHK, a leading blockchain R&D company, who I recently caught with at the Malta Blockchain Summit earlier this November said in relation to investing in ICO’s: “Before purchasing an ICO, my first piece of advice would be to understand the project’s whitepaper and the product or service. The reality is that if you cannot understand the whitepaper then don’t buy into it.”In addition, the American from Boulder, Colorado, whose IOHK team over the past three years designed Cardano, an industrial-strength blockchain and the home of the Ada cryptocurrency, stressed that potential investors ""should never put more money into anything - ICOs included - than they can afford to lose and understand that these vehicles are tremendously speculative.”Pretty sound and sensible advice there. And, of course do your own dilligence and be wary of celebrity endorsements spouting on about vast fortunes to be made in a flash. There are also various we If it is too good to be true, it probably is.The SEC’s investigation concerning Messrs Mayweather and Khaled Khaled  is being conducted by Alison R. Levine of the New York Regional Office and Jon A. Daniels, Luke M. Fitzgerald, and John O. Enright of the Enforcement Division’s Cyber Unit. The case is being supervised by Cyber Unit Chief Robert A. Cohen."
