,press company,date,title,url,abstract,date detail,head article,main article
0,https://www.forbes.com/,"Dec 10, 2018",Why Bitcoin Crashed And Why It Will Crash Again,https://www.forbes.com/sites/davidpetersson/2018/12/10/why-bitcoin-crashed-and-why-it-will-crash-again/,"Bitcoin is the dominating crypto currency. The recent crash only managed to 
get its price back to where it was last December, which means it is ...","Dec 10, 2018,12:49pm EST",The bitcoin cash war split the currency into two and crashed the market. Photocredit: Getty,"Bitcoin is the dominating crypto currency. The recent crash only managed to get its price back to where it was last December, which means it is still profitable compared to a few years ago. Yet the digital currency that started it all suffers from some serious flaws, from volatility to its core algorithms.This November, bitcoin broke the floor and went below the $6,000 limit. As of this writing, it has even broken the $5,000 and $4,000 lines.  While some specialists expected the currency to reach $25,000 in December, the market is currently “bearish.”There have been many speculations around the cause: some suggest the massive sell-offs, while others point to news around Goldman Sachs abandoning plans to launch a crypto currency trading desk. Some simply suggest that since many bitcoin investors are young adults, they want to cash in before college. Another theory is the fear of huge capital gain taxes. But before all of these, we had the bitcoin cash split. To understand the split, which affected the community so heavily, it is important to know how bitcoin “upgrades.”Unlike regular (centralized) software, where a company owns a product and can upgrade it anyhow it likes, decentralized protocols such as bitcoin rely on several thousands of nodes, each of them having a version of that software installed. And there is no central place to automatically upgrade them (like Playstore) as that would defeat the purpose of decentralization. For this reason, all nodes must agree on the best way to go forward.This process is called “forking,” where a new version of the software is created and installed on all nodes. And if the fork is a “hard fork,” this means the new software becomes “incompatible” with the old one, effectively resulting in a new coin. This is what happened to bitcoin cash.It’s worthwhile to mention that bitcoin cash was a fork from bitcoin itself, and the reason behind it was limitations in bitcoin’s algorithm. Bitcoin can only process seven transactions per second, compared to Visa’s 24,000. As bitcoin adoption was increasing, the scalability problem had to be solved.Bitcoin uses a CPU-intensive “Proof of Work” algorithm which requires the miners to spend a lot of time and resources on computing a hash value that verifies the transactions. In return, the one who solves the algorithm is rewarded in bitcoin.To increase the chances for reward, GPU mining, ASIC mining and mining pools were created, with Bitmain currently being the largest. But the increased hashing power of these pools (with a majority of them residing in China) also increased the worries of a 51% attack, where one pool could overwrite the entire history of bitcoin and redefine the contents in all wallets.To solve the problem of scalability, the community had to make a choice. The problem could be solved by increasing the “block size” (limited to 1 MB) which would allow a lot more transactions to be processed per second, but this meant that smaller devices would have no chance to compete with the bigger players. It was an issue of centralization vs. decentralization. The community could not agree, and bitcoin cash was born as the alternative which could process more transactions per second.On November 15, bitcoin cash officially split into two versions: Bitcoin ABC (Adjustable Blocksize Cap) and Bitcoin SV (Satoshi’s Vision). To keep it simple, both factions had different views on how bitcoin cash should proceed, with one of the debates circulating around the block size. But in this split, the chains tried to eliminate each other, partially fighting over who should own the BCH symbol.When a crypto currency splits, the users on the old chain double their coins, as they receive a similar amount of coins on both sides of the chain. But without a mechanism called “replay protection,” if a user spends coins on one of the chains, it automatically deduces from the other one as well.Bitcoin SV initially refused to implement this feature. Furthermore, Craig Steven Wright (who supports bitcoin SV) explicitly stated that they will use any hash power under their control to 51%-attack the bitcoin ABC chain, resulting in a “hash war.” For these reasons, many exchanges stopped supporting bitcoin cash altogether until the dust settled off.For now, it seems like bitcoin ABC has won the civil war, but the entire crypto community has paid the price. Bitcoin is driven by opposing visions; some consider it a vehicle for investment, while others want to use it to “pay for your coffee.”Bitcoin did a great job in introducing crypto currencies to the world. It seized the right moment after the financial crisis, and became the first and biggest digital currency. Yet, it has many flaws: volatility, scalability and the power-hungry algorithm are some of them.For these reasons, we now have stablecoins and third and fourth generation blockchain projects which rely on totally different algorithms (some that rely on RAM instead of CPUs). Bitcoin probably cannot become a mainstream payment mechanism, but it has paved the way for other digital currencies. If its flaws are not fundamentally resolved, it might lose its dominating position."
1,https://www.forbes.com/,"Dec 5, 2018",The Top 10 Risks Of Bitcoin Investing (And How To Avoid Them),https://www.forbes.com/sites/forbesfinancecouncil/2018/12/05/the-top-10-risks-of-bitcoin-investing-and-how-to-avoid-them/,"In addition to hacking, there is a fair amount of fraud in the bitcoin 
market. Buyers and sellers are looking to trade bitcoins online, but since 
their ...","Dec 5, 2018,08:00am EST",Getty,"Virtual currency is considered the future of monetary exchange. Trading goods online with a global currency certainly sounds like a method that could expedite commerce without the complications of a national currency.Bitcoin is by far the most successful currency today, but with any new frontier, there are bound to be some obstacles. Despite bitcoin’s recent popularity, there are some serious risks when it comes to investing in cryptocurrency.With so many people rushing to invest, it’s important to be aware of the concerns surrounding this new market. Here are the top 10 risks of bitcoin investing and how to avoid getting caught up in them.10. The Volatile And Fluctuating MarketThe price of bitcoin is constantly changing. As of November 6, 2018, one bitcoin was worth $6,461.01. If you happened to purchase a bitcoin on December 17, 2017, the price topped $20,000. Days later, on the 24th, buyers could not sell their investment for more than $14,626. The bitcoin market is constantly rippling back and forth. With such an unpredictable market, there’s no telling if you will get a return on your investment. To avoid a massive loss, keep a vigilant eye on the market. Make small investments; they’ll be more beneficial long-term.9. CybertheftCryptocurrency is technology-based, which leaves this investment open to cyberattacks. Hacking is a serious risk, since there is no way to retrieve your lost or stolen bitcoins. Many reports suggest that many buyers lose their investments on exchanges and mining losses. Exchanges are more likely to hacked -- even if you have the protection of a smart wallet. Additionally, if you do have a wallet and you forget or misplace your key, there is rarely a way to retrieve your coins. Carefully research your cryptocurrency wallets to be sure you have the most reliable option.8. FraudIn addition to hacking, there is a fair amount of fraud in the bitcoin market. Buyers and sellers are looking to trade bitcoins online, but since their rise in popularity, some of these exchanges can be fake. The Consumer Finance Protection Bureau and the Securities and Exchange Commission have warned against these transactions where unsuspecting investors are duped out of their bitcoins in fraudulent exchanges. This lack of security creates a big risk for investors. While systems have been created to deal with these problems, security remains a big issue.7. Little Or No RegulationCurrently, the bitcoin market is operating without any major regulations. The government doesn’t have a clear stance on cryptocurrency; the market is just too new. It is not taxed, which can make it enticing as an investment opportunity. However, a lack of taxation could lead to problems should bitcoin pose as competition for government currency. As of now, cryptocurrency is not a widely accepted currency, but the future is ever-changing. There’s no telling what the state of the bitcoin market could be in a few years’ time.6. Technology RelianceBitcoin is an online exchange that is reliant on technology. Coins are digitally mined, exchanged via smart wallet and kept in check using various systems. Without that technology, cryptocurrency is worth nothing. Unlike other forms of currency or investment, there is no physical collateral to back it up. With gold, real estate, bonds or mutual funds, you own something that can be exchanged. With a currency that is 100% technology-based, bitcoin owners are more vulnerable to cyberthreats, online fraud and a system that can be shut down.5. Block WithholdingNew bitcoins are created by solving mathematical equations called “blocks,” which are created every time there is a bitcoin exchange online. A mining pool can use computational power to mine a block and hide it from honest miners instead of reporting the new block to the network. Essentially, this is a way for a select few to reap the benefits, while others are left with nothing.4. Limited Use Bitcoin may be a step toward a new monetary exchange; however, there are few companies that accept it as a viable form of currency. Currently, a few online stores, including Overstock, Newegg and Monoprix, allow cryptocurrency exchanges. Additionally, bitcoin owners can use their funds for travel with companies like AirBaltic, Air Lituanica and CheapAir.com. Unfortunately, many companies do not recognize bitcoin as a legitimate exchange.3. Financial LossBitcoin has been referred to as a Ponzi scheme, with people at the top benefiting off the ignorance of others. As more people buy into bitcoin, it creates a bubble economy. When the bubble bursts, bitcoin will essentially become useless; there will be many people holding onto cryptocurrency, intending to sell but unable to unload. There is no return on the investment, which can equal a very painful financial loss2. Currency Or Investment Opportunity?Cryptocurrency could be an effective online currency exchange; however, buyers buy up bitcoins with the intent of investing much as they would with stocks. Some even think that bitcoin is a solid investment opportunity for retirement. With a constantly shifting market, no regulation and zero physical collateral, investors can end up losing everything they invest. While bitcoin could potentially pay off, the best way to approach this investment is with caution. Small investments and small steps will cover more ground.1. Young TechnologyCryptocurrency is still a very young technology. Bitcoin came about roughly 10 years ago, and it has yet to develop into something solid. With so many changes occurring in the past few years, there’s no telling how the market will evolve. Bitcoin as we know it may become useless in the future. The best way to approach this new investment opportunity is with caution and due diligence. Take the steps to secure your funds, and brace yourself for the future of the market.The information provided here is not investment, tax, or financial advice. You should consult with a licensed professional for advice concerning your specific situation."
2,https://www.forbes.com/,"Dec 6, 2018",Bitcoin Falls To Fresh Yearly Lows After Wild Swings -- Here's Why,https://www.forbes.com/sites/billybambrough/2018/12/06/bitcoin-falls-to-fresh-yearly-lows-after-wild-swings-heres-why/,"Bitcoin is down some 80% from its all-time highs at the end of 2017, a drop 
which has dragged many other coins down as much if not more, as ...","Dec 6, 2018,10:43am EST","Bitcoin has today sunk to its lowest level since the beginning of the year as a cryptocurrency-wide market rout continues to cause pain for holders of bitcoin, ethereum, Ripple's XRP and other major digital tokens.","The bitcoin price fell to a low of $3,563 earlier today, down around 6% over the last 24 hours according to the CoinDesk bitcoin price tracker, before rebounding slightly. Earlier in the week, a bounce in the bitcoin price had led some to speculate the worst was coming to an end for the bitcoin and cryptocurrency market.Bitcoin is down some 80% from its all-time highs at the end of 2017, a drop which has dragged many other coins down as much if not more, as investors worry long-expected institutional investment in the sector will fail to materialize.Bitcoin has been on a downward trend all year, although the sell-off has picked up steam over the... [+] last month.The latest downturn follows a report of Bloomberg analysis of technical data that suggests the bitcoin price could be heading into a ""negative pattern.""The Average Directional Index (ADX) a technical indicator that rises as negative selling trends strengthen, is at its highest level since July, Bloomberg reported. The ADX is currently around 47 and if it crosses 50 it will be the first time it does so this year in a negative pattern, according to Bloomberg.""There’s little to prevent fading Bitcoin prices from reaching the continuous mean of $1,500,"" wrote Bloomberg analyst Mike McGlone in a note, indicating a drop of 60% from bitcoin's current price.The bitcoin sell-off, which has been labeled crypto winter, was sparked by a so-called hard fork in the bitcoin cash cryptocurrency after developers and miners failed to agree on updates to the coin's network.The bitcoin price appeared be rebounding yesterday before taking a dive today.The ensuing computer power war, which turned nasty as the two camps struggled for control of the bitcoin rival, resulted in many cashing out of the bitcoin and cryptocurrency holdings, afraid major holders could be about to abandon their positions to hurt one another.""We’re at a classic psychological stage where the market is reversing the 2017 frenzy,"" said McGlone in an interview with the newswire's TV station. ""The hard fork was a key trigger that signaled the technology is way too nascent. You had these dicey characters threatening to destroy each other and institutions said 'It might be best if we stay away from this for a while.'""After months of relative stability, bitcoin volatility exploded in November, with bitcoin recording its steepest monthly plunge in seven years and sparking speculation the bitcoin experiment could be coming to an end.Adding to bitcoin's woes the U.S. Securities and Exchange Commission (SEC) has cracked down on the crypto space, in recent weeks, fining two companies last month that hadn’t registered their initial coin offerings as securities.Last week, the head of the SEC said that concern over a lack of investor protections means he is minded not to approve a closely-watched bitcoin exchange-traded fund application. A decision from the SEC is expected at the end of December.Elsewhere, other major cryptocurrencies also took a beating. Ripple, the informal name for the XRP token, is down some 5% over the last 24 hours, while ethereum is off by almost 9% and stellar is down 10%.Bitcoin cash, which was the subject of a hard fork and hash war last month, led the sell-off today.Meanwhile, Miami-based blockchain and telecoms company UnitedCorp has launched a lawsuit against bitcoin mining company Bitmain, website bitcoin.com, Roger Ver, who runs the bitcoin.com website, and the Kraken bitcoin exchange over what it calls a ""scheme"" to take control of bitcoin cash for ""personal gain.""UnitedCorp is arguing the group colluded to ""effectively hijack"" the bitcoin cash network after the November software update with the intent of centralizing the network."
3,https://www.forbes.com/,"Nov 27, 2018",Latest Crypto Crash Caused By Bitcoin Civil War Say Experts,https://www.forbes.com/sites/ginaclarke/2018/11/27/latest-crypto-crash-caused-by-bitcoin-civil-war-say-experts/,"Other major cryptocurrencies have also experienced a significant fall in 
value, including ethereum, bitcoin cash, and litecoin. Initial Coin 
Offerings ...","Nov 27, 2018,06:20pm EST",What's behind the latest Bitcoin crash?,"Bitcoin’s USD value continued to fall this week leading to the cryptocurrency’s value dropping below $5,000 for the first time in 13 months. Bitcoin saw a fall of 14% in a 24 hour period last week, which could be down in part to the U.S. Securities and Exchange Commission’s sanctions on two crypto startups that it ruled were offering ICOs. Other major cryptocurrencies have also experienced a significant fall in value, including ethereum, bitcoin cash, and litecoin.Initial Coin Offerings rulingThe first potential cause for the widespread sudden fall in value for cryptocurrencies is the U.S. Securities and Exchange Commission’s decision to classify ICOs as unlicensed securities, meaning that those offering such assets were breaking the law and must pay fines as well as restitution.While some are arguing that the SEC’s intervention is long overdue, the commission had been taking a back seat in terms of overseeing and enforcing regulation within the crypto market until now. However, the decision has certainly made some industry insiders question the viability of the market in this period of uncertain regulation. The decision by the SEC will not come as a surprise to many, but it may well have been enough to spook some investors who could sit tight on crypto until clearer regulations are outlined by not only the U.S. government but lawmakers across the globe also.Bitcoin Cash ForkBut the unrest could have come from loyal investors in Bitcoin, torn between two coins. On the one hand is Bitcoin Cash ABC while backing the other, Bitcoin Cash SV, is the (self-professed) Satoshi Nakamoto himself Craig Wright. This fork is the divisive element cryptocurrency could do without.Developers of Bitcoin ABC included a so-called checkpoint that forces miners to include the first Bitcoin Cash ABC block in any chain, without it the chain is considered invalid by the software client. There are other software options for users, and they can opt out of the checkpointed version, but it opens the risk of another split taking place between a checkpointed Bitcoin Cash ABC and a non-checkpointed Bitcoin Cash ABC.This latest fork renewed fears that Bitcoin Cash would become centralized, and said fears are thought to be at the heart of the fall in the value of Bitcoin Cash.However, it is not the first fork for the cryptocurrency, and the changes that took place in the past were also steeped in controversy but did not cause the type of fall in value observed this time. On the drop, Jehan Chu, Co-Founder & Managing Partner at Kenetic.Capital commented: ""Bitcoin’s previously solid price anchor was unmoored by the recent Bitcoin Cash fork and is unlikely to recover anytime soon. Craig Wright’s antics have exposed the fragile relationship between decentralized technology and the outsize influence their figureheads wield. Until blockchain technology proves more useful than the people behind it, price levels are unlikely to remain sustainably high.""Nvidia and Advanced Micro DevicesThe third potential contributing factor to the sudden drop in value is the disappointing results announced by chip-makers Nvidia and Advanced Micro Devices, both of which are leading suppliers of hardware for cryptocurrency miners. The decline in sales has been seen as an indicator of a fall in levels of interest in crypto mining. The biggest question surrounding this is whether miners caught wind of the upcoming crash and stopped investing in hardware, or if the decline in hardware sales caused investors to question the long-term interest in cryptocurrency mining. Nvidia’s share prices fell to a 16-month low following the announcement of the dramatic fall in sales and the cryptocurrency crash. It remains unclear if the fall in chip makers’ sales is a symptom or a cause of the crash, but there is a definite correlation between both significant events in the cryptocurrency market.Market insiders’ opinionIndustry experts have gathered together to analyze the recent fall in cryptocurrency value. The crash has been widely attributed to the Bitcoin Cash fork, but some also believe it could be due to an inevitable bubble burst that has come after a period of unsustainable growth.Crypto YouTube star Quinten François of the Young & Investing channel said:Market makers are finishing the cycle. Currently we are sitting under ""the mean"" or fair value of Bitcoin, which means that we are in the last bearish phase of the cycle called “despair”. After that we should see a market reversal and start a new cycle. How far we will fall is still a question, but a fact is that when Bitcoin would fall to $5,000 it would have lost 75% of its value top to bottom. That seems to be fair considering that a market loses less value every other cycle in the process of becoming mature. Last cycle Bitcoin lost 87% top to bottom (2014), but that was an entirely different market environment and industry.""Michael Jeoung, CEO of Trustverse also believes the fork is in part responsible, saying:Crypto Civil War erupted from Bitcoin cash hard folk between ABC and SV (Satoshi Vision) has been one of the cause for the deep impact for the crypto market melt down and many investors are suffering from the incident. More importantly, this battle between ABC (Jihan Woo) vs. SV (Craig Wright), has no consensus from the public nor the DAU of Bitcoin Cash token holders and this makes it serious from the ethical point of view. It is centralized and monopolized power game, where blockchain is meant to become a public, decentralized trust mechanism. Price manipulation by power game is hurting digital wealth as well as it’s future value for technology development.First of all, wasn’t blockchain more about sharability and shared economy? More and more I feel from this industry is that many things are manipulated, information asymmetry exists larger than the modern financial market, and moreover such incident really has impacted mistrust for many entities. No product or services that ignore right or customer satisfaction fails and this civil war really implies self-interest than public’s interest. Overall cryptocurrency transactions seem to be shorted and slowing down for now. My hopeful view is that the fundamental market has not been changed.""All things considered, there will be enough people out there making use of the BCH capitulation to drive prices down across the space in what some are calling a technical move. And if the Hash war has not ended then this could cause an influx of cash, and might give way to either a price stabilization or a momentum. Either way, there could be a further drop before the currency starts to make gains."
