,press company,date,title,url,abstract,date detail,head article,main article
30,https://www.forbes.com/,"Nov 28, 2018","Pay Your Taxes In Bitcoin, Trigger Tax Losses On Price Drop Too",https://www.forbes.com/sites/robertwood/2018/11/28/pay-your-taxes-in-bitcoin-trigger-tax-losses-on-price-drop-too/,"With Bitcoin and other crypto prices down again, many holders don't want to 
sell. But if you owe taxes, how about paying them in Bitcoin?","Nov 28, 2018,08:53am EST","With Bitcoin and other crypto prices down again, many holders don't want to sell. But if you owe taxes, how about paying them in Bitcoin? Selling now may trigger tax losses to use next year too. In Ohio, you can now make state tax payments in Bitcoin. It's only for Bitcoin at present, but the permitted crypto should expand according to OhioCrypto.com. Ohio beat out Arizona, Georgia, Utah and New Hampshire, where efforts to accept crypto for taxes failed. The transaction fee is zero during an initial three-month introductory period, and then 1% thereafter. Even if you owe taxes to Ohio, that does not necessarily mean you qualify. So far, this is just for businesses operating in Ohio. If you operate a business in Ohio and have a tax bill, you can register at OhioCrypto.com. All payments are processed by third-party processor, BitPay. Payments are converted to dollars before deposit into a state account. ","Ethereum, Bitcoin and Ripple coins (physical). (Photo by Ulrich Baumgarten via Getty Images)Payment Protocol-compatible wallets include BitPay Wallet; Copay Wallet; BTC.com Wallet; Mycelium Wallet; Edge Wallet; Electrum Wallet; Bitcoin Core Wallet; Bitcoin.com Wallet; BRD Wallet; and Bitcoin Cash (BCH) Wallets. If you don’t have one, OhioCrypto.com says you can create one. Remember, the IRS ruled that cryptocurrency is property in Notice 2014-21. That classification as property has some big tax consequences, accentuated by wild price swings.  If you owe $5,000 in taxes, you could pay the $5,000 in dollars. If you pay with $5,000 worth of Bitcoin, as long as the crypto is worth $5,000 when you pay, you’re home free, right? Not really. You need to consider the sale you just made. The transfer of the crypto to the tax man is a sale, and that could mean more taxes for the year of the payment. If you bought the crypto for $5,000 the day you pay your taxes, there’s no gain.But suppose you bought the crypto a year ago for $1,000 and it’s worth $5,000 when you use it to pay taxes? That’s right, you have a $4,000 gain. Hopefully, it is a long-term capital gain, which would make the taxes lower. But you still have taxes to pay—because of your tax payment. You could trigger a tax loss too, if you had bought the crypto for $7,000 and transfer it for taxes when it is worth $5,000. All sorts of transfers can trigger taxes. For example, payments using virtual currency made to independent contractors are taxable transactions to both parties. The recipient has income measured by the market value at the time of receipt.What’s more, as with other payments to independent contractors, payers engaged in a business must issue IRS Forms 1099. You can’t enter “1,000 Bitcoin” on IRS Forms 1099. You must value the payment in dollars, as of the time of payment. A payment made using virtual currency is subject to Form 1099 reporting just like any other payment made in property. The person paying the independent contractor with crypto just sold it. Whether that triggers a gain or loss depends on the payor's tax basis. The gain might be capital or ordinary. If you hold it for more than a year, the best deal is long-term capital gain treatment.But actually, gain or loss depends on whether the virtual currency is a capital asset in your hands. Most people can probably say they are investors in crypto, not a dealer or someone using it in their trade or business. But it is worth considering. Ordinary income vs. long term capital gain treatment can spell a big difference. You might have to pay only 15% on long term capital gain. But top long term capital gain rates are 20%, plus the possibility of the 3.8% net investment income tax under Obamacare.Every time you transfer crypto, you might trigger gain or loss. Tax basis and holding period are important, as is record keeping. If you receive virtual currency as payment, you must you include its fair market value in income. Report the fair market value in U.S. dollars on the date you receive it. If you “mine” virtual currency, you have income from mining, and the fair market value of what you produced is income."
31,https://www.forbes.com/,"Nov 20, 2018",The Great Cryptocurrency Scam,https://www.forbes.com/sites/jayadkisson/2018/11/20/the-great-cryptocurrency-scam/,"The larger financial firms have shied away from Bitcoin, with JP Morgan 
Chase's Jamie Dimon calling Bitcoin a fraud. But this hasn't stopped ...","Nov 20, 2018,11:59pm EST","When I first wrote about The Great Bitcoin Scam in  December of 2017, Bitcoin was trading at $15,433 after falling from its all-time high of $19,783 a few days earlier. As I write this article, Bitcoin is now trading at $4,359. Very simply, Bitcoin is in deep trouble. There are investigations about price manipulation, and the use of Bitcoin for payments is down 80% according to Reuters.","The Bitcoin BubbleAs poorly as Bitcoin has done in 2018, Bitcoin is the best of a sordid lot. The website deadcoins.com humorously lists hundreds of defunct cryptocurrencies and related investments that were either outright scams or just really bad ideas, many of which attracted untold billions from investors worldwide who are now that much less wealthy.Whatever else one can say that cryptocurrency has accomplished, it has been one of the greatest destroyers of wealth in the financial history of mankind. Take, for example, Bitconnect which was pitched by this guy to enthusiastic investors and at the end of 2018 was worth $450 -- it is now worth $0.06 assuming you can find a buyer.Nonetheless, hardly a day goes by that somebody doesn't ask me about investing in cryptocurrency because their financial advisor told them that they need ""some exposure to cryptocurrencies"". My response is always the same: They need to find another financial advisor, unless the plan was to go short on Bitcoin.According to retired investment advisor and cryptocurrency watcher Charles Padua, ""It is hard to imagine cryptocurrency being a suitable investment for all but those who are sufficiently wealthy that they can burn wads of cash off a bridge and not be distressed by it.""The fact is that cryptocurrency is starting to make that transition from a bad financial idea to an outright scam. Although cryptocurrency has at best a dubious future, there are still companies out there seeking venture capital from investors to ""take advantage of cryptocurrency"" and which promise to be the next Apple or Google, although exactly what they are going to be doing that will ever result in a profit is anything but clear.The larger financial firms have shied away from Bitcoin, with JP Morgan Chase's Jamie Dimon calling Bitcoin a fraud. But this hasn't stopped lesser firms from attempting to generate fees by attracting investors who largely don't have the first inkling of what they are investing in, but succumb to predictions of instant riches. Far from being folks wealthy enough to burn wads of cash off the bridge, these investors are much smaller investors who are being told, among other things, to use their retirement funds for cryptocurrency investing.There are also predictions about investment performance that make little sense. Take Fundstrat's Tom Lee, who just a month ago predicted that Bitcoin would hit $25,000 by the first of the year. After the most recent price drop, Lee cut his prediction to $15,000 — which means that Bitcoin would have to go up by 300% in the next 40 days. One has to wonder what sort of data  pundits like Lee rely upon to make such predictions. In his defense, Lee is not alone: If you want a good chuckle, check out these crazy predictions for year-end 2018.Without identifying anybody in particular, suffice it to say that a goodly number of Bitcoin prognosticators are simply shilling and attempting to pump the price of Bitcoin up because they themselves are invested in cryptocurrency companies. This is where the scam comes in. Very simply, cryptocurrency investors are being actively misled -- Jamie Dimon's reference to fraud -- into investing in something that doesn't have a realistic chance of yielding the promised results. In the old days of securities regulation, this was known as selling ""blue sky"" and resulted in state securities laws of the same name.Which is all to say that securities regulators, both at the federal and state level, have let the public down by not more actively regulating cryptocurrency investments, setting suitability guidelines for financial firms, and prosecuting the worst offenders including those pundits who are nakedly shilling Bitcoin and related investments. At the end of the day, Bitcoin has become nothing more than a giant pump-and-dump scheme, and investors should be protected from the scheme just as they would be from such a penny-stock biotech company whose sole existence is a website plus a closet with a phone in Salt Lake City, and the promise of someday obtaining valuable patents.As usual, the horse is already out of the barn, but this doesn't mean that investors do not deserve at least minimal protection from cryptocurrency even as interest wanes in this alleged asset class.This article at https://goo.gl/78Zo5gI've previously written about Bitcoin in the following articles:"
32,https://www.forbes.com/,"Nov 21, 2018",Bitcoin Crashed: Are Stablecoins The Way Forward?,https://www.forbes.com/sites/davidpetersson/2018/11/21/bitcoin-crashed-are-stablecoins-the-way-forward/,"Bitcoin crashed, and it took the other cryptocurrencies down with itâ€”most 
of them, at least. Some currencies, however, were designed to keep ...","Nov 21, 2018,05:04pm EST","Bitcoin crashed, and it took the other cryptocurrencies down with it—most of them, at least. Some currencies, however, were designed to keep their prices stable. The recent market fall was a test for these stablecoins – whether they delivered on their promise, or if they were unreliable.","Economic crisis and related business terms word cloud written with chalk on black board. There is a... [+] big arrow chart moving down. A businessman is hiding his head in a moving box.Volatility is nothing new in the cryptospace – in fact, this attracted speculators who bet on their rise to gain hefty profits. But this renders the currencies unusable for daily transactions.Stablecoins have been an attempt to confront this feature. Projects like Tether are pegged to the U.S. dollar, which makes every USDT worth exactly one dollar—nothing more, nothing less. The most important thing to note is that stablecoins are a financial vehicle, i.e. you cannot just “decide” that a coin should be traded for one dollar—what if people believe the coin is worthless? Then, no one would sell anything for that coin, and the coin issuers have to pay more coins to eventually persuade the sellers. The trick is to create a system that would never fall to this scenario. And so far, three methods have been invented: fiat-collateralized stablecoins, crypto-collateralized stablecoins and non-collateralized stablecoins.Fiat-collateralized stablecoins have (as the name implies) fiat money backing their crypto. This means that for every digital coin, there is an equivalent fiat money in held in collateral in a central bank. This system works like an IOU, where every coin is perfectly tradable for an equivalent dollar.Crypto-collateralized stablecoins intend to remove the dependency on fiat completely. This allows them to create a more decentralized solution by relying on crypto (such as ether or bitcoin) as collateral, but they are also more complex as the underlying asset is highly unstable. To confront this instability, these stablecoins are over-collateralized to absorb the shock of an eventual price fall. For instance, a user would need to deposit $200 ether to receive $100 in stablecoins—if ether falls by 25%, the coin still has enough backing to be traded for one dollar. Of course, these projects justify for this apparently $100 loss by paying interest or similar to the issuers, which in some cases allow the issuers to gain more than they have deposited.Without going much into the details, crypto-collateralized stablecoins have a working model that is more decentralized and transparent than their fiat-counterparts, but also more complex.The last category is non-collateralized stablecoins. In these projects, smart contracts are in charge to control the supply and demand scheme and ensure the price stays at one dollar. If the coin is trading too high, the system automatically creates new coins (historically called seignorage). If it is trading too low, the system buys up the coins in the market to reduce the circulating supply. If there are not enough coins to support this action, the system entitles you to future seignorage. In a way, the “collateral” in this system is the shares in the future growth of the system.Non-collateralized stablecoins are complex and the most promising project in this area is Basis, which does not have an official launch date yet. This brings us to the next topic.Stablecoins have been under fire for being doomed to fail. Tether, one of the first stablecoins pegged to the U.S. dollar fell down to $0.84 in mid-October when people started to doubt whether it is fully collateralized. Tether is a fiat-collateralized stablecoin.Critics of this system claim that these coins have no reason to exist, as they are simply copies of perfectly liquid dollars that have been traded for cryptocurrencies with “questionable backing that is awkward to use,” so why not just use the dollar directly?However, this could be said about just any cryptocurrency, not just stablecoins. Digital currencies have obvious advantages such as fast international payments, availability to anyone with an internet connection and the lack of need to go through a banking system.Several big players are offering their own stablecoins, such as Circle's USD Coin (USDC) which is backed by Goldman Sachs, or the Winklevoss twins with their Gemini (GUSD). They all indicate the potential for stablecoins. One of the recent players in this field is Elizabeth White, the CEO of The White Company.Originally a trader of labmorghini and yachts, White quickly encountered the problem with crypto price volatility. For that reason, her company launched the White Standard stablecoin (WSD), the first to be built off the Stellar blockchain (which is 1500% faster than Ethereum, and 1/1000 the cost).White did not repeat Tether’s mistake: “Tether has not had regular audits. In fact, they have had none from September 2017 until June 2018, and none since then. WSD is audited on a monthly basis.” She continues: “Tether's holdings are in an unnamed bank, presumably offshore. WSD holdings are in U.S. based, FDIC insured institutions.”“In the last few days we’ve seen a drop of more than 30 percent for BTC and even greater for other cryptocurrencies,” said Ronny Boesing, CEO of Openledger. The stablecoins, on the other hand, did not crash. Shortly after bitcoin’s fall, USDC and TUSD were trading at one to three cents over the dollar. USDT was trading for an average of $0.97, with WSD in the same range. Openledger’s bitCNY, which is pegged to the Chinese yuan, also managed to keep its stability.This all shows that so far, stablecoins have been able to keep their promises. Of course, they will probably not remain stable for all eternity, but the recent developments shows they have been able to absorb huge crashes after all.This begs the question; what is preventing stablecoins from going mainstream? In the words of Boesing, whose OpenLedger DEX was the first decentralized trading platform on BitShares that started offering stablecoins: “a simple answer is lack of trust.” Many banks and exchanges are still reluctant to accept stablecoins, and a lot of them who accept them did that under public pressure. White’s intention is to make stablecoins more reachable for that public.“Mainstream adoption of stablecoins will follow wider acceptance of stablecoin based payment methods in everyday life. That is why a two-sided network is the best approach to growing use. This means that stablecoins must find ways to allow their users to spend them through existing merchant networks, for example, a stablecoin based debit card like the upcoming White Card. On the other hand, merchant adoption of stablecoin payments will also help increase their use, with services like White Pay.”Will demand for stablecoins increase? Can they remain stable if bitcoin keeps crashing? There are many forces at play. What’s certain is that digital currencies have a much higher chance for becoming a reliable trading asset if they step away from being speculation tools—and that’s where stablecoins excel.Update: an earlier version of this article incorrectly referred to USDC as Goldman Sachs' coin, while it is actually created by Circle and backed by Goldman"
33,https://www.forbes.com/,"Nov 26, 2018","Ohio Becomes The First State To Allow Taxpayers To Pay Tax Bills Using 
Cryptocurrency",https://www.forbes.com/sites/kellyphillipserb/2018/11/26/ohio-becomes-the-first-state-to-allow-taxpayers-to-pay-tax-bills-using-cryptocurrency/,"Currently, the Treasurer's office only accepts Bitcoin for payment, but the 
plan is to add other cryptocurrencies in the future. There is a cost ...","Nov 26, 2018,12:47pm EST",Getty,"By now, most taxpayers understand that there are tax consequences associated with cryptocurrency, but ironically, until recently you couldn’t pay those taxes using cryptocurrency. That’s about to change: With the launch of OhioCrypto.com, Ohio will become the first state in the nation to accept tax payments using cryptocurrency.“We are proud to make Ohio the first state in the nation to accept tax payments via cryptocurrency,” said Ohio Treasurer Josh Mandel. “We’re doing this to provide Ohioans more options and ease in paying their taxes and also to project Ohio’s leadership in embracing blockchain technology.”Under the new payment system, not all taxpayers can make payment in cryptocurrency: It’s limited to businesses operating in Ohio. Offering the service to individual taxpayers is on the agenda, but Mandel hasn’t indicated any specific timeframe for the expansion.Here’s how it works: If you operate a business in the State of Ohio and you have a tax bill, you can register online at OhioCrypto.com to pay your taxes. You can make payments on any of 23 eligible business-related taxes (you can find a list here), and there is no transaction limit.The Treasurer’s office isn’t holding, mining or investing in cryptocurrency for payments or processing. All cryptocurrency payments are processed by a third-party cryptocurrency payment processor, BitPay. Those payments are immediately converted to dollars before being deposited into a state account. “The State of Ohio is the first major government entity offering its citizens the option to pay with cryptocurrency,” said Stephen Pair, cofounder and CEO of BitPay. “With BitPay, Ohio can leverage blockchain technology and benefit from reduced risk and identity fraud as well as enabling quick and easy payments from any device anywhere in the world and get paid in dollars. This vision is at the forefront of moving blockchain payments into mainstream adoption.”You’ll need to use Payment Protocol-compatible wallets to pay. Those include BitPay Wallet; Copay Wallet; BTC.com Wallet; Mycelium Wallet; Edge Wallet (formerly Airbitz); Electrum Wallet; Bitcoin Core Wallet; Bitcoin.com Wallet; BRD Wallet (breadwallet); and Bitcoin Cash (BCH) Wallets. If you don’t have one of these wallets, OhioCrypto.com advises you to create one and send some coin to it.Currently, the Treasurer’s office only accepts Bitcoin for payment, but the plan is to add other cryptocurrencies in the future.There is a cost associated with paying in cryptocurrency (it’s worth noting taxpayers who pay via credit cards or debit cards are also subject to fees from payment providers but are not assessed fees through the Treasurer’s office). Taxpayers paying using cryptocurrency are charged a transaction fee, network fee and miner fee. The miner fee will be displayed in the taxpayer’s wallet and not on OhioCrypto.com. The transaction fee will be 0% during an initial three-month introductory period, and after that time, it will be 1%. Fees are user fees and are not supplemented by state funds. According to the Treasurer's Office, ""The State of Ohio will not pay Bitpay or any other company fees for processing or other services relating to the acceptance of crypto.""It will be interesting to see if other state governments follow suit. A bill to accept bitcoin as payment for taxes was ultimately voted down, 264 to 74, by the New Hampshire legislature in 2016. A similar measure in Utah also failed to pass, while a bill to accept crypto for payments in Georgia stalled earlier this year. However, states are still trying: Arizona’s state legislature actually passed a crypto payment measure, but it was vetoed on May 16, 2018.The Internal Revenue Service (IRS) doesn’t currently accept cryptocurrency as payment either. By law, the IRS issues Regulations (interpretations of the tax code) and other guidance about the kinds of payment which can be used to pay taxes. The IRS has authorized payment by check, money order, credit card and debit card—but not by Bitcoin or other cryptocurrency. (You can find more ways to pay your IRS tax bill here.)"
