,press company,date,title,url,abstract,date detail,head article,main article
13,https://cryptonews.com/,"Dec 10, 2018",This Banking Giant Begins to Commercialize Blockchain ...,https://cryptonews.com/news/crypto-keen-s-korean-bank-in-blockchain-drive-3045.htm,"Cryptonews · News · Bitcoin NewsEthereum NewsAltcoin NewsBlockchain 
NewsPress ReleasesSponsoredIndustry TalkICO news · Exclusives.","
December 10, 2018
","One of South Korea’s largest banks, Shinhan has claimed it has started adopting blockchain technology “in earnest,” claiming that it has already provided some 400 employees with blockchain “education and consulting” and is already beginning to commercialize blockchain-powered services.","The bank claims that it began blockchain-powered Interest Rate Swap (IRS) transactions late last month – the first commercial service to be developed by the bank’s Blockchain Lab unit. The unit has also conducted talks with government and regulatory bodies with a view to potentially expanding its commercial blockchain operations into the foreign exchange and investment sectors.Shinhan is thought to be keen on exploring the potential uses of both blockchain technology and cryptocurrencies.Per media outlet Money Today, the bank has also struck a deal with Korbit, one of the country’s biggest cryptocurrency exchanges, which will allow new Korbit account holders to use real-name banking services for Korean won withdrawals. The bank had previously only allowed existing Korbit account holders to use such services. The government earlier this year issued guidelines that require banks in the country to only allow withdrawals to be made via real-name and social security number-verified accounts.Shinhan is also working on blockchain technology projects with KT, the South Korean telecom provider that claims it has developed one of the world’s fastest blockchain platforms. The bank  has previously expressed an interest in developing a network of ultra-safe cryptocurrency vaults, and struck deals with the likes of Ripple. Its credit card arm has agreed a deal with OmiseGo, an Ethereum-powered payment platform.Shinhan's global network:Elsewhere, market-leading exchange Bithumb has released a Beta version of a voting platform that will allow its users to vote on which cryptocurrencies it should list. The exchange says it will monitor the platform “24 hours a day to ensure fair voting,” will bar fraudulent tokens and will review all nominated coins to ensure they are above-board.Meanwhile, a South Korean blockchain startup is attempting to reverse the country’s blanket ban on all forms of initial coin offering (ICO) by appealing to the constitutional court, reports Segye Ilbo. The company, named Presto, is attempting to conduct a decentralized autonomous initial coin offering (DAICO), and hopes to convince the court of the ICO ban's nonfeasance.The government is yet to announce if it has changed its stance on the ICO ban following extensive pressure from business groups – despite promising it would do so by the end of November."
14,https://cryptonews.com/,"Dec 8, 2018",Can We Get a Bull Run for Christmas? No? But 20 Crypto ...,https://cryptonews.com/exclusives/can-we-get-a-bull-run-for-christmas-no-but-20-crypto-jokes-a-3040.htm,"You WILL get hit by a Christmas tree ornament, so watch out. Preparing to 
see your family, whom you told to buy bitcoin last year...#comedy #btc ...","
December 08, 2018
","December is here and everyone’s wishlist contains at least one coin they want to see spiking before the year is out. However, up until now, every day has been similar to opening a new window on the advent calendar to see which coin plummeted in the night. The markets run redder than Rudolph’s nose, and we’re running out of Christmas-related stuff to compare this situation to - and there’s still three weeks to go until the New Year.","This week, we’ve had the Faketoshi saga get a new spin, an Ethereum Classic dev team shutting down due to money issues, and Bitcoin seeing its second largest difficulty drop in mining. Crypto startups are now held to higher standards than ever, South Korea is suspecting illegal activities on local exchanges, and Binance has announced their own blockchain called the Binance Chain. Another 51% attack rocked the cryptoverse and they’re getting cheaper; but there is a chance that AI will be able to help with crypto fraud prevention. The week ends with yet another crash early on Friday - but let’s hope that not all is lost.So, have you been naughty or nice?___________This goes for any coin, really. Santa is sweating on the North Pole right now.__You WILL get hit by a Christmas tree ornament, so watch out.Preparing to see your family, whom you told to buy bitcoin last year...#comedy #btc #bitcoin pic.twitter.com/eD1Fc4GANa__To be fair, Santa does deliver whenever he can.__Reality is far less glamorous than we’d like to believe.__At least someone is happy.__If you don’t watch this until the end, you’re missing the faces, which will also fuel all your nightmares in the coming year.2018 was a very very SCARY year...  #bitcoin $btc pic.twitter.com/RGy2qkyvFC__The message is “together through thick and thin,” aka “together through 1k and 20k.” __When you’re down, remember, there is only one coin that is stable. 1 DOGE = 1 DOGE.__“Balance” is pretty subjective, though.__What the past few weeks felt like.__All the ways we fail the next generation…__The real pain is yet to come.__-insert any coin you dislike here-__You can actually insert practically an infinite amount of altcoins here and the meme still stands.__It’s funny, but with a caveat: this dude shilled Bitconnect and scammed people out of their money, so you might not want to take him seriously.__How a meet and greet on Crypto Twitter would turn out.CT Meet & Greet pic.twitter.com/l9bYshU2mx__It’s hilarious when it’s not happening to you.Checking Bitcoin price. pic.twitter.com/aUpJqHxWJl__Always look on the bright side of life!__You know, we’ll just leave this one here, nothing we say can be as funny as this is.__Ending this on a bright note - just keep this in mind!__"
15,https://cryptonews.com/,"Nov 20, 2018",Sony Just Approved Ethereum-based PS4 Game,https://cryptonews.com/news/sony-just-approved-ethereum-based-ps4-game-2955.htm,"Cryptonews · News · Bitcoin NewsEthereum NewsAltcoin NewsBlockchain 
NewsPress ReleasesSponsoredIndustry TalkICO news · Exclusives.","
November 20, 2018
","Plague Hunters, the blockchain-based video game, has reportedly been approved by Japanese tech giant Sony and it’s coming to the PlayStation 4, a video game console, soon. This is the first Ethereum blockchain-based game that has gone through Sony’s rigid process of approval.","Plague Hunters, the sequel to its forefather, the successful Plague Road, is developed by Arcade Distillery, a New York-based video game maker. Arcade Distillery is expected to release the game in Q1 2019.The game teaser:The game will use the freemium model, so it will be free to play with a chance for players to purchase in-game items. For this, Plague Hunters will have a built-in peer-to-peer (P2P) marketplace powered by the Ethereum blockchain. Players can use the marketplace to exchange their items with each other with having full ownership of the assets. The in-game assets will be non-fungible tokens, which you may know from CryptoKitties.Despite that the marketplace will be built on the Ethereum blockchain, Plague Hunter will not feature blockchain-based gameplay. Instead, the gameplay was designed for the PS4 and Nintendo Switch, a gaming console, with Arcade Distillery exploring options to release the game for Xbox One and smartphones.While the gameplay will be very similar to non-blockchain based games, users in Plague Hunter’s ecosystem will have full ownership of every asset they receive, collect, or buy, as well as the scarcity of the in-game items will have provable scarcity. Basing a video game on the blockchain is a creative way to introduce new people to cryptocurrencies as well as to attract crypto enthusiasts into blockchain gaming. But Plague Hunter is not the only blockchain-based game that’s to be released. Earlier in November, the Coinbase-backed card game Gods Unchained released its gameplay trailer. The game - which was inspired by popular titles like Magic: the Gathering and Hearthstone - will also feature blockchain-based assets, but the gameplay will happen on the creator's, Fuel Games’ servers.Gods Unchained is soon going into private beta for stress testing the game, and in three months, the game’s open beta will be released with the full launch coming thereafter."
16,https://cryptonews.com/,"Dec 9, 2018",Get Inspired by These 20 Crypto Christmas Gift Ideas,https://cryptonews.com/exclusives/get-inspired-by-these-20-crypto-christmas-gift-ideas-2981.htm,"The Casa node is a fool proof plug-n-play Bitcoin full node and Lightning 
node, combined. Simply plug it in, sync up the blockchain and you ...","
December 09, 2018
","Christmas is drawing ever nearer, and figuring out what to buy as a present is never an easy task. Buying something crypto-related for your enthusiast friend - or yourself - is an obvious choice, but what to choose? Where to find it? Cryptonews.com assembled a list of great Christmas gift ideas to help you pick.","(Found this article in 2019? Checkout our new list of crypto gifts for 2019.)
______Well, it's not a very original idea, but is definitely worth to remember. A hardware wallet is a special type of cryptocurrency wallet which stores the user's private keys in a hardware device. Hardware wallets promise enhanced security against software wallets in the case of theft or scams. If you hold cryptocurrencies, it is only logical that you would want to protect them and keep them safe until you want to spend them, or HODL until the next bull run.There are three wallets that are among the most popular ones:__A Faraday bag shields all electronic devices (like tablets, phones, HD Wallets, thumb drives, smart watches and keyfobs) from all radio frequency signals (BT, WIFI, RFID, GPS, Keyfob) and protects your electronics from EMP blasts from the likes of solar flares or malicious attacks.
You can use one to keep your phone, tablet, hardware wallet or anything similar safe in it. Their price range can be anything between USD 20 and USD 100, depending on what you need and what size it is. It’s definitely something you rarely hear about!
__The Casa node is a fool proof plug-n-play Bitcoin full node and Lightning node, combined. Simply plug it in, sync up the blockchain and you should be ready to make lightning payments in no time! They are plug and play, pre-synced, and easy to set up and use. Make and receive Lightning payments, no coding required.Although it is a bit pricey - around USD 300 - it is a great gift for anyone who wants to experiment with Bitcoin transactions. You can find the Casa node review here.__This is about as tech a gift you can get for someone at the holidays, but it doesn't need to be so scary even for those who don't have  strong technical know-how. For example, in November, Coinmine, a Coinbase, among other investors, backed crypto tech startup, introduced Coinmine One, a USD 799 device capable of mining cryptocurrencies. However, the company stressed “this is not just a miner, but a general purpose crypto device that just happens to include a GPU [graphics processing unit] miner” and “what you buy today will not be what you have in the future.” In either case, mining cryptocurrencies with this device is not profitable business in the current market. Hopefully, next Christmas this good looking crypto box will bring more value to its owners. __Regardless of whether it’s by HTC, or Sirin Labs, a blockchain phone can act as a cold storage wallet, with increased security and specific features based on blockchain technology. As a gift to a crypto and blockchain aficionado, it’s probably perfect - from storing their crypto on it, over following prices on integrated dapps, to paying with crypto through your phone, these gadgets seem as good as it gets.Still, be prepared to cash out around USD 1,000 regardless of which of these phones you choose - Exodus or Finney - and also be prepared for your present to be late for Christmas, as most of them are expected to be delivered around New Year or later. Next year, Pundi X's XPhone might joint the gift list, also, as the company aims to start shipping it in Q2 of 2019.__For those with a sense of humor and without much money to spare, a blockchain keychain could be the perfect gift. Not only does it take blockchain completely literally, it’s also a great conversation piece - all your friends will be so impressed once you start explaining what blocks and hashes are and how SHA256 works.The keychain costs USD 12 and is available on Etsy (last time we checked.) __Crypto-related art can bring a decentralized air into any room - if that’s what you want. So if you’d like to show your cypherpunk colors (or any others), why not gift someone a painting? You both get to show off, it’s another conversation piece, and people visiting immediately know what the main topic of conversation will be.For example, this picture starts at around USD 44 and its price increases with the dimensions you want. It’s available on Etsy.__Sometimes, your friend has a long day and just needs to kick back and relax. Whether with Glenfiddich or apple juice doesn’t matter, but this decanter with two glasses can help him remember to check the prices of crypto. And maybe pour himself another one. You can find the set on Amazon for USD 68. 
__Do you have a friend that would actually like crypto if they knew more about it? Gift them a cryptocurrency course! You will have someone to share your pain when checking prices in no time. From the basics to investing in initial coin offerings (ICOs), you can learn anything online for a small price.Starting at around USD 10 on Udemy and going up to around USD 100 each on edX, these courses can be the starting point your friend needs to join the cryptoverse.__Let’s be real, is it truly Christmas without an ugly Christmas sweater? Our personal favorite is this one, which says “Ho Ho HODL” - a sentiment many wholeheartedly agree with. It’s available on Etsy for around USD 30, with a choice of color and a few equally interesting ones related to crypto from the same seller.__Is someone you know having a baby? Are you having one? Even if you just want to buy it for yourself and keep it for any potential offspring, this onesie is a great choice for a humblebrag. It’s also a conversation starter - for example, all your relatives are going to ask “what’s crypto?” as soon as they see it. Available on Zazzle for around USD 14.__Is your friend a little bit too obsessed with the safety of their crypto? Give them another layer of protection with a Bitcoin vault. Best used for storing your paper wallet - or any other valuable paper - it features a 5 letter combination lock, where you must spell the correct secret word or combination to open the chamber. Available on Amazon for USD 52 plus shipping.__If you have a friend or family member that’s in it for the technology, getting them something to constantly remind them of this is probably a good idea. You can either design and print your own (DIY presents are great!) or order one online. There is one available at BTCPoster.com for USD 79.__These pens, announced in April this year, are what every classy person needs and the perfect gift if you have a lot of money to spare. And we do mean a lot. The absolute least you will pay for one is EUR 1,250, which comes to around USD 1,420. At least they offer free shipping. Can be found on the official Ancora1919 website.__If the price of the pen left you gasping for air, maybe a mug of coffee will help. This one changes color when hot liquid is poured in to an image of the Bitcoin genesis block. It’s available on BitcoinShirt.co for USD 17.90, but can also be paid for in Bitcoin.__Getting your own tiny little kitty on the blockchain would be pretty cool, wouldn’t it? If you have some Ether, you can buy a CryptoKitty in the Marketplace, with a wide range of prices. Once you have it, you also get the option to gift it to someone! CryptoKitties can also probably help you figure out how genetics works, so you can always consider it a learning prop if you need to explain yourself to anyone.__Does your friend already own a CryptoKitty? Do they already have a favorite? Turn that kitten into a physical representation as a personalized gift! Available at this Etsy store, you can send this person the picture of the kitty you want and get a needle felted cat for USD 28.__While we’re still on the topic of cats, there’s a Japanese-style figurine called the maneki-neko (translating to “beckoning cat”) - a talisman of a cat with one raised paw which is often believed to bring good luck to the owner. When shopping in the volatile crypto market, good luck is exactly what you need, as well as a way to save up some money. That’s why you can buy a crypto cat that doubles as a bank for you to keep fiat in it. Available on Etsy for USD 19.__Another not very original idea, but need we say anything more? After all, isn’t this what most crypto fans want? Since the market is plummeting and a Lambo never seemed farther away, buying one for your loved ones would be a good deed. But then again, if you can afford to fork out over USD 200,000 for the cheapest version available, won’t you buy one for us too?
___Perhaps the most obvious answer of all, a great present for anyone in crypto would be - more crypto. Simply sending them any amount of cryptocurrency (as usual, you need to do your own research which coin to choose) takes care of the present and is a great choice for anyone, veterans and newbies alike. This is like the old-fashioned cash gift, except we’re moving to crypto now. Best part? You can spend as much as you choose to. Also, paper wallets like this might help here.__"
17,https://cryptonews.com/,"Dec 11, 2018",A New Wave of Attacks on Ethereum Mining Rigs,https://cryptonews.com/news/a-new-wave-of-attacks-on-ethereum-mining-rigs-3055.htm,"Cryptonews · News · Bitcoin NewsEthereum NewsAltcoin NewsBlockchain 
NewsPress ReleasesSponsoredIndustry TalkICO news · Exclusives.","
December 11, 2018
","Another massive campaign targeting Ethereum mining rigs has been going on for at least a week, since December 3rd, ZDNet reported, citing Troy Mursch, co-founder of Bad Packets LLC, a cybersecurity company. Attackers are scanning for devices with port 8545 exposed online - which has cost careless miners more than USD 20 million back in June this year, when the same thing happened.","The port 8545 is standard for the JSON-RPC interface of many Ethereum wallets and mining equipment. Some Ethereum software applications can be configured to expose a Remote Procedure Call (RPC), the purpose of which is to provide access to programmatic API (application programming interface) that an approved third-party service or app can query and interact or retrieve data from the original Ethereum-based service. The RPC interface can also grant access to very sensitive functions, like private keys, personal details and similar.In theory, the interface should be only exposed locally, but some wallet apps and mining equipment enable it on all interfaces. Furthermore, this JSON-RPC interface, when enabled, also does not come with a password in default configurations and relies on users setting one. If this stays exposed on the internet, attackers can freely move funds from the victim’s address to their own.here as well, 1st wave seen around 4pm UTC pic.twitter.com/i5dXEohYI0Many mining rig vendors and wallet app makers have taken precautions to limit port 8545 exposure, or have removed the JSON-RPC interface altogether. The Ethereum team sent out a security advisory to all Ethereum users about the dangers of using mining equipment and Ethereum software that exposes this API interface over the Internet, recommending that users take precautions by either adding a password on the interface, or using a firewall to filter incoming traffic for port 8545.To showcase the vulnerability of many miners, ZDNet writes that, “A quick Shodan [search engine for Internet-connected devices] search shows that nearly 4,700 devices --most of which are Geth mining equipment and Parity wallets-- are currently exposing their 8545 port.” Even though the price of the asset is reaching new lows, standing at around USD 90 as of the time of writing, this has not deterred attackers from looking for easy pickings. As previously reported, protecting yourself from these attacks does not have to be very difficult. Tinkering with your Ethereum client should be off-limits unless you’re certain you know what you’re doing, and reading the warning notices that come with the app you’re using should be your first step. Of course, if you have a good reason to enable the RPC interface, secure it by an access control list (ACL), a firewall, or other authentication systems."
18,https://cryptonews.com/,"Dec 1, 2018",Not for the Grumpy Ones: Another Collection of 20 Crypto Jokes,https://cryptonews.com/exclusives/not-for-the-grumpy-ones-another-collection-of-20-crypto-joke-3007.htm,"Follow up with your own. Our personal favorite is “some people even use 
their GPUs for gaming.” Or - ""It is so bad, people no longer think 
#Bitcoin ...","
December 01, 2018
","November is gone and down in history as a month that brought huge losses to crypto markets. And while many of us wanted the market to show some change, I think I speak for everyone when I say we were hoping for a bull run and not this. Still, what we got instead was unity through desperation, a lot of panicking and theorizing on whether the market is capitulating - the exact opposite of what we wanted. So what we still got left is millennial humor that gets very self-deprecating, very fast. That’s what we’re here for.","We started off this week with Ohio saying yes to crypto tax payments, Overstock share price pumping through old news, and the community offering to help Buterin. Bitcoin SV made a big entrance, a weakness has been discovered in a Bitcoin wallet, and Sirin Labs launched their blockchain phone. The week ends with a big crackdown on those in the crypto world not always following the letter of the law.While many are waiting for the bull run of 2018 that still has some time to appear magically, we can dive right in.______________This whole thread is hilarious. Follow up with your own. Our personal favorite is “some people even use their GPUs for gaming.” Or - ""It is so bad, people no longer think #Bitcoin is a Ponzi scheme"" and ""People have become so desperate, that they start to build something BEFORE they make the ICO presentation."" The #cryptocurrency bear market is so bad, not even Chuck Norris checks his portfolio anymore. https://t.co/PEua9JPvUM__Are you in the mood for some blues? This is the song for you.__Want more music? We got you covered.__And this is what we have been telling ourselves since the market crashed.__An inspirational story for all you HODLers out there.__Some people just want you to hate them, or at least envy them.__Be nice to people around you!__Art has come a long way in recent history.__Then, there are those who understand.__All our hopes go towards this type of 2019.__There’s always hope that it’s a gravitational slingshot to Mars or something.__It’s the simplest way to explain scaling, really.__Is this loss?__The only way to truly make a difference in the market.Sign this petition and make your voice heard: https://t.co/s84rLgZscI #MakeDipsIllegal__Then, there’s the option that 2019 might look like this.__It’s been… difficult, to say the least.__Even Freddie is feeling the pain.__What the ride really felt like.__There are many mysteries in the universe, and BTC price drop is one of the biggest ones.__
Don’t you wish your holiday talks about what you do went like this?"
