,press company,date,title,url,abstract,date detail,head article,main article
19,https://cryptonews.com/,"Nov 22, 2018","Exclusive: ""There Is an Organized Campaign Against Us ...",https://cryptonews.com/exclusives/exclusive-there-is-an-organized-campaign-against-us-says-tet-2961.htm,"... they've recently homed in on suspicions that a tangled web involving 
bitcoin, Tether and crypto exchange Bitfinex might have been used to ...","
November 22, 2018
","Media reports about Bahamas-based Deltec Bank accepting suspicious transactions is part of an “organized campaign” against their customer Tether, Leonardo Real, Chief Compliance Officer (CCO) at Tether, the most popular stablecoin, told Cryptonews.com, without specifying who's behind this campaign. ","According to him, this is all “misinformation” designed to hurt Tether itself, after they unveiled their account with the bank, claiming that they can back their USDT coins one on one thanks to those holdings.Cryptonews.com talked to the CCO about these and many other issues that the stablecoin has run into and how that affected their business.Cryptonews.com: According to Bloomberg, while federal prosecutors opened a broad criminal probe into cryptocurrencies months ago, they’ve recently homed in on suspicions that a tangled web involving bitcoin, Tether and crypto exchange Bitfinex might have been used to illegally move prices. What’s your comment on this?Leonardo Real: We stand by the fact that all outstanding USDT are backed 1-to-1 by fiat USD. This has been confirmed on numerous occasions, by unrelated parties and at unconnected points in time. The story put forth by Bloomberg cites an unbacked, independent study which claims that, if USDT were to be unbacked (i.e. supply-driven and “pushed"" onto traders as opposed to “pulled” via organic demand) it could indicate manipulation of the Bitcoin price. The entire study relies on the assumption that USDT is unbacked and therefore not sufficiently driven by trader demand. This is flawed, and claims which suggest that USDT transactions aren’t driven by demand when it is consistently in the top 2 of traded cryptocurrencies in the space with regards to volume, are simply ridiculous by now. To reiterate, the accusation against Tether is based around the assumption that outstanding USDTs are unbacked - something which has been proven false time and time again. The story is a clear example of technological innovation moving too quick for mainstream journalists to learn, understand and analyze developments in a certain space.The Deltec bank account case was the latest in a string of those where people don’t believe you that you hold the assets to back your stablecoin. What’s your next step? How will you prove to your customers that their trust in you is not misplaced? Will you finally say yes to an official audit?We have clearly demonstrated to all parties that we have the funds we say we have at various points. We released the consulting report from Friedman LLP [a New York City-based accounting, tax and business consulting] firm last year. We had Freeh Sporkin & Sullivan [a Washington-based law firm] investigate our balances in June 2018. We published a letter from Deltec bank this month. The only people who don't believe that we have the funds are people that refuse to acknowledge the facts, presumably for their own reasons. We have never said no to an audit or refused to engage in this process, but the accounting industry continues to grapple with and have difficulty providing assurance services in the cryptocurrency space. As and when they are ready to help, we hope to be able to engage with them.According to media reports, your bank, Deltec, is suspected to be accepting suspicious transactions, such as laundered funds, as well as being named in two global bribery cases. What’s your comment on this? How does this affect your business with them? Will this cast a shadow on your own trustworthiness?This is more misinformation that is now targeting our bankers as part of an organized campaign against us. We are proud to be working with Deltec. Their compliance and operational standards are second to none. Their compliance functions have not been compromised and they are not involved in any case that could cast doubt on their integrity. Deltec has done nothing wrong in any of the allegations made against it of which we are aware.How does the community’s skepticism affect you? Have you noticed drops in your transaction volumes?Not at all. In fact, we continue to be a leader in transaction volume. We are proud to offer a service that focuses on our customers' needs, and we believe that this focus has been a key to our success.What caused the steep price drop of USDT on October 15?We do not comment on the price of USDT on other platforms. Tether continues to maintain a 1:1 peg. USDTs are always valued at USD 1.The community is currently outraged about the fact that you, as well as some other stablecoins, retain the right to refuse service to whoever you want to, calling it centralized and against cryptocurrency politics. What’s your comment on this? Is this a necessary tradeoff in the case of stablecoins? Are there ways to keep both users and regulators happy?We must maintain the right to refuse service to bad actors and those who are in breach of our terms of service. This is a legal requirement, but even if it were not, we would want to do it to prevent our platform from being exploited by those trying to harm others.Do the recent troubles Bitfinex has been having (fiat withdrawals especially) affect Tether in any way? How is Bitfinex’s fiat withdrawal fee increase affecting Tether? Is the lack of trust in Bitfinex translating to Tether, and vice versa? What about Bitfinex insolvency rumors? Demand for Tether remains steady and strong. It is the dominant stablecoin in the space because it is useful to people transacting business among exchanges.There have been several social media cleanses, most notably one where every post in the r/Tether subreddit (on popular social network Reddit) has been deleted. Why? Spam? Bots? Something else?We have set our subreddit spam filters to high on both /r/Bitfinex and /r/Tether to control a coordinated wave of unsubstantiated, ill-researched and, at times dangerous claims (e.g. leaking of private employee information), which made their way to our subreddits. It is publicly verifiable that we actively address all support inquiries, issues, concerns and complaints across the Bitfinex subreddit and that we have never taken the steps to conceal any potential customer concerns. Our community managers and support agents are active across both Reddit and Telegram should users or industry followers wish to discuss certain industry developments taking place.Are other stablecoins competing with Tether? Do you see your stablecoin being overtaken by new ones as the biggest stablecoin? Who do you see as your biggest competitor currently?There are a number of stablecoin alternatives, and all try to offer something in the space. Tether's main competitor may have not yet emerged."
20,https://cryptonews.com/,"Dec 12, 2018","TenX PAY Beats the Market, Surges on News",https://cryptonews.com/news/tenx-pay-beats-the-market-surges-on-news-3058.htm,"The card makes cryptocurrencies instantly spendable, allowing users to 
spend Bitcoin, Litecoin and Ethereum in the real world, at real time and ...","
December 12, 2018
","Second only to DEX, which has soared in price in recent days, the TenX PAY token stands out as a shining star in an otherwise red crypto market this week as the Singapore-based crypto payment company is estimated to finally deliver on their promises.","PAY was up by 18% on Wednesday morning before trimming its gains to 10% (UTC 07:10 AM) and is still up by more than 8% in a week. However, it is down by 95% from its all-time high a year ago.PAY price chart: So, what exactly is it that has been driving the recent bullishness in this token? The answer may be found in the company’s 2018 OKR (Objectives and Key Results) Update published on December 11. Judging from this, the company may be set to start rolling out their much-anticipated payment cards right around Christmas this year, with KYC (know your customer) checks for the first batch of customers starting today, December 12. The news was reported by Cryptonews.com in November. “The Singapore launch will be followed by releases in several countries across the Asia Pacific region. The card makes cryptocurrencies instantly spendable, allowing users to spend Bitcoin, Litecoin and Ethereum in the real world, at real time and is accepted at over 42 million points globally. The release of TenX Cards in Europe is scheduled to follow in 2019,” a TenX spokesperson told Cryptonews.com back then.In addition to the card roll-out, the company is also introducing a new “reward token” known as TenX Token, which is intended to “reward” loyal PAY holders.Julian Hosp, co-founder of the company that was among top 10 initial coin offerings (ICOs) in 2017 by raised capital (USD 80 million), discussed the news during a livestream on Tuesday:Despite the promises by the company, some members of the community are still not convinced, following a period of delays and set-backs regarding TenX’s product launches:>Europe later next year.lolyeah... I'm not holding my breath pic.twitter.com/67HIV2Ey9BHowever, judging from the PAY price jump, the market is more positive regarding the news."
21,https://cryptonews.com/,"Nov 20, 2018",TransferWise Still Not Convinced by Ripple,https://cryptonews.com/news/transferwise-still-not-convinced-by-ripple-2952.htm,"Cryptonews · News · Bitcoin NewsEthereum NewsAltcoin NewsBlockchain 
NewsPress ReleasesSponsoredIndustry TalkICO news · Exclusives.","
November 20, 2018
","The UK-based money transfer service TransferWise says they’ll start looking into blockchain-based solutions when more banks start using Ripple - in spite of Ripple scoring significant victories lately by signing up PNC Bank and Santander, among others.","Speaking on the latest episode of Fortune’s “Balancing the Ledger,” Taavet Hinrikus, co-founder and chairman of TransferWise, said, “If every bank in the world was going through the Ripple network, it would be amazing. Yet how many banks are using Ripple today in production? It’s a very short list. In that sense we’re big supporters of Ripple or anything else… and if any of these gets enough adoption, and it actually materially helps us do things cheaper and faster, we’d love to, but so far we haven’t found one.”TransferWise claims it has more than 4 million customers and is moving ""over GBP 3 billion every month globally, saving people GBP 80 million in hidden charges."" It is available in 71 countries covering over 1,300 currency routes.Ripple, meanwhile, keeps adding victories to their books. From signing up three new companies - Mercury FX, Cuallix, and Catalyst Corporate Federal Credit Union - over remittance operator TransferGo implementing Ripple’s xCurrent product for cross-border payments (which is not using XRP), to its XRP coin taking second place by market cap and staying there, the company is seeing wider adoption than many other blockchain-based solutions. TransferWise, meanwhile, thinks it prudent to wait until Ripple is even more widely adopted, to make blockchain more efficient than the prevailing payments systems in banks.TransferWise is not the only company that remains unconvinced. Back in June this year, Western Union, an American money transfer giant, said they had not seen a benefit from Ripple’s technology during a six-month trial period. The company’s CEO, Hikmet Ersek, told Fortune, “We are always criticized that Western Union is not cost-efficient, blah blah blah, but we did not see that part of the efficiency yet during our tests. The practical matter is it’s still too expensive.”Meanwhile, TransferGo claims it has 700,000 customers across 47 destinations worldwide and completes 1.5 million transactions per year and has implemented xCurrent for their cross-border payments. Back in October, the CEO, Daumantas Dvilinskas, said he had his sights on growing the company’s customer base from one million to one hundred million and for this, he says that TransferGo’s partnership with Ripple will be key."
22,https://cryptonews.com/,"Dec 12, 2018",Kraken Joins Exchanges Looking for Big Money Investments,https://cryptonews.com/news/kraken-joins-exchanges-looking-for-big-money-investments-3060.htm,"Cryptonews · News · Bitcoin NewsEthereum NewsAltcoin NewsBlockchain 
NewsPress ReleasesSponsoredIndustry TalkICO news · Exclusives.","
December 12, 2018
","Kraken, a popular crypto exchange, is considering a private offering as it looks to raise capital for possible acquisitions. Such a move would be in line with the decision of many other exchanges like Coinbase, Bitstamp, Bithumb, Poloniex, all of which have received big investments from traditional venture capital (VC) and investment firms.","The report by Finance Magnates claims that Kraken’s team has sent out emails to select high-value clients asking them for input. The email states that to receive more information about the offering, customers are invited to fill out an online survey. Although they claim they’re not in need of financing, they consider the current bear market and the company’s “significant reserves” as opportunities for acquisitions. Kraken would be looking at targets that would have strong ""synergies with their existing product/service offerings, and with great teams,"" CEO Jesse Powell told CoinDesk. Kraken has already purchased companies such as Coinsetter, CAVirtex, CleverCoin and Cryptowatch. The company also adds that its valuation that’s listed for sale is USD 4 billion, with a minimum investment size of USD 100,000. Kraken is also going to be evaluating each prospective investor for eligibility to be a part of the share offering, according to the report. The customers which received the email have until the 16th of December to respond to the survey. The company also adds that more details will be available in the near future. Interesting, got this in the mail this morning.If Coinbase is worth $8b, I guess Kraken coming in at $4b seems fair...?War chests for the bear market..Could we get some more ShitCoins to short @krakenfx 🤔 pic.twitter.com/DLkCfxlkZ4At the time of writing, the 24 hour trading volume at Kraken stands at almost USD 83 million. Top 10 markets at Kraken:The influx of “big money” into the cryptocurrency space, most notably in the case of exchanges, has had the community wondering whether businesses will eventually push the small players and retail investors out of the game. Still, many argue that this is a necessary move in the further development of the industry. Back in November, CEO and co-founder of the Swiss-based loyalty platform qiibeetold Cryptonews.com, “No, I don’t believe this is something we need to be concerned about. If anything, this is an opportunity for HODLers and traditional investors to work together within the cryptosphere to achieve mainstream adoption.”In October, Coinbase announced that it is officially valued at USD 8 billion, following a mega funding round led by Tiger Global Management and infusing the company with USD 300 million to accelerate its global expansion. Lou Kerner, a partner at CryptoOracle, an advisory and investment firm, explained to Cryptonews.com, “[O]ver time, as the new technology matures, as more investors understand the potential for disruption and wealth creation, more traditional investors start investing. So traditional financial sources investing in crypto, and crypto exchanges, is just signs of a maturing industry.”"
23,https://cryptonews.com/,"Nov 28, 2018","Venezuela's Crypto Tourism Bid, Paraguay OKs Huge Mining ...",https://cryptonews.com/news/venezuela-s-crypto-tourism-bid-paraguay-oks-huge-mining-proj-2988.htm,"... “particularly” what Maduro called “global cryptocurrencies” – 
presumably widely accepted digital tokens such as Bitcoin, Litecoin and the 
like.","
November 28, 2018
",Venezuelan president Nicolás Maduro has announced beach-loving tourists to the country will now be able to settle their bills in cryptocurrencies.,"State media quotes Maduro as stating that the ruling applies only to certain “economic zones,” including tourist hotspots including beaches in the northern state of Falcón, the Margarita and La Tortuga islands, and the Archipelago de Los Roques.Maduro stated that the national currency, the bolivar, would no longer be accepted in these areas, and that “all services provided, from plane fares to hotels, boat trips, food and souvenirs"" would be obliged to process payment either in conventional international fiats or “particularly” what Maduro called “global cryptocurrencies” – presumably widely accepted digital tokens such as Bitcoin, Litecoin and the like.Total contribution of travel and tourism to GDP of Venezuela:Venezuela’s economic crisis continues to deepen, with hyperinflation driving down the value of the bolivar. The government has attempted to fight back by issuing a state-backed cryptocurrency, the Petro, backed by its oil reserves. Demand for Venezuelan oil has fallen dramatically in recent years, causing financial mayhem in a country that gains most of its income from crude exports.Elsewhere in Latin America, while Chinese and Russian miners are reportedly shutting down their rigs en masse, the government of Paraguay is bucking the trend by green-lighting to what will become “the world’s largest mining farm in terms of area,” per the International Business Times.The new facility, being built in conjunction with a South Korean initiative, will cover 50,000sqm of land adjacent to the Itaipu Hydroelectric Dam. The power plant increased its capacity to 103 TWh in 2017. Paraguay is known to have an energy surplus, exporting some 90% of the power it produces to Latin American and Oceanic nations. Some 70% of Paraguay’s energy is generated at hydroelectric plants."
24,https://cryptonews.com/,"Nov 24, 2018",Black Friday Market Sale: Price Drops and 20 Crypto Jokes,https://cryptonews.com/exclusives/black-friday-market-sale-price-drops-and-20-crypto-jokes-2969.htm,"When Bitcoin is determined to get to the bottom. Black Friday Market Sale: 
Price Drops and 20 Crypto Jokes 102. __. Did you know that all the ...","
November 24, 2018
","With Thanksgiving barely behind us, it’s time to remember the turkey one last time and being thankful that the market has not capitulated yet, in spite of Black Friday sales. So while you’re taking the chance to grab some of those coins at incredible prices - and maybe prepare some Christmas gifts, who knows - we’re hoping that the Christmas season will bring a jolly bull market. Don’t forget to ask for “lambo” or “moon” when writing your letter to Santa.","At the beginning of this week, Ripple was securing their position in the market, Tom Lee still remains bullish - although not as much as usual - and the Swiss stock exchange announced support for a crypto ETP. Then, the market crashed - again - the Thai central bank wants centralized crypto, and things will supposedly get worse before they start getting better. We end the week with claims that someone is ""organizing a campaign against Tether"" and that miners are feeling growing pressure to sell their coins.Let’s dig in like it’s turkey, mashed potatoes and gravy! Or mashed potatoes, only (in case you're a vegetarian or hodler.)_________________Just. It's so sad, that it's funny (maybe.)__“Do you think they’ve even heard of the 46th dip?” or, alternatively, “Legolas, what do your elf eyes see? Is it another bear?”__When Bitcoin is determined to get to the bottom.__Did you know that all the pools on the Titanic are still filled with water? Not everything is destroyed when it sinks.__Is it turtles all the way down? No. It’s corrections all the way down.__This is the only way you should be looking at the current dip. Also, this is the only way you should revive this dead meme.__A short poem in the style of Dr. Seuss. Regardless, you probably shouldn’t read this to your kids.__What it feels like being in crypto in 2018…__If you missed the FOMO train in 2017, here’s why you probably shouldn’t feel bad about it.One year in crypto - a short story. pic.twitter.com/IPtQDK5vAB__Halloween may be over, but real life horrors are not.__“My name is Pepe and I have a problem.”__You may think you’ve seen all possible versions of bank robberies, but you haven’t seen this one yet.__YES! When respectable companies like Bitconnect were going down, their CEO came out to say everything is going to be alright. When is this Nakamoto guy going to do the same?!__This may or may not be aimed at anyone in particular.__How the BCH fork war looks to outsiders.__Couldn’t have said it better myself.__The constant struggle of choosing to do the right thing…__Especially after you’ve seen the ATH in December 2017 and subsequent bloodbaths throughout 2018.__Wait, what?__“Come right in, there’s support bro.”__"
25,https://cryptonews.com/,"Nov 29, 2018",ICOs that Deliver: The Case of Sirin Labs' Finney Phone,https://cryptonews.com/news/icos-that-deliver-the-case-of-sirin-labs-finney-phone-3000.htm,"Finney is a smartphone, named after Hal Finney, the second ever user of 
Bitcoin (after Satoshi Nakamoto,) with an operating system (OS) ...","
November 29, 2018
","Switzerland-based Sirin Labs was the fourth largest initial coin offering (ICO) of 2017, having raised USD 157.8 million, and they’re finally delivering their product in the shape of a blockchain phone named Finney. ","Many ICOs from last year flopped, and the top five ones saw their token price tumbling. However, it now looks like Sirin might be back in the race, as their coin (SRN) is up by around 18% in the past 24 hours (UTC 7:00 PM) - and the phone has been launched at an event in Barcelona today.SRN price chart:Finney is a smartphone, named after Hal Finney, the second ever user of Bitcoin (after Satoshi Nakamoto,) with an operating system (OS) based on blockchain, called SIRIN OS. It features a cold storage wallet, a special operating system and an additional screen called the Safe Screen, as well as increased security. Technological specifications of the phone have been published at the beginning of this month, and the phone does not lack any other, more common specifications either, boasting:The phone was initially announced in September 2017, and the company signed on football superstar Lionel Messi as its brand ambassador in December 2017, followed by raising USD 157.8 million in the fourth largest ICO of the year. More news followed in April this year, when FIH Mobile, a subsidiary of electronics company Foxconn, was chosen to manufacture it. Notably, FIH are also makers of the iPhone phone, Xbox video game console and Kindle e-reader.Its two main competitors are the HTC Exodus (available for pre-order) and Pundi X XPhone (to be launched in Q2 of 2019). Although they share many of the same basic specifications, Exodus does have a better main camera at 16 MPX. The XPhone, which has it's own blockchain-based operating system, does not have any of its attributes currently listed other than 64 GB of internal storage and 6 GB RAM, which they say is the “minimum specs requirement.” However, the phone’s website adds that, “This is a working prototype hence the final product will be different.”As for differences in the way they work, all three use operating systems based on Android in some way or other, with the main difference being that Exodus runs Android and another, micro operating system running parallel with it for added security. All three should be able to run dapps (decentralized applications), as well as offer dapp marketplaces, and should be able to double as cold storage wallets. Finney differs from its competitors by offering a Safe Screen, which they consider its strongest feature. It operates as the gateway to the crypto world by activating the cold storage wallet, and it has a separate power switch for users to access it relatively independently. The phone also offers its Token Conversion Service (TCS) which enables users to make crypto transactions for supported coins and tokens (at launch - BTC, ETH, and SRN.)Finney can currently be pre-ordered through Sirin Labs website and paid for with SRN tokens with a discount of 10%, and should be available through the Amazon Launchpad program from January. Its price stands at USD 999. Later on, the phone is set to be available for purchase through additional channels of payments, including credit card. The company will also open two flagship concept stores first in London in December 2018, and later in Tokyo in January 2019, where the phone will be physically sold. The store on London is also set to become a “blockchain academy for our community and any blockchain-curious audience.” 
____
Finney introduction by Sirin Labs:"
