,press company,date,title,url,abstract,date detail,head article,main article
59,https://www.tokenpost.kr/,,'아동 성 착취 영상' 구매에 암호화폐 활용 급증…2년새 212% 증가,https://www.tokenpost.kr/article-32908,"21일(현지시간) 블록체인 분석업체 체이널리시스는 발표한 자료에서 지난해 아동 성 착취 영상 구매에 지불된 비트코인(BTC)과 
이더리움(ETH) ...","<p class=""viewInfoTime"">2020-04-22 수 17:05</p>",아동 성 착취 영상을 구매하는데 활용된 암호화폐 결제액이 해마다 증가하고 있는 것으로 조사됐다.,"21일(현지시간) 블록체인 분석업체 체이널리시스는 발표한 자료에서 지난해 아동 성 착취 영상 구매에 지불된 비트코인(BTC)과 이더리움(ETH) 규모가 93만 달러(약 11억 5천만원)에 달한다고 밝혔다.아동 성착취 영상을 구매하는데 활용된 암호화폐 결제액 규모는 해마다 증가하고 있다. 지난해 결제액은 2018년 대비 32% 증가한 액수로, 2017년보다는 무려 212%나 증가했다.이와 관련해 체이널리시스는 ""암호화폐가 아동 성 착취 영상물 결제에 사용되는 비중이 지속적으로 증가하고 있다""면서 ""이는 아동 성 착취 영상물에 대한 수요의 증가라기 보다는 암호화폐 채택 증가로 인한 가능성이 높다""고 분석했다.이어 ""93만 달러라는 액수는 암호화폐 시장 규모에 비해 작은 수준""이라면서도 ""이러한 성 착취 범죄에 암호화폐가 활용된다는 점은 업계가 우려해야 한다""고 지적했다.불법 영상물 결제에 대한 암호화폐 결제 비중이 높아진 데에는 당국의 추적을 어렵게 만들겠다는 구매자들의 계산이 깔려있는 것으로 해석된다.실제로 국내에서 텔레그램 '박사방'을 만들어 성 착취 영상을 유통한 운영자 조주빈은 입장료 명목으로 암호화폐를 받은 것으로 드러났다. 특히 거래 내역 추적이 어렵다고 알려진 다크코인 '모네로(XMR)'를 통한 결제를 구매자들에게 권유한 것으로 알려졌다.하지만 체이널리시스에 따르면, 이러한 결제의 대부분이 암호화폐 거래소를 통해 이뤄지고 있어 블록체인을 통해 추적이 가능하다.업체는 ""대부분의 결제 금액이 암호화폐 거래소를 통해 유입된 것으로 나타났다""면서 ""특정 시간대, 특정 액수의 거래로 추적 범위를 좁히면 많은 패턴을 식별할 수 있고, 범죄자들의 신원과 활동을 추적할 수 있다""고 설명했다.토큰포스트 | [email protected]"
60,https://www.tokenpost.kr/,,"크립토 맘 ""디지털 달러와 암호화폐 공존 가능"" - TokenPost",https://www.tokenpost.kr/article-33371,"그동안 SEC 내에서 암호화폐 산업과 비트코인 파생상품 등을 지지하며 '크립토 맘'이라는 별명을 얻은 피어스 위원은 오는 6월을 끝으로 
임기를 ...","<p class=""viewInfoTime"">2020-04-29 수 15:23</p>",'크립토 맘(Crypto Mom)' 헤스터 피어스(Hester Peirce) 미국 증권거래위원회(SEC) 위원이 중앙은행 디지털화폐(CBDC)와 민간 암호화폐가 공존할 수 있다는 의견을 내놓았다.,"28일(현지시간) 코인텔레그래프에 따르면, 피어스 의원은 크립토 파이낸스 컨퍼런스(Crypto Finance Conferenct)와 가진 화상 인터뷰에서 이같은 견해를 밝혔다.그는 ""중앙은행이 CBDC 발행에 신중을 기하고, 자신들의 역할에 대해 검토하는 것은 자연스러운 일""이라며 ""그러한 CBDC의 발행이 민간 디지털화폐의 종말을 의미하는 것은 아니라고 생각한다""고 말했다.다만 피어스 위원은 CBDC 발행이 프라이버시를 침해할 우려가 있다는 점은 생각해봐야 한다고 지적했다.그는 ""디지털화폐를 발행하려면 개인 프라이버시 문제에 대해 생각해야 한다""면서 ""대중은 정부가 타인이 그들의 거래를 감시하는 것에 대해 불편하게 여기기 때문""이라고 설명했다.그동안 SEC 내에서 암호화폐 산업과 비트코인 파생상품 등을 지지하며 '크립토 맘'이라는 별명을 얻은 피어스 위원은 오는 6월을 끝으로 임기를 마치게 된다. SEC 소속된 5명의 위원은 미 상원의 동의를 거쳐 대통령이 임명하게 된다.암호화폐 업계는 그동안 비트코인을 포함한 암호화폐에 부정적인 견해를 보여온 SEC에서 유일하게 지지를 보내준 피어스 의원이 물러나면 산업이 위축될 수 있다고 우려하고 있다.이와 관련해 피어스 의원은 ""다른 사람을 자리에 앉힐 때까지 계속 있을 수 있다""면서도 ""정말 중요한 것은 특정 인물이 아니라 산업의 토대를 세우는 것""이라고 강조했다.한편, 미국은 디지털 달러 발행에 대한 움직임이 높아지고 있다. 크리스토퍼 지안카를로(Christopher Giancarlo) 전 상품성물거래위원회(CFTC) 위원장을 중심으로 디지털 달러 재단이 지난 1월 출범했다.최근에는 코로나19 관련 긴급 지원금을 국민에 지급하는 방식으로 디지털 달러를 발행하자는 내용의 '지역자동부양법안(ABC·Automatic Boost to Community Act)'이 미국 의회에 제출됐다.토큰포스트 | [email protected]"
61,https://www.tokenpost.kr/,,4월 21일(화) 국내외 블록체인 뉴스 오후 브리핑 - TokenPost,https://www.tokenpost.kr/article-32845,"미국 비트코인 선물 시장에 새 규제 승인 거래소가 등장했다. 미국 상품선물거래위원회(CFTC)는 암호화폐 거래소 
'비트노미얼(Bitnomial)'을 비트 ...","<p class=""viewInfoTime"">2020-04-21 화 17:26</p>","[중국 ""디지털 위안화, 2022년 베이징 동계올림픽에서 활용될 수 있다""]","중국이 개발 중인 디지털 위안화가 2022년 동계올림픽에서 활용될 수 있다는 전망이 나왔다. 중국 국영 텔레비전 CCTV는 중국 중앙은행인 인민은행(PBoC) 관계자를 인용해 이같은 내용을 전했다. 인민은행 관계자는 ""디지털 위안화 개발 작업이 순조롭게 진행되고 있다""면서 ""오는 2022년 베이징 동계 올림픽에서 실전 투입이 가능할 것""이라고 전했다. 인민은행 관계자의 이번 언급은 중국 디지털 위안화가 적어도 2021년 중반까지는 개발과 테스트를 마치고 실제 유통에 들어갈 것이라는 내용을 암시한다. 현재 인민은행은 디지털 위안화의 공식적인 출시 일정에 대해서는 아무런 입장을 밝히지 않고 있다. [80조 국고보조금 블록체인으로 관리 검토]디스트리트에 따르면 정부가 블록체인을 활용해 연간 80조원 규모 국고보조금을 지급하고 관리하는 방안을 검토·추진한다. 20일 관계부처에 따르면 최근 기획재정부는 보건복지부, 과학기술정보통신부 등과 블록체인 기술을 활용한 국고보조금 지급 시스템 개발에 착수했다. 정부 관계자는 ""향후 국고보조금 지급액 규모가 꾸준히 늘어날 전망이지만 저소득층과 청년들의 자산 형성 및 자립을 돕는 '자산형성지원사업'에서 중복 수급 문제가 불거지는 등 시스템상 한계는 여전하다""며 ""블록체인 기술이 이런 문제에 대한 해답을 제시할 수 있을 것으로 기대하고 있다""고 말했다. [페이스북, 칼리브라 아일랜드 지사 ‘50명’ 추가 확충]페이스북의 결제 부문 자회사 ‘칼리브라(Calibra)’는 리브라 프로젝트를 지원할 인력을 모집 중이다. 모집 인원은 50명으로 연말부터 아일랜드 더블린에 있는 칼리브라 지사에서 근무한다. 리브라 월렛 개발사인 칼리브라는 규제기관과 협력할 준법이행팀, 월렛 사기 방지 프로그램 작업을 진행할 전문가, 고객서비스지원 인력을 구하고 있다. [美 CFTC, 비트코인 선물 거래소에 허가…백트·CME와 경쟁]미국 비트코인 선물 시장에 새 규제 승인 거래소가 등장했다. 미국 상품선물거래위원회(CFTC)는 암호화폐 거래소 '비트노미얼(Bitnomial)'을 비트코인 선물 및 옵션 상품을 제공할 수 있는 ‘적격거래소(DCM)’로 허가했다. 비트노미얼은 실물인도 방식의 비트코인 결제 계약을 집중적으로 지원할 예정이다. 계약 만기 시, 상응하는 현금이 아닌 실제 비트코인으로 지급하는 방식이다. [독일 규제당국, 투자금 회수 가능 'rICO' 허용]독일 금융감독청(BaFin)이 특정 기한 내 투자 약정 자금을 되찾을 수 있는 '리버서블 암호화폐공개(Reversible ICO, rICO)'를 허가했다고 21일(현지시간) 디크립트가 보도했다. rICO는 기존 암호화폐공개(ICO) 구조를 변경해 투자자 보호 수준을 더욱 강화했다. 첫 번째 단계에서 투자할 토큰을 비축했다가, 이를 두 번째 단계에서 시간차를 두고 매입하는 방식이다. 프로젝트 지원 의사가 없으면 약정했던 토큰 중 남은 금액을 이더리움으로 환수할 수 있다.
[국제결제은행 “비트코인 시세, ‘정책 뉴스’에 민감”]댈러스 연준 세계화 연구소(Globalization Institute)가 지난 18일 공개한 보고서에 따르면 정부의 명확한 규제 정책 도입은 암호화폐에 뚜렷한 상승 추진력으로 작용한다. 해당 보고서는 국제결제은행 소속 혁신·디지털경제부 수석 경제학자인 라파엘 아우어와 금융 안정성 정책 수석인 스틴 크래센스가 작성했다. 연구진은 뉴스 범주를 분류하고 이에 따른 시세 영향을 분석, ""암호화폐 시세가 정부의 암호화폐 금지 조치에 하락하고 규제 명확화 소식에 상승했다""면서 ""암호화폐 시세가 자체 평판보다 규제 소식에 더욱 민감하게 반응했다""고 설명했다. [옥스퍼드 법대 “암호화폐 규제 수립으로 금융 붕괴 막아야”]금융시장 붕괴를 방지하기 위해 시장의 일부로 자리잡은 암호화폐 시장을 규제해야 한다는 주장이 제기됐다. 옥스포드 법대 연구진은 17일(현지시간) 공식 블로그에서 기존 금융 시스템을 위협할 수 있는 암호화폐 시장에 엄격한 규제 방안을 도입해야 하다고 주장했다. 최근 금융 위기에 대응하기 위해 자산을 암호화폐로 이동시킨 움직임이 학계의 관심을 끌었다. 암호화폐 거래는 중앙기관을 의존하지 않는 탈중앙 방식이다. 연구진은 ""투자자가 자산 보호에 대해 중앙 정부와 은행을 신뢰할 수 없을 때 자산을 암호화폐로 이동시키는 움직임이 나타난다""고 짚었다. [NGO 단체 '헤퍼인터내셔널', 리브라협회 23번째 회원사로 합류]헤퍼 인터내셔널은 공식 블로그에서 '금융 포괄성, 경쟁력, 책임있는 금융 서비스 혁신을 지원할 시스템 구축'이라는 리브라의 미션을 언급하며 ""저비용으로 접근성을 확대할 수 있는 금융 시스템을 구축하는 데 협력하기 위해 리브라협회에 합류했다""고 밝혔다. 헤퍼인터내셔널은 전 세계 빈곤층 농가가 생산량을 늘리고 새로운 시장에 진출해 매출과 소득을 높일 수 있도록 돕고 있다. 단체는 자선 단체 평가 사이트 '채리티 내비게이터'에서 별 4개 만점에 3개를, 책임성과 투명성 부문에서는 100점 만점에 97점을 받은 바 있다. [미쓰이물산, 증권형토큰 실증사업 실시]일본 미쓰이물산 디지털애셋매니지먼트가 블록체인 기반 증권형 토큰 발행을 목표로 하는 프로젝트를 시작한다. 우선 부동산 투자 펀드로 실증사업을 실시할 방침이다. 블록체인 기업 LayerX가 해당 프로젝트에 참여한다. 미쓰이물산 디지털애셋매니지먼트는 미쓰이물산과 LayerX가 4월 1일 설립한 회사다. 이달 말까지 SMBC 닛코 증권, 미쓰이스미토모신탁은행과 제휴할 예정이며 올해 하반기부터 본격적인 사업을 전개할 계획이다. [中 은행 업계 최초 블록체인 백서 발간]중국 이동지불망에 따르면 중국 4대 은행 중 하나인 공상은행 핀테크연구원, 커신블록체인(可信区块链)이 공동으로 '블록체인금융응용발전백서'를 정식 발간했다. 이는 중국 은행업계에서 최초로 발간한 블록체인 백서다. 백서는 금융 분야에서 블록체인이 가지는 의미, 응용모델, 발전현황과 더불어 현 금융업계의 문제점, 블록체인의 응용 가치를 중점적으로 서술했다. <기타외신>日 STO 협회, 신규 규제 가이드라인 발표일본 3대 은행, 블록체인 무역 금융 테스트 완료아부다비 이슬람 은행, 블록체인 거래 성료토큰포스트 | [email protected]"
62,https://www.tokenpost.kr/,,"블록스트림 CSO ""리퀴드 네트워크, BTC 대량 이체 최적화 ...",https://www.tokenpost.kr/article-33355,"... 트위터를 통해 ""리퀴드는 거래소간 비트코인 대규모 이체에 최적화된 네트워크""라고 말했다. 이와 관련해 그는 ""만약 블록체인을 
통해 온라인으로 ...","<p class=""viewInfoTime"">2020-04-29 수 12:02</p>","블록체인 기술 개발사 블록스트림(Blockstream)의 최고전략책임자(CSO)인 샘슨 모우(Samson Mow)가 29일 자신의 트위터를 통해 ""리퀴드는 거래소간 비트코인 대규모 이체에 최적화된 네트워크""라고 말했다. 이와 관련해 그는 ""만약 블록체인을 통해 온라인으로 커피를 구매하고 싶다면 라이트닝 네트워크를 활용하는 것이 최선일 것이다. 같은 의미로 거래소간 대규모 BTC 이체도 온체인 트랜잭션을 만들거나 대규모 라이트닝 네트워크 채널 개설을 통해 진행할 수 있지만, 리퀴드 네트워크를 활용하는 것이 최선이다""라고 설명했다.",Provided by 코인니스
63,https://www.tokenpost.kr/,,"존맥아피 ""사토시 나카모토 정체 99% 확신"" - TokenPost",https://www.tokenpost.kr/article-33580,"암호화폐 전문 미디어 코인텔레그래프에 따르면 비트코인 옹호론자이자 세계적인 보안 소프트웨어 개발자 존맥아피(John McAfee)가 
""비트코인 ...","<p class=""viewInfoTime"">2020-05-04 월 09:38</p>","암호화폐 전문 미디어 코인텔레그래프에 따르면 비트코인 옹호론자이자 세계적인 보안 소프트웨어 개발자 존맥아피(John McAfee)가 ""비트코인 창시자 사토시 나카모토 정체를 99% 확신한다""고 말했다. 그는 ""앞서 그의 정체를 밝히고자 했지만 그와의 통화 후 그러지 않기로 결정했다. 백서를 보면, 즉 문체나 숨겨진 의도롤 파악해보면 사토시 나카모토 정체를 파악하는데 필요한 모든 것을 알 수 있다""고 덧붙였다.",Provided by 코인니스
64,https://www.tokenpost.kr/,,백트 CEO 마이크 블랜디나 4개월 만에 사임 - TokenPost,https://www.tokenpost.kr/article-33046,"백트는 전 세계 기관 투자자를 대상으로 비트코인 선물과 옵션 계약을 제공하고 있다. 지난해 9월 실물 인도 비트코인 선물 상품을 
출시하고 그해 12 ...","<p class=""viewInfoTime"">2020-04-24 금 10:26</p>",백트 수장이 취임 4개월만에 자리에서 물러났다.,"23일(현지시간) 코인데스크 보도에 따르면 지난해 12월 임명된 마이크 블랜디나가 백트의 최고경영자(CEO)직을 사임했다.해당 소식은 내부 전체회의에서 발표됐으며 공식 성명을 통해 확인됐다.지난해 12월, 백트 출범 전부터 프로젝트를 이끌어온 전임자 켈리 뢰플러가 상원에 입성하면서 공석이 된 CEO 자리를 마이크 블랜디나가 이어받았다.성명은 자세한 내용 없이 블랜디나가 ""새로운 기회를 찾아 기업을 떠났다""고 설명했다. 사안을 잘 아는 소식통에 따르면 마이크 블랜디나는 JP모건으로 자리를 옮긴 것으로 알려졌다. 블랜디나는 개인적인 입장을 내놓지 않았으며 JP모건 측도 언급을 피하고 있다.백트 CEO직은 모기업 ICE의 인수합병·통합 부문 부대표 데이비드 클리프턴가 맡는다. 회장직은 애덤 화이트가 계속 이어간다.클리프턴은 2013년 ICE의 NYSE 유로넥스트 인수에 참여한 바 있으며 현재 백트의 브릿지 2 솔루션을 통합하는 데 집중하고 있다. 브릿지2 솔루션은 로열티 솔루션 제공업체로 백트가 지난 2월 인수했다.제프리 스프레처 ICE 회장은 ""데이비드 클리프턴은 수년 동안 기업의 가장 중요한 프로젝트마다 깊이 관여해왔다. 백트 소비자 앱 구현을 가속화하기 위한 브리지2 인수 과정에도 조력했다. 백트의 중간 CEO로 훌륭한 리더십을 보여줄 것이라고 믿는다""고 전했다. 백트는 전 세계 기관 투자자를 대상으로 비트코인 선물과 옵션 계약을 제공하고 있다. 지난해 9월 실물 인도 비트코인 선물 상품을 출시하고 그해 12월에는 이를 기초로 하는 옵션 상품과 현금 결제 비트코인 선물도 지원하기 시작했다.올해 백트는 '소비자 채택'을 경영 최우선 목표로 두고 매장 결제 및 보상 앱 구축을 추진 중이다. 지난 달에는 스타벅스 베타앱에 '백트 캐시'를 통합하는 작업을 진행한 바 있다.토큰포스트 | [email protected]"
65,https://www.tokenpost.kr/,,"외신 ""BTC 전체 노드 4,7만 이하...3년 내 최저수준"" - TokenPost",https://www.tokenpost.kr/article-33799,"암호화폐 전문 미디어 코인데스크가 비트코인 코어 개발자 루크 대시 주니어(Luke Dash Jr)의 데이터를 인용 ""6일(현지시간) 
BTC의 전체 노드수가 ...","<p class=""viewInfoTime"">2020-05-07 목 04:36</p>","암호화폐 전문 미디어 코인데스크가 비트코인 코어 개발자 루크 대시 주니어(Luke Dash Jr)의 데이터를 인용 ""6일(현지시간) BTC의 전체 노드수가 47,000 이하로 떨어졌다""며 ""3년 내 최저 수준이다""고 보도했다. 이와 관련해 해당 미디어는 ""노드의 수는 지난 2018년 1월 최고 수준이었던 20만개 이상에서 지속 감소세를 보였다. 노드의 감소는 새로운 트랜잭션의 검증과 네트워크 트랙잭션 기록을 저장하는데 참여하는 사람이 줄어든다는 것을 의미한다""며 ""이 최저 수준이 최근 가격과 해시레이트가 증가하는 시점에서 나왔다""고 덧붙였다.",Provided by 코인니스
66,https://www.tokenpost.kr/,,"DASH, 일본시장 '재진출' 비용 예산안 가결",https://www.tokenpost.kr/article-33252,"DASH의 트랜잭션은 완전히 투명하고 감사가 가능하며 비트코인과 동일한 수준의 익명성을 보장한다""고 설명했다. 앞서 코인체크 등 일본 
암호화폐 ...","<p class=""viewInfoTime"">2020-04-28 화 10:03</p>","일본 암호화폐 전문 미디어 코인포스트에 따르면, 대시(DASH, 시총 19위) 5월 예산 중 대시재팬(Dash Japan) 팀이 제안한 일본 시장 진출 사업비 지원을 승인했다. 이에 따라 대시재팬 팀은 428.73 DASH(약 4,323만 원)의 예산을 조달했다. 이와 관련 대시재팬 측은 ""해당 예산은 일본 규제당국과 협력을 도모하고, 일본 시장에 DASH를 다시 상장시키기 위한 활동비로 사용될 예정이다. 블록체인 기반 토큰 거래에 익명성을 문제 삼아 상장폐지됐던 과거의 사례에 법적 이의를 제기하기 위해 예산을 측정했다. DASH 블록체인은 추적과 감사가 불가능하다는 오해를 받고 있다. DASH의 트랜잭션은 완전히 투명하고 감사가 가능하며 비트코인과 동일한 수준의 익명성을 보장한다""고 설명했다. 앞서 코인체크 등 일본 암호화폐 거래소는 상대적으로 트랜잭션 추적이 어려운 '다크코인'들에 컴플라이언스 리스크가 존재한다며 상장폐지 조치를 취한 바 있다.",Provided by 코인니스
67,https://www.tokenpost.kr/,,"팀 드레이퍼 ""BTC, 2023년 25만 달러 돌파 확신"" - TokenPost",https://www.tokenpost.kr/article-33260,"암호화폐 전문 미디어 코인텔레그래프에 따르면, 최근 미국 실리콘밸리 유명 벤처투자자이자 대표적인 비트코인 강세론자인 팀 
드레이퍼(Tim ...","<p class=""viewInfoTime"">2020-04-28 화 10:53</p>","암호화폐 전문 미디어 코인텔레그래프에 따르면, 최근 미국 실리콘밸리 유명 벤처투자자이자 대표적인 비트코인 강세론자인 팀 드레이퍼(Tim Draper)가 ""만약 BTC 가격이 2023년 초까지 25만 달러를 돌파하지 못한다면 날계란을 먹겠다""고 말했다. 이와 관련 그는 ""개인적인 가격 예측이지만, 버티다보면 BTC가 25만 달러가 되는 날은 반드시 올 것이라고 확신한다. 미국 정부는 대규모 경기부양책을 통해 달러 가치를 떨어뜨리고 있으며, 이는 사람들을 암호화폐 시장으로 유입시킬 것이다. 또 전세계적인 비트코인 대규모 채택에 힘입어 BTC 가격은 상승할 것""이라고 설명했다.",Provided by 코인니스
68,https://www.tokenpost.kr/,,"설문조사, 내년 BTC 투자 최대 리스크는 '코로나' - TokenPost",https://www.tokenpost.kr/article-32997,"유명 암호화폐 분석가 플랜B(트위터 계정)가 트위터 상에서 '향후 1년 비트코인의 최대 리스크는 무엇인가?'를 주제로 설문 조사를 
진행했다.","<p class=""viewInfoTime"">2020-04-23 목 16:41</p>","유명 암호화폐 분석가 플랜B(트위터 계정)가 트위터 상에서 '향후 1년 비트코인의 최대 리스크는 무엇인가?'를 주제로 설문 조사를 진행했다. 그 결과 45%의 응답자가 ""코로나 사태로 인한 경기 하방 압력""을 꼽았다. 26%는 선물, 시세조작, 공매도를 꼽았다. 17%는 반감기로 인한 채굴 중단을 꼽았다. 나머지 14%는 마운트 곡스, 플러스 토큰 현금화를 꼽았다. 설문조사에는 보도시간 기준 10185명이 참여했다.",Provided by 코인니스
69,https://www.tokenpost.kr/,,"LTC 공동 창업자 ""거시요인, BTC 가격 상승 설명 불가능 ...",https://www.tokenpost.kr/article-33591,"라이트코인(LTC, 시총 7위) 재단 공동 창업자 왕신시(Xinxi Wang)가 3일 자신의 트위터를 통해 ""비트코인 가격 상승을 
설명할 수 있는 거시경제적 ...","<p class=""viewInfoTime"">2020-05-04 월 10:34</p>","라이트코인(LTC, 시총 7위) 재단 공동 창업자 왕신시(Xinxi Wang)가 3일 자신의 트위터를 통해 ""비트코인 가격 상승을 설명할 수 있는 거시경제적 요인은 없다""고 말했다. 이와 관련 그는 ""오늘날 BTC는 2017년처럼 대대적인 신규 투자자 유입이 없으며, 각국 중앙은행이 양적완화를 펼치며 돈을 찍어내는 와중에도 인플레이션이 오지 않았다. 비트코인은 금처럼 '안전한 피난처'(safe-haven)가 아니다. 최근 BTC 가격 상승은 반감 전 시장조작일 가능성이 있다""고 설명했다.",Provided by 코인니스
