,press company,date,title,url,abstract,date detail,head article,main article
82,https://www.tokenpost.kr/,,"네덜란드 중앙은행 ""유럽 CBDC 실험의 장 제공하겠다 ...",https://www.tokenpost.kr/article-32886,"비트코인처럼 탈중앙 검증 방식을 사용하는 탈중앙 솔루션은 탈금융 개념에서 나온 것이라고 지적했다. 은행이 CBDC를 구현하기 위해 
리소스 중심의 ...","<p class=""viewInfoTime"">2020-04-22 수 11:03</p>",네덜란드 중앙은행이 디지털 유로를 위한 실험의 장을 자처하며 '중앙은행 발행 디지털화폐(CBDC)'에 대한 적극적인 지지 입장을 전했다.,"21일(현지시간) 코인데스크 보도에 따르면 네덜란드 중앙은행은 45쪽 분량의 CBDC 보고서에서 유로 지역 내 CBDC 시범 지역으로 역할할 수 있다고 밝혔다. 중앙은행은 암호화폐가 은행에 필요한 기술 방향을 제시했다고 평가했다. 특히 스마트 컨트랙트 기술이 CBDC의 미래 가능성을 확인하는 데 도움이 될 것이라고 말했다.중앙은행은 ""복잡한 로직을 가진 스마트 컨트랙트 시스템은 CBDC 수요를 증가시키고 거래 비용을 절감시킬 수 있다""며 ""결제 시장의 다양성과 혁신성에 기여할 것""이라고 전망했다.네덜란드 중앙은행은 현재 CBDC 관련 작업을 진행하고 있지 않지만 유럽 CBDC 연구, 개발, 도입의 허브가 되기 원한다고 밝혔다.중앙은행은 ""유럽이 CBDC 실험을 더 구체화한다면 네덜란드가 주도적인 역할을 할 준비가 돼있다""면서 ""CBDC 실험을 위한 적절한 실험의 장을 제공할 것""이라고 밝혔다.2017년 유럽연합 보고서에 따르면, 인구 1700만의 네덜란드는 유로 지역에서 상품 구입·서비스 이용 시 현금으로 결제할 가능성이 가장 낮은 국가로 확인됐다.현금 인출 규모는 매년 감소하고 있는 반면, 일반 은행 계좌와 연결해 사용하는 민간 디지털 결제 비중은 늘어나는 추세다. 글로벌 스테이블코인 리브라도 출시가 지연되고 있지만 여전히 국가 통화주권에 위협적인 요소다.네덜란드 중앙은행은 ""CBDC에 대한 자국민의 관심도 높아지고 있다""면서 ""디지털 화폐가 디지털 시대에 공공 화폐를 존속시킬 방안이 될 것""이라고 강조했다.보고서는 어떤 형태의 CBDC가 가장 적합할지 자세히 검토하고 이를 리브라, 비트코인, 현금, 시중은행 통화, 중앙은행 준비고와 비교했다.중앙은행은 ""10년 동안 민간 암호화폐 실험이 진행됐다""며 ""이중 어떤 기술이 CBDC에서 사용할 충분한 부가 가치를 갖느냐가 문제""라고 설명했다.이어 ""스마트 컨트랙트가 은행이 활용할 수 있는 유일한 기술이 될 수 있다""며 ""CBDC는 리브라만큼, 비트코인보다 더 프로그래밍이 가능한 시스템이어야 한다""고 강조했다.한편, 네덜란드 중앙은행은 분산원장기술(DLT)에 대해서는 부정적인 입장을 내비쳤다. 비트코인처럼 탈중앙 검증 방식을 사용하는 탈중앙 솔루션은 탈금융 개념에서 나온 것이라고 지적했다. 은행이 CBDC를 구현하기 위해 리소스 중심의 분산 합의 모델을 차용할 필요가 없다고 주장했다.다만 중앙은행은 CBDC의 '익명성'에 대한 필요는 인정했다. 중앙은행은 ""CBDC가 완전한 익명성을 제공하는 현금 다음으로 어느 정도 선택적인 익명 수준을 지원해야 할 것""이라고 전했다.유럽 내 디지털 화폐에 대한 논의가 심화되고 있다. 지난달 프랑스 중앙은행은 CBDC 내부 테스트 계획을 공개한 바 있다.토큰포스트 | [email protected]"
83,https://www.tokenpost.kr/,,"리플, 유튜브에 소송 제기 ""암호화폐 스캠 단속 철저해야 ...",https://www.tokenpost.kr/article-32938,"암호화폐 전문 미디어 비트코인닷컴에 따르면, 최근 리플(XRP, 시총 3위)사가 최근 세계 최대 동영상 플랫폼 유튜브에 소송을 
제기했다. 이와 관련 ...","<p class=""viewInfoTime"">2020-04-22 수 23:59</p>","암호화폐 전문 미디어 비트코인닷컴에 따르면, 최근 리플(XRP, 시총 3위)사가 최근 세계 최대 동영상 플랫폼 유튜브에 소송을 제기했다. 이와 관련 리플은 ""유튜브의 정책은 '암호화폐 증여'(giveaway) 스캠을 철저히 단속하기에 충분하지 않다. 소송을 통해 사용자 보호를 위한 업계 전반의 '스캠 예방' 대처를 강화할 것""이라고 설명했다. 또 브래드 갈링하우스 리플사 최고경영자는 ""유튜브 플랫폼 내에서 암호화폐 기업이나 업계 유명인을 사칭한 '암호화폐 에어드롭' 사기가 성행하고 있다. 유튜브는 매달 20억 명 이상이 이용하는 플랫폼이다. 코로나 사태로 글로벌 경제가 위기에 직면한 오늘날 만연한 암호화폐 사기로부터 사용자들을 보호하는 것은 어느때보다 중요하다""고 강조했다.",Provided by 코인니스
84,https://www.tokenpost.kr/,,"BTC ATM 업체 Boinnex, 아일랜드 은행 계좌 폐쇄로 사업 지장",https://www.tokenpost.kr/article-33790,"코인데스크에 따르면 비트코인 ATM 업체 Boinnex 설립자 Bryan Tierney가 작년 8월 아일랜드 AIB(Allied 
Irish Banks) 은행이 계좌를 폐쇄한다고 ...","<p class=""viewInfoTime"">2020-05-06 수 23:54</p>","코인데스크에 따르면 비트코인 ATM 업체 Boinnex 설립자 Bryan Tierney가 작년 8월 아일랜드 AIB(Allied Irish Banks) 은행이 계좌를 폐쇄한다고 일방적으로 통보하면서 회사 운영에 지장을 받았다고 밝혔다. 실제로 Boinnex는 AIB가 계좌를 폐쇄한 후 6주 동안 문을 닫아야 했다. 이와 관련 AIB는 지난해 10월, 5차 유럽연합(EU) 돈세탁 방지 지침(AMLD5)에 따라 크립토 사업자들이 영향을 받는다고 설명한 바 있다. 하지만 미디어는 코로나19로 인해 의회가 마비되면서 연내 AMLD5 시행 여부가 불투명한 상태라고 진단했다.",Provided by 코인니스
85,https://www.tokenpost.kr/,,"암호화폐 제공업체 COO ""BTC 저평가, 단기 변동폭 확대 전망""",https://www.tokenpost.kr/article-33264,"... 에 따르면 암호화폐 제공업체 디지털민트(DigitalMint) 의 Don Wyper COO가 “비트코인(BTC) 경제에는 
고려해야 할 요소가 너무 많다. 현재 BTC ...","<p class=""viewInfoTime"">2020-04-28 화 12:05</p>",암호화폐 전문 미디어 BNNBloomberg에 따르면 암호화폐 제공업체 디지털민트(DigitalMint) 의 Don Wyper COO가 “비트코인(BTC) 경제에는 고려해야 할 요소가 너무 많다. 현재 BTC 시세는 반감기 잠재 영향을 완전히 소화하지 못했다. 과거 반감기 이후 BTC 시세는 급등했으며 장기 측면에서 볼 때 현재 BTC는 저평가 되어 있다. 단기적으로 변동성이 커질 수 밖에 없다”고 말했다.,Provided by 코인니스
86,https://www.tokenpost.kr/,,"中 3대 채굴장비업체, 美 SEC에 IPO 신청서 제출 - TokenPost",https://www.tokenpost.kr/article-33118,"금융 전문지 Renaissance Capital에 따르면 중국 3대 비트코인 채굴장비 제조업체인 이방인터내셔널이 24일(현지 시간) 
미국 증권거래 ...","<p class=""viewInfoTime"">2020-04-25 토 11:48</p>",금융 전문지 Renaissance Capital에 따르면 중국 3대 비트코인 채굴장비 제조업체인 이방인터내셔널이 24일(현지 시간) 미국 증권거래위원회(SEC)에 IPO 신청서를 제출했다. 목표 자금조달액은 1억 달러다. 종목코드는 EBON으로 뉴욕증권거래소(NYSE)와 나스닥 상장을 추진 중인 것으로 알려졌다. 이방인터내셔널 지난해 매출은 1억 900만 달러 수준이다. 한편 미디어에 따르면 이방인터내셔널은 앞서 2월 14일 IPO 신청 서류를 비공개로 제출한 바 있다.,Provided by 코인니스
87,https://www.tokenpost.kr/,,"업비트, '다크코인' 8종 유의종목 지정…국내 거래소 쫓겨나는 ...",https://www.tokenpost.kr/article-33769,"국내 가상자산 거래소 업비트가 익명성을 중시하는 '다크코인'의 8종 퇴출을 예고했다. 최근 국민적 공분을 산 'n번방' 사건과 함께 
가상자산 시장의 ...","<p class=""viewInfoTime"">2020-05-06 수 19:20</p>","국내 가상자산 거래소 업비트가 익명성을 중시하는 ‘다크코인’의 8종 퇴출을 예고했다. 최근 국민적 공분을 산 ‘n번방’ 사건과 함께 가상자산 시장의 제도권 진입을 앞두고 시장 건전성 확보에 초점을 맞추는 모습이다.

6일 관련 업계에 따르면 업비트는 최근 8종의 다크코인을 투자유의종목으로 지정했다. 해당 다크코인은 △지코인(XZC) △그로스톨코인(GRS) △버지(XVG) △코모도(KMD) △나브코인(NAV) △익스클루시브코인(EXCL) △호라이즌(ZEN) △아이오텍스(IOTX) 등이다. 유의종목지정이 상장폐지를 의미하진 않지만 사실상 전원 퇴출이 유력할 것으로 전망된다.

업비트 측은 “전송 과정에서 프라이버시 기능을 지원하거나 향후 지원 가능성이 존재, 익명 거래를 표방하는 암호화폐에 대해 유의 종목 지정 및 거래 지원 종료 절차를 밟아 나갈 계획”이라고 밝혔다.

앞서 업비트는 지난해 9월 모네로(XMR)를 비롯해 대시(DASH), 지캐시(ZEC), 헤이븐(XHV), 비트튜브(TUBE), 피벡스(PIVX) 등의 다크코인 6종을 투자유의종목으로 지정한 뒤 그달 상장폐지를 결정한 바 있다. 자금세탁방지 위험성이 높은 다크코인의 익명성 위험을 인식한 조치다.","

업비트와 함께 국내 양대 거래소를 형성하고 있는 빗썸도 지난달 16일 익명성 보장의 모네로(XMR)와 버지(XVG)를 투자유의종목으로 지정했다. 조만간 거래 지원 종료 여부가 발표될 예정이다. 후오비코리아도 최근 모네로 상장폐지를 결정했다.

한편 관련 업계는 이러한 움직임과 함께 다크코인이 더 이상 국내 거래소에서 거래되기 힘들 것이란 견해다. 이번 n번방 사건이 크게 작용한 점도 있으나 최근 국회를 통과한 특금법 개정안과 함께 국제자금세탁방지기구(FATF)의 권고안 중 ‘트래블 룰’(Travel Rule)이 작용한 결과다.

트래블 룰이란 가상자산 취급 사업자가 모든 가상자산의 거래 내역을 추적할 수 있고 필요할 경우 정부 당국에 관련 데이터를 제공해야 한다는 의무를 부여한다. 익명성을 주된 특징으로 삼는 다크코인이 트래블 룰 이행에 걸림돌로 작용할 수 있다.

업계 한 관계자는 “전체 시장 흐름을 봐야겠지만 향후 시장 규제 상황에 따라 다크코인의 존폐가 결정될 수 있다”며 “다크코인도 이러한 변화에 감지해 프로젝트의 방향을 대거 바꿔야 하는 상황”이라고 말했다.원문 출처 : CBC뉴스토큰포스트 | [email protected]"
88,https://www.tokenpost.kr/,,"국회입법조사처 ""국내 암호화폐 규제에 일본 사례 참고해야""…日 규제 내용은",https://www.tokenpost.kr/article-33626,"... 일본 최대 암호화폐 거래소 '코인체크'에서 5억 3천만 달러 상당의 암호 ... 마진 거래를 지원하는 해외 암호화폐 거래소 
비트멕스는 지난 1일부터 ...","<p class=""viewInfoTime"">2020-05-04 월 14:29</p>","국회입법조사처가 일본의 자금결제법 및 금융상품거래법 개정을 다룬 '외국입법 동향과 분석' 보고서를 지난달 29일 발간하고, 국내 암호화폐 규제 도입에 일본의 규제 사례를 참고해야 한다는 조언을 내놓았다.","국회입법조사처는 ""2017년 이후 우리나라에서도 일본과 같이 암호화폐 거래소 해킹 및 시세조종으로 이용자가 경제적 손실을 보는 사례가 발생하고 있음에도 이용자 보호를 위한 제도적 장치가 충분하지 않은 상황""이라며 ""일본의 사례를 참고해 향후 암호화폐 이용자를 보호하기 위한 규제 도입을 검토할 필요가 있다""고 말했다.보고서는 국내 암호화폐 규제에도 일본 자금결제법 및 금융상품거래법 개정안이 명시한 △이용자 자산 안전보관 의무, △이용자에 대한 변제 재원 마련 의무, △불공정거래 금지 의무 등의 암호화폐 이용자 보호를 위한 제도적 장치가 마련돼야 한다고 지적했다.일본 자금결제법 시행 배경과 변화현재 일본은 자금결제법과 금융상품거래법 개정안을 통해 암호화폐 관련 규제를 시행하고 있다. 암호화폐 유출과 시세조종 등으로부터 암호화폐(가상자산) 투자자를 보호하기 위해서다.지난 2010년 시행된 일본 자금결제법은 기술 발전으로 다양한 지급결제 수단이 등장함에 따라 여기에 대응하기 위해 만들어졌다. 이후 지난 2014년 당시 세계 최대 거래소였던 일본 마운트곡스가 해킹으로 4억 7,300만 달러 상당의 투자자 피해를 남기고 파산하자(현재는 회생절차 진행 중) 이를 계기로 2016년 자금결제법을 1차로 개정했다.자금결제법 1차 개정안에서는 암호화폐를 '가상통화'로 명명하며 법률상의 재산적 가치로 인정했다. 암호화폐를 취급하는 사업자에 대해서는 이용자 보호 조치로 △금융당국에 대한 등록 의무, △이용자에 대한 설명 의무, △이용자 재산을 분리 보관하는 의무를 부과했다.하지만 1차 개정에도 불구하고 지난 2018년 일본 최대 암호화폐 거래소 '코인체크'에서 5억 3천만 달러 상당의 암호화폐가 유출되는 사고가 발생하자 규제 강화에 대한 목소리가 높아졌다. 이에 일본 금융청은 지난해 3월 자금결제법 및 금융상품거래법 개정안을 의회에 제출했다. 해당 개정안은 지난해 5월에 의결돼 이달 1일부터 시행되고 있다.올해 시행되는 개정안에는 어떤 내용이 담겼나자금결제법 2차 개정안은 암호화폐 사업자에 대한 규제 감독 강화를 골자로 한다. 이번 2차 개정안에서는 1차 개정안에서 명명한 '가상통화'라는 명칭을 '암호자산'으로 변경했다. 기존 이용자 재산 분리 보관에 대한 내용은 방법을 구체적으로 명시해 이용자 자산을 신탁회사 등에 신탁하는 방법으로 보관하게 했다.또 암호화폐 교환업무의 원활한 수행을 위해 핫월렛 이용을 허용하는 한편, 이용자들의 인출권을 보장하기 위해 같은 종류, 같은 양의 암호화폐를 별도로 보관하도록 했다. 암호화폐 수탁 서비스 사업자에 대한 등록 의무 규정을 신설했으며, 이용자 거래에 영향을 줄 수 있는 암호화폐 사업자의 허위 광고 및 오인 광고를 금지하도록 했다.금융상품거래법 개정안에서는 암호화폐를 금융상품으로 규정해 규제 대상에 포함시켰다. 일본에서는 그동안 암호화폐가 지급결제수단으로 인식돼 왔다. 그러나 암호화폐를 통한 마진거래, 금융상품으로 매매되는 비중이 증가하면서 금융상품 거래에 적용되는 규제를 적용하기로 했다.암호화폐 마진 거래 및 파생상품에 대해 레버리지 최대 배율을 2배로 제한했다. 시행령 초기에는 레버리지 최대 배율을 4배로 규정했지만 이후 2배로 낮춰 규제를 강화했다. 이에 따라 일본 내 일부 암호화폐 거래소는 마진 거래를 종료했으며, 마진 거래를 지원하는 해외 암호화폐 거래소 비트멕스는 지난 1일부터 일본 고객의 서비스 이용을 제한했다.일본은 현재 자금결제법 및 금융상품거래법 개정을 통한 암호화폐 규제 틀을 마련하면서도, 암호화폐 관련 협회의 시장 자율규제를 인정하는 유연한 방식의 규제를 시행하고 있다.일본 금융청은 개정안 시행에 앞서 일본 STO협회와 일본 가상화폐거래소협회(JVCEA) 두 곳을 공인 금융상품거래협회로 인정했다. STO협회에는 SBI, 노무라 등 일본 유명 증권사들이 STO 기반 자금조달을 위해 참여하고 있으며, JVCEA에는 일본 암호화폐 거래소들이 회원사로 참여하고 있다.토큰포스트 | [email protected]"
89,https://www.tokenpost.kr/,,"나스닥, R3 코다 블록체인서 '디지털자산 플랫폼' 제공 - TokenPost",https://www.tokenpost.kr/article-33411,"... 제공업체 크립토컴페어와 파트너십을 맺고 기관 투자자를 위한 암호화폐 가격 지수를 출시했으며, 최근에는 비트코인 선물 출시도 
검토하고 있다.","<p class=""viewInfoTime"">2020-04-30 목 01:12</p>",나스닥 증권거래소가 R3와의 제휴를 통해 코다(Corda) 블록체인 기반의 디지털 자산시장 플랫폼을 제공한다.,"29일(현지시간) R3는 공식 보도자료를 통해 나스닥과 협약을 체결했다고 밝혔다. 이에 따라 나스닥은 R3의 엔터프라이즈 블록체인 코다를 통해 디지털 자산시장을 위한 서비스를 제공하게 된다.해당 원장 기술은 매칭 엔진, 감시, 데이터 디스커버리, 리포팅 서비스 등을 포함한 여러 다른 자본 시장 서비스와 연결되는 나스닥 파이낸셜 프레임워크와 통합돼 있다.요한 톨(Johan Toll) 나스닥 디지털자산 책임자는 ""R3의 코다 플랫폼은 고도의 규제 환경을 위해 설계돼 나스닥의 기술 생태계에 잘 들어맞는다""면서 ""자본 시장 참가자들은 이제 코다 블록체인을 사용해 디지털 자산의 발행과 거래, 결산, 수탁을 할 수 있다""고 말했다.지난 1971년 2월에 개설된 나스닥은 벤처기업들이 상장돼 있는 미국 장외시장이다. 마이크로소프트, 인텔, 애플, 구글 등 대부분의 하이테크 관련주가 상장돼 있다.최근 나스닥은 블록체인 기술과 암호화폐로 영역으로 점차 확대하고 있다. 지난해 6월에는 암호화폐 데이터 제공업체 크립토컴페어와 파트너십을 맺고 기관 투자자를 위한 암호화폐 가격 지수를 출시했으며, 최근에는 비트코인 선물 출시도 검토하고 있다.아데나 프리드먼(Adena Friedman) 나스닥 CEO는 지난해 10월 인터뷰를 통해 ""블록체인을 거래 인프라 개선을 위한 첨단 기술 중 하나로 인식하고 적극 활용하고 있다""면서 ""블록체인, 암호화폐 분야에 진정한 기회가 잠재돼 있다고 생각한다""고 말했다.한편, 이번에 나스닥과 협력해 디지털 자산시장 플랫폼을 제공하는 R3의 코다 플랫폼은 국제전기전자공학회(IEEE)가 진행한 국가 기술 표준 평가에서 이더리움, 하이퍼레저 패브릭을 제치고 유일하게 정부 기준에 부합하다는 평가를 받은 바 있다.토큰포스트 | [email protected]"
90,https://www.tokenpost.kr/,,"BTC 개발자 ""TRX·EOS, 댑 시장 손쉽게 잠식"" - TokenPost",https://www.tokenpost.kr/article-33257,"비트코인 개발자 우디 워트하이머(Udi Wertheimer)가 트위터를 통해 “트론(TRX), 이오스(EOS), 
이더리움클래식(ETC)은 아주 쉽게 (별 가치가 없는) ...","<p class=""viewInfoTime"">2020-04-28 화 10:27</p>","비트코인 개발자 우디 워트하이머(Udi Wertheimer)가 트위터를 통해 “트론(TRX), 이오스(EOS), 이더리움클래식(ETC)은 아주 쉽게 (별 가치가 없는) 이더리움 댑(Dapp) 시장을 잠식할 것이다. 이는 아주 자명한 사실”이라며 “사람들은 이더리움(ETH)을 택하는 유일한 이유는 이데올로기 때문이다. 하지만 인프라에 대해 논할 때는 대부분 이데올로기를 중시하지 않는다”고 말했다.",Provided by 코인니스
91,https://www.tokenpost.kr/,,"외신 ""페이스북, 印릴라이언스에 7조원 투자...블록체인 호재""",https://www.tokenpost.kr/article-32972,"암호화폐 전문 미디어 비트코인닷컴이 ""페이스북이 인도 최대 기업 중 하나인 릴라이언스 인더스트리의 전자상거래 사업 분야에 7조원을 
투자했다.","<p class=""viewInfoTime"">2020-04-23 목 12:42</p>","암호화폐 전문 미디어 비트코인닷컴이 ""페이스북이 인도 최대 기업 중 하나인 릴라이언스 인더스트리의 전자상거래 사업 분야에 7조원을 투자했다. 이는 블록체인 업계에 호재로 작용할 수 있다""고 23일(현지 시간) 보도했다. 이와 관련 미디어는 ""지난 22일 미국 IT 공룡 페이스북이 인도 최대 기업 중 하나인 릴라이언스 인더스트리의 디지털 비즈니스 부문 자회사 지오 플랫폼에 7조원을 투자해 지분 9.99%를 인수하기로 했다고 발표했다. 또 지난해 릴라이언스 산하 지오 플랫폼은 인도 최대 블록체인 네트워크 구축 계획을 발표한 바 있다. 릴라이언스 지오와 페이스북의 협력은 블록체인 및 암호화폐 관련 사업에 시너지 효과를 발휘할 수 있다""고 설명했다.",Provided by 코인니스
92,https://www.tokenpost.kr/,,"中 연구원 ""DCEP, 주로 소액결제에 쓰일 것"" - TokenPost",https://www.tokenpost.kr/article-33209,"중국 국가금융발전실험실 특별초빙 연구원 둥시먀오(董希淼)는 ""많은 사람들이 비트코인, 리브라(페이스북 코인)를 '디지털화폐'라고 
칭하는데 사실 ...","<p class=""viewInfoTime"">2020-04-27 월 15:47</p>","theblockbeats에 따르면 오늘(27일) 오후 중국 관영 CCTV13 뉴스 프로그램 新闻直播间(Live News)에 베이징대 디지털금융 연구원 쉬위안(徐远)이 출연해 ""디지털 위안화(DCEP)는 주로 소액결제(retail)에 쓰일 것이며, 이러한 점은 현금과 상당히 흡사하다""고 말했다. 중국 국가금융발전실험실 특별초빙 연구원 둥시먀오(董希淼)는 ""많은 사람들이 비트코인, 리브라(페이스북 코인)를 '디지털화폐'라고 칭하는데 사실 가상화폐라 부르는 게 맞다. 이것들은 본질적으로 가상상품이다. 왜냐하면 국가 신용이 뒷받침되어 있지 않기 때문이다""라고 말했다.",Provided by 코인니스
93,https://www.tokenpost.kr/,,"실크로드 창업자 ""BTC, 2만 달러 이하 매우 저렴"" - TokenPost",https://www.tokenpost.kr/article-33179,"그는 장기적으로 봤을 때 비트코인 가격 상한선은 무한대로, 수십년이 지나고 보면 2만 달러 이하 가격은 매우 저렴하다고 생각될 것이라고 
설명했다 ...","<p class=""viewInfoTime"">2020-04-27 월 11:52</p>","비트코이니스트에 따르면 최근 다크웹 실크로드 창업자 Ross Ulbricht가 앞서 4월 초 BTC 가격이 3000 달러 아래로 떨어질 수 있다고 예측한 일에 대해 해명했다. 그는 장기적으로 봤을 때 비트코인 가격 상한선은 무한대로, 수십년이 지나고 보면 2만 달러 이하 가격은 매우 저렴하다고 생각될 것이라고 설명했다. 미국 FBI는 2013년 실크로드를 폐쇄하며 범죄에 사용된 약 17.4만 BTC를 압수한 바 있다.",Provided by 코인니스
94,https://www.tokenpost.kr/,,"외신 ""일본 자금결산법 개정안 시행, 커스터디 업체도 등록 필수""",https://www.tokenpost.kr/article-33522,"암호화폐 전문 미디어 비트코인닷컴에 따르면, 5월 1일부로 일본에서 암호화폐 규제 내용이 포함된 '자금결산법 개정안'이 시행된다. 이에 
따라 암호 ...","<p class=""viewInfoTime"">2020-05-01 금 14:03</p>","암호화폐 전문 미디어 비트코인닷컴에 따르면, 5월 1일부로 일본에서 암호화폐 규제 내용이 포함된 '자금결산법 개정안'이 시행된다. 이에 따라 암호화폐 커스터디 업체로 규제 당국에 정식으로 등록해야 한다는 게 미디어 측의 설명이다. 이와 관련해 글로벌 로펌 모리슨앤포어스터는 ""일본에서 자금결산법 개정안이 시행됨에 따라 암호화폐 커스터디 서비스 제공업체는 규제 당국에 정식으로 등록돼야 한다. 커스터디 업체는 '지불 서비스 법'의 규제 관할에 포함되게 되며 이와 관련한 운영 라이선스를 취득해야 한다. 암호화폐 파생상품 거래소의 경우 '금융도구 및 거래법'의 규제를 받게 되며 관련 라이선스를 취득해야 한다. 현재 일본 내 23개 거래소가 금융청에 정식 등록되어 있으며, 정식 라이선스가 없는 거래소는 플랫폼 내 서비스 약관을 수정하는 동시에 일본 사용자에게 서비스를 제공할 수 없다""고 설명했다.",Provided by 코인니스
