,press company,date,title,url,abstract,date detail,head article,main article
19,https://cointelegraph.com,"Oct 26, 2019","The Curious Case of AT&T, Seth Shapiro’s SIM Card and a Stolen $1.8M",https://cointelegraph.com/news/the-curious-case-of-att-seth-shapiros-sim-card-and-a-stolen-18m,"Related News. Is Bitcoin a Store of Value? Experts on BTC as Digital Gold. 
Pay-to-Play Gaming Is Flawed, Blockchain-Based Platform Says.","Oct 26, 2019","Over the past week, the global crypto community bore witness to a unique case wherein California resident and blockchain entrepreneur Seth Shapiro filed a lawsuit against American telecom giant AT&T — alleging that a couple of the firm’s employees had perpetrated a nefarious SIM-swap scheme that resulted in the former losing $1.8 million in various crypto assets.","Shapiro, who is a two-time Emmy Award-winner, as well as an author and adjunct professor at the University of Southern California School of Cinematic Arts, filed the aforementioned lawsuit against AT&T on Oct. 17, claiming that between May 16, 2018 and May 18, 2019, the telecom provider’s employees perpetrated four hacks in total that lead to his personal and confidential data — including usernames, passwords, event calendar, etc. — being leaked to third-party hackers. In this regard, the submitted court documents highlight that the aforementioned developments resulted in the miscreants gaining control of Shapiro’s various cryptocurrency exchange accounts on platforms, such as KuCoin, Bittrex, Coinbase, Huobi, Cryptopia, Livecoin, HitBTC, Coss.io, Liqui and Bitfinex. Not only that, but they were also able to seize control of some of his other digital accounts, such as Evernote.In addition, the plaintiff has also alleged that he is currently in possession of chat logs that clearly show the AT&T employees and hackers discussing their plans to use the stolen funds to acquire their dream cars and other valuable objects. The logs also contain details of how the hackers planned on rerouting the funds to avoid being caught by the police. On the subject, the lawsuit reads as follows:“AT&T employees obtained unauthorized access to Mr. Shapiro’s AT&T wireless account, viewed his confidential and proprietary personal information, and transferred control [...] to a phone controlled by third-party hackers in exchange for money. [...] The hackers then utilized their control over Mr. Shapiro’s AT&T wireless number [...] to access his personal and digital finance accounts and steal more than $1.8 million.”Jim Greer, an AT&T assistant vice president for corporate communications, told Cointelegraph in a statement: “We are working closely with our industry, law enforcement and consumers to stop and prevent this type of crime.”To gain a better understanding of the situation, Cointelegraph reached out to Shapiro and asked him to share some comments regarding the matter. First, Cointelegraph wanted verified whether Shapiro had indeed made repeated attempts to get AT&T’s service operators to prioritize his calls in order to protect his account. Additionally, Cointelegraph also asked him why he failed to notify local police authorities immediately after the first hack — after all, it has been alleged that a total of four breaches took place. Shapiro responded to this by saying:“I did. There’s not much local PDs can do — AT&T has all the information. In my case, I was lucky that the REACT Task force in Santa Clara got a lead and pursued the case. As did the Department of Homeland Security, who have been amazing. I am very grateful to both groups and can give you contacts at each.”  When asked about the crypto assets that were lost as a result of the repeated intrusions, Dwayne Sam — an attorney at Pierce Bainbridge Beck Price & Hecht LLP — and a member of Shapiro’s legal team, provided a legal document that contained the following data:In all, Shapiro alleged that he has had to face a total loss of around $1.7 million in cryptocurrency — $1 million of which consists solely of his personal funds, which he said was savings for his retirement.It should be mentioned that AT&T has had a poor track record when it comes to SIM-swapping incidents, with occurrences more than doubling between January 2013 and 2016. Also, in an earlier case relatively similar to this one — Terpin v. AT&T — a United States court did lay some responsibility on the claimant for failing to secure the account adequately. Thus, when asked if Shapiro’s legal team expected to face similar responsibility from the judge presiding over their case, Sam replied by saying:“Mr. Shapiro’s case will be judged on its own merits. That said, nothing in the Terepin court’s most recent decision could or should be construed as blaming the victim.”Lastly, when asked about how the legal team foresees the judgment of his case panning out in court Shapiro pointed out:“The evidence in this case of AT&T’s culpability and negligence is overwhelming. We fully anticipate that AT&T will be held legally accountable for its actions and those of its employees.”     AT&T’s Greer told Cointelegraph that the company has security measures in place to combat fraudulent SIM swapping, adding:“However, recent high profile cases reinforce the importance of businesses and consumers taking steps to protect against SIM swap fraud, such as not using mobile phone numbers as the single source of security and authentication.Greer went on to say that the company believes what happened to Shapiro is unfortunate, but added: “We dispute his allegations. We look forward to presenting our case in court.”To better understand if the responsibility in relation to this matter lies with AT&T alone or with the firm’s employees who reportedly stole Shapiro’s data, Cointelegraph got in touch with David Reischer, an attorney and CEO of LegalAdvice. He responded by saying Shapiro’s allegation that AT&T being in violation of the Federal Communications Act is absolutely true — especially in regard to the firm failing to protect the confidentiality of his mobile telephone account and other related data. He then went on to add:“AT&T is liable for its employees criminal acts via a theory of vicarious liability that holds a company accountable for the acts of its employees. The chat logs introduced into evidence by Mr. Shapiro further detail the scheme to steal Mr. Shapiro's cryptocurrency and AT&T is equally negligent for not protecting Mr. Shapiro against this scheme and fraud.”Similarly, another important facet is whether or not the issue of contributory negligence arises — i.e., would Shapiro’s activities qualify as contributing to the damage, as he should have known not to use a SIM card as an authenticating factor. On the subject, Jonathan Klinger, an Israeli cyber law attorney and blogger, told Cointelegraph:“It is also quite hard to believe that such a material amount of funds were held in an account that merely needed these factors. One should expect the protection of personal data to be proportionate to the amount of funds that he might lose. In this case, these factors weigh in favor of AT&T. Shapiro has a long way ahead before he might get any compensation, in my opinion.""It is also worth remembering that SIM swapping is a relatively new type of fraud that has been growing at a rapid pace over the past decade or so — especially in the wake of the recent crypto boom. Related: Grand Theft Crypto: The State of Cryptocurrency-Stealing Malware and Other Nasty TechniquesThus, investments made through smartphones, laptops and other digital devices are now prone to certain third-party interference, which one needs to be wary of at all times. On the subject, Alina Kiselevich, a communication specialist with a legal background at Enigma Securities, pointed out to Cointelegraph that, “Mr. Shapiro did everything that a responsible client should do” by repeatedly reporting an attack to AT&T and seeking help from the telecoms company:“As you can see, it was impossible for Shapiro to call the police, because it did not happen between long periods of time, but rather very quickly. Robert Jack and Jarratt White, two people standing behind the theft from AT&T’s side, were confirmed to be employed there, their involvement in the case was also confirmed.”Terpin v. AT&T Mobility: Last year, Michael Terpin, a prominent cryptocurrency advocate and the founder of Marketwire, was the victim of SIM swap fraud involving AT&T. He filed a lawsuit against the firm in August 2018, later winning $75.8 million in a civil judgment — even though AT&T filed for a dismissal of the lawsuit, the plea was eventually overruled by the court.Liu v. AT&T: On Feb. 12, 2018, after Mitch Liu's smartphone started malfunctioning, he immediately went to an AT&T store and spoke to the customer care representative, revealing his Social Security number as proof of identification. He was then provided with a new SIM card, which, once installed, allowed hackers to obtain control of his cell phone data. On March 19, 2018, Liu received a message stating that his social media and cryptocurrency exchange accounts had been compromised, and that a total of $10,000 worth of crypto assets had been moved from his wallets.Sidhu v. AT&T: As per court documents recently obtained by Cointelegrah, early last year, AT&T user Jagdeep Sidhu started experiencing issues with his cell phone. He subsequently acquired a new SIM card and upon restarting his phone, Sidhu immediately realized that his Gmail, Coinbase, Facebook and Instagram accounts had been compromised. Basu v. AT&T: On Aug. 27, 2018, REACT investigators confirmed that an unknown individual was able to gain control of Saswata Basu’s phone and steal his AT&T cell phone account via a SIM swap. Shortly afterward, his Yahoo and Gmail addresses were accessed without authorization. In all, it is estimated that Basu lost around 9,000 DASH and 1,287 ETH.Hui v. AT&T: According to legal data acquired by Cointelegraph, on Nov. 20, 2017, Tina Hui tried to log into her Gmail account only to be told that she had changed her password four hours prior. Upon seeing the message, she immediately sent in a request for a password reset and waited for a two-factor authentication text message to arrive. However, when the message did not come, Hui realized that her cell phone might have been compromised. She rushed to an AT&T store to rectify the issue, but by then, a number of her personal accounts, including her Coinbase wallet, had been hacked into."
20,https://cointelegraph.com,"Oct 26, 2019",Bahamas to Release Fiat Digital Currency to Counter Cash Dependence,https://cointelegraph.com/news/bahamas-to-release-fiat-digital-currency-to-counter-cash-dependence,"Bitcoin transactions can be made over alternative low-bandwidth transport 
layers like mesh radios and SMS.” Meanwhile, the Republic of the ...","Oct 26, 2019",The Central Bank of the Bahamas (CBOB) is planning to release its own fiat digital currency in order to ensure economies’ resilience in the event of a natural disaster.,"CBOB governor John Rolle made the statement during his speech at the Counsellors Limited’s Exuma Business Outlook at Sandals Emerald Bay, local news publication the Nassau Guardian reported on Oct. 25. According to Rolle, digital currency has the ability to free the country from dependency on cash — particularly useful after a natural disaster.The digital currency is being developed under the auspices of Project Sand Dollar and will be the Bahamas’ first digital fiat currency. The currency is expected to be accompanied by an associated digital wallet and a card that will contain identical information. Rolle explained:“It would permit wireless restoration of payments connectively, avoiding the cash shipment and cash handling frustrations. It would permit electronic dispersing of aid and allow families to recapture personal dignity by restoring the flexibility to prioritize the elements of personal need that they prefer to satisfy post-disasters.”Rolle noted that following the recent hurricane, the country’s banking sector saw significant damage to the physical structures of Abaco and Grand Bahamas, which led local banks to shut down operations.Indeed, weeks and even months after a natural disaster like a hurricane, power grids in affected areas remain inoperative. More than 11 months after Hurricane Maria, some places in Puerto Rico were still without electricity.Commenting on the potential impact of practical offline crypto transaction solutions, Richard Myers, a decentralized applications engineer at Global Mesh Labs and goTenna, told Cointelegraph:“In many parts of the rural and developing world internet connectivity is both expensive and intermittent. More solutions tailored to these situations would certainly facilitate the use of cryptocurrencies in places where it is needed. Bitcoin transactions can be made over alternative low-bandwidth transport layers like mesh radios and SMS.”Meanwhile, the Republic of the Marshall Islands is also developing its national digital currency as a way to eliminate the country’s dependence on the United States dollar, which it has been using for decades."
22,https://cointelegraph.com,"Oct 25, 2019",World Economic Forum Unveils ‘Mining and Metals Blockchain Initiative’,https://cointelegraph.com/news/world-economic-forum-unveils-mining-and-metals-blockchain-initiative,"How Tyler Winklevoss Converted His Biographer Into a Bitcoin Believer ·
Crypto Platform Sees Its User Base Grow Amid the Global Pandemic.","Oct 25, 2019",The World Economic Forum (WEF) and seven major mining and metals firms are partnering to develop responsible sourcing and sustainability practices using blockchain.,"The Global Mining Review reported details of the new “Mining and Metals Blockchain Initiative” on Oct. 25. The seven partners, together with the WEF, plan to pool their resources to experiment with, design and deploy joint proofs-of-concept as part of an inclusive blockchain platform.Rather than acting individually, the initiative aims to foster industry-wide trust through mutual cooperation and to tackle inadequate standardization and prevent fragmentation in the sector.An industry-wide blockchain initiative has the potential to help the industry both to increase transparency and efficiency and to improve the reporting of carbon emissions, the report notes.Members will reportedly examine issues related to governance, develop case studies and establish a working group. Key areas of collaboration and development will include carbon emissions tracking and supply chain transparency — with projects to tackle provenance tracking, chain of custody and production methods.Jörgen Sandström, Head of the Mining and Metals Industry at the WEF, has given a statement outlining that:“Material value chains are undergoing profound change and disruption. The industry needs to respond to the increasing demands of minerals and materials while responding to increasing demands by consumers, shareholders and regulators for a higher degree of sustainability and traceability of the products.”Alongside the WEF, the initiative’s members are Antofagasta Minerals, the Eurasian Resources Group, Glencore International AG, Klöckner & Co., Tata Steel Ltd. and Tracr, which represents AngloAmerican and De Beers.International regulators and NGOs are also expected to provide input for the firms’ collaborative development of blockchain solutions for the industry.This summer, the WEF published a Blockchain Value Framework guide advising global businesses to invest time in understanding blockchain technology, identifying incentives and accounting for potential risks, and to align its implementation with their strategic priorities.At the end of May, the WEF had announced the formation of six separate “Fourth Industrial Revolution” councils to work on new technology policy guidance.Ahead of today’s industry-wide venture, bilateral blockchain projects in the mining and metals sector have included a Tracr pilot for De Beers and Russia’s Alrosa — the world’s largest diamond mining firm."
23,https://cointelegraph.com,"Oct 25, 2019",Introducing Bispex: A One-Stop Crypto Prediction Market Platform,https://cointelegraph.com/press-releases/introducing-bispex-a-one-stop-crypto-prediction-market-platform,"Pay-to-Play Gaming Is Flawed, Blockchain-Based Platform Says. XBT Provider 
Bitcoin ETN Hits $100 Mln, Partners With Xapo. Cointelegraph ...","Oct 25, 2019","Prediction markets are one of the most interesting platforms that have become associated with blockchain technology. However, they are not without fault, with some even having to deal with intrigues and lawsuits.","Additionally, prediction markets suffer from having bad user experience (UX) and sluggish payouts. On top of it, some that cater to more general subjects suffer from having unquantifiable and arbitrary results.Nevertheless, a new player emerges with its next-generation features and sleek interface. Introducing Bispex, the one-stop cryptocurrency prediction market platform.Bispex is a prediction market service that focuses on cryptocurrency price changes. Based in Seychelles, the project aims to provide a go-to place for making predictions regarding future cryptocurrency price changes and the overall market status.At the helm of the operations is CEO Ashish Babar, a young blockchain-savvy entrepreneur. Mr. Babar is joined by other talented and seasoned experts, which are CTO Mike Kwon, CSO Desiree Yoo, and CMO Patrick Chun. Together, they form the executive body of Bispex.Despite scores of already-existing prediction markets today, there aren’t as many that are dedicated entirely to cryptocurrency price changes. The project believes that this is a very thrilling subject, especially that cryptocurrencies are decentralized, thus having frequent price fluctuations.According to Mr. Babar, one of the problems commonly faced by prediction market sites is the scarcity of information that centres on user behaviour and preferences. This is caused by the lack of proper tools and fewer users who could have otherwise helped to improve their UX.Bispex gathers price information fed by a number of reputable cryptocurrency listing websites and other credible entities to make sure that the prediction results will not be manipulated by anyone with a particular bias or ulterior motive.Aside from providing the sheer thrill of making accurate predictions, the founders believe that Bispex will be able to improve the cryptocurrency industry. Having a prediction market that focuses on cryptocurrency price will entice cryptocurrency enthusiasts, including professional crypto traders, into the competition.These traders can provide professional inputs, allowing new traders to understand the market better. In turn, this will help the latter to refrain from making unwise decisions that can cause them to lose money. Furthermore, prediction markets could inadvertently become survey sites that show the overall mood or opinion of many in cryptocurrency trading circles at a specific moment.Bispex is developing its own token, which it is looking to be listed on multiple exchanges in November. Aside from the prediction market, the platform is also considering having a cryptocurrency exchange service in the future. This exchange will allow spot trading, trade mining, and margin trading for its users.Mr. Babar said in a statement:“We’re the new contenders [in the prediction market sector], but we’ll make sure to be at the top. An accurate prediction market with fast asset liquidation — you can bet on it with Bispex.”Interested bettors can follow Bispex through its official Facebook, Twitter, Instagram, LinkedIn, and Telegram to know the latest developments from the platform."
