,press company,date,title,url,abstract,date detail,head article,main article
10,https://cointelegraph.com,"Oct 25, 2019",Stanford Prof: Crypto Will Rain on Banks’ Low-Interest Rate Parade,https://cointelegraph.com/news/stanford-prof-crypto-will-rain-on-banks-low-interest-rate-parade,"Professor Duffie said the public should not be misled by the relatively 
still-low levels of adoption of decentralized cryptocurrencies such as 
Bitcoin ...","Oct 25, 2019",A professor at Stanford Graduate School of Business says cryptocurrencies will put an end to the windfall that banks currently enjoy from low-interest deposits.,"In an Oct 24 interview for the university,  Dean Witter Distinguished Professor of Finance Darrell Duffies said that one way or another, cryptocurrencies are likely to upend banks’ business model within the next decade.Professor Duffie said the public should not be misled by the relatively still-low levels of adoption of decentralized cryptocurrencies such as Bitcoin (BTC); nor should they take the pushback against Facebook’s Libra as the sign of a moratorium on major private initiatives.“The future is coming, and it will be very disruptive to legacy banks that don’t get with the program,” he said.Whether it in the form of a dollar-backed stablecoin, a Facebook product, or a central bank digital currency, the benefits of the digital asset model will likely mean that banks lose their access to lucrative low-interest deposits within ten years, he said, adding: “New payment methods will trigger greater competition for deposits. If consumers have faster ways of paying their bills, and merchants can get faster access to their sales revenue without needing a bank, they won’t want to keep as much money in accounts that pay extremely low interest.”As the report notes, consumers and businesses currently store around $14 trillion in deposits with United States banks alone that pay out an extremely low rate of interest on average.Banks currently pay less than 0.1% interest on checking and savings accounts, and only a slightly higher rate on one-year certificates of deposit. Meanwhile, the amount banks receive from routine overnight loans has climbed from 0.3% in 2015 to over 2% in 2019.This dependence on deposit accounts to process payments by the vast majority of the population ensures huge profits for banks. In addition, banks charge high fees from credit card vendors — a cost that is mostly then passed on to the consumer. Different models for future central bank digital currencies could also develop in ways that would bypass commercial banks for at least part of the payment process. And if adoption is driven by the private sector — as with Libra, due to the unprecedented scale effects it has — it could have a huge impact on the status quo. He argued that the current system is not sustainable and that technology, economics and public pressure will wrest control of the global payment system away from banks.“The smartest banks will be on the front edge of this, but others will be reluctant to cannibalize their very profitable franchises,” he said. To those banks that are slow on the mark, he cautioned:“The future is coming, and it’s not good.”"
11,https://cointelegraph.com,"Oct 25, 2019",China’s President Xi Urges Accelerated Blockchain Technology Adoption,https://cointelegraph.com/news/breaking-chinas-xi-jinping-urges-accelerated-blockchain-technology-adoption,"Blockchain, not Bitcoin. Xi's push for greater blockchain adoption comes 
against the backdrop of China's long-standing aversion to — and a ...","Oct 25, 2019",China’s President Xi Jinping has called for the country to accelerate its adoption of blockchain technologies as a core for innovation. Xi made the comments at a Politburo Committee session on blockchain technology trends on Oct. 24.,"Xi stressed that the implementation of integrated blockchain technologies is key in promoting technological innovation and transforming industries. He told the committee:“We must take blockchain as an important breakthrough for independent innovation of core technologies, clarify the main directions, increase investment, focus on a number of key technologies, and accelerate the development of blockchain and industrial innovation.”Xi’s push for greater blockchain adoption comes against the backdrop of China’s long-standing aversion to — and a crackdown on — cryptocurrencies. Authorities in the country first banned ICOs in 2017, quickly followed by cryptocurrency exchanges.There have even been reports that at least one government agency is considering a ban on cryptocurrency mining.Unsurprisingly, the one cryptocurrency that the Chinese government doesn’t seem to have an issue with is its proposed central bank digital currency (CBDC). Despite reports throughout the summer that the launch of this was imminent, officials from China’s Central Bank last month said that there was no timetable for the launch of the CBDC.Meanwhile, Facebook’s Mark Zuckerberg has been referencing the threat of Chinese superiority in the digital currency space in an attempt to sell U.S. lawmakers his plans for the Libra stablecoin.""China is moving quickly to launch a similar idea in the coming months. We can't sit here and assume that because America is today the leader that it will always get to be the leader if we don't innovate,” he argued in an official statement. "
12,https://cointelegraph.com,"Oct 25, 2019","Zuck of the Hill: After 6-Hour Libra Grilling, Congress Unconvinced",https://cointelegraph.com/news/zuck-of-the-hill-after-6-hour-libra-grilling-congress-unconvinced,"Related: Digital Yuan: Weapon in US Trade War or Attempt to Manipulate 
Bitcoin? The problem with this argument is that it pits a state-backed ...","Oct 25, 2019","On Oct. 23, Mark Zuckerberg, founder and CEO of social media platform Facebook, appeared before the U.S. House Financial Services Committee to testify on the prospective global cryptocurrency Libra, which his company is backing. He ended up enduring almost six hours of mostly critical questioning, as some of the legislators used the occasion to raise their concerns about many problematic aspects of Zuckerberg’s social media empire, even those not directly related to the cryptocurrency’s operation.","Those who expected the hearings to shed light on many substantive questions regarding Libra’s design and regulatory status that remain unanswered were likely left disappointed. Some observers noted that Zuckerberg was overall successful in achieving his tactical goal, which was to take the beating with humility while getting his main talking points across and making sure to dodge controversial questions. The exchange, however, did not result in much clarity with regard to Libra’s standing with regulators and its overall prospects. As Rep. Patrick McHenry summarized at the end of the hearing, “I’m not sure we’ve learned anything new here.”Indeed, many things that were conspicuous throughout the hearing were already known: that Congress is deeply suspicious of Facebook’s cryptocurrency initiative in the light of the company’s record of high-profile controversies, that some legislators would prefer to break the company up rather than allow it to extend its power into the domain of finance, and that no one fully understands the potential effects of Libra’s launch on the global financial system. If there was anything new in Zuckerberg’s testimony and responses, it was the selection of persuasive tools and the scope of concessions that he appeared willing to make.This was the first Libra hearing for the Facebook boss — previously, it was David Marcus, the head of the forthcoming crypto wallet Calibra, who was dispatched to be grilled on the Hill. As the project seemed to have hit a regulatory wall, Zuckerberg has apparently come to the conclusion that the matter requires his personal attention. The chair of the House Financial Services, Rep. Maxine Waters, welcomed Facebook’s CEO with a rather unequivocal statement in her opening remarks: “As I have examined Facebook's various problems, I have come to the conclusion that it would be beneficial for all if Facebook concentrates on addressing its many existing deficiencies and failures before proceeding any further on the Libra project.”Many of Waters’s Democratic colleagues, who subsequently took the stage, appeared similarly hostile to Libra and Facebook more generally from the outset. They challenged Zuckerberg on a wide array of issues: personal data breaches, discriminatory ad targeting, lack of commitment to diversity, among many others. Rep. Brad Sherman of California invoked the classic “cryptocurrency for criminals” argument, saying: “You’re trying to help those for whom the dollar is not a good currency — drug dealers, terrorists.”Anticipating that, Facebook’s CEO heavily emphasized the patriotic frame, seeking to win sympathies of those concerned with maintaining America’s global influence. He suggested that Libra is the kind of fintech innovation that the U.S. needs in order to stand up to the emerging threat of China’s digital yuan.Related: Digital Yuan: Weapon in US Trade War or Attempt to Manipulate Bitcoin?The problem with this argument is that it pits a state-backed digital currency against one relying on a network of corporate backers. Even to the most hawkish legislators, it may not sound convincing that in order to compete with the Chinese digital currency for global markets, the U.S. should put its faith in Libra, which some believe is itself a potential competitor to the dollar.Naturally, this line of reasoning led to the question: Why not just create a digital version of the dollar? Zuckerberg responded that it would be less attractive to global consumers than a currency backed by a diverse basket of assets. Importantly, he also stated that he would be open to regulations mandating Libra to be majority-backed by the U.S. dollar.Another central theme that Zuckerberg dwelled on was drawing a solid line between Facebook and Libra to convince committee members that the two are distinct entities, and that Facebook will not have any more power over Libra than any other member of the association. He also doubled down on the reassurances that Facebook will not initiate the launch of the cryptocurrency unless it gets all the necessary approvals from U.S. regulators.In illustrating this point, Zuckerberg went as far as to envision a scenario where other members of the Libra Association decide to proceed without securing U.S. authorities’ permission, in which case Facebook would have to pull from the project – something that sounds as realistic as, say, the United Kingdom leaving the Commonwealth.At the same time, the testimony added nothing to the overall understanding of Zuckerberg’s views on what specific regulations should apply to Libra. His responses to specific questions regarding regulation and governance of the Libra Association conspicuously lacked detail, which didn’t help in winning representatives’ endorsements.While some Republican committee members praised Zuckerberg’s entrepreneurial achievements and drive for innovation, not a single one voiced support for Libra during the hearing.  Perhaps McHenry, the ranking member on the House Financial Services Committee, came the closest in calling for a measured approach to the initiative. Just ahead of the hearing, he expressed concern over the possibility that lawmakers may be stifling innovation that they do not fully understand: “My fear is that we now have American innovation on trial by policymakers here in Washington because they don’t understand it. […] Because they’re a big company doing this type of innovation, you have American policymakers trying to pounce on them. This also sends a chilling signal to innovation in the United States.”This sentiment echoes what some of the crypto industry stakeholders have to say on the matter. Patrick McLain, co-founder of San Francisco-based blockchain accelerator MouseBelt, thinks that the hearings are indicative of the legislators’ stance on cryptocurrencies at large and are not about Facebook or Libra:“This is the government putting the very concept of cryptocurrency on trial. Today, lawmakers have drawn a line in the sand that says, ‘Cryptocurrency is unwelcome in the United States, and we will do everything in our power to stop it — including villainize some of the world’s best innovators.’ But cryptocurrency is a borderless and immutable movement that can’t be stopped. Libra may not survive, but something else will.”While some of the issues that members of Congress take with the Libra project are legitimate, others belong to the realm of prejudices that have been refuted by respectable research, suggesting that McHenry might have a point. Tom Robinson, chief scientist and co-founder of blockchain forensics firm Elliptic, told Cointelegraph that the fears of Libra being used by criminals and terrorists are overblown, as it will not prove to be a useful tool for them:“Libra transactions will be transparent and traceable. Law enforcement around the world have repeatedly demonstrated that cryptocurrencies are not safe havens for criminals, because they’re able to trace transactions and identify the individuals behind darknet markets, ransomware attacks and other bad actors. A shift toward crypto-assets would have the opposite effect that is being suggested by many politicians because AML technology is easier and more effective in tracing crypto transactions than fiat.”In sum, regulatory pushback against Libra is fueled both by Facebook’s trust problem and regulators’ lack of understanding of the project’s mechanics and potential effects. While Zuckerberg pledged to comply with all regulations that U.S. government deems necessary to give Libra the green light, he offered little in the way of a comprehensive vision of what such framework may look like. Given the gravity of legislators’ concerns, appealing to the threat of Chinese digital currency competition is unlikely to sway a significant number of lawmakers. After Wednesday’s hearing, the odds of Libra ever seeing the light of day are still unclear, and the project will remain in regulatory limbo until the negotiating parties arrive at a more specific action plan."
13,https://cointelegraph.com,"Oct 25, 2019",Bitfinex Calls Itself 'Victim of a Fraud' in Response to Recent Arrest,https://cointelegraph.com/news/bitfinex-calls-itself-victim-of-a-fraud-in-response-to-recent-arrest,"#Law · #Bitcoin Regulation · #Bitfinex · #Cryptocurrency Exchange · 
#Crimes. Related News. How Tyler Winklevoss Converted His Biographer ...","Oct 25, 2019",Major global crypto exchange Bitfinex has called itself a “victim of a fraud” in response to the recent arrest of the president of Crypto Capital exchange.,"Following the arrest report on Oct. 24, Cointelegraph received a response statement from Stuart Hoegner, Bitfinex's general counsel, on Oct. 25. The statement seeks to establish the company as a “victim of fraud” and to deny potential accusations of illegal activity by Bitfinex.In the statement, Bitfinex claimed that any allegation that Crypto Capital, which is a former Bitfinex’s payment processor, laundered any illicit funds upon request of Bitfinex or its customers is “categorically false.” The exchange wrote:“This week's developments do nothing to affect or otherwise deter Bitfinex's claims to funds in Poland or anywhere else. We will continue to work to recover all funds for and on behalf of our stakeholders.”As reported, Ivan Manuel Molina Lee, the president of Crypto Capital was arrested by Polish authorities allegedly in relation to involvement in money laundering through cryptocurrencies for facilitating international drug cartels. Specifically, Molina Lee was reportedly detained on the basis of a European Arrest Warrant in connection to $350 million that were previously seized by the Polish Ministry of Justice. As a major crypto payment processor, Crypto Capital reportedly served industry-known crypto exchanges in the past, including Binance, Kraken, BitMEX as well as Bitfinex.As previously reported, Crypto Capital is allegedly responsible for Bitfinex’s loss of $880 million. On Oct. 18, Bitfinex’s parent company IFinex filed a discovery application to regain access to over $880 million in funds tied to Crypto Capital, alleging that simply did not keep the fund of Bitfinex’s clients.In the recent statement, Bitfinex noted that Crypto Capital processed certain funds for and on behalf of Bitfinex for several years. The exchange elaborated that at the time, Bitfinex was relying upon representations from Crypto Capital, including those by Molina Lee and another exec Oz Yosef (Oz Joseph), which eventually turned out to be misleading. Bitfinex said:“Among those misrepresentations, Crypto Capital regularly referred to its integrity, banking expertise, robust compliance programme and financial licences. This was designed to assure us that Crypto Capital was capable of handling Bitfinex's transactions.”Another principal, Oz Yosef, has reportedly been indicted on three criminal counts by the United States Attorney for the Southern District of New York, according to Bitfinex."
14,https://cointelegraph.com,"Oct 25, 2019",Ethereum 2.0 Validators to Earn up to 10% Annually for Staking: Report,https://cointelegraph.com/news/ethereum-20-validators-to-earn-up-to-10-annually-for-staking-report,"... his stance towards the Google's much-discussed quantum computing 
progress, which could allegedly impact Bitcoin (BTC) and other crypto.","Oct 25, 2019","Ethereum 2.0 validators can expect to earn from 4.6% to 10.3% as rewards for staking on an annual basis, a senior ConsenSys exec says.","Collin Myers, head of global product strategy at blockchain firm ConsenSys, reportedly claimed that in order to become a validator on the Ethereum 2.0, one is required to maintain a minimum amount of 32 Ether (ETH), which is worth $5,760 at press time. Myers revealed the news at a recent blockchain event Devcon 5, Coindesk reports Oct. 25.Ethereum 2.0 is a major network upgrade on the Ethereum blockchain that is poised to shift its current Proof-of-Work consensus algorithm to Proof-of-Stake, passing block validation function from miners to special network validators. As previously agreed by Ethereum core developers, the first stage of the Ethereum’s transition to Ethereum 2.0 is expected to take place on Jan. 3, 2020.At the same event, Myers also revealed a tool allowing validators to calculate annual gross and net returns, taking into account hardware and energy costs. Dubbed ETH 2.0 Calculator, the new web application is planned for launch in conjunction with Ethereum 2.0, Myers noted. The calculator’s model is discussed in Telegram group ETH 2.0 Calculator.Yesterday, Ethereum co-founder Vitalik Buterin expressed his stance towards the Google’s much-discussed quantum computing progress, which could allegedly impact Bitcoin (BTC) and other crypto. In a tweet on Oct. 24, Buterin pointed out that recent quantum supremacy is as far from real quantum computing as hydrogen bombs are to nuclear fusion, explaining them as:“Proof that a phenomenon and the capability to extract power from it exist, but still far from directed use toward useful things.”"
16,https://cointelegraph.com,"Oct 26, 2019",Poll: 60% Tell Vitalik Buterin ‘No’ to Ethereum Reversing Transactions,https://cointelegraph.com/news/poll-60-tell-vitalik-buterin-no-to-ethereum-reversing-transactions,"The largest altcoin by market cap, ETH has nonetheless fared
underwhelmingly this year as Bitcoin (BTC) cements its position at the top.","Oct 26, 2019",Ethereum co-founder Vitalik Buterin has sparked controversy among cryptocurrency users after suggesting developers could reverse transactions. ,"In a Twitter survey on Oct. 26, Buterin quizzed followers about their opinion of reversing chain activity in the event of a major hack of an exchange or similar entity. “Suppose a popular smart contract wallet that a large portion of the ETH community uses gets hacked. This could be reverted by reverting all chain activity since the hack and doing a DAO-style HF to recover the funds,” he wrote. Continuing, he asked how many coins would need to be stolen in order for followers to support manual reversal. The survey appeared to touch a nerve among commentators. Ethically, they argued, the amount of money should not matter — rolling back transactions removes the benefits of a blockchain without centralized control. “Failchain,” popular Bitcoin pundit Dennis Parker summarized.Correspondingly, more than 60% of the over 10,000 responses to the survey confirmed they would not tolerate remedial measures under any circumstances.Ethereum developers have reversed transactions before, notably following the notorious Decentralized Autonomous Organization, or DAO, hack in June 2016, which lost Ether (ETH) worth $60 million at the time.Ethereum is currently undergoing a major transformation in a long-term upgrade which will ultimately even see it change its algorithm. The changes will help resolve some of the network’s growing pains - in August, Buterin warned its blockchain was almost full.The largest altcoin by market cap, ETH has nonetheless fared underwhelmingly this year as Bitcoin (BTC) cements its position at the top."
18,https://cointelegraph.com,"Oct 25, 2019",Huobi Japan Raises $4.6M From FPG to Expand Crypto Trading Business,https://cointelegraph.com/news/huobi-japan-raises-46m-from-fpg-to-expand-crypto-trading-business,"#Japan · #Huobi · #Bitcoin Regulation · #Cryptocurrency Exchange · #FSA ·
#Regulation. Related News. McAfee on BTC, Exile & the US: 'No ...","Oct 25, 2019","Licensed crypto exchange Huobi Japan has raised 5 million yen ($4.6 million) from Financial Products Group (FPG), a financial instruments business operator.","The development was revealed in a press release shared with Cointelegraph on Oct. 25.Huobi Japan is a wholly-owned subsidiary of major Singapore-based crypto exchange Huobi, which serves traders across over 130 countries. The platform launched this January as a fully compliant entity after a merger with BitTrade — one of only 16 crypto exchanges at the time to have secured a license under the aegis of Japan’s national financial regulator, the Financial Services Agency (FSA). According to today’s announcement, FPG and Huobi Japan will jointly focus on providing support for new financial assets and payment methods.In addition, FPG Group says it anticipates a possible future collaboration with Huobi Japan to further the digitization of Japan’s securities market by combining its expertise as a financial instruments business operator with Huobi’s blockchain technology.A license has been mandatory for all crypto exchanges operating within Japan since the amendment of the country’s Payment Services Act back in April 2017. The FSA evolved increasingly strict requirements for license applicants in the wake of a major $532 million hack in January 2018 of local exchange Coincheck.Coincheck went on to secure an FSA license in January of this year. Other regulator-approved exchanges include LVC Corporation — the digital asset- and blockchain-focused arm of Japanese messaging giant LINE — which was granted a license this September.Founded in China in 2013, Huobi Group has been headquartered in Singapore since Beijing’s crackdown on domestic crypto-fiat exchanges in September 2017. This August, New York-based blockchain infrastructure firm Elementus published research alleging that almost 50% of the total number of PlusToken withdrawals — an alleged crypto Ponzi scheme — were processed via the flagship Huobi platform."
