,press company,date,title,url,abstract,date detail,head article,main article
7,https://www.forbes.com/,"Oct 26, 2019",Bitcoin’s Roller-Coaster Week; Zuckerberg Grilled On Libra,https://www.forbes.com/sites/cryptoconfidential/2019/10/26/bitcoins-roller-coaster-week-zuckerberg-grilled-on-libra/,"Bitcoin sank to a five-month low Wednesday before it surged nearly 40% 
Friday. Getty. LIBRA ON THE HILL. On Wednesday morning, Facebook ...","Oct 26, 2019,12:12pm EDT","Get Forbes' top crypto and blockchain stories delivered to your inbox every week for the latest news on bitcoin, other major cryptocurrencies and enterprise blockchain adoption.","Bitcoin sank to a five-month low Wednesday before it surged nearly 40% Friday.On Wednesday morning, Facebook CEO Mark Zuckerberg testified in front of the United States House of Representatives Committee on Financial Services about Facebook’s role in developing libra, a cryptocurrency backed by a basket of stable international assets and designed to be spendable anywhere in the world.Facebook’s Libra Association, a coalition of companies that will oversee the project, is struggling as it faces growing skepticism and regulatory uncertainly surrounding the new cryptocurrency. It has lost seven of its largest partners in less than a month: PayPal, Visa, Mastercard, Stripe, Mercado Pago, Booking Holdings and eBay. 21 members of the group still remain, including Uber, Spotify and Vodafone. And although Zuckerberg has pledged to cooperate with regulators, there is still red tape to negotiate and politicians to appease before libra can be launched.Zuckerberg appeared before the committee ostensibly to provide an update and more clarity on plans for Facebook’s libra cryptocurrency, but he never clearly explained how Facebook is expecting to profit from libra, and, if the project isn’t about money, why it’s taking on such a complex project at all.Not everyone was convinced by Zuckerberg’s testimony: Congressman Brad Sherman of California dismissed cryptocurrency as technology that is only useful for criminals, and warned that these new types of assets have the potential to threaten the U.S. dollar’s dominance over the global financial system. And committee chairwoman Maxine Waters didn’t hide her contempt in her opening statement:“It would be beneficial for all if Facebook concentrates on addressing its many existing deficiencies and failures before proceeding any further on the libra project,” she said.Wtih libra in the spotlight, bitcoin sank to a five-month low on Wednesday. Prices fell to $7,307.39, their lowest level since May 18.  At this point, the world’s largest cryptocurrency by market value had lost nearly half of its value since reaching nearly $14,000 in June. Jeff Dorman, chief investment officer of asset manager Arca, said that “increased regulatory scrutiny” drove the sale of bitcoin and other cryptocurrencies in the hours leading up to the hearing.But bitcoin regained those losses and much more with a meteoric rise Friday. It rallied nearly 40% in a 24-hour span, briefly exceeding $10,000 late Friday night for the first time in more than a month before settling back to a little more than $9,000.Ripple CEO Brad Garlinghouse weighed in on the issue, telling FOX Business on Wednesday that Facebook “deficit of trust” has hurt the libra project. Garlinghouse also chastised Zuckerberg for telling Congress libra is a way to extend America’s financial leadership: “Last I checked it is based in Switzerland.”Ripple announced on Tuesday that it is opening an office in Washington D.C., which according to company officials makes it the first and only cryptocurrency and blockchain company in the industry with an office devoted to government and regulatory affairs.Plus: Ripple’s XRP has added some 30% to its price since the end of September.In other news, this week also brought the announcement that a coalition of major accounting firms are teaming up with ConsenSys, Microsoft, and others to create a risk assessment tool that provides accountants, auditors, CFOs, and compliance leads with guidance to evaluate digital assets and blockchain technology. HTC now has an entry-level blockchain phone [The Verge]Casa Is Helping Bitcoin Investors Pass on Their Holdings When They Die [CoinDesk]Binance to Launch Venus Cryptocurrency [Bloomberg]"
8,https://www.forbes.com/,"Oct 26, 2019",How U.S. Regulators Could Race To The Bottom For Crypto,https://www.forbes.com/sites/jasonbrett/2019/10/26/how-us-regulators-could-race-to-the-bottom-for-crypto/,"... compliance examiner for the Making Home Affordable Program (HAMP) with 
the Treasury, and have been active in bitcoin and … Read More.","Oct 26, 2019,10:45pm EDT","At the beginning of this month, two major platforms in the blockchain ecosystem received announcements from U.S. regulators. ","On September 30, 2019, a company called Block.one paid a $24 million fine for an unregistered securities offering as part of a settlement with the SEC. Block.one publishes EOSIO and EOS is one of many blockchains built on EOSIO. EOS was created by the developer community. Block.one doesn’t own, manage, or monitor the EOS Public Blockchain. The settlement relates specifically to the ERC-20 token sold on the Ethereum blockchain between June 26, 2017 and June 1, 2018, which is no longer in circulation or traded, and will not require the token to be registered as a security with the SEC nor will there be ongoing reporting requirements. The settlement relates specifically to the ERC-20 token sold on the Ethereum blockchain between June 26, 2017 and June 1, 2018, which is no longer in circulation or trade and will not require the token to be registered as a security with the SEC. On October 10, 2019, the CFTC’s new Chairman Heath Talbert announced Ethereum is a commodity. Ethereum is the second largest blockchain by market cap, with EOS in the top ten. Color macro shotWhat is also interesting is Block.one’s opening of an office in Arlington, Virginia, right next to Washington D.C., with numerous politicians including the Virginia Governor at the opening, indicating the potential of up to 200 blockchain jobs. As I reported earlier this week, Ripple just opened up a major political and regulatory affairs office in D.C. as well. These moves indicate an increased effort by the industry in working the SEC and CFTC. One theory in regulatory relations that goes back quite a while, is the concept of a race to the bottom. Regulators - or countries - attempt to lower the threshold on regulations to attract businesses to its jurisdiction. For example, the Libra Association established itself in Switzerland rather than the United States, perhaps as a result of the Swiss law for nonprofits that makes it easier and less likely to face stringent regulation. In fact, many in Congress asked Libra why not or to please consider re-establishing itself in the U.S. For U.S. regulators, a race to the bottom will occur when an agency may lower its standards in some ways to attract more businesses to be under its purview. While this may seem counterintuitive, the many regulators in the U.S. do have a healthy sense of competition between each other and can equal measures of power and influence in D.C. Indeed, regulators facing a lower amount of entities to regulate translates to budget and job cuts for the regulators of that agency. Customers line up in front of an IndyMac Bank branch in Santa Monica, California, on July 14, 2008. ... [+] Federally-seized IndyMac Bank was due to reopen Monday after suffering one of the biggest bank closures in US history, as the troubled US mortgage industry struggles to stem further meltdown.The regulatory Office of Thrift Supervision (OTS) announced Friday it had placed the California-based bank, worth an estimated 32 billion dollars, under the control of the Federal Deposit Insurance Corporation (FDIC). The mortgage lender, which will reopen as IndyMac Federal Bank, marked the largest bank failure in a year of mortgage and foreclosure crisis highlighted by a surge in defaults and a plunge in housing prices which are rippling through the US economy. AFP PHOTO GABRIEL BOUYS (Photo credit should read GABRIEL BOUYS/AFP via Getty Images)The Global Financial Crisis showed a textbook example of the worst kind of impact from a “race to the bottom”. The Office of Thrift Supervision served as the regulator of Countrywide, IndyMac, Washington Mutual, and AIG - all headline-grabbing bank failures. When a bank fails that is of a significant amount, there is a statutory “Material Loss Review” (MLR) investigation of the regulator and the facts and circumstances of the bank failure. In the case of IndyMac bank, one of the most egregious examples of a regulator placating a bank it was responsible for examining was noted in the MLR below: “...OTS allowed IndyMac to record an $18 million capital infusion from the holding company, received in May 2008, as though it was available on March 31, 2008. This allowed IndyMac to inappropriately report that it was at the well capitalized level as of March 31.” A race to the bottom can lead to the regulator taking the side of the industry it regulates. This is another concept known as regulatory capture, a symptom of this race to the bottom. For cryptocurrency companies, the idea of regulators lowering their standards is probably a breath of fresh air. Indeed, the many regulators in the U.S. economy can make for a costly and confusing dilemma for these companies. With some of the rhetoric in Congress lately on cryptocurrency and blockchain, the idea of a race to the bottom for this industry is actually a much-needed solution to the potential stifling of this innovation that sends U.S. companies overseas. As regulators embrace cryptocurrency and blockchain innovations, the true test will be in the actual, ongoing work of regulating these companies once better clarity is established and the dust settles. Congress and the public relies upon the regulators - and the inherent trust placed in them - to ensure that, as leeway may be offered providing at times “light-touch” regulation, that these do not mean either ignoring the failings of a company to comply with regulators, or in the very worst case with IndyMac bank, being complicit in falsifying regulatory reports on the status of a particular company’s financials. Correction: On Monday, October 28, this article was clarified to reflect that the settlement applies solely to the ERC-20 token raise, where the token is no longer a security and that Block.one is the publisher of EOSIO, a platform for several blockchains to be built upon, including the EOS public blockchain that has EOS as a native cryptocurrency. Block.one, not EOS, opened its offices in Arlington, VA. "
9,https://www.forbes.com/,"Oct 25, 2019","Life After The ICO Hype: What's In Store For The Collective Investment 
Market?",https://www.forbes.com/sites/forbestechcouncil/2019/10/25/life-after-the-ico-hype-whats-in-store-for-the-collective-investment-market/,"Back when bitcoin's popularity started to grow in 2016 and spiked in 2017, 
initial coin offerings (ICOs) were created as the cryptocurrency ...","Oct 25, 2019,07:50am EDT","Back when bitcoin's popularity started to grow in 2016 and spiked in 2017, initial coin offerings (ICOs) were created as the cryptocurrency analogy for classic initial public offerings (IPOs). The goal of ICOs was not necessarily to sell shares. Rather, they were created to issue tokens with no need for stock exchanges or intermediaries like banks.","ICOs' hype started with Ethereum token sales (which is now the No. 2 crypto by market cap). According to ICObench statistics, at least 5,156 ICOs have been created since 2014, with a total $26.17 billion funds raised. But the party didn't last so long. When bitcoin's price started to slide in 2018, the same happened to funds raised by ICOs. In the first quarter of that year, ICOs raised $3.9 billion. However, in Q2, that number slid slightly to $3.8 billion. Q3 saw $1.7 billion in sales, and Q4 saw $0.8 billion.Many crypto investors have lost interest in ICOs, and new token sale formats have been created, namely security token offerings (STOs) and initial exchange offerings (IEOs). But how do these three formats stack up against each other?ICOsIn a classic ICO, a startup issues its tokens and sells them in exchange for other tokens (like bitcoin or Ethereum) through its website. Today, the largest ICO is the EOS project, which raised more than $4.2 billion at the end of its token sales in June 2018.On the darker side of things, in my experience, the ICO format could allow token issuers to completely avoid responsibility for fulfilling obligations. This attracts swindlers and casts a shadow even on bona fide projects. This factor became the main reason for the transition to new models where the risks for investors are reduced.STOsAn STO is the regulated issuance and distribution of tokens that perform the functions of securities (stocks, bonds or derivatives). During this process, I've noticed that bureaucratic procedures slow down and complicate the process, significantly increasing the entry threshold for investors. In addition, STOs significantly limit their number of participants.The STO boom expected in the second half of 2018 or first half of 2019 did not happen. According to PwC Strategy report released in June, the biggest STO of the year of that time was BoltonCoin, which raised $68 million. In comparison, the biggest IEO -- launched by Bitfinex -- raised a whopping $1 billion. So, most investors chose the classic ICO model or went for the IEO, like Bitfinex did.IEOsAn IEO is the newest and most popular token sale format, from what I've seen in the industry. It's often seen as the most balanced option, since it comes with minimum bureaucratic procedures and simultaneously guarantees a certain investment reliability degree.The first IEOs have been held on Binance Launchpad since December 2017, but this format really gained popularity in January 2019 with the BitTorrent token sale, which caused widespread discussion and sparked new hype.According to an InWara report, in the first half of 2019, 59 IEOs were created, and their total funds raised totaled $1.625 billion.Pros And ConsSo, what makes an IEO so attractive for cryptocurrency investors?IEO AdvantagesIEO DisadvantagesInvestors In the IEO eraNowadays, token sales give private investors the opportunity to contribute their money and savings to promising startups without any regulations. This leaves out the need to pay extra money to intermediaries, like in pre-IPO or IPO deals.After “cryptowinter,” the token sale market has considerably matured and stabilized. Still, investors in this market haven't changed. The majority of them, in my experience, are short-term speculators seeking to make three, five or even 10 times returns within one year. That was theoretically possible in the past, but it’s hardly likely now.New crypto investors should study prospective projects before investing in them. It is worth studying some historically successful projects and highlighting their key success factors. Look for these factors in new projects, especially IEOs.ICO, IEO, and other similar models are investments in startups, most often in their very early stages. This is always a big risk. Venture investors have a rule: Out of 10 selected projects, three will completely fail, three will go into the reeds, three will not bring significant profit and only one will find great success.The FutureDespite the booming popularity of IEOs, ICOs and STOs are still relevant. There are still projects that hold token sales on their own -- without relying on exchanges.Above everything else, any token sale is a tool. Any investment instrument carries risks, and these risks are traditionally higher for nonregulated instruments. But, if you can learn to use these instruments competently and diversify your investments, you could achieve great results."
10,https://www.forbes.com/,"Oct 25, 2019","Start-Up KoreConX Launches A New Blockchain Network To Connect The Private 
Capital Market",https://www.forbes.com/sites/robertanzalone/2019/10/25/start-up-koreconx-launches-a-new-blockchain-network-to-connect-the-private-capital-market/,"Today In: Crypto & Blockchain · On-Chain Metrics Paint Bullish Bitcoin 
Price Picture · Big Four Accounting Firm Wants To Empower Enterprises ...","Oct 25, 2019,05:56am EDT","Do you know how to invest in the private capital market?  Not many people do.  It is complicated, requires a lot of paperwork, has low transaction volume, comes with risk and volatility, and not very liquid. ","Could distributed ledger technology (DLT) be used to reduce back-office fees and expand the market for this asset class? I interviewed Oscar Jofre, CEO and co-founder of KoreConX, who believes his platform and infrastructure can help.KoreConX is a company working to change how businesses raise capital.  Mr. Jofre is an advocate for using DLT to bring transparency to a fractured process.  Mr. Jofre mentioned, “There are over 90,000 companies in our platform from around the globe who have raised more than $6.6 billion. Companies who use the KoreConX platform raised capital working with broker-dealers or direct offerings on their own. We are purely providing the technology to make sure they are fully compliant and to manage the entire process.”What is the private capital market?  What are the problems?The private capital market represents companies not publicly traded on stock exchanges. Private funds, venture capital investors, and some mutual funds are typically the main buyers.  Investments can be in new start-up enterprises, mature business, or sometimes struggling firms. This type of asset is considered to be highly risky.  One critical problem, the team at KoreConX explained, was the lack of market access for small firms. Dr. Kiran Garimella, KoreConX’s CSO and CTO, said, “The majority of participants in private capital markets are smaller entities who are closely connected with local companies and investors. They cannot afford huge expenses for integrated systems.”  KoreConX specializes in connecting all sizes of firms rather than limiting their scope to more mature enterprises.  Interestingly CEO Oscar Jofre’s background is crowdfunding, which is a driving influence in his business.Jason Futko, CFO and co-founder, said, “It is often difficult for companies in the private capital markets to identify investors to present their opportunity. The fragmentation in this market can make it difficult to find investors or other professionals to help you grow your business.” On June 26th, 2019, Broadridge bought from Northern Trust a similar blockchain platform.  There is competition in this space from many players. Mr. Jofre said, “There are companies like Carta, Capshares, ComputerShare, AST, and Link Group that offer some of the features KoreConX provides in our all-in-one platform. We have a much different view of the market. To truly transform it, we need to make sure all participants have all the tools they need. If they don't, then we will never see any great change in the private capital markets.”KoreConX launched on October 11th, 2019, their new blockchain ecosystem for fully compliant digital securities worldwide.  Their mission is to ensure compliance with securities regulation and corporate law.  The KoreConX platform includes securitized token issuance, trading, clearing, settlement, management, reporting, and corporate actions.As explained to me by the management team, the lack of data integrity and regional knowledge of jurisdictional compliance can restrict investment opportunities offered to the public.  Mr. Futko continued, “Obviously part of the solution under KoreConX has to be around connecting document fragmentation, providing access to professionals and creating trust through our blockchain, which ensures both business and regulatory logic.”Why can blockchain technology help now?The KoreConX team stated that the private capital markets serve over 450 million private companies worldwide today.  They have a lack of document transparency and high fees. Compare this to public capital markets, which have established listing standards and rules.  Furthermore, open markets are used every day and can handle many transactions.  Dr. Garimella said, “Blockchain offers technology that provides solid mechanisms for trust through immutability and consensus among parties.”I asked Mr. Jofre to explain why his work was different from larger companies, like Broadridge? He responded, “KoreConX is entering a market with many providers who have a single feature or application. For private capital markets to be as efficient, as public listed markets, it needs an infrastructure layer and an application layer.  KoreConX brings both.  We do not exclude anyone because of size or geography.”"
