,press company,date,title,url,abstract,date detail,head article,main article
0,https://cointelegraph.com,"Oct 26, 2019","Bitcoin Price Soars 42% to $10,500 — Biggest Daily Gain Since 2011",https://cointelegraph.com/news/bitcoin-price-soars-42-to-10-500-biggest-daily-gain-since-2011,"Crypto markets are in shock as Bitcoin price posted its biggest daily gain 
since 2011, squeezing $150 million in short positions to the disbelief ...","Oct 26, 2019","The last 24-hours have been an absolute roller coaster for Bitcoin price (BTC). Earlier in the week, BTC swiftly dropped by 10% after failing to hold above the $8,000 support.","Crypto market data daily view. Source: Coin360By Thursday, BTC/USD was sitting on the bottom trendline of the descending channel and many investors and analysts were calling for a drop to $7,000.A few even predicted that a revisit to the long-term support at $6,500 was on the cards. Despite the bearish bias, traders like Scott Melker and Michaël van de Poppe spotted a series of bullish divergences on the 4-hour and daily timeframe and by Friday morning (Oct. 25) the chart and various indicators on the hourly and 4-hour timeframe were flashing bullish.Investors believed that a quick upside move to $7,700-$7,800 would occur and many expected that bears would open their short positions at the top of this range and eventually push Bitcoin price back down to the mid $7,000s or high $6,000s at worst. Obviously, this is exactly what did not happen and the short squeeze that accompanied the first part of Bitcoin’s 16% rally from $7,450 to $8,600 resulted in the liquidation of $150 million shorts at BitMEX.BitMEX XBT USD Liquidations. Source: Skew.comAfter such a strong move, consolidation around the $8,300 to $8,500 region was the next expectation that traders had in mind. Tackling the $8,800 resistance would have been the next step and it seemed likely that this would play out depending on the state of the weekly candle at closing. Surprisingly, Bitcoin bulls gathered up enough steam for a final hurrah, and towards the evening of the U.S. trading session bulls pressed Bitcoin price far above the $8,800 resistance to set a higher high at $10,540.Analysts and traders will probably spend the weekend searching for the exact reasons that catalyzed today’s strong 36% surge — the biggest daily gain since 2011. Currently, the crypto community is pointing to Chinese President Xi Jinping’s call for the development of blockchain technology throughout the country. Bakkt’s Bitcoin futures back to back all-time high volume achievements are also being cited as a reason for Bitcoin’s surge. BTC/USD daily chart. Source: TradingviewAs shown by the daily chart, Bitcoin bounced off the descending trendline at $7,400, rallied up to the 61.8% Fibonacci retracement level, then rocketed through the 111, 128 and 200-day moving averages (DMA). The volume profile visible range shows that numerous levels of resistance were sliced through and the wick to $10,542 set a higher high not seen since Sept. 6. Bitcoin stopped its advance right at a high volume node (VPVR) and a move above $10,542 should proceed toward $10,970 and $11,500, and then to $12,000, according to the daily chart. If Bitcoin can clear $12,000 over the coming weeks, it could be set for a blue sky breakout.BTC/USD daily chart. Source: TradingviewAt present, the forecasted death cross between the 50 and 200-DMA has been avoided and the 50 DMA is curling away from the 200 DMA. The MACD line shot far above the signal line and the bullish divergence that analysts identified on the daily MACD and RSI proved to be an early indicator of what was to come. Divergence is simply when the price trends in one direction and an oscillator trends in a counter direction.BTC/USD weekly chart. Source: TradingviewThe 36% surge even altered the trajectory of the weekly MACD, flipping the histogram from deep red to pink and curving the MACD up toward the signal line. As shown by the chart above, barring some unprecedented price reversal, Bitcoin appears set for a pleasant weekly close above the descending channel. Some will even go as far as labeling the current setup a trend reversal. Over the short-term, it is possible that Bitcoin could pull back to the upper arm of the descending channel at $9,360. This point also aligns with the upper arm of the Bollinger Band indicator and after strong upside moves the price has a tendency to settle near the top arm and the middle moving average of the indicator. On the daily timeframe, a drop to the 20-MA of the Bollinger Band indicator would set Bitcoin price near $8,200. Prior to reaching this point, Bitcoin could first retrance to $8,800 and $8,600, points which were reached on Oct. 9 and Oct. 11.BTC/USD 4-hour chart. Source: TradingviewAt the time of publishing, there is a spinning top candle on the 4-hour chart and volume has dropped off significantly when compared against the high volume spike seen on Oct. 26. As mentioned earlier, the MACD on this time frame is pulling a reading not seen since Aug. 5, 2019.BTC/USD 4-hour RSI. Source: TradingviewThe 4-hour RSI has also popped above 85, a point which in the past has marked exhaustion from buyers. The same can be said for the Stochastic RSI (Stoch). If Bitcoin has become overbought on the shorter timeframes, then the current spinning top candle is evidence of this. The current pause in momentum and indecision could also be the result of profit-taking and a drop off in volume as traders are wary of buying the top after such a high volume breakout. If the rally does not resume shortly, most traders will probably observe to see whether Bitcoin consolidates and builds support before entering into new positions. The views and opinions expressed here are solely those of the author (@HorusHughes) and do not necessarily reflect the views of Cointelegraph. Every investment and trading move involves risk. You should conduct your own research when making a decision."
1,https://cointelegraph.com,"Oct 25, 2019",Bitcoin Price Returns to $7.6K as Markets Reaffirm New Support Levels,https://cointelegraph.com/news/bitcoin-price-returns-to-76k-as-markets-reaffirm-new-support-levels,"After a day at the lower bound of a well-defined trading corridor, Bitcoin 
rose up to tackle $7,650 and reclaim some ground lost in its major slide ...","Oct 25, 2019","Bitcoin (BTC) hit $7,600 on Oct. 25 after a spell of bullish upward action saw 2% gains occur in a matter of minutes. ","Cryptocurrency market daily overview. Source: Coin360Data from Coin360 showed BTC/USD passing the $7,600 mark across major exchanges, going on to challenge $7,650 before correcting. At press time on Friday, Bitcoin was fluctuating around the new levels, still down around 8% versus the beginning of the week. Bitcoin seven-day price chart. Source: Coin360The latest in a series of abrupt moves, the potential reasons for the behavioral shift are still becoming clear. As Cointelegraph reported, major bagholders along with external factors are the favorites among analysts.Others focusing on price were unsurprised by a bounce off what they previously identified as the lower boundary in a longer-term trading corridor. Cointelegraph contributor Michaël van der Poppe had previously noted the 200-day moving average for Bitcoin (around $7,400) would form a likely support area. “These dips on $BTC are overall giving you a beautiful opportunity to buy until the market starts its next wave up,” he told Twitter followers on Thursday prior to the uptick. Resistance for Bitcoin still remains heavy closer to $8,500. Beyond technical circles, the mood suggests a catalyst is needed to overcome this. This week, investor Mike Novogratz told mainstream media that new custody solutions for institutional investors could be the clinching factor. “It’s going to need new energy to really make the big move,” he said in an interview with CNBC.Altcoin markets meanwhile began taking advantage of Bitcoin’s reversal, gaining fairly strongly on the day. Ether (ETH), the largest altcoin by market cap, was up 2.8% at close to $166, in line with most coins in the top twenty. Ether seven-day price chart. Source: Coin360Others performed even better, with XRP gaining 4.4% and Binance Coin (BNB) 5.8%. A freak move by Bitcoin SV (BSV) nonetheless stole the show, climbing 16% in the past 24 hours. The overall cryptocurrency market cap was $208 billion, with Bitcoin’s share at 65.6%."
2,https://cointelegraph.com,"Oct 27, 2019",Ether Price: 30% Weekly Gain Driven by Bitcoin Rally – Next Stop $225?,https://cointelegraph.com/news/ether-price-30-weekly-gain-driven-by-bitcoin-rally-next-stop-225,"Ether flipped bullish, gaining 24% as Bitcoin rallied 42% on Oct. 25. The 
altcoin now aims for $200. 10227 Total views. 194 ...","Oct 27, 2019","On Oct. 25 Bitcoin (BTC) unexpectedly gained 42%, one of the largest daily gains witnessed since 2011. A number of altcoins benefitted from this startling upside move and Ether (ETH) rallied 24.23% alongside Bitcon. ","Daily crypto market data daily view. Source: Coin360This week also saw a deluge of positive news from decentralized finance (DeFi) companies which are expanding, increasing interest payments, and reducing loan interest rates on many of the crypto-based products and services they offer. A few of the major DeFi-related announcements this week were: – Dharma relaunched it’s DeFi platform and now supports DAI and USD Coin (USDC)– Crypto-lending platform Nexo reduced its loan rates to 5.9% on all instant credit lines.– Celcius Network increased the interest of Tether (USDT) deposits to 9.75% and 12% for investors who opt to receive interest payments in CEL token.– Digital asset broker Voyager Digital announced that it would provide 3% interest on all Bitcoin held on it’s platform.While these developments might not be directly connected to the Ether, investors are aware that the number of Ether locked into DeFi platforms has risen tremendously risen throughout 2019 and the majority of DeFi platform are built on the Ethereum Network. According to data from DeFi Pulse there is currently $598.5 million worth of cryptocurrency locked into DeFi platforms and 3.3 million Ether tokens in lockup.Total Value (ETH) Locked in DeFi. Source: Defipulse.comIn a way, DeFi has become somewhat synonymous with Ether and the Ethereum network which could be leading investors to interpret all DeFi news as potentially bullish events for Ether.This week’s 30.29% gain from Ether backs up the claim that the altcoin’s price action has been riveting as of late. The week started with Bitcoin’s collapse from $8,050 which rocked Ether and caused its price to drop out of the descending wedge pattern to form a double bottom at $152.95. Prior to Friday’s massive Bitcoin led rally which saw BTC gain 42% and Ether 24.23%, the altcoin traded in a gray area, nudging quietly against the bottom trendline of the descending wedge. The historic Oct. 25 rally sent Ether price well above the trendlines of the descending wedge to set a near 2-week high at $199.61.ETH USD daily chart. Source: TradingViewCurrently Ether is situated right at the 50-day moving average after setting a 16-day high at $199.61 which was well above the 100-day moving average. A move back to $200 would place price on top of the upper Bollinger Band arm and right at the 200-day moving average (DMA). This move would also align with the steep drop from $204 that took place on Sept.24 and was previously the first sell target for any Ether position opened from $152. The volume profile visible range (VPVR) shows that in the current range from $180 to $206 there is limited overhead selling pressure so in addition to yesterday’s 24.23% gain, momentum traders might pull up their stop orders with the anticipation that volume sustaining on Bitcoin and Ethereum, Ether could still have an additional 11% to run. ETH USD daily MACD. Source: TradingViewThe daily moving average confluence divergence (MACD) also shows promise. The MACD and signal line pulled off a bullish crossover and the histogram flipped positive and currently sits above 0. The magnitude of this move is shown on the shorter time frames and the momentum on the 4-hour MACD histogram reached a high not seen since Sept. 28. The daily RSI has also entered bullish territory (50) ETH USD weekly chart. Source: TradingViewThe weekly time frame shows Ether broke above the descending channel and briefly pierced the 61.8% Fibonacci retracement level, a point which is significant to many traders. Above the first take profit level ($204) Ether needs to surmount the 78.6% Fibonacci retracement level $211.48 which would also represent a higher high above the 27.8% dump that occured on Sept. 23. An upside move to $211 would also nearly cross above the 20-week moving average on the weekly Bollinger Band indicator. ETH BTC daily chart. Source: TradingViewThe ETH/BTC pairing does not exhibit the same bullish scenario as the USD pairing. The 10% drop on Oct. 26 formed a monthly low (Sept. 26) and a double bottom at 0.018847 satoshis (sats) which is typically a reversal pattern. Ether remains below the 200-DMA and Friday’s drop also plunged the altcoin below the 50-DMA. Without reading into the situation too deeply, it's possible that as Bitcoin made its stunning upside move, traders shifted into BTC to catch the action. The daily MACD, RSI and Stoch RSI are all also uninspiring. Traders can keep an eye on volume and the recently formed double bottom to see if this leads to a reversal. One would expect that if the ETH/BTC pair turns bullish, similarly significant price action will be mirrored on the ETH/USD pairing. In the event that the ETH/USD pairing turns bearish and drops below $170, there is support by the previous double bottom at $152.95 and the support at $146.60.The views and opinions expressed here are solely those of the author (@HorusHughes) and do not necessarily reflect the views of Cointelegraph. Every investment and trading move involves risk. You should conduct your own research when making a decision."
3,https://cointelegraph.com,"Oct 25, 2019","Bitcoin Transferred a Giant $11 Trillion Since 2009, New Data Reveals",https://cointelegraph.com/news/bitcoin-transferred-a-giant-11-trillion-since-2009-new-data-reveals,"Bitcoin's transaction activity on the blockchain dwarfs competitors around 
for longer, notably PayPal, whose annual volume Bitcoin beats in just ...","Oct 25, 2019","Bitcoin (BTC) has transferred $11 trillion in wealth since its blockchain first went live in 2009, according to the fresh calculations.","Uploaded to social media by analyst PlanB on Oct. 24, the latest buoyant statistics for Bitcoin show the largest cryptocurrency is still beating out fiat competitors. At present, the network is processing around $9.6 billion every day. At that rate, Bitcoin passes PayPal’s annual transaction volume — $578 billion for 2018 — in just two months.PlanB used his Bitcoin full node to verify the transaction data. The numbers underscore the continued interest in Bitcoin, coming despite the bearish price action in the second half of 2019. Its ability to beat out major fiat alternatives including Visa and Mastercard is meanwhile nothing new. As Cointelegraph reported, in April, new research even suggested that Bitcoin could overtake the fiat payment heavyweights by 2029.“In just 10 years, Bitcoin has managed to compete with the leaders of the payment system industry. Bitcoin’s development is occurring exponentially,” analysis firm DataLight concluded at the time. In the future, as the development of off-chain scaling solutions such as the Lightning Network brings new advances, less and less activity in Bitcoin will occur on the blockchain. This, commentators note, should ensure current block sizes cope with demand.Earlier this month, Samson Mow, CSO of Bitcoin technology company Blockstream, suggested that there is already more than enough spare capacity in Bitcoin."
4,https://cointelegraph.com,"Oct 25, 2019","Altcoins React on BTC’s Sudden Surge, Some Major Coins Post Double-Digit 
Gains",https://cointelegraph.com/news/altcoins-react-on-btcs-sudden-surge-some-major-coins-post-double-digit-gains,"Following Bitcoin's sudden jump earlier in the day, altcoin markets have 
also entered the green zone, with some of the major cryptocurrency ...","Oct 25, 2019","Following Bitcoin’s (BTC) sudden jump earlier in the day, altcoin markets have also entered the green zone, with some of the major cryptocurrency markets registering solid growth.","Cryptocurrency market daily overview. Source: Coin360Bitcoin had been hovering around $7,500 during the day until it suddenly surged over $500 in just five minutes to the $8,391 price mark. At press time, the leading crypto is trading at around $8,541, up by nearly 15% on the day.Bitcoin 24-hour price chart. Source: Coin360Top-20 coins are posting gains as well, with some of them seeing double-digit price increases. The major gainers on the list are Bitcoin Cash (BCH), Bitcoin SV (BSV) and EOS, having registered 20.5%, 20.08% and 15.21% increases in value over the past 24 hours.The largest altcoin, Ether (ETH), has registered solid gains of 11.6% on the day to trade at around $181 at press time. However, Ether’s current price is not the highest on its monthly chart, as it posted $196.5 on Oct. 11.Ether 24-hour price chart. Source: Coin360XRP is also seeing significant daily gains, up by over 8% at press time. The altcoin is currently trading at $0.299, while its highest price point on the day was $0.303.XRP 24-hour price chart. Source: Coin360Tether (USDT), Unus Sed Leo (LEO) have experienced minor gains of 0.02% and 2.03% over the day, and are trading at around $1 and $0.971 at press time respectively.Meanwhile, Tether  is gaining popularity as a payment method, with some analysts seeing it catching up with Bitcoin and Ether. According to some experts, users choose Tether due to the stablecoin’s capability to avoid price fluctuations.A professor at Stanford Graduate School of Business says cryptocurrencies will put an end to the windfall that banks currently enjoy from low-interest deposits, stating that cryptocurrencies are likely to upend banks’ business model within the next decade."
