,press company,date,title,url,abstract,date detail,head article,main article
0,https://www.forbes.com/,"Oct 25, 2019",Bitcoin Rallies Close To 40% In 24 Hours,https://www.forbes.com/sites/cbovaird/2019/10/25/bitcoin-rallies-close-to-40-in-24-hours/,"Bitcoin prices have risen sharply today, climbing upwards of 40% and 
breaking through the psychological $10,000 level after suffering a rough ...","Editors' Pick|Oct 25, 2019,11:40pm EDT","Bitcoin prices surged today, climbing roughly 40% as the digital currency benefited from numerous ... [+] tailwinds. (Photo Illustration by Chesnot/Getty Images)","Bitcoin prices have risen sharply today, climbing upwards of 40% and breaking through the psychological $10,000 level after suffering a rough few days. The world’s most prominent digital currency reached as much as $10,332.41 around 9:45 EDT, CoinDesk figures show. At this point, the cryptocurrency was up 39.8% from the intra-day low of $7,393.26 it fell to earlier in the day, additional CoinDesk data reveals. [Ed note: Investing in cryptocoins or tokens is highly speculative and the market is largely unregulated. Anyone considering it should be prepared to lose their entire investment.]Much of the day’s gains took place within short periods of time, as bitcoin rose sharply during a few hours between the late morning and early afternoon, and then enjoyed another strong rally that started after 8 p.m. EDT. The digital currency rose to more than $8,700 as a result of the first upward movement, and extended these gains to surpass $10,000 later at night. This bullish activity took place after bitcoin suffered some notable losses earlier this week, dropping to its lowest since May. The cryptocurrency’s price declined shortly before Facebook CEO Mark Zuckerberg provided Congressional testimony regarding Libra, a proposed digital currency project. More recently, technical analysts emphasized that the digital currency was approaching a bearish formation called a Death Cross, which would provide a signal of further losses as a result of a 50-day moving average (DMA) dropping below a 200-day moving average. However, markets received a boost earlier today, when Xi Jinping, president of the People’s Republic of China, emphasized the significant opportunity presented by blockchain technology. Bitcoin’s upward movement forced speculators to close out short positions, triggering further upside. The cryptocurrency’s continued rise helped trigger FOMO (fear of missing out), noted analysts, which fueled additional gains. John Todaro, director of digital currency research for TradeBlock, commented on these developments. “Leading up to Mark Zuckerberg's Libra hearing, bitcoin had sold-off as many traders put on bearish positions,” said Todaro. “The technical set up looked negative, but then President Xi Jinping's commentary around blockchain technology was an unexpected positive catalyst that caught some bearish traders off guard in my view, leading to the upward movement which likely brought in more speculators as BTC traded above key thresholds,” he added. Marouane Garcon, managing director of crypto-to-crypto derivatives platform Amulet, also weighed in, emphasizing the key importance of the comments involving China. “There were quite a lot of liquidations but I think it’s still mostly about President Xi’s announcement because people know that his green light will cause a ripple effect across China,” he stated. “The space needs China’s involvement,” added Garcon. “If China would’ve never banned crypto trading and exchanges the space would be a lot bigger today,” he said. “Having China onboard, in my opinion, is just as good if not better than having America onboard.”Forbes Offer: Stay informed and ahead of the crowd with Forbes Crypto Confidential, a free weekly e-letter delivered to your inbox. Sign up today.––Disclosure: I own some bitcoin, bitcoin cash, litecoin, ether and EOS. "
1,https://www.forbes.com/,"Oct 26, 2019","After Recovery To $10,000, Bitcoin ‘Should Hit $100,000 In 2021’",https://www.forbes.com/sites/billybambrough/2019/10/26/after-recovery-to-10000-bitcoin-could-hit-100000-in-2021/,"The bitcoin price dropped like a stone on Thursday, falling to five-month 
lows of just over $7,000 per bitcoin, only to bounce back to over ...","Oct 26, 2019,10:43pm EDT","Bitcoin has had a roller-coaster week, with crypto market watchers on the edge of their seats for more wild price swings.","The bitcoin price dropped like a stone on Thursday, falling to five-month lows of just over $7,000 per bitcoin, only to bounce back to over $10,000–enlivening what had been a stagnant market and leaving analysts scratching their heads as to the cause of the extreme volatility.Ahead of bitcoin's sudden market moves this week, bullish bitcoin speculators had remained confident the market will explode over the next couple of years, with the big rebound further emboldening investors–and chasing away bitcoin bears, at least for now. Bitcoin's wild swings this week have revitalized trader and investor hopes that bitcoin could be ... [+] back on course to top its all-time highs. Earlier this week, widely-respected bitcoin analyst PlanB, who created the so-called stock-to-flow bitcoin pricing model, reiterated his expectation that bitcoin will hit $100,000 before Christmas 2021. ""Somewhere between and year and a year-and-a-half after the [May 2020] halving, so say before Christmas 2021, bitcoin should be, or should have been above $100,000,"" PlanB told Global Macro Investor founder Raoul Pal. ""If that’s not the case, then all bets are off and [the model] probably breaks down. I don’t expect that to happen.""The stock-to-flow pricing model calculates a ratio based on the existing supply of an asset against how much is entering circulation. Commodities such as gold–with the largest stock-to-flow ratio of 62, meaning it would take 62 years of gold production to get the current gold stock–have a higher stock-to-flow ratio and are valued by investors for their scarcity. Silver has the second-largest stock-to-flow ratio with 22 years for its production to reach the current silver stock. Bitcoin currently has a stock-to-flow ratio of 25 though the model sees this increasing to 50 following the scheduled 2020 bitcoin halving.In May next year, unless the bitcoin network computing power radically changes, the coin reward for mining new bitcoin blocks will drop from 12.5 bitcoin to 6.25 bitcoin–cutting the supply of new bitcoin coming onto the market by half. Earlier this year, Morgan Creek Digital co-founder Anthony Pompliano similar predicted bitcoin will hit $100,000 by the end of 2021, pointing to looser monetary policy from the world's central banks and bitcoin's next halving as a ""perfect storm""–though not everyone agrees. The bitcoin price stagged something of a recovery this week but remains far from its year-to-date ... [+] highs of almost $14,000 per bitcoin set in late June. Following bitcoin's spike yesterday, those in the bitcoin and crypto industry were quick to jump on recent developments as an explanation for bitcoin's uptick. ""I do think Mark Zuckerberg’s testimony got a lot of people worried of a bigger retaliation from regulators, but after most of the questioning had nothing to do with cryptocurrency or libra and with reports of China premier Xi describing blockchain as a 'rule of law network'–spirits have risen and the bull is back,"" said Alex Mashinsky, chief executive of New York-based crypto lending platform Celsius Network.China's president President Xi Jinping said on Thursday that the country should ""seize the opportunity"" of bitcoin's blockchain technology, taken by some that China could ease its strict bitcoin and crypto restrictions.Ahead of Xi's comments, Facebook's chief executive Mark Zuckerberg was savaged by U.S. senators over his plans for a bitcoin rival, dubbed libra, leaving crypto investors with fresh fears there could be a global crackdown on bitcoin and other digital tokens."
2,https://www.forbes.com/,"Oct 25, 2019","Forget China—Is This The Real Reason Bitcoin, Ethereum, Litecoin, And 
Ripple’s XRP Bounced?",https://www.forbes.com/sites/billybambrough/2019/10/25/forget-chinais-this-the-real-reason-bitcoin-ethereum-litecoin-and-ripples-xrp-bounced/,"Many bitcoin and cryptocurrency market analysts pointed to comments made by 
China's president President Xi Jinping that the country should "" ...","Oct 25, 2019,09:06pm EDT","Bitcoin has swung wildly this week, as many had expected it to, with it losing $1,000 per bitcoin a few days ago before suddenly shooting back up earlier today. ","The bitcoin price is now at over $9,000 per bitcoin after dropping to lows of almost $7,000 on Thursday–and heading fast towards the psychological $10,000 mark, according to the latest prices from Luxembourg-based exchange Bitstamp.Elsewhere, other major cryptocurrencies ethereum, litecoin, Ripple's XRP, and bitcoin cash rallied between 7% and 23%, adding billions to the value of the combined cryptocurrency market.The bitcoin price had been treading water for around a month before its extreme volatility this ... [+] week.Many bitcoin and cryptocurrency market analysts pointed to comments made by China's president President Xi Jinping that the country should ""seize the opportunity"" of bitcoin's blockchain technology as the reason behind bitcoin's sudden rally. China banned bitcoin and cryptocurrency exchanges in 2017 and some took Xi's blockchain comments as a sign the country could ease bitcoin and crypto restrictions.""We must take the blockchain as an important breakthrough for independent innovation of core technologies,"" Xi reportedly said, speaking at the 18th collective study of the Political Bureau of the Central Committee in Beijing.""[We must] clarify the main direction, increase investment, focus on a number of key core technologies, and accelerate the development of blockchain technology and industrial innovation."" However, Xi's comments, which referred only to blockchain technology and not to bitcoin and cryptocurrencies, might not have been the driver behind bitcoin's recovery. Following bitcoin's sudden drop earlier this week, bitcoin and crypto investors feared the worst wasn't over the for the market. The bitcoin price has suddenly surged after a sell-off earlier this week, leaving many bitcoin and ... [+] crypto traders scratching their heads. Facebook's chief executive Mark Zuckerberg was savaged by U.S. senators over his plans for a bitcoin rival dubbed libra and crypto investors are fretting there could be a global crackdown on bitcoin and other digital tokens. Elsewhere, technical data pointed to a so-called ""death cross"" for bitcoin, while the Fear & Greed Index slumped and a Twitter reading of investor temperature was poor. ""Sentiment in the crypto market is very low right now,"" eToro senior market analyst Mati Greenspan wrote in a note to clients before the pump earlier today. This sentiment slump meant investors bet against the bitcoin price, predicting it would move lower.When the bitcoin price recovered a couple of hundred dollars per bitcoin in just a few minutes, some $150 million worth of short positions on the Seychelles-based BitMEX crypto exchange were liquidated, according to bitcoin and cryptocurrency analytics provider Skew.This triggered what's known as a ""short squeeze,"" where an asset rapidly increases in value due to short sellers trying to cover their positions, resulting in buying volume that drives the price up.""Sentiment can change pretty quickly in this market, especially while volumes are low,"" Greenspan added in his earlier note. A small uptick in the bitcoin price led to millions of dollars of bitcoin short positions being ... [+] liquidated. Bitcoin volumes have been struggling recently, leaving the market especially vulnerable to so-called whales placing large orders or liquidating short positions. Bitcoin trading volume among the top ten biggest bitcoin and crypto exchanges has fallen to under $200 million a day, according to bitcoin and crypto data company Messari, down 20-fold from a peak of $4 billion per day just a few months ago.Adding to the market turnaround, bitcoin futures exchange Bakkt recorded a new all-time high in daily trading volume with 1156 futures contracts traded today. It was Bakkt's lacklustre volumes that many believe triggered bitcoin's fall from its $10,000 plateau late last month."
3,https://www.forbes.com/,"Oct 25, 2019",Bitcoin Has Crashed Again—What Now?,https://www.forbes.com/sites/investor/2019/10/25/bitcoin-has-crashed-again--what-now/,"Bitcoin (BTC) is falling because China is closing with the U.S. on a trade 
deal. Today In: Investing ...","Oct 25, 2019,09:18am EDT",(Photo Illustration by Chesnot),"I’ve been drawing and posting the following chart, and variations on it, a lot recently and being bearish that the outcome would be a breakdown.The Bitcoin chart as I have been drawing it latelySo here it is and here is a bearish map:The Bitcoin chart is bearishSo we are looking down the barrel of another potential $1,500 drop.What to do?Firstly, a change in the global situation could dramatically change the picture.Bitcoin (BTC) is falling because China is closing with the U.S. on a trade deal.The recent sudden fall, at least in my model, is because the deal suddenly got much closer.Again, in my model we should hear this good news in the coming days.What to do depends on your position:Personally I’m buying the dip and happy to have an equity hedge. BTC seems to have 5-10 convexity to my equities, so what is not to love?It’s hard to sit there and watch positions take a beating but that is what hedges do. The key is the overall result and one thing is for sure, chopping and changing is expensive and very, very hard to get right.So buy and hold and dollar cost averaging is the way to go with BTC and it looks like there is some cheaper BTC coming our way.Forbes Special Offer: Click here to get How To Gain Early Access To Crypto Asset Projects.–-Clem Chambers is the CEO of private investors website ADVFN.com and author of Be Rich, The Game in Wall Street and Trading Cryptocurrencies: A Beginner’s Guide. In 2018, Chambers won Journalist of the Year in the Business Market Commentary category in the State Street U.K. Institutional Press Awards."
4,https://www.forbes.com/,"Oct 25, 2019","Bitcoin Defies Death Cross, Surging Close To 20%",https://www.forbes.com/sites/cbovaird/2019/10/25/bitcoin-defies-death-cross-surging-close-to-20/,"Bitcoin, the world's most prominent digital currency, has been logging some 
serious gains today as upward movement helps fuel FOMO (fear of ...","Editors' Pick|Oct 25, 2019,01:58pm EDT","Bitcoin prices rallied sharply today, fueled by news surrounding China, a highly leveraged market ... [+] and FOMO. (Photo by Chesnot/Getty Images)","Bitcoin, the world’s most prominent digital currency, has been logging some serious gains today as upward movement helps fuel FOMO (fear of missing out). The cryptocurrency reached as much as $8,762.68 around 1:20 EDT, according to CoinDesk. At this point, bitcoin had spiked more than 18% from its intra-day low of $7,393.26 reached earlier today, additional CoinDesk figures show. [Ed note: Investing in cryptocoins or tokens is highly speculative and the market is largely unregulated. Anyone considering it should be prepared to lose their entire investment.]The digital currency experienced this sharp rally after Xi Jinping, president of the People’s Republic of China, stated earlier today that his country should “seize the opportunity” offered by blockchain technology. Bitcoin prices began climbing after he provided these remarks, and but intensified their ascent as market factors drove the digital currency higher. The cryptocurrency enjoyed these gains after a period where many investors had been watching the markets for the possibility of a Death Cross, a bearish formation that takes place when the 50-day moving average falls below the 200-day moving average. Fortunately, this Death Cross did not materialize, according to a BitBull Capital analysis of Bitstamp data. “China’s endorsement of blockchain technology helped Bitcoin recover, and along the way, a short squeeze helped push prices even higher,” said Joe DiPasquale, BitBull Capital’s CEO. “The death cross has, for now, been averted, since the 50-day and 200-day moving averages have not yet crossed,” he stated. “That being said, Bitcoin still needs to cross $9,000 to get out of the danger zone,” added DiPasquale, emphasizing that while the digital currency has “recovered,” it “remains under the major resistance zone between $8,700 and $9,000.” Unless bitcoin can break through this area of resistance, the cryptocurrency will “likely” “fall back,” he stated. Disclosure: I own some bitcoin, bitcoin cash, litecoin, ether and EOS. "
5,https://www.forbes.com/,"Oct 26, 2019",‘Stablecoins Are The New Bitcoin’ In Congress,https://www.forbes.com/sites/jasonbrett/2019/10/26/stablecoins-are-the-new-bitcoin-in-congress/,"It was over five years ago when U.S. Senator Joe Manchin (D-W.Va.) called 
on U.S. regulators to ban bitcoin. In the July hearing, Congressman ...","Oct 26, 2019,11:24pm EDT","In one of the wildest twists to the cryptocurrency and blockchain industry, the House Financial Services Committee held a hearing with Mark Zuckerberg, CEO of Facebook, to ask questions about the Libra Association and the company’s foray into digital money. While many questions at the hearing went predictably to Facebook’s ad revenue process, censorship practices on posts, its reputation on data and impacts of foreign adversaries using the platform to influence the 2016 Presidential election, a nuanced policy result entered into the debate. ","INDIA - 2019/10/09: In this photo illustration a popular cryptocurrency Bitcoin logo seen displayed ... [+] on a smartphone. (Photo Illustration by Avishek Das/SOPA Images/LightRocket via Getty Images)A bill titled “Stablecoins Are Securities Act of 2019”, discussed how managed stablecoins should be treated as securities under the SEC. It was over five years ago when U.S. Senator Joe Manchin (D-W.Va.) called on U.S. regulators to ban bitcoin. In the July hearing, Congressman Warren Davidson (R-OH) created a great deal of excitement in the cryptocurrency space when he stated, “There’s Bitcoin and Then There’s Shitcoin (Libra).” Indeed, Congress has come a long way in being able to decipher between different blockchains, including a much more decentralized Bitcoin blockchain model operating since 2009, against what starts out as a more centralized approach with Libra. The Ranking Member of the House Financial Services Committee, Patrick McHenry (R-NC), noted on a recent podcast with Laura Shin called “Unconfirmed” that “Bitcoin will be of enormous value”. It is clear that while Congress was originally very explicit to the point that many who discussed policy on the subject of cryptocurrency with Congress would avoid using bitcoin and go through great pains to separate bitcoin the cryptocurrency from blockchain the technology. Indeed, the fluctuations in prices for cryptocurrencies painted a picture similar to the “Wild West” that caused a great deal of unease as the public started to profit in 2017 with a boom in prices, followed by a bust that left many disgruntled. As companies continued to see potential value in these new types of digital coins, soon the idea of finding a way to create stability by backing them with FIAT currencies on a 1-to-1 basis became extremely popular. Companies in the industry space such as Tether queued the banks to look at this stable phenomenon, as JPMorgan Coin was introduced. Soon, it’s very likely Facebook got the memo and realized the creation of a cryptocurrency was a worthwhile endeavor for enabling global payments on a mass scale if the price could remain “stable”. In a response similar to the idea of simply banning Bitcoin in 2014, many in Congress see Libra as an impending threat to the U.S. dollar and that, while Bitcoin likely cannot be banned in the U.S. as has recently been mentioned, perhaps Libra could be stopped through legislation. Indeed, the worst case outcome for any of the cryptocurrencies established on blockchains would be to receive the treatment as a security. This is the death knell for most companies as needing broker-dealers to facilitate transactions on digital tokens that are not truly “equities” means business cannot exist or scale in any meaningful way. So, for a bill that is described as “Stablecoins Are Securities Act of 2019”, the problem of course is how broad of a definition this implies. As the bill refers to “managed stablecoins”, perhaps the “basket of currencies” that Libra was originally thinking of to create stability might shift to different iterations backed directly by a FIAT currency, to avoid the “security” label. Of course, this still indicates that, from a policy perspective, while no bill has been introduced to ban Bitcoin, no one ever expected the introduction of Libra would result in additional scrutiny for cryptocurrencies providing stability in value. Thus, while bitcoin’s virtues of decentralization are being extolled in comparison to other cryptocurrencies, it seems that the bigger threat to the status quo is not decentralization through blockchain technology, but rather the mass distribution of digital carbon copies of tokens that provide a derivative of a fiat currency. For more details on the “Stablecoins Are Securities Act of 2019”, see the draft bill below: "
6,https://www.forbes.com/,"Oct 26, 2019","Game Is On Again For Bitcoin, ETH, XRP, And XLM",https://www.forbes.com/sites/panosmourdoukoutas/2019/10/26/game-is-on-again-for-bitcoin-eth-xrp-and-xlm/,"After a series of sell-offs, major cryptocurrencies are in a rally mode 
that reminds 2016. Over the last twenty-four hours, Bitcoin has gained ...","Oct 26, 2019,09:01am EDT",INDIA - 2019/10/23: In this photo illustration a popular decentralised digital currency Bitcoin logo ... [+] displayed on a smartphone. (Photo Illustration by Avishek Das/SOPA Images/LightRocket via Getty Images),"After a series of sell-offs, major cryptocurrencies are in a rally mode that reminds 2016.Over the last twenty-four hours, Bitcoin has gained 21.74%, ETH 9.26%, XRP 3.12%, and LTC 10.90%. The rally has spread across the entire cryptocurrency market, with 60 out of the top 100 cryptocurrencies advancing.What can explain this change in the game for major cryptocurrencies? “Halving, according to Daniel Haudenschild, CEO of SIBEX. ""We are coming into a time where the Bitcoin price is being affected by halving, with Bitcoin’s inflation rate recently dropping from 3.8% to 1.8%,” he says. “Prices typically increase significantly leading up to the halving and have been followed both times by a 10x move just a few weeks later. The 2016 halving started a rally that brought BTC prices from $600 to $19,000 just one month after the halving.”koyfin_20191026_085932654That’s why all eyes should be on Bitcoin for clues into the future. “The BTC price is still the major factor in alt coin prices,” he adds. “Recent downward corrections are symptoms of large block movements in a market with no functioning OTC infrastructure. However, these are minor compared with the rally normally associated with a halving.""koyfin_20191026_080403436Meanwhile, there’s the abundance of liquidity, which fuels speculation in all risky assets. NASDAQ shares, for instance, has been rallying to new highs in recent weeks.koyfin_20191026_081049594And there are seasonal factors, which create a bullish sentiment for risky assets.Still, technical analyst, Nicholas Pelecanos, Advisor to NEM Ventures, sees the digital currency to be range bound for the rest of the year. ""Bitcoin has broken to new lows that we have not seen since June. Currently we are seeing a fairly clear bullish divergence in the BTC price, but I would not be surprised if the recent lows are retested in the short to medium term. After the 50% fall in price from the highs set earlier this year, I’m largely expecting the BTC price to range until the end of the year.”While this pattern could scare away investors, it could be good for traders. “This does not mean that trading opportunities won’t be abundant, as a BTC range can be greater than 30% from the support to the resistance and generally a flat BTC allows for more capital to flow into ALTs.""Provided, of course, that these traders can time the market."
