,press company,date,title,url,abstract,date detail,head article,main article
5,https://cointelegraph.com,"Oct 25, 2019","Price Analysis 25/10: BTC, ETH, XRP, BCH, LTC, EOS, BNB, BSV, XLM, TRX",https://cointelegraph.com/news/price-analysis-25-10-btc-eth-xrp-bch-ltc-eos-bnb-bsv-xlm-trx,"Bitcoin managed a sharp turnaround just a day after 10% price dump. Does 
this increase the possibility of a bottom formation? 12864 Total ...","Oct 25, 2019","The total market capitalization has bounced from very close to the $200 billion support, which is a positive sign. The pullback from the dip on Oct. 23 has been broad-based with Bitcoin (BTC) and several altcoins doing well. This shows that the crypto space is generating interest among buyers. ","Cryptocurrency market daily performance. Source: Coin360Many major cryptocurrencies are showing signs of selling exhaustion. When the bulls buy breakdowns from critical support levels, instead of panicking, it shows that the sentiment is changing. As the recovery is across the board, it increases the sustainability of the move. Recently, Joel Birch, the founder of crypto hedge fund and market research firm Lunar, said that traders should view a drop below $8,000 as a buying opportunity. Though the initial interest in Bakkt futures was not very encouraging, the platform continues to add new features for institutional traders. On Oct. 24 Bakkt announced the launch of regulated options contract for Bitcon futures starting on Dec. 9. With these tools at their disposal, institutional investors are likely to show greater interest once the market starts a trending move. The recent spurt in volume on Bakkt is also a sign that institutional interest is gradually picking up.In previous analysis we had suggested that the current fall was looking like a bear trap. Now that a turnaround has occurred we must take a closer look in order to see if it is a good time to start buying? Let’s analyze the charts. The failure of the bears to capitalize on the breakdown of $7,702.87 on Oct. 23 has attracted buyers. A failed breakdown of a critical level, followed by a quick reversal is usually a sign that the bears are losing their grip and a bottom is around the corner.As the BTC/USD pair climbed above the previous support turned resistance of $7,702.87, it picked up momentum that resulted in a sharp rally. The pace of the rise from the lows shows aggressive buying by the bulls and short covering by the bears. The up move has broken out of the 20-day EMA, which is a positive sign. The next target to watch on the upside is the 50-day SMA. If this level is crossed, a rally to the downtrend line, close to $10,000, is likely. This is an important level to watch out for because if the bulls scale above the downtrend line, the uptrend will resume. As the sentiment has turned bullish, traders can use dips to $8,200 to buy. A stop loss can be kept at $7,200. Our bullish view will be invalidated if the bears defend the overhead resistance zone and sink the price below the recent lows of $7,297.21. Though Ether (ETH) broke below the initial support at $161.056, the bears could not break below the Sept. 24 low of $151.829. This shows that lower levels are attracting buyers, instead of resulting in a panic.Repeated failures of the bears to break below $151.829 resulted in a sharp pullback. The up move has reached the downtrend line, which is likely to act as a stiff resistance. If this level is crossed, the relief rally can reach $196.483. Above this, the ETH/USD pair can rise to $235.70. Therefore, traders can buy on a breakout and close above the 50-day SMA with a stop loss of $150. The bullish divergence on the RSI also points to a rally. Our bullish view will be invalidated if the pair turns down from the downtrend line and plummets below $150. The bulls purchased the sharp dip to $0.24715 on Oct. 23. This shows that the sentiment is to buy the dips rather than panic and sell positions, which is a positive sign. If the buyers can push XRP above $0.29227 to $0.30368 resistance zone, a move to $0.34229 will be on the cards. Therefore, traders can continue to hold their long positions with the stop loss at $0.24.If the bulls fail to push the price above the overhead resistance zone, the XRP/USD pair might remain range-bound for a few more days. Our positive view will be negated if the bears sink the pair below the $0.24508 to $0.22 support zone. If this zone breaks down, the downtrend will resume. However, we give it a low probability of occurring.Bitcoin Cash (BCH) dipped below the critical support of $203.36 on Oct. 23 but the bears could not capitalize on it because, by close (UTC time), the price had risen back above $203.36. This showed a lack of sellers at lower levels. Failure to follow through on a breakdown, after a bearish pattern is a bullish sign.The bulls have pushed the price above the top of the range at $241.85 and are currently attempting to scale above the 50-day SMA. If successful, the rally can extend to the neckline of the head and shoulders pattern, which might act as a resistance. However, if this level is crossed, a move to $360 is likely.We do not suggest chasing prices higher. Traders can wait for the BCH/USD pair to dip towards $242 before buying. The stop loss can be kept at $196. Litecoin (LTC) has bounced sharply from the lows of Oct. 23. The bulls are attempting to break above the downtrend line, which is a stiff resistance. Above this level, the next resistance is likely to be the 50-day SMA. If the price turns down from this zone, it will extend its stay inside $47.1851 to $59.9743 range. However, if the bulls can push the price above the overhead resistance zone, a rally to $80.2731 is likely. Therefore, traders can buy above $63 and keep a stop loss at $47. Our view will be invalidated if the LTC/USD pair reverses direction from the current levels and plummets below the recent lows of $47.1851.The bulls defended the support at $2.4001 on Oct. 23, which is a positive sign. The sharp pullback in EOS is likely to face resistance at $3.370. If the bulls fail to scale above this level, a few days of consolidation between $2.4001 and $3.370 is possible. A consolidation, if followed by a breakout, signals accumulation by strong hands at lower levels. Longer the consolidation, stronger will be the eventual breakout from it. A breakout of $3.370 can carry the price to $4.240 and above it to $4.8719. Therefore, traders can buy on a breakout and close (UTC time) above $3.370 and keep an initial stop loss of $2.40.Our view will be invalidated if the EOS/USD pair turns down from one of the overhead resistance levels and plunges below $2.4001.Binance Coin (BNB) again took support closer to $18.30. This is the second time the bulls have held this level in the past fortnight, which shows that buyers are using the dips to accumulate. If the bulls can now propel the BNB/USD pair above the channel, it will signal the end of the downtrend. Therefore, we retain the buy recommendation given in an earlier analysis. Our bullish view will be invalidated if the bulls fail to sustain above the channel. A break below $14.2555 will be a huge negative.Bitcoin SV (BSV) found support at the 20-day EMA on Oct. 23, which is a positive sign. The subsequent bounce has been strong and it picked up momentum after breaking out of the overhead resistance zone at $107 to $115.170.With the 20-day EMA sloping up gradually and the RSI in the positive territory, the advantage is with the bulls. There is a minor resistance at $138.95 and above it $160. Instead of chasing prices higher, we suggest traders wait for a dip before buying. Our bullish view will be negated if the BSV/USD reverses direction from the current levels and dives below the support at $90.40.Stellar (XLM) is trying to form a higher floor at $0.056. The bulls purchased the dip to this level on Oct. 23, which is a positive sign. If the buyers can push the price above the downtrend line, a rally to $0.088708 is possible. Conversely, if the XLM/USD pair fails to scale above the downtrend line, it will remain range-bound for a few more days. A break below the immediate support at $0.056 can drag the price to the critical support at $0.051014. If this level also cracks, the downtrend will resume. Therefore, traders can retain the stop loss on the long position at $0.051. Tron (TRX) bounced off the immediate support at $0.0136940 on Oct. 23. It has broken out of the moving averages and is attempting to scale above the downtrend line. Both moving averages are flat and the RSI is close to the center, which indicates a balance between the bulls and the bears.If the bulls can push the price above the downtrend line, a move to $0.018660 is likely. We anticipate the bears to offer a strong defense at this level. If the TRX/USD pair turns down from this level, it will extend its stay inside the range. A break below $0.0116262 to $0.011240 support zone will resume the downtrend. We will wait for a buy setup to form before proposing a trade in it.The views and opinions expressed here are solely those of the author and do not necessarily reflect the views of Cointelegraph. Every investment and trading move involves risk. You should conduct your own research when making a decision.Market data is provided by HitBTC exchange."
6,https://cointelegraph.com,"Oct 26, 2019",China Passes First-Ever ‘Crypto Law’ Going Into Effect January 2020,https://cointelegraph.com/news/china-passes-first-ever-crypto-law-going-into-effect-january-2020,"... not explicitly mention cryptocurrency, though it does focus on 
cryptography, a key component underpinning cryptocurrencies such as Bitcoin.","Oct 26, 2019","The Standing Committee of the 13th National People's Congress in China has passed a new law regulating cryptography on Oct. 26 that will take effect on Jan. 1, 2020, reports local news outlet CCTV. ","Per the report, the new regulatory framework aims to set standards for the application of cryptography and the management of passwords. The new regulatory framework establishes the role of a central cryptographic agency meant to lead public cryptographic work, creating guidelines and policies for the industry. The draft of the law was published on May 7 by a Chinese news outlet. The text is largely focused on government centralized password management and does not explicitly mention cryptocurrency, though it does focus on cryptography, a key component underpinning cryptocurrencies such as Bitcoin.Wan explained: “The key take away is — the developing of new cryptography, hashing algo, even the usage of the tech, will be in the official legal realm. This means you need to follow the CCP standard for all ‘encrypted’ behaviors, which can be VERY broad, from mining to block propagation.”She concluded that the law is building the foundation for the upcoming Chinese national cryptocurrency, though there is no official timetable for its launch, one Chinese official confirmed in September. As Cointelegraph reported yesterday, China’s President Xi Jinping has called for the country to accelerate its adoption of blockchain technologies. Meanwhile, this past week, Facebook’s Mark Zuckerberg warned that Chinese superiority in the digital currency space could put the U.S. dollar at risk in an attempt to sell lawmakers his plans for the Libra stablecoin.""China is moving quickly to launch a similar idea in the coming months. We can't sit here and assume that because America is today the leader that it will always get to be the leader if we don't innovate,” he argued in an official statement. "
7,https://cointelegraph.com,"Oct 25, 2019","Google’s Quantum Computer Still Far From Useful, Says Vitalik Buterin",https://cointelegraph.com/news/googles-quantum-computer-still-far-from-useful-says-vitalik-buterin,"Ethereum co-founder Vitalik Buterin does not think that Bitcoin faces any 
real threats from Google's quantum computer just yet. 17424 Total ...","Oct 25, 2019",Ethereum co-founder Vitalik Buterin is not at all impressed by the perceived threat Bitcoin (BTC) faces from Google’s quantum computer.,"Buterin took to Twitter on Oct. 23, where he commented on the news that Google had achieved quantum supremacy, meaning that a quantum computer has solved a mathematical calculation that would take any traditional computer millenia to solve. Buterin shared a seemingly snarky analogy:“My one-sentence impression of recent quantum supremacy stuff so far is that it is to real quantum computing what hydrogen bombs are to nuclear fusion. Proof that a phenomenon and the capability to extract power from it exist, but still far from directed use toward useful things.”Bitcoin evangelist and educator Andreas Antonopoulos echoed similar sentiments towards Google’s quantum computer at the beginning of October, when he said that the threat to Bitcoin by Google’s quantum supremacy is “zip, bupkis nada:”“What is the effect on mining and the cryptocurrency world in general? Zip, bupkis, nada, nothing really happens. Quantum supremacy – what Google described – is demonstrating the practical applicability of quantum computers to certain classes of problems. Those classes of problems are not the same class of problem we’re talking about when we talk about breaking cryptography.”In theory, quantum computers could vastly speed up the process of solving complex calculations and might therefore pose a real threat to Bitcoin’s proof-of-work mechanism, as well as blockchain technology at large. Quantum calculations will be endlessly superior to modern cryptography, in such a way that it could reverse cryptocurrency transactions and possibly gain access to private keys.Scott Aaronson, a quantum theoretician at the University of Texas at Austin, recently claimed that Google’s quantum computing technology could actually turn out to be a huge help to improve the technology which underpins proof-of-stake (PoS) cryptocurrencies. He wrote on his blog:“A sampling-based quantum supremacy experiment could almost immediately be repurposed to generate bits that can be proven to be random to a skeptical third party (under computational assumptions). This, in turn, has possible applications to proof-of-stake cryptocurrencies and other cryptographic protocols. I’m hopeful that more such applications will be discovered in the near future.”"
8,https://cointelegraph.com,"Oct 25, 2019",Lebanon Banks' Shutdown Is ‘Most Potent Case’ for Crypto: Nassim Taleb,https://cointelegraph.com/news/lebanon-banks-shutdown-is-most-potent-case-for-crypto-nassim-taleb,"Bitcoin (BTC) proponents are encouraging Lebanese citizens to swap fiat for 
crypto after it emerged the country's banks would stay closed.","Oct 25, 2019",Bitcoin (BTC) proponents are encouraging Lebanese citizens to swap fiat for crypto after it emerged the country’s banks would stay closed.,"In an ongoing Twitter debate which began on Oct. 24, commentators vented anger on behalf of Lebanon’s population, which has been without banking services for more than a week. Following civil unrest, banks everywhere closed their doors. Six working days later, a senior banking executive said the status quo would continue until conditions improved.“Once normalcy is restored, we are very confident that we can resume servicing our customers in full capacity,” Salim Sfeir, head of local lender Bank of Beirut, told Reuters on Thursday.Previously, long queues were seen at ATMs as worried consumers attempted to access their wealth. Around 65% of Lebanon is banked, figures say, leaving two-thirds of the country cut off from personal funds. For well-known Lebanese statistician, former trader and author of “The Black Swan,” Nassim Nicholas Taleb, the government’s policy was enough to directly endorse cryptocurrencies such as Bitcoin.“The most potent case for cryptocurrencies: banks are never there when you need them,” he summarized in a tweet. Taleb continued: “And they are trying to bully the public so they avoid accountability and profit disbursements. Bankers are legal crooks.”The anger is reminiscent of other recent episodes of economic chaos, during which states have withheld money for their own purposes. In addition to Hong Kong this year, an infamous example is India, which in 2016 began a series of botched currency reforms which left hundreds of millions of people holding worthless notes.India’s taste for Bitcoin soon increased dramatically, before a hardline policy saw its exchange sector all but evaporated last year.It is worth noting that unlike banks, the decentralized Bitcoin network operates 24/7 with 99.98% uptime since its inception, according to monitoring resource Bitcoin-uptime."
9,https://cointelegraph.com,"Oct 26, 2019",Can Libra and Other Crypto Find a Ground to Navigate Regulation?,https://cointelegraph.com/news/can-libra-and-other-crypto-find-a-ground-to-navigate-regulation,"Bitcoin (BTC) and cryptocurrencies are causing some confusion for 
regulators globally. Designed usually as peer-to-peer payment platforms, ...","Oct 26, 2019","Bitcoin (BTC) and cryptocurrencies are causing some confusion for regulators globally. Designed usually as peer-to-peer payment platforms, cryptocurrencies seek to improve trust, security and privacy by significantly reducing or eliminating third parties. However, by connecting users directly, cryptocurrencies make regulatory oversight far more complex. ","The regulatory control that most governments seek is generally related to money laundering and illegal activity. While cryptocurrency creators have no desire to foster such practices, many nevertheless hope to move away from the sorts of regulatory controls that are seen as centralized, less cost-efficient and often domineering. Facebook founder Mark Zuckerberg’s newest offering to the tech world is a proprietary cryptocurrency called Libra. Designed as a means of P2P payments on the Facebook platform, Zuckerberg had hoped that his creation would mimic Bitcoin to a degree.Initially the response from insiders was a sense of profound excitement. A host of tech giants signed on financial partners. The news was all about how Libra could change the world, particularly the 1.7 billion adults who remain unbanked across the globe. However, as government agencies have begun offering feedback, the fires have cooled substantially. Most recently, Lael Brainard, one of the governors of the United States Federal Reserve, has stated unequivocally that Libra cannot see the light of day until a number of regulatory standards have been met. What’s more, other analysts have made even stronger statements about the dangers of Libra, and the potential it has to damage society.Related: After 6 Hours of Zuckerberg Testimony, Congress Still Hates LibraThe result has been a massive exodus from the system. Seven of the largest funding partners — including PayPal, Visa, Mastercard and eBay — have all made a hasty retreat from the company. And others are threatening to do the same, as U.S. and international regulators, like the Financial Action Task Force (FATF) continue to clamp down on the new system by offering stricter guidelines on how digital transactions should be managed. One major concern of regulators is that Libra could heavily disrupt the global financial system and potentially be subverted for money laundering or terrorist financing.While not immediately impactful for Bitcoin, this new guidance from the Federal Reserve suggests that coins that do not offer good regulatory control may come under fire. For example, privacy coins like Monero and Dash are under serious scrutiny. These coins offer users complete anonymity in transactions through the use of blockchain technology — a particularly odious feature for regulators. However, while this gap between privacy-based cryptocurrencies and regulators appears to be growing increasingly wide, other coins and platforms have moved into the space, hoping to provide solutions that are meaningful and helpful for regulators.Related: What Role Should Central Banks Have Launching Stablecoins Like Libra?For that reason, platforms such as Particl and Verge, for example, are coming online that allow exchanges to offer some level of regulatory oversight, but still maintain the desired privacy and P2P transactions that cryptocurrency users are pursuing. As a community governance example, Particl is designed with internal regulation, in that it allows for private transactions but also a secondary level of internal governance through user voting. By allowing users to vote against listings that don't conform to the community guidelines, the system is internally regulating. This type of solution offers a middle road between regulators seeking some level of control and the complete anonymity of coins like Zcash and Monero.Other platforms are also seeking solutions that mix private and public transactions. For example, Dash offers private internal transactions between users but requires the coins to be “mixed” with other coins to provide the desired privacy. The founders believe the network should be able to meet the necessary compliance suggestions from FATF.According to Dash CEO Ryan Taylor, “Dash is identical to Bitcoin and is 100% capable of meeting the requirements.”Others, like DeepOnion, are moving in the opposite direction, building on The Onion Router, or TOE, darknet and moving away from any oversight whatsoever. These platforms assume that government will never allow private-style transactions, and are therefore moving underground. While the potential to hide from government will always be there, it seems clear that digital coins that seek a middle ground with regulators pose the greatest hope for mass adoption of cryptocurrencies. New systems that offer a certain level of control (even if only through users) but remain private, allow for a hybrid option that may well represent the future of digital money.Related: What Does Skepticism for Libra Say About Bitcoin?Such systems bring regulators and cryptophiles together. Facebook has promised to work tirelessly with regulators to help bridge the gaps that currently exist. But the departure of its key funding and supportive partners may tell a different story. What’s more, while the coin may offer some benefits for users, other decentralized platforms adhere more carefully to Satoshi Nakamoto’s original vision of a peer-to-peer, digital payment system that is fully decentralized but also highly scalable, safe and secure. While companies have executed permutations of Satoshi’s original vision, most would not deny that clear, consistent and reasonable regulation is required for mass adoption of cryptocurrencies. But ultimately, the cryptocurrencies and systems that do the best job of finding a middle ground between their benefits and regulatory oversight will be the ones that survive and thrive.The views, thoughts and opinions expressed here are the author’s alone and do not necessarily reflect or represent the views and opinions of Cointelegraph.Eric Doyle is an independent tech marketing and PR consultant with nearly 20 years of experience with enterprise and consumer tech brands, including blockchain, fintech, ad tech, AI, e-commerce and entertainment industries"
