,press company,date,title,url,abstract,date detail,head article,main article
38,https://cryptonews.com/,"Sep 26, 2018",Top 5 Stablecoins: Features and Differences,https://cryptonews.com/exclusives/top-5-stablecoins-features-and-differences-2655.htm,"Overview: USDT is a cryptocurrency asset issued on the Bitcoin blockchain. 
Each USDT unit is reportedly backed by a U.S. Dollar held in the ...","
September 26, 2018
",Institutional investors and new crypto startups are increasingly becoming interested in development of stablecoins that may solve one of the main problems for crypto adoption - price volatility.,"Design of a stablecoin allows to keep a relatively stable price of this asset. They are most useful when trading cryptocurrencies: instead of relying on HODLing onto the volatile nature of other coins, you can trade in stablecoins instead of fiat. If you’d like to look above simple trading, think of stablecoins as replacements for fiat in terms of stability, with features of cryptocurrency.Currently, most people in the cryptoverse have heard about Tether and perhaps also TrueUSD, but what about others? We have made an overview of five stablecoins, biggest by market capitalization, highlighting the attributes of each. Market Cap: USD 2.8 billion (September 26)
Rank: 8 (by market capitalization)
Type: fully collateralized, backed by USD
Overview: USDT is a cryptocurrency asset issued on the Bitcoin blockchain. Each USDT unit is reportedly backed by a U.S. Dollar held in the reserves of the Tether Limited and can be redeemed through the Tether Platform. To prove that the amount of USD in the bank account is the same or more than the USDT in circulation, Tether Limited publishes the bank account balance on its website’s Transparency page.
Points of Interest: first major adopted stablecoin, available on most major exchanges, but also a lack of real transparency, no official audit has been done, accusations of lack of funds.
_______Market Cap: USD 94 million
Rank: 67
Type: fully collateralized, backed by USD
Overview: TrueUSD is a USD-backed ERC20 stablecoin that is fully collateralized, legally protected, and transparently verified by third-party attestations. It uses multiple escrow accounts to reduce counterparty risk and to provide token-holders with legal protections against misappropriation. It uses TrustToken’s smart contracts to ensure 1:1 parity.
Points of Interest: uses escrow accounts (centralized by nature), but the TrustToken framework ensures the legitimacy of the process. However, it is significantly less available than USDT.
_______Market Cap: USD 55 million
Rank: 94
Type: fully collateralized, backed by ETH
Overview: Dai is a stablecoin issued by MakerDAO, which also created the MKR token. DAI is set to be a decentralized stablecoin that will react automatically to changes in the market in order to stabilize its price against other types of currency. Despite being backed by ETH, the cryptocurrency’s value mirrors the value of the USD currency.
Points of Interest: no third party involvement, backed by crypto instead of fiat but this opens the possibility of a black swan event (where ETH price crashes well below the one-to-one collateralization ratio in a time frame too short for the system to handle.)
_______Market Cap: USD 10.9 million
CoinMarketCap Rank: 310
Type: fully collateralized, backed by BTS, the core asset of BitShares, a decentralized cryptocurrency exchange.
Overview: The BitUSD is a market-pegged asset on the BitShares blockchain. It is backed by BTS, and the minimum required collateral for most bitAssets (including the bitUSD) is ~2x. This means that you need to put USD 200 worth of BTS into the contract to borrow just 100 bitUSD. In the end, the market peg is achieved by a social consensus in such that 1 bitUSD should be worth 1 USD. Hence, trading against the peg should make you lose money because someone else will make a profit from trading towards the peg.
Points of Interest: the process can be complicated to understand, and the value fluctuates due to market instability.
_______HAV_____
nUSDMarket Cap: USD 4.5 million / USD 976,600
CoinMarketCap Rank: 498 / 861
Type: fully collateralized, backed against each other
Overview: Havven is a dual-token system that aims to collateralize its token nomin (stable value of USD 1 and variable supply) with its token havven (variable value and fixed supply), relying solely on the markets forces and the underlying security of the blockchain technology to keep this stability. In order for any supply of nomin to exist, a certain amount of havven needs to be kept in escrow, locked away, as a collateral for the system. Whenever someone escrows a quantity of havven, nomins are issued and sold by the system at a limit order of USD 1 in a decentralized exchange (for ETH, for example), increasing the supply of nomins in the pool. If someone wishes to regain access to some (or all) of their havven, a limit buy order of USD 1 is placed by the system, and the nomins purchased are destroyed.
Points of Interest: decentralized, not pegged against an outside asset, self-reliant, but not very well-known outside of its fanbase."
39,https://cryptonews.com/,"Nov 10, 2018",Approaching the Moon With 20 Crypto Jokes,https://cryptonews.com/exclusives/approaching-the-moon-with-20-crypto-jokes-2901.htm,"Yet here we are, getting tired of “Bitcoin is a stablecoin!” jokes and 
wondering if the prices have actually stabilized for real. Sure, it would 
be ...","
November 10, 2018
","To be fair, the titular joke might not have aged too well, but it’s that time of the year when bull runs sometimes happen. Yet here we are, getting tired of “Bitcoin is a stablecoin!” jokes and wondering if the prices have actually stabilized for real. Sure, it would be good for the industry, but where is my Lambo in that case?!","Anyway, this week, BAT and BCH got a great beginning; ICOs seem to find their way in China in spite of government regulations; and Vitalik Buterin had to clarify that he is not, in fact, leaving Ethereum - in spite of sensationalist tweets. The new generation keeps teaching the older ones about crypto, and there might be hope for South Korean ICOs yet. Twitter scams are alive and well, unfortunately, and Sirin Labs has finally unveiled Finney, their blockchain phone. The week ends with Faketoshi suffering a blow.Now, to unwind after the working week, check out our joke collection while you’re waiting for that moon._____________This comparison makes sense now. This is what it’s like to use crypto nowadays.__And now, the Bitcoin Cash fork…__More now, but still relevant.__Bears are more capable than you think.Never underestimate the bears. pic.twitter.com/xV9dATBGfk__A high-quality meme, but “Don’t let your memes be dreams” is what makes it a masterpiece.__A podcast host explains what it’s like to HODL, and we’re inclined to agree.If it were easy to be a $BTC Hodler of Last Resort then everyone would .What is needed: Discipline. Mentally for research & emotionally for price cycles where market weeds out the weak & undisciplined. So, #Bitcoin is extremely fair & brutal tool for allocating gains & losses. pic.twitter.com/8CK7jHFCfa__How the panic sellers see Bitcoin’s price movements.__Does your family really need Christmas presents, though?__Why voting is so important.__The panic is settling in.__When you put it that way…__It’s important to maintain a positive outlook on life.__The real horror is when your kid makes you take a long, hard look at yourself.__Not only is it accurate, but it’s also implying ICOs have a door to begin with.Finding out an ICO is a scam...#crypto #ico #bitcoin #btc #funny pic.twitter.com/ZZzFwrfNMu__It’s a really simple distinction.__7 minutes might seem long for a video, but it’s hilarious.__“I can’t believe it’s not butter” but better.__Are you cooler than this dog? No. Nobody is cooler than this dog.__You know, some things you just gotta know before investing.__And frankly, it’s not even funny anymore.__"
40,https://cryptonews.com/,"Nov 11, 2018",Spain is Preparing for Crypto Fiesta,https://cryptonews.com/exclusives/spain-is-preparing-for-crypto-fiesta-2872.htm,"""This year, I have seen a lot more serious businesses start accepting 
Bitcoin and altcoins."" ""A lot of people just don't trust governments to 
make ...","
November 11, 2018
",Could Europe’s next big crypto adopter be Spain? And might the country’s growing escalation of interest one day eclipse the region’s biggest blockchain powers? Evidence suggests that a wave of crypto fever has quietly washed over Spain in 2018 – leaving crypto pioneers very optimistic about what the future holds.,"Why the sudden rush of positivity? Well, for a start, some 10% of the surveyed Spaniards claimed their own cryptocurrency holdings, the fourth highest number in the European economic bloc, according to an international survey by ING, a Dutch financial giant, carried our between 26 March and 6 April 2018. That figure is nothing to sneeze at: France and Britain lag far behind with ownership rates of only 6%. Also, 32% of the surveyed Spaniards said that they ""expect to own cryptocurrency in the future,"" while almost 40% added that cryptocurrencies represent the future of online expenses and investment. A minority, yes, but not an insignificant one.In fact, the Spanish government’s recent decision to begin taxing crypto earnings may well be proof that crypto trading is as alive and well in Spain as it is in other early crypto-adopting nations like Japan.Spain’s central bank has also talked of creating its own digital currency. The bank recently issued a report stating that “digital currencies and blockchain technology could benefit Spanish monetary policy and financial infrastructure.”Media outlet Infobae stated that the bank was essentially proposing creating a Spanish answer to Venezuela’s Petro – a state-owned cryptocurrency.Crypto pay is also on the ascendancy in Spain.Jordi Calabia is a cryptocurrency investor in Barcelona. He told Cryptonews.com:“I remember going to a cryptocurrency-themed sushi bar a few years ago. It was by the seafront in the Costa Brava town where my parents live. It was fun, but quite gimmicky – and I think it has since closed down. This year, though, I have seen a lot more serious businesses in and around Barcelona start accepting Bitcoin and altcoins – from shops to restaurants that cater to tourists to the kind of places that only locals frequent.”Per a report in CMD Sport earlier this year, Spain has now welcomed its first crypto-friendly gyms – CrossFit centers in Madrid and Granada, operated by a company named Singular Box, where customers can pay membership fees in Bitcoin and other tokens. The news outlet quotes Singular Box’s owner as saying, “Cryptocurrencies provide one less barrier for new athletes who want to come and train with us. More and more people are making use of this financial technology. [The reaction from members] has been very positive. The feedback has been good.”Other gyms across the country have reportedly followed suit.Meanwhile, a network of holistic health clinics with branches in Almería, Granada, Jaén, Málaga and Córdoba last month told Diario Bitcoin that it had begun accepting Bitcoin and Ethereum payment because it “believes cryptocurrencies are the future of commerce in all industries.”And a house owner in Tarragona earlier this year sold his apartment for 40 BTC. Mister Piso, the real estate agent that conducted the deal, said that Bitcoin pay enabled ""a much speedier and more effective transaction than traditional payment methods,"" and actively advised the owner to request a crypto-only payment.Eurocoinpay, a Spanish crypto pay platform based in León, last month announced it was in talks with some of the country’s biggest high street retailers, including El Corte Inglés and Zara, as well as overseas brands such as Decathlon and French hypermarket chain Carrefour.El Economista states that the platform – Spain’s first of its kind – will potentially allow users to make in-store purchases with commission rates of 0.25%. One news site said the initiative would allow customers to “basically buy a dress in Zara paying in [cryptocurrencies], without having to go through the usual set of intermediary companies.”Even though businesses are becoming increasingly crypto-friendly, if digital tokens are to go mainstream in Spain, private individuals will probably take them there.A plethora of Spanish universities have begun offering cryptocurrency and blockchain-themed courses this year in response to growing demand – and have been inundated with applicants. These include the University of Navarra, the ESADE Business School and the Instituto de Empresa Business School in Madrid, some of the most prestigious business institutions in Europe. This year has also seen tertiary education establishments in Seville, Pozuelo, Cantabria, La Rioja, Pamplona and Barcelona begin offering blockchain and cryptocurrency training.Calabia notes:“There are communities of crypto and blockchain enthusiasts who meet up every week here in Barcelona. One I know of is thousands of members strong. People remember the time of the peseta, before the euro, when sudden currency fluctuations were common. Crypto offers Spaniards an alternative to government-controlled or Brussels-regulated currencies. A lot of people just don’t trust governments to make sound financial decisions. That’s why a lot of us are now keen to make investments in cryptocurrencies.”Asked if she thought Spain’s rising crypto-enthusiasm represented a groundswell of interest, Cadiz-based IT expert Marta Castillo told Cryptonews.com, “Yes. Many ordinary people are starting to dabble. They talk about crypto a lot, and people are becoming much more knowledgeable about blockchain and token-related matters. I think 2019 will be a very interesting year in Spain for this sort of technology.”"
41,https://cryptonews.com/,"Nov 7, 2018",The Massive XLM Airdrop Hits Wall of Criticism,https://cryptonews.com/news/the-massive-xlm-airdrop-hits-wall-of-criticism-2885.htm,"Bitcoin developer Udi Wertheimer writes, “If you're a [blockchain.info] 
wallet user, this is a pretty bad deal for you. You should be asking for 
*way* ...","
November 07, 2018
","Cryptocurrency wallet and data provider Blockchain has announced an airdrop of USD 125 million in Stellar Lumens (XLM), nearly half a billion tokens, in an attempt to boost crypto adoption. However, the news didn’t elicit as much of a positive response as the company might have hoped: the community is not persuaded that this is the best way to foster adoption, arguing that it doesn’t make sense.","Even immediately following the announcement on Twitter, replies like “This must be a scam” began to flood in. Pierre Rochard, founder of Bitcoin Advisory, a firm that specializes in Bitcoin's economics and software engineering, wrote, “Be very careful about using services that enable ‘give away’ scams, it likely means that they are starved for revenue and will do anything for a quick buck. Don't trust them, don't trust people that are associated with them.” Although co-founder of Blockchain Nicolas Cary immediately replied that this is no scam and “We're really going to give away the money,” Rochard was quick to point out: “You're not giving away the money, you're giving away XLM.”Recently, Blockchain launched the foundation for the Blockchain Airdrops, together with the criteria that will guide the company in selecting which tokens we will airdrop to our users.A big problem that the community has with this airdrop is the fact that you have to create a Blockchain wallet and go through their KYC (know your customer) procedure to be eligible for the airdrop. Bitcoin developer Udi Wertheimer writes, “If you’re a [blockchain.info] wallet user, this is a pretty bad deal for you. You should be asking for *way* more than USD 25 to let them attach your identity to years of bitcoin transaction history.”User @AnselLindner joins in, saying, “Reminds me of the United Bitcoin scam. Give me your data, let us track you, and you get free stuff.” Popular economist and Bitcoin investor Tuur Demeester adds: Context: https://t.co/cV9LjKjbgvThe only people that seem to be really happy about this airdrop are Stellar holders, calling it a great way to distribute ownership. XLM price chart:And, of course, this community wouldn’t be what it is without memes about the situation surfacing almost instantly.pic.twitter.com/i3XNvOgAEi"
42,https://cryptonews.com/,"Oct 19, 2018",What to Do This Weekend: File Your Mt. Gox Claim!,https://cryptonews.com/news/what-to-do-this-weekend-file-your-mt-gox-claim-2797.htm,"Gox was handling over 70% of all bitcoin transactions worldwide, as the 
largest bitcoin intermediary and the world's leading bitcoin exchange, ...","
October 19, 2018
","The deadline for filing a rehabilitation claim with the infamous Mt. Gox exchange is rapidly approaching; claimants have until Monday, October 22nd to send proof of being a victim in the exchange’s hack. ","Nobuaki Kobayashi, the trustee of the exchange opened up the process in August as part of its civil rehabilitation process.A separate Q&A document, published in August, says that, “The planned deadline for the Rehabilitation Trustee to submit a statement of approval or rejection to the court is January 24, 2019, but, at the current point in time, a definite date has not been determined.” There has been no update on this situation as of right now.However, according to a Reddit post on the topic, during a Q&A session of the creditors meeting on September 26th Kobayashi confirmed that he is going ahead with self-admission of claims. These so-called zombie claims mean that if the trustee is aware of anyone who should have a claim, he will file a claim on their behalf. In other words, anyone that had an account on Mt. Gox and appears on their database, even with just a few dollars or satoshis on the exchange, will have a claim filed in their name. However, if the funds are unclaimed after a certain amount of time, it will pass to the Japanese treasury. According to reports, there are about 75.000 small accounts that make up about 10% to 20% of total claim value.""In practice this means a reduction of claim value for BTC claimants, and the Japanese government benefiting. Our group (mtgoxlegal.com) are currently fundraising to keep our lawyer on this,"" the post reads. However, there is no official announcement regarding the ""zombie claims.""The road to recovery has not been completely smooth to all claimants, however. In a subreddit dedicated to the legal proceedings of Mt. Gox, many users complain that the call center is hard to reach, even during business hours, and that the process itself is confusing. The community also speculates that the payout should happen around summer to fall 2019. Reddit user u/Btc_Hawker said they were attending the previous creditors’ meeting on September 26th, and writes, “[I] will be asking the trustee to pay out an interim distribution of all the cash owed to depositors and the vast bulk of the Bitcoin in February. There is no justification for further delay once civil rehabilitation is approved.” The user did not further update on this.The next Mt. Gox creditors’ meeting is set for March 20th, 2019. Before that, the period to examine Proofs of rehabilitation claims is set from January 31st to February 7th, 2019. Launched in July 2010, by 2013 and into 2014 Mt. Gox was handling over 70% of all bitcoin transactions worldwide, as the largest bitcoin intermediary and the world's leading bitcoin exchange, according to Wikipedia. Mt. Gox announced that approximately 850,000 bitcoins belonging to customers and the company were missing and likely stolen, an amount valued at more than USD 450 million at the time."
43,https://cryptonews.com/,"Nov 15, 2018",Forbes 30 Under 30: Meet Four Crypto Entrepreneurs,https://cryptonews.com/news/forbes-30-under-30-meet-four-crypto-entrepreneurs-2925.htm,"Olaoluwa Osuntokun is the co-founder and CTO of Lightning Labs, the company 
behind one of the best-known scalability solutions for Bitcoin.","
November 15, 2018
","The Forbes magazine has released its annual “30 Under 30” ranking for 2019, celebrating the top entrepreneurs under the age of 30 in over 20 categories each, and picking out the “brashest entrepreneurs across the United States and Canada” in its own words. Out of all those, a total of four entrepreneurs from the crypto industry have made it onto the list. They are all founders and co-founders of  projects, such as Lightning Labs, developer of the Lightning network, and Bitwise Asset Management, a crypto investment company. Let’s take a look at who they are.","Olaoluwa Osuntokun is the co-founder and CTO of Lightning Labs, the company behind one of the best-known scalability solutions for Bitcoin. The company has raised USD 2.5 million to turn bitcoin into a more viable form of payment by making smaller transactions more cost effective.
Osuntokun got his computer science degree at the University of California, Santa Barbara. During his graduate studies he focused on the field of applied cryptography, specifically encrypted search. He has worked both at the University as a researcher and teaching assistant, as well as Google as an intern, before co-founding Lightning Labs with CEO Elizabeth Stark.Hunter Horsley is the CEO of Bitwise Asset Management, among other things known for BIT10, a cryptocurrency basket that can help newcomers in the space. He has raised USD 4 million from Khosla Ventures, Naval Ravikant, the CEO and a co-founder of AngelList, a U.S. website for startups, and others to build these cryptocurrency indices that rely on transparent criteria. 
Among 40 crypto hedge funds that use Bitwise's four indices as benchmarks is Morgan Creek, which manages USD 1.5 billion in assets, and 600 multi-family offices.
He got his economics degree at the Wharton school, University of Pennsylvania. After that, he has worked as product manager at both Facebook and Instagram, before turning to Bitwise. Nader Al-Naji is the founder and CEO at Intangible Labs, which raised USD 133 million from the likes of Andreessen Horowitz and Bain Capital Ventures to develop a cryptocurrency that can be used to make payments. His main product is Basis, a stable cryptocurrency designed to replace central banks.
With a computer science degree from Princeton, he worked at D. E. Shaw and Google as a software developer, and founded Basis in July 2017.JB Rubinovitz is an artist turned entrepreneur, as well as a machine-learning engineer, and the primary force behind Bail Bloc, which aims to upend the bail financing industry and has raised enough money to bail out 100 criminally arrested individuals by mining cryptocurrency. 
Bail Bloc mines Monero and converts it to US dollars, donating it to The Bronx Freedom Fund. Once installed on a user’s computer, Bail Bloc uses a small amount of the computer’s power to mine for Monero in the background, so daily use of the computer is unaffected. Rubinovitz’s computer science degree hails from Columbia University in the City of New York. _______The Forbes 30-Under-30 list is another indication of the growing influence of cryptocurrency and blockchain technology as it expands from being a niche area of fintech into an industrial heavyweight in its own right. Earlier this year Fortune also recognized the likes of Ethereum’s Vitalik Buterin, and Coinbase’s Brian Armstrong in its “40 under 40” list. Last year, Buterin made it onto the “30 under 30” list as well."
