,press company,date,title,url,abstract,date detail,head article,main article
23,https://cryptonews.com/,"Oct 15, 2018",Unusual Crypto Rally Increases Volatility,https://cryptonews.com/news/unusual-crypto-rally-increases-volatility-2771.htm,"Bitcoin price rallied towards the USD 7,000 resistance during a sharp 
decline in Tether. Tether dropped sharply and later recovered to USD 
0.965 ...","
October 15, 2018
","Bitcoin price gained bullish momentum against the US Dollar and Tether (USDT) during the past few hours (UTC 08:20 AM). There was a sharp upward move in BTC/USDT above the USD 7,500 level due to a nasty slide in Tether below the USD 0.950 support. BTC/USD also gained traction and surged above the USD 6,500 and USD 6,700 resistance levels. However, buyers failed to hold gains and bitcoin price reversed most of its gains. BTC/USD is back to USD 6,600 and it is currently trading with a positive bias. Similarly, ethereum, bitcoin cash and ripple rallied recently before trimming most of their gains. Overall, the recent price spike ignited a lot of volatility in the crypto market, which could help bitcoin buyers in the short term.","Total market capitalization After testing the USD 6,200 support, bitcoin price  started an upward move. BTC/USD broke the USD 6,350 and USD 6,400 resistance levels to climb sharply higher. It even spiked above the USD 6,850 resistance, but sellers quickly reversed the bias. 
The price declined sharply and traded below the USD 6,700 level. It is currently trading near the USD 6,600 mark, with an immediate support near the USD 6,500 level. The most important support on the downside awaits at USD 6,400. On the upside, the price needs to regain the USD 6,700 level to climb back towards USD 6,800.Ethereum price  broke the USD 200 resistance zone to enter a positive area. ETH/USD climbed above the USD 205 and USD 215 resistance levels.
The price also traded above the USD 220 level, but later it declined below USD 215. It is currently up 5% to USD 211, with an immediate support at USD 210. On the upside, buyers need to settle the price above the USD 225 resistance for further gains.Bitcoin cash price  rallied above the USD 450 and 475 resistance levels during the recent upward move. BCH/USD tested the USD 490-500 resistance zone, which prevented further upsides. The price is currently down to USD 462 and it may well continue to trade lower towards the USD 450 support.
Ripple price  surged above the USD 0.450 resistance and even spiked above the USD 0.465 level. Later, XRP/USD reversed gains and it is currently trading near the USD 0.445 level. It seems like a proper close above the USD 0.450 level is needed for a larger upward move.Many altcoins gained traction and moved up between 7%-20%, including komodo, DROP, holo, bytecoin, BTG, DGD, MOAC and NPXS.Overall, the recent upward move in bitcoin price seems like a false spike, but as long as BTC/USD is holding the USD 6,400 support, it could climb higher once again. Similarly, if ETH/USD stays above the USD 210 level, the pair may possibly retest the USD 225 resistance.
_____"
24,https://cryptonews.com/,"Nov 16, 2018",This Coinbase-backed Crypto Mining Rig is Not a Mining Rig,https://cryptonews.com/news/this-coinbase-backed-crypto-mining-rig-is-not-a-mining-rig-2937.htm,"For example, bitcoin mining rig manufacturer Canaan Creative has ... new 
way for ordinary people to mine bitcoins by using their TV sets.","
November 16, 2018
","After Coinmine, a Coinbase, among other investors, backed crypto tech startup, introduced Coinmine One, a device capable of mining cryptocurrencies, it hit a wall of criticism due to the low mining profitability it offers. However, it might be only the beginning of the new wave of the crypto tech for the general public and another step towards the mass adoption.","At this stage, the device might provide a hassle-free solution for people who seek to get into crypto mining and earn some coins on the way. Now it can mine cryptocurrencies such as Ethereum, Ethereum Classic, Zcash, and Monero. However, at the time when mining profitability is going down, it might be not a good idea to buy a USD 799 device in order to make 2 dollars per month (also, there is a 5% fee.) (In comparison, the same device would have made around USD 200 in January this year, when the ether price stood at almost USD 1,400. Now the price stands at USD 178.) Some people reacted: “Mine at a loss from the comfort of your own home!”Moreover, the company collects the mined coins and stores them on wallets powered by Coinmine’s central servers.However, the startup rushed to defend its product that starts shipping in December, by saying that “this is not just a miner, but a general purpose crypto device that just happens to include a GPU [graphics processing unit] miner” and adding that “what you buy today will not be what you have in the future.”For starters, the company plans to add more coins that could be mined on this device. Also, they promise that two new features are coming “soon.”According to their website, users will be able to send and receive payments on the Lightning Network, earning routing fees in with their bitcoin. Furthermore, Coinmine stated that their users will also be able to participate in the Proof of Stake networks where they will be able to “effortlessly” stake cryptocurrency right from their mobile device. In this case, instead of using hardware to mine, users “stake” their currency to the validity of transactions. In return, they earn interest on the tokens they have staked.______In either case, Coinmine is not the only company that is making crypto mining accessible for the general public. For example, bitcoin mining rig manufacturer Canaan Creative has reportedly come up with a creative new way for ordinary people to mine bitcoins by using their TV sets.Also, there is a heater that, when you turn it on, passively mines your cryptocurrency of choice while doing its original job in heating up the room.Moreover, there's a desktop app, Honeyminer, that helps the average Joe with a consumer-grade computer mine cryptocurrencies."
25,https://cryptonews.com/,"Oct 25, 2018","""Top"" 10 Crypto Music Videos",https://cryptonews.com/exclusives/top-10-crypto-music-videos-2787.htm,"__. Make no mistake, we actually like this song. It's easy to listen to and 
it has a message that's close to the heart of every Bitcoin maximalist 
out ...","
October 25, 2018
","Music has always been a popular way of self-expression, and if you really wanted to, you could probably find a song about literally anything online. This, of course, means that there are songs about crypto. From boasting about how rich you got by trading crypto to songs shilling a certain coin, saying that the songs vary in quality would be a big understatement. ","Cryptonews.com assembled 10 music videos related to crypto. Be warned though - some of these are simply so bad that they’re good. We’re not vouching for lyrics, rhythm or cadence, mostly because we’re not expecting an aria about Satoshi Nakamoto, but a good laugh and probably an earworm or two.____________________The perfect example of “so bad it’s good,” this song absolutely deserves to be the first in our list, because it sets the tone to the rest. Yes, many people are rapping about how rich they got. __Make no mistake, we actually like this song. It’s easy to listen to and it has a message that’s close to the heart of every Bitcoin maximalist out there.__This one is an obvious parody of most “I got rich thanks to Bitcoin” songs, and ironically, it is higher quality than 90% of them.__Let’s make a quick break from rap. If you’re a fan of parodies and Adele (or either of these) and you remember Mt. Gox, this one’s for you.__And back to rap! This song shows what people feel like when you blow their ear off with your crypto talk (guilty as charged).__Maybe it’s cheating to add these guys again, but this song is the theme song of every exit scam victim ever, so we felt obliged to share it with the world.__Want to relax? We’ve got the perfect song for you, while you’re sipping your cocktail on your yacht somewhere in the Bahamas, paid for with Bitcoin… Yeah right.__If you’re looking for an ode to the creator of Bitcoin, look no further.__We have featured this song previously, but let’s face it, it’s too good not to add it again - plus, it’s such a blatant shill that it’s funny.__And to top it off, we wish you a good night and sweet dreams with this masterpiece.__"
26,https://cryptonews.com/,"Oct 27, 2018",Waiting for the Bull Run: 20 Crypto Jokes,https://cryptonews.com/exclusives/waiting-for-the-bull-run-20-crypto-jokes-2822.htm,"This Redditor's mother makes it look so easy. What my mom thought ""mining 
bitcoins"" was... from r/Bitcoin. __. May not be ...","
October 27, 2018
","After almost a year long bear run, the best we, as a community, can hope for is a bull run somewhere in the last part of the year. The final two months of 2018 are rapidly approaching without any signal that HODLers will have cause to celebrate, however. Once again, we take solace in humor and hope the industry has not failed us.","The week began with sincere hopes that November will follow the trend of previous years and not cause losses; around USD 7.5 million were stolen from what was supposed to be cold storage; HTC unveiled their blockchain phone and entrepreneurs urged for regulation of the space once again. The work week ends on a hopeful note, with the CEO of Visa saying, “If we have to go there [to crypto], we’ll go there.”Now to unwind from the week, let’s dive right in!________________Although the picture perfectly shows what we all look like when checking our portfolio, the painter’s name - Ferdinand Hodler - brings it all together.__If this was a Venn diagram, the two circles wouldn’t even touch.__If you’re reconsidering mining, remember this…__Fool me once, shame on you; fool me twice, this space needs regulations because it’s full of scams!__A small Easter egg for fans of Dragon Ball Z.__The panic is palpable. But in a good way. And we’re still waiting for that particular bull run.__The debate of digital money vs. banks is best summarized this way.__Who said crypto and art don’t go together?__This Redditor’s mother makes it look so easy.__May not be very funny, but it’s extremely relevant, especially in those economic climates.__This has been relevant for months now.__2018 gives this comic a few more panels, namely one where the guy picks himself up, and another where he cries again because it’s still worth more than in 2011.__It’s like being a noob, but with additional steps.__A solution for everyone panic-selling.__KFC was pro-Bitcoin before it was cool. (No, we’re not bashing altcoins.)__“Yeah, no, of course my life savings aren’t all invested in crypto, haha, that would be dumb.”__A noble thought that we need to hear in such a market.__Say no to drugs, invest in bitcoin.__Our biggest hope for November/December 2018.__When you find that perfect Proof of Stake coin…__"
27,https://cryptonews.com/,"Oct 6, 2018",Memes of Our Lives: Your Weekly 20 Crypto Jokes,https://cryptonews.com/exclusives/memes-of-our-lives-your-weekly-20-crypto-jokes-2718.htm,"... as of yet unpublished footage of altcoin headquarters and their war on 
Bitcoin. We just witnessed an altcoiners meeting to takeover Bitcoin","
October 06, 2018
","Since the prices are showing no sign of actively picking up pace, either upwards or downwards, it can get boring trying to track what’s happening in the space. I mean, you check your portfolio and it hasn’t changed since, like, July? That’s why you should be checking our website for the weekly memes instead. At least we like to shake it up.","From the news that crypto is attracting Nobel prize winners, over EOS corruption allegations, to good news coming from Ripple, this week was a carefully optimistic one. Coinbase’s USD 8 billion valuation was certainly great news, but the fact that the biggest cryptocurrency exchanges were not the most secure ones - not so much. We finish the week with the news about the trend of crypto baskets, and head towards a new one.Meanwhile, let’s get you what you came for._______________Protection is important and cheap knockoffs can kill you.pic.twitter.com/nXGaxIbR0n__This is too good (and old) to need a description. Watch it, thank us later.__Real, as of yet unpublished footage of altcoin headquarters and their war on Bitcoin.We just witnessed an altcoiners meeting to takeover Bitcoin 😆Please reward our effort with a retweet if you enjoy these vids and want to see more of them in the future. 👍💪 pic.twitter.com/LtoncH1iQb__Asking the question we’d all like to know the answer to…When’s the next bull market? pic.twitter.com/21x9KvjJAT__What the past month has felt like…__You win some, you lose some.__Garlicoin is the real hero, keeping us safe from shitcoins.__As they say, “just add blockchain into the name and you’ve secured your funding.”__The pain in his eyes speaks to all of us on a subconscious level.__Murphy’s law: “Whatever can go wrong, will go wrong.”__Now I understand Thanos, and he did absolutely nothing wrong.__Coffee is there to wake you up both physically and mentally. You’re welcome.__There’s fear, and then there’s terror.__I go to crazy rides at theme parks to relax and get my adrenaline down.__Possibly ironic to use Rosie the Riveter for a meme in a space that has very little women in it, but let’s appreciate the sentiment for now.__What it feels like to be new to the space.__When Jehovah's Witnesses are less annoying than Bcash supporters, you have a problem.__When you've talked to all your friends about ""this great new investment"" that you made, and now you're too embarrassed to appear in public.__Won't someone think of the losses?!__
They'll come, don't worry! "
28,https://cryptonews.com/,"Oct 5, 2018",Top 5 Privacy Coins: Features and Differences,https://cryptonews.com/exclusives/top-5-privacy-coins-features-and-differences-2725.htm,"Bitcoin may not be as anonymous as most people think, but there is a number 
of coins focusing on that issue first and foremost. Oftentimes ...","
October 05, 2018
","Cryptocurrencies that focus on the privacy of their users - or, simply, privacy coins - have drawn the interest of many different people, all with a single priority: nobody should know how they spend their money. Bitcoin may not be as anonymous as most people think, but there is a number of coins focusing on that issue first and foremost. Oftentimes, privacy coins are considered the ones that truly follow original Bitcoin ideas about anonymity and decentralization.","However, not all of them are decentralized or even completely anonymous. They all have their strengths and weaknesses, and figuring out exactly what you need - and how they fit into that - is your first step towards finding the coin you want. Here, we will take a quick look through the top five privacy coins by market capitalization, their attributes and points of interest. You may want to note that “cryptographically private” means that the ways of maintaining privacy have been built into the product by ways of cryptography. This makes it impossible for someone to track your transactions as there is no way for them to know that it is your transaction to begin with - an important point to consider when choosing a privacy coin.Market Cap: USD 1.9 billion (October 4)
Rank: 10th (by market capitalization)
Privacy: cryptographically private
Decentralization: decentralized
Overview: Considered the most secure and anonymous privacy coin in the market today, Monero enables users to hide the amount of digital cash they send and receive, the source of the funds, the recipients, and the amounts held in their wallets. It is cryptographically private by default, utilizing several privacy features – most prominently being stealth addresses and ring confidential transactions (RingCT).
Points of Interest: Mining centralization is a possible weakness; the coin’s popularity on the dark web gives it a bad reputation; a possible plus is that the coin has a dedicated hardware wallet.Market Cap: USD 1.5 billion 
Rank: 12th 
Privacy: not cryptographically private; privacy through mixing
Decentralization: partially centralized
Overview: Dash promises privacy through mixing, utilizing a modified version of CoinJoin – a method initially created to “anonymize” Bitcoins. Dash functions similar to Bitcoin, in that the blockchain is transparent by default while offering optional privacy by way of mixing. A masternode is required to expedite the mixing process, which in turn requires users to trust that the server is not recording details on where each user’s outputs are ending up.
Points of Interest: Masternode network makes it semi-centralized but allows it to include innovations like InstantSend, PrivateSend, and the Dash Budget System; not completely trustless as there is nothing keeping the masternodes from recording details; takes seconds to confirm a transaction.Market Cap: USD 645 million 
Rank: 21st 
Privacy: cryptographically private; but not private by default (meaning you have to turn privacy ON, otherwise the transaction is public)
Decentralization: partially centralized
Overview: Zcash leverages the Zerocoin protocol and zero-knowledge proof cryptography called zk-SNARKs to provide financial privacy to its users by enabling them to hide information about the sender, the recipient, and the transaction amount. At the basic level, zero-knowledge proofs allow to prove that the information you are sending to the other party is true, without having to broadcast said information besides the fact that it is true.
Points of Interest: Creating a shielded transaction is computationally heavy (although an upcoming hard fork promises to solve this issue almost completely); unshielded transactions can, in some cases, leak information about shielded transactions.Market Cap: USD 232 million 
Rank: 40th
Privacy: not cryptographically private; privacy through Tor browser, used by many to protect their online identity, and I2P routing
Decentralization: decentralized
Overview: Verge only offers “privacy” by way of Tor and I2P routing, to obfuscate traffic and conceal a user’s IP address when transacting. There are no cryptographic privacy features with regards to the blockchain, the linkability and traceability of transactions and addresses, nor the concealment of the amounts being transacted. The coin also lost its credibility in early 2018 after experiencing two 51% attacks.
Points of Interest: the 51% attacks are considered a big drawback in security; there have been network promises and underdeliveries by the team that were considered unprofessional.Market Cap: USD 124 million 
Rank: 52nd 
Privacy: cryptographically private; but not private by default
Decentralization: partially centralized
Overview: Komodo uses zero knowledge proofs to provide its users with financial anonymity. Aside from offering increased financial privacy through its digital currency KMD, the Komodo platform also offers the launch of decentralized ICOs (dICOs), a decentralized exchange, and blockchain development solutions, among other services.
Points of Interest: Scalability solution called Peerchains, where sibling chains (different assetchains) on the KMD platform can form a network of blockchains which operates on its own and doesn’t bloat the Komodo blockchain; interoperability between different blockchains; passive income, where holding your tokens in a KMD wallet generates you 5% KMD annually by just sending your coins back to your address; however, the community is quite inactive."
29,https://cryptonews.com/,"Nov 3, 2018",Braving the Cold November Rain With 20 Crypto Jokes,https://cryptonews.com/exclusives/braving-the-cold-november-rain-with-20-crypto-jokes-2860.htm,"__. The brave and valiant efforts of Bitcoin to break into stablecoin 
ranks. Braving the Cold November Rain With ...","
November 03, 2018
","It’s less than two months until the end of this year and around a month until the time we remember most all-time highs. While we remember the good times when “moon” was not just a faraway object in space and Lamborghinis seemed closer than they really are, at least we have jokes collections to take our minds off things. Who are we kidding - we’d all rather have the lambo.","This week started out with news of an exchange ditching their users and a suspected exit scam. Only a day later, it was revealed that Bitstamp was sold - but not to worry, they promised not to change their way of working. As for other exchanges, Coinbase got a whopping new USD 300 million from institutional investors, South Korean exchange Coinis won its battle against a banking ban, and Ripple ripped, excuse the pun, into traditional banking institutions and their remittance speed. An anonymous project founder disappeared after creating and immediately selling new tokens, and Tether now claims they do have enough money to back their stablecoin. The week has certainly been interesting, so now it’s time to kick back and enjoy the weekend.________________We’re just past Halloween, so we can start off with a spooky picture.__Someone said Lambo? This is what it looks like now.__This man has got his priorities straight.Now is a time for HODLing. #bitcoin #crypto #cryptocurrency pic.twitter.com/1o2VMMX0KR__Have you ever heard the market cap as a sound? There are several variations, but we found this to be the most accurate one.__The brave and valiant efforts of Bitcoin to break into stablecoin ranks.__Crying about Bitcoin’s stability? I thought you didn’t want it to fall anymore.__Have you wondered how blockchain works? Here’s the simplest tutorial we could find.__All he needs is a “#1 Dad” mug to take to his office.__Houston, we have a problem…__Are you sick and tired of all the stablecoin jokes yet? Yes? Well, they're more stable than the stablecoins themselves.__Good luck waiting, kiddo.__“HODL,” I whispered to her, with tears in my eyes…__What’s for dinner in cryptoland?__A very varied, ambitious roadmap.__Making the world a better place, step by step.__Someone went to all this trouble of creating a South Park parody about Nouriel Roubini, so you should definitely watch it.Dedicated to Crypto’s #1 Troll 😘 pic.twitter.com/Y64t5VRjr7__Are we still in a Halloween mood? If not, let's go back to it.__Sometimes blockchain really is an overengineered solution for your problem.__Although this is an edit of an xkcd comic, this is still very much how it works in reality.__Explaining new technologies to people who are ""not computer people and proud.""__"
