,press company,date,title,url,abstract,date detail,head article,main article
0,https://cryptonews.com/,"Oct 12, 2018","""Lost Bitcoin is a Donation"": Best Quotes by Satoshi Nakamoto",https://cryptonews.com/exclusives/lost-bitcoin-is-a-donation-best-quotes-by-satoshi-nakamoto-2760.htm,"Although the real identity of Satoshi Nakamoto, a mysterious creator of 
Bitcoin, could well remain a mystery forever, his words are still 
closely ...","
October 12, 2018
","Although the real identity of Satoshi Nakamoto, a mysterious creator of Bitcoin, could well remain a mystery forever, his words are still closely read and religiously followed by many Bitcoin enthusiasts. However, there is an extensive list of forum posts the Bitcoin creator penned while Satoshi still worked on the project that many still follow. Now, the Satoshi Nakamoto Institute has collected those quotes and organized them into topics for everyone to read.","The Satoshi Nakamoto Institute, founded in November 2013, is looking to “learn from the past and build toward the future, through scholarship, community, and coding.” This includes archiving writings, publishing research papers related to the industry as well as sharing ideas and concepts.Some of the quotes include: “Governments are good at cutting off the heads of a centrally controlled networks like Napster, but pure P2P networks like Gnutella and Tor seem to be holding their own.”""Banks must be trusted to hold our money and transfer it electronically, but they lend it out in waves of credit bubbles with barely a fraction in reserve. We have to trust them with our privacy, trust them not to let identity thieves drain our accounts. Their massive overhead costs make micropayments impossible.""“A lot of people automatically dismiss e-currency as a lost cause because of all the companies that failed since the 1990's. I hope it's obvious it was only the centrally controlled nature of those systems that doomed them. I think this is the first time we're trying a decentralized, non-trust-based system.”“It's very attractive to the libertarian viewpoint if we can explain it properly. I'm better with code than with words though.”""Yes, but we can win a major battle in the arms race and gain a new territory of freedom for several years."" “Commerce on the Internet has come to rely almost exclusively on financial institutions serving as trusted third parties to process electronic payments. While the system works well enough for most transactions, it still suffers from the inherent weaknesses of the trust based model.”""Writing a description for this thing for general audiences is bloody hard. There's nothing to relate it to."" “I would be surprised if 10 years from now we’re not using electronic currency in some way, now that we know a way to do it that won’t inevitably get dumbed down when the trusted third party gets cold feet.”""Bitcoin would be convenient for people who don't have a credit card or don't want to use the cards they have, either don't want the spouse to see it on the bill or don't trust giving their number to ""porn guys"", or afraid of recurring billing.""“Lost coins only make everyone else's coins worth slightly more. Think of it as a donation to everyone.”""It might make sense just to get some in case it catches on. If enough people think the same way, that becomes a self fulfilling prophecy. Once it gets bootstrapped, there are so many applications if you could effortlessly pay a few cents to a website as easily as dropping coins in a vending machine."" ""I'm sure that in 20 years there will either be very large transaction volume or no volume.""“Bitcoins have no dividend or potential future dividend, therefore not like a stock. More like a collectible or commodity.”""How does everyone feel about the B symbol with the two lines through the outside? Can we live with that as our logo?""The project needs to grow gradually so the software can be strengthened along the way. I make this appeal to WikiLeaks not to try to use Bitcoin. Bitcoin is a small beta community in its infancy. ""The requirement is that the good guys collectively have more CPU proof-of-worker than any single attacker.""""The Bitcoin network might actually reduce spam by diverting zombie farms to generating bitcoins instead."" ""We should have a gentleman's agreement to postpone the GPU arms race as long as we can for the good of the network. It's much easer to get new users up to speed if they don't have to worry about GPU drivers and compatibility. It's nice how anyone with just a CPU can compete fairly equally right now."" ""I am not Dorian Nakamoto.""______If you want to read more, head over to the Satoshi Nakamoto Institute to learn about the person (or people) behind all this. And remember: when in doubt, ask yourself: what would Satoshi Nakamoto do?"
1,https://cryptonews.com/,"Nov 11, 2018",Where Will Bitcoin be Ten Years From Now?,https://cryptonews.com/exclusives/where-will-bitcoin-be-ten-years-from-now-2903.htm,"Governments responded by printing unlimited quantities of money. And 
Bitcoin was born as Satoshi's indignant response to the mess they ...","
November 11, 2018
","Juan Villaverde is an econometrician and mathematician devoted to the analysis of cryptocurrencies since 2012. He leads the Weiss Ratings team of analysts and computer programmers who created Weiss cryptocurrency ratings.
______","Will Bitcoin be many times more valuable by 2028?Or will it be mostly dead?Will it be replaced by the more advanced cryptocurrencies that merit our highest Weiss Ratings?If so, will those cryptocurrencies have begun to replace most fiat currencies?Before I can answer these questions about the future, let’s first look back at the past …When Bitcoin was born ten years ago, the world was torn by financial crisis.It was 2008. Major governments had piled up massive debts. Lehman Brothers failed, triggering a chain reaction of even greater failures in the banking system. Governments responded by printing unlimited quantities of money. And Bitcoin was born as Satoshi’s indignant response to the mess they created.The dream: To create a peer-to-peer system of electronic cash, killing three birds with one stone:First, Bitcoin would unshackle money from the control of those who created the financial crisis.Second, it would replace their behind-the-scenes deliberations and manipulations with the first-ever form of money that has a built-in monetary policy.Third, the monetary policy would be stable, predictable and completely transparent — visible to everyone.That was the dream. But it has not been the reality.Bitcoin will more closely resemble a store of wealth (like gold) than a system of electronic cash.Here’s what happened …When Bitcoin creators looked at fiat money, there was little desire to sort out the good from the bad. Instead Bitcoin’s specs were deliberately designed to be the exact antithesis of every critical aspect of existing monetary policy. Specifically …1. Fiat money supply is unlimited and forever expandable. Bitcoin’s money supply is strictly capped and immutable.2. Access to fiat digital money is dictated by banks. Bitcoin is free for everyone and anyone to use as they see fit.3. The fiat money system is made up of multiple gatekeepers and asset custodians that have to be regulated by a central government and trusted by the people. Bitcoin’s code stipulates that there are no gatekeepers, custodians, regulators or governments in the mix. In fact, there’s supposed to be no authority whatsoever.That was the theory. But in practice, these design choices have taken a heavy toll on the Bitcoin network over time:1. Since Bitcoin is scarce, most people are usually reluctant to spend it. Instead, they simply hoard it in the expectation that, with time, its value will always go up.2. Since there is no formal authority, there has emerged an oligopoly of miners who control the minting of most new Bitcoins.3. And since Bitcoin lacks adequate governance rules to select custodians, certain groups of developers have seized control over most of the network’s development.So, with the benefit of hindsight, it’s now evident that Bitcoin was an overreaction to the financial crisis and to the monetary system that allowed the crisis to occur. End result: Instead of functioning as an efficient peer-to-peer system for transferring cash, Bitcoin is evolving into a store of value like gold. But unless dramatic changes are made, that could wind up being its only function ten years from now.What’s worse, if current trends continue, Bitcoin could become an asset that’s mostly mined by an oligopoly of large corporations in the East … but mostly owned by large financial institutions in the West. (See “What might happen if China declared war on Bitcoin?”)The good news: Like gold, Bitcoin still retains the potential to rise dramatically in value. Moreover, the fact remains that Bitcoin introduced the first public, open, digital asset the world has ever seen. Bitcoin was the first successful experiment with Distributed Ledger Technology (DLT). And in recent years, that revolutionary technology has evolved rapidly.So, what comes next? Looking ahead to the next ten years, we can see how …DLT could contribute not only to the evolution of money and the stability of monetary policy … it could also enhance economic productivity, political governance, social cohesion and more.DLT could revolutionize democratic elections, transform the world of lending and massively disrupt social media. So, the potential for cryptocurrencies to change the world is big, much bigger than originally expected ten years ago.In fact, whether or not Bitcoin can deliver on its original promise is now a moot point. Other cryptocurrencies are rising to the occasion to fulfill the original dream … plus much more.Yes, the invention of Bitcoin broke the ice.• It unleashed teams of developers and thinkers who are passionate about a decentralized digital cash system, who are fixing the deficiencies of Bitcoin and fine-tuning their algorithms to create a currency for the masses, and …• More recently, it has also unleashed a parallel trend of a very different kind: Regulators and gatekeepers of the traditional financial system see the handwriting on the wall. They have become increasingly aware of the powerful advantages that DLT could bring to the table. And they are already looking for ways to adapt, adopt — or co-opt — the new technology to modernize the existing system.Depending on which of these prevails, there are two possible scenarios on how cryptocurrencies evolve over the next decade:Public open ledgers and their native cryptocurrencies begin to replace the fiat currency system. Instead of saving, spending or investing dollars, euros or yen, people begin to do all of those things with cryptocurrencies like EOS, Cardano, Ripple, Stellar or Holo.A growing share of the population transitions from government-issued currency to public cryptocurrencies. They are attracted to crypto by handy, practical distributed applications (dApps), powered by free and open cryptocurrencies.This activity is not controlled by government or government-regulated institutions. It’s governed by the consensus of each community.Initially, governments resist. But eventually, they accept the new reality. They realize they can no longer control the monetary system the way they used to. Instead of bucking the trend, they begin to recognize these new forms of money as legal tender.No currency emerges as the sole winner. Rather, a select group of cryptocurrencies becomes dominant, thanks to superior technology, the most practical applications and the broadest mainstream acceptance.Governments of the world’s largest economies — the U.S., the European Union, China and Japan — lead the way toward adopting Distributed Ledger Technology. If not, smaller countries take the lead and the larger ones follow. They realize that digital money is the wave of the future. And they see that the single, most-efficient form of digital money is based on DLT.BUT instead of creating open, decentralized systems, they focus on digital money systems that mimic the fiat system already in place. Yes, the technology is similar. But the governance is not: The new kinds of money remain under the direct control of central banks.For political leaders who crave more power and control, it’s a massive upgrade: Government agents gain the ability to directly monitor every single transaction in the system. They are empowered to freeze accounts with a few clicks of a mouse. And once various kinds of property are digitized, a government decree to confiscate assets of targeted groups can be executed in seconds.The technology is still distributed ledger. But instead of opening the network to everyone (a permissionless system), those who wish to join must first get the government’s OK (a permissioned system). And instead of relying on the rules embedded in the code to ensure fairness (a trustless system), participants must accept the authority of the rulers (a trusted system).In a country with strong democratic traditions and judicial protections, this would not be of immediate concern. The government is expected to act in the best interests of the people. It’s assumed it will use its new digital superpowers strictly against rogue actors.But in countries already leaning toward autocracy or with no independent judiciary to speak of, the picture goes from dark to darker: Governments use centralized DLT to snuff out whatever individual freedoms remain.How can two starkly different scenarios be enabled by the same technology?Remember: All technology is inherently neutral. It can be tool of evolution or a weapon of destruction; a blade for harvest or for war.DLT is a prime example. It’s one of the most revolutionary technologies on the planet. It can help enhance individual freedom, guarantee property rights and build wealth. Or, it can be used by authoritarian governments to install a draconian surveillance state.Ten years from now, which will it be? A lot will depend on which scenario prevails: Decentralized DLT or centralized DLT?My guess is that, for now at least, we could wind up with an unholy mix of both. But in the longer term, decentralized DLT will always have two major advantages:First, DLT derives its greatest power from voluntary mass participation. But centralized DLT represses that mass participation. It’s contrary to the essence of what DLT does best.Second, even if governments can create their own form of cryptocurrency that’s fully under their control, it will be almost impossible for them to ban decentralized DLT networks.In the end, the same dynamic that ultimately makes democracies stronger than dictatorships will also make decentralized DLT stronger than the centralized alternative."
2,https://cryptonews.com/,"Sep 15, 2018",What is Schnorr and Why it's Very Important for Bitcoin,https://cryptonews.com/exclusives/what-is-schnorr-and-why-it-s-very-important-for-bitcoin-2616.htm,"For the uninitiated, cryptographic signatures are how a blockchain protocol 
(such as Bitcoin's) verifies that a public wallet key corresponds to a ...","
September 15, 2018
","Bitcoin's scalability problem is gradually becoming less acute. In August 2017, the activation of the Segregated Witness (SegWit) upgrade began increasing network transaction speeds and lowering transaction fees, while ongoing work on the Lightning Network also promises to make Bitcoin faster by moving certain transactions off-chain.","And now, a new piece of the puzzle is about to fall into place. This is Schnorr, an algorithm that would enable multiple signatures to be securely aggregated into one, thereby increasing the speed and privacy offered by Bitcoin. However, while a technical outline for implementing Schnorr has now been released by developer Pieter Wuille, the need for community consensus and adoption could mean there's still some time to wait before it increases Bitcoin network capacity by as much as 40%.Originally developed by German cryptographer/mathematician Claus-Peter Schnorr, the Schnorr signature algorithm is essentially a way of linking multiple wallet keys to a single signature.""For applications like Bitcoin, one of the most compelling advantages is compact multi-signatures, allowing what are effectively several signatures to be compressed into the space of one,"" crypto-analyst Tony Arcieri explains to Cryptonews.com. 
""The overwhelming majority of the data in Bitcoin's blockchain consists of signatures, so using Schnorr-based techniques to ""compress"" signatures allows for a much smaller blockchain to represent the same cryptographically verifiable information.""""The overwhelming majority of the data in Bitcoin's blockchain consists of signatures, so using Schnorr-based techniques to ""compress"" signatures allows for a much smaller blockchain to represent the same cryptographically verifiable information.""For the uninitiated, cryptographic signatures are how a blockchain protocol (such as Bitcoin's) verifies that a public wallet key corresponds to a private one. They're needed a) to verify transactions and b) to avoid revealing a private key to unwanted scrutiny. Unfortunately, the need to provide a signature for every single wallet involved in a transaction can weigh the Bitcoin network down.Enter Schnorr, which is now a viable solution for Bitcoin due to the introduction of SegWit. This is because SegWit moves all signature data to a separate portion of each block, which allows such portions to have their rules altered without the need for a hard fork.As such, Schnorr can be introduced with only a soft fork, enabling a transaction involving multiple addresses to be reduced to a single signature. While estimates vary depending on who you ask, this simplification will reduce the amount of block storage needed by the Bitcoin network by anything from 25% to 40%.In other words, more transaction info could be included on a single block, and if we assume a current maximum speed of seven or eight transactions per second for Bitcoin, the addition of Schnorr could bring this up to as much as 9.8 or 10.2. Increased capacity would also help to reduce transaction fees, thereby making it cheaper to buy and sell bitcoin.This aggregating of multiple addresses in a single signature will also have a positive effect on privacy, since it will incentivise people to use CoinJoin, an anonymization method for bitcoin transactions, or similar protocols. Previously, this anonymization service suffered from the fact that not enough people used it, something which can actually compromise the anonymity of those who do. But combined with the use of Schnorr, transaction fees will be reduced on the whole if people pool their transactions together, in the process giving people a reason to use the program and increase their privacy.As promising as Schnorr sounds, there's still the question of when it will actually be deployed, and of whether the Bitcoin community will harmoniously arrive at the consensus necessary for adopting it.For example, the proposed SegWit upgrade ultimately led to the hard fork that created Bitcoin Cash in August 2017, since some community members felt that it wouldn't do enough to change how BTC is treated more as an asset than a currency.However, Arcieri for one is sceptical that Schnorr will be controversial enough to cause yet another schism. 
""This is sound cryptographic engineering the community should probably adopt from a purely technical perspective,"" he says. ""I can't imagine what kind of narrative people would spin to argue against it, but we've seen that in the past with what should otherwise be uncontroversial cryptographic improvements to Bitcoin like SegWit.""""This is sound cryptographic engineering the community should probably adopt from a purely technical perspective,"" he says. ""I can't imagine what kind of narrative people would spin to argue against it, but we've seen that in the past with what should otherwise be uncontroversial cryptographic improvements to Bitcoin like SegWit.""And still, even if there is consensual support for Schnorr, its implementation will still rely on users actually choosing to use it, as is the case with SegWit. And given that SegWit enjoyed only 25% usage six months after its launch, it's clear that Schnorr's effect on BTC transaction speeds and fees won't be instantaneous."
3,https://cryptonews.com/,"Sep 19, 2018",People in Crypto: Successful Twins and Adventure of Bitcoin Girl,https://cryptonews.com/exclusives/people-in-crypto-successful-twins-and-adventure-of-bitcoin-g-2631.htm,"Bitcoin Girl follows a young woman known as He Youbing on the internet, who 
tries to survive 21 days using only bitcoins in Beijing, Shenzhen, ...","
September 19, 2018
","Crypto has long since spread beyond the small tech savvy community into the world, gathering around it enthusiasts from all walks of life. Two new examples lend strength to this claim.","Recently, a new documentary called Bitcoin Girl came out, in which a young woman attempts to live on Bitcoin for 21 days in China - infamous for its dislike of cryptocurrencies. Meanwhile, on the other side of the planet in southern London, two identical twins designed a cryptocurrency in their mother’s kitchen, and now it’s in the top 100 coins by market capitalization.Bitcoin Girl follows a young woman known as He Youbing on the internet, who tries to survive 21 days using only bitcoins in Beijing, Shenzhen, Guangzhou and Shanghai. At the start of her trip on August 28th, she had around USD 1,400 in bitcoins. The experiment included persuading shop owners and strangers to accept bitcoin in exchange for food, accommodation and traditional banknotes, while educating them about the benefits of blockchain. Most of the 15 six-minute episodes of the documentary have been shown so far on iQiyi, a Chinese online video platform.Life on crypto is not easy, the documentary shows. She traveled through Beijing on an unlocked bike from a sharing service, sleeping in a McDonald's, where she dined on free ketchup. There, a college student offered to treat her for a meal at their canteen, adding, “but I don’t want to take bitcoin.” Others don’t even know what bitcoin is. At one point, she fainted due to low sugar levels - friends from a crypto chat group sent her to the hospital and turned out to be the first ones to accept her bitcoin in exchange for some snacks. Traveling further to the southern coastal city of Shenzhen, a crayfish restaurant turned out to be accepting bitcoin. There, a yoga teacher bought some coins from her, so she had enough fiat to spend the night at a hotel. In the latest episode shown on September 15, He Youbing was on her way to Shanghai, the final destination of her 21-day trip, South China Morning Post reports. In the documentary, the producers said they refused the offer of several blockchain startups in China to help fund the experiment. He Youbing adds, “If I fail, then that’s the failure of the blockchain people.”Meanwhile, half the world away, in south London, identical twins Steve and Sam Williams became multi-millionaires by designing Populous (PPT), a coin currently ranked 53rd by market capitalization, with a price of USD 3.13 as of the time of writing. Populous is a peer-to-peer invoice discounting platform that is globalizing what is currently a localized and limited market sector, helping small and medium-sized businesses with cash flow. The founding twins, Steve and Sam, have grown up in a tough neighborhood, learning a lot about what it means to be a victim of crime and how it impacted them.“It filled in some elements that were missing in me and opened my eyes to what could happen to me,” Steve told the Evening Standard in an interview. They both spent four years working on this project from their family home in Brockley, a district in south London. (However, the website of the company mentions Steve as the only founder). Within the first five days of launching in June last year, demand was so strong that the initial batch of tokens was worth more than GBP 8 million (USD 10.51 million), according to the report. This success was also their ticket out of the rough neighborhood: Steve’s six-year-old attends a private school, and their offices are in Mayfair, an affluent area in the West End of London.Populous price chart:Steve studied advanced business, while Sam took a course in computer programming, according to the report. Also, in 2008 Steve was charged and convicted of obtaining money transfers by deception and served 18 months of a three-and-a-half-year jail term.Moreover, Sam has also launched two other crypto coins called Zloadr and DocTailor, aimed at legal professionals, the Evening Standard reported.
___While a life using only cryptocurrencies may still be a long way off - perhaps especially in China - crypto is already offering a new chance to business-savvy individuals. Still, the penetration of both blockchain and cryptocurrencies into different niches is a positive step towards adoption - and if you can sell your bitcoins to one yoga teacher, you might well be set for a while."
