,press company,date,title,url,abstract,date detail,head article,main article
10,https://cryptonews.com/,"Sep 24, 2018",What Are Sidechains?,https://cryptonews.com/exclusives/what-are-sidechains-2658.htm,"This occurred because the Bitcoin blockchain could not accommodate the 
number of bitcoin transactions that the late-2017 bitcoin gold rush ...","
September 24, 2018
","If you are reading this article, you know what the blockchain is. What you may not know, however, is that so-called “sidechains” also exist in the distributed ledger ecosystem. ","To enlighten you, you will discover what sidechains are and what impact they could potentially have on the future of cryptocurrencies. The concept of sidechains was first introduced in 2014 in a paper titled ‘Enabling Blockchain Innovations with Pegged Sidechains’ written by a team of developers who later went on to form the blockchain startup Blockstream. In simple terms, a sidechain is a separate blockchain that is linked to the main blockchain through what is referred to as two-way pegging, which enables digital assets to be interchangeable between the two chains without jeopardizing their performance or speed. Sidechains are being developed first and foremost to address the issue of blockchain scalability but also to potentially add new functionalities to a blockchain, such as introducing smart contracts for the Bitcoin network, for example. To transact on a sidechain a bitcoin user first has to send his or her coins to an output address, where the coins are being locked so that the user can then spend them elsewhere. Once this transaction has been completed, a transaction confirmation is communicated across the two chains followed by a short waiting period for security reasons. Once the waiting period is completed, the equivalent number of bitcoin is released onto the sidechain, allowing the user to then access and spend the coins as he or she pleases. To put coins back on the main chain, the reverse transaction needs to take place. Everyone who has used bitcoin in late 2017 will remember the excruciatingly high transaction fees that peaked at an average of over USD 50 per transaction in mid-December. This occurred because the Bitcoin blockchain could not accommodate the number of bitcoin transactions that the late-2017 bitcoin gold rush caused. As a result, transactions suddenly took hours to process and high fees made bitcoin unuseable as a spending currency. In anticipation of this scaling challenge, Bitcoin developers have started to work on sidechains with the belief that they can provide the much-need relief for the Bitcoin blockchain to ensure that the digital currency can survive as its adoption continues to grow globally. Through the creation of sidechains, much larger transaction volumes can be processed as the main blockchain is relieved of its burden. Hence, a functioning network of sidechains could potentially give blockchain technology the ability to scale to a commercial level. Having said that, sidechains have not yet been implemented into Bitcoin network as issues such as security and centralization still need to be addressed before we can start spending our bitcoins using sidechains."
11,https://cryptonews.com/,"Oct 31, 2018",A Very Spooky Crypto Halloween!,https://cryptonews.com/exclusives/a-very-spooky-crypto-halloween-2847.htm,"Are you ready to have this guy explain Bitcoin to you through terrible 
analogies? Please welcome to the ring. Your 2k18 Halloween costume. The ...","
October 31, 2018
","Halloween is one of those holidays that many celebrate - regardless of religion, ethnicity, political affiliation or personal ideals, people love dressing their kids up (or themselves), go trick or treating or to a party and generally let go. The crypto community is no exception, and we’ve collected our favorite ways in which people from the cryptoverse are celebrating Halloween.","Happy haunting!__________This guy dressed up as the blockchain for his Halloween party.Apparently, people brought over glowsticks, so by the end of of the night, he became Lightning Network.__This Redditor’s family is giving out these chocolates for Halloween, and each of these has some claimable BTC! Each coin is worth around USD 10 in BTC, but how many will actually be redeemed?__Cryptocurrency exchange OKEx has a competition for Halloween. You can win BTC 0.02 by sharing your crypto-themed costume. These are some of the contestants:_______________________When the bear run doesn’t treat you right even for Halloween, and you have to find another costume.I wanted to be a #crypto millionaire for Halloween, but I had to settle for a unicorn 😭 #xrp #cryptolife #makemerichalready pic.twitter.com/NuhU3DGCSM__The scariest costume you will see all year!Scary Halloween costume https://t.co/ky5FcgHgzj pic.twitter.com/zTSYOnXDFE__Sometimes your creativity goes beyond dressing yourself, so you choose to dress Roger Ver as well.I picked a halloween costume for you @rogerkver pic.twitter.com/vqJqE7qGBi__Gifto is going as another scary thing, especially in the context of this year.What crypto-themed costume are you wearing for Halloween? We know what we're going as....    #Gifto #Halloween #Wehatebears #CryptoScares pic.twitter.com/meER1ePszs__At least everyone recognizes what you’re supposed to be in both of these examples.pic.twitter.com/vCbTzQcUJlThe beard was a nice touch.Atlanta Tech Village @atltechvillage building costume party. Hannon Hill bringing it as “Bitcoin Miners” #halloween #halloweencostumes https://t.co/uiX7outd7n pic.twitter.com/zgSshNA3NT__If you’re not mining, are you HODLing? Because we know what you should dress as.Halloween costume idea: bitcoin HODLer pic.twitter.com/JOhh2zh8q6__We know it’s photoshopped, but it’s an idea for everyone still wondering what to go as.Best Halloween costume pair of the year 😂😂😂 via r/bitcoin #bitcoin pic.twitter.com/ZuOG34e2fH__Here’s a Bitcoin whale, too. Are you ready to have this guy explain Bitcoin to you through terrible analogies?Please welcome to the ringYour 2k18 Halloween costumeThe holder to HODLThe slayer of cyberThe king of cryptoBIG MONEY BITCOIN pic.twitter.com/XkrUz3Hcxx__If you’re still not convinced, Whale Panda has more ideas for you.Inspiration for $Crypto-themed halloween costumes:- Ripple Bagholder- Sealion (optional: film crew following you around)- Nouriel Roubini- illegal ICO issuer (optional: in prison)- Carnivore Bitcoin Maximalist- Reckless Lightning Network user__Also known as a “stablecoin” lately.im a bitcoin for halloween pic.twitter.com/4gczzQsyyq__And if you’re sick and tired of costumes, here’s more horror movies reimagined as crypto!ICYMI here's the full 7 #Bitcoin #Halloween cartoon series from https://t.co/3uyQXNWqI3! pic.twitter.com/c8tyqZSjMb__This is not the first crypto Halloween and ""crypto bubble"" year. Check out this idea from last year!For Halloween I went as a Bitcoin Bubble. pic.twitter.com/vi8ve0A4qH__A great way to pay homage to early memers!My Halloween costume came! 🧙🏽‍♂️ #bitcoin #magicinternetmoney #wizard #crypto #ethereum #halloween pic.twitter.com/ZMztmTRSpm__How about using this idea from last year to dress as something everyone would love to see again?Happy Halloween from the Bitcoin Bull/El Toro de Bitcoin. World Tax Federation Heavyweight Champion. IRS CONQUERER #Halloween #Crypto pic.twitter.com/EkixsNhrk7_____By the way, did you know that Halloween has its own coin? Ranked as No. 2028 by market capitalization, Halloween Coin (HALLO) is scaring its owners by dropping 35% in the past 24 hours (its trading volume stands at USD 27.) While it's pre Halloween week chart is worth mentioning, too:"
12,https://cryptonews.com/,"Oct 22, 2018",9 Crypto Baskets of 2018: Features and Differences,https://cryptonews.com/exclusives/9-crypto-baskets-of-2018-features-and-differences-2806.htm,"This means that when you buy a bundle that includes, for example, Bitcoin 
and Monero, you will get significantly more of Bitcoin than of Monero ...","
October 22, 2018
","Doing your own research before investing money in any kind of endeavor is of critical importance. The chance to lose everything is much higher when you don’t know exactly what you’re doing. Investing in cryptocurrencies can be all the more daunting for the fact that they’re relatively new and mostly unregulated, and there is no central authority you can go to in order to ask everything you wanted to know.","This is why crypto baskets exist: if you’d rather not handpick among thousands of coins, various platforms offer the possibility of buying a so-called basket which includes a select array of coins. In most cases, they are weighted against the market: this means that the percentage of market dominance is also often the percentage the coin makes up in the bundle. This means that when you buy a bundle that includes, for example, Bitcoin and Monero, you will get significantly more of Bitcoin than of Monero due to their respective market capitalizations.Cryptonews.com brings you a collection of nine crypto baskets, launched by 5 five platforms this year, for a better overview of what’s in the market, what you’d be interested in and what potential drawbacks they have.CollectionsProvider: Circle Invest
Basket Options: four baskets (Platforms, Payments, Privacy and The Market)
Tokens within Basket: Platforms: four; Payments: four; Privacy: two; The Market: eleven;
Overview: Circle has been trying to make it as easy as possible to get started with cryptocurrency trading, and Collections is supposed to make it easy for anyone, even complete “noobs,” to purchase cryptocurrency. The Market is a bundle with which, in one tap, you can buy all the coins on Circle Invest, weighted depending on their respective market capitalization. The others are grouped according to their purpose. This means that Monero will belong to Privacy, while Bitcoin is in Payments, etc. 
Points of Interest: Geographically restricted (only for the US); initial transaction as low as a single US dollar.
____BundleProvider: Coinbase
Basket Options: one basket;
Tokens within Basket: five: Bitcoin, Bitcoin Cash, Ethereum, Litecoin, and Ethereum Classic;
Overview: The Coinbase Bundles work very similarly to Circle’s Collections in that they are weighted according to each coin’s share of the market - they are available in different ratios based on the market capitalization and price at the time of purchase.
Points of Interest: Geographically restricted (to the US, EU and UK); the smallest Coinbase Bundle available is USD 25, GBP 25, or EUR 25; limited purchase according to verification limits.
____BIT10Provider: Abra & Bitwise
Basket Options: A single index 
Tokens within Basket: the top 10 coins by market cap that also meet quality criteria (liquidity, security, and robustness requirements), rebalanced monthly;
Overview: The BIT10 is based on the traditional model of index investing. It is supposed to widen access to cryptocurrency investing by simplifying the experience of gaining exposure to a large part of the crypto market, and minimizing barriers to entry. Using Abra’s stablecoin model,  BIT10 positions are held in multi-signature smart contracts on the Bitcoin or Litecoin blockchain. Once invested, Abra and the user enter into a smart contract that effectively pegs the asset invested (either fiat currency or cryptocurrency) to the same amount of BIT10 tokens. While the token is built on Bitwise's index fund, it is not an exchange-traded fund (ETF).
Points of Interest: USD 5 minimum investment; no restrictions on entry or exit timing; no fees; no geographical restrictions.
____HB10Provider: Huobi 
Basket Options: a single index;
Tokens within Basket: 10 coins that are listed on Huobi and have the higher market value, larger scale and better circulation to reflect the overall performance of Huobi Global's market;
Overview: By exchanging for HB10, users can hold HB10 Index. Users can have the opportunity to exchange for a basket of corresponding digital assets so that they can invest in several currencies, which can help to provide users with a risk-distributed and diversely targeted tool for long-term digital asset exchange.
Points of Interest: exchange fee decreases with exchange value (up to none at all after USDT 1 million); allocation method explained in-depth on the company’s website; HB10 can be exchanged with BTC, ETH, HT (Huobi Token) and USDT.
____OK05/OK06Provider: OKEx
Basket Options: two: OK05 and OK06;
Tokens within Basket: five within OK05, six within OK06;
Overview: OK05 and OK06 are indices that both follow the top 5 coins by market cap, with the difference that OK06 adds a sixth coin to its collection: OKB, the official utility token of OKEx. To qualify for the OK05, tokens are required to have been listed on OKEx for longer than 90 days; to be an open-source project; to be in the top 10% by 30-day average trading volume in USDT market; must be decentralized and cannot be a security. All coins from OK05 are automatically eligible for OK06 with the addition of OKB, which serves to reflect the performances of the most important tokens on OKEx. The index is rebalanced weekly. 
Points of Interest: minimum subscription/redemption quantity is 100 units; both subscription and redemption are completed within an hour; there is no subscription fee, but the redemption fee is 0.2%."
13,https://cryptonews.com/,"Nov 17, 2018",20 Crypto Jokes After the Bloodbath,https://cryptonews.com/exclusives/20-crypto-jokes-after-the-bloodbath-2931.htm,"Well, not as much as they used to, it's true. 20 Crypto Jokes After the 
Bloodbath 101. __. When Bitcoin decides it's irritated by you constantly ...","
November 17, 2018
","Another week that seemed to be pretty similar to the past few in terms of prices - until the fated Wednesday night and Thursday morning, when the market dropped and so did our hopes and dreams. However, there are many pieces out there detailing what is happening in the market, how people are reacting and what we can expect. What this means for our weekly meme piece, meanwhile, is that we get to laugh at ourselves. It beats crying any day.","This week, we caught up with users still waiting for their fiat withdrawals at Bitfinex, discovered that yet another stablecoin has a centralizing backdoor, and followed the BCH hard fork race with bated breath. While waiting on those results, retail giant Target’s Twitter was hacked by Bitcoin scammers, a guy went to prison for stealing crypto, and it turns out that Faketoshi did lose the BCH battle after all.Regardless of what your side in the BCH hard fork was, let’s dive in now.___________________Probably the best Drake parody you’ll see around, just because it hits so close to home.__Bulls popping bubbles.Proof that something can be both in a bubble AND a bull run...#crypto #funny #ico #bull #bitcoin pic.twitter.com/dezfrJNG0W__Well, not as much as they used to, it’s true.__When Bitcoin decides it’s irritated by you constantly wondering when it’s going to do something.__This is all of us.Ok really last gif of the day. This is a classic from @JimBTC #Crypto #bitcoin pic.twitter.com/zWPkA3sAKQ__And you thought the kitty had it good.#Bitcoin pic.twitter.com/IPvcAPQho2__It’s a mistake, right? It must be a mistake. Software glitch? Glitch in the matrix?Hello @tradingview I'd like to report an error on your platform (I'm a pro user)Seems like there's something wrong, right? Right? pic.twitter.com/U0TKGqd7EB__To clarify, they mean last December, which doesn’t mean we can’t hope for a bull run this time around as well.__What it felt like to trade these days.__And this is what it feels like to HODL with the current market.__Jackie Chan would like you to know that you should have done the same.__Small blessings in these hard times.__This is probably almost exactly the way it happened.__You know, this is probably the weirdest thing you’re going to see all day. When an ICO actually makes good on a crazy idea 💡 #crypto #ico #bitcoin #btc #funnyA post shared by  CoinBoys (@coinboyscast) on Nov 10, 2018 at 11:10am PST__Let’s hope it gets better, and that this guy actually has some sort of jockstrap.To all the 2018 crypto holders, if you are reading this and you are still in crypto, you have paid your dues and will get to harvest in 2019. pic.twitter.com/7SE6WVKTmp__The irony is obvious, and so is the message this is sending.__Bracing yourself didn’t really work out for Ned Stark in the end, did it?__Fiat is bad for you. Ask a crypto expert for help with quitting fiat.__Have you seen this guy? Missing since last Christmas. Was last seen climbing a mountain at 20,000 feet.__Halloween may be over, but our nightmares are still here.__"
14,https://cryptonews.com/,"Oct 15, 2018",Top 20 Countries by Crypto ATMs per Capita,https://cryptonews.com/exclusives/top-20-countries-by-crypto-atms-per-capita-2734.htm,"Also, for those who like to build things we have a bonus video - How to 
Make a Bitcoin ATM (well, from cardboard.) Enjoy!","
October 15, 2018
","Cryptocurrency ATMs are often considered a sure way to tell whether the country is receptive towards the new technology or not. Although we’re used to first world countries having many crypto ATMs - the US has the most at 2,295 locations - it may be a better ratio to see how many ATMs a country has compared to its population. ","It comes as a no surprise that microstates such as Liechtenstein or San Marino have secured top spots here. In case of San Marino, it's enough to have one ATM to be No. 2 on the list. However, only 6 countries with the population of less that one million (out of more than 70, according to the United Nations) made into the list. Meanwhile, Austria with the population of almost 9 million and 229 ATMs is the leader among larger countries. In the case of protectorates such as Saint Kitts and Nevis or Anguilla, we did not count them as independent countries - since they’re not - but added them to their respective countries. This means that, although those territories have a small population, they did not make the list, as they were considered, on the whole, as the UK (or Netherlands in the case of Aruba).Also, if Hong Kong, the special administrative region of the People's Republic of China, would be an independent country, it would also secure a place among Top 10, as it has 28 crypto ATMs. Although the low population count in many of these examples skews the image of cryptocurrency adoption, it is still worth noting that adoption exists even in those places that are not in most news headlines. After all, as we see here, Djibouti has a better ATM per capita ratio than, for example, Australia.Take note, big countries.In either case, the number of crypto ATMs in the world is rising steadily, and that they're enjoying increased usage from customers. Still, the legal status of crypto is preventing their growth from being as impressive as it could be, while stubbornly high fees are placing a limit on customer usage.
____Also, for those who like to build things we have a bonus video - How to Make a Bitcoin ATM (well, from cardboard.) Enjoy!"
15,https://cryptonews.com/,"Oct 31, 2018",Ripple's New Ad Is Brutally Honest,https://cryptonews.com/news/ripple-s-new-ad-is-brutally-honest-2851.htm,"Cryptonews · News · Bitcoin NewsEthereum NewsAltcoin NewsBlockchain 
NewsPress ReleasesSponsoredIndustry TalkICO news · Exclusives.","
October 31, 2018
","After a successful advertising campaign of eToro, a multi-asset platform which offers both investing in stocks and cryptocurrencies, Ripple, a California-based crypto start-up focusing on the banking sector, is trying to get their minute of fame. ","The startup has just published a new ad, and they’re mocking the outdated financial system by showing that it would be both easier and faster to get on a plane and deliver money directly. The ad shows a woman bringing money to a bank, and the teller getting dressed, boarding a plane, climbing mountains and navigating rivers and jungles to find the recipient and give them the money. “Global payments are fragmented. Ripple connects,” the ad concludes.Comments on the YouTube video are disabled, so the community took to Twitter to share their opinions about the ad. “I think this should be a Super Bowl commercial,” says user @cryptografix, while others are asking whether the ad will be televised. However, others stress that the ad is not talking about the XRP, the native token of Ripple: Yeah, but the point is to make sure crypto has a mainstream platform to present its use case to the world.In either case, the ad is already garnering attention, with more than 65,000 views on Twitter and more than 5,000 views on YouTube.Meanwhile, on Reddit, user u/LOSFan4 even says the idea for this commercial came from him! “For context: 68 days ago I posted here suggesting that Ripple make a commercial where they demonstrate how it’s faster to fly money around the world,” he says, linking the post that garnered some attention even back then, with close to 400 upvotes and 116 comments. “I’m picturing a video commercial where the point is a race to deliver money. Someone leaves Ripple’s NY office with a backpack full of cash, while someone else sends an electronic payment via SWIFT to someone in London. First person to get the money to London wins. You show the person flying to London, delivering the cash, going on a short holiday (seeing the sights, etc), flying back to NY, while the SWIFT money STILL hasn’t settled,” u/LOSFan4 wrote back then, adding, “Part 2 of the commercial is the same race, but it’s physical delivery vs xRapid. Basically the guy carrying cash doesn’t even get to the elevator before he’s lost the race.”Whether or not they got the idea from this Reddit user, the ad is just the latest in Ripple news: last week, the company said that they saw revenue from the sale of the digital asset XRP more than double this past quarter compared to the second quarter of 2018. The Q3 2018 XRP Markets Report states that they sold USD 163.33 million in XRP, up from USD 75.53 million in the second quarter.Also, a few weeks ago, Ripple announced that three clients have moved from pilot-testing to full commercial use of Ripple’s xRapid product, which uses the cryptocurrency XRP as a liquidity vehicle for cross-border payments.Back then, Alistair Constance, CEO of MercuryFX, UK-based payment provider, told Fortune that the company used xRapid to send a several thousand dollars in small denominations to a charity in Mexico. According to the CEO, the payments were made in two minutes at a cost of ""not even a couple cents,"" while sending USD 1,000 via SWIFT international payments network it would take 2-to-3 days to settle and cost up to USD 75."
