,period,username,date,retweets,favorites,hashtags,text
1,201712,justinsuntron,2017-12-21 06:45:40+00:00,503,712,#trx #tron #bitcoin #bitcoin #eth,Thanks Bloomberg. But it seems our return for the past week should be 4000% #trx #tron #bitcoin #eth $trx
2,201712,justinsuntron,2017-12-18 13:07:23+00:00,387,443,#tron #trx #bitcoin #bitcoin,We have launched new trading campaign with the world No.1 exchange @binance_2017 https://support.binance.com/hc/en-us/articles/115003486931-Binance-TRON-Bring-You-a-Merry-Christmas-Maserati-Mercedes-Benz-Giveaway- The champion will win @Maserati_HQ and @MercedesBenz $trx #tron #trx #bitcoin
3,201712,justinsuntron,2017-12-16 17:00:18+00:00,81,276,#trx,Guess who expands far beyond Bitcoin #trx
4,201712,justinsuntron,2017-12-15 14:46:25+00:00,102,346,#trx #tron,"We spend 100 days to increase our daily trading volume from 50,000 USD to 100 million USD. 100 days to reach 1 billion market cap(ethereum 2.5 year Bitcoin 4 years). #trx #tron"
5,201712,justinsuntron,2017-11-25 19:32:01+00:00,6,45,#TRX,"I am writing my thesis about bitcoin,blockchain, #TRX of Hupan University and will submit to Hupan board on Nov. 30th. "
6,201712,justinsuntron,2017-11-14 17:20:27+00:00,0,6,#Trader #bitcoin #bitcoin #ethereum #BitcoinCash,"@hitbtc are happy to announce the latest initiative made in collaboration with one of its partners: the TRX airdrop, powered by TRON Foundation. http://blog.hitbtc.com/2866-2/ $trx $eth $btc #Trader #bitcoin #ethereum #BitcoinCash"
7,201712,justinsuntron,2017-11-14 16:52:23+00:00,15,52,#blockchain #ethereum #bitcoin #bitcoin #exchange #trade,Excited to announce the airdrop of $TRX on @hitbtc! Trade TRX/BTC and TRX/ETH on one of the leading exchanges! #blockchain #ethereum #bitcoin #exchange #trade
8,201712,justinsuntron,2017-11-10 11:22:57+00:00,12,39,,This is the FIRST TIME Jack ma makes comments on Bitcoin. He believes the technology in Bitcoin is very powerful. $trx $eth $btc https://twitter.com/tronfoundation/status/928939640345673729
9,201712,officialmcafee,2017-12-25 17:59:37+00:00,677,3114,,"Technical issues with Bitcoin are trivial, including transaction times and costs. I have been a technician all of my life, so if anyone knows, it is me. The world is waiting on consensus for the right solution. Bitcoin is still the only guaranteed investment in the crypto world."
10,201712,officialmcafee,2017-12-25 16:10:33+00:00,3391,11426,,"For you who are long term investors like myself: (those who allways make the most returns), BITCOIN is still the crypto giant. It is at a low price, and will never be cheaper. It will be ten times this price in 2018. Remember - it has the lowest circulating supply of any coin."
11,201712,officialmcafee,2017-12-23 13:07:27+00:00,2782,10808,,"Coin of the day: Digibyte (DGB). Using a Blockchain which is 40 times faster than Bitcoin and having one of the most decentralized mining systems in the world - based on 5 different synergistic algorithms. DGB adherents call the coin ""The Sleeping Giant"". https://www.digibyte.co"
12,201712,officialmcafee,2017-12-22 14:01:09+00:00,4266,3452,,"Coin of the day: BURST -- First truly Green coin and most overlooked coin. Uses 400 times less power than Bitcoin. Super secure and private. Includes smart contracts, encrypted messaging, decentralized wallet, libertine blockchain. Most undervalued coin. "
13,201712,officialmcafee,2017-12-19 19:27:08+00:00,6,55,,You need to try to understand ..... Bitcoin is a currency. It's rise is due to the massive explosion in vendors who will ONLY accept Bitcoin as payment. How can you not see the simplicity of the math?
14,201712,officialmcafee,2017-12-19 19:14:30+00:00,1,5,,You are missing the point!! It is a currency and the price rise is due to the massive rise in vendors who ONLY accept Bitcoin as a payment.
15,201712,officialmcafee,2017-12-19 17:41:47+00:00,453,2106,,MGT's new Bitcoin mining facility and mining maintenance staff. We are aiming for the number one Bitcoin mining facility in the world. 
16,201712,officialmcafee,2017-12-19 13:23:32+00:00,0,4,,tgat chart has nothing to do with Bitcoin
17,201712,officialmcafee,2017-12-19 13:16:36+00:00,7,41,,If it's not self evident then you absolutely have no business investing in cryptocurrencies. Stick to stocks. Or invest in my company - MGTi - which is one of the world's largest Bitcoin Mining companies. A much safer investment for newbies in cryptocurrencies.
18,201712,officialmcafee,2017-12-19 13:07:40+00:00,2,15,,"In 2013, Bitcoin was in its infancy and few items could be purchased with it. Bitcoin is a currency with a fixed number of coins and a huge number of vendors. Bubbles (long term drops) cannot happen.a"
19,201712,officialmcafee,2017-12-19 10:21:50+00:00,359,986,,Tulip mania and Bitcoin. Why Bitcoin cannot have a bubble. 
20,201712,officialmcafee,2017-12-15 07:21:15+00:00,6,51,,"Ni sir. This is a three or four year play. But I promise, in the long term m, it will outperform Bitcoin by a factor of 5. It will break all records. Don't ask me to explain. Your lucky to get this:)"
21,201712,officialmcafee,2017-12-15 06:08:38+00:00,5,44,,Many times Bitcoin's rise. It's a long term play. There are technical problems that need to be fixed. And it is being delisted from exchanges. This is why it now only costs a few pennies. It's like getting into Bitcoin when it was a few pennies. There is no better investment.
22,201712,officialmcafee,2017-12-15 06:03:50+00:00,7,33,,"Technical problems with the code. Easily fixed. After it is fixed it will double or tripple Bitcoins performance. Plus, It's now only a few pennies because everyone knew it would be delisted. It's like getting into Bitcoin six years ago when it was just a few pennies."
23,201712,officialmcafee,2017-12-15 04:34:56+00:00,79,346,,"In fact, I own more SAFEX than Bitcoin. So. Trust me, I was not trying to dis SAFEX. An excellent coin. It just did not come to mind as I searched my memory for the older and more established privacy coins. Or maybe I just didn't want anyone horning in on my secrets:)"
24,201712,officialmcafee,2017-12-10 18:19:56+00:00,1,5,,"""Users"" -- My company is one of the largest miners outside of China. I know what ""users"" are doing. The overwhelming majority use Bitcoin as a currency. If you want to buy a product and you can only buy it using Bitcoin, then you use Bitcoin. Wake up people."
25,201712,officialmcafee,2017-12-10 18:07:07+00:00,584,1298,,"In the long term, don't be afraid of Bitcoin Futures: "
26,201712,officialmcafee,2017-12-09 13:47:58+00:00,55,302,,"I like stuff. Most of the stuff I REALLY like I can only buy with Bitcoins. I prefer stuff over money. I can't eat, smoke, wear or fuck a Bitcoin. I got 'em, but I spend 'em."
27,201712,officialmcafee,2017-12-09 08:45:59+00:00,624,1376,,Why the price of Bitcoin cannot be a bubble: 
28,201712,officialmcafee,2017-12-09 03:55:33+00:00,2,6,,Utter fucking nonsense. Most of the people I hang with use Bitcoin every day to buy things. Scarce??? What does that mean? I sell something for Bitcoins. I then use those Bitcoins to buy something.
29,201712,officialmcafee,2017-12-09 03:46:56+00:00,58,226,,"He omits the most important fact: Bitcoin is a currency. I personally buy almost everything with it. So do many others. As this currency is adopted by more vendors, the supply/demand formula will activate with a vengeance. Even without the ""investment"" aspect, Bitcoin will fly."
30,201712,officialmcafee,2017-12-09 01:06:40+00:00,239,741,,"Here is the flaw with Jamie Dimon's ""Tulip Mania"" analogy: Tulips are perishable and must be repurchased, over and over, to maintain a presence. Obviously, inflated prices cannot be sustained. Bitcoin is not perishable, and needs to purchased only once. There can be no comparison "
31,201712,officialmcafee,2017-12-08 23:11:06+00:00,3,35,,WTF??? This has nothing to do with the price of Bitcoin. What drugs are you on?
32,201712,officialmcafee,2017-12-08 02:14:04+00:00,3,39,,You are an adult and are free to interpret the world as you wish. I just can't buy your logic. It's based on a universe that has been replaced. I think you should re-read Satoshi's white paper. We have left the fragmented development stage if Bitcoin.
33,201712,officialmcafee,2017-12-08 01:29:39+00:00,15,73,,"A comment by Jamie Dimon that causes a 40% drop in Bitcoin in a day, is not a ""correction"" if Bitcoin recovers + 20% in 72 hours. This new math allows for massive short terms deviations from trajectory, but they are all self correcting. Determine the price trajectory, and relax."
34,201712,officialmcafee,2017-12-08 01:09:27+00:00,1845,3889,,"Bitcoin now at $16,600.00. Those of you in the old school who believe this is a bubble simply have not understood the new mathematics of the Blockchain, or you did not cared enough to try. Bubbles are mathematically impossible in this new paradigm. So are corrections and all else "
35,201712,officialmcafee,2017-12-07 22:44:05+00:00,3,16,,You can buy a tenth of a bitcoin. Or a millionth. Only have six dollars? You can buy six dollars worth of Bitcoin.
36,201712,officialmcafee,2017-12-07 14:38:27+00:00,3,10,,Which cryptocurrency other than Bitcoin takes hours????
37,201712,officialmcafee,2017-12-07 14:23:45+00:00,3,47,,"That's just Bitcoin. I said ""cryptocurrencies"""
38,201712,officialmcafee,2017-12-07 14:20:44+00:00,908,2163,,"Bitcoin = $15,000. Why? The cryptocurrency paradigm is accelerated. When banks do wires it takes 24 hours. A Cryptocurrency wire takes 24 seconds. Buying with a credit card can take 5 minutes of inputs. A Crypto currency buy takes 5 seconds. Why be surprised by 10,000% growth? a "
39,201712,officialmcafee,2017-12-07 07:56:59+00:00,0,3,,"Both are, fundamentally. BITCOIN"
40,201712,officialmcafee,2017-12-07 07:38:08+00:00,216,876,,"Three days ago a Wall street wizard predicted Bitcoin could hit $14,000 by the end of 2018. I replied that it would absolutely be above $14,000 before the end of January. We were both off base: "
41,201712,officialmcafee,2017-12-07 06:20:23+00:00,112,431,,A message to the establishment and to all those who oppose Bitcoin: 
42,201712,officialmcafee,2017-12-06 05:40:21+00:00,522,1975,,"""The Age of Bitcoin"". Enough said."
43,201712,officialmcafee,2017-12-06 05:38:12+00:00,1,29,,"""The age of Bitcoin"". God damn .... I like it. May I steal It? I only steal with permission."
44,201712,officialmcafee,2017-12-06 04:13:35+00:00,590,1634,,"Legendary trader predicts Bitcoin at $14,000 by the end if 2018. Will the old guard ever get a clue?? BTC will surpass that by the end of January. The world has split in half. Make sure you are in the half that embraces the new paradigm. "
45,201712,officialmcafee,2017-12-05 05:49:22+00:00,189,581,,https://www.youtube.com/watch?v=CssU9WBHx6k&amp;feature=youtu.be My infowars interview about Bitcoin
46,201712,officialmcafee,2017-12-04 13:27:46+00:00,2,20,,"The fact that you use the word ""correction"" shows that you have no understanding of the dynamics of Bitcoin. ""Correction"" is a force associated with a paradigm that has no play in the world of Bitcoin."
47,201712,officialmcafee,2017-12-02 03:34:30+00:00,4,10,,"Insufficient data for a guaranteed bottom line. I know for a fact that Bitcoin will, at the absolute least, reach $1 million by Dev 2020. The mean is $1 million 600,000"
48,201712,officialmcafee,2017-12-02 03:31:16+00:00,1,13,,Don't use addition. Use percentage growth month to month. Extrapolation gives Bitcoin a value of over $6 million by Dec 2020
49,201712,officialmcafee,2017-11-30 07:49:09+00:00,1,8,,Bitcoin. I buy nothing that cannot be bought with Bitcoin.
50,201712,officialmcafee,2017-11-30 06:35:23+00:00,3,8,,You can buy any fraction of a Bitcoin
51,201712,officialmcafee,2017-11-30 03:04:24+00:00,240,527,,"There are only 21 million Bitcoins. There are 2 billion working people in the world. Final Bitcoin value = (average individual economic productivity) ร (number of productive people) รท (21 million). A GROSS simplification, but the answers is in the tens of billions $per coin."
52,201712,officialmcafee,2017-11-29 23:22:46+00:00,788,2349,,"Bitcoin has created a new paradigm of unprecedented scale, and the backlash against it is also unprecedented. ""Bubble, ""Scam"", ""Shitcoin"", ""Scheme"", and other derogetories are like ""GET A HORSE"" laughingly shouted at new owners of the first automobile. People: sell your horses!"
53,201712,officialmcafee,2017-11-29 16:26:20+00:00,0,180,,An old and tired Bitcoin
54,201712,officialmcafee,2017-11-29 16:25:31+00:00,9,151,,People pay me obscene amounts of money to answer that question. You won't find the answer here. Feel lucky that I at least give a Bitcoin price projection.
55,201712,officialmcafee,2017-11-29 16:17:23+00:00,22,582,,Where is the contradiction? Bitcoin can reach a million and still not be dominant. Did all of you get hit in the head as a child?
56,201712,officialmcafee,2017-11-29 15:56:40+00:00,6627,12422,,"When I predicted Bitcoin at $500,000 by the end of 2020, it used a model that predicted $5,000 at the end of 2017. BTC has accelerated much faster than my model assumptions. I now predict Bircoin at $1 million by the end of 2020. I will still eat my dick if wrong. "
57,201712,officialmcafee,2017-11-28 13:43:35+00:00,1,5,,Go read up on Bitcoin and then cone back. You are seriously confused dude.
58,201712,officialmcafee,2017-11-28 13:42:16+00:00,1,8,,And Bitcoin will be abandoned in favor of some other proof of work coin.
59,201712,officialmcafee,2017-11-28 13:35:59+00:00,2,16,,"I personally own none of either. If Bitcoin goes down and I'm holding, then I lose. That's gambling. We create then sell, create then sell, create then sell. It is the only formula guaranteed to make money."
60,201712,officialmcafee,2017-11-28 13:25:06+00:00,275,644,,"Article: Bitcoin investors will be the richest people on earth. Anyone who understands Bitcoin cannot deny this. But what does that say about Bitcoin miners? We occupy the top rung of profitability. Soon, mining will be immorally profitable. http://www.mntrends.com/2017/10/see-why-bitcoin-investors-might-make.html?m=1"
61,201712,officialmcafee,2017-11-27 23:56:36+00:00,518,1938,,"It amazes me that human beings can deceive themselves. Bitcoin has been doubling every month for the past three months, yet an analyst suggests that it might grow, in the next 8 months, by 12%. They opened the door to the new world, but brought the rules from the old world."
62,201712,officialmcafee,2017-11-24 23:03:15+00:00,1,17,,Totally incorrect. If Bitcoin goes down you lose. We dont. When Bitcoin drops so does the difficulty rate - we mine mire couns for the same fixed cost. We maje exactly the same outrageous profit whether it goes up or down.
63,201712,officialmcafee,2017-11-24 23:00:00+00:00,3,47,,"Unclear. The asset would have to appreciate. Mgti makes the same enormous amount of money whether Bitcoin goes up or down. If it goes down, so do difficulty rates and we mine more coins. If difficulty goes up we mine fewer coins but make virtually the same profit."
64,201712,officialmcafee,2017-11-24 22:30:54+00:00,175,677,,People finally discovering that the best way to invest in Bitcoin is to invest in MGTi: 
65,201712,officialmcafee,2017-11-20 21:51:37+00:00,1,5,,Bitcoin. Gold is visible.
66,201712,officialmcafee,2017-11-20 05:22:15+00:00,1,2,,Jihan has never sold a single Bitcoin from the multiple millions of coins he has mined. And he is the only game in town for mining machines.
67,201712,officialmcafee,2017-11-20 04:43:44+00:00,2,6,,I don't divulge sensitive information for free. Let me look for my Bitcoin wallet address ......
68,201712,officialmcafee,2017-11-18 02:01:04+00:00,1,8,,Never said it was. Merely said it will replace Bitcoin. If anyone here is actually angered by that opinion then you don't belong in my Twitter. This account is for adults only.
69,201712,officialmcafee,2017-11-18 01:56:40+00:00,0,4,,Fuck forks. Whatever wins will still be Bitcoin
70,201712,officialmcafee,2017-11-18 00:47:10+00:00,0,14,,"Don't have a crystal ball, although Bitmain now will only take BCH. I think That's the writing on the wall. No worse thing could happen. The only feasible Bitcoin ASIC manufacturer requiring payment in BCH. This is my opinion only. If you disagree then PEACE!"
71,201712,officialmcafee,2017-11-18 00:04:45+00:00,0,5,,"I use virtually all cryptocurrencies fot testing, and have a small Bitcoin wallet for purchases. Maybe a total of $1,000. When I need to use Bitcoin I buy then spend it."
72,201712,officialmcafee,2017-11-17 21:16:32+00:00,164,462,,John McAfee Says You Can't Deny the Reality of Bitcoin Cash https://mney.co/2zFCPow via @moneymorning
73,201712,officialmcafee,2017-11-17 15:13:12+00:00,0,2,,all is good
74,201712,officialmcafee,2017-11-17 02:53:29+00:00,158,776,,I never said that Bitcoin was a business. I said that mining was a business. Anyone who cannot spot this obvious business is inhabiting a universe that in no way intersects mine.
75,201712,officialmcafee,2017-11-15 17:53:14+00:00,0,7,,I never said Bitcoin was a business. I said mining was a business. If you are too stupid to see this I don't need you as a follower. Blocking now.
76,201712,officialmcafee,2017-11-14 17:25:44+00:00,245,725,,Litecoin and Bitcoin making a move against Monero: 
77,201712,officialmcafee,2017-11-14 08:34:01+00:00,0,6,,They are both Bitcoin
78,201712,officialmcafee,2017-11-12 19:19:44+00:00,1,14,,I agree fully. Bitcoin is not a business. But mining is. You can't possibly hide from that reality.
79,201712,officialmcafee,2017-11-12 19:16:16+00:00,67,256,,"I remember. But you can't fight something by denying it. There is a flaw in Bitcoin. That flaw is mining. Satoshi is (was) a great mathematician, but had no understanding of business. Business is war. Pure and simple. And in war, there is always a winner."
80,201712,officialmcafee,2017-11-12 18:38:50+00:00,1,16,,And what is wrong with Asicboost? It is a competitive innovation. Mining is competitive. It was designed to be so. It is a business. Businesses always centralize. Why do you care? It has nothing to do with the ultimate state of Bitcoin.
81,201712,officialmcafee,2017-11-12 07:08:39+00:00,0,3,,As you wish. It is nothing more than Bitcoin + longer block size. Which of those two pieces is shit?
82,201712,officialmcafee,2017-11-12 06:59:16+00:00,0,9,,"Yes. All things do. But in the long term what will replace It? There is no replacement for a longer block chain. Segwit is a tool that punishes Jihan and accomplishes nothing. Bitcoin as it is cannot stand due to block size limitations. What is left? Please, God, someone tell me."
83,201712,officialmcafee,2017-11-12 06:52:31+00:00,4,20,,I'm not sure how substantive that list is. I see little understanding here. Bitcoin cannot survive without an immediate increase in block size. Everyone knows this. BCH is merely BTC with a larger block size. What is not to understand here?
84,201712,officialmcafee,2017-11-12 06:48:12+00:00,4,19,,BCH is Bitcoin with a larger block size. What are you talking about?
85,201712,officialmcafee,2017-11-12 06:37:41+00:00,16,61,,"Larger block size, we survive. Status quo, Bitcoin dies. It's as simple as that folks."
86,201712,officialmcafee,2017-11-12 06:33:06+00:00,236,748,,For those who feel that the rise of BCH has no substance: A larger block size us the single most substantial prerequisite to the survival of Bitcoin. BCH provides that larger block size. What more info do you need??
87,201712,officialmcafee,2017-11-11 22:12:15+00:00,2,34,,Why would I pump? I own no Bitcoin Cash.
88,201712,officialmcafee,2017-11-11 22:10:57+00:00,6,53,,"Then you must accept that you have lost. Don't like Bitcoin cash? Don't use it. But if you believe in what you claim, then war is inevitable. We are living in reality, not an ideology."
89,201712,officialmcafee,2017-11-11 22:05:14+00:00,303,1020,,"If you want to stop Bitcoin Cash, you cannot do it by denying the reality around you. Accept that they will win round one. No contest. Start from there and make war."
90,201712,officialmcafee,2017-11-11 20:38:56+00:00,5,30,,"OK ... the bottom line --- If you don't like Bitcoin Cash, then don't use it."
91,201712,officialmcafee,2017-11-11 18:32:01+00:00,31,196,,Its still Bitcoin dude. With longer blocks
92,201712,officialmcafee,2017-11-11 18:24:44+00:00,5,24,,And where do you believe the scam is? Bitcoin cannot survive with its current blocksize. What option does anyone have at this moment?
93,201712,officialmcafee,2017-11-11 18:12:18+00:00,9,45,,"It's hardly a scam. Bitcoin will disappear entirely without larger blocks. For now, that's all that matters."
94,201712,officialmcafee,2017-11-08 01:05:48+00:00,0,8,,The finger of Bitcoin
95,201712,officialmcafee,2017-10-23 01:07:18+00:00,0,4,,There is no ROI model for buying Bitcoin. I have no idea what price Bitcoin will be at the time of our next quarterly report.
96,201712,officialmcafee,2017-10-16 13:38:07+00:00,65,166,,My company - MGT - releases Bitcoin mining numbers: 
97,201712,officialmcafee,2017-10-13 13:05:30+00:00,124,373,,MGT announces purchase of additional 2000 Bitcoin mining machines. http://markets.businessinsider.com/news/stocks/MGT-Capital-Announces-Purchase-of-2-000-additional-Bitmain-S9-Antminer-Rigs-1004023933
98,201712,officialmcafee,2017-09-27 17:42:47+00:00,202,406,#bitindia #india #blockchain #bitcoin #bitcoin #ethereum #ripple #litecoin,A new wave of Blockchain from India has begun! http://www.applancer.co/blog/the-new-wave-of-blockchain-will-come-from-india #bitindia #india #blockchain #bitcoin #ethereum #ripple #litecoin
99,201712,officialmcafee,2017-09-24 06:40:42+00:00,4,33,,Bitcoin news published the same thing from a differrnt source.
100,201712,officialmcafee,2017-09-19 15:21:17+00:00,21,86,,Thanks to @realnewsx2 for having me on today's show to discuss Bitcoin's future and Equifax hack. Watch live http://infowars.com/show
101,201712,officialmcafee,2017-09-15 23:26:13+00:00,203,566,#bitcoin #bitcoin #chinaban,"Heading to India until the China war with cryptocurrencies is over. Heading to India, China is done! @bitindia #bitcoin #chinaban"
102,201712,VitalikButerin,2017-12-25 15:13:35+00:00,1,7,,So a bitcoin cash-led united cryptocommunity would preclude coinbase?
103,201712,VitalikButerin,2017-12-25 14:45:13+00:00,1,0,,"> If the community did modify PoW I would almost certainly sell out of bitcoin at that point, experiment over AFAIC. That's interesting! I personally do not feel that way about Ethereum, to me *recovering* from successful 51% attacks is a key part of censorship resistance."
104,201712,VitalikButerin,2017-12-25 14:28:11+00:00,0,0,,"If we want to build a censorship resistant currency, then IMO we *must* have a contingency plan for such scenarios; if the contingency plan does not exist, then that's not truly censorship resistant. And if it *does* exist then the contingency plan is part of the rules of bitcoin"
105,201712,VitalikButerin,2017-12-25 14:26:36+00:00,0,0,,"I'm assuming an external attacker, eg. Chinese gov takes over mining farms and 51% attacks bitcoin."
106,201712,VitalikButerin,2017-12-25 14:25:23+00:00,0,0,,"""Bitcoin is user driven"" == ""the *actual* rules of bitcoin are determined subjectively"". So you're agreeing with my point."
107,201712,VitalikButerin,2017-12-25 12:22:11+00:00,0,2,,"So you think that if an actual 51% attack happened (as in, a real attack, not miners not cooperating with bitcoin core's dev roadmap), then the community would just sit by and let the attack continue? If that was true, my opinion of bitcoin would be much *lower*."
108,201712,VitalikButerin,2017-12-25 02:57:55+00:00,1,44,,We've been over this. Social consensus is also bitcoin's security model (see: bitcoin core's threats to hard fork change PoW if miners attack the network). We're just more explicit about it.
109,201712,VitalikButerin,2017-12-19 03:53:17+00:00,12,61,,"If bitcoin cash wants to go to multi-gigabyte blocks, I hope they add state root commitments, or at least require transactions to reference block number and txindex of prevouts they spend, and https://github.com/ethereum/research/wiki/A-note-on-data-availability-and-erasure-coding; that way we can have strong light client verification"
110,201712,VitalikButerin,2017-12-18 07:07:11+00:00,11,28,,And we're intent on continuing to improve these mechanisms over time. Though keep in mind that none of this would have existed had we not had 4 years of bitcoin experience to learn from. Imagine what will exist in 2025 with 17 years of btc/eth experience as a basis.
111,201712,VitalikButerin,2017-12-18 05:14:12+00:00,3,12,,"Imagine if when Satoshi wrote the whitepaper he had five appendices on selfish mining attacks, 51% cartel attacks, attacks on the high-timestamp rejection mechanism, etc etc. Reading that you might think bitcoin is super-complex too."
112,201712,VitalikButerin,2017-12-18 05:07:59+00:00,4,10,,"If miners 51% attacked to revert three weeks of history, what blockchain do you think would *really* be considered canonical bitcoin a year from then? My money's on the original chain extended with a PoW hard fork."
113,201712,VitalikButerin,2017-12-13 09:00:29+00:00,2,3,,"> Unlike fiat though, LN's settlement to Bitcoin is cryptographically secured and cannot be removed! Technically not true: it can be removed via a soft fork that sharply cuts down block size or bans closing transactions."
114,201712,VitalikButerin,2017-12-09 02:48:14+00:00,2,16,,"But locally efficiency-improving innovation does not necessarily lead to a more efficient world. The most obvious counterexample is 20th century improvements in warfare technology. Bitcoin mining is, game-theoretically, more like war than it is like home lighting."
