,period,username,date,retweets,favorites,hashtags,text
2016,201712,barrysilbert,2017-09-26 22:11:32+00:00,0,15,,Smart move. I hear bitcoin is a fraud
2017,201712,barrysilbert,2017-09-24 17:36:44+00:00,19,47,,This week's Sunday poll: Who will be the first to do a 180 and publicly turn bullish on bitcoin?
2018,201712,barrysilbert,2017-09-22 16:50:18+00:00,20,104,,"Would love to see open outcry bitcoin exchanges pop up all over China (see Satoshi Square in the U.S., circa 2013)"
2019,201712,barrysilbert,2017-09-19 13:00:30+00:00,7,23,,"Great to welcome @balderton &amp; RMI to the Luno bitcoin party, joining @Naspers, @venturracapital and DCG. Congrats @marcusswanepoel and team!"
2020,201712,barrysilbert,2017-09-17 15:20:01+00:00,21,36,,This week's Sunday poll: Chinese government reverses the decision to shut down bitcoin exchanges in what time frame?
2021,201712,barrysilbert,2017-09-15 21:25:43+00:00,211,920,,Feels like the establishment declared war on bitcoin this week Bring it on
2022,201712,ToneVays,2017-12-25 15:44:09+00:00,173,600,#Shitcoin #BTCUSD #Bitcoin #Bitcoin #BCash,"Amazing how scammers like @officialmcafee have 0 integrity &amp; will shill ANY #Shitcoin for a price! &amp; guess what Currency he charges #BTCUSD of course, Yup the real &amp; ONLY #Bitcoin while conspiring for #BCash. (then gets pissed at legit trading strategies)"
2023,201712,ToneVays,2017-12-25 13:09:06+00:00,29,96,#Bitcoin #Bitcoin #Christmas,LIVE NOW talking #Bitcoin $BTCUSD price on this #Christmas Day!!!
2024,201712,ToneVays,2017-12-25 02:41:03+00:00,29,182,#MarryChristmas #Bitcoin #Bitcoin #ChristmasEve #HODL,#MarryChristmas all &amp; Happy Holliday. For this #Bitcoin #ChristmasEve please enjoy the awesome work of @realcoindaddy w/ his Ho-Ho-#HODL story!
2025,201712,ToneVays,2017-12-25 00:59:54+00:00,135,532,#BCash #ChristmasEve #Bitcoin #Bitcoin,"This Holiday Season, I would like to thank the #BCash Fools that are granting me the opportunity to deal with the following emails on #ChristmasEve !!! How incompetent are you people to NOT change address notion of your Malicious Hard Fork !!! There is ONLY ONE #Bitcoin "
2026,201712,ToneVays,2017-12-24 13:24:13+00:00,14,68,#Trading #Bitcoin #Bitcoin,"Bandwidth Willing :)... Will attempt to do #Trading #Bitcoin podcast to discuss current $BTCUSD downturn along with LIVE Q&amp;A. - On a daily 6 of 9, will the Massacre last 3 additional days?"
2027,201712,ToneVays,2017-12-24 13:00:13+00:00,2,60,#Bitcoin #Bitcoin,"I am a responsible analyst, with current #Bitcoin Volatility, i am not able to provide a confident price target nor am I in front of a computer all day in a place w/ good internet to update set targets. But have been doing daily $BTCUSD vids to try &amp; guide traders."
2028,201712,ToneVays,2017-12-23 23:52:49+00:00,1,3,#Bitcoin #Bitcoin,"close on that quote :). i refer to $USDT as a: ""Centralized problem to a decentralized solution"" created by #Bitcoin for censorship resistant payments."
2029,201712,ToneVays,2017-12-23 17:15:48+00:00,0,0,#Bitcoin #Bitcoin,vs #Bitcoin
2030,201712,ToneVays,2017-12-23 03:03:06+00:00,0,7,,it should be on WCN audio podcast
2031,201712,ToneVays,2017-12-22 17:04:17+00:00,0,3,#Bitcoin #Bitcoin,"i used to trade there, even beta tested the platform with Test Net #Bitcoin."
2032,201712,ToneVays,2017-12-22 16:55:51+00:00,47,312,#Bitcoin #Bitcoin,"Since @Coinbase is once again down dew to incompetence, may i recommend trading #Bitcoin $BTCUSD at @BitMEXdotcom https://www.bitmex.com/register/cMvHXg"
2033,201712,ToneVays,2017-12-22 16:45:24+00:00,2,21,#BCash #Bitcoin #Bitcoin #Bullshit,"So @coinbase once again is proving how they are terrible at running an efficient business. Oh and guess what, big blocks on #BCash will not solve their #Bitcoin (i wonder if they figured that out yet) I also Call #Bullshit. 2 months ago u could send $BTC at 5 sat/byte"
2034,201712,ToneVays,2017-12-22 13:26:32+00:00,31,98,#Bitcoin #Bitcoin #Scam #IOTA #Scam #Lightning,"#Bitcoin Morning Brief w/ @jimmysong - More wood for @SEC_News to Chop, @coinbase &amp; @GDAX stay incompetent, $IOTA is a #Scam - I repeat #IOTA is a #Scam! @starkness of #Lightning w/ @TheStalwart on @BloombergTV &amp; How low $BTCUSD will go?"
2035,201712,ToneVays,2017-12-21 20:36:03+00:00,1,31,#Bitcoin #Bitcoin,"Compared to #Bitcoin, almost every other crypto is INSTANT and Virtually Free... NO ONE USES THEM"
2036,201712,ToneVays,2017-12-21 17:07:07+00:00,5,34,#Bcash #Bitcoin #Bitcoin #SegWit,"As fools enrich bad actors by supporting #Bcash and other scam coins, these bad actors have more money to waste on spamming the #Bitcoin mempool for everyone. In addition these bad actors have companies like @coinbase @BitPay &amp; @blockchain in their pocket to NOT use #SegWit."
2037,201712,ToneVays,2017-12-21 14:29:14+00:00,26,73,#Bitcoin #Bitcoin #Litecoin,"#Bitcoin Morning Brief w/ @jimmysong - @CNBCFastMoney tries to Troll, @Coinbase is just a joke, is a $BTC ETF gonna happen &amp; @SatoshiLite sells his #Litecoin. Is $BTCUSD headed for a bear market?"
2038,201712,ToneVays,2017-12-21 14:07:50+00:00,0,1,#segwit #Bitcoin #Bitcoin,"Until companies like @coinbase @BitPay &amp; wallets like @blockchain start implementing #segwit addresses, #Bitcoin transaction fees will remain high."
2039,201712,ToneVays,2017-12-21 13:59:26+00:00,0,1,#Segwit #Bitcoin #Bitcoin,Hey Dumb Dumb (to quote @junseth) only 5% of address are #Segwit and companies like @coinbase @BitPay &amp; @blockchain HAVE 0 Intention of integrating it. Come back and troll when segwit is 95% of #Bitcoin Transaction.
2040,201712,ToneVays,2017-12-20 23:53:47+00:00,110,404,#Bitcoin #Bitcoin #Blockchain #Finance #BCash #Scammers,"The FACT that @CNBCFastMoney had to ask should show how clueless these so called ""EXPERTS"" are about #Bitcoin #Blockchain or anything in #Finance!!! Final results can be 99% to 1% &amp; they will still bring on #BCash #Scammers to screw their viewers! @CNBC @nbc @NBCNews"
2041,201712,ToneVays,2017-12-20 21:34:20+00:00,59,222,#Bitcoin #Bitcoin,You guys have to understand that @Coinbase does not see themselves as a manipulator. As long as they tell their customers one thing but do what ever they like as long as it actually hurts #Bitcoin it's the correct Business Decision. 
2042,201712,ToneVays,2017-12-20 20:55:19+00:00,0,2,#Bitcoin #Bitcoin #BCash,"So what were u using #Bitcoin for that the fees were bothering you? And why were you not able to use say a Credit Card with 0 fees. Cause if the answer is ""getting people into crypto"" I have to inform you that you are scamming your friends by getting them into #BCash for low fees"
2043,201712,ToneVays,2017-12-20 18:53:31+00:00,440,652,#Bitcoin #Bitcoin,"Sooooo, ""Insider Trading"" Investigator over? Thanks @lordoftrade and other twitter detectives for breaking this one wide open... someone should send a message to @BBC @BBCBreaking so they can update the article ... haha #Bitcoin "
2044,201712,ToneVays,2017-12-20 18:32:19+00:00,114,439,#BCash #Shitcoin #Bitcoin #Bitcoin,"There was a very easy way for @Coinbase to avoid any issues of Staff ""Legally"" Insider Trading the #BCash pump. How about simply giving users their #Shitcoin &amp; allowing them to trade it elsewhere. There is Just ONE #Bitcoin "
2045,201712,ToneVays,2017-12-20 18:20:27+00:00,26,73,#Bitcoin #Bitcoin,Interesting little convo on @FoxBusiness. Facts of a situation are ignored cause the messenger is not ideal... just another day in #Bitcoin Land. 
2046,201712,ToneVays,2017-12-20 14:30:56+00:00,39,102,#Bitcoin #Bitcoin #Shitshow #BCash #Scammers #SegWit,"#Bitcoin Morning Brief w/ @jimmysong - @Coinbase &amp; @GDAX (the #Shitshow goes on, but NOW w/ #BCash!) @CNBCFastMoney is either ""Incompetent"" or Malicious #Scammers, USE #SegWit. So What this Mean for $BTCUSD?"
2047,201712,ToneVays,2017-12-19 19:37:22+00:00,38,128,#Bitcoin #Bitcoin #hashgraphs #BCash #Blockchain,"It's been a while since @jimmysong &amp; I talked #Bitcoin Scaling. So let's go LIVE at top of the Hour to discuss the insane ideas to replace $BTC like #hashgraphs, #BCash &amp; other nonsense. #Blockchain"
2048,201712,ToneVays,2017-12-19 15:00:36+00:00,6,46,#Bitcoin #Bitcoin #t0 #Venezuela #Blockchain #SEC,"#Bitcoin Morning Brief w/ @jimmysong - CoinJoin Mixing by @nopara73, #t0 launching a token, #Venezuela &amp; Pumping your Stock with #Blockchain buzz (#SEC has popped companies before for this). Is the $BTCUSD price really pulling back?"
2049,201712,ToneVays,2017-12-18 15:01:59+00:00,11,49,#Bitcoin #Bitcoin #Olympic #FEDs,"#Bitcoin Morning Brief w/ @jimmysong - @BitPay Scams people by integrating ""Chuck-e-Cheese Tokens"", US #Olympic Luge Team, #FEDs Get Rich - $BTCUSD makes a dip on @CMEGroup Futures Launch, Now What?"
2050,201712,ToneVays,2017-12-18 14:33:21+00:00,0,0,#Bitcoin #Bitcoin,I have no problem with that statement? Not everyone is willing to be Ross Ulbrict & going to prison for life. Luke has a family w/ kids to take care of. Going to prison for other people is not for everyone. I have no intention of doing it either & why I use #Bitcoin carefully
2051,201712,ToneVays,2017-12-18 01:03:21+00:00,0,5,#Bitcoin #Bitcoin #Blockchain,if #Bitcoin is not a stable store of value nor a good future currency then #Blockchain has failed.
2052,201712,ToneVays,2017-12-17 23:21:28+00:00,0,64,#Trading #Bitcoin #Bitcoin #cali #colombia,Here is a side camera view of the Cameo on Today's #Trading #Bitcoin Video :) $BTCUSD #cali #colombia
2053,201712,ToneVays,2017-12-17 18:40:02+00:00,29,106,#Trading #Bitcoin #Bitcoin,"Going LIVE, NOW to talk #Trading #Bitcoin $BTCUSD, Get ready for @CMEGroup $BTC Futures to Launch. Will Wall Street Dump it? or are more All Time Highs Incoming?"
2054,201712,ToneVays,2017-12-17 18:30:21+00:00,2,16,#Bitcoin #Bitcoin,"My Official position on #Bitcoin as a currency is that it's the only Stable Censorship resistant unconscionable medium of exchange in the world, and when you have to make this type of a payment, the fee and speed is irrelevant."
2055,201712,ToneVays,2017-12-17 18:26:27+00:00,0,3,,"At the time he wrote it, Litecoin was closer to a scam/copycat of bitcoin. Just because 1000+ scammier projects people believe in launched since then elevating Litecoin to be the most useful 3 legged horse does not mean his original view is any less true today vs then."
2056,201712,ToneVays,2017-12-17 18:23:23+00:00,1,8,,"the Best Litecoin can ever be a TestNet for Bitcoin. In a way it's a good thing cause if Bitcoin core devs ever fuck up and new changes that Litecoin is so quick to adopt implode that blockchian, those that have any value saved there will learn a valuable lesson."
2057,201712,ToneVays,2017-12-17 17:54:05+00:00,0,17,#Litecoin #Bitcoin #Bitcoin,Please name 5 #Litecoin Devs that you know of and what are their programming history/experience? Actually how about you name 3. I can name you 15-20 #Bitcoin Devs.
2058,201712,ToneVays,2017-12-17 17:47:50+00:00,106,374,#Bitcoin #Bitcoin #Blockchian #Litecoin,"Since so many people are new to #Bitcoin/#Blockchian &amp; continue to get caught up in ""Get Rich Quick Pump &amp; Dumps"", I want to remind people of what @LukeDashjr said in 2013 about #Litecoin. It is even more True today as things like $LTC &amp; $XMR while Honest Project remain Useless!"
2059,201712,ToneVays,2017-12-17 17:42:11+00:00,0,3,#Bitcoin #Bitcoin,Why do I continue to waste my time with dumb trolls like yourself that know NOTHING & just make me waste time. Here is the last 6 months of $BTC vs $LTC &amp; they are identical. #Bitcoin is still 1000x safer investment even as it's being attacked left right. 
2060,201712,ToneVays,2017-12-17 13:50:10+00:00,0,1,,"I can't trade bitcoin... for example here is my last 24 hours: Woke up, caught up on social media for an hr, then did a morning show with Jimmy. Ate food &amp; left for Airport 930am Aruba time. Finally landed in Cali Colombia 7pm local (2 flights) met people &amp; went to dinner/drinks."
2061,201712,ToneVays,2017-12-17 13:43:05+00:00,29,167,#Nautilus #Scam #Fake #Bitcoin #Bitcoin #MSM,"Wow, what happened to @BKBrianKelly? I used to like that guy &amp; was even ignoring the #Nautilus #Scam he was pushing but Shilling #Fake #Bitcoin on @CNBC is really bad. Oh well, not the first time #MSM gives investors the WORST possible advice &amp; ain't gonna be the last!"
2062,201712,ToneVays,2017-12-16 12:42:33+00:00,25,77,#Bitcoin #Bitcoin #Crypto #Hyporledger,"#Bitcoin Morning Brief w/ @jimmysong - Protect your #Crypto, #Hyporledger is nonsense like we said 3 years ago &amp; North Korean Hackers? - $BTCUSD Breaks OUT! another ATH next MOON?"
2063,201712,ToneVays,2017-12-15 23:20:16+00:00,0,0,,"its specific to shorting bitcoin on Interactive Brokers (i use them, but have been priced out of shorting btc haha)"
2064,201712,ToneVays,2017-12-15 20:10:38+00:00,0,2,,I use bitcoin at least 3 times a day
2065,201712,ToneVays,2017-12-15 19:35:13+00:00,11,170,#Bitcoin #Bitcoin #Blockchian,"Another achievement Unlocked , I don't understand why @el33th4xor blocked me now, i have not engaged him in months maybe tweeted at him 5 times. Just goes to show how academics don't even wanna here #Bitcoin &amp; #Blockchian views from those on the ground &amp; NOT in Ivory Towers"
2066,201712,ToneVays,2017-12-15 16:58:48+00:00,65,312,#Bitcoin #Bitcoin #SegWit #BCash #Scam,"At this point: NOT only does Peter Smith oversee the WORST #Bitcoin Wallet @blockchain, man is either a liar on his Jan 31st #SegWit Comments, runs an incompetent company that can't implement improvements or they are maliciously sabotaging network in favor of #BCash #Scam Support"
2067,201712,ToneVays,2017-12-15 15:51:05+00:00,21,62,#Bitcoin #Bitcoin #Lightning #MtGox,#Bitcoin Morning Brief w/ @jimmysong - How can Crypto Community Boycott @blockchain (The WORST &amp; Now Borderline Malicious Wallet) http://Blockchian.info is now as bad as http://Bitcoin.com! #Lightning #MtGox - $BTCUSD Breaks OUT! to ATH next MOON?
2068,201712,ToneVays,2017-12-15 03:22:49+00:00,3,23,#ToneVays #Bitcoin #Bitcoin,"2 of 3: It should lead nicely into #ToneVays Pt. III, so for those did not catch it the first time, here is the relevant part :) #Bitcoin https://youtu.be/q3VFHY3PhzA?t=27m"
2069,201712,ToneVays,2017-12-15 03:20:12+00:00,7,54,#Bitcoin #Bitcoin #Satoshi #cryptokitties,"1 of 3: Once again shout-Out to @realcoindaddy for continuing to Entertain via his Youtube Channel for #Bitcoin comedy Rap $Gold &amp; awesome Story Telling. This on is called ""Moon Man"" #Satoshi #cryptokitties https://www.youtube.com/watch?v=q3VFHY3PhzA"
2070,201712,ToneVays,2017-12-14 21:02:24+00:00,9,60,#Bitcoin #Bitcoin #Tether,Live NOW w/ @RichardHeartWin talking #Bitcoin &amp; @CMEGroup + #Tether $USDT
2071,201712,ToneVays,2017-12-14 16:34:09+00:00,28,128,#OnTheRecord #Bitcoin #Bitcoin #Tether,"In about 4 hours tune into #OnTheRecord w/ @RichardHeartWin as we talk @CMEGroup #Bitcoin Futures &amp; their affects on $BTCUSD Price, get his views on #Tether $USDT &amp; what ever else is on his mind. Not one to miss guys!"
2072,201712,ToneVays,2017-12-14 16:17:13+00:00,7,39,#Bitcoin #Bitcoin #Bits #IToldYouSoVays #Venezuela,#Bitcoin Morning Brief w/ @jimmysong - is @Poloniex having issues? should we use #Bits Notation? #IToldYouSoVays called the exit of @OverstockCEO from @Overstock just Yesterday! haha &amp; #Venezuela Mining - $BTCUSD remains stuck at ATH w/ a 9 Sell Daily!
2073,201712,ToneVays,2017-12-13 14:52:21+00:00,16,66,#Bitcoin #Bitcoin #SEC #ICO #Tezos #SegWit,"#Bitcoin Morning Brief w/ @jimmysong - #SEC vs #ICO again, #Tezos Dumpster-fire getting bigger, is $BTC stealing $GOLD Luster &amp; BECH 32 #SegWit Addresses need Adoption. As for the price - $BTCUSD Still stuck at ATH with a 9 Sell Daily!"
2074,201712,ToneVays,2017-12-12 16:30:35+00:00,10,44,#Bitcoin #Bitcoin,Also since im not sure if i will have time to talk specifically about #Bitcoin futures from @CMEGroup w/ someone like @RichardHeartWin but please re-watch this from a month ago starts around 53:30 min in:
2075,201712,ToneVays,2017-12-12 16:15:56+00:00,9,78,#Toronto #SouthAmerica #Bitcoin #Bitcoin #ICO #Cryprokitties,Time to leave snowy #Toronto &amp; head back to #SouthAmerica. Hope nothing crazy happens to $BTCUSD price while i'm in the Air. In the mean time check out a part of my interview w/ @CoffeeAndCrypto on #Bitcoin #ICO's &amp; even #Cryprokitties haha 
2076,201712,ToneVays,2017-12-12 12:43:52+00:00,9,48,#Bitcoin #Bitcoin #SEC #ICO #ETF,"#Bitcoin Morning Brief w/ @jimmysong - #SEC vs #ICO, @BitGo get's Paid, Everyone wants to create an #ETF &amp; if $BTC Mining a Waste? As for the price - $BTCUSD ran into a Daily &amp; a 4hr 9 SELL, Now What?"
2077,201712,ToneVays,2017-12-12 00:42:54+00:00,17,92,#LaBITConf2017 #Bitcoin #Bitcoin #Blockchian,"Hey guys, check out this recent interview I did with Arcane Bear at #LaBITConf2017 @laBITconf about #Bitcoin #Blockchian $BTCUSD and @CMEGroup Futures:"
2078,201712,ToneVays,2017-12-12 00:01:16+00:00,67,305,#BTCUSD #Bitcoin #Bitcoin #HODL,"Been meaning to tweet this 9/13 on 4hr #BTCUSD chart all day. Normally a 1-4 Candle drop then higher but #Bitcoin Daily chart will hit a 9 Sell tomorrow so another potential top. However, Weekly is now bullish + Daily Double top / Breakout at ATH points higher. Bottomline: #HODL"
2079,201712,ToneVays,2017-12-11 23:31:00+00:00,3,33,#Bitcoin #Bitcoin,Welcome to #Bitcoin. Roger was promised infinitely small and free transactions and that aint workin gout either.
2080,201712,ToneVays,2017-12-11 14:06:22+00:00,19,111,#Bitcoin #Bitcoin #Bolgaria #Bitcoin #Bitcoin,"#Bitcoin Morning Brief w/ @jimmysong - $BTC on @nbcsnl, #Bolgaria gets Rich, Welcome to #Bitcoin @CBOE haha, is @JihanWu now pro @bitcoincoreorg &amp; is $BTCUSD Price at a Double Top?"
2081,201712,ToneVays,2017-12-10 21:22:53+00:00,1,54,#Bitcoin #Bitcoin #Toronto,"finally a day to chill :)... bathhouse, drinks, good food... and of course good #Bitcoin company... what more can one want on cold day in #Toronto w/ @petertoddbtc"
2082,201712,ToneVays,2017-12-10 15:00:33+00:00,24,79,#Bitcoin #Bitcoin,"LIVE to talk Trading #Bitcoin. Latest on @CMEGroup &amp; their Leverage. Has $BTCUSD price topped or is this just another pullback to ""Buy The Dip""."
2083,201712,ToneVays,2017-12-09 13:10:17+00:00,20,66,#Bitcoin #Bitcoin,"#Bitcoin Morning Brief w/ @jimmysong - @OPENDIME HW Wallet, @Bitfinexed lawyers up, is the Scaling Debate Finally Over &amp; $BTCUSD Price."
2084,201712,ToneVays,2017-12-08 15:31:50+00:00,37,120,#Bitcoin #Bitcoin #Blockchain #Impact,"""If you do NOT plan your estate before you depart, it will be the State that gets your assets & YES that includes your #Bitcoin. Unless you are banking on Immortality, you better get to planning"" -@pamelawjd at #Blockchain #Impact conf"
2085,201712,ToneVays,2017-12-08 14:53:53+00:00,8,51,#BlockchainImpact #Toronto #Canada #Bitcoin #Bitcoin #Blockchain,The #BlockchainImpact Conf in #Toronto #Canada has kicked off with @EdmundCMoy key note followed by @petertoddbtc talking Open Timestamps on #Bitcoin #Blockchain.
2086,201712,ToneVays,2017-12-08 14:45:58+00:00,10,101,#Scamming #Fake #Bitcoin #Bitcoin #BCash #BTrash,One of my best / most proud of trades :).... so happy I did not profit from #Scamming nubes by selling them expensive #Fake #Bitcoin (aka #BCash/#BTrash)
2087,201712,ToneVays,2017-12-08 14:23:54+00:00,7,58,#StPetersburg #Russia #Bitcoin #Bitcoin #Blockchian #ICO #Crypto #Decentralization,"For those that have not seen it, please check out this interview I did w/ @Cointelegraph a few months ago in #StPetersburg #Russia about #Bitcoin, #Blockchian, #ICO &amp; all other things #Crypto &amp; #Decentralization:"
2088,201712,ToneVays,2017-12-08 13:00:09+00:00,10,51,#Bitcoin #Bitcoin #India,"#Bitcoin Morning Brief - to talk More Support for @aantonop, @NiceHashMining hack, @GoldmanSachs to clear $BTCUSD futures, #India Bank Bail-Ins &amp; is $BTC price correcting?"
2089,201712,ToneVays,2017-12-08 11:33:40+00:00,0,3,,"yeah http://Blockchain.info is one of the worst wallets. its right up there Coinbase as wallets never to use, i stopped using them in 2014. it did not get any better"
2090,201712,ToneVays,2017-12-08 04:27:46+00:00,0,2,#SegWit,"you will just have to wait, a lot of people using it right now. I am now using @GreenAddress, its #SegWit so it helps and you can bump the fee up."
2091,201712,ToneVays,2017-12-07 23:51:08+00:00,0,1,,"haha, for 3 days in early Jan... then don't know."
2092,201712,ToneVays,2017-12-07 23:46:49+00:00,0,2,,I'm only 2-3 days behind on email. so If I did not reply: A. I just missed it or it went to Spam B. I read it and didn't care to reply (these are usually ICO Pitches) Re-Send I guess.
2093,201712,ToneVays,2017-12-07 22:42:02+00:00,1,3,,I'm ready :)
2094,201712,ToneVays,2017-12-07 21:54:35+00:00,1,47,#Bogota #BumperCars #Labitconf2017 #Colombia #Toronto #Canada #Bitcoin #Bitcoin,"So #Bogota OR #BumperCars at an Amusement Park! Good Bye #Labitconf2017 #Colombia, off to #Toronto #Canada to talk more #Bitcoin w/ @SunnyStartups &amp; the $BTCUSD seminar :)"
2095,201712,ToneVays,2017-12-07 21:21:22+00:00,71,283,#HODL #Bitcoin #Bitcoin,I'm prob the last to find out but just saw #HODL defined in the @urbandictionary Awesome :)... #Bitcoin. 
2096,201712,ToneVays,2017-12-07 20:53:42+00:00,0,2,#Bitcoin #Bitcoin,I have always mined #Bitcoin on @slush_pool ... @slushcz
2097,201712,ToneVays,2017-12-07 20:29:54+00:00,0,2,#Bitcoin #Bitcoin,The miner I have is from @canaanio but looks like they are sold out. It has more than paid for itself already and it took me a month to get it up and running. of course the #Bitcoin price rise helped :) https://canaan.io/product/avalonminer-741/
2098,201712,ToneVays,2017-12-07 17:40:42+00:00,1,39,#Bitcoin #Bitcoin,"yeah, it's totally broken, NO ONE wants #Bitcoin. ""Nobody goes there anymore. It's too crowded"" - Yogi Berra"
2099,201712,ToneVays,2017-12-07 16:56:01+00:00,23,134,#ICO #Securties #Money #Bitcoin #Bitcoin #Currency,"You just don't get it, do you? #ICO = Centralized schemes (#Securties or Printing U'r Own #Money) to separate unqualified investors from their $$$or $BTC to fund u'r bullshit dream #Bitcoin = A new Decentralized asset class that can be used as #Currency that Gov't fears!"
2100,201712,ToneVays,2017-12-07 15:44:01+00:00,0,1,#Bitcoin #Bitcoin,"yeah, it's totally broken, NO ONE wants #Bitcoin. ""Nobody goes there anymore. It's too crowded"" - Yogi Berra"
2101,201712,ToneVays,2017-12-07 14:03:36+00:00,9,46,#Bitcoin #Bitcoin,"Going Live to talk #Bitcoin Futures w/ @UglyOldGoat1, It all starts w/ the basics, why do they exists, how will $USDBTC ones from @CMEGroup &amp; @CBOE be different?"
2102,201712,ToneVays,2017-12-07 12:45:56+00:00,20,92,#Bitcoin #Bitcoin #LightningNetwork,"#Bitcoin Morning Brief w/ @jimmysong to talk Support for @aantonop, Criminalizing Concealed $BTC, #LightningNetwork. Will $BTCUSD ever correct again?"
2103,201712,ToneVays,2017-12-07 00:49:57+00:00,0,0,,I could not fined the trading view app on Android
2104,201712,ToneVays,2017-12-06 23:18:40+00:00,4,66,#Colombia #Bitcoin #Bitcoin,"Just a reminder that i will have very limited internet presence till I'm able to once again turn on my laptop, or buy a new one. Leaving #Colombia Tomorrow to speak at an All Day #Bitcoin event in Toronto Friday, then my Full Day $BTCUSD Trading seminar Saturday"
2105,201712,ToneVays,2017-12-06 21:03:16+00:00,14,56,#LabitConf2017 #ICO #Bitcoin #Bitcoin #LaBitConf,"My #LabitConf2017 presentation can be watched here, it was about the Inevitable #ICO bubble leaking #Bitcoin King. Starts around 1:48:30 but the workshop before me was all about building ICO's. #LaBitConf Sout out @RodolfoBits organizer of @laBITconf"
2106,201712,ToneVays,2017-12-06 13:08:45+00:00,3,22,#Bitcoin #Bitcoin,"there was 0 #Bitcoin on the computer which is about 4 months old and prob because of that i never made a back up of anything in it... so if SSD is shot, it would still really suck."
2107,201712,ToneVays,2017-12-06 12:33:12+00:00,4,51,#Bitcoin #Bitcoin,"Hey guys, it look like my Laptop is dead due to ""2100: Detection error on Storage Device (M.2)โ Please watch on #Bitcoin Morning Brief on @jimmysong channel."
2108,201712,ToneVays,2017-12-06 05:37:38+00:00,11,314,#Bogota #Colombia #LaBitComf2017 #Bitcoin #Bitcoin #LaBitConf,"In #Bogota #Colombia for #LaBitComf2017 to celebrate $BTCUSD breaking $12,000 Oh Yea ---&gt; #Bitcoin Life is the Sh*t w/ @MissBriannaM &amp; @Melissa_Aquinn #LaBitConf @laBITconf"
2109,201712,ToneVays,2017-12-06 02:20:39+00:00,0,3,#Bitcoin #Bitcoin,welcome to #Bitcoin
2110,201712,ToneVays,2017-12-06 02:12:12+00:00,1,56,#Labitconf2017 #bitcoin #bitcoin #Bogota #Colombia #LaBitConf,Can't wait to actually get to the Party and START Drinking! #Labitconf2017 #bitcoin #Bogota #Colombia #LaBitConf @laBITconf
2111,201712,ToneVays,2017-12-06 00:39:54+00:00,2,29,#Bitcoin #Bitcoin #LaBitConf #LaBitConf2017,Uno Mas! #Bitcoin #LaBitConf #LaBitConf2017 @laBITconf
2112,201712,ToneVays,2017-12-06 00:30:23+00:00,4,72,#Labitconf2017 #LaBitConf2018 #Bitcoin #Bitcoin #LaBitConf,"So another great #Labitconf2017 is coming to a close, had a great time, see you all at #LaBitConf2018 to take #Bitcoin to a greater level! @laBITconf #LaBitConf"
2113,201712,ToneVays,2017-12-05 15:12:16+00:00,34,226,#Bogota #Colombia #ICO #Bitcoin #Bitcoin #Labitconf2017 #Labitconf,About to go on stage at @laBITconf #Bogota #Colombia to talk #ICO bubble &amp; why #Bitcoin will rule them all #Labitconf2017 #Labitconf
2114,201712,ToneVays,2017-12-05 12:50:32+00:00,0,1,#Bitcoin #Bitcoin,They Can't so there needs to be a default and if I was in that situation and why Gov't is trying to ban stealth holding of #Bitcoin.
