,period,username,date,retweets,favorites,hashtags,text
2775,201712,adam3us,2017-10-05 23:07:32+00:00,0,2,,"it's the same as BTU they had to show BTC-B2X and B2X, so they could not call BTC-B2X bitcoin."
2776,201712,adam3us,2017-10-05 22:52:06+00:00,8,82,,yay. do we get you back on bitcoin core full time? (timestamps being fun and all... but Bitcoin!) 
2777,201712,adam3us,2017-10-05 20:30:32+00:00,0,1,,"identity is also weak: identity theft in banking, govt id at root. key as principal is the bitcoin paradigm, robust vs identity is principal"
2778,201712,adam3us,2017-10-05 17:14:47+00:00,0,1,,"or an s-curve, in this or... maybe s-curve in both (segwit adoption & bitcoin moon:)"
2779,201712,adam3us,2017-10-05 12:43:27+00:00,0,1,,"competition is government fiat & banks, need scale for adoption, but adoption needs to be actual Bitcoin not centralCoin. that's status quo."
2780,201712,adam3us,2017-10-05 12:37:06+00:00,0,2,,barely warmed up yet. Bitcoin will prevail &amp; power through the storm. think how strong Bitcoin will be after contentious fork card is spent.
2781,201712,adam3us,2017-10-05 11:12:56+00:00,5,32,,"comes back to again: what does Bitcoin stand for, what is the point of it? cheap centralised payments, or uncensorable permissionless ecash?"
2782,201712,adam3us,2017-10-05 11:00:36+00:00,1,3,,"reasserting: people who want to corporate takeover Bitcoin are the enemies of Bitcoin ethos, ie of a meaningful future. that is anti-Bitcoin"
2783,201712,adam3us,2017-10-05 10:58:46+00:00,1,5,,"Bitcoin believers, users &amp; investors will hold the line on Bitcoin ethos. no ethos, no censor-resistance, no permissionlessness- centralised"
2784,201712,adam3us,2017-10-05 00:09:04+00:00,0,3,,ironic as i think they're bitcoin whales and were just naturally very concerned about their investments in the face of contentious forks.
2785,201712,adam3us,2017-10-05 00:06:00+00:00,0,2,,"dont think meant that, crossed communication some hodlers confronted & he mistakenly thought they were from a co. they're Bitcoin customers!"
2786,201712,adam3us,2017-10-04 20:21:55+00:00,2,27,,"I guess it's like China can't ban Bitcoin again when you finally did it. fork, spend reputation. businesses welcome to come back, of course. "
2787,201712,adam3us,2017-10-04 14:47:18+00:00,1,31,,"See I can do that too ;) Doesn't help. Focus on integrating SW & LN. Cancel segwit2x. Avoid drama, Bitcoin brand damage, for no cost benefit"
2788,201712,adam3us,2017-10-04 14:19:14+00:00,1,26,,"it is not detracting from @blockchain &amp; other companies great work in popularising Bitcoin to date, to call a spade a spade."
2789,201712,adam3us,2017-10-04 14:17:22+00:00,1,23,,"can not expect those who value Bitcoin's potential for the world to leave that comment. maybe you didn't view it that way, but such it is."
2790,201712,adam3us,2017-10-04 14:15:23+00:00,13,96,,"trying to pivot Bitcoin tech from open, decentralised &amp; ethos preservation to centralised corporate group is a mistake of grand order."
2791,201712,adam3us,2017-10-04 14:11:49+00:00,16,88,,is Bitcoin's value cheap payments or permissionless uncensorable money? my bet is on the latter &amp; so we should scale while preserving value.
2792,201712,adam3us,2017-10-04 13:57:15+00:00,2,24,,"whether you mean well is not the point, the damage to Bitcoin is real, and the cost benefit makes limited sense to anyone I've talked with."
2793,201712,adam3us,2017-10-04 13:53:38+00:00,4,20,,".@OneMorePeter nice to see you join the convo. that was a bit out of context, but I do sincerely think SegWit2x is biggest risk to Bitcoin."
2794,201712,adam3us,2017-10-04 08:43:34+00:00,0,5,,I am centrally opposed to BizCoin2x to defend Bitcoin ethos - a Bitcoin where a few CEOs in a hotel room dictate change is not Bitcoin.
2795,201712,adam3us,2017-10-04 08:41:11+00:00,4,13,,"blockstream owns Bitcoin too &amp; all employees at blockstream. bizcoin2x is a destruction of Bitcoin value, including ours &amp; shareholders."
2796,201712,adam3us,2017-10-04 08:27:22+00:00,3,29,,"I argue that there are critical risks to centralising control of Bitcoin around a few CEOs in a hotel room, and ignoring users &amp; ecosystem."
2797,201712,adam3us,2017-10-04 08:05:30+00:00,0,6,,I believe it's a significant factor in why Bitcoin wins over BizCoin2x. Hodlers have conviction in their beliefs. Cue your pragmatist quote.
2798,201712,adam3us,2017-10-04 01:39:27+00:00,0,17,,"consequently, in fact contrary to what you said, exchanes will continue to follow Bitcoin (and to follow some spinoffs) node software."
2799,201712,adam3us,2017-10-04 01:38:02+00:00,16,90,,"no exchange is going to delete bitcoin listing and replace it with segwit2x, they will list Bitcoin and Bizcoin separately, rest is market."
2800,201712,adam3us,2017-10-04 00:31:20+00:00,2,23,,exchanges are going to list both tokens. one with 1 dev and controlled by a few CEOs: bizcoin2x. and Bitcoin. i'm doubling down on Bitcoin.
2801,201712,adam3us,2017-10-04 00:26:18+00:00,0,0,,"it is critical for Bitcoin's censor-resistant, permissionless value proposition that enough people run economic fullnodes."
2802,201712,adam3us,2017-10-04 00:18:28+00:00,0,3,,"the Bitcoin ecosystem is overly nice because it's a community mission rising tide raises all ships, where the competition is fiat &amp; bank."
2803,201712,adam3us,2017-10-03 23:52:37+00:00,3,28,,"people are giving you feedback on *bad ideas*, you are rejecting peer review, and creating massive ethos, brand & market damage to Bitcoin."
2804,201712,adam3us,2017-10-03 15:09:17+00:00,90,307,,spot on @LukeDashjr. people who want to corporate take-over Bitcoin are anti-Bitcoin ethos and anti-Bitcoin; they are *enemies* of Bitcoin. 
2805,201712,adam3us,2017-10-02 00:16:21+00:00,10,74,,I honestly think some people have lost track of what Bitcoin is.
2806,201712,adam3us,2017-10-02 00:07:51+00:00,5,29,,"for the future, an activist & informed user base defends bitcoin ethos. users absolutely need to be able to say no, mean it &amp; make it stick."
2807,201712,adam3us,2017-10-02 00:06:11+00:00,3,30,,"brinkmanship is not ideal. but if pushed too far against ethos at some point users need to hodl the line, or Bitcoin does not mean a damn."
2808,201712,adam3us,2017-10-01 23:54:10+00:00,0,2,,"and if they do not, ie if they mine something else, Bitcoin is still Bitcoin. there are many SHA256 altcoins. we do not call them Bitcoin."
2809,201712,adam3us,2017-10-01 23:53:06+00:00,0,2,,"if miners make proofs of work on cat pictures, bitcoin is still not a cat. people are hiring miners to secure Bitcoin, they can do it or not"
2810,201712,adam3us,2017-10-01 23:50:43+00:00,0,3,,it is probably a net loss to Bitcoin Cash and segwit2x/Bizcoin that they do not join. divide and conquer makes them both weaker for Bitcoin.
2811,201712,adam3us,2017-10-01 23:46:55+00:00,1,28,,"which makes sense as polls show 75:25 for Bitcoin against Segwit2x/bizcoin, and I would expect that ratio higher by Bitcoin weighting."
2812,201712,adam3us,2017-10-01 23:45:29+00:00,1,14,,in the bitcoin cash/bcash case it was the new chain that had low hashrate. as you may have noticed having trouble getting people to swap 1:1
2813,201712,adam3us,2017-10-01 23:37:44+00:00,0,22,,"well ok then. you are confusing people as to what you mean by saying ""bitcoin is the majority hashrate"" as if hashrate decides protocol then"
2814,201712,adam3us,2017-10-01 23:36:28+00:00,2,25,,"if a miner doesnt mine the Bitcoin that user nodes run, they arent mining: hashrate falls, other miners become more profitable and that's it"
2815,201712,adam3us,2017-10-01 23:32:03+00:00,11,61,,"this ""Bitcoin is whatever hashrate does"" is not ideology, that's an economic fallacy re labour theory of value. hashrate *follows* value."
2816,201712,adam3us,2017-10-01 23:29:07+00:00,3,35,,"@VinnyLingham that's not correct Bitcoin is not ""majority hashrate"". see this article by @el33th4xor"
2817,201712,adam3us,2017-10-01 23:26:24+00:00,4,16,,"unprofitable mining hurts that miner, it doesnt change Bitcoin. if you're not mining the Bitcoin users nodes are running, you're not mining."
2818,201712,adam3us,2017-10-01 23:15:10+00:00,0,30,,"even if 75% of miners decided to burn money making proofs of work on cat pictures, Bitcoin would keep going fine as difficulty adjusts."
2819,201712,adam3us,2017-10-01 15:43:41+00:00,39,205,,after a year when both BCH and B2X @rogerkver can give bitcoin domain to @TraceMayer to use for bitcoin positive content. deal? 
2820,201712,adam3us,2017-09-30 21:42:10+00:00,0,3,,"self-sovereignty takes some getting used to. not everyone is a coder, so influence pyramids are normal but immature and improving in bitcoin"
2821,201712,adam3us,2017-09-30 21:05:10+00:00,0,2,,IETF consensus process is not new to Bitcoin. technical consensus is described eg https://lists.linuxfoundation.org/pipermail/bitcoin-dev/2015-October/011457.html and
2822,201712,adam3us,2017-09-30 20:25:12+00:00,17,55,,"great find @TuurDemeester ""Bitcoin Classic Hard Fork Likely to Activate at 71% Hashrate Support"", just a few contentious hard-forks ago :) "
2823,201712,adam3us,2017-09-30 20:13:25+00:00,0,4,,well there is on Bitcoin side. but seemingly not on the bizCoin/segwit2x side so far. that's useful market information I think.
2824,201712,adam3us,2017-09-30 20:08:36+00:00,0,4,,eg segwit was worked on by people from 3 or 4 different bitcoin implementations. BIP1 itself was written by @AmirPolyteknik who's libbitcoin
2825,201712,adam3us,2017-09-30 15:54:20+00:00,1,26,,I feel it would be better for Bitcoin if you and Roger went all in and sold. Are you saying you do not actually have conviction?
2826,201712,adam3us,2017-09-30 15:31:30+00:00,0,4,,this time we need atomic swap and k of n escrow to guarantee transaction completion.
2827,201712,adam3us,2017-09-30 15:29:33+00:00,20,92,,I will join a group buy organised by gmax. I hope you follow through and allow us to completely buy both you and @rogerkver out of Bitcoin.
2828,201712,adam3us,2017-09-30 15:26:13+00:00,0,0,,"yes preserving privacy is a good idea, for safety also. confidential transactions help: send 0.01 btc from XXX btc output with value privacy"
2829,201712,adam3us,2017-09-30 14:11:56+00:00,0,3,,right that's why I said auditor - they can look at the coins and tell us anonymized stats. atomic contract can be pooled and batched.
2830,201712,adam3us,2017-09-30 13:56:19+00:00,0,8,,need an auditor to show it's 25% or more of yours and his coins or you're just posturing.
2831,201712,adam3us,2017-09-30 13:56:00+00:00,0,5,,"it's easy to be ""look at me I have conviction"" and then toss out 250 BTC, that's not even 1% of Roger's coins."
2832,201712,adam3us,2017-09-30 13:54:33+00:00,0,1,,that's 1000 BTC which is not conviction at all. you said 100k...
2833,201712,adam3us,2017-09-30 13:52:51+00:00,1,7,,you should yes. gmax is organising. are you all in bcash or bizcoin/segwit2x? you'll have to decide now :)
2834,201712,adam3us,2017-09-30 13:48:47+00:00,0,5,,citation / URL for 100k BTC link for @rogerkver ?
2835,201712,adam3us,2017-09-30 13:39:43+00:00,2,16,,"I suspect they won't in fact, as they lack conviction. waiting to see if @rogerkver puts up 25k BTC swap."
2836,201712,adam3us,2017-09-30 12:45:18+00:00,7,33,,"good to see @woonomic in Forbes, bring on the actual Bitcoin experience! "
2837,201712,adam3us,2017-09-30 12:44:06+00:00,4,41,,"wait he was on stage a few days ago saying BCH was ""the real Bitcoin"" what is it now B2X bizcoin?"
2838,201712,adam3us,2017-09-30 12:39:43+00:00,44,178,,not meaningful unless @rogerkver puts up at least 25k BTC. anything lower is posture. we'll bring the bitcoin. gmax offers to do atomic swap
2839,201712,adam3us,2017-09-30 12:31:35+00:00,15,82,,"gmax was representing too many Bitcoin &amp; Roger chickened out. come on @rogerkver it's weak to do a 1% bet, where is your conviction!"
2840,201712,adam3us,2017-09-30 12:11:37+00:00,0,2,,yes but pointless- custody based bitcoin banks exist today and you can make federated ones too. better as bitcoin is still the secure base.
2841,201712,adam3us,2017-09-30 02:23:37+00:00,1,8,,"not ""core"", it's bitcoin developers &amp; researchers generally BIPs are worked on and testedd by multiple implementations. already did: segwit."
2842,201712,adam3us,2017-09-30 01:53:32+00:00,45,129,,"not a new phenomena- p2p wins over centralised. bittorrent vs napster, bitcoin vs digicash, skype vs telco, next bitcoin vs bizcoin/segwit2x "
2843,201712,adam3us,2017-09-29 16:49:33+00:00,15,151,,"regardless @jgarzik why are you so hostile? it's 100% clear that Bitcoin will continue, so do not attack Bitcoiners. live and let live."
2844,201712,adam3us,2017-09-29 16:28:25+00:00,18,183,,"you're all posture. Bitcoin value is 90% digital gold thesis &amp; censor resistant payments, permissionlessness. which corp-bizcoin will lose."
2845,201712,adam3us,2017-09-28 22:26:26+00:00,13,58,,"and they can go make that mistake if they prefer to learn the hard way, but they will not make it with Bitcoin. Bitcoin will remain Bitcoin. "
2846,201712,adam3us,2017-09-28 22:24:53+00:00,0,18,,feel free to connect offline to discuss with NYA & non-NYA people to appreciate why splitting bitcoin in two is unnecessary brand damage.
2847,201712,adam3us,2017-09-28 22:23:31+00:00,2,17,,explained why in more detail here https://www.reddit.com/r/Bitcoin/comments/72ryef/it_is_time_to_call_off_nyasegwit2x_and_work/ you really do NOT want control or you create risk for Bitcoin regardless of intent
2848,201712,adam3us,2017-09-28 22:13:10+00:00,0,1,,"BIPs are worked on by researchers, devs & reviewers from a number of projects including bitcoin core that is most of ""bitcoin dev community"""
2849,201712,adam3us,2017-09-28 20:03:14+00:00,0,1,,"would be $1,000,000 as there are 100 million Satoshis ber Bitcoin. (so 1 satoshi = 1c in your example)"
2850,201712,adam3us,2017-09-28 19:59:18+00:00,0,21,,no matter as bizcoin will fast become paypal2.0 and lose differentiating value. if that is what you want use a bitcoin bank account today.
2851,201712,adam3us,2017-09-28 17:20:35+00:00,0,8,,"probably a good way to increase your bitcoin holdings at the expense of people who have a weak investment thesis even (BTC vs BCH, now B2X)"
2852,201712,adam3us,2017-09-28 14:43:28+00:00,15,34,,interesting Bitcoin fee idea for analysis. 
2853,201712,adam3us,2017-09-28 14:16:12+00:00,0,4,,"on bitfinex they list it as BCH because BCC is taken, and they call it Bcash to avoid novice users confusing with Bitcoin. seems fair."
2854,201712,adam3us,2017-09-28 14:14:33+00:00,0,4,,what do you think are good priorities for a $70bil Bitcoin? that is significantly used for store of value plus uncensorable transactions
2855,201712,adam3us,2017-09-28 14:12:01+00:00,0,21,,you can call it bitcoin cash if you prefer. maybe you can take @jgarzik too. looks like you need developers.
2856,201712,adam3us,2017-09-28 11:37:47+00:00,22,85,,"There is just no world where anyone will acquiesce to Bitcoin being taken over by Garzak and a few CEOs. Think again, honey bagger says no."
2857,201712,adam3us,2017-09-28 10:42:34+00:00,7,26,,"naive @jgarzik law enforcement agents Blockchain Alliance exists to liaise will ""request"" you add blacklists to segwit2x ""bitcoin""?"
2858,201712,adam3us,2017-09-28 00:33:12+00:00,0,7,,curious that the people who are attacking bitcoin via spam attack are doing so with wealth from bitcoin. takes a perverse mind to do that.
2859,201712,adam3us,2017-09-28 00:32:06+00:00,0,5,,"the other solution might be if they *like* their bcash chain, and just content themselves to use it without attacking Bitcoin."
2860,201712,adam3us,2017-09-28 00:23:16+00:00,0,1,,"no? a defensive, free to use patent conveys no economic value by design. you do know that most bitcoin cos have patents and non defensively?"
2861,201712,adam3us,2017-09-28 00:08:30+00:00,0,1,,there are ways to build medium security chains that are more centralised - like bcash - but ontop of bitcoin. if anyone is interested...
2862,201712,adam3us,2017-09-28 00:06:45+00:00,0,1,,"there are many things that to do, first bottleneck is better lines of communication between developers & people operating bitcoin services."
2863,201712,adam3us,2017-09-27 23:57:56+00:00,0,1,,"that's nonsense. you'd have to be living under a rock to not be aware of XT, classic, BU, BCH, B2X, Bitcoin GPU &amp; whatever others i forgot."
2864,201712,adam3us,2017-09-27 22:20:43+00:00,1,12,,"rushedd HF proponents are actually chasing 32MB then moving to GBs, but started small for political expediency. same with bitcoin classic."
2865,201712,adam3us,2017-09-27 19:36:34+00:00,1,8,,I think Bitcoin is un-cooptable. users can keep selling spinoffs and buy more bitcoin - if you run a fullnode you have financial sovereignty
2866,201712,adam3us,2017-09-27 12:38:41+00:00,5,18,,"an actual account from someone who joined bitcoin. if you think you're a real programmer, see if you can cut it. "
2867,201712,adam3us,2017-09-27 12:36:35+00:00,216,553,,It is time to call off NYA/segwit2x and work together to scale Bitcoin to compete against Fiat. Please. 
2868,201712,adam3us,2017-09-27 12:31:34+00:00,1,11,,"you're making stuff up. people are talking with voices right now on bitcoin github, IRC it's very welcoming. do not throw falsehoods."
2869,201712,adam3us,2017-09-27 02:29:54+00:00,1,16,,"no development is quite decentralised, it is just that developers are self-selecting and believe in the ethos and meaning of Bitcoin."
2870,201712,adam3us,2017-09-26 16:01:30+00:00,0,1,,nodes run the consensus rules that define bitcoin. miners confirm transactions and provide security. only valid blocks following rules count
2871,201712,adam3us,2017-09-26 15:55:27+00:00,0,1,,"and not within anyone's moral authority. changes to bitcoin need widespread consensus from the ecosystem of users, tech community &amp; services"
2872,201712,adam3us,2017-09-26 12:39:15+00:00,63,206,,the other elephant here is there is no way 12 guys in a hotel suite can redefine bitcoin. that just can not happen or Bitcoin isnt Bitcoin. 
2873,201712,adam3us,2017-09-25 00:25:46+00:00,2,26,,"Thanks for that, truly Eric. Feels like bitcoin computer science faces a barrage of moon landing-denial conspiracy https://www.youtube.com/watch?v=DpPMoIv1lxI"
2874,201712,adam3us,2017-09-24 01:43:08+00:00,0,0,,"the non-human bitcoin fullnodes, however they will not be confused at all :) they will reject &amp; ignore forks. run a fullnode and trust it!"
2875,201712,adam3us,2017-09-24 01:40:40+00:00,0,0,,"there's enough correlation between understanding Bitcoin ethos and GINI ranking that B2X will mostly confuse retail, new and novice users."
2876,201712,adam3us,2017-09-24 01:07:35+00:00,0,0,,"it's not clear to me he's arguing for Bcash nor B2X, he just wants there to be one Bitcoin chain. Don't see how to do that without coercion."
2877,201712,adam3us,2017-09-23 22:10:30+00:00,4,8,,off-chain does not change the number of units. they are just delayed and netted *real* bitcoin transactions that can be posted on chain...
2878,201712,adam3us,2017-09-23 17:59:38+00:00,0,1,,"so if I get you, you think Bitcoin experts should decisively destroy spin-offs. probably they could do that. but should they? i think not."
2879,201712,adam3us,2017-09-23 17:54:04+00:00,0,0,,"Bitcoin can defend itself fine, without unethical steps. you're calling for blockchain sabotage wars."
2880,201712,adam3us,2017-09-23 17:39:07+00:00,0,1,,I would think even just the bitcoin holders at the @breakingbitcoin conference would be enough to hold stable price &amp; mining.
2881,201712,adam3us,2017-09-23 11:49:03+00:00,12,41,,Using Indian rupee as an example is very ironic given 4hour notice ban of 1000INR note being the primary driver of bitcoin adoption surge.
2882,201712,adam3us,2017-09-21 12:38:38+00:00,5,13,,I said what I wanted to say about scale which still seems mostly current https://www.youtube.com/watch?v=HEZAlNBJjA0&amp;t=1h0s tech improves over time &amp; Bitcoin adopts.
2883,201712,adam3us,2017-09-21 11:46:01+00:00,24,80,,"Even with good intention, Bitcoin's future potential &amp; value is destroyed if closed hotel room meeting of 12 guys can force a change &amp; bully"
2884,201712,adam3us,2017-09-21 11:40:07+00:00,1,19,,"Considering Bitcoin hodlers, investors it's just implausible - people buy permissionless ethos &amp; counter-cyclical hedge on that future."
2885,201712,adam3us,2017-09-21 11:06:40+00:00,7,24,,"but hypothetical closure, even half of miners turning off doesn't affect bitcoin - difficulty falls and bitcoin continues unaffected."
2886,201712,adam3us,2017-09-21 10:58:10+00:00,70,228,,"notice a trend? bitcoin devs &amp; experts improve scalability properties, non-coders argue block-size+++ no problem (due to experts work) "
2887,201712,adam3us,2017-09-20 19:13:25+00:00,0,3,,"anti-fragility is automagic to some folks understanding. there's a t-shirt that says ""I am anti-fragility"" from one of the Bitcoin dev confs"
2888,201712,adam3us,2017-09-20 10:44:39+00:00,13,52,,"bear in mind for context, a bitcoin company with FOSS software, high technical risk, and no developers is a brick..."
2889,201712,adam3us,2017-09-19 12:15:53+00:00,125,242,,how realistic is hyperbitcoinization? https://www.reddit.com/r/Bitcoin/comments/712f07/how_realistic_is_hyperbitoinization/ some statistics and thoughts. bitcoin is already &gt;1% of global physical cash.
2890,201712,adam3us,2017-09-19 10:42:44+00:00,6,22,,or 300x rarer & price $410k/bitcoin if we used next halving in 1000 days https://www.reddit.com/r/Bitcoin/comments/70z6p0/if_you_do_the_math_a_single_btc_is_more_than_200/dn7ikck/ prices vary &amp; gold quantity not fully known
2891,201712,adam3us,2017-09-18 12:38:53+00:00,7,45,,enough politicking - man up to your mistakes. complete disdain for the central thesis of bitcoin decentralisation and value proposition.
2892,201712,adam3us,2017-09-18 10:16:12+00:00,1,7,,maybe some lessons for Bitcoin pretenders in that @nntaleb quote. people are way too discreet in not calling a con a con.
2893,201712,adam3us,2017-09-18 09:06:41+00:00,12,57,,"Bitcoin nodes define most-work valid chain, for fundamental reasons. It's a structural and technical mistake for custodians to do otherwise."
2894,201712,adam3us,2017-09-18 08:59:08+00:00,0,2,,.@notgrubles bitcoin @blockstream satellite setup guide in 3 parts.
2895,201712,adam3us,2017-09-17 11:15:37+00:00,31,125,,"made a new reddit thread https://www.reddit.com/r/Bitcoin/comments/70mwnk/dont_sell_more_bitcoin_than_you_can_afford_to/ ""don't sell more bitcoin than you can afford to lose. some thoughts on HODLing strategy"""
2896,201712,adam3us,2017-09-17 10:25:46+00:00,0,1,,maybe the 3rd dimension of blocks is the layer1.5 volume they support :)
2897,201712,adam3us,2017-09-17 09:14:58+00:00,3,22,,Sometimes in Bitcoin the UFOlogists get way too much attention. It's due to influence pyramid immaturity &amp; tech understanding still building
2898,201712,adam3us,2017-09-16 20:36:57+00:00,0,5,,i think we should just cancel 2x. enough other things to do and scale bitcoin without more silly distractions &amp; another spinoff coin.
2899,201712,adam3us,2017-09-16 14:22:38+00:00,0,2,,"Bitcoiners continue to try, to bring them back to bitcoin's roots"
2900,201712,adam3us,2017-09-16 12:37:54+00:00,63,204,,"point is that bitcoin is designed to be robust via modest bandwidth so it is easy to keep running, even in the face of attempted censorship."
2901,201712,adam3us,2017-09-16 11:49:38+00:00,4,31,,"you've got to wonder what they will be calling ""real bitcoin"" if the remaining NYA proponents, if any, create a third fork in a few months!"
2902,201712,adam3us,2017-09-16 11:48:23+00:00,14,63,,"Jihan/Roger bought BCH & promoting as ""real bitcoin"" at conferences. NYA is no longer self-logical. forks require ecosystem consensus anyway"
2903,201712,adam3us,2017-09-16 07:35:14+00:00,16,40,#bitcoin #bitcoin,Great explainer about big #bitcoin 0.15 sync &amp; other performance gains from switch to per output storage strategy. 
2904,201712,adam3us,2017-09-15 14:39:07+00:00,0,1,,didnt say they did. bitcoin is digital gold. just explaining it's implausible that ether artificial fee token is used at scale in enterprise
2905,201712,adam3us,2017-09-15 14:23:09+00:00,3,17,,"early in bitcoin, I mused for 15seconds, huh i bet i could cash in reputation &amp; get rich w new altcoin. conscious said: no that's unethical."
2906,201712,adam3us,2017-09-15 14:06:24+00:00,0,16,,"so the ""bitcoin maximalist"" accusation rang hollow for most bitcoin protocol experts - they view it as an ethical line. that's where I'm at"
2907,201712,adam3us,2017-09-15 14:03:58+00:00,1,22,,another reflection is on why almost all bitcoin devs reject ICO/altcoin work on principle. they're more qualified &amp; could get rich quick /2
2908,201712,adam3us,2017-09-15 14:00:45+00:00,3,3,,the conservative crypto in bitcoin is safe for decades IMO &amp; can be soft-fork upgraded to PQ &amp; already quantum resistant for existing coins.
2909,201712,adam3us,2017-09-15 10:13:44+00:00,7,27,,โAn intro to Bitcoin Core [0.14] fee estimationโ by @jfnewbery https://bitcointechtalk.com/an-introduction-to-bitcoin-core-fee-estimation-27920880ad0 looking forward to the 0.15 fee estimator explainer.
2910,201712,VinnyLingham,2017-12-25 01:22:17+00:00,20,115,,Nor will it kill Bitcoin! 
2911,201712,VinnyLingham,2017-12-25 00:15:32+00:00,0,9,,Thatโs the token. Underlying platform is Bitcoin.
2912,201712,VinnyLingham,2017-12-25 00:11:45+00:00,62,323,,Should @Civickey move off Bitcoin and onto Bitcoin Cash as suggested by @bradmillscan? We would save a lot of money in fees and clearly not getting any credit from supporters like Brad for supporting Bitcoin... 
2913,201712,VinnyLingham,2017-12-24 23:54:31+00:00,0,1,,"I call it Bitcoin all the time, I was just specifically referring to the two forks in this particular tweet for posterity."
