,period,username,date,retweets,favorites,hashtags,text
1,201831,justinsuntron,2018-11-10 07:47:30+00:00,413,1160,#Ethereum #TRON #TRX #ETH,Don't think #Ethereum transaction volume will ever catch up to #TRON's again. @VitalikButerin #TRX $TRX #ETH
2,201831,justinsuntron,2018-11-04 01:45:46+00:00,940,1562,#TRON #ethereum #TRX,#TRON reached 990k transaction yesterday(11/02/2018). Almost 2x to that of #ethereum. Guess when TRON will reach 1M Tx per day? Guess&amp;RT. I will randomly pick 5 winner for 1k $TRX each! #TRX
3,201831,justinsuntron,2018-10-23 08:55:40+00:00,671,2775,#TRONICS #Ethereum #TRX,#TRONICS can check out Marcus's views on the delay in the upgrade of #Ethereum's Constantinople hard fork. #TRX $TRX
4,201831,justinsuntron,2018-10-20 10:37:32+00:00,747,1081,#TRON #ETH #TRX,"Ethereum has 82,418 Txs pending today. It is the second day that #TRON has surpassed #ETH in daily Txs. 10/18 #TRX 599,677 vs. ETH 565,971; 10/19 $TRX 630,018 vs. ETH 601,119. All ETH developers need to migrate to TRON immediately with 0 cost! http://Developers.tron.network"
5,201831,justinsuntron,2018-10-19 20:58:13+00:00,815,1357,#TRON #Ethereum #TRX #ETH,It is the first time that #TRON has surpassed #Ethereum in daily transaction. #TRX 599354 vs. #ETH 565791 in October 18th. It's just the beginning! $TRX
6,201831,justinsuntron,2018-10-11 06:41:17+00:00,249,364,#TRON #TRONVM #Ethereum #TRX,"Cryptocurrency which sets the tone -#TRON. #TRONVM, advantages over #Ethereum and “vulnerabilities” of the project – find it in the interview. #TRX $TRX"
7,201831,justinsuntron,2018-10-10 09:44:52+00:00,432,845,#TRON #Ethereum #EOS #TRX,"The new developing kit is an all-in-one tool. It’s free and open source. It marks the start of smart contracts that can run on #TRON Mainnet. They will be 200x faster than #Ethereum, 100x cheaper than #EOS. #TRX $TRX http://globalcoinreport.com/tron-trx-new-development-kit-smart-contracts-era-entry"
8,201831,justinsuntron,2018-09-11 03:03:26+00:00,201,542,#TRON #Ethereum #TRX,#TRON continues to grow at speed already at a third of #Ethereum’s transaction rate. #TRX $TRX
9,201831,VitalikButerin,2018-11-13 22:17:28+00:00,2,7,,We can do a proper futarchy on ethereum by doing conditional markets on ETH/DAI.
10,201831,VitalikButerin,2018-11-13 01:49:09+00:00,2,14,,"Cobra is capable of changing he's mind; he's done so on BCH, I hope he can come to appreciate ethereum too "
11,201831,VitalikButerin,2018-11-13 01:46:23+00:00,1,7,,This whole quantum computing episode was before ethereum even existed 
12,201831,VitalikButerin,2018-11-12 13:58:24+00:00,1,2,,"""Singapore decided""? That phrasing is incredibly misleading, many people could easily mistake that for this being a SG government-approved thing. It is clearly not."
13,201831,VitalikButerin,2018-11-09 13:54:47+00:00,1,4,,"> 2. available to all includes you, which would make it free for you and thus not very sybil limited, 1 trusted party Ethereum foundation, not me. EF is a nonprofit, can't take funds out for personal gain."
14,201831,VitalikButerin,2018-11-08 02:11:25+00:00,1,17,,Evan got no share of the ethereum premine.
15,201831,VitalikButerin,2018-11-07 10:49:26+00:00,1,4,,"Sure, but if they're so ""ethical"" why didn't they build the decentralized insurance app on ethereum classic, or some weird bitcoin sidechain contraption?"
16,201831,VitalikButerin,2018-11-07 10:47:21+00:00,28,157,,I feel like we need someone to explicitly do a survey of applications being built on ethereum by/for people in emerging economies (especially those closer to seeing actual users) and do a special track or section about them next year or sooner.
17,201831,VitalikButerin,2018-11-05 15:23:09+00:00,3,3,,"What's a recent example of an average user being scoffed away from ethereum governance on technical grounds? I mean, I'm sure the rate of that happening is nonzero because the ethereum community is made up of humans, but I'd like to understand what you're complaining about."
18,201831,VitalikButerin,2018-11-05 14:48:32+00:00,1,2,,"PoS is not a governance mechanism! It's not like coins are your congressmen, it's more like coins are the military."
19,201831,VitalikButerin,2018-11-05 14:35:41+00:00,2,2,,Yay! I love taxing congestible things!
20,201831,VitalikButerin,2018-11-05 14:29:45+00:00,1,1,,"Ooh! Didn't know about that book, taking a look now :)"
21,201831,VitalikButerin,2018-11-05 14:20:20+00:00,6,21,,"Our ideologies need to take these complexities into account. The ability to think game-theoretically about cooperation and conflict and everything in between is also I think one of the great strengths of the crypto space that could be applied to ""the neo-radical movement""."
22,201831,VitalikButerin,2018-11-05 14:18:00+00:00,1,15,,"Thomas Schelling's ""Strategy of Conflict"" is underrated imo in describing the complexities of mixed cooperation/competition particularly."
23,201831,VitalikButerin,2018-11-05 14:15:45+00:00,2,12,,"Saving us from ""returning to the 1930s"" is definitely something I care about! I also think the future will not be *exactly* like the past. The 21st century is a complex one, with powerful non-state actors, mixed cooperation/competition, growing possibilities in info warfare...."
24,201831,VitalikButerin,2018-11-05 14:01:16+00:00,6,17,,"Agree! Though I think it's *governance*, and not *consensus*, that is more important to keep non-plutocratic. The consensus layer (PoW/PoS) is like the military, governance is more like Congress/senate. Though still, non-plutocratic consensus *and* governance would be ideal."
25,201831,VitalikButerin,2018-11-05 13:50:01+00:00,3,10,,"To be fair, the only private property that's formalized by ethereum itself is ETH; everything else (and I hope that ""everything else"" slice eventually dominates) is purely a matter of user-chosen standards."
26,201831,VitalikButerin,2018-11-05 13:47:58+00:00,4,5,,"Also there is real technical work being done on ""formalizing people"" better. Aside from your own work, here's one cool recent example:"
27,201831,VitalikButerin,2018-11-05 13:46:07+00:00,8,36,,"I would argue that formalizing people *badly* can potentially lead to worse consequences than just leaving the area as a TODO stub. Totalitarian regimes ""formalize people"" all the time. CC @VladZamfir So good that we're approaching that subject slowly and carefully."
28,201831,VitalikButerin,2018-11-05 10:33:26+00:00,2,5,,This is a big part of why collusion-resistant voting mechanisms (eg. using multi-party computation) are very important. Need to make sure that you can't prove who you voted for.
29,201831,VitalikButerin,2018-11-02 07:17:11+00:00,10,69,,"Actually, the subheadline is fine. > At Ethereum’s annual developer conference, its founder tells us why his technology can only be truly decentralized if it stops depending on him. ""Ethereum stops depending on me"" is the correct emphasis. But very far away from me leaving."
30,201831,VitalikButerin,2018-10-25 20:07:49+00:00,1,12,,"Why do you want to put the entire block header into the ethereum chain? This seems completely unnecessary. All that you need is the Merkle root and the signature, what other data is there? I'm trying to help here; I think you can easily optimize by a factor of ~100"
31,201831,VitalikButerin,2018-10-25 20:02:21+00:00,1,4,,"Ethereum Foundation uses crypto to pay people in many countries; very convenient, especially for one-time payments (eg. security bounties)"
32,201831,VitalikButerin,2018-10-25 19:32:06+00:00,2,23,,"And one plasma block per ethereum block is totally unnecessary; one per minute is fine, or even less. You can even adjust the rate based on the gas price. So all in all your estimate was off by at least two orders of magnitude."
33,201831,VitalikButerin,2018-10-25 19:30:26+00:00,1,18,,Also how is ~20 blocks/min even possible? Ethereum's own block rate is 4 blocks/min.
34,201831,VitalikButerin,2018-10-15 18:47:20+00:00,4,12,,Try
35,201831,VitalikButerin,2018-10-15 14:14:07+00:00,2,9,,"But Bitcoin UTXOs are also immutable scripts, and they're clearly far less powerful than ethereum contracts."
36,201831,VitalikButerin,2018-10-15 02:20:46+00:00,8,22,,@benjaminion_xyz 's slides on ethereum 2.0: 
37,201831,VitalikButerin,2018-10-10 20:56:26+00:00,9,34,,"The Ethereum Foundation only ever owned ~3m, and now has ~660k; the rest was spent on development."
38,201831,VitalikButerin,2018-10-08 23:26:00+00:00,32,474,,"I don't think that's a fair characterization; if you look more deeply at the actual processes of ethereum governance you'll find that while a technical elite does exist (as in all cryptocurrencies), my own involvement is much less pivotal than it seems from the outside."
39,201831,VitalikButerin,2018-10-08 00:11:12+00:00,14,73,,"I have had the idea in the back of my head that eventually a small PoW component could be reintroduced into ethereum, not for consensus but basically a block reward for STARK generation."
40,201831,VitalikButerin,2018-10-05 05:52:12+00:00,13,88,,I think ethereum can absolutely survive me spontaneously combusting tomorrow at this point.
41,201831,VitalikButerin,2018-09-30 01:25:12+00:00,7,16,,"The ethereum community seems so far to be moving closer to the pro-immutability direction. So you're predicting a change from the status quo *and* a trend reversal, which IMO does require a non-negligible burden of proof :)"
42,201831,VitalikButerin,2018-09-28 20:20:02+00:00,14,132,,I hope Zcash can learn from all of the fun stuff that's coming soon down the ethereum pipeline!
43,201831,VitalikButerin,2018-09-24 10:49:37+00:00,128,464,,Rocket Pool continues humming along implementing and making tests for ethereum stake pools: 
44,201831,VitalikButerin,2018-09-24 00:06:08+00:00,3,16,,"My experience and intuition really do say otherwise. (i) I think most would say the impact of the DoS attacks on ethereum was larger than the one time there was a consensus failure (ii) the culture of ""there is no privileged reference client"" needs to be ingrained from day one"
45,201831,VitalikButerin,2018-09-23 23:49:17+00:00,7,40,,"Heterogeneity arguably saved the Ethereum blockchain back during the 2016 DoS wars ( https://www.ethnews.com/ethereum-continues-to-suffer-from-ddos-attacks ); what stopped geth did not stop parity and vice versa, so the network was online all the way through."
46,201831,VitalikButerin,2018-09-22 12:38:05+00:00,2,31,,Last week in Singapore I saw an ethereum certification service (forgot the name unfortunately) that does a Merkle tree for certifications and only puts the entire list of revocations on chain. For many non-financial use cases things like that can be done.
47,201831,VitalikButerin,2018-09-18 01:52:55+00:00,290,1158,,"Lighthouse: an open-source Ethereum 2.0 client, written in Rust "
48,201831,VitalikButerin,2018-09-11 23:59:25+00:00,1,9,,"I agree cryptocurrency distribution models in general could be much better. I would not say ethereum's is more unfair than others. It may even be one of the more balanced due to the multi-component approach (sale, premine between ~100 developers, mining)."
49,201831,VitalikButerin,2018-09-11 16:12:52+00:00,1,3,,"I remember that. BCH was also used as a payment method Though I believe in at least some of those cases, the reason behind this was volatile txfees plus lack of replace-by-fee support (for those transactions). Ethereum had mandatory RBF since day 1."
50,201831,VitalikButerin,2018-09-11 16:01:58+00:00,1,10,,"Also, this hasn't yet addressed the fact that ETH is the cheapest-to-use MoE in ethereum (and even more so for contracts!)."
51,201831,VitalikButerin,2018-09-11 15:40:28+00:00,3,29,,"Also, ETH is the only medium of exchange on ethereum where the gas cost of transactions is 21000, and not ~40000. Abstraction would change this, but as I said, we have no active plans to do full abstraction."
52,201831,VitalikButerin,2018-09-11 15:30:51+00:00,5,69,,"The reason is that as of today, abstraction is not even implemented in ethereum. There are clear efficiency advantages to using ETH as a means of paying for gas: it's already baked into the protocol, zero gas cost to pay for gas (so no ""tax tax""), network protocol supports it..."
53,201831,VitalikButerin,2018-09-11 15:20:39+00:00,57,307,,"So I realized that the argument that ""there's no value for ETH in ethereum as of today"" is even wronger than I thought."
54,201831,SatoshiLite,2018-10-25 21:21:48+00:00,331,1458,,"Bitcoin, Ethereum, and Litecoin are the BELlweather cryptos. They are the only coins that are traded on every major crypto exchanges and can be stored on every hardware wallet. Easily buying and securely storing other coins is really a PITA. "
55,201831,aantonop,2018-11-13 22:17:51+00:00,37,100,,"Ethereum Q&amp;A: Light clients, EVM, and Mist "
56,201831,aantonop,2018-10-21 14:10:53+00:00,35,72,,Ethereum Q&amp;A: 'Coin' and 'token' terminology 
57,201831,aantonop,2018-10-20 22:32:48+00:00,0,3,,"It is intended. I picked the ""animal"" on both books. Ants and bees represent emergent intelligence from the collaboration of many individual simple ""nodes"" following rules. Just like Bitcoin and Ethereum."
58,201831,aantonop,2018-09-13 19:01:34+00:00,51,149,,Ethereum Q&amp;A: What happens if there are bugs? 
59,201831,ErikVoorhees,2018-11-07 10:55:10+00:00,119,295,,BBVA Puts $150 Million Syndicated Loan on Ethereum Blockchain http://bit.ly/2RIKgkl via @CoinDesk
60,201831,ErikVoorhees,2018-10-18 22:42:53+00:00,71,291,#bitcoin #bitcoin #ethereum #litecoin,SALT’s new website is looking good... get fiat loans backed by your crypto as collateral. Credit scores become irrelevant with this technology. http://www.saltlending.com #bitcoin #ethereum #litecoin
61,201831,ErikVoorhees,2018-10-15 18:43:23+00:00,186,673,,Fidelity Launches Institutional Platform For Bitcoin And Ethereum via @forbes
62,201831,ErikVoorhees,2018-10-15 14:45:23+00:00,10,35,#bitcoin #bitcoin #ethereum #litecoin #blockchain,An In-Depth Look at the Keepkey Cryptocurrency Hardware Wallet http://disq.us/t/378ltwy #bitcoin #ethereum #litecoin #blockchain
63,201831,ErikVoorhees,2018-10-09 18:22:17+00:00,37,125,#bitcoin #bitcoin #ethereum #blockchain #finance,The most influential endowment manager (Yale CIO David Swensen) just jumped into crypto with bets on two Silicon Valley funds https://cnb.cx/2yk5zjQ #bitcoin #ethereum #blockchain #finance
64,201831,ErikVoorhees,2018-10-09 16:02:54+00:00,15,104,#bitcoin #bitcoin #ethereum #blockchain #crypto,ShapeShift made the CNBC 100 https://cnb.cx/2E6y3Uo #bitcoin #ethereum #blockchain #crypto @shapeshift_io
65,201831,ErikVoorhees,2018-10-07 15:32:16+00:00,155,484,#bitcoin #bitcoin #ethereum,"Of the many projects that ICO'd in 2017, SALT is emerging as one of the leaders in actually delivering a working and highly useful service. Avoid selling crypto when you need fiat. Excellent new financial service for the crypto economy. https://blog.saltlending.com/salt-announces-200-increase-in-lendable-areas-487cc796cd9a #bitcoin #ethereum"
66,201831,ErikVoorhees,2018-10-02 14:38:41+00:00,30,119,#bitcoin #bitcoin #ethereum #blockchain #finance #wallstreet,“We should not expect the Wall Street Journal to change Wall Street.” — @ShapeShift_io https://medium.com/@ShapeShift.io/shining-light-on-wsjs-attack-on-shapeshift-and-crypto-5aba86160185 #bitcoin #ethereum #blockchain #finance #wallstreet @wsj
67,201831,ErikVoorhees,2018-10-02 03:04:21+00:00,119,341,#bitcoin #bitcoin #ethereum #blockchain,“The WSJ reporters withheld information for months about suspicious accounts in order to build their story” — @ShapeShift_io https://medium.com/@ShapeShift.io/shining-light-on-wsjs-attack-on-shapeshift-and-crypto-5aba86160185 #bitcoin #ethereum #blockchain @WSJ
68,201831,ErikVoorhees,2018-10-01 22:56:08+00:00,138,433,#bitcoin #bitcoin #ethereum #blockchain #wallstreetjournal,“Shining Light on WSJ’s Attack on ShapeShift and Crypto” by @ShapeShift_io https://medium.com/shapeshift-io/shining-light-on-wsjs-attack-on-shapeshift-and-crypto-5aba86160185 @wsj #bitcoin #ethereum #blockchain #wallstreetjournal
69,201831,ErikVoorhees,2018-09-28 03:28:22+00:00,194,450,,Austria to Use Ethereum Public Blockchain to Issue $1.35 Bln in Government Bonds https://cointelegraph.com/news/austria-to-use-ethereum-public-blockchain-to-issue-135-bln-in-government-bonds via @cointelegraph
70,201831,ErikVoorhees,2018-09-20 21:43:03+00:00,2,19,#bitcoin #bitcoin #ethereum #erc20 #tokens #crypto #blockchain,CryptoGround: A Complete KeepKey Hardware Wallet Review https://www.cryptoground.com/a/keepkey #bitcoin #ethereum #erc20 #tokens #crypto #blockchain
71,201831,APompliano,2018-11-10 17:42:06+00:00,283,956,,This week in crypto: 1. BBVA put $150M loan on Ethereum 2. Sim swapping victims sue carriers 3. @binance launched research arm 4. @WilliamShatner defends @VitalikButerin 5. Bitmain launched new miners 6. DTCC testing blockchain 7. @blockchain airdropping $125M XLM Onwards!
72,201831,APompliano,2018-11-08 13:54:19+00:00,101,576,,Two principles at a school in China were caught mining Ethereum in the building. Crypto brings economic freedom to so many people...even the principal.
73,201831,APompliano,2018-10-07 17:41:12+00:00,140,883,,Unpopular opinion: More ICOs will be issued on the Bitcoin blockchain than Ethereum blockchain over the next decade.
74,201831,APompliano,2018-10-02 11:20:53+00:00,28,106,," New podcast alert!! @Sonnenshein is the Managing Director of crypto's largest asset manager, @GrayscaleInvest. We talked about Bitcoin, regulation, institutional investors, and why @DCGco bet on Ethereum Classic. Listen &amp; I promise you'll learn. "
75,201831,APompliano,2018-09-10 13:20:38+00:00,1522,5041,,Winklevoss twins just announced a stablecoin backed by USD. The Ethereum-based token is: - Approved by NY Department of Financial Services - Dollars held in FDIC-insured State Street account - Audited by multiple third-parties at various times The market continues to mature.
76,201831,maxkeiser,2018-10-06 17:13:26+00:00,4,6,#Bitcoin #Bitcoin,"According to developers, is the primary differentiation between #Bitcoin and Ethereum a question of decentralization?"
77,201831,lopp,2018-11-09 16:50:54+00:00,49,523,,"I once met a miner who accidentally 51% attacked Ethereum Classic in its early days and, upon realizing it, redirected some hashpower to other coins so as to avoid crashing confidence in the newborn network."
78,201831,lopp,2018-10-30 12:58:41+00:00,0,0,,"Minimum specs are tough to say because it usually comes down to ""how long are you willing to wait for initial sync"" - the only nodes of which I'm aware some PCs can NEVER sync to chain tip are ethereum nodes running on spinning disks."
79,201831,lopp,2018-10-28 15:19:27+00:00,0,6,,While Ethereum is running near max capacity it appears to be adding about 8 hours of validation time to the initial sync for every month of history you're syncing. On this fairly high end machine.
80,201831,lopp,2018-10-28 13:14:14+00:00,1,10,,"Ethereum is slightly different / more complex. I'm not doing full archival because my hard drive isn't large enough. I am keeping all of the blocks and validating them all, but am pruning old states. "
81,201831,lopp,2018-10-27 00:31:15+00:00,31,324,,"Yo dawg, I heard you like Bitcoin and Ethereum so I put some bitcoins in your ether contracts so you can BTC while you ETH."
82,201831,lopp,2018-10-23 11:27:12+00:00,34,140,,"""Bitcoin maximalists are nationalists"" is one logical leap from ""Bitcoin maximalists are nazis."" Let's hurry up and get this over with - we just need one more Ethereum founder to complete the cycle! "
83,201831,TuurDemeester,2018-10-22 00:14:40+00:00,1,4,,"Since 2016 I'm on record warning about how many development decisions taken in Ethereum dangerously contribute to centralization. Now that the patient is in the Emergency Room, you're telling me that there's no merit in saying that he's become morbidly obese..."
84,201831,TuurDemeester,2018-09-27 19:03:33+00:00,0,0,,"Glad you enjoyed it Evan! An apologies accepted. In terms of scaling prospects & differences between Bitcoin & Ethereum, here's an article that I've been reading today. https://hackernoon.com/sharding-centralizes-ethereum-by-selling-you-scaling-in-disguised-as-scaling-out-266c136fc55d"
85,201831,TuurDemeester,2018-09-26 21:37:47+00:00,1,4,,"The reason why Ethereum planned to scale on layer 1, was that this was the reason for its existence in the first place. If scaling was always going to happen on layer 2, ETH could just as well become a smart contract layer on top of Bitcoin."
86,201831,TuurDemeester,2018-09-22 14:39:26+00:00,0,0,,"Vitalik responded 4 hours ago, my tweet is from 2 days ago... I'm aware of the promise of ""layer 2"" in Ethereum - and like many others I'm skeptical of the execution. You forgot to link to Vitalik's responses: "
87,201831,TuurDemeester,2018-09-21 00:10:58+00:00,92,364,,"But... deploying d-apps on the ""Ethereum Virtual Machine"" is exactly what everyone was encouraged to do for the past 4 years. Looks like on-chain scaling wasn't such a great idea after all. "
88,201831,TuurDemeester,2018-09-11 18:36:38+00:00,113,418,,"Developer source: ""Every company running an Ethereum node I've talked to in the past few months have reported constant problems with keeping the tip synced. One company said they have one guy completely devoted to handling the ~3 fires per week that come up with their geth node."""
89,201831,barrysilbert,2018-10-30 12:44:23+00:00,92,432,,"The Ethereum Foundation just donated $150,000 (in $ETC) to the Ethereum Classic Cooperative Thrilled to see bridges being built between the Ethereum and Ethereum Classic communities "
90,201831,barrysilbert,2018-10-22 14:24:58+00:00,64,184,,"Ethereum Based Tokenized Virtual Reality Land Sold for $100,000 "
91,201831,barrysilbert,2018-09-12 02:18:26+00:00,67,267,,"#of individuals working full time on Ethereum Classic has grown from 11 last year to 38 currently (spread across four teams), giving ETC one of the largest networks of developers and contributors in cryptoland And it is completely decentralized "
92,201831,barrysilbert,2018-09-10 22:47:12+00:00,44,187,,"Looking forward to two days of discussion, debate and celebration with over 500 of my Ethereum Classic peeps from around the world "
93,201831,ToneVays,2018-11-10 21:36:52+00:00,0,4,#ethereum,"He came to dinner organized for me in London when I came to town, it was actually fun sitting next to him for a few hours talking shit about #ethereum :)"
94,201831,ToneVays,2018-11-07 14:50:06+00:00,4,54,#Bitcoin #Bitcoin #ICO #Ethereum #Security,The #Bitcoin Law Review will be back THIS WEEK w/ Lots to talk about. Will @SEC_News @SEC_Enforcement call all #ICO's &amp; even #Ethereum a #Security? Top Vids: https://www.youtube.com/watch?v=wUUVlatCvp0&amp;index=3&amp;list=PLQBwZ2xry6ebYoZktlQeeKDGeJaMP5EJ1 https://www.youtube.com/watch?v=EnUGcwBUO5I https://www.youtube.com/watch?v=FzGBR-M6U88&amp;list=PLQBwZ2xry6eZ2SXBT-CuABpdirgguF0bg&amp;index=1 https://www.youtube.com/watch?v=KlAvwpNsVpc&amp;index=12&amp;list=PLQBwZ2xry6eZ2SXBT-CuABpdirgguF0bg https://www.youtube.com/watch?v=18xThXGorDc&amp;index=10&amp;list=PLQBwZ2xry6eZ2SXBT-CuABpdirgguF0bg
95,201831,ToneVays,2018-11-07 14:27:10+00:00,0,0,#Ethereum #ICO,"Why Can't it be #Ethereum? with you on the other two, $ETH was an #ICO"
96,201831,ToneVays,2018-11-02 03:21:03+00:00,57,375,#Blockchain #Bitcoin #Bitcoin #Ethereum #EOS,"Looks like @VitalikButerin is getting ready to pull a @DanLarimer. Exited!!. People continue to NOT understand what a Decentralized #Blockchain is &amp; why #Bitcoin does NOT compete w/ nonsense like #Ethereum $ETH or #EOS $EOS, it compets w/ $USD $EUR $GOLD"
97,201831,ToneVays,2018-10-19 17:21:11+00:00,7,56,#Ethereum #Bitcoin #Bitcoin,"ТОН ВЕЙС на русском языке про Биткоин, #Ethereum, трейдинг, #Bitcoin ETF, SEC, Майка Новограца Another recent interviews in RUSSIAN that was done by one of the attendees at the Amsterdam Trading Class:"
98,201831,ToneVays,2018-10-13 09:03:32+00:00,24,185,#Crypto #Ethereum #Blockchian #Bitcoin #Bitcoin,"AND this is why I continue to call @laurashin the WORST ""Top 10 popular/non-scammer"" Journalist/podcaster in #Crypto. She DOSN'T comprehend that @Nouriel is 100% right in his #Ethereum #Blockchian understanding. Watch my debate against Nouriel on #Bitcoin: https://www.youtube.com/watch?v=_ecOfaidq9I"
99,201831,ToneVays,2018-10-11 20:56:07+00:00,0,0,#Ethereum,"No, because the company did not scam anyone... but if I ever promoted #Ethereum, I would feel like disgrace"
100,201831,ToneVays,2018-10-01 07:46:28+00:00,0,1,#Ethereum #CryptoScam,This actually reminds me that i need to edit the 3rd #Ethereum episode of the @Crypto_Scam #CryptoScam podcast which I recorded over a month ago... I've been talking this $ETH stupidity since 2015 --&gt; at least
101,201831,ToneVays,2018-09-22 20:03:58+00:00,2,37,#Ethereum,"But it's worse than that, backing a crypto currency with $GOLD is probably the dumbest thing one can do. The model has been proven a failure 10 years ago ($DIG is actually more dangerous cause it's prob on top of unscalable/centralized #Ethereum): https://en.wikipedia.org/wiki/E-gold"
102,201831,ToneVays,2018-09-17 21:42:07+00:00,0,2,,"Ethereum has way more, not impressed."
103,201831,ToneVays,2018-09-17 21:14:12+00:00,0,7,#Ethereum,"Actually, it should age just fine... i'm still expecting $1 #Ethereum cause that shit can't scale."
104,201831,ToneVays,2018-09-12 20:30:47+00:00,9,41,#Bitcoin #Bitcoin #ICO #Securities #FakeNews #Ethereum #Bitcoin #Bitcoin,#Bitcoin Law Review to talk latest @SEC_Enforcement &amp; did a Judge Rule that #ICO's are #Securities or was it #FakeNews? #Ethereum &amp; #Bitcoin ETN's get de-listed by @SEC w/ @FJasonSeibert @dcsilver @RestisLawFirm @propelforward @sashahodler @BitcoinKhaleesi
