,period,username,date,retweets,favorites,hashtags,text
119,201924,VentureCoinist,2019-11-20 15:30:01+00:00,0,8,,Bitcoin dividend doesn't sound too bad
120,201924,VentureCoinist,2019-11-15 20:41:40+00:00,95,287,,"Asset price bubbles: •Nikkei = $2.2T lost •Tech bubbles = $5T lost •US Housing bubble = $6.5T lost •Bitcoin ""bubble"" = $.3T lost source: @CoinSharesCo chart from 2019 Crypto Trends Report"
121,201924,VentureCoinist,2019-11-15 20:10:24+00:00,0,2,,if you're a degen on high leverage you'll end up with 0 bitcoin. was speaking from a trading perspective. if I wasn't a longterm bitcoin bull I wouldn't be here
122,201924,VentureCoinist,2019-11-15 20:02:04+00:00,3,47,,The $BTC swing from 8700-&gt;9ks did not work twice. Stopped on new lows for November. With Bitcoin sliding lower it generally presents an opportunity for large cap alts to gain. That's not happening either. Rough Friday for any bull. 
123,201924,VentureCoinist,2019-11-15 19:45:28+00:00,0,14,,I have an episode I'm editing now which agrees with your bullets. Showing tether discount there as well which can be a gauge of bitcoin demand (otc onramp)
124,201924,VentureCoinist,2019-11-11 20:00:19+00:00,0,5,,appreciate the honesty. I clicked and my bitcoin cash account just went negative
125,201924,VentureCoinist,2019-11-10 21:42:36+00:00,0,2,,we discussed Bitcoin a large majority of the conversation. this was one clip
126,201924,VentureCoinist,2019-11-10 18:14:34+00:00,0,10,,love the initiative 
127,201924,VentureCoinist,2019-11-10 18:13:18+00:00,290,940,,One of the most common misconceptions about investing in $BTC for newcomers: Bitcoin is too risky. Bitcoin is too volatile. Bitcoin is dangerous to invest in. Listen to @AriDavidPaul explain why that's nonsense. full clip: https://youtu.be/c1PZZFhhy4c
128,201924,VentureCoinist,2019-11-09 17:07:37+00:00,0,5,,I think bitcoin wins even if one jurisdiction tried to ban mining. Sure the security of the network could take a hit but capital/resources would flow somewhere else... 
129,201924,VentureCoinist,2019-11-09 17:01:07+00:00,33,118,,"Have you ever wondered: ""Can the government ban Bitcoin?"" If yes, you should read @parkeralewis most recent post: https://www.unchained-capital.com/blog/bitcoin-cannot-be-banned/ Dropping BIG facts "
130,201924,TuurDemeester,2019-11-22 20:30:54+00:00,43,207,,"It's important to note that, as Bitcoin slowly approaches maturity/saturation, its price uptrend will gradually slow down, which causes parabolic trendlines to fail. In other words, a violation of the trendline above won't be proof that the secular bull market in bitcoin is dead. "
131,201924,TuurDemeester,2019-11-22 18:11:58+00:00,25,129,,"Here's the unabridged audiobook version of our report ""The Bitcoin Reformation"". (runtime 56 minutes) https://anchor.fm/thecryptoconomy/episodes/The-Bitcoin-Reformation---by-Tuur-Demeester-e94mjn"
132,201924,TuurDemeester,2019-11-22 17:48:27+00:00,695,2554,#buythedip,"Bitcoin's parabolic uptrend which started in January 2015 is still intact. Now nearly touching support again, for the first time since March 2019. #buythedip"
133,201924,TuurDemeester,2019-11-21 23:21:37+00:00,82,488,,Because Bitcoin will be adopted as a store of value before it's used as a medium of exchange. 
134,201924,TuurDemeester,2019-11-20 01:50:14+00:00,11,47,,Imo one of the best DIY Bitcoin cold storage guides out there: 
135,201924,TuurDemeester,2019-11-20 01:49:38+00:00,1,10,#smartcustody,Bitcoin #smartcustody book cover and contents:
136,201924,TuurDemeester,2019-11-20 01:15:17+00:00,10,33,,"Christopher Allen talking Bitcoin Smart Custody, Self-Sovereign Identity at @unchainedcap in Austin."
137,201924,TuurDemeester,2019-11-19 18:01:00+00:00,8,33,,"Je suis ravi de partager avec vous la traduction française de notre rapport: ""La Réforme Bitcoin"". https://medium.com/@romainrouphael/la-r%C3%A9forme-bitcoin-8775b460a04a"
138,201924,TuurDemeester,2019-11-17 16:58:46+00:00,4,34,,"Critical but fair take on ""The Bitcoin Reformation"", by CT's Ryan Singer: "
139,201924,TuurDemeester,2019-11-14 22:09:45+00:00,18,82,,"Excited to see a good quality audiobook version of ""The Bitcoin Reformation"". (it's free) "
140,201924,TuurDemeester,2019-11-14 18:57:39+00:00,11,30,,"A thread for news items that illustrate the trends described in ""The Bitcoin Reformation"". Link to report: https://docsend.com/view/ijd8qrs"
141,201924,TuurDemeester,2019-11-14 13:24:46+00:00,0,1,,Thanks. It seems like his assumption is the value of fiat currencies is not fundamentally undermined by perpetual QE. From there I can see how he'd be skeptical about Bitcoin having a long term future.
142,201924,TuurDemeester,2019-11-13 17:46:19+00:00,6,22,,"(In Dutch) @aaronvanw, @jwburgers and @gkboris discuss our report ""The Bitcoin Reformation"": "
143,201924,TuurDemeester,2019-11-13 17:24:38+00:00,3,28,,"Finnish translation of our report ""The Bitcoin Reformation"" is now complete. Check it out here: "
144,201924,TuurDemeester,2019-11-12 21:53:35+00:00,0,5,,Welcome. It made me regret not reviewing The Sovereign Individual before finishing The Bitcoin Reformation report.
145,201924,TuurDemeester,2019-11-08 17:20:42+00:00,1,44,,"To my knowledge, out of the top 100 bitcoin influencers, 6 live in Austin already (I won't name names) - double that of 2 years ago. "
146,201924,TuurDemeester,2019-11-08 16:02:34+00:00,0,1,,"Imo Bitcoin is here to stay. Also ""The P2P Cash Reformation"" isn't as sexy a title ;-)"
147,201924,TuurDemeester,2019-11-08 14:06:22+00:00,35,223,,"Our report ""The Bitcoin Reformation"" had 7,000 visits and was downloaded 2,800 times in the first 24 hours. Translations in French &amp; Finnish on the way. https://docsend.com/view/ijd8qrs"
148,201924,TuurDemeester,2019-11-08 13:53:52+00:00,0,0,,51% attack to clawback funds is +70% cheaper on Ethereum vs Bitcoin.
149,201924,TuurDemeester,2019-11-08 11:54:05+00:00,0,3,,"""The 80 Years War of Bitcoin"" sounds a bit grim... at least reformation hints at a reshaping of society. Also historically ""protestant"" didn't necessarily mean a particular religion, you identified with the label if you protested against the Catholic church."
150,201924,TuurDemeester,2019-11-08 03:00:30+00:00,0,27,,"Imo this is the broken window fallacy. Bitcoin mining is not wasting energy, it's rather a more efficient way of creating financial predictability compared to the traditional IMFS, gold mining, etc."
151,201924,TuurDemeester,2019-11-08 02:01:21+00:00,0,1,,How to Position for the Rally in Bitcoin (November 2015): 
152,201924,TuurDemeester,2019-11-08 02:00:18+00:00,0,1,,Bitcoin in Heavy Accumulation (March 2019): 
153,201924,barrysilbert,2019-11-19 16:05:28+00:00,22,66,,Grayscale Bitcoin Trust’s Step Forward with SEC Filing by @GrayscaleInvest
154,201924,barrysilbert,2019-11-19 14:08:27+00:00,37,102,,Grayscale Bitcoin Trust Files Form 10 with SEC 
155,201924,ToneVays,2019-11-23 13:49:46+00:00,29,255,#Bitcoin #Bitcoin,"Trading #Bitcoin - Looks like the short term low is in. Yesterdays Stream Almost called it perfectly, was off by a bout an hour and $100 for $BTC price. Where to Next? Short Term - Bull! Mid Term - Bear! Long Term - Moon!"
156,201924,ToneVays,2019-11-23 09:19:00+00:00,25,171,#Bitcoin #Bitcoin,"FLASHBACK: What it means to Short! - In this Oct 2018 @LucidInvestment video that was streamed 2 weeks before the price of #Bitcoin Crashed from $6k to $3k. Tyler Jenk's, @LeahWald &amp; I explain shorting https://www.youtube.com/watch?v=4TKDNuOfq2Y NOTE: I was short $BTC at the time while Tyler in Cash"
157,201924,ToneVays,2019-11-22 11:15:47+00:00,12,98,#Bitcoin #Bitcoin,"Trading #Bitcoin - Follow up from yesterdays video where I stated ""a short term $BTC low should be made within 36 hours"". I believe this low is now here - ""But Downtrend form June's $14k Top is NOT yet Over"". Going LIVE soon:"
158,201924,ToneVays,2019-11-21 14:02:00+00:00,6,43,#Bitcoin #Bitcoin,"Trading #Bitcoin - Back under $8k but w/ a TD 9 Buy, is this the time to catch a $BTC 'Dead Cat Bounce' to the upside?"
159,201924,ToneVays,2019-11-20 08:12:53+00:00,15,109,#Bitcoin #Bitcoin,Trading #Bitcoin w/ @woonomic let's get a full explanation of his views about the tweet below and find out how Bearish he is going into this $BTC halving: https://www.youtube.com/watch?v=RM9uYBUo0b8
160,201924,ToneVays,2019-11-18 07:28:34+00:00,0,0,#Bitcoin #Bitcoin #Crypto,spoken just like a tru shitcoiner selling his bags of $GRIN scam coin as an anonymous troll... It's people like you that confuse intelligent people like the speaker replace a smart word like #Bitcoin with a silly word like #Crypto in an excellent presentation.
161,201924,ToneVays,2019-11-18 06:38:11+00:00,1,32,#Crypto #Bitcoin #Bitcoin,"Great opening presentation at @AIM_Summit. James McCormack of @FitchRatings talks about the future viability of $USD as global currency of choice. Was interesting to see #Crypto in his slide, wish it was just #Bitcoin but the fact that it's even there is a huge improvement "
162,201924,ToneVays,2019-11-16 16:35:39+00:00,6,45,#Bitcoin #Bitcoin,Check out my guest appearance w/ @alessiorastani talking #Bitcoin &amp; of course $BTC price :)
163,201924,ToneVays,2019-11-16 15:39:24+00:00,7,51,#Bitcoin #Bitcoin,"Trading #Bitcoin - $8,500 Now Lost, Where to from here for $BTC Price... Off to Dubai guys, last stop on the 3 month speaking tour :)"
164,201924,ToneVays,2019-11-16 02:38:11+00:00,1,26,#Blockchain #Bitcoin #Bitcoin #Dubai #AIMSummit,"If you are still at Singapore & still not sick of #Blockchain / #Bitcoin events this week, I will be speaking at this one later today then getting on a flight to #Dubai to speak at #AIMSummit there."
165,201924,ToneVays,2019-11-14 22:22:51+00:00,10,58,#Bitcoin #Bitcoin,"Trading #Bitcoin - How critical is $8,500 Support? Let's take a deep dive from the top of Marina Bay Sands Infinity Pool - Singapore "
166,201924,ToneVays,2019-11-13 11:39:51+00:00,1,24,#Bitcoin #Bitcoin,"You are talking about #Bitcoin, but that's because you are probably not smart enough to understand that $BTC has properties $XRP does not: - Unconfiscatablity - Censorship Resistance - Finite Supply - Decentralization - Mining $XRP is more like ""Flooz"" or ""Beenz"" Google them!"
167,201924,ToneVays,2019-11-13 08:19:42+00:00,5,18,#Singapore #Bitcoin #Bitcoin,Will not be speaking at this year's @BlockShowcom but if you are in #Singapore come out tomorrow night as I will be on a panel talking #Bitcoin &amp; $BTC trading at:
168,201924,ToneVays,2019-11-10 19:32:26+00:00,4,66,#Bitcoin #Bitcoin,"Trading #Bitcoin - $BTC Back above $9k, How Significant is that? Let's take a look from yet another airport :)... off to Singapore!"
169,201924,ToneVays,2019-11-08 16:39:19+00:00,4,57,#Bitcoin #Bitcoin,"Trading #Bitcoin - Just saw that $9k was lost, need to look at the $BTC charts so might as well do it live."
170,201924,adam3us,2019-11-20 15:27:13+00:00,10,209,,"""> Do you personally own any cryptocurrencies? Yes. Bitcoin. &gt; Only Bitcoin? Only. Yes."""
171,201924,adam3us,2019-11-20 15:16:26+00:00,0,24,,"I mean come on, there are better comparators for shadness than Bitcoin. Bitcoin is digital gold, zero premine, decentralised, censor resistant asset class. Start by stack ranking it vs onecoin, bitconnect, and dozens of other historic pre-mined, ICOed, over-marketted ""coins""."
172,201924,adam3us,2019-11-20 15:11:13+00:00,0,2,,"If you are long term holding you're already good, but to continue function, Bitcoin would be more anti-fragile with some temporary mechanism available to protect against re-org, exchange theft and DoS from hypothetical slight majority hostile miners (eg co-opted by nation state)."
173,201924,adam3us,2019-11-20 15:06:52+00:00,1,2,,"It maybe an idea to boycott, or at least not recommend NYA supporting companies, unless they clearly recognise it was a hostile to Bitcoin epic mistake, not to be repeated. This is why people ask those who will respond if they acknowledge their mistake."
174,201924,adam3us,2019-11-20 15:06:03+00:00,0,1,,"Or if they do try, Bitcoin is already next level anti-fragile and effortlessly repels the attack at economic cost to the attacker."
175,201924,adam3us,2019-11-20 13:16:32+00:00,0,6,,"Biggest lesson from that is run a fullnode to protect your Bitcoin, and educate and help others to. Including hybrid wallets, self custody vs custodial, more Bitcoin protected more directly by fullnode cross check is better."
176,201924,adam3us,2019-11-20 11:41:43+00:00,2,18,,"it is a good time for bitcoin layer2 tech to sweep away the premined ICO over-marketing of crappy tech as: a) bitcoin dominance is on the rise (a lot volume adjusted) b) the crappy tech is crumbling, admitting failure c) the ICO coin marketing game is hurt by being over crowded."
177,201924,adam3us,2019-11-20 11:38:27+00:00,0,9,,"ofc there are lots of eth competing premined ICO platforms now with better tech, more funding etc they pay exchanges to integrate. liquid is I would say is better tech and open, no ICO, no premine for the ""pay to play"" marketing coin games, obviously being a Bitcoin layer2."
178,201924,adam3us,2019-11-18 22:44:49+00:00,2,10,,"Confidential Transactions, which has been available live on Bitcoin via Liquid layer2/sidechain is a pretty neat confidentiality and privacy feature. But MW does not really much change that level of privacy as miners or p2p aggregators must see transactions. Now CT+CJ would be."
179,201924,adam3us,2019-11-18 22:42:54+00:00,0,15,,"seriously $8500 down to $8200 is -3.5% (actually $8250 now so more like -2.9%). even in the last few months of bitcoin volatility fell from $14k to $7500. it rose from $7.5k to $10k in an hour. and it's news that it loses $300 ZOMG. perspective, zoom out, relative to normal vol."
180,201924,adam3us,2019-11-18 19:43:52+00:00,8,41,,"If you want to try Confidential Transactions you can use them on liquid (Bitcoin layer2/sidechain), via the @blockstream green wallet https://blockstream.com/green/ on L-BTC, or L-USDt etc). Or liquid-qt wallet and others."
181,201924,adam3us,2019-11-17 20:52:16+00:00,2,18,,"eg take a look at this pre-bitcoin stamp collection :) why did people make them? just for the fun of it, creating computational artefacts and having the fun of discussing what hardware and time they took to create. http://hashcash.org/stamps/ (the top one is post bitcoin 2011)."
182,201924,adam3us,2019-11-17 11:10:33+00:00,0,2,,fwiw @olivierjanss is not disagreeing that fullnodes hold miners honest. he's saying there are other ways miners could attack which we have not seen on bitcoin yet (mining empty blocks and other things Gavin argued for before falling offf the bamboozle cliff)
183,201924,adam3us,2019-11-16 01:28:21+00:00,1,10,,"But we're describing Bitcoin, and the scenario you're describing with a majority of pools/miners ""supporting"" forks actually happened, and miners almost immediately stopped because hashrate follows profitability."
184,201924,adam3us,2019-11-15 14:14:12+00:00,42,249,,"your fullnode has nearly infinite defensive power in verifying bitcoin validity - the asymmetry of many people verifying is awesome. miners can expend $millions and yet a basic computer can reject invalid work, similar to how a gold assay device can reject gold plated lead."
185,201924,adam3us,2019-11-14 19:07:48+00:00,2,13,,"FWIW I think @ErikVoorhees is mostly all in Bitcoin, just lightly talking shapeshift book."
186,201924,adam3us,2019-11-14 13:57:15+00:00,1,4,,Apparently @halfin is partly responsible for that change. The claim is bitcoin had 2.1bil bitcents=21mil Bitcoins until Hal argued to add more digits which be 6 extra: so Bitcoin has 21trillion bits divided into 2.1 quadrillion sats.
187,201924,adam3us,2019-11-12 21:48:39+00:00,0,1,,"The way the inputs are committed/encrypted protects against double spending, but in a way where at the time mined, miners do not learn which inputs, amounts are being spent so it improves fungibility and makes Bitcoin more censor resistant."
188,201924,VinnyLingham,2019-11-18 01:17:03+00:00,1,81,,Did you buy any Bitcoin?
189,201924,CharlieShrem,2019-11-22 16:05:01+00:00,190,848,,Fake China Bitcoin Ban pushes BTC price below $600 [March 2014] 
190,201924,CharlieShrem,2019-11-22 15:27:57+00:00,3,16,#Bitcoin #Bitcoin,"The problem is, the ""analyses"" is mostly guess work. No one can 100% verify any claims these companies make. I know of a court case where a #Bitcoin analyses company testified under oath on behalf of who paid them. Later it was found they were wrong and it fucked shit up. "
191,201924,CharlieShrem,2019-11-21 16:31:00+00:00,54,306,#bitcoin #bitcoin,"“People think #bitcoin maximalists have closed minds not willing to listen or learn. This is incorrect, OG maximalists have been around and seen it all, they chose Bitcoin!” - @danheld on UntoldStories."
192,201924,CharlieShrem,2019-11-20 20:50:33+00:00,46,324,#Bitcoin #Bitcoin #Crypto,"The amount of people around the world that are working, growing, developing, building and loving #Bitcoin and #Crypto is staggering and amazing. Thank you !"
193,201924,CharlieShrem,2019-11-20 14:42:41+00:00,1,9,#bitcoin #bitcoin,The UntoldStories studio needs a #bitcoin rug or carpet ! Who’s got a good link to one ?
194,201924,CharlieShrem,2019-11-19 23:56:30+00:00,0,5,#bitcoin #bitcoin,My monthly book clubs’ continuity proves that decentralized governance works in practice. #bitcoin
195,201924,CharlieShrem,2019-11-19 18:02:30+00:00,0,4,#Bitcoin #Bitcoin,"I dont understand this ""assuming lost"" metric. While trying to figure out how much #Bitcoin in circulation is applaudable, this should be taken with a grain of salt."
196,201924,CharlieShrem,2019-11-19 13:44:21+00:00,14,47,#Bitcoin #Bitcoin,"""If you send Bitcoin to a centralized exchange, you don't own #Bitcoin."" My friend @AtomicWallet CEO Konstantin Gladych @gladkos &amp; I talk about why the industry will go more toward non-custodial solutions on todays of http://UntoldStories.com Sponsors: @eToroUS &amp; @offordscott"
197,201924,CharlieShrem,2019-11-18 17:52:26+00:00,2,10,,"Brad is amazing and the business he built is phenomenal. His podcast is top in the world, enjoyed doing this! Charlie Shrem. Still Banking On Bitcoin. Episode 215 with The Real Brad Lea (TRBL) "
198,201924,CharlieShrem,2019-11-15 19:57:30+00:00,5,99,,Who remembers “Inside Bitcoin” circa 2013?
199,201924,CharlieShrem,2019-11-14 15:49:44+00:00,5,22,#Bitcoin #Bitcoin,Yup! He eventually ran out of free #Bitcoin to give to people. One of the ideas was that Bitcoin Foundation would fund and run a faucet. 
200,201924,CharlieShrem,2019-11-14 01:27:27+00:00,78,717,#bitcoin #bitcoin,I can’t believe after the next halving we will be down to 6.25 #bitcoin per block. Remember when it was 50?
201,201924,CharlieShrem,2019-11-13 13:48:32+00:00,4,18,#Bitcoin #Bitcoin,".@mikekimelman and I discuss the schism in #Bitcoin culture and warn of complacency in crypto — it could still be marginalized by government. FATF, FinCEN and other agencies lie in wait to pounce if Bitcoin flinches. http://UntoldStories.com Thanks @eToroUS &amp; @offordscott"
202,201924,CharlieShrem,2019-11-12 21:22:35+00:00,5,14,#bitcoin #bitcoin,Listen to my and @mikekimelman experiences with the Federal court system &amp; how it changed our views on #bitcoin forever. http://UntoldStories.com Sponsors: @eToroUS &amp; @offordscott
203,201924,CharlieShrem,2019-11-12 14:38:46+00:00,4,12,#Bitcoin #Bitcoin,"On todays http://UntoldStories.com, I sit down with author @mikekimelman who discovered #Bitcoin in 2015 when he decided to help me prepare for prison. This episode is an epic one. Thanks @eToroUS &amp; @offordscott"
204,201924,CharlieShrem,2019-11-12 13:55:50+00:00,10,12,,"The takeaway from this episode of http://UntoldStories.com is encapsulated in two images — a frog in boiling water and grey pork in a cup. Mike and I examine the criminal justice system, prison life, and#Bitcoin culture in a nutshell. Thanks @eToroUS &amp; @offordscott"
205,201924,CharlieShrem,2019-11-12 13:21:05+00:00,9,32,,"I would not have made it through prison without @mikekimelman On http://UntoldStories.com, Mike Kimelman and I swap prison stories and explore how Bitcoin promises a different world but could be threatened by complacency. Listen now Presented by @eToroUS @offordscott"
206,201924,CharlieShrem,2019-11-11 15:29:26+00:00,1,17,#Bitcoin #Bitcoin,“I never like living in the past & saying just because something always happens it will happen in the future.” ~ @VinnyLingham What are Vinnys good and bad #Bitcoin predictions for 2020? Listen to this episode on http://UntoldStories.com Presented by @bitpanda @bitpay
207,201924,CharlieShrem,2019-11-08 16:32:11+00:00,20,120,#bitcoin #bitcoin,Excited to be at @BitcoinMagazine offices in Nashville talking to @DavidFBailey for http://UntoldStories.com. The first issue launched in May 2012 and was briefly available at Barnes and Nobles. @VitalikButerin launched his writing career here. #bitcoin 
208,201924,CharlieShrem,2019-11-08 16:29:25+00:00,239,1164,#bitcoin #bitcoin,In 2012 we paid 1300 #bitcoin for these BitInstant ads. This was the first issue of @BitcoinMagazine in May 2012.
209,201924,CharlieShrem,2019-11-08 15:52:30+00:00,8,19,#Bitcoin #Bitcoin,"My friend @jeffreyatucker, the most well known economists of our time, explains how I turned him from a skeptic to #Bitcoin lover after 1 drink. Listen to this week’s episode on blockchain, cocktails, economics, and more. http://UntoldStories.com Sponsors: @eToro @offordscott"
210,201924,CharlieShrem,2019-11-08 15:08:45+00:00,2,11,#Bitcoin #Bitcoin,“Can you imagine the next crypto bubble bust – #Bitcoin gets blamed?” via @VinnyLingham We discuss scenarios and unpopular opinions that make us all stronger. Listen to this episode on http://UntoldStories.com Sponsors: @bitpanda @bitpay
211,201924,balajis,2019-11-18 22:05:48+00:00,9,56,,"There are many different ways in which crypto changes news, including: 1) prediction markets 2) pseudonymous authors 3) censorship-resistant publication 4) blockchain-verifiable facts 5) bitcoin bounties for corrections 6) number of confirmations Probably worth a post."
212,201924,balajis,2019-11-13 19:43:37+00:00,6,79,,"Hackathons are a good start. Maybe there’s more we can do in terms of harnessing all that brainpower in one place? As an example, the Little Bitcoin Book was written in a few days by N people, one chapter each, and then published on Amazon. @calilyliu @jimmysong What else?"
213,201924,balajis,2019-11-12 05:41:41+00:00,45,348,,Bitcoin is a spinal transplant for the tech industry.
214,201924,balajis,2019-11-08 16:18:00+00:00,3,31,,"Rather than fiat as the Catholic Church and Bitcoin as the Protestants, this thread posits Bitcoin as the Catholic Church and all other coins as the Protestants. "
215,201924,balajis,2019-11-08 15:23:56+00:00,5,47,,"Please note that I have no personal opinion on this ancient religious dispute! But there are parallels with Bitcoin in terms of decentralization, disintermediation, and a personal relationship with your money. Let’s hope we avoid the 30 Years War."
216,201924,AriDavidPaul,2019-11-23 22:23:52+00:00,2,12,,"Unlike bologna, bitcoin is resistant to seizure. Admittedly, it’s also less delicious. "
217,201924,AriDavidPaul,2019-11-20 20:19:00+00:00,0,3,,"Your long form explanation below is reasonable, but “issued” is problematic. If Satoshi was NSA, that wouldn’t affect what bitcoin is today. I’d replace with “controlled” for clarity."
218,201924,AriDavidPaul,2019-11-20 18:32:06+00:00,0,0,,"2/ I also thought that made bitcoin most secure against political attacks to make it most likely to serve as a successful tool for censor and seizure resistance. And there were a lot, a lot, of people like me opposing the block size increase in bitcoin."
219,201924,AriDavidPaul,2019-11-20 18:31:14+00:00,0,0,,"I have no relation to Blockstream in any form whatsoever. As a Bitcoin owner, I thought the schelling point of ""no hard forks ever, unless absolutely necessary"" was in my economic interest, and"
220,201924,AriDavidPaul,2019-11-20 18:06:14+00:00,0,0,,"2/ same with, say, downloading a bitcoin client. I can confirm the hash of the software...but confirm it against what? A hash posted on a website? Even if websites couldn't be MiTM attacked, how do I know which website to look at? It all comes down to qualitative human trust."
221,201924,AriDavidPaul,2019-11-20 15:21:29+00:00,5,22,,"My friend @Meshlakhani is producing a podcast series for a general audience on investing. He did a two-parter on Bitcoin. @avichal was in both 1 &amp; 2, and I'm in this second one. ""What's the Deal with Bitcoin (PART 2)"" "
222,201924,AriDavidPaul,2019-11-19 20:49:55+00:00,0,1,,"3/ I’m not knowledgeable enough to have an informed opinion on this topic, but worth noting that competing clients (in both ethereum and bitcoin) have fairly frequently accidentally HF’ed, but multiple minority clients is critical to political decentralization imo."
223,201924,AriDavidPaul,2019-11-19 20:48:18+00:00,1,3,,"2/ addressing this. Are there any ethereum initiatives to actively discourage usage of the most popular client? Is this an explicit goal? Bitcoin devs disagree with each other on this point, but majority seem to favor a single dominant client to avoid accidental HFS."
224,201924,AriDavidPaul,2019-11-19 20:45:48+00:00,0,1,,"It’s been a long running distracting troll. Blockstream has never produced a protocol change in bitcoin, ever. Nor has anyone else other than satoshi. We can debate the extent to which a dominant client is the asset or protocol, but I’m not aware of any ethereum plans directly"
225,201924,AriDavidPaul,2019-11-16 06:49:41+00:00,0,6,,Bitcoin was pitched as digital gold to me in 2014. No one with any understanding of payment rails thought a blockchain would ever be useful for small legal transfers.
