,period,username,date,retweets,favorites,hashtags,text
107,201911,CharlieShrem,2019-04-03 17:14:56+00:00,9,18,,"Bitcoin (BTC), Ethereum (ETH), Bitcoin Cash (BCH): New World Order https://cryptoiq.co/bitcoin-btc-ethereum-eth-bitcoin-cash-bch-new-world-order/ via @_CryptoIQ"
108,201911,balajis,2019-06-22 19:00:02+00:00,1,16,,"Yes, Ethereum is a major technological breakthrough. Concepts like “colored coins” that had been around since the early days of Bitcoin were made feasible by @VitalikButerin and company. Smart contracts also extend a lot of the (originally intended) script features in Bitcoin."
109,201911,balajis,2019-06-20 18:17:20+00:00,2,23,,"For example, China and Russia are sovereign with respect to the US in the sense that they can deter an invasion, but most other countries are not. Similarly, Bitcoin & Ethereum appear to be sovereign with respect to (at least) Venezuela, in that they can defeat seizure attempts."
110,201911,balajis,2019-06-11 22:17:01+00:00,1,4,,"Yes, you can do it today. It’s clunky but 100% possible. You’d incorporate as a smart contract, on the Ethereum chain or one of the newer ones. It would mirror Delaware concepts. You’d receive payments on-chain and pay your employees in the same way (perhaps via stablecoin)."
111,201911,balajis,2019-05-15 04:57:03+00:00,6,53,,Why might DAUs be a non-ideal metric to measure Ethereum? Think about a VC. They may send 50 wires a year. I guess they are a “weekly active user” of the ACH system. But it’s the dollar value of the investments that’s more important than the frequency of use.
112,201911,balajis,2019-05-14 18:46:33+00:00,6,57,,"That is, Bitcoin wasn’t primarily about Paypal-style payment volume. It was about market cap & store of value, concepts outside PayPal. Ethereum similarly may not be about Facebook-style DAUs, but concepts like “ETH locked in defi” for decentralized interest, loans, derivatives."
113,201911,balajis,2019-05-14 18:42:40+00:00,29,148,,"Great bet & article. At the end it makes the same point I would have made. The Horowitz/Salmon bet was on Bitcoin as a payment rail, but it really shined as digital gold. The Song/Lubin bet is on Ethereum for social/mobile-ish dapps, but it may work primarily as a defi platform. "
114,201911,AriDavidPaul,2019-06-04 21:35:14+00:00,0,0,,100% centralized? How do you quantify this and what score do you give bitcoin and ethereum?
115,201911,AriDavidPaul,2019-05-26 18:36:00+00:00,2,50,,"4/ The growth of non-custodial decentralized finance, currently led by the ethereum ecosystem (I own ETH.) Making the “be your own bank” a functional reality."
116,201911,AriDavidPaul,2019-05-15 07:37:15+00:00,0,1,,This same vulnerability (in all phones’ OS) applies to bitcoin and ethereum as well.
117,201911,AriDavidPaul,2019-05-07 20:11:59+00:00,0,2,,"2/ if you don’t want stakeholders to control a system, why are you more comfortable with a smaller set of less aligned actors controlling that system? If you argue ethereum control is kept in check by community, why can’t that apply to a coinvote with the same incentives?"
118,201911,AriDavidPaul,2019-05-07 20:10:17+00:00,0,2,,"Why do you think ethereum’s governance doesn’t suffer from the same flaws you’re criticizing in stockholder governance. Similar flaws, just more extreme arguably. Bitcoin’s effective governance is simply no governance. No hard forks at all, so, nothing to decide."
119,201911,AriDavidPaul,2019-05-07 20:00:49+00:00,0,1,,"Not sure I understand. Are you anti-ethereum now? Doesn’t every version of ethereum governance being discussed, including the status quo suffer from the same problems you object to?"
120,201911,AriDavidPaul,2019-05-02 09:37:54+00:00,0,0,,"Not just programmable value. For example, Bitcoin hasn’t succeeded for small day to day transactions like coffee, at least, yet. Ethereum hasn’t succeeded as a global decentralized computation platform, at least, yet. There’s no “email” equivalent for ethereum...yet."
121,201911,AriDavidPaul,2019-04-25 15:55:19+00:00,0,8,,"All permissioned systems are also sugar free and fat free. Let's advertise ethereum as ""zero trans fats."""
122,201911,AriDavidPaul,2019-04-23 23:47:36+00:00,0,13,,"3/ There's a relatively small number of investors like us putting capital to work, and we mostly all quickly eliminate the same 95% of bad projects as junk. Of the remaining 5%, there's differences of opinion, some allocators like investing in ethereum killers,"
123,201911,AriDavidPaul,2019-04-22 16:29:33+00:00,2,32,,"Ethereum (2.0) is a unicorn. Ambitious, fun, inspiring, and doesn't exist (at least yet)."
124,201911,AriDavidPaul,2019-04-16 02:09:12+00:00,0,14,,"If I ever launch an exchange, I'll first list ethereum, just so I can then delist it as you demand."
125,201911,novogratz,2019-05-08 11:26:52+00:00,236,1553,,I am shocked that @cz_binance even went there. Talk of forking or reorganizing the blockchain is close to heresy. When the ethereum community did it the project was like 5 months old. A baby. Bitcoin now has $100bn market cap and is a legitimate store of wealth. 
126,201911,cburniske,2019-05-09 20:20:40+00:00,4,20,#Ethereum,"12/ Touching upon the idea of ""tokenization,"" I raised quiet signs of momentum amongst traditional asset classes, with a $112M bond quietly being issued by Societe Generale on #Ethereum, and $442M raised in STOs in 2018, up 20x from 2017. "
127,201911,laurashin,2019-05-30 07:37:05+00:00,2,11,,"Hi AP, I’m a journalist who has been covering this space for years. Slight correction: Bitcoin is capitalized when referring to the *network* (not the concept). The currency is lower case. Similarly, Ethereum the network is capitalized; ether the digital currency is lower case."
128,201911,laurashin,2019-05-24 16:29:42+00:00,4,24,,"On today's Unconfirmed, my discussion with Olaf Carlson-Wee of @polychaincap from Consensus! We discuss Ethereum 2.0, his view on the smart contract competition, Facebook's upcoming coin and the future of decentralized autonomous corporations. "
129,201911,laurashin,2019-05-14 18:13:05+00:00,6,28,,"Great episode of Unchained out today! @gavofyork and @jutta_steiner of Parity describe Polkadot, how it aims to solve scalability, interoperability and security, when a developer should build an Ethereum dapp vs. a Polkadot parachain and the frozen funds. "
130,201911,ethereumJoseph,2019-06-25 19:10:30+00:00,29,89,#Ethereum,"Announcing the @ConsenSys Grants Hackathon! 3 days. 5 tracks. $2,000 in prizes. Swing by Bushwick for the weekend and build something cool on #Ethereum. https://pages.consensys.net/consensys-grants-hackathon-new-york"
131,201911,ethereumJoseph,2019-06-20 18:25:45+00:00,68,207,#Ethereum,"The Swiss army knife of #Ethereum data analytics is here. Today, @AlethioEthstats unveiled their new API. Developers now have real-time access to indexed, synthesized, on-chain data that can be implemented into a dApp with surprisingly minimal effort."
132,201911,ethereumJoseph,2019-06-07 17:48:30+00:00,14,31,#blockchain #Ethereum #EtherealNY,"This past @EtherealSummit in Brooklyn was a celebration of #blockchain, art, music, fashion, social good, and just general #Ethereum nerdery. It's impossible to convey all the excitement from the event, but this highlight reel comes close. #EtherealNY"
133,201911,ethereumJoseph,2019-06-07 15:15:04+00:00,112,336,#Ethereum,"This morning, @Forbes reported on @trufflesuite's new partnership with @Microsoft. Now @Azure customers have all the tools at their disposal to build on #Ethereum. "
134,201911,ethereumJoseph,2019-06-06 13:47:29+00:00,16,93,#Ethereum,"Thank you for unfaltering devotion to #Ethereum. The whole ecosystem, but @ConsenSys especially, wouldn't be where it is today without @AndrewDARMACAP and his infectious ambition. Good luck on your next adventure. "
135,201911,ethereumJoseph,2019-06-05 18:38:12+00:00,64,173,#blockchain #Ethereum,"Shoutout to @ethstatus, @cosmos, @storjproject, @AragonProject, and @AugurProject for being the five busiest #blockchain projects on @github in May. The amount of developer activity on #Ethereum right now is truly staggering. "
136,201911,ethereumJoseph,2019-06-03 19:01:02+00:00,40,75,#Ethereum,"A reminder that right now there is a free online course on @ConsenSysAcad for @PegaSysEng's enterprise #Ethereum client, Pantheon. Devs can learn how to install and deploy in less than an hour. https://learn.consensys.net/catalog/info/id:144"
137,201911,ethereumJoseph,2019-05-30 16:38:36+00:00,15,68,#Ethereum #blockchain,"The Solidity programming language, used in #Ethereum smart contract development, is far and away the most popular language used in #blockchain according to a new report from @thenextweb using @StackOverflow data."
138,201911,ethereumJoseph,2019-05-29 16:43:12+00:00,33,70,#blockchain #Ethereum #EtherealTLV,"Thrilled to announce expansion of @EtherealSummit to Tel Aviv on Sept 15. We chose this city for its rich #blockchain ecosystem, and access to talented #Ethereum developers. Contact @avieli &amp; @jesssmithpr for partnership info. See you there! #EtherealTLV https://etherealsummit.com/events/ethereal-tel-aviv/"
139,201911,ethereumJoseph,2019-05-23 15:15:38+00:00,41,79,#Ethereum,"The @Virtue_Poker public beta launches today! Feeling lucky? Sign up for your chance at $30k in prizes, and a shot at the grand prize of entry to the $10k main event. Time to ditch shady, centralized online casinos for demonstrably fair #Ethereum poker. http://bit.ly/VirtueBetaSignUpTwitter"
140,201911,ethereumJoseph,2019-05-21 16:19:17+00:00,14,57,#Ethereum,"Friendly reminder of /r/ConsenSys over on @reddit. Not as all-encompassing as /r/Ethereum, or as exhilarating as /r/EthTrader, but a great way to stay informed on @ConsenSys happenings and discuss the interesting projects we're building on #Ethereum. https://www.reddit.com/r/ConsenSys/"
141,201911,ethereumJoseph,2019-05-20 15:46:25+00:00,62,189,#Blockchain #Bitcoin #Bitcoin #Ethereum,"Teardown of regional search activity for Bitcoin, Ethereum, #Blockchain, and Cryptocurrency from @ConsenSys. #Bitcoin remains dominant in the US, but we see #Ethereum taking over in countries like Taiwan, Japan, South Korea, and Russia. "
142,201911,ethereumJoseph,2019-05-16 19:00:41+00:00,17,69,#Eth2 #Interop #Ethereum,"Talking #Eth2 today at the ‘Road to #Interop’ workshop, hosted by Team Artemis of @PegaSysEng and @BushXGenerator. Right now, @VitalikButerin outlining #Ethereum beacon chain/shard architecture. – at The Bushwick Generator"
143,201911,ethereumJoseph,2019-05-16 15:26:07+00:00,12,41,#CryptoSpring #Ethereum #NYCBlockchainWeek,Reminder that we're having a little #CryptoSpring shindig at the @ConsenSys office tonight in Brooklyn at 6:30pm. @cemozer_ of @PegaSysEng will be giving an overview of #Ethereum 2.0 efforts from an infrastructure perspective. #NYCBlockchainWeek
144,201911,ethereumJoseph,2019-05-11 22:31:03+00:00,76,229,#Ethereum #EtherealNY,The dream has been made real. And we are all in it. Thanks to all who came out to @EtherealSummit this weekend. I’ve never been more excited to see the crazy stuff that’s going be built by the #Ethereum community. We’ll see you at Ethereal 2047. #EtherealNY – at Pioneer Works
145,201911,ethereumJoseph,2019-05-11 21:31:38+00:00,13,31,#Ethereum #EtherealNY,2030. On my walk home from work my AI companion sends an automated transaction to the #Ethereum blockchain for the banana I snagged from a cart. #EtherealNY – at Pioneer Works
146,201911,ethereumJoseph,2019-05-11 21:19:37+00:00,52,117,#Ethereum #EtherealNY,"The year is 2025. The public begins to demand the right to their data, thanks to the ideals instilled by decentralized technologies such as #Ethereum. #EtherealNY – at Pioneer Works"
147,201911,ethereumJoseph,2019-05-10 21:42:46+00:00,62,210,#EtherealNY,"The wait is over! Thanks to @mi_ayako. @ethereum @EFDevcon V Osaka, Japan October 8-11, 2019 https://devcon.org/ #EtherealNY"
148,201911,ethereumJoseph,2019-05-10 20:48:14+00:00,45,77,#Ethereum #EtherealNY,"Packed house here for a forum on layer 1 vs. layer 2 value capture on #Ethereum. All-star lineup: @TusharJain_ cofounder at @multicoincap, @plasma_group’s @jinglanW, @jackoholleran CEO @skalelabs, @ameensol of @SpankChain fame, and moderator @TMacheel from @cheddar. #EtherealNY"
149,201911,ethereumJoseph,2019-05-10 19:27:46+00:00,142,442,#Ethereum #EtherealNY #YearOfTheDAO,"Thrilled to finally reveal that myself, @ConsenSys, @VitalikButerin, and the @Ethereum Foundation are all contributing 1k $ETH each to @MolochDAO. Huge thanks to @ameensol helping to redefine how we fund #Ethereum development. GUILD BANK NOW OVER $1M #EtherealNY #YearOfTheDAO – at Pioneer Works"
150,201911,ethereumJoseph,2019-05-10 17:34:34+00:00,25,97,#EtherealNY,"“My wife then proceeded to run a @CryptoKitties breeding farm for the next two weeks.” @dannyryan, core developer for the @Ethereum Foundation, explains why he is cautious, but optimistic, about the future of decentralization. #EtherealNY – at Pioneer Works"
151,201911,ethereumJoseph,2019-05-10 15:06:53+00:00,16,53,#Ethereum #blockchain,"""#Ethereum is a petri dish full of experiments right now"". @twobitidiot from @MessariCrypto, @tehoban1, @Shaughnessy119 co-founder of @Delphi_Digital, and moderator @CamiRusso share some insight into the #blockchain battle for smart contract dominance."
152,201911,ethereumJoseph,2019-05-10 13:39:43+00:00,7,31,#Ethereum,We’re here at @PioneerWorks_ for the next two days celebrating #Ethereum at @EtherealSummit. @amandagutterman and @JesseGrushack kicking off programming on the main stage right now! – at Pioneer Works
153,201911,ethereumJoseph,2019-05-07 15:52:23+00:00,44,113,#Ethereum,"The @OpenLawOfficial team worked with six leading Canadian law firms to develop innovative legal templates on the #Ethereum blockchain. Smart contracts were used for M&amp;A escrow agreements in indemnification claims, working-capital payouts, and more. "
154,201911,ethereumJoseph,2019-05-06 16:27:09+00:00,47,145,#Blockchain #Ethereum,"The global economy is a hulking behemoth of over $80 trillion in wealth. Unfortunately, that wealth is not returned in ratio-balanced measure to the people who do the hard work. #Blockchain technology like #Ethereum can even the scales and increase access. "
155,201911,ethereumJoseph,2019-05-01 20:49:52+00:00,15,42,#Ethereum,"Congrats to @editionalapp on yesterday's launch! Their new platform allows creators to upload digital art or design directly on their phone, then issue and monetize a set number of editions as unique, collectible NFTs on #Ethereum. "
156,201911,ethereumJoseph,2019-04-30 17:27:27+00:00,143,387,#Ethereum,Presenting the #Ethereum Developer Portal. @ConsenSys threw together a massive collection of resources for getting started with building on Ethereum. 
157,201911,ethereumJoseph,2019-04-30 15:15:15+00:00,14,53,#Ethereum #blockchain,Huge day for the @PegaSysEng team and Enterprise #Ethereum! Pantheon 1.1 marks a big step towards establishing robust privacy solutions desired by companies interested in #blockchain. Don't miss their 'Privacy in Pantheon' webinar today at 3:30pm EST. https://pages.consensys.net/privacy-in-pantheon-webinar
158,201911,ethereumJoseph,2019-04-29 18:36:56+00:00,17,62,#blockchain,AGENDA IS LIVE. Schedule for @EtherealSummit is finalized and will be a nonstop #blockchain blitz. Must-see sessions? Day 1: @mi_ayako with what's next for the @Ethereum Foundation. Day 2: @novogratz is still certain the institutional herd is coming.
159,201911,ethereumJoseph,2019-04-25 15:33:37+00:00,108,275,#Ethereum,This monster list of #Ethereum apps got a big update yesterday. @Dharma_HQ bodied Lightning Network last week. Huge @airswap update coming TODAY. @AlethioEthstats with the sleekest block explorer in the game. @opera &amp; @brave winning the web3 browser war.
160,201911,ethereumJoseph,2019-04-17 17:05:49+00:00,142,396,#blockchain #Ethereum,TL;DR - The big players are joining the party. The new @Forbes list of 50 billion-dollar companies exploring #blockchain foreshadows the explosion of enterprise #Ethereum adoption we will see in 2019. 
161,201911,ethereumJoseph,2019-04-09 21:33:53+00:00,42,100,#Ethereum,Some key takeaways from my talk this week at @Deconomy_forum. Laid down my argument for why I believe #Ethereum will emerge as the global settlement layer of the natively-digital economy. 
162,201911,cryptomanran,2019-06-19 21:32:40+00:00,9,75,,I bet all my Ethereum that this will be delayed.... 
163,201911,cryptomanran,2019-05-23 19:49:23+00:00,3,18,,I’d love to hear opinions here. Real opinions from people that understand. Could this be an “upgraded” Ethereum with Vlad involved? 
164,201911,cryptomanran,2019-05-13 19:36:47+00:00,14,52,,Bang! NYC Blockchain week pump! Here is our coverage! @Travis_Kling how we got here-what happens next @TusharJain_ is he buying Ethereum? @ethereumJoseph the shift to POS @cburniske the possibility $1Trillion! 5 ways to make money holding Crypto https://www.youtube.com/watch?v=-mgPpyO-kQA&amp;feature=youtu.be
165,201911,cryptomanran,2019-05-06 17:15:14+00:00,23,271,,"Today, just for the next few hours, I’m an Ethereum maximalist... after that I will go back to being XRP and Facebook coin maximalist! "
166,201911,cryptomanran,2019-04-18 01:10:12+00:00,3,36,,I sat with @CamiRusso today and heard a little about the book she is writing about Ethereum. I didn’t realize how much drama there was in Ethereum. It’s going to be an amazing book and maybe a better movie! 
