,period,username,date,retweets,favorites,hashtags,text
1,201911,justinsuntron,2019-06-25 05:29:43+00:00,376,456,#TRON #Ethereum #ERC20 #TRX,"Exactly one year ago, #TRON celebrated its independence day. On June 25, 2018, TRON moved off #Ethereum as an #ERC20 token, launched the TRON mainnet and generated the first genesis block. I am as deeply moved today as I was a year ago. #TRX $TRX https://medium.com/@Tronfoundation/tron-independence-day-a-letter-to-the-community-3b3526fa6c65"
2,201911,justinsuntron,2019-06-24 11:27:56+00:00,267,336,#TRON #Ethereum #TRX,TRON Weekly Report 1. Improved demo on network log collection function. 2. Odyssey-V3.6 is Officially Released. 3. #TRON has caught up with #Ethereum's daily cumulative transactions in just 1 year. #TRX $TRX
3,201911,justinsuntron,2019-06-20 02:41:22+00:00,88,265,#TRON #TRX,"TRONGrid provides an API interface into the #TRON Network. Similar to Infura on the Ethereum platform, TRONGrid provides TRON clients running in the cloud, so you don’t have to run one yourself to work with TRON. Check more below. #TRX $TRX"
4,201911,justinsuntron,2019-06-17 03:05:33+00:00,67,239,#TRON #DApp #TRON #EOS #Ethereum #TRX,#TRON #DApp Weekly Report: #TRON continues to loom over #EOS and #Ethereum. #TRX $TRX https://ambcrypto.com/tron-dapp-weekly-report-justin-suns-crypto-continues-to-loom-over-eos-and-ethereum/
5,201911,justinsuntron,2019-05-29 08:14:17+00:00,88,350,#TRON #blockchain #Ethereum #TRX,This guide presents the comparison that developing smart contracts on the #TRON #blockchain is vastly less expensive than #Ethereum and similar protocols in a user-friendly format. #TRX $TRX
6,201911,justinsuntron,2019-05-24 07:24:55+00:00,111,258,#Ethereum #TRON #TRX,"For users wishing to deploy existing #Ethereum solidity contracts onto the #TRON network, there are some key differences to look for: Units of Currency and User Pay Ratio. #TRX $TRX"
7,201911,justinsuntron,2019-05-19 06:58:43+00:00,168,499,#TRON #Ethereum #EOS #TRON #TRX,#TRON Posts Personal Bests in Surpassing Transaction Volumes of #Ethereum and #EOS. #TRON has performed exceptionally well especially at the decentralized application hosting front. #TRX $TRX
8,201911,justinsuntron,2019-05-14 20:24:02+00:00,155,490,#TRX #ETH #TRON #ethereum,.@ethereumJoseph We should have a friendly bet too! Bet 1 million USD equivalent #TRX or #ETH on whether #TRON will have more active users on Dapp platform than #ethereum at the end of 2019! Or I am happy to donate to @BinanceBCF too! 
9,201911,justinsuntron,2019-05-14 09:09:32+00:00,165,399,#TRON #Ethereum #EOS #TRX,"The total transaction volume on #TRON was very impressive in Q1. It once surpassed $91 million on March 15, which was way beyond the historical highest record of #Ethereum and #EOS dapps. #TRX $TRX"
10,201911,justinsuntron,2019-04-21 21:49:17+00:00,274,647,#TRON #USDT #Ethereum #USDT #TRX #BTT,"#TRON now occupies 2% of total #USDT supply, 50 million out of 2.5 billion. Goal for Q2 2019: Surpass #Ethereum &amp; achieve 10%. We will reach 50% of #USDT in 2019! Check here: https://wallet.tether.to/transparency #TRX $TRX #BTT $BTT"
11,201911,justinsuntron,2019-04-15 09:59:48+00:00,241,551,#TRON #Ethereum #TRX,#TRON mainnet crosses 2.5 million accounts; beats #Ethereum with 8 million blocks since launch. #TRX $TRX https://ambcrypto.com/tron-trx-mainnet-crosses-2-5-million-accounts-beats-ethereum-eth-with-8-million-blocks-since-launch/
12,201911,justinsuntron,2019-04-15 05:04:10+00:00,172,395,#TRON #Bitcoin #Bitcoin #Ethereum,#TRON Overcomes #Bitcoin and #Ethereum in Transaction Volume. 
13,201911,officialmcafee,2019-05-15 18:03:02+00:00,3,77,,Aha!!!! Mimicking the God of Ethereum. That explains it.
14,201911,officialmcafee,2019-05-15 17:09:40+00:00,339,3169,,"Folks asking my opinion of Ethereum: Well . . .. Frankly, I prefer one syllable coins and am not fond of Ethereum's spelling. Additionally, many of my friends who hold Ethereum dress oddly. And, of course, Buterin looks underfed to me. But do not take this as investment advice."
15,201911,officialmcafee,2019-05-15 17:03:22+00:00,3,6,,"I prefer one syllable coins and have never been fond of Ethereum's spelling. Additionally, many of my friends who hold Ethereum tend to dress oddly. And, of course, Buterin looks underfed to me. On the positive side, Ethereum wallets tend to have great names."
16,201911,fredwilson,2019-05-19 16:09:41+00:00,0,4,,"""The focus on a smaller number of higher value players fits with where Ethereum is right now in its scaling efforts."" that is from my post"
17,201911,cdixon,2019-05-16 02:25:22+00:00,4,78,,I'm applying to the @HumanityDAO registry! My Ethereum address is 0x70c7579431ee5e7b55e1bb57f0b6d7a65c1e6e6e
18,201911,aantonop,2019-06-18 10:19:08+00:00,17,67,,"No, it's not going to be a challenger to Ethereum. Libra will not ( and cannot) be open to any participant, nor can it offer ""unstoppable code"". It will be a stoppable-code, vetted-validator, vetted-participant system. It does not compete with any open public blockchain"
19,201911,aantonop,2019-06-05 16:46:05+00:00,50,140,,Ethereum Q&amp;A: Stablecoins and DAI 
20,201911,aantonop,2019-05-18 19:46:45+00:00,43,112,,"Ethereum Q&amp;A: ""Blockchain all the things"" "
21,201911,aantonop,2019-05-14 22:31:54+00:00,32,84,,Ethereum Q&amp;A: What is an archival node? 
22,201911,aantonop,2019-05-05 15:00:51+00:00,35,82,,Ethereum Q&amp;A: Developer compensation and performance indicators 
23,201911,aantonop,2019-04-05 17:00:58+00:00,22,51,,Ethereum Q&amp;A: Governance and setting bad precedent 
24,201911,cz_binance,2019-06-13 01:36:44+00:00,9,89,,Congrats!
25,201911,cz_binance,2019-04-18 13:25:19+00:00,42,276,,"Thanks for the nice article! But almost too supportive. lol. @Binance_DEX does not challenge Ethereum, it doesn't even have smart contracts. It challenges ourselves, exchanges. :)"
26,201911,ErikVoorhees,2019-06-20 18:05:25+00:00,8,34,#bitcoin #bitcoin #ethereum #crypto #blockchain,The history of exchange hacks: How Much Could ‘Convenience’ Cost You? by @ShapeShift_io https://link.medium.com/hgMcXInrFX #bitcoin #ethereum #crypto #blockchain
27,201911,ErikVoorhees,2019-06-05 14:55:30+00:00,13,42,#bitcoin #bitcoin #ethereum #crypto #blockchain,An Open Letter to KeepKey Users https://link.medium.com/JxPjDSWCfX @ShapeShift_io @cryptokeepkey #bitcoin #ethereum #crypto #blockchain
28,201911,ErikVoorhees,2019-05-28 13:52:38+00:00,125,490,#bitcoin #bitcoin #ethereum #crypto,"Kin establishes $5 million http://DefendCrypto.org fund to take on the SEC. Support from @coinbase, @Circle, @MessariCrypto, @ShapeShift_io, @fredwilson and others. #bitcoin #ethereum #crypto"
29,201911,ErikVoorhees,2019-05-23 18:45:08+00:00,31,107,,Grayscale to Open Ethereum Trust to Individual Investors 
30,201911,ErikVoorhees,2019-05-21 02:59:34+00:00,72,211,,"Demystifying Cosmos: Atomic Swaps, Ethereum, Polkadot and the Path to Blockchain Interoperability by @mrjasonchoi https://link.medium.com/jBlO5M1XQW @cosmos"
31,201911,ErikVoorhees,2019-05-20 20:34:44+00:00,0,10,#crypto #finance #blockchain #bitcoin #bitcoin #ethereum,Android: https://play.google.com/store/apps/details?id=io.coinCap.coinCap iOS: https://itunes.apple.com/us/app/coincap/id1074052280?mt=8 #crypto #finance #blockchain #bitcoin #ethereum
32,201911,ErikVoorhees,2019-05-20 16:26:18+00:00,13,43,#bitcoin #bitcoin #ethereum #blockchain,Bitcoin Lockup - ShapeShift's Brand New Platform - Review (2019) https://bitcoinlockup.com/shapeshifts-brand-new-platform-review-2019/ #bitcoin #ethereum #blockchain @shapeshift_io
33,201911,ErikVoorhees,2019-05-14 21:41:19+00:00,262,912,#bitcoin #bitcoin #ethereum #blockchain #finance,Bloomberg Video: Crypto Is Taking Over the World: ShapeShift CEO #bitcoin #ethereum #blockchain #finance
34,201911,ErikVoorhees,2019-05-13 21:06:11+00:00,180,502,#bitcoin #bitcoin #ethereum,"Bitcoin Comes to Whole Foods, Major Retailers in Coup for Digital Currency http://fortune.com/2019/05/13/bitcoin-comes-to-whole-foods-major-retailers-in-coup-for-digital-currency/?utm_source=twitter.com&amp;utm_medium=social&amp;utm_campaign=social-share-article #bitcoin #ethereum"
35,201911,ErikVoorhees,2019-05-08 00:04:06+00:00,122,376,#DeFi,"Bitcoin showed how money and payments will be taken away from banks. Ethereum and the #DeFi phenomenon is showing how loans will be taken away from banks. Equities, derivatives, trading and exchange... financial services broadly are being pulled toward crypto. It won't stop."
36,201911,ErikVoorhees,2019-05-06 19:09:37+00:00,7,31,#bitcoin #bitcoin #ethereum #dash #monero #litecoin,"The new CoinCap v2 app is now live for Android... dark mode, watchlist, and as always, the best real-time market data for cryptocurrency. https://play.google.com/store/apps/details?id=io.coinCap.coinCap @CoinCap_io #bitcoin #ethereum #dash #monero #litecoin"
37,201911,ErikVoorhees,2019-04-26 14:55:03+00:00,7,25,#bitcoin #bitcoin #ethereum #crypto #blockchain,"ShapeShift Stories - Sharing our newest education, news, and inspiration. https://medium.com/shapeshift-stories #bitcoin #ethereum #crypto #blockchain @ShapeShift_io"
38,201911,ErikVoorhees,2019-04-22 20:13:50+00:00,10,36,#bitcoin #bitcoin #ethereum,A Letter to KeepKey hardware wallet users... cheers! https://signup.shapeshift.com/keepkeyclient/?utm_source=KKclient_letter @cryptokeepkey @ShapeShift_io #bitcoin #ethereum
39,201911,ErikVoorhees,2019-04-16 18:20:20+00:00,17,47,#bitcoin #bitcoin #ethereum #crypto #blockchain,How crypto merchant payments and ecommerce will work in the near future (works across all chains): FIO E-Commerce Demonstration https://youtu.be/GHSaikgL3O8 @joinFIO #bitcoin #ethereum #crypto #blockchain
40,201911,ErikVoorhees,2019-04-15 02:08:34+00:00,6,31,#bitcoin #bitcoin #ethereum #blockchain #crypto,"For realtime crypto market data, without annoying ads: https://coincap.io/ #bitcoin #ethereum #blockchain #crypto (also transparent data methodology: https://coincap.io/methodology)"
41,201911,ErikVoorhees,2019-04-10 21:40:43+00:00,33,138,#bitcoin #bitcoin #ethereum #crypto,"As Spring arrives, and the cold winter thaws, the new ShapeShift emerges from the soil... https://signup.shapeshift.com/?mwr=8589-8d8d274f Invites going out weekly. #bitcoin #ethereum #crypto"
42,201911,APompliano,2019-06-07 12:54:10+00:00,24,125,,"New episode live with @CamiRusso! We discuss how she discovered BTC while covering Argentina's financial markets, how journalists view crypto today, why she is writing the book on Ethereum, and what stories she has learned along the way. Listen &amp; learn! "
43,201911,APompliano,2019-05-27 18:12:44+00:00,1,6,,"Bitcoin since inception outperformed Ethereum since inception. Doesn’t mean that will be true forever, but that’s the current state of returns"
44,201911,APompliano,2019-05-23 13:29:27+00:00,449,2001,,BREAKING: @GrayscaleInvest’s Ethereum Trust has been approved by FINRA for retail investors. Another step in the right direction for increasing access 
45,201911,APompliano,2019-05-17 11:53:43+00:00,47,199,,New episode live with @preston_vanloon where we discuss: - testing frameworks - working at Google - blockchain scalability - Ethereum 2.0 - sharding - Ethereum Foundation Grants - Prysmatic Labs. This one was fun. Listen and learn! 
46,201911,APompliano,2019-05-11 00:33:22+00:00,3,10,,"ZCash, Monero, and Ethereum right now. Read this too: "
47,201911,APompliano,2019-05-11 00:26:58+00:00,0,4,,"ZCash, Ethereum, Monero now and Bitcoin coming soon."
48,201911,APompliano,2019-05-01 01:19:26+00:00,0,4,,Which one? The one where he said Ethereum or “jk?” (I’m kidding!)
49,201911,APompliano,2019-04-30 04:32:52+00:00,183,2350,,"Elon you want to come on the podcast to talk about why you’re so excited about Bitcoin, Ethereum and crypto? Know you’re busy building 2 of the most important companies in the world so I’ll fly to you to get it done."
50,201911,APompliano,2019-04-18 22:44:13+00:00,425,2267,,"Blackstone, a single asset manager, has raised $126 billion in new money in the last 12 months. That is more than the market caps of Bitcoin and Ethereum combined. We are so early. Be patient."
51,201911,APompliano,2019-04-13 12:28:50+00:00,684,2763,,This week in crypto: 1. Bitstamp granted Bitlicense 2. PewDiePie now on DLive platform 3. Dharma live on Ethereum 4. Lawmakers seek crypto tax clarity 5. Coinbase launch crypto debit card 6. Blockstack files for $50M Reg A+ 7. Bitcoin still not dead :) The virus is spreading 
52,201911,maxkeiser,2019-06-24 13:49:15+00:00,4,14,,"Forget Worthless Ethereum Co-Founder Lubin, Read Max Keiser’s Comments On Facebook’s Libra To Understand What’s Going On. "
53,201911,maxkeiser,2019-05-27 00:33:14+00:00,14,63,,"Bitcoin (BTC) At $28,000 Still In Play, Max Keiser Asserts Amid Market Surge – Ethereum World News https://ethereumworldnews.com/?p=43365 via @EtherWorldNews"
54,201911,maxkeiser,2019-05-15 12:50:03+00:00,10,52,,Bitcoin (BTC) Bull Max Keiser Believes Institutionalised 'Fomo' Will Lead to Bigger Market Moves – Ethereum World News 
55,201911,maxkeiser,2019-05-04 17:41:21+00:00,0,6,,Ethereum.
56,201911,maxkeiser,2019-04-15 11:55:08+00:00,31,80,,"Max Keiser Says Countries Will Mine Bitcoin in a 'Frantic, Wild Orgy of Hashing', Plus Ripple and XRP, Ethereum, Tron, Litecoin, IOTA: Crypto News Alert "
57,201911,maxkeiser,2019-04-10 18:35:18+00:00,4,4,,"Max Keiser Bares Fangs, Challenges Bitcoin Naysayers With Digital Gold Argument – Ethereum World News https://ethereumworldnews.com/?p=33205 via @EtherWorldNews"
58,201911,maxkeiser,2019-04-03 12:58:09+00:00,6,13,,Max Keiser: Bitcoin (BTC) Is The Currency Of Global Revolution – Ethereum World News 
59,201911,lopp,2019-06-19 07:53:14+00:00,0,1,,"Ethereum stores transactions in blocks that have a parent hash (back link) while it seems that the ""blocks"" on the Libra network are ephemeral and not actually stored as a backlinked data structure. I wonder if the code for this logic is available, it may be more clear."
60,201911,VentureCoinist,2019-05-16 02:45:13+00:00,11,107,,Ethereum 
61,201911,TuurDemeester,2019-06-24 20:22:50+00:00,5,20,#Ethereum,"""Using the latest Geth client prevents your node from falling behind"" => imo losing forward compatibility will result in an ever decreasing number of nodes (older nodes stop being relevant for validation) => #Ethereum network becomes ever more centralized "
62,201911,TuurDemeester,2019-06-19 00:04:47+00:00,78,282,,“Sounds like Facebook has not solved any of the massive problems that Ethereum has been working on for years.” - @lopp
63,201911,TuurDemeester,2019-06-11 20:47:54+00:00,24,96,,".@HASHCIB's report ""Ethereum: Running out of Gas"" is well worth the read. "
64,201911,TuurDemeester,2019-06-06 21:20:03+00:00,5,15,,Ethereum. Thread: https://twitter.com/nicksdjohnson/status/1136459320877637633?s=19
65,201911,TuurDemeester,2019-06-03 00:44:23+00:00,77,263,,"How is Ethereum 2.0's ""Beacon Chain"" different from a sidechain? And if it's not, then why not use Bitcoin's blockchain as Anchor Layer? Afaik BTC is by all measures superior in terms of stability, security, and decentralization. https://media.consensys.net/state-of-ethereum-protocol-2-the-beacon-chain-c6b6a9a69129"
66,201911,TuurDemeester,2019-05-22 02:02:44+00:00,1,6,,"Long term, the market is a weighing machine. If, relative to Bitcoin, Ethereum still grows and thrives a decade from now, that'll probably mean my current analysis is overlooking some important pieces of information."
67,201911,barrysilbert,2019-06-17 15:40:04+00:00,49,175,,"Excited to announce our investment in @LivepeerOrg, as well as the addition of the $LPT token to DCG's conviction list of digital asset investments, alongside the following: Bitcoin $BTC Ethereum Classic $ETC Zcash $ZEC Decentraland $MANA Horizen $ZEN"
68,201911,barrysilbert,2019-06-11 00:35:36+00:00,84,306,,Ethereum Classic to Accelerate 'Greater Collaboration' with Ethereum 
69,201911,barrysilbert,2019-05-31 16:32:48+00:00,15,55,,Grayscale's Ethereum Trust: Adding Validity To Cryptocurrencies? via @Investingcom
70,201911,barrysilbert,2019-05-29 19:24:20+00:00,15,76,,Ethereum Fund To Trade On OTC Market via @FAmagazine
71,201911,barrysilbert,2019-05-23 22:46:52+00:00,41,186,,Grayscale Gets Regulatory Nod From FINRA for Ethereum Trust to Trade on OTC Markets https://cointelegraph.com/news/grayscale-gets-regulatory-nod-from-finra-for-ethereum-trust-to-trade-on-otc-markets via @cointelegraph
72,201911,barrysilbert,2019-05-23 17:16:43+00:00,23,76,,Grayscale Widens Net for Ethereum Investors with Trust’s FINRA Approval https://news.yahoo.com/grayscale-widens-net-ethereum-investors-163552741.html?soc_src=hl-viewer&amp;soc_trk=tw via @YahooNews
73,201911,barrysilbert,2019-05-23 16:27:11+00:00,109,413,,Grayscale Ethereum Trust opens to Mom and Pop https://www.bloomberg.com/news/articles/2019-05-23/grayscale-to-open-ethereum-trust-to-individual-investors via @technology
74,201911,barrysilbert,2019-05-23 13:43:36+00:00,162,522,,Grayscale Investments Announces Approval of Public Quotation for Eligible Shares of Grayscale Ethereum Trust https://on.mktw.net/2M8fa7I
75,201911,ToneVays,2019-06-15 08:23:52+00:00,0,5,,"If the Ethereum Foundation does not like your project they will reverse the transaction. theDAO proved this. Also no one build a full node so in a few years , it's possible that single company has all the historical data and validate all transactions. It's a Centralized Company!"
76,201911,ToneVays,2019-06-15 07:10:34+00:00,29,316,,"You do know that Bitcoin is not a Company right? People build things on it! Ethereum, Ripple, EOS, Tron, Tezos, Cordano, etc are Companies w/ founders, CEO's, Investors, Security Sales, Dividends (aka PoS rewards) &amp; all the rest, so you need centralized permission to build on em"
77,201911,ToneVays,2019-05-31 23:17:46+00:00,0,0,,"Financial Transection are Censored & Confiscated, Smart Contracts are not, if you can't comprehend this please put all your money in Ethereum and go broke so you can't afford internet in the future and we won't see your messages anymore"
78,201911,ToneVays,2019-05-31 21:55:02+00:00,0,3,#ethereum,And don't forget the dumb assumption of #ethereum being immutable 
79,201911,ToneVays,2019-05-30 19:23:53+00:00,0,0,#Ethereum,"""based on my understanding...""He clearly does not understand #Ethereum if anyone smart actually explains it him he will take back that dumb statement."
80,201911,ToneVays,2019-05-29 15:59:12+00:00,0,3,,"Of course, but more than half the crypto space is more interestedin HODLING Ripple and Ethereum"
81,201911,ToneVays,2019-05-25 09:42:49+00:00,0,8,#ethereum #Ripple,Why does everyone forget about #ethereum $ETH &amp; #Ripple $XRP 
82,201911,ToneVays,2019-05-15 14:56:22+00:00,7,62,#Consensus19 #Bitcoin #Bitcoin #Ethereum,"LIVE form #Consensus19 w/ @jimmysong to talk about his #Bitcoin vs #Ethereum bet w/ @ethereumJoseph, keep an eye on the $BTCUSD Charts &amp; interview unsuspected victims walking by :)"
83,201911,ToneVays,2019-05-03 01:30:30+00:00,0,0,,"Fuck off dude, 99% of the companies in this space are scams Bitfinex and tether are not bigger than Ethereum or EOS or many others i go after, why don't you get a following and help about instead of bitching at me to do everything for you"
84,201911,ToneVays,2019-04-27 18:55:53+00:00,29,300,#Bitcoin #Bitcoin #Unconfiscatable #Tether #Ripple #Ethereum,"This aged well -------------- Why was it so hard to understand #Bitcoin's greatest asset! it's #Unconfiscatable by being Trustless and Decentralized (from Nodes, to Miners to Development). #Tether $USDT, #Ripple $XRP, #Ethereum $ETH &amp; the rest are NOT"
85,201911,ToneVays,2019-04-20 20:54:32+00:00,0,1,,Do you think Vitalik is smarter than Burnie Madoff?
86,201911,ToneVays,2019-04-20 01:56:43+00:00,0,21,#ethereum,"I agree, they are not 'all scammers' most of them are just Stupid and are not very good developers, or they would have actual jobs and/or be useful to society. I report my uncle who has been a truck driver for 40 years more than any #ethereum developer. He helps society."
87,201911,ToneVays,2019-04-19 20:36:27+00:00,0,9,#EthereumClassic #Ethereum,"Believing in #EthereumClassic is actually worse than believing in #Ethereum, it has all of the same downside as $ETH but More Centralized, Less Secure &amp; NO ONE uses it... The Moral Argument of being 'original shitcoin' is fun, but pretty much stupid at this point cause $ETC Lost!"
88,201911,ToneVays,2019-04-18 17:08:07+00:00,0,2,#Ethereum #CryptoScam,"I have 3 episodes about #Ethereum in the #CryptoScam series, look for the playlist on my youtube"
89,201911,ToneVays,2019-04-18 16:49:15+00:00,2,11,#Bitcoin #Bitcoin #Ethereum #Ethereum,ANY REPLY TO THIS ANSWER GETS YOU BLOCKED for wasting my time 1. #Bitcoin sidechains support smart contracts 2. No one needs decentralized smart contracts unless they are so illicit i can't even say what they do here 3. #Ethereum Can't Scale 4. #Ethereum is Centralized
90,201911,ToneVays,2019-04-18 16:40:45+00:00,0,16,#CryptoScam #Ethereum #Shitcoin,"You must be new here, are you not familiar with the #CryptoScam Series, there have 3 episodes about #Ethereum being a #Shitcoin:"
91,201911,ToneVays,2019-04-10 08:43:37+00:00,8,97,#Bitcoin #Bitcoin #Ethereum,"Pure Bullshit by @RichardHeartWin, this is why CT is such a time drain. There was never a central entity to give away #Bitcoin, a few early adopters did. #Ethereum on the other hand gave away ~20% of the initial 72 Million $ETH, the founders of the scam printed it for themselves."
92,201911,ToneVays,2019-04-10 08:40:25+00:00,2,56,#Bitcoin #Bitcoin #Ethereum,"#Bitcoin never gave away coins, that is pure bullshit on your part. #Ethereum on the other hand have away 40% of the initial 72 Million $ETH the founders of the scam printed it for themselves."
93,201911,adam3us,2019-06-21 14:35:21+00:00,0,8,,"Just that he's prone to magical thinking and suckering people with mumbo jumbo into ""investing"" in things which any due diligence would reject as laughable. Now he's doubling down on dumb things. Similarly, many ethereum issues were predicted before a line of code was written."
94,201911,adam3us,2019-04-23 07:00:10+00:00,0,12,,"Effectively this has been tried multiple times & empirically found to fail. You can see why: if people have institutional will issues investing in infra *even when fees are high*, what chance is there when fees are low. That way lies gigabyte blocks and ethereum scaling failure."
95,201911,CharlieShrem,2019-06-25 19:51:34+00:00,13,52,,A few years ago Ethereum launched a naming service where instead of long addresses you could transact with addresses like charlie.ens. Why has adoption been so slow and why are all blockchains not using it? Listen to a new http://UntoldStories.com where I discuss with @tayvano_
96,201911,CharlieShrem,2019-06-14 17:30:46+00:00,2,10,,"You just described a benefit not a negative ! Multiple layers don’t degrade the security, it increases it. Can you have everything on one layer it increases attack vectors, as we saw multiple times with Ethereum."
97,201911,CharlieShrem,2019-06-14 17:15:28+00:00,3,23,,2/ C. @VitalikButerin originally wanted to put Ethereum on the Bitcoin blockchain because of its security. Creating multiple layers was proven to be a better idea as we saw with the multiple Ethereum problems- 
98,201911,CharlieShrem,2019-06-04 12:58:07+00:00,3,12,,"NEW http://UntoldStories.com with @brandon_goldman! Why Tether was the sacrificial goat of Bitfinex Bitcoin requires blind faith, like religion The Dead Sea Scrolls related to Bitcoin Cash? How the price of Ethereum saved Brandons health in 2014! "
99,201911,CharlieShrem,2019-05-31 13:13:58+00:00,5,17,,Ethereum (ETH): The Awakening https://cryptoiq.co/ethereum-eth-the-awakening/ via @_CryptoIQ
100,201911,CharlieShrem,2019-05-29 14:26:30+00:00,23,118,#Ethereum #Bitcoin #Bitcoin,Did you know @VitalikButerin originally wanted to put #Ethereum on the #Bitcoin blockchain? How was ETH formed and why will @VladZamfir be written in the history books next to Vitalik and Satoshi? I talk about these things on yesterdays episode of http://UntoldStories.com !
101,201911,CharlieShrem,2019-05-28 13:14:50+00:00,6,13,#Ethereum #Ethereum #Bitcoin #Bitcoin,"New episode of http://UntoldStories.com! #Ethereum cofounder @stevennerayoff about how @VitalikButerin originally tried to put #Ethereum on the bitcoin blockchain, where ""utility token"" came from and buying #Bitcoin at gunpoint! Subscribe! https://apple.co/2wqlg8O"
102,201911,CharlieShrem,2019-05-27 19:50:13+00:00,12,57,#UntoldStories #Ethereum,"I'm stoked about tomorrows episode of #UntoldStories. I talk to one of the #Ethereum founders, the architect of the ""utility token"" and why he hates that term. Some crazy stories will reshape what you think happens behind closed doors! Subscribe at http://UntoldStories.com !"
103,201911,CharlieShrem,2019-05-15 17:29:55+00:00,10,38,,Ethereum (ETH) and Ripple (XRP): Bullish Chain Reaction 
104,201911,CharlieShrem,2019-05-07 14:13:23+00:00,4,12,,"Market Analysis: Bitcoin (BTC) Climbs $100, Ethereum (ETH) Jumps 7% on Futures News, Rest of Crypto Market Mixed https://cryptoiq.co/market-analysis-bitcoin-btc-climbs-100-ethereum-eth-jumps-7-on-futures-news-rest-of-crypto-market-mixed/ via @_CryptoIQ"
105,201911,CharlieShrem,2019-04-18 13:51:50+00:00,1,7,,"Alt Reason: Ethereum (ETH), Binance (BNB), and Polymath (POLY) https://cryptoiq.co/alt-reason-ethereum-eth-binance-bnb-and-polymath-poly/ via @_CryptoIQ"
106,201911,CharlieShrem,2019-04-11 17:09:22+00:00,6,14,,"Bitcoin (BTC) Futures, S&P (SPX), VIX, Ethereum (ETH): What Foreshadows What https://cryptoiq.co/bitcoin-btc-futures-sp-spx-vix-ethereum-eth-what-foreshadows-what/ via @_CryptoIQ"
