,period,username,date,retweets,favorites,hashtags,text
226,201924,AriDavidPaul,2019-11-15 15:12:11+00:00,0,2,,"That’s why the analogy works. Modern armies don’t fear handguns, they fear the need to fight against the citizenry in combat. Similarly, if you fork the majority of passionate bitcoin users and holders off your miner network, you might realize you’re destroying a lot of value."
227,201924,AriDavidPaul,2019-11-15 10:57:31+00:00,0,0,,"2/ even if we don’t think that such a fork would be viable, the threat of a serious attempt and its resulting economic loss throughout bitcoin related assets is a deterrent."
228,201924,AriDavidPaul,2019-11-14 18:06:22+00:00,1,8,,Cheez whiz is the next bitcoin.
229,201924,woonomic,2019-11-21 23:53:57+00:00,5,85,,"Because users need a reason to use it. Bitcoin has had two killer apps: get high quick, and get rich quick. LN doesn't solve a present day need. Timing is everything."
230,201924,woonomic,2019-11-21 23:23:40+00:00,2,40,,Bitcoin keeps going no matter how times it dies. Viral outbreaks are nasty. 
231,201924,woonomic,2019-11-20 19:21:11+00:00,1,7,,In that case Bitcoin aims to democratise but we aren’t there yet. Got more Internet to role out and simpler ways to explain and experience it. Time to roll up our sleeves.
232,201924,woonomic,2019-11-19 13:53:55+00:00,19,174,,Bitcoin sovereignises offshore banking. It’s not like we take a vote on who gets to decide whether my tx goes through. I’m in charge with my private key. 
233,201924,woonomic,2019-11-18 18:31:06+00:00,3,28,,"Dear sir, we are unbanking you because we suspect you are doing something naughty. Probably dabbling in that money launching tech I don't understand called Bitcoin. Therefore we must exit this business arrangement. Even if you will be the next richest 1% on the planet. Dammit"
234,201924,woonomic,2019-11-18 09:14:52+00:00,0,2,,"I tried to keep away from derivative and bond markets, I could see these recreated and fractionally backed by Bitcoin like hard asset markets already are today with Real Estate and Gold."
235,201924,woonomic,2019-11-18 03:48:11+00:00,1,4,,"I keep it simple for normies. Bitcoin is always the gateway. Ethereum is optimised for smart contracts while Bitcoin is optimised for store of value. That does not make it more advanced, just more vulnerable. SoV in Ethereum is a secondary halo effect."
236,201924,woonomic,2019-11-18 02:40:40+00:00,15,148,,"The 10,000 year view of Bitcoin. "
237,201924,woonomic,2019-11-18 02:40:39+00:00,4,100,,Tweet References: Bitcoin is the invention of an internet-native digital scarcity. 
238,201924,woonomic,2019-11-18 02:40:37+00:00,5,154,,"After that, they'll usually ask about buying some Bitcoin. I think my hit rate is +90%. You may at this point warn them to avoid fake Bitcoins until they know exactly what they are, i.e. BCH and BSV. I say this in case they start going to bitcoin dot com by mistake."
239,201924,woonomic,2019-11-18 02:40:37+00:00,19,189,,"As the Bitcoin asset class inflates with value, it has outperformed every other asset class for its entire 10 year history. Under the lens of ROI adjusted for risk, it's as performant today as it was in 2009, you haven't missed the boat. "
240,201924,woonomic,2019-11-18 02:40:29+00:00,60,378,,"Here's some buckets that people store value in: Gold: $8T Stocks: $75T Fiat: $90T Real Estate: $220T And now, we can store value online... Bitcoin: $150B We are in a post-industrial Internet age. Bitcoin is growing from being a thimble to a bucket."
241,201924,woonomic,2019-11-18 02:40:28+00:00,71,393,,"Bitcoin is the first invention of something on the Internet that cannot be copied. When something is scarce, it can store value, fine art and gold are some examples."
242,201924,woonomic,2019-11-18 02:40:28+00:00,510,1367,,How I explain Bitcoin to normies...
243,201924,woonomic,2019-11-16 13:48:39+00:00,36,226,,"HODLers who want to store value in Bitcoin gives it value. Liquidity determines whether they can get in and out. The more liquidity it has, the greater the number of rich people it can serve. The rich are last in its maturity cycle. "
244,201924,woonomic,2019-11-16 07:59:03+00:00,4,78,,"Lol. Now you’re arguing on my side. Bitcoin was first generation growth of a forest, Ethereum is second stage after the undergrowth was put in. Second stage growth should be much faster. Being young is no excuse for lack of liquidity."
245,201924,woonomic,2019-11-16 03:47:00+00:00,65,318,,"Bitcoin has withstood economic and technical attacks for 10yrs, while it exploits vulnerabilities in real world markets. "
246,201924,woonomic,2019-11-13 08:34:08+00:00,1,34,,He’s mistaken. Banks are not yet using Bitcoin. 
247,201924,woonomic,2019-11-13 05:45:38+00:00,3,113,,"So is Tether, EOS, Bitcoin Cash, Neo and Ethereum is also very young. My point being all coins ride on Bitcoin’s Halo Effect, so being young is no excuse. It’s a different time in the industry than 2012."
248,201924,cburniske,2019-11-18 10:51:38+00:00,0,4,,"Bitcoin as a community can lean into things, and *should* do so. Doesn’t require a company, CEO, or VCs. I, as part of that community, always have, including the decision to incorporate $BTC into the first public funds @ARKInvest in 2015."
249,201924,cburniske,2019-11-17 15:25:45+00:00,5,71,#bitcoin #bitcoin,"3/ I'm familiar w/ @MustStopMurad's arc for $BTC to arrive at being a MoE, or @saifedean's hopes for a #bitcoin standard to underlie a global economy, but the data doesn't support those narratives."
250,201924,cburniske,2019-11-12 19:22:19+00:00,58,275,#bitcoin #bitcoin,"Space mining will mean any physical commodity has theoretically infinite supply. Good luck storing value in such assets. It is only digital commodities, with #bitcoin the poster child, where we can architect and enforce absolute scarcity. "
251,201924,laurashin,2019-11-20 21:26:57+00:00,0,17,,"And, I know you’ve had Bitcoin on your mind: https://twitter.com/Snowden/status/1187892280906137602?s=20 What do you say we discuss it on my show?"
252,201924,laurashin,2019-11-19 17:32:16+00:00,16,71,,"Great episode of Unchained with @ChorzempaMartin and @DoveyWan on China's blockchain push + DCEP! Topics: global blockchain standards, U.S.-China trade war, Libra, China's shadow banking system, internationalizing the RMB, “controlled anonymity” &amp; Bitcoin "
253,201924,laurashin,2019-11-12 14:12:48+00:00,8,24,,"Former CFTC chairman @giancarloMKTS discusses why the CFTC thought Bitcoin futures would pop the 2017 Bitcoin bubble, what he thinks of Libra and the digital yuan, his proposal for a digital dollar and the Congressional hearing that made him ""Crypto Dad."" "
254,201924,cryptomanran,2019-11-22 00:38:37+00:00,28,249,,"Pardon my ignorance, but why does a police raid on Binance’s Shanghai office (If it actually happened) actually affect the price of Bitcoin?"
255,201924,cryptomanran,2019-11-14 18:45:27+00:00,94,833,,PayPal just did the “pull out” from the porn industry. Bitcoin never pulls out.
256,201924,cryptomanran,2019-11-12 16:38:22+00:00,10,103,,Is there any type of financial crisis or event globally in which Bitcoin will perform badly?
