,press company,date,title,url,abstract,date detail,head article,main article
7,https://cryptonews.com/,"Sep 24, 2019",Kin Price Nosedives After Operator Announced the Shut Down ...,https://cryptonews.com/news/kin-price-nosedives-after-operator-announced-the-shut-down-o-4716.htm,"Cryptonews · News · Bitcoin NewsEthereum NewsAltcoin NewsBlockchain 
NewsPress ReleasesSponsoredIndustry TalkICO news · Exclusives.","
September 24, 2019
",Kin prices have been sent tumbling after the coin's operator announced it will shut down its Kik messaging app.,"In a blog post, Kik Interactive's CEO Ted Livingston stated that regulatory pressure from the American Securities and Exchange Commission (SEC) had sparked the decision.However, the CEO did not specify when the app will be closed, only adding that Kin has over 2,000,000 monthly active earners, and 600,000 monthly active spenders. Kin prices took a sharp turn downwards after the news broke, with its 24-hour price rate depreciating by almost 25% after what had been a mostly steady and stable week for the token, ranked 381st by market capitalization.Livingston wrote, as a justification of Kik Interactive’s decision,“After 18 months of working with the SEC, the only choice they gave us was to either label Kin a security or fight them in court. Becoming a security would kill the usability of any cryptocurrency and set a dangerous precedent for the industry.”The CEO stated that the SEC is “working to characterize almost all cryptocurrencies as securities” – thus forcing token operators to abide by American securities laws that date back almost a century.In a scathing attack on the regulator, Livingston wrote that the SEC had taken his company’s quotes “out of context to manipulate the public to view us as bad actors,” and “pressured exchanges not to list Kin.” He also alleged that the SEC had used underhand tactics, “drawing out a long and expensive process to drain [the company’s] resources.” The company stated that in addition to shutting down the Kik app, it would also be reducing its staff to just 19 – with 70 employees working on the Kin blockchain project in Tel Aviv, Israel, handed layoff notices yesterday, per media outlet Calcalist Tech.As reported in January 2018, Kik Interactive, intends to fight the SEC in court over the categorization of their token as a security, arguing that “the tokens represent a new kind of asset that shouldn’t be subject to the same rules as stock or bond offerings.” A legal battle like this could help determine the scope of the SEC’s authority over the ICO (initial coin offering) market and set legal precedent for future cases.In May, the Kin Foundation, developer of the Kin Ecosystem, set aside USD 5 million for the legal battle.The cryptocurrency that Kik created, Kin, enjoyed one of the most high profile ICOs of 2017, when it raised almost USD 100 million in September 2017."
8,https://cryptonews.com/,"Sep 25, 2019",XRP Price Drops to the Level Last Seen in December 2017,https://cryptonews.com/news/xrp-price-drops-to-the-level-last-seen-in-december-2017-4729.htm,"Cryptonews · News · Bitcoin NewsEthereum NewsAltcoin NewsBlockchain 
NewsPress ReleasesSponsoredIndustry TalkICO news · Exclusives.","
September 25, 2019
","Another victim of the abrupt drop that painted the market red is Ripple's XRP, which reverted to the levels seen all the way back at the end of 2017. ","While ether, the second largest token by market capitalization, certainly suffered this week, the third largest coin, XRP, is not doing any better. It has seen almost a 12% drop in the last 24 hours (11:09 UTC) and more than 22% in the last week. That brought it to the current price of below USD 0.24. The last time we’ve seen it this low was in December 2017. XRP price chart:Moving to a closer period of time though, XRP’s price exactly a year ago was USD 0.52, and though it had been rising and falling since, it hasn’t reached that number again so far and is down by 47%. Looking at the levels in the last quarter alone, what we notice is actually a gradual drop all the way till the short-lived September rally. In the last week, like many altcoins, XRP appreciated on September 17th, rising by 24% to USD 0.31 on September 18th, before starting to drop to its current levels. But observing the week leading up to the rally, the price was quite stable, with the usual fluctuations, moving between USD 0.25 and USD 0.26. It is also interesting to note that XRP was among seven of the top 10 coins that saw its trading volume increase in September during the rally, compared to the August values.Like we’ve seen with the reactions to the ETH drop, the opinions on XRP’s next move are also quite divided, but in general – nobody seems to be particularly worried. The ardent supporters insist that the levels are guaranteed to be higher again. Many of them believe that, a drop or not, Ripple will continue to expand and improve its product, boosting the native token’s price. Some blame the institutional involvement and are calling for people to hodl, and others believe this lowest price of the year is the perfect shopping time. Others, though, are not that optimistic, expecting a further drop.Meanwhile, the past month was somewhat mixed for XRP in terms of news:_____A few more reactions to the recent price drop coming out of the Cryptoverse:$XRP update:A heartfelt sorry from me to the XRP community. pic.twitter.com/6LT9HrGvoP__First got #XRP in 2017 at .26 and it fell to .20 then climbed to all time high...you haven’t lost anything unless you’re panic selling.__But then the ecosystem would also stop growing."