,crypto,gubun,datetime,username,retweets,favorites,hashtags,text
1,BCH,down,2018-11-27 00:00:00+00:00,BchPulse,0,0,#BCHUSD #BitcoinCash,BCH / USD $182.87 | -0.0254% #BCHUSD #BitcoinCash
2,BCH,down,2018-11-27 00:00:00+00:00,BlockPulse360,0,0,#cryptocurrency #bitcoin #bitcoin #BTC #BTC #blockchain #Crypto #finance #cryptocurrencyNews #Ethereum #fintech #digitalasset #ICO #Exchange #bitcoinnews #btcnews #bitcoincash #cryptomarket,Global: Are Institutional Investors Accumulating Bitcoin While Retailers Panic? https://bit.ly/2zqtFeo #cryptocurrency #bitcoin #BTC #blockchain #Crypto #finance #cryptocurrencyNews #Ethereum #fintech #digitalasset #ICO #Exchange #bitcoinnews #btcnews #bitcoincash #cryptomarket
3,BCH,down,2018-11-27 00:00:00+00:00,CryptoGulp,1,0,,"Top 5 Cryptocurrencies Prices Bitcoin $BTC: $3,779.70 +1.76% XRP $XRP: $0.356065261 +1.59% Ethereum $ETH: $108.35 +2.30% Bitcoin Cash $BCH: $182.07 +2.69% EOS $EOS: $3.18 +1.94% "
4,BCH,down,2018-11-27 00:00:03+00:00,BitcoinCash_ES,0,0,#BitcoinCash #Kraken #BCHEUR,Cotización del Bitcoin Cash: 157 30.€ | +2.41% | Kraken | 27/11/18 01:00 #BitcoinCash #Kraken #BCHEUR
5,BCH,down,2018-11-27 00:00:05+00:00,Economia_Forex,0,0,#BTC #BTC #bitcoin #bitcoin #ETH #ethereum #BCH #Bitcoin #Bitcoin #ltc #litecoin #XRP #ripple #XMR #monero #DSH #dash #criptovalute,#BTC #bitcoin $3850.22 #ETH #ethereum $110.59 #BCH #Bitcoin Cash $397.34 #ltc #litecoin $30.26 #XRP #ripple $0.36 #XMR #monero $54.45 #DSH #dash $91.72 #criptovalute http://valutevirtuali.com/criptovalute-principali-performance-ed-andamento-prezzo/
6,BCH,down,2018-11-27 00:00:05+00:00,stratumHKBot,0,0,#stratum #fuckthebanks,"Preços Bank To Crypto: BITCOIN: R$15.724,28 BITCOIN-CASH: R$746,18 ETHEREUM: R$466,88 SMARTCASH: R$0,09 ZCORE: R$2,57 http://bktc.com.br #stratum #fuckthebanks 26/11/18-22:00"
7,BCH,down,2018-11-27 00:00:21+00:00,TrackThatCrypto,0,0,#crypto #bitcoin #bitcoin #ethereum #xrp #tezos #litecoin #decred #eos #bitcoincash #dogecoin #waves #iota #neo #cryptocurrency #altcoin #blockchain #news #CryptoBuzzTracker,TOP-12 most-mentioned #crypto this hour: 1. #bitcoin 2. #ethereum 3. #xrp 4. #tezos 5. #litecoin 6. #decred 7. #eos 8. #bitcoincash 9. #dogecoin 10. #waves 11. #iota 12. #neo #cryptocurrency #altcoin #blockchain #news #CryptoBuzzTracker
8,BCH,down,2018-11-27 00:00:24+00:00,bitsmart_io,0,0,#bitcoin #bitcoin #usstate #cryptocurrency #joshmandel #thewallstreetjournal #bitsmart,"Bitcoin Briefly Breaks Over $4,000, Bitcoin Cash Sees Gains Near 20 Percent on the Day #bitcoin #usstate #cryptocurrency #joshmandel #thewallstreetjournal #bitsmart"
9,BCH,down,2018-11-27 00:00:39+00:00,BCashManager,0,0,#bitcoincash,Bitcoin Cash cheapest on Gate USDT-market: $181.71 0.04773642BTC $bch $BCHBTC $BCHUSD #bitcoincash 
10,BCH,down,2018-11-27 00:00:53+00:00,FeesBitcoin,0,0,#Bitcoin #Bitcoin #BitcoinCash #Bitcoin #Bitcoin #BitcoinCash,"#Bitcoin $3,761.42 v #BitcoinCash $268.19 (BTC/BCH 14.0), Avg Transaction fee for #Bitcoin ~$0.52 v #BitcoinCash ~$0.00 - 2018/11/27 09:00JST"
11,BCH,down,2018-11-27 00:01:38+00:00,QUALITYMINER2,0,0,#QualityMiner,"BitPay ya permite a los comerciantes utilizar Bitcoin y Bitcoin Cash para realizar transacciones. En un comunicado, el cofundador y director ejecutivo Stephen Pair señaló que agregar el token PAX permitiría además liquidaciones de transacciones de bajo costo. #QualityMiner"
12,BCH,down,2018-11-27 00:02:00+00:00,coingamma,0,0,#blockchain #bitcoinprice #crypto,Bitcoin $BTC Price: $3779.7 (-6.5%) XRP $XRP Price: $0.36 (-5.97%) Ethereum $ETH Price: $108.35 (-7.13%) Bitcoin Cash $BCH Price: $182.07 (-1.43%) EOS $EOS Price: $3.18 (-5.68%) More Prices: https://goo.gl/Hb6qJN #blockchain #bitcoinprice #crypto
13,BCH,down,2018-11-27 00:02:37+00:00,wieslaw17,0,1,,We are happy to announce that Bitcoin cash (BCH) @BTCNewsUpdates @BitcoinCashA now available in Citowise Wallet. We have finally added this popular coin to our wallet. @rogerkver Read more https://goo.gl/YzR3Vk #blockchain#citowisewallet#BCH https://twitter.com/citowise/status/1054305751043399681
14,BCH,down,2018-11-27 00:02:55+00:00,bch_price,0,0,#bitcoincash #bch,Price of 1 BCH to USD: $182.21 (Change: +3.2 %) Price of 1 BCH to BTC: 0.04833139 Ƀ (Change: +1.33 %) #bitcoincash #bch $bch
15,BCH,down,2018-11-27 00:03:00+00:00,CryptocoinsTra3,0,1,#crypto #cryptocurrency #bitcoincash #bitcoin #bitcoin #stellar #ripple #steem #requestnetwork #cryptocoins #tron #TRX #0x #ZRX #BAT #Litecoin #nano #NEM #DigiByte #Zilliqa #ARK #Cardano #golem,Do you want to earn a lot of money just like me? https://bitvavo.com/?a=A5DEBB527D #crypto #cryptocurrency #bitcoincash #bitcoin #stellar #ripple #steem #requestnetwork #cryptocoins #tron #TRX #0x #ZRX #BAT #Litecoin #nano #NEM #DigiByte #Zilliqa #ARK #Cardano #golem
16,BCH,down,2018-11-27 00:03:37+00:00,OfficialAceLTD,0,0,,I liked a @YouTube video http://youtu.be/LdoKgT8e2EA?a Bitcoin Cash HashWar is Over! + Buy Beware: Fake Trezor Wallets Flooding the Market!
17,BCH,down,2018-11-27 00:03:41+00:00,ZKamal23,0,0,,"EOS (EOS), Stellar Lumens (XLM) And Bitcoin Cash (BCH) Battle for Dominance via @beincrypto"
18,BCH,down,2018-11-27 00:05:00+00:00,ESPACIOBITVE,0,0,#Criptomonedas #Bitcoin #Bitcoin #BTC #BTC #Ethereum #ETH #BitcoinCash #BCH #Litecoin #LTC #Ripple #XRP #Tether #USDT #CoinMarketCap #MarcOstwald,Bitcoin está cerca de los $4.000 y la industria criptográfica se escandaliza https://espaciobit.com.ve/main/2018/11/21/bitcoin-esta-cerca-de-los-4-000-y-la-industria-criptografica-se-escandaliza/?utm_source=feedburner&amp;utm_medium=feed&amp;utm_campaign=Feed%3A+Espaciobit+%28EspacioBit%29 #Criptomonedas #Bitcoin #BTC #Ethereum #ETH #BitcoinCash #BCH #Litecoin #LTC #Ripple #XRP #Tether #USDT #CoinMarketCap #MarcOstwald
19,BCH,down,2018-11-27 00:05:42+00:00,cointubeoffical,0,0,,Bitcoin Cash [BCH] proponent Roger Ver and Bitmain’s Jihan Wu should burn to the ground: Craig Wright http://rviv.ly/fye4ZK
20,BCH,down,2018-11-27 00:05:46+00:00,taejkim1980,0,0,,Lol so is bitcoin cash...
21,BCH,down,2018-11-27 00:06:23+00:00,CFDTrading1,0,0,,"Hours After Bitcoin Cash Network Update Begins, Bitcoin ABC Over 10 Blocks Ahead Hours after the Bitcoin Cash upgrade started, the Bitcoin ABC camp is leading in terms of hash rate and blocks "
22,BCH,down,2018-11-27 00:06:32+00:00,justcryptocnews,0,0,,"Bitcoin, Ripple, Ethereum, Bitcoin Cash, Stellar, EOS, Litecoin, Cardano, Monero, TRON: Price Analysis, Nov. 26 - https://www.justcryptocurrencies.com/2018/11/27/bitcoin-ripple-ethereum-bitcoin-cash-stellar-eos-litecoin-cardano-monero-tron-price-analysis-nov-26/"
23,BCH,down,2018-11-27 00:09:57+00:00,SatoshiBrain,0,1,,which Bitcoin Cash exactly ?
24,BCH,down,2018-11-27 00:10:02+00:00,EarlyAdopter23,0,0,#cryptocurrencies #Bitcoin #Bitcoin #XRP #Ethereum #BitcoinCash #EOS #instaeth #money #markets #stockmarket,"Top 5 #cryptocurrencies Alert Time: 2018-11-27 03:10:02 #Bitcoin: $3,770.562 #XRP: $0.353 #Ethereum: $107.919 #BitcoinCash: $180.783 #EOS: $3.181 #instaeth $LTC #money #markets #stockmarket http://www.coincaps.ai"
25,BCH,down,2018-11-27 00:10:22+00:00,CryptoCoin_Lord,0,0,,"Bitcoin, not Bitcoin Cash ABC SV LBGTQXYZ... Bitcoin. "
26,BCH,down,2018-11-27 00:10:53+00:00,CryptoBitNews2,0,0,,"Bitcoin, Ripple, Ethereum, Bitcoin Cash, Stellar, EOS, Litecoin, Cardano, Monero, TRON: Price Analysis, Nov. 26 https://www.cryptobitnews.co.uk/2018/11/26/bitcoin-ripple-ethereum-bitcoin-cash-stellar-eos-litecoin-cardano-monero-tron-price-analysis-nov-26/"
27,BCH,down,2018-11-27 00:11:51+00:00,scotlarock727,1,2,#HYPED #Bitcoincash #ZRX #XMR #BTC #BTC #LTC #ETH #XRP #XLM #NEO #TRX #Cryptocurrency #BCH #Bitcoin #Bitcoin #XEM #DASH #BTG #EOS #BTG #QTUM #BCH #Ripple #XLM #IOT #KMD #OMG #BTS #ADA #WTC,Live with Leisure Coin Dev https://youtu.be/QKiTc-QOp5E via @YouTube #HYPED #Bitcoincash #ZRX #XMR #BTC #LTC #ETH #XRP #XLM #NEO #TRX #Cryptocurrency #BCH #Bitcoin #XEM #DASH #BTG #EOS #BTG #QTUM #BCH #Ripple #XLM #IOT #KMD #OMG #BTS #ADA #WTC
28,BCH,down,2018-11-27 00:12:10+00:00,jmescoda,0,0,,"Bitcoin, bitcoin cash, o tots dos?"
29,BCH,down,2018-11-27 00:13:52+00:00,ZKamal23,0,0,,"Bitcoin, Ripple, Ethereum, Bitcoin Cash, Stellar, EOS, Litecoin, Cardano, Monero, TRON: Price Analysis, Nov. 26 https://cointelegraph.com/news/bitcoin-ripple-ethereum-bitcoin-cash-stellar-eos-litecoin-cardano-monero-tron-price-analysis-nov-26 via @cointelegraph"
30,BCH,down,2018-11-27 00:14:00+00:00,cryptodealingd,0,0,#BitcoinCash #Crypto #Cryptocurrency #Bitcoin #Bitcoin #altcoins #Trading,"Our trading signal service sold #BitcoinCash with 3,83% profit. Connect with @CryptoDealingdeskBot on Telegram to trade like a pro yourself. #Crypto #Cryptocurrency #Bitcoin $BTC #altcoins #Trading 4168 closed trades / 60,24% wins / Total yield 6.943,56% since 2017-10-24"
31,BCH,down,2018-11-27 00:15:05+00:00,DryptoGear,0,0,,Bitcoin Cash Price Rallies Toward $200 as CoinGeek Ends 'Hash War' https://www.ccn.com/bitcoin-cash-price-rallies-toward-200-as-coingeek-ends-bch-hash-war/
32,BCH,down,2018-11-27 00:15:21+00:00,ScrapeINT,0,0,,Bitcoin:$3775.48703129 Ethereum:$107.968142544 Bitcoin Cash:$181.709827596 Litecoin:$29.5256685153 XRP:$0.3538420475 IOTA:$0.2728460017
33,BCH,down,2018-11-27 00:15:45+00:00,tradingbtc1,0,0,,"Bitcoin, Ripple, Ethereum, Bitcoin Cash, Stellar, EOS, Litecoin, Cardano, Monero, TRON: Price Analysis, Nov. 26 "
34,BCH,down,2018-11-27 00:16:32+00:00,mundocriptonews,0,0,,"Bitcoin, Ripple, Ethereum, Bitcoin Cash, Stellar, EOS, Litecoin, Cardano, Monero, TRON: Análisis de precios, 26 de noviembre"
35,BCH,down,2018-11-27 00:17:06+00:00,aWebAnalysis,0,0,#bch #bitcoin #bitcoin,"Bitcoin Cash BCH Current Price: $180,895 1 Hour: 2.55 % | 24 Hours: -1.81 % | 7 Days: -36.59 % #bch #bitcoin cash"
36,BCH,down,2018-11-27 00:17:19+00:00,criptopwr,0,0,,"Bitcoin, Ripple, Ethereum, Bitcoin Cash, Stellar, EOS, Litecoin, Cardano, Monero, TRON: Análisis de precios, 26 de noviembre https://ift.tt/2FJyfK7"
37,BCH,down,2018-11-27 00:17:31+00:00,Djor444,0,1,#bchpls #bchfaucet #bitcoincash #bchforeveryone,I just received free Bitcoin (BCH) from the new Bitcoin Cash Faucet! https://free.bitcoin.com #bchpls #bchfaucet #bitcoincash #bchforeveryone чрез @bitcoincom
38,BCH,down,2018-11-27 00:18:19+00:00,hackingfx,0,0,,"Bitcoin, Ripple, Ethereum, Bitcoin Cash, Stellar, EOS, Litecoin, Cardano, Monero, TRON: Análisis de precios, 26 de noviembre https://ift.tt/2Ky5UVX"
39,BCH,down,2018-11-27 00:19:11+00:00,msdenmail,0,0,,Cloud mining. Bonus 100 GH/s. USD. Ether Classic. Ethereum. Litecoin. Bitcoin. Bitcoin Cash. Dash. Dogecoin. Zcash. $&amp; Sign Up - http://bit.ly/2OQLBDZ
40,BCH,down,2018-11-27 00:20:02+00:00,EarlyAdopter23,1,0,#cryptocurrencies #Bitcoin #Bitcoin #XRP #Ethereum #BitcoinCash #EOS #trx #altcoins #binance #money #rt,"Top 5 #cryptocurrencies Alert Time: 2018-11-27 03:20:02 #Bitcoin: $3,773.547 #XRP: $0.354 #Ethereum: $107.924 #BitcoinCash: $181.326 #EOS: $3.177 #trx #altcoins #binance #money #rt http://www.coincaps.ai"
41,BCH,down,2018-11-27 00:20:23+00:00,cripto_guru,0,0,,"Bitcoin, Ripple, Ethereum, Bitcoin Cash, Stellar, EOS, Litecoin, Cardano, Monero, TRON: Análisis de precios, 26 de noviembre https://es.cointelegraph.com/news/bitcoin-ripple-ethereum-bitcoin-cash-stellar-eos-litecoin-cardano-monero-tron-price-analysis-nov-26"
42,BCH,down,2018-11-27 00:20:37+00:00,Cryptoc46572563,0,0,#Cryptocurrency #bitcoin #bitcoin,"Major Cryptocurrency latest prices(26,Nov 19:20) [Bitcoin(BTC)] 3,760.52 USD [Ethereum(ETH)] 107.75 USD [XRP(XRP)] 0.36 USD [Bitcoin Cash(BCH)] 194.09 USD [Litecoin(LTC)] 29.38 USD Learn more -&gt; https://coins.lat #Cryptocurrency #bitcoin"
43,BCH,down,2018-11-27 00:21:25+00:00,Norman57097322,0,0,,What you need to know about the Bitcoin Cash hard fork https://blog.blockchain.com/2018/11/14/the-bch-hard-fork/
44,BCH,down,2018-11-27 00:22:01+00:00,coinnewsdatacom,0,0,#cryptocurrency #blockchain #coinnews,Bitcoin Cash ‘Hash War’ May Soon End As Losses Near $12M https://bitcoinist.com/bitcoin-cash-hash-war-end/ #cryptocurrency #blockchain #coinnews
45,BCH,down,2018-11-27 00:22:46+00:00,aditya_ppw,0,0,#bitcoin #bitcoin #BitcoinCash #BitcoinSV #BitcoinBull #bitcoin #bitcoin,Apa kabar Bitcoin... Menguat lah kembali... Ferguso @BitcoinMagazine @BTCTN @Bitcoin @crypto #bitcoin #BitcoinCash #BitcoinSV #BitcoinBull #bitcoin price
46,BCH,down,2018-11-27 00:22:59+00:00,TheBTCTimes,0,0,,"Bitcoin, Ripple, Ethereum, Bitcoin Cash, Stellar, EOS, Litecoin, Cardano, Monero, TRON: Análisis de precios, 26 de noviembre https://www.thebtctimes.com/bitcoin-ripple-ethereum-bitcoin-cash-stellar-eos-litecoin-cardano-monero-tron-analisis-de-precios-26-de-noviembre/"
47,BCH,down,2018-11-27 00:23:09+00:00,tarmedia,1,1,#blockchain #Crypto #decentralization #Bitcoin #Bitcoin #cryptocurrency #Cryptocurrency #crypto #BitcoinCash #Ethereum #altcoin #Cryptocurrencies,"Blind Optimism, or Hard Realism - What Does 2019 Hold for Bitcoin? | Finance Magnates https://www.financemagnates.com/cryptocurrency/news/blind-optimism-or-hard-realism-what-does-2019-hold-for-bitcoin/#bitcoin #blockchain #Crypto #decentralization #Bitcoin #cryptocurrency #Cryptocurrency #crypto #BitcoinCash #Ethereum #altcoin #Cryptocurrencies"
48,BCH,down,2018-11-27 00:23:29+00:00,criptovigilante,0,0,,"Bitcoin, Ripple, Ethereum, Bitcoin Cash, Stellar, EOS, Litecoin, Cardano, Monero, TRON: Análisis de precios, 26 de noviembre https://ift.tt/2Ky5UVX"
49,BCH,down,2018-11-27 00:23:32+00:00,criptoguacharo,0,0,,"Bitcoin, Ripple, Ethereum, Bitcoin Cash, Stellar, EOS, Litecoin, Cardano, Monero, TRON: Análisis de precios, 26 de noviembre https://ift.tt/2Ky5UVX"
50,BCH,down,2018-11-27 00:27:05+00:00,bitcoin_vn,0,1,#Ti #Ti #Tint #GiaBitcoin #BitcoinVietnam #Bitcoin #Bitcoin #Ethereum #Dash #BitcoinCash #Ripple #Litecoin,Phân tích giá Bitcoin 27/11: Giá Bitcoin tiếp tục chảy máu khi thị trường không tìm thấy đáy. #Tiềnảo #Tiềnđiệntử #TintứcBitcoin #GiaBitcoin #BitcoinVietnam #Bitcoin #Ethereum #Dash #BitcoinCash #Ripple #Litecoin
51,BCH,down,2018-11-27 00:29:38+00:00,AvocadoByProof,0,0,#bitcoin #bitcoin #BitcoinCash #DigiByte #crypto,"Results are in for the last 10 minutes: the best crypto performer is #bitcoin (0%), while the biggest loser is #BitcoinCash (-1.4%). ||| Greatest overall change (price or volume) is: #DigiByte with a 6.3% negative change in volume #crypto https://bit.ly/2zPNY7s"
52,BCH,down,2018-11-27 00:30:02+00:00,coinmentionsbot,0,0,,4chan /biz/ coin mentions (24 hours) #1 : Bitcoin | 683 | 24h Δ: -267 #2 : Chainlink | 298 | 24h Δ: -33 #3 : Ethereum | 95 | 24h Δ: -135 #4: Bitcoin Cash | 92 | 24h Δ: +7 #5: Everipedia | 80 | 24h Δ: +22 $BTC $LINK $ETH $BCH $IQ
53,BCH,down,2018-11-27 00:30:50+00:00,crypto_lite,0,3,,How in the earth an inflated coin BCH BSV in TOP 10. Aren’t it those who split the value and double the coins supplied for their own good? So now who is claiming the real Bitcoin cash of the real Bitcoin??? What a joke!!!
54,BCH,down,2018-11-27 00:33:07+00:00,HGgeonzon,0,0,,"Bitcoin, Ripple, Ethereum, Bitcoin Cash, Stellar, EOS, Litecoin, Cardano, Monero, TRON: Price Analysis, Nov. 26 https://cointelegraph.com/news/bitcoin-ripple-ethereum-bitcoin-cash-stellar-eos-litecoin-cardano-monero-tron-price-analysis-nov-26"
55,BCH,down,2018-11-27 00:33:16+00:00,AlgoryProject,0,0,#cryptocurrency #cryptonews #crypto #algory #BTC #BTC #BCH #OCT #BIT #Bitcoin #Bitcoin #BitcoinCash #OracleChain #FirstBitcoin #blockchain #ledger #mining #satoshi,Eight Historic Bitcoin Transactions Read more: https://app.algory.io/app/cryptonews/339787/eight-historic-bitcoin-transactions &#13;#cryptocurrency #cryptonews #crypto #algory #BTC #BCH #OCT #BIT #Bitcoin #BitcoinCash #OracleChain #FirstBitcoin #blockchain #ledger #mining #satoshi
56,BCH,down,2018-11-27 00:33:57+00:00,coinsavage,0,1,,It doesn’t matter... Bitcoin Cash is not investable ... 
57,BCH,down,2018-11-27 00:34:01+00:00,Raschad_Camal,0,1,,when will come our Bitcoin cash SV ?))
58,BCH,down,2018-11-27 00:34:54+00:00,DaDonHooly,0,0,,I liked a @YouTube video http://youtu.be/LdoKgT8e2EA?a Bitcoin Cash HashWar is Over! + Buy Beware: Fake Trezor Wallets Flooding the Market!
59,BCH,down,2018-11-27 00:35:52+00:00,TomHarpointner,0,1,#Bitcoin #Bitcoin,#Bitcoin questions nobody’s asking anymore: 1. When moon? 2. Is Bitcoin Cash the real Bitcoin? 3. Who else is going to the ___ Bitcoin conference? What else??
60,BCH,down,2018-11-27 00:35:56+00:00,MatthewAiyash,0,0,#Bitcoin #Bitcoin #BitcoinCash #Mining,Things are about to get interesting I think... $BTC $BCH #Bitcoin #BitcoinCash #Mining
61,BCH,down,2018-11-27 00:38:07+00:00,arvicco,0,1,,I'm confused. Which Bitcoin Cash is the real Bitcoin Cash out of all the Bitcoin Cashes out there?
62,BCH,down,2018-11-27 00:38:49+00:00,cot_criptomoeda,0,0,#bitcoin #bitcoin #litecoin #bitcashcoin #ethereum,"O valor médio das criptomoedas é: Bitcoin(BTC) R$15457,02 Litecoin(LTC) R$120,88 Bitcoin Cash(BCH) R$747,16 Ethereum(ETH) R$444,47 #bitcoin #litecoin #bitcashcoin #ethereum"
63,BCH,down,2018-11-27 00:39:21+00:00,coinonedan,0,1,#Bitcoin #Bitcoin #BitcoinCash #Ethereum,"2018/11/27 09:39:21 [ bitFlyer ] ビットコイン[BTC/JPY]：423,040円 イーサリアム[ETH/JPY]：12,078円 [ Zaif ] ネム[XEM/JPY]： 7.7939円 モナコイン[MONA/JPY]：134.0円 BCH[BCH/JPY]： 21,105円 #Bitcoin #BitcoinCash #Ethereum #仮想通貨 #暗号通貨"
64,BCH,down,2018-11-27 00:39:33+00:00,CCNMarkets,25,46,,Craig Wright’s Bitcoin Cash Fork Can Hit $1 Million: Reddit’s Fmr. Crypto Lead 
65,BCH,down,2018-11-27 00:39:49+00:00,ChartGuys,3,35,#Bitcoin #Bitcoin #Ethereum #Ripple #Bitcoincash #crypto #cryptocurrency #cryptocurrencies #cryptotrading #cryptotwitter #altcoin #altcoins #Dogoodthings,VIDEO: #Bitcoin #Ethereum #Ripple #Bitcoincash Technical Analysis 11/26/2018 https://youtu.be/wohXk_Mkt1E $BTC $GBTC $ETH $XRP $BCHSV #crypto #cryptocurrency #cryptocurrencies #cryptotrading #cryptotwitter #altcoin #altcoins #Dogoodthings
66,BCH,down,2018-11-27 00:39:56+00:00,freebitcoindir,0,0,,Craig Wright’s Bitcoin Cash Fork Can Hit $1 Million: Reddit’s Fmr. Crypto Lead http://freebitcoin.directory/craig-wrights-bitcoin-cash-fork-can-hit-1-million-reddits-fmr-crypto-lead/
67,BCH,down,2018-11-27 00:40:02+00:00,AlgoryProject,0,0,#cryptocurrency #cryptonews #crypto #algory #BTC #BTC #BCH #Bitcoin #Bitcoin #BitcoinCash,Craig Wright’s Bitcoin Cash Fork Can Hit $1 Million: Reddit’s Fmr. Crypto Lead &#13;Read more: https://app.algory.io/app/cryptonews/339797/craig-wrights-bitcoin-cash-fork-can-hit &#13;#cryptocurrency #cryptonews #crypto #algory #BTC #BCH #Bitcoin #BitcoinCash
68,BCH,down,2018-11-27 00:40:02+00:00,EarlyAdopter23,0,0,#cryptocurrencies #Bitcoin #Bitcoin #XRP #Ethereum #BitcoinCash #EOS #ethereum #altcoin #altcoins #newcryptocurrency #markets,"Top 5 #cryptocurrencies Alert Time: 2018-11-27 03:40:02 #Bitcoin: $3,753.326 #XRP: $0.352 #Ethereum: $107.285 #BitcoinCash: $178.604 #EOS: $3.142 #ethereum #altcoin #altcoins #newcryptocurrency #markets http://www.coincaps.ai"
69,BCH,down,2018-11-27 00:40:12+00:00,agotec2000,0,0,,Bitcoin Cash ABC update exposes potentially catastrophic vulnerability https://tnw.to/Bkb5F
70,BCH,down,2018-11-27 00:40:19+00:00,ccryptoventures,0,0,,"New post (Bitcoin, Ripple, Ethereum, Bitcoin Cash, Stellar, EOS, Litecoin, Cardano, Monero, TRON: Price Analysis, Nov. 26 - Cointelegraph) has been published on Crypto Ventures - http://cryptoventures.io/2018/11/27/bitcoin-ripple-ethereum-bitcoin-cash-stellar-eos-litecoin-cardano-monero-tron-price-analysis-nov-26-cointelegraph/"
71,BCH,down,2018-11-27 00:40:30+00:00,Btctools,1,0,#bitcoin #bitcoin,#bitcoin Craig Wright’s Bitcoin Cash Fork Can Hit $1 Million: Reddit’s Fmr. Crypto Lead https://www.ccn.com/craig-wrights-bitcoin-cash-fork-can-hit-1-million-reddits-fmr-crypto-lead/
72,BCH,down,2018-11-27 00:40:32+00:00,HeyTaiZen,5,14,,"They say the bitcoin cash war has ended... for now...but more forks will continue to come in bitcoin core, cash n SV since there is no process in the bitcoin community to decide on a FINAL n BINDING decision on how the network should be upgraded... "
73,BCH,down,2018-11-27 00:40:46+00:00,Qp3bcS0Y1DBpWGq,0,0,,"主要仮想通貨 現在の価格(11/27 08:40) [Bitcoin(BTC)] 423,479.72円 [Ethereum(ETH)] 12,251.25円 [XRP(XRP)] 39.77円 [Bitcoin Cash(BCH)] 26,832.89円 [Litecoin(LTC)] 3,312.46円 続き→https://coins.lat/ja #仮想通貨 #ビットコイン"
74,BCH,down,2018-11-27 00:41:06+00:00,Bitcoin_Korea,0,0,,Craig Wright’s Bitcoin Cash Fork Can Hit $1 Million: Reddit’s Fmr. Crypto Lead https://www.ccn.com/craig-wrights-bitcoin-cash-fork-can-hit-1-million-reddits-fmr-crypto-lead/ (via Twitter https://twitter.com/CryptoCoinsNews/status/1067216321790861312)
75,BCH,down,2018-11-27 00:41:07+00:00,blockchain_hub,0,0,#CCN #ICO,Craig Wright의 Bitcoin Cash Fork는 1 백만 달러를 벌 수 있습니다 : Reddit \'s Fmr. Crypto Lead : https://www.blockchainhub.kr/bbs/board.php?bo_table=news&amp;wr_id=21091 #CCN #블록체인허브 #비트코인전망 #비트코인시세 #가상화폐 #암호화폐 #블록체인 #비트코인 #이더리움 #ICO #코인마켓캡
76,BCH,down,2018-11-27 00:41:12+00:00,andrewwcox,0,1,#BitcoinCash #Cryptocurrency #cryptotrading,Craig Wright’s Bitcoin Cash Fork Can Hit $1 Million: Reddit’s Fmr. Crypto Lead https://www.ccn.com/craig-wrights-bitcoin-cash-fork-can-hit-1-million-reddits-fmr-crypto-lead/ #BitcoinCash #Cryptocurrency #cryptotrading
77,BCH,down,2018-11-27 00:41:17+00:00,TakeHightower,0,0,#Craig,#Craig Wright’s Bitcoin Cash Fork Can Hit $1 Million: Reddit’s Fmr. Crypto Lead https://ift.tt/2KBN28o
78,BCH,down,2018-11-27 00:41:37+00:00,FeursteinP2P,0,2,#cryptocurrency #altcoin,Craig Wright’s Bitcoin Cash Fork Can Hit $1 Million: Reddit’s Fmr. Crypto Lead #cryptocurrency #altcoin https://www.ccn.com/craig-wrights-bitcoin-cash-fork-can-hit-1-million-reddits-fmr-crypto-lead/
79,BCH,down,2018-11-27 00:41:45+00:00,fiftyline50,0,0,#bitcoin #bitcoin #abc #bitcoin #bitcoin #cash #bitcoin #bitcoin #sv #moneybutton #ryan #x #charles #yours,Craig Wright's Bitcoin Cash Fork Can Hit $1 Million: Fmr Reddit Crypto Dev - @bitillionaire http://bit.ly/2ArIcWT #bitcoin #abc #bitcoin #cash #bitcoin #sv #moneybutton #ryan #x. #charles #yours.org
80,BCH,down,2018-11-27 00:42:48+00:00,sharpcredit1,0,0,,Craig Wright’s Bitcoin Cash Fork Can Hit $1 Million: Fmr Reddit Crypto Dev https://sharpcredit.com/2018/11/26/craig-wrights-bitcoin-cash-fork-can-hit-1-million-fmr-reddit-crypto-dev/
81,BCH,down,2018-11-27 00:43:28+00:00,lalitsingh518,0,0,,Bitcoin Cash Price Rallies Toward $200 as CoinGeek Ends BCH ‘Hash War’ https://www.pivot.one/share/post/5bfc03e0cd5ee70940eefbfd?uid=5bf91f570162e75c0a23376a&amp;invite_code=EIBYCQ
82,BCH,down,2018-11-27 00:43:35+00:00,Newbreed408Jose,0,1,,So in 2017 bitcoin was not Satoshi vision. So bitcoin cash came out and had a lot of people saying BCH is the real bitcoin. Now the same people who were saying that are now on bitcoinSV pito saying that is the true bitcoin!! Que la chingada 
83,BCH,down,2018-11-27 00:44:03+00:00,eBargainsToday,1,0,#AltcoinAnalysis #BitcoinCash,#AltcoinAnalysis #BitcoinCash Craig Wright’s Bitcoin Cash Fork Can Hit $1 Million: Reddit’s Fmr. Crypto Lead http://dlvr.it/QsB5Th | http://bit.ly/ebidsale
84,BCH,down,2018-11-27 00:45:21+00:00,ScrapeINT,0,0,,Bitcoin:$3760.62536267 Ethereum:$107.302029893 Bitcoin Cash:$179.091492403 Litecoin:$29.3104529457 XRP:$0.3532816311 IOTA:$0.2716982561
85,BCH,down,2018-11-27 00:45:26+00:00,onlinetraderbiz,0,0,,Craig Wright’s Bitcoin Cash Fork Can Hit $1 Million: Reddit’s Fmr. Crypto Lead https://www.ccn.com/craig-wrights-bitcoin-cash-fork-can-hit-1-million-reddits-fmr-crypto-lead/
86,BCH,down,2018-11-27 00:45:29+00:00,kris_tarr,0,0,#cryptocurrency #news,Craig Wright’s Bitcoin Cash Fork Can Hit $1 Million: Reddit’s Fmr. Crypto Lead https://ift.tt/2KBN28o #cryptocurrency #news
87,BCH,down,2018-11-27 00:45:39+00:00,trdrmtscdr,0,0,,"Bitcoin, Ripple, Ethereum, Bitcoin Cash, Stellar, EOS, Litecoin, Cardano, Monero, TRON: Price Analysis, Nov. 26 https://tradermeetscoder.com/bitcoin-ripple-ethereum-bitcoin-cash-stellar-eos-litecoin-cardano-monero-tron-price-analysis-nov-26/"
88,BCH,down,2018-11-27 00:47:36+00:00,DigitalCashNews,1,0,,CCN: Craig Wright’s Bitcoin Cash Fork Can Hit $1 Million: Reddit’s Fmr. Crypto Lead http://dlvr.it/QsB5qx
89,BCH,down,2018-11-27 00:48:09+00:00,Tchau_crise,0,0,,"Bitcoin, Ripple, Ethereum, Bitcoin Cash, Stellar, EOS, Litecoin, Cardano, Monero, TRON: Análise de preços, 26 de novembro https://ift.tt/2zrc2uZ"
90,BCH,down,2018-11-27 00:48:18+00:00,workwithryan,0,0,,Craig Wright’s Bitcoin Cash Fork Can Hit $1 Million: Reddit’s Fmr. Crypto Lead https://ift.tt/2r4MG18
91,BCH,down,2018-11-27 00:48:44+00:00,rhatr,0,6,,Kraken: The recent Bitcoin Cash hard fork resulted in two (for now) viable chains... Me (with tears of nostalgia): this brings so many memories from USSR's ruble fracturing into independent state's currencies
92,BCH,down,2018-11-27 00:49:00+00:00,CoinLook,0,0,,Craig Wright’s Bitcoin Cash Fork Can Hit $1 Million: Reddit’s Fmr. Crypto Lead http://j.mp/2ByvV4u
93,BCH,down,2018-11-27 00:49:24+00:00,teclookup,0,0,#blockchain #bitcoin #bitcoin #cryptonews #cryptocurrency,"Craig Wright’s Bitcoin Cash Fork Can Hit $1 Million: Reddit’s Fmr. Crypto Lead: News by CCN , #blockchain #bitcoin #cryptonews #cryptocurrency"
94,BCH,down,2018-11-27 00:50:02+00:00,EarlyAdopter23,0,0,#cryptocurrencies #Bitcoin #Bitcoin #XRP #Ethereum #BitcoinCash #EOS #instabitcoin #cryptocurrency #btcnews #cryptonews,"Top 5 #cryptocurrencies Alert Time: 2018-11-27 03:50:02 #Bitcoin: $3,766.742 #XRP: $0.353 #Ethereum: $107.544 #BitcoinCash: $179.557 #EOS: $3.144 #instabitcoin #cryptocurrency #btcnews #cryptonews $XBT http://www.coincaps.ai"
