,crypto,gubun,datetime,username,retweets,favorites,hashtags,text
2867,BCH,up,2018-02-08 17:51:07+00:00,Bitcoin_NewsBTC,0,0,#Bitcoin #Bitcoin #BTC #BTC #BlockChain #News #CryptoCurrency,Bitcoin cash is soaring | Markets Insider http://bitcoin-newswire.com/?p=22347 #Bitcoin #BTC #BlockChain #News #CryptoCurrency
2868,BCH,up,2018-02-08 17:51:45+00:00,derykmakgill,2,25,,"For @rogerkver. ""If you can bear to hear the truth you’ve spoken Twisted by knaves to make a trap for fools, Or watch the things you gave your life to, broken, And stoop and build ’em up with worn-out tools"" Keep up the good work. Bitcoin Cash is Bitcoin."
2869,BCH,up,2018-02-08 17:51:52+00:00,cryptogu_ru,0,0,#bitcoin #bitcoin,"BitcoinCash, DASH, Bitcoin. Алгоритм анализа новостей | Прогноз криптовалют от TSI Analytics https://goo.gl/bngtd6 #биткоин #bitcoin #биткойн"
2870,BCH,up,2018-02-08 17:52:13+00:00,shillycrypto,0,11,,"There has been a lot of confusion for users, when they send Bitcoin to a Bitcoin Cash address and end up losing it. Coupled with http://Bitcoin.com claiming Bitcoin Cash is Bitcoin, they have helped contribute to this."
2871,BCH,up,2018-02-08 17:52:30+00:00,Crypo_Advisor,0,0,,Bitcoin cash - резкий рост: cryptoadvisor https://cryptoadvisor.livejournal.com/14915.html?utm_source=twsharing&amp;utm_medium=social с помощью @livejournalru
2872,BCH,up,2018-02-08 17:52:39+00:00,kmazher1,0,1,,"Invest you hard earn money to buy Bitcoin cash. Very Cheap transaction fee cost .02cents faster and secured, decentralized. Genuine and experience team behinds. Coinex reg in UK, HongKong. free to transfer withdrawal. Taker fee 0, maker 0.1 24hrs, instant deposits, withdral"
2873,BCH,up,2018-02-08 17:52:58+00:00,MotorSport4Live,0,0,#CryptoNews #BitcoinCash,I am not aware of any #CryptoNews around #BitcoinCash tbh. For a simple pump its going up for to long now. Hourly candles in this chart though.
2874,BCH,up,2018-02-08 17:53:50+00:00,Cryptotrucker,0,0,,I purchased a Bitcoin cash at $920 got a little paranoid we might be in a bull trap so I sold it regrettably. Now I'm looking at hoping to pull back to 1200 and I'm going to pick up 3 more. Could the flippening be near?
2875,BCH,up,2018-02-08 17:54:00+00:00,coinonedan,0,0,#Bitcoin #Bitcoin #BitcoinCash #Ethereum,"2018/02/09 02:53:59 [ bitFlyer ] ビットコイン[BTC/JPY]：891,020円 イーサリアム[ETH/JPY]：86,696円 [ Zaif ] ネム[XEM/JPY]： 58.6円 モナコイン[MONA/JPY]：404.1円 BCH[BCH/JPY]： 140,075円 #Bitcoin #BitcoinCash #Ethereum #仮想通貨 #暗号通貨"
2876,BCH,up,2018-02-08 17:54:00+00:00,CryptoInvest18,0,1,#crypto #cryptocurrency #binance #exchange #mcafee #bitcoin #bitcoin #btc #btc #altcoins #bitcoincash #ethereum #litecoin #cardano #ada #verge #xvg #tron #trx #miota #iota #nem #xem #money #investing #ico,War of words between Binance CEO Changpeng Zhao and Mcafee! Who do you support guys? #crypto #cryptocurrency #binance #exchange #mcafee #bitcoin #btc #altcoins #bitcoincash #ethereum #litecoin #cardano #ada #verge #xvg #tron #trx #miota #iota #nem #xem #money #investing #ico
2877,BCH,up,2018-02-08 17:54:25+00:00,paultower,0,0,#bitcoincash #cryptocurrency #crypto #bitcoin #bitcoin,Look at that unusual 24 hr pump on #bitcoincash using $btc #cryptocurrency #crypto #bitcoin
2878,BCH,up,2018-02-08 17:54:51+00:00,toomuch72,0,0,#bitcoincash,"Ok, using your analogy, remember how everyone hated widows vista? That is legacy bitcoin. #bitcoincash just works so I would call it windows 7 because it does the job that was expected."
2879,BCH,up,2018-02-08 17:54:51+00:00,CryptoCoinDevil,0,0,#Bitcoin #Bitcoin,Decentralized Marketplace OpenBazaar Now Accepts #Bitcoin Cash https://goo.gl/uxKYX5
2880,BCH,up,2018-02-08 17:57:17+00:00,CryptoPastor,1,0,,"When you see Bitcoin Cash pumping like now, just know altcoins are gonna follow. We may have as well reached the bottom of the dip "
2881,BCH,up,2018-02-08 17:58:24+00:00,HackermanAce,0,1,#crypto #BitcoinCash,Ohhh you all are funny #crypto $bcc right at the end every time lol. Are you going to to pump it more? #BitcoinCash 
2882,BCH,up,2018-02-08 17:58:43+00:00,morumolu1,0,0,,Bitcoincashなぜ上がる？ここは買うべきかどうか迷うところ。
2883,BCH,up,2018-02-08 17:58:49+00:00,RedPillTrading,0,2,,"Bitcoin cash has advances in the tech specifically removed. SegWit is an OPTIONAL advancement that opens up the door to many possibilities. If you think LESS cutting-edge tech is better, enjoy your btrash."
2884,BCH,up,2018-02-08 17:59:54+00:00,Xentagz,121,196,#Bitcoin #Bitcoin #Bcash #Bitcoin #Bitcoin,#Bitcoin Cash should always be referred to as #Bcash to avoid confusion among new bitcoin users. Bcash is a scam on multiple levels and has nothing to do with #Bitcoin (please retweet)
2885,BCH,up,2018-02-08 18:00:00+00:00,CryptoGulp,0,0,,"Top 5 Cryptocurrencies Prices Bitcoin $BTC: $8,234.75 -0.05% Ethereum $ETH: $800.86 -0.91% Ripple $XRP: $0.755433 -0.75% Bitcoin Cash $BCH: $1,287.87 +2.12% Cardano $ADA: $0.345084 -1.11% "
2886,BCH,up,2018-02-08 18:00:01+00:00,BchPulse,0,0,#BCHUSD #BitcoinCash,BCH / USD $1208.93 | -0.0005% #BCHUSD #BitcoinCash
2887,BCH,up,2018-02-08 18:00:02+00:00,ScrapeINT,0,0,,Bitcoin:$8234.75 Ethereum:$803.884 Bitcoin Cash:$1287.87 Litecoin:$144.433 Ripple:$0.7575 IOTA:$1.79043
2888,BCH,up,2018-02-08 18:00:03+00:00,cryptocoinviz,0,0,#Bitcoin #Bitcoin,#Bitcoin Cash | $BCH - Smells like a winner.. - https://www.cryptocoinviz.com/currency/bitcoin-cash-bch
2889,BCH,up,2018-02-08 18:00:03+00:00,cryptcoin_trade,0,0,#BCC #bitcoincash,"Bitcoin Cash: $1,280.37 +24.94% (+$255.60) High: $1,333.00 Low: $941.11 Volume: 4454 $BCC #BCC #bitcoincash"
2890,BCH,up,2018-02-08 18:00:03+00:00,BitcoinCash_ES,0,0,#BitcoinCash #Kraken #BCHEUR,"Cotización del Bitcoin Cash: 1,047 00.€ | -1.32% | Kraken | 08/02/18 19:00 #BitcoinCash #Kraken #BCHEUR"
2891,BCH,up,2018-02-08 18:00:16+00:00,CryptoCoinPLife,0,0,#litecoin #bitcoin #bitcoin #BitcoinCash,"""Форбс"" публикува класация на криптовалютных милиардери - Криптовалута - http://cryptocoinportal.life/news/forbs-pyblikyva-klasaciia-na-kriptovalutnyh-miliarderi.html #litecoin #bitcoin #BitcoinCash "
2892,BCH,up,2018-02-08 18:00:17+00:00,CentretourOrg,0,0,#litecoin #bitcoin #bitcoin #BitcoinCash,В Хабаровском редици отвори snowpark за екстремни - http://centretour.org/news/v-habarovskom-redici-otvori-snowpark-za-ekstremni.html #litecoin #bitcoin #BitcoinCash 
2893,BCH,up,2018-02-08 18:00:17+00:00,coinstats,0,0,#BitcoinCash #BCH,"BitcoinCash - BCH Price: $1,296.23 Change in 1h: +3.86% Market cap: $21,979,653,618.00 Ranking: 4 #BitcoinCash #BCH"
2894,BCH,up,2018-02-08 18:00:18+00:00,CryptoStatsBot,0,0,, Biggest Gainers (1 hr) Bitcoin Cash $BCH 3.86% Santiment Network Token $SAN 2.26% IOStoken $IOST 1.83% Zcash $ZEC 1.33% GameCredits $GAME 1.27% 
2895,BCH,up,2018-02-08 18:00:27+00:00,Ozzmak,0,0,#Swimwear #Swim #CourtneyAllegra #designer #celebrity #LA #cryptocurency #ecoin #Bitcoin #Bitcoin #ecoinnetwork #ethereum #tron #bitcoincash,Courtney Allegra Swim https://www.courtneyallegra.com/ #Swimwear #Swim #CourtneyAllegra https://www.instagram.com/itscourtneyallegra/ … #designer #celebrity #LA - Join The eCoinNetwork. Learn All about #cryptocurency https://ozzmak.ecoinnetwork.com #ecoin #Bitcoin #ecoinnetwork #ethereum #tron #bitcoincash 
2896,BCH,up,2018-02-08 18:00:28+00:00,CryptoCoinPLife,0,0,#litecoin #bitcoin #bitcoin #BitcoinCash,Официален чантата си и браузър Эфириума ще получат опция миг синхронизация - К ... - http://cryptocoinportal.life/news/oficialen-chantata-si-i-brayzr-efiriyma-she-polychat-opciia-mig-sinhronizaciia.html #litecoin #bitcoin #BitcoinCash 
2897,BCH,up,2018-02-08 18:00:31+00:00,CentretourOrg,0,0,#litecoin #bitcoin #bitcoin #BitcoinCash,"""Сибир"" ще лети от Новосибирск в Красноярск - http://centretour.org/news/sibir-she-leti-ot-novosibirsk-v-krasnoiarsk.html #litecoin #bitcoin #BitcoinCash "
2898,BCH,up,2018-02-08 18:00:40+00:00,RFEIFonline,0,0,#RFEIF #BTC #BTC #Bitcoin #Bitcoin,#RFEIF.org | 12 Reasons Bitcoin Cash is the Real Bitcoin... http://bit.ly/2EPjf9w #BTC #Bitcoin
2899,BCH,up,2018-02-08 18:00:45+00:00,TeacherInvestor,0,0,#personalfinance,http://CoinGeek.com financia a equipe da Electron Cash para o desenvolvimento de projetos open source de Bitcoin Cash com a nChain #personalfinance http://cmun.it/k2sdlcw - get content from: http://cmun.it/free-content
2900,BCH,up,2018-02-08 18:00:52+00:00,FeesBitcoin,0,0,#Bitcoin #Bitcoin #BitcoinCash #Bitcoin #Bitcoin #BitcoinCash,"#Bitcoin $8,192.82 v #BitcoinCash $1,275.62 (BTC/BCH 6.4), Avg Transaction fee for #Bitcoin ~$4.59 v #BitcoinCash ~$0.11 - 2018/02/09 03:00JST"
2901,BCH,up,2018-02-08 18:01:10+00:00,JGPI2017,0,0,,Thank you if management agrees please let me know would love to buy the first room with bitcoincash!! Your hotel is amazing and I appreciate your response.
2902,BCH,up,2018-02-08 18:01:12+00:00,nowarnomore,0,1,,Can't believe you guys don't take BitcoinCash yet.
2903,BCH,up,2018-02-08 18:01:17+00:00,gf_mktgp,0,0,,"Crypto Watch: Bitcoin Cash (BCH) Price Surges 28% In 8 Hours, With 22% Bull Run In 2 Hours https://fb.me/FEhcDRax"
2904,BCH,up,2018-02-08 18:01:43+00:00,sextoystumblr1,0,0,,"Bitcoin Cash Outpaces Crypto Market Consolidation with 20% Spike - The top 10 cryptocurrencies by market capitalization look to be consolidating today, generally trading flat to positive below yesterdays highs. The notable exception is bitcoin cash, w... http://ow.ly/yle750gqbcM"
2905,BCH,up,2018-02-08 18:01:48+00:00,coinspectator,0,0,#bitcoin #bitcoin #crypto #eth,"Crypto Watch: Bitcoin Cash (BCH) Price Surges 28% In 8 Hours, With 22% Bull Run... #bitcoin #crypto #eth https://coinspectator.com/news/270414/crypto-watch-bitcoin-cash-bch-price-surges-28-in-8-hours-with-22-bull-run-in-2-hours"
2906,BCH,up,2018-02-08 18:01:49+00:00,TSNNEWS_,0,0,,"Crypto Corner LIVE! on TSN with updates on the markets, Bitcoin Cash and a whole bunch of goodies. https://fb.me/YwXdZMhN"
2907,BCH,up,2018-02-08 18:02:12+00:00,bitbrokersinc,0,1,#bitcoin #bitcoin,"Crypto Watch: Bitcoin Cash (BCH) Price Surges 28% In 8 Hours, With 22% Bull Run In 2 Hours #bitcoin http://ift.tt/2Er7nwB"
2908,BCH,up,2018-02-08 18:02:24+00:00,kmazher1,0,0,,"Most peoples require Crypto for buying and shopping things on regularly and the crypto which provides secured, fast, cheaper and appreciation in value. Bitcoin cash team has devotes themself to achieves all those. They haven't storeed coins to enrich themself"
2909,BCH,up,2018-02-08 18:02:27+00:00,bch_price,0,0,#bitcoincash #bch,Price of 1 BCH to USD: $1287.87 (Change: +0.58 %) Price of 1 BCH to BTC: 0.15629 Ƀ (Change: +0.78 %) #bitcoincash #bch $bch
2910,BCH,up,2018-02-08 18:03:34+00:00,Chandra_Trauth,0,0,#crypto,"RT! -> Crypto Watch: Bitcoin Cash (BCH) Price Surges 28% In 8 Hours, With 22% Bull Run In 2 Hours http://ift.tt/2BLNtvv #crypto"
2911,BCH,up,2018-02-08 18:04:03+00:00,Bitstocks_,0,0,#BitcoinCash #Crypto,#BitcoinCash Outpaces #Crypto Market Consolidation with 20% Spike https://hubs.ly/H09XXtD0 via @CoinDesk
2912,BCH,up,2018-02-08 18:04:28+00:00,JesseDamiani,1,2,#BCH #BCC,"Crypto Watch: Bitcoin Cash $BCH Price Surges 28% In 8 Hours, With 22% Bull Run In 2 Hours @BITCOlNCASH #BCH #BCC https://www.forbes.com/sites/jessedamiani/2018/02/08/crypto-watch-bitcoin-cash-bch-price-surges-28-in-8-hours-with-22-bull-run-in-2-hours/#5d659d5d1c03"
2913,BCH,up,2018-02-08 18:05:14+00:00,Ozzmak,0,0,#RT #cryptocurency #ecoin #Bitcoin #Bitcoin #ecoinnetwork #ethereum #tron #bitcoincash #Affiliates,#RT Follow me on Pinterest https://www.pinterest.com/pin/59954238773004296/ Artist Promotion &amp; Social Media Marketing Join The ★★★★★ eCoinNetwork. Learn All about #cryptocurency https://ozzmak.ecoinnetwork.com #ecoin #Bitcoin #ecoinnetwork #ethereum #tron #bitcoincash #Affiliates
2914,BCH,up,2018-02-08 18:06:08+00:00,eStream_Studios,0,0,#crypto,ICYMI: #crypto @BitcoinRTs Decentralized Marketplace OpenBazaar Now Accepts Bitcoin Cash http://dlvr.it/QFZBRg | http://bit.ly/2vIfQaF
2915,BCH,up,2018-02-08 18:06:17+00:00,Ozzmak,0,0,#OnAMission #shopping #Smiley360 #ozzmak #cryptocurency #ecoin #Bitcoin #Bitcoin #ecoinnetwork #ethereum #tron #bitcoincash #Affiliates,Join me on Smiley360 & try products for free. #OnAMission http://h5.sml360.com/-/2oyev #shopping #Smiley360 #ozzmak Join The ★★★★★ eCoinNetwork. Learn All about #cryptocurency https://ozzmak.ecoinnetwork.com #ecoin #Bitcoin #ecoinnetwork #ethereum #tron #bitcoincash #Affiliates
2916,BCH,up,2018-02-08 18:06:23+00:00,Ozzmak,0,0,#Brand #musicpromo #RT #reverbnation #cryptocurency #ecoin #Bitcoin #Bitcoin #ecoinnetwork #ethereum #tron #bitcoincash #Affiliates,Increase your #Brand popularity! http://ln.is/com/M9ail ♫ ♫ #musicpromo Real Time Promotion #RT #reverbnation Join The ★★★★★ eCoinNetwork. Learn All about #cryptocurency https://ozzmak.ecoinnetwork.com #ecoin #Bitcoin #ecoinnetwork #ethereum #tron #bitcoincash #Affiliates
2917,BCH,up,2018-02-08 18:07:01+00:00,coinonedan,0,0,#Bitcoin #Bitcoin #BitcoinCash #Ethereum,"2018/02/09 03:07:00 [ bitFlyer ] ビットコイン[BTC/JPY]：886,350円 イーサリアム[ETH/JPY]：85,692円 [ Zaif ] ネム[XEM/JPY]： 58.4091円 モナコイン[MONA/JPY]：404.0円 BCH[BCH/JPY]： 138,015円 #Bitcoin #BitcoinCash #Ethereum #仮想通貨 #暗号通貨"
2918,BCH,up,2018-02-08 18:07:12+00:00,CaraJacobs70,0,0,,"Crypto Watch: Bitcoin Cash (BCH) Price Surges 28% In 8 Hours, With 22% Bull Run In 2 Hours http://dlvr.it/QFZBmG"
2919,BCH,up,2018-02-08 18:07:24+00:00,faws_com,0,0,#BTC #BTC #BCH,"Crypto Markets Hold Steady, But Bitcoin Cash Explodes http://blocktribune.com/crypto-markets-hold-steady-bitcoin-cash-explodes/ $BTC #BTC $BCH #BCH"
2920,BCH,up,2018-02-08 18:07:26+00:00,Ozzmak,0,0,#news #advertising #exposure #branding #ozzmak #RT #TwitterPromotions #cryptocurency #ecoin #Bitcoin #Bitcoin #ecoinnetwork #ethereum #tron #bitcoincash #Affiliates,The Ozzmak Daily News http://paper.li/Ozzmak/1407364015 #news #advertising #exposure #branding #ozzmak #RT #TwitterPromotions Join The ★★★★★ eCoinNetwork. Learn All about #cryptocurency https://ozzmak.ecoinnetwork.com #ecoin #Bitcoin #ecoinnetwork #ethereum #tron #bitcoincash #Affiliates
2921,BCH,up,2018-02-08 18:07:49+00:00,Raph96901854,0,0,,Wow. That short video about sums it up for me. Bitcoin Cash is actually a good coin...just bad representation having Roger Ver as a spokesperson.
2922,BCH,up,2018-02-08 18:08:08+00:00,eBargainsToday,0,0,#crypto,ICYMI: #crypto @BitcoinRTs Decentralized Marketplace OpenBazaar Now Accepts Bitcoin Cash http://dlvr.it/QFZCJc | http://bit.ly/2vIfQaF
2923,BCH,up,2018-02-08 18:08:21+00:00,Carlos_Dosil,0,2,#OpenBazaarBCH,"Hey @OpenBazaar, I want my $BCH! My Peer ID is ob://QmcqjixWLsihhdSeCkZkmwu6mMrzz9nXK3gWdx8UhEx8Uw and my OB BCH wallet is bitcoincash:qqac3jfal4v63cjsjxavwqa4x07c502vsqh99c2wau #OpenBazaarBCH"
2924,BCH,up,2018-02-08 18:09:21+00:00,BIGREDMURPHY,0,0,#bitcoincash #bch,"They are both bitcoin, different sides of the same coin. Different road maps, different ideas. #bitcoincash is just following the original idea. They are both forks one was soft one was hard.. Segwit and #bch."
2925,BCH,up,2018-02-08 18:09:26+00:00,j_thomaschki,0,2,#BitcoinCash #bitcoincrash,"They’re back! Bad economy, good offer. #BitcoinCash #bitcoincrash @Toon"
2926,BCH,up,2018-02-08 18:09:29+00:00,CriptoMentors,0,0,#Bitcoin #Bitcoin #Ethereum #BitcoinCash #Ripple #Stellar #Litecoin #NEM #NEO #EOS,"#Bitcoin #Ethereum #BitcoinCash #Ripple #Stellar, #Litecoin #NEM #NEO #EOS: Estaremos frente una nueva tendencia alcista? Análisis de precios http://bit.ly/2nQ0z2b vía @Cointelegraph"
2927,BCH,up,2018-02-08 18:09:57+00:00,kopulov11,0,0,,Мені подобається відео @YouTube Blockchain get Bitcoin Cash 2018 (http://youtu.be/q2vXNYqMaG8?a)
2928,BCH,up,2018-02-08 18:10:08+00:00,TheCaliManCan,0,0,#bitcoin #bitcoin,"Crypto Watch: Bitcoin Cash (BCH) Price Surges 28% In 8 Hours, With 22% Bull Run In 2 Hours https://www.forbes.com/sites/jessedamiani/2018/02/08/crypto-watch-bitcoin-cash-bch-price-surges-28-in-8-hours-with-22-bull-run-in-2-hours/ #bitcoin"
2929,BCH,up,2018-02-08 18:10:30+00:00,slowmotionmoves,0,0,,"As I said, he just can't/won't see it (probably because he's into Bitcoin cash or some other altcoin). His arguments are similar to ""we will never see live stream video on the internet"" in 1995."
2930,BCH,up,2018-02-08 18:10:40+00:00,PortfolioBuzz,0,0,#Machinelearning #bitcoincash,"These assets are seeing a jump in tweets #Machinelearning #bitcoincash $Blockchain $ETH http://www.cityfalcon.com/watchlists?assets=%23Machinelearning,%23bitcoincash,$Blockchain,$ETH"
2931,BCH,up,2018-02-08 18:10:45+00:00,kmazher1,0,1,,Bitcoin cash teams reqire supports from the people' to globalization of Bitcoin cash for every humans.
2932,BCH,up,2018-02-08 18:11:52+00:00,Admiral_hare,0,0,,"Мне понравилось видео ""Blockchain get Bitcoin Cash 2018"" (http://youtu.be/q2vXNYqMaG8?a) на @YouTube."
2933,BCH,up,2018-02-08 18:11:57+00:00,cryptolob777,0,0,,Bitcoin Cash Price Leads the Index as Market Recovers to $400 Billion https://www.cryptolob.com/bitcoin-cash-price-leads-the-index-as-market-recovers-to-400-billion/
2934,BCH,up,2018-02-08 18:12:19+00:00,cadillackiller,0,0,,Keep telling yourself that. What it means is that your bcash bags are going to get A LOT heavier and you bet on the wrong horse.
2935,BCH,up,2018-02-08 18:13:15+00:00,CryptoNewswire,1,1,#cryptocurrency #altcoins #crypto,"Bitcoin Cash, Litecoin and Ripple Daily Analysis - 08/02/18 - http://finance.yahoo.com/news/bitcoin-cash-litecoin-ripple-daily-055511413.html $BTC $BCH $LTC #cryptocurrency #altcoins #crypto"
2936,BCH,up,2018-02-08 18:13:21+00:00,kryptouutiset,0,0,#cryptocurrency #blockchain,"Crypto Watch: Bitcoin Cash (BCH) Price Surges 28% In 8 Hours, With 22% Bull Run In 2 http://kryptouutiset.com/2018/02/crypto-watch-bitcoin-cash-bch-price-surges-28-in-8-hours-with-22-bull-run-in-2-hours/ #cryptocurrency #blockchain"
2937,BCH,up,2018-02-08 18:13:56+00:00,MMialeshka,0,0,,"Мне понравилось видео ""Blockchain get Bitcoin Cash 2018"" (http://youtu.be/q2vXNYqMaG8?a) на @YouTube."
2938,BCH,up,2018-02-08 18:13:58+00:00,realcryptoinfo,0,0,#PresidentTrump #PresidentTrumpCoin #BitcoinCash,#PresidentTrump Coin is getting Dumped &gt; last 24 hours 133% Fluctuation. What are your thoughts on #PresidentTrumpCoin ?$btc $bch #BitcoinCash 
2939,BCH,up,2018-02-08 18:14:09+00:00,coingamma,0,0,#blockchain #bitcoinprice #crypto,Bitcoin $BTC Price: $8234.75 (0.2%) Ethereum $ETH Price: $800.858 (-3.3%) Ripple $XRP Price: $0.755433 (-2.6%) Bitcoin Cash $BCH Price: $1287.87 (26.73%) Cardano $ADA Price: $0.345084 (-2.64%) More Prices: https://goo.gl/Hb6qJN #blockchain #bitcoinprice #crypto
2940,BCH,up,2018-02-08 18:14:12+00:00,kasugainoima,0,0,#bitcoin #bitcoin #BitcoinCash #Ripple,コインチェックで仮想通貨はじめました #ビットコイン #仮想通貨 #コインチェック #bitcoin #BitcoinCash #Ripple #億り人
2941,BCH,up,2018-02-08 18:14:13+00:00,Datos365,0,0,#BitcoinCash,#BitcoinCash ¿Cuánto ha subido hoy el bitcóin? Sigue su precio en tiempo real aquí: https://www.preciobitcoin.net/?btz0=1814021208
2942,BCH,up,2018-02-08 18:14:55+00:00,Tha_trader,0,0,#HODLgang #HODL #hodling #Bitcoin #Bitcoin #bitcoinnews #BitcoinCash #HODLer #Crypto #cryptocurrencynews #cryptocurrencies #cryptocurrency #TRX #BTC #BTC #Ethereum #Litecoin #ripple #Stellarlumens #Stellar #Binance #Binancedown #binance_2017,yay!! #HODLgang #HODL #hodling #Bitcoin #bitcoinnews #BitcoinCash #HODLer #Crypto #cryptocurrencynews #cryptocurrencies #cryptocurrency #TRX #BTC #Ethereum @officialmcafee #Litecoin #ripple #Stellarlumens #Stellar @binance_2017 #Binance #Binancedown #binance_2017
2943,BCH,up,2018-02-08 18:15:00+00:00,CryptoGulp,0,0,,"Top 10 Cryptocurrencies prices during the past hour The biggest loser during the last hour was Bitcoin Cash $BCH, with a price of $1,260.43; a decrease of -2.04%"
2944,BCH,up,2018-02-08 18:15:05+00:00,CryptoCoinDevil,0,0,#Bitcoin #Bitcoin,"To celebrate our newest coin integrations, #Bitcoin Cash and @zcashco (Beta), we are doing… https://goo.gl/vg3GjE"
2945,BCH,up,2018-02-08 18:15:21+00:00,ToastedTokens,0,0,#bear #cryptocrash #btc #btc #bitcoinCash #bch,Newbs are forgetting this is still a #bear market. Be cautious trying to make quick money on the coins that are pumping. #cryptocrash #btc #bitcoinCash #bch
2946,BCH,up,2018-02-08 18:15:50+00:00,Pcrepairlkn,0,0,,"Bitcoin Cash Outpaces Crypto Market Consolidation with 20% Spike - The top 10 cryptocurrencies by market capitalization look to be consolidating today, generally trading flat to positive below yesterdays highs. The notable exception is bitcoin cash, w... http://ow.ly/WiIa50gqbIV"
2947,BCH,up,2018-02-08 18:16:04+00:00,AGDConsulting,0,0,#bitcoin #bitcoin,Bitcoin Cash Markets Recover — While Infrastructure Support Increases https://www.google.com/url?rct=j&amp;sa=t&amp;url=https%3A%2F%2Fnews.bitcoin.com%2Fbitcoin-cash-markets-recover-while-infrastructure-support-increases%2F&amp;ct=ga&amp;cd=CAIyGjMyN2M4N2ZmMTYzMzk2OTU6Y29tOmVuOkNB&amp;usg=AFQjCNEtJAyEUPIxw0MGXj5JzNCr2erfbQ&amp;utm_source=dlvr.it&amp;utm_medium=twitter #bitcoin
2948,BCH,up,2018-02-08 18:16:04+00:00,Darth_Crypto,0,1,#BCash #BitcoinCash #Bitcoin #Bitcoin,"Sometimes somebody actually does a #BCash #BitcoinCash $BCH transaction. You can check it here. https://txhighway.com/ This page was made to show how ""oh so full"" the ""oh so small"" #Bitcoin blocks are. The irony... All $BCH is good for is P&amp;D to transfer value away from idiots."
2949,BCH,up,2018-02-08 18:16:14+00:00,miguelpitufrom,0,0,,"Situación en este momento Bitcoin Cash: Nombre Símbolo Precio 1h 24h 1 Bitcoin BTC $8.220,62 16% 0,13% 2 Ethereum ETH $803,80 -0,01% 4 Bitcoin Cash BCH $1.287,78 7,35% 27,11%"
2950,BCH,up,2018-02-08 18:16:16+00:00,TasteLikeLov,0,0,,"Bitcoin Cash Outpaces Crypto Market Consolidation with 20% Spike - The top 10 cryptocurrencies by market capitalization look to be consolidating today, generally trading flat to positive below yesterdays highs. The notable exception is bitcoin cash, w... http://ow.ly/FlE350gqbWf"
2951,BCH,up,2018-02-08 18:16:19+00:00,BottleOfMemes,0,0,#burgerchef #burgerking #bitcoin #bitcoin #bitcoincash #etherum #ripple #cardano #stellar #neo #litecoin #eos #nem #iota #dash #monero #tron #qtum #lisk #etherumclassic #vechain #populous #icon #nano #tether #bitcoingold #omisego #zcash #steem #bitshares,yo follow my instagram for memes. #burgerchef #burgerking #bitcoin #bitcoincash #etherum #ripple #cardano #stellar #neo #litecoin #eos #nem #iota #dash #monero #tron #qtum #lisk #etherumclassic #vechain #populous #icon #nano #tether #bitcoingold #omisego #zcash #steem #bitshares
2952,BCH,up,2018-02-08 18:16:20+00:00,CoinkingDe,0,0,,"Retweeted CryptoCoin (@dzulkiflimd1967): Bitcoin, Ethereum, Bitcoin Cash, Ripple, Stellar, Litecoin, NEM, NEO,... https://fb.me/7eakSQc6j"
2953,BCH,up,2018-02-08 18:16:25+00:00,BitraceToken,9,11,#bitcoincash #bountyhunters #xmr #buybitcoin #blockchaintechnology #bounty #bitcoinnews #tokens #coin #crowdsales #bitcoinprice #btcx #bonus #coinbase #btc #btc #xrp, BITRACE ICO Token Sale Overview BITRACE Website: https://goo.gl/zk4joj #bitcoincash #bountyhunters #xmr #buybitcoin #blockchaintechnology #bounty #bitcoinnews #tokens #coin #crowdsales #bitcoinprice #btcx #bonus #coinbase #btc #xrp
2954,BCH,up,2018-02-08 18:17:02+00:00,die_perle,0,0,#bitcoin #bitcoin,"Cryptocurrencies Technical Analysis : Ethereum, Ripple, Litecoin, Bitcoin Cash http://bit.ly/2E6Y5mg #bitcoin $btc $eth $iot $mod $xrp $ltc"
2955,BCH,up,2018-02-08 18:17:04+00:00,BitraceToken,11,15,#bitcoincash #bountyhunters #xmr #buybitcoin #blockchaintechnology #bounty #bitcoinnews #tokens #coin #crowdsales #bitcoinprice #btcx #bonus #coinbase #btc #btc #xrp, BITRACE ICO TOKENS HOLDERS Benefit BITRACE Website: https://goo.gl/zk4joj #bitcoincash #bountyhunters #xmr #buybitcoin #blockchaintechnology #bounty #bitcoinnews #tokens #coin #crowdsales #bitcoinprice #btcx #bonus #coinbase #btc #xrp
2956,BCH,up,2018-02-08 18:17:05+00:00,aWebAnalysis,0,0,#bch #bitcoin #bitcoin,"Bitcoin Cash BCH Current Price: $1.239,720 1 Hour: -3.99 % | 24 Hours: 21.85 % | 7 Days: -4.39 % #bch #bitcoin cash"
2957,BCH,up,2018-02-08 18:17:13+00:00,JohnJdeBoer,0,0,#BTC #BTC #BCH #BitcoinCash #Bitcoin #Bitcoin,Please educate me on PnD's as I am probably wrong in thinking this is a good example. - 9 hours on the 15 M chart. This crypto had no significant news. Can you guess which one it is? #BTC #BCH #BitcoinCash #Bitcoin
2958,BCH,up,2018-02-08 18:17:21+00:00,CryptocoinCache,0,0,,"Bitcoin Forks Generated $44 Billion Last Quarter: Report http://ift.tt/29GDCpw The most prominent forks in 2017 resulted in the creation of Bitcoin Cash and Bitcoin Gold. As of this writing, bitcoin cash has a total valuation of $16.4 billion and is the world's fourth most va… "
2959,BCH,up,2018-02-08 18:17:28+00:00,SamAI_Software,0,3,,"Not everybody hate Bitcoin Cash. People are divided in 3 camps: pro-BCH, againt BCH and those who don't care at all. Here is an article with all main events of recent revolution attempt. Check it out and you will see both pros and cons. "
