,crypto,gubun,datetime,username,retweets,favorites,hashtags,text
1,BCH,up,2018-02-08 00:00:00+00:00,BchPulse,0,0,#BCHUSD #BitcoinCash,BCH / USD $1005.35 | -0.0076% #BCHUSD #BitcoinCash
2,BCH,up,2018-02-08 00:00:00+00:00,CryptoGulp,0,0,,"Top 5 Cryptocurrencies Prices Bitcoin $BTC: $7,637.95 -2.90% Ethereum $ETH: $759.04 -4.17% Ripple $XRP: $0.724666 -2.24% Bitcoin Cash $BCH: $961.97 -3.55% Cardano $ADA: $0.343082 -0.69%"
3,BCH,up,2018-02-08 00:00:01+00:00,ScrapeINT,0,0,,Bitcoin:$7637.95 Ethereum:$759.043 Bitcoin Cash:$961.972 Litecoin:$138.855 Ripple:$0.723895 IOTA:$1.60326
4,BCH,up,2018-02-08 00:00:04+00:00,BitcoinCash_ES,0,0,#BitcoinCash #Kraken #BCHEUR,Cotización del Bitcoin Cash: 770 50.€ | -5.55% | Kraken | 08/02/18 01:00 #BitcoinCash #Kraken #BCHEUR
5,BCH,up,2018-02-08 00:00:06+00:00,c_coins2017,0,0,#BCH #BitcoinCash,"BCH最新価格 : 102,899.18 円( 2018-02-08 08:59:55 ) #最新価格 #BCH #ビットコインキャッシュ #BitcoinCash"
6,BCH,up,2018-02-08 00:00:14+00:00,CentretourOrg,0,0,#litecoin #bitcoin #bitcoin #BitcoinCash,В Токио отвори врати хотел марката Hyatt Centric - http://centretour.org/news/v-tokio-otvori-vrati-hotel-markata-hyatt-centric.html #litecoin #bitcoin #BitcoinCash 
7,BCH,up,2018-02-08 00:00:16+00:00,CryptoCoinPLife,0,0,#litecoin #bitcoin #bitcoin #BitcoinCash,Санкциите на САЩ и влиянието им върху криптовалютную индустрия - Криптовалута - http://cryptocoinportal.life/news/sankciite-na-sash-i-vliianieto-im-vrhy-kriptovalutnyu-indystriia.html #litecoin #bitcoin #BitcoinCash 
8,BCH,up,2018-02-08 00:00:17+00:00,coinstats,0,0,#BitcoinCash #BCH,"BitcoinCash - BCH Price: $957.96 Change in 1h: -3.86% Market cap: $16,242,319,571.00 Ranking: 4 #BitcoinCash #BCH"
9,BCH,up,2018-02-08 00:00:27+00:00,CryptoCoinPLife,0,0,#litecoin #bitcoin #bitcoin #BitcoinCash,В Ленобласти използвали блокчейн за регистрация на капиталово договор - Крипто ... - http://cryptocoinportal.life/news/v-lenoblasti-izpolzvali-blokchein-za-registraciia-na-kapitalovo-dogovor.html #litecoin #bitcoin #BitcoinCash 
10,BCH,up,2018-02-08 00:00:39+00:00,fiddler_roof,0,3,#OpenBazaarBCH,"Hey @OpenBazaar, I want my $BCH! My Peer ID is ob://QmW2xjMDxj9N1GhwM5gheSnbuRCqQ9LCo5RtkNYY5ZeD9u and my OB BCH wallet is bitcoincash:qp97e7jst4kf4waghmcv755m2wuukams8vcl78ce6l #OpenBazaarBCH"
11,BCH,up,2018-02-08 00:00:53+00:00,FeesBitcoin,0,0,#Bitcoin #Bitcoin #BitcoinCash #Bitcoin #Bitcoin #BitcoinCash,"#Bitcoin $7,581.80 v #BitcoinCash $951.60 (BTC/BCH 8.0), Avg Transaction fee for #Bitcoin ~$4.61 v #BitcoinCash ~$0.10 - 2018/02/08 09:00JST"
12,BCH,up,2018-02-08 00:00:54+00:00,cryptodemedici,0,1,,And you would sell bitcoin cash before it did a 10x
13,BCH,up,2018-02-08 00:01:27+00:00,hercosyjo1971,0,0,#cryptocurrency,"#cryptocurrency Bitcoin, Ethereum, Bitcoin Cash, Ripple, Stellar, Litecoin, NEM, NEO, EOS: Price Analysis, ... - http://crypto-today.info/bitcoin-ethereum-bitcoin-cash-ripple-stellar-litecoin-nem-neo-eos-price-analysis-february-7-2018/"
14,BCH,up,2018-02-08 00:01:55+00:00,Khannyhotmailc2,0,0,,Is that 10.0 bitcoin cash?
15,BCH,up,2018-02-08 00:02:18+00:00,lupinehy,0,0,#PRICE_ANALYSIS,"Bitcoin, Ethereum, Bitcoin Cash, Ripple, Stellar, Litecoin, NEM, NEO, EOS: Price Analysis, February 7 2018 - Is the downtrend finally over? #PRICE_ANALYSIS http://ow.ly/ZOGK50gpwB3"
16,BCH,up,2018-02-08 00:02:47+00:00,gvtraders,0,0,#cryptocurrency #crypto #altcoin #bitcoin #bitcoin #gvtraders #PRICE_ANALYSIS,"Stay in the Loop. #cryptocurrency #crypto #altcoin #bitcoin #gvtraders Bitcoin, Ethereum, Bitcoin Cash, Ripple, Stellar, Litecoin, NEM, NEO, EOS: Price Analysis, February 7 2018 - Is the downtrend finally over? #PRICE_ANALYSIS http://ow.ly/ZD5L50gpx6X"
17,BCH,up,2018-02-08 00:02:59+00:00,sextoystumblr1,0,0,#BinanceAlternative #BittrexAlternative #CryptoTrading,"HitBTC Exchange: https://goo.gl/MmNJ1g #BinanceAlternative #BittrexAlternative #CryptoTrading Bitcoin, Ethereum, Bitcoin Cash, Ripple, Stellar, Litecoin, NEM, NEO, EOS: Price Analysis, February 7 2018 http://ow.ly/kkRS50gpxen"
18,BCH,up,2018-02-08 00:03:10+00:00,MedievalReviews,0,0,,"Bitcoin, Ethereum, Bitcoin Cash, Ripple, Stellar, Litecoin, NEM, NEO, EOS: Price Analysis, February 7 2018 - See if we can find signs of bullishness in the cryptocurrency market. The views and opinions expressed here are solely those of the author and... http://ow.ly/yDfl50gpx9Z"
19,BCH,up,2018-02-08 00:03:19+00:00,bch_price,0,0,#bitcoincash #bch,Price of 1 BCH to USD: $957.96 (Change: -3.88 %) Price of 1 BCH to BTC: 0.125956 Ƀ (Change: -1.06 %) #bitcoincash #bch $bch
20,BCH,up,2018-02-08 00:03:23+00:00,HallyuWebsite,0,10,#Bitcoin #Bitcoin #BTC #BTC #BitcoinCash #BCH #cryptocurrency #korea #southkorea #crypto #bitcoinprice,The latest from South Korea... #Bitcoin #BTC #BitcoinCash #BCH #cryptocurrency #korea #southkorea #crypto #bitcoinprice
21,BCH,up,2018-02-08 00:03:52+00:00,MOON_ARIAD,0,0,#PRICE_ANALYSIS,"Bitcoin, Ethereum, Bitcoin Cash, Ripple, Stellar, Litecoin, NEM, NEO, EOS: Price Analysis, February 7 2018 - Is the downtrend finally over? #PRICE_ANALYSIS http://ow.ly/euGO50gpy78"
22,BCH,up,2018-02-08 00:04:09+00:00,Pcrepairlkn,0,0,#BinanceAlternative #BittrexAlternative #CryptoTrading,"HitBTC Exchange: https://goo.gl/MmNJ1g #BinanceAlternative #BittrexAlternative #CryptoTrading Bitcoin, Ethereum, Bitcoin Cash, Ripple, Stellar, Litecoin, NEM, NEO, EOS: Price Analysis, February 7 2018 http://ow.ly/sY9z50gpyt1"
23,BCH,up,2018-02-08 00:04:13+00:00,cryptodemedici,0,0,,So you’re half full of shit? Hate bitcoin cash but like ripple?
24,BCH,up,2018-02-08 00:04:18+00:00,Ozzmak,0,0,#People #cryptocurency #ecoin #Bitcoin #Bitcoin #ecoinnetwork #ethereum #tron #bitcoincash #Affiliates,Join Shine On Hollywood Magazine on Facebook https://www.facebook.com/shineonmagazine/posts/1151053818284092 Free Magazine! Real #People Join The ★★★★★ eCoinNetwork. Learn All about #cryptocurency https://ozzmak.ecoinnetwork.com #ecoin #Bitcoin #ecoinnetwork #ethereum #tron #bitcoincash #Affiliates
25,BCH,up,2018-02-08 00:05:16+00:00,cot_criptomoeda,0,0,#bitcoin #bitcoin #litecoin #bitcashcoin #ethereum,"O valor médio das criptomoedas é: Bitcoin(BTC) R$25763,33 Litecoin(LTC) R$465,61 Bitcoin Cash(BCH) R$3127,31 Ethereum(ETH) R$2553,94 #bitcoin #litecoin #bitcashcoin #ethereum"
26,BCH,up,2018-02-08 00:05:24+00:00,Ozzmak,0,0,#RT #cryptocurency #ecoin #Bitcoin #Bitcoin #ecoinnetwork #ethereum #tron #bitcoincash #Affiliates,#RT Follow me on Pinterest https://www.pinterest.com/pin/59954238773004296/ Artist Promotion &amp; Social Media Marketing Join The ★★★★★ eCoinNetwork. Learn All about #cryptocurency https://ozzmak.ecoinnetwork.com #ecoin #Bitcoin #ecoinnetwork #ethereum #tron #bitcoincash #Affiliates
27,BCH,up,2018-02-08 00:05:28+00:00,ohiobitcoin,0,0,#bitcoin #bitcoin,"Bitcoin, Ethereum, Bitcoin Cash, Ripple, Stellar, Litecoin, NEM, NEO, EOS: Price Analysis, February 7 2018 https://goo.gl/fgnZBs #bitcoin"
28,BCH,up,2018-02-08 00:05:53+00:00,coinonedan,0,0,#Bitcoin #Bitcoin #BitcoinCash #Ethereum,"2018/02/08 09:05:52 [ bitFlyer ] ビットコイン[BTC/JPY]：838,000円 イーサリアム[ETH/JPY]：82,962円 [ Zaif ] ネム[XEM/JPY]： 56.0円 モナコイン[MONA/JPY]：376.0円 BCH[BCH/JPY]： 103,000円 #Bitcoin #BitcoinCash #Ethereum #仮想通貨 #暗号通貨"
29,BCH,up,2018-02-08 00:06:20+00:00,EfectoCognitivo,0,0,#BitcoinCash,#BitcoinCash ¿Cuánto ha subido hoy el bitcóin? Sigue su precio en tiempo real aquí: https://www.preciobitcoin.net/?btz41=0006022008
30,BCH,up,2018-02-08 00:06:26+00:00,Ozzmak,0,1,#Brand #musicpromo #RT #reverbnation #cryptocurency #ecoin #Bitcoin #Bitcoin #ecoinnetwork #ethereum #tron #bitcoincash #Affiliates,Increase your #Brand popularity! http://ln.is/com/M9ail ♫ ♫ #musicpromo Real Time Promotion #RT #reverbnation Join The ★★★★★ eCoinNetwork. Learn All about #cryptocurency https://ozzmak.ecoinnetwork.com #ecoin #Bitcoin #ecoinnetwork #ethereum #tron #bitcoincash #Affiliates
31,BCH,up,2018-02-08 00:06:29+00:00,Ozzmak,0,1,#OnAMission #shopping #Smiley360 #ozzmak #cryptocurency #ecoin #Bitcoin #Bitcoin #ecoinnetwork #ethereum #tron #bitcoincash #Affiliates,Join me on Smiley360 & try products for free. #OnAMission http://h5.sml360.com/-/2oyev #shopping #Smiley360 #ozzmak Join The ★★★★★ eCoinNetwork. Learn All about #cryptocurency https://ozzmak.ecoinnetwork.com #ecoin #Bitcoin #ecoinnetwork #ethereum #tron #bitcoincash #Affiliates
32,BCH,up,2018-02-08 00:06:54+00:00,iTabeMan,0,1,,"Oh no! Giving people options is just horrible. They aren’t doing away with btc man. Just giving another option. But let me guess, bcash??? Sigh...."
33,BCH,up,2018-02-08 00:07:16+00:00,coingamma,0,0,#blockchain #bitcoinprice #crypto,Bitcoin $BTC Price: $7637.95 (-0.4%) Ethereum $ETH Price: $759.043 (-2.52%) Ripple $XRP Price: $0.724666 (-5.04%) Bitcoin Cash $BCH Price: $961.972 (0.58%) Cardano $ADA Price: $0.343082 (-4.22%) More Prices: https://goo.gl/Hb6qJN #blockchain #bitcoinprice #crypto
34,BCH,up,2018-02-08 00:07:23+00:00,Ozzmak,0,0,#employment #Job #career #cryptocurency #ecoin #Bitcoin #Bitcoin #ecoinnetwork #ethereum #tron #bitcoincash,"Invite friends to the Hired Marketplace and we'll send you $1,337 when they accept an offer https://hired.com/x/1wne6 #employment #Job #career Join The eCoinNetwork. Learn All about #cryptocurency https://ozzmak.ecoinnetwork.com #ecoin #Bitcoin #ecoinnetwork #ethereum #tron #bitcoincash "
35,BCH,up,2018-02-08 00:07:25+00:00,Ozzmak,0,1,#news #advertising #exposure #branding #ozzmak #RT #TwitterPromotions #cryptocurency #ecoin #Bitcoin #Bitcoin #ecoinnetwork #ethereum #tron #bitcoincash #Affiliates,The Ozzmak Daily News http://paper.li/Ozzmak/1407364015 #news #advertising #exposure #branding #ozzmak #RT #TwitterPromotions Join The ★★★★★ eCoinNetwork. Learn All about #cryptocurency https://ozzmak.ecoinnetwork.com #ecoin #Bitcoin #ecoinnetwork #ethereum #tron #bitcoincash #Affiliates
36,BCH,up,2018-02-08 00:07:28+00:00,Ozzmak,0,0,#sweetrainsrecords #IggyKisil #edm #NewMusicAlert #NowPlaying #cryptocurency #ecoin #Bitcoin #Bitcoin #ecoinnetwork #ethereum #tron #bitcoincash #Affiliates,Top Story: via @sweetrainsnyc https://twitter.com/Ozzmak/status/917731839829090305 #sweetrainsrecords #IggyKisil #edm #NewMusicAlert #NowPlaying Join The ★★★★★ eCoinNetwork. Learn All about #cryptocurency https://ozzmak.ecoinnetwork.com #ecoin #Bitcoin #ecoinnetwork #ethereum #tron #bitcoincash #Affiliates
37,BCH,up,2018-02-08 00:07:42+00:00,smm_sem_expert,0,0,,OpenBazaar Bitcoin Cash Giveaway – How to Claim your $10 in BCH | Buzzeology http://buzzeology.com/openbazaar-bitcoin-cash-giveaway-how-to-claim-your-10-in-bch-buzzeology/
38,BCH,up,2018-02-08 00:08:21+00:00,GlobalCryptoIn,0,0,,"""The Fund invests in a basket of large cap digital assets that will initially include Bitcoin (BTC), Ethereum (ETH), Ripple (XRP), Bitcoin Cash (BCH) and Litecoin (LTC)."""
39,BCH,up,2018-02-08 00:08:21+00:00,Ozzmak,0,1,#ozzmak #Pinterest #socialmediamarketing #twittermarketing #seo #copromote #cryptocurency #ecoin #Bitcoin #Bitcoin #ecoinnetwork #ethereum #tron #bitcoincash,Join me on Pinterest :) https://www.pinterest.com/ozzmak/pins/ #ozzmak #Pinterest #socialmediamarketing #twittermarketing #seo #copromote Join The eCoinNetwork. Learn All about #cryptocurency https://ozzmak.ecoinnetwork.com #ecoin #Bitcoin #ecoinnetwork #ethereum #tron #bitcoincash 
40,BCH,up,2018-02-08 00:08:23+00:00,Ozzmak,0,0,#JellyBelly #candy #JellyBellyFactoryTour #cryptocurency #ecoin #Bitcoin #Bitcoin #ecoinnetwork #ethereum #tron #bitcoincash,Jelly Belly Factory Tour! https://www.youtube.com/watch?v=QdHeDbyWQeo #JellyBelly #candy #JellyBellyFactoryTour https://twitter.com/Ozzmak/status/911594044551086080 Join The eCoinNetwork. Learn All about #cryptocurency https://ozzmak.ecoinnetwork.com #ecoin #Bitcoin #ecoinnetwork #ethereum #tron #bitcoincash
41,BCH,up,2018-02-08 00:09:08+00:00,thecryptinsider,0,0,#Altcoin #BitcoinPrice #EthereumPrice #BitcoinCash #Ripple,"Bitcoin, Ethereum, Bitcoin Cash, Ripple, Stellar, Litecoin, NEM, NEO, EOS: Price Analysis, February 7 2018 http://dlvr.it/QFSb6n #Altcoin #BitcoinPrice #EthereumPrice #BitcoinCash #Ripple"
42,BCH,up,2018-02-08 00:09:22+00:00,Ozzmak,0,1,#Teamwork #ozzmak #cryptocurency #ecoin #Bitcoin #Bitcoin #ecoinnetwork #ethereum #tron #bitcoincash,Top Story: Shine on Hollywood Magazine’s Special Edition: #Teamwork #ozzmak http://wp.me/p57CeT-em via @shineonmag http://www.ShineOnHollywoodMagazine.com Join The eCoinNetwork. Learn All about #cryptocurency https://ozzmak.ecoinnetwork.com #ecoin #Bitcoin #ecoinnetwork #ethereum #tron #bitcoincash 
43,BCH,up,2018-02-08 00:09:23+00:00,Ozzmak,0,1,#job #jobsearch #gethired #hirenow #careers #CareerSuccess #employment #JobFair #cryptocurency #ecoin #Bitcoin #Bitcoin #ecoinnetwork #ethereum #tron #bitcoincash,"Get your friend a job - Get $1,337 https://hired.com/x/1wne6 #job #jobsearch #gethired #hirenow #careers #CareerSuccess #employment #JobFair Join The eCoinNetwork. Learn All about #cryptocurency https://ozzmak.ecoinnetwork.com #ecoin #Bitcoin #ecoinnetwork #ethereum #tron #bitcoincash "
44,BCH,up,2018-02-08 00:10:30+00:00,Ozzmak,0,0,#freemagazine #hollywoodnews #people #cryptocurency #ecoin #Bitcoin #Bitcoin #ecoinnetwork #ethereum #tron #bitcoincash,@shineonmag Shine On Hollywood Magazine – Get Inspired http://shineonhollywoodmagazine.com #freemagazine #hollywoodnews #people Join The eCoinNetwork. Learn All about #cryptocurency https://ozzmak.ecoinnetwork.com #ecoin #Bitcoin #ecoinnetwork #ethereum #tron #bitcoincash 
45,BCH,up,2018-02-08 00:10:31+00:00,Ozzmak,0,1,#Exposure #RTZ #cryptocurency #ecoin #Bitcoin #Bitcoin #ecoinnetwork #ethereum #tron #bitcoincash,Artist Promotion & Social Media Marketing - Go Viral! http://www.viralorganicpromotion.com/ http://m.seo-webtraffic.com/ #Exposure #RTZ Join The eCoinNetwork. Learn All about #cryptocurency https://ozzmak.ecoinnetwork.com #ecoin #Bitcoin #ecoinnetwork #ethereum #tron #bitcoincash 
46,BCH,up,2018-02-08 00:10:33+00:00,Ozzmak,0,1,#cryptocurency #ecoin #Bitcoin #Bitcoin #ecoinnetwork #ethereum #tron #bitcoincash,Increase Reverbnation chart position Now! Get more plays! Join The eCoinNetwork. Learn All about #cryptocurency https://ozzmak.ecoinnetwork.com #ecoin #Bitcoin #ecoinnetwork #ethereum #tron #bitcoincash 
47,BCH,up,2018-02-08 00:11:18+00:00,Ozzmak,0,1,#exposure #ozzmak #socialmedia #copromote #newmusicalert #nowplaying #RT #music #cryptocurency #ecoin #Bitcoin #Bitcoin #ecoinnetwork #ethereum #tron #bitcoincash,Follow me @ozzmak Get free #exposure &amp; Shares! #ozzmak #socialmedia #copromote #newmusicalert #nowplaying #RT #music Join The eCoinNetwork. Learn All about #cryptocurency https://ozzmak.ecoinnetwork.com #ecoin #Bitcoin #ecoinnetwork #ethereum #tron #bitcoincash
48,BCH,up,2018-02-08 00:11:21+00:00,Ozzmak,0,1,#promo #cryptocurency #ecoin #Bitcoin #Bitcoin #ecoinnetwork #ethereum #tron #bitcoincash,"Social media marketing, branding & exposure. Need Viral Promotion? http://www.musicartistnewspromotion.com/2016/05/29/social-media-marketing-branding-exposure/ Only $99 #promo Join The eCoinNetwork. Learn All about #cryptocurency https://ozzmak.ecoinnetwork.com #ecoin #Bitcoin #ecoinnetwork #ethereum #tron #bitcoincash "
49,BCH,up,2018-02-08 00:13:42+00:00,crypto_t1,0,0,#bitcoin #bitcoin #litecoin #ethereum #bitcoincash #ADA #xrp #coinmarketcap #cryptocurrencynews #cryptocurrency #crypto #neo #blockchain #LightningNetwork #segwit,CryptoWatch: Bitcoin has been acting unusually similar to the stock market http://crwd.fr/2EMTUx1 #bitcoin #litecoin #ethereum #bitcoincash #ADA #xrp #coinmarketcap #cryptocurrencynews #cryptocurrency #crypto #neo #blockchain #LightningNetwork #segwit
50,BCH,up,2018-02-08 00:14:24+00:00,kasugainoima,0,0,#bitcoin #bitcoin #BitcoinCash #Ripple,お金が欲しい #ビットコイン #仮想通貨 #コインチェック #bitcoin #BitcoinCash #Ripple #億り人
51,BCH,up,2018-02-08 00:15:00+00:00,CryptoGulp,0,0,,"Top 10 Cryptocurrencies prices during the past hour Star of the hour was NEO $NEO, reaching a price of $107.80; an increase of 3.28% in a single hour Bitcoin Cash $BCH was the biggest loser, it has dropped to $962.10, representing a loss of -2.98%"
52,BCH,up,2018-02-08 00:17:06+00:00,aWebAnalysis,0,0,#bch #bitcoin #bitcoin,"Bitcoin Cash BCH Current Price: $957,108 1 Hour: -3.52 % | 24 Hours: -0.08 % | 7 Days: -35.41 % #bch #bitcoin cash"
53,BCH,up,2018-02-08 00:17:08+00:00,TasteLikeLov,0,0,#BinanceAlternative #BittrexAlternative #CryptoTrading,"HitBTC Exchange: https://goo.gl/MmNJ1g #BinanceAlternative #BittrexAlternative #CryptoTrading Bitcoin, Ethereum, Bitcoin Cash, Ripple, Stellar, Litecoin, NEM, NEO, EOS: Price Analysis, February 7 2018 http://ow.ly/HHb050gpz6d"
54,BCH,up,2018-02-08 00:17:10+00:00,allstyles85,0,1,,Can we throw some ripple and bitcoin Cash logos in the fire blast?
55,BCH,up,2018-02-08 00:17:24+00:00,EagleESBD,0,2,#BCash,"You do know that Core is the name of the code repository right? There would be no BCash without a BCash Core. Since the core is what makes the software work, then Bitcoin Core is the real Bitcoin. I hearby rename #BCash ""Bitcoin Cash Core"""
56,BCH,up,2018-02-08 00:17:28+00:00,limapadd87,0,0,#PRICE_ANALYSIS,"Bitcoin, Ethereum, Bitcoin Cash, Ripple, Stellar, Litecoin, NEM, NEO, EOS: Price Analysis, February 7 2018 - Is the downtrend finally over? #PRICE_ANALYSIS http://ow.ly/768M50gpz7w"
57,BCH,up,2018-02-08 00:17:52+00:00,VolodySk,1,0,#PRICE_ANALYSIS,"Bitcoin, Ethereum, Bitcoin Cash, Ripple, Stellar, Litecoin, NEM, NEO, EOS: Price Analysis, February 7 2018 - Is the downtrend finally over? #PRICE_ANALYSIS http://ow.ly/WYfb50gpzGO"
58,BCH,up,2018-02-08 00:17:55+00:00,Digital_IRA,0,0,#PRICE_ANALYSIS,"News Update: Bitcoin, Ethereum, Bitcoin Cash, Ripple, Stellar, Litecoin, NEM, NEO, EOS: Price Analysis, February 7 2018 - Is the downtrend finally over? #PRICE_ANALYSIS http://ow.ly/CuPi50gpzOQ"
59,BCH,up,2018-02-08 00:18:21+00:00,Ozzmak,1,3,#cryptocurency #ecoin #Bitcoin #Bitcoin #ecoinnetwork #ethereum #tron #bitcoincash #Affiliates,Join The ★★★★★ eCoinNetwork. Learn All about #cryptocurency https://ozzmak.ecoinnetwork.com #ecoin #Bitcoin #ecoinnetwork #ethereum #tron #bitcoincash #Affiliates
60,BCH,up,2018-02-08 00:18:21+00:00,Ozzmak,0,1,#cryptocurency #ecoin #Bitcoin #Bitcoin #ecoinnetwork #ethereum #tron #bitcoincash #Affiliates,Join The ★★★★★ eCoinNetwork. Learn All about #cryptocurency https://ozzmak.ecoinnetwork.com #ecoin #Bitcoin #ecoinnetwork #ethereum #tron #bitcoincash #Affiliates
61,BCH,up,2018-02-08 00:18:40+00:00,PrashantGandhi5,0,1,#Airdrop #airdrop #bounty #bitcoin #bitcoin #btc #btc #ethereum #eth #ripple #xrp #bitcoincash #bch #cardano #ada #stellar #xlm #neo #litecoin #ltc #eos #bitcoinprice #bitcoinnews,Follow me for all crypto latest #Airdrop Follow Retweet ♺ Crypto #airdrop #bounty #bitcoin #btc $btc #ethereum #eth $eth #ripple #xrp $xrp #bitcoincash #bch $bch #cardano #ada $ada #stellar #xlm $xlm #neo $neo #litecoin #ltc $ltc #eos $eos #bitcoinprice #bitcoinnews
62,BCH,up,2018-02-08 00:18:44+00:00,artbtc,0,0,,"Bitcoin, Ethereum, Bitcoin Cash, Ripple, Stellar, Litecoin, NEM, NEO, EOS: Price Analysis, February 7 2018 http://ht.ly/DaHz50gpAyO"
63,BCH,up,2018-02-08 00:18:52+00:00,Paulk201270,0,2,#OpenBazaarBCH,"Hey @OpenBazaar, I want my $BCH! My Peer ID is ob://QmSDsVKJ7dUNT9UqSzEMwJtguegRHnx6gXyhaDD97yTuGp and my OB BCH wallet is bitcoincash:qzgc2d662gxqsg3vvk632eds52eacxpttshsymgd6u #OpenBazaarBCH"
64,BCH,up,2018-02-08 00:19:06+00:00,chenyingzhu2018,0,2,#OpenBazaarBCH,"Hey @OpenBazaar, I want my $BCH! My Peer ID is ob://QmPXH8ZuGTqs3yKCDeJBB9hhWRzgCEPUqz3XHEcPHecPJp and my OB BCH wallet is bitcoincash:qqhdduprd8dyfjd55u3c0287lmj3w7qeeggd7hgshk #OpenBazaarBCH"
65,BCH,up,2018-02-08 00:19:17+00:00,Ozzmak,0,1,#JosieSlayz #music #RT #cryptocurency #ecoin #Bitcoin #Bitcoin #ecoinnetwork #ethereum #tron #bitcoincash,Top Story: Follow JosieSlayz via @JosieOsmak https://www.instagram.com/Josieosmak/ YouTube http://m.youtube.com/channel/UCT35xc8uuryxFiY5i3Iehyw #JosieSlayz @musicallyapp #music #RT Join The eCoinNetwork. Learn All about #cryptocurency https://ozzmak.ecoinnetwork.com #ecoin #Bitcoin #ecoinnetwork #ethereum #tron #bitcoincash 
66,BCH,up,2018-02-08 00:19:18+00:00,Ozzmak,1,2,#cryptocurency #ecoin #Bitcoin #Bitcoin #ecoinnetwork #ethereum #tron #bitcoincash #Affiliates,Join The ★★★★★ eCoinNetwork. Learn All about #cryptocurency https://ozzmak.ecoinnetwork.com #ecoin #Bitcoin #ecoinnetwork #ethereum #tron #bitcoincash #Affiliates
67,BCH,up,2018-02-08 00:19:18+00:00,Ozzmak,0,1,#NoMercy #newmusicalert #guitar #instrumental #ozzmak #rock #newmusic #cryptocurency #ecoin #Bitcoin #Bitcoin #ecoinnetwork #ethereum #tron #bitcoincash,#NoMercy Ozzmak Music #newmusicalert https://www.https://www.reverbnation.com/ozzmakmusic8/song/22414262-no-mercy #guitar #instrumental #ozzmak #rock #newmusic - Join The eCoinNetwork. Learn All about #cryptocurency https://ozzmak.ecoinnetwork.com #ecoin #Bitcoin #ecoinnetwork #ethereum #tron #bitcoincash 
68,BCH,up,2018-02-08 00:19:18+00:00,Ozzmak,0,1,#musicpromo #RT #reverbnation #youtube #soundcloud #instagram #facebook #twitter #cryptocurency #ecoin #Bitcoin #Bitcoin #ecoinnetwork #ethereum #tron #bitcoincash,Increase Your Popularity! @Ozzmak ♫ ♫ #musicpromo Real Time Promotion #RT #reverbnation #youtube #soundcloud #instagram #facebook #twitter Join The eCoinNetwork. Learn All about #cryptocurency https://ozzmak.ecoinnetwork.com #ecoin #Bitcoin #ecoinnetwork #ethereum #tron #bitcoincash 
69,BCH,up,2018-02-08 00:19:19+00:00,Ozzmak,1,2,#cryptocurency #ecoin #Bitcoin #Bitcoin #ecoinnetwork #ethereum #tron #bitcoincash #Affiliates,Join The ★★★★★ eCoinNetwork. Learn All about #cryptocurency https://ozzmak.ecoinnetwork.com #ecoin #Bitcoin #ecoinnetwork #ethereum #tron #bitcoincash #Affiliates
70,BCH,up,2018-02-08 00:19:22+00:00,Ozzmak,0,2,#Exposure #RT #reverbnation #youtube #soundcloud #instagram #facebook #cryptocurency #ecoin #Bitcoin #Bitcoin #ecoinnetwork #ethereum #tron #bitcoincash,Increase Your Popularity! http://wp.me/p57CeT-dF ♫ ♫ Get More #Exposure #RT #reverbnation #youtube #soundcloud #instagram #facebook - Join The eCoinNetwork. Learn All about #cryptocurency https://ozzmak.ecoinnetwork.com #ecoin #Bitcoin #ecoinnetwork #ethereum #tron #bitcoincash 
71,BCH,up,2018-02-08 00:19:34+00:00,EagleESBD,0,1,#BCash,"I hearby rename #BCash, ""Bitcoin Cash Core"" "
72,BCH,up,2018-02-08 00:19:39+00:00,PrashantGandhi5,0,0,#airdrop #bitcoin #bitcoin #bitcoins #bitcoinprice #bitcoinnews #bitcoinmining #BitcoinBillionaire #bitcoincash #bitcointrading #bitcoinexchange #bitcoingold #bitcoinminer #bitcoiner #bitcoinvalue #BitcoinMillionaires #btc #btc,Follow me for all crypto latest #airdrop Follow Retweet ♺ Crypto #bitcoin #bitcoins #bitcoinprice #bitcoinnews #bitcoinmining #BitcoinBillionaire #bitcoincash #bitcointrading #bitcoinexchange #bitcoingold #bitcoinminer #bitcoiner #bitcoinvalue #BitcoinMillionaires #btc
73,BCH,up,2018-02-08 00:20:26+00:00,Ozzmak,0,2,#cryptocurency #ecoin #Bitcoin #Bitcoin #ecoinnetwork #ethereum #tron #bitcoincash #Affiliates #CASH,Join The ★★★★★ eCoinNetwork. Learn All about #cryptocurency https://ozzmak.ecoinnetwork.com #ecoin #Bitcoin #ecoinnetwork #ethereum #tron #bitcoincash #Affiliates #CASH
74,BCH,up,2018-02-08 00:20:37+00:00,cryptow1re,0,0,,@Reddit_BTC : Wicked Wednesday Bitcoin Cash Tip giveaway + enter weekly raffle for $50 in BCH 
75,BCH,up,2018-02-08 00:20:43+00:00,Stocks_Beginner,0,1,#cryptocurrency #cryptocurrencies #bitcoin #bitcoin #Crypto #blockchain #fintech #BitcoinCash #cryptocurrencynews #tradingcrypto #cryptocrash #digitalcurrency #Prediction #money,"""Crypto Experts Predict 2018 Bull Run: Bitcoin To $50k, Overall Market Cap To $1 Trln"" https://cointelegraph.com/news/crypto-experts-predict-2018-bull-run-bitcoin-to-50k-overall-market-cap-to-1-trln #cryptocurrency #cryptocurrencies #bitcoin #Crypto #blockchain #fintech #BitcoinCash #cryptocurrencynews #tradingcrypto #cryptocrash #digitalcurrency #Prediction #money"
76,BCH,up,2018-02-08 00:20:54+00:00,coinonedan,0,0,#Bitcoin #Bitcoin #BitcoinCash #Ethereum,"2018/02/08 09:20:53 [ bitFlyer ] ビットコイン[BTC/JPY]：850,399円 イーサリアム[ETH/JPY]：85,099円 [ Zaif ] ネム[XEM/JPY]： 56.9円 モナコイン[MONA/JPY]：382.3円 BCH[BCH/JPY]： 104,995円 #Bitcoin #BitcoinCash #Ethereum #仮想通貨 #暗号通貨"
77,BCH,up,2018-02-08 00:21:07+00:00,realJohnnyBCH,0,3,#OpenBazaarBCH,"Hey @OpenBazaar, I want my $BCH! My Peer ID is ob://QmTXR7Fvh7dE31tmaFqiWt7zdR1ebJqoSqK5Z1inNFF6AS and my OB BCH wallet is bitcoincash:qr54x273lsp4rc55v54m0g2p4q8vawhr7y2k65yyax #OpenBazaarBCH"
78,BCH,up,2018-02-08 00:21:49+00:00,EagleESBD,0,1,,Are you talking Bitcoin Core or Bitcoin Cash Core?
79,BCH,up,2018-02-08 00:23:13+00:00,TRCoinOfficial,0,1,#RT,#RT @Bitcoin: @Awyee707 Bitcoin Cash is Bitcoin. $1 @tipprbot
80,BCH,up,2018-02-08 00:23:22+00:00,Ozzmak,0,2,#cryptocurency #ecoin #Bitcoin #Bitcoin #ecoinnetwork #ethereum #tron #bitcoincash #Affiliates #makemoney #bitcoinwallet #affiliatemarketing #mlmmarketing #bitcoinmlm #poloniex #bittrex #binance,Join The ★★★★★ eCoinNetwork. Learn All about #cryptocurency https://ozzmak.ecoinnetwork.com #ecoin #Bitcoin #ecoinnetwork #ethereum #tron #bitcoincash #Affiliates #makemoney #bitcoinwallet #affiliatemarketing #mlmmarketing #bitcoinmlm #poloniex #bittrex #binance
81,BCH,up,2018-02-08 00:23:23+00:00,CryptoNamer,0,0,#cryptocurrency #Bitcoin #Bitcoin #Ripple #Ethereum #BitcoinCash #Cardano #Litecoin #NEO #NEM #Stellar #IOTA,TyrantCoin #cryptocurrency #Bitcoin #Ripple #Ethereum #BitcoinCash #Cardano #Litecoin #NEO #NEM #Stellar #IOTA
