,crypto,gubun,datetime,username,retweets,favorites,hashtags,text
885,BCH,down,2018-11-27 11:01:21+00:00,CriptosEnEsp,0,0,#CryptoCotizaci #bitcoin #bitcoin #ethereum #ripple #bitcoincash #litecoin #eos #neo #crypto #criptomonedas,#CryptoCotización Precios actualizados a las 12:01:17. #bitcoin #ethereum #ripple #bitcoincash #litecoin #eos #neo #crypto #criptomonedas
886,BCH,down,2018-11-27 11:01:24+00:00,AlexMagicStudio,0,0,#Litecoin #BCH #BCHSV,"Предсказание Чарли Ли сбылось и Litecoin обошел Bitcoin Cash по капитализации, ну тот другой, который SV. Или это ""настоящий биткоин"". Я запутался... #Litecoin #BCH #BCHSV"
887,BCH,down,2018-11-27 11:02:50+00:00,bch_price,0,0,#bitcoincash #bch,Price of 1 BCH to USD: $175.87 (Change: -0.51 %) Price of 1 BCH to BTC: 0.04722643 Ƀ (Change: -0.83 %) #bitcoincash #bch $bch
888,BCH,down,2018-11-27 11:04:05+00:00,CoinAjansCom,0,0,,"Ryan Charles: Bitcoin Cash SV, Koin Başına Bir Milyon Doları Bulabilir! https://coinajans.com/haberler/14144-ryan-charles-bitcoin-cash-sv-koin-basina-bir-milyon-dolari-bulabilir"
889,BCH,down,2018-11-27 11:04:25+00:00,hexabond,1,3,#cryptocurrencies #Crypto #cryptocurrency #cryptotwitter #bitcoin #bitcoin #BitcoinTalk #bitcoinmining #BitcoinCash #ripplenews #xrp #BlockChainNews #Ethereum #altcoins #blockchain #Trending #TrendingNow #trendingnews,China Lifts Ban from Bitcoin. #cryptocurrencies #Crypto #cryptocurrency #cryptotwitter #bitcoin #BitcoinTalk #bitcoinmining #BitcoinCash #ripplenews #xrp #BlockChainNews #Ethereum #altcoins #blockchain #Trending #TrendingNow #trendingnews
890,BCH,down,2018-11-27 11:05:09+00:00,Bikashroy1986,0,0,,@ProfFaustus @CalvinAyre @rogerkver I assume you all are simply trying to manipulate people from the core Btc to all the babies born out of Btc known as bitcoin cash and bitcoin http://SV.it could be a bleeding market but Btc will always remain btc how much you all
891,BCH,down,2018-11-27 11:05:12+00:00,AlgoryProject,0,0,#cryptocurrency #cryptonews #crypto #algory #BTC #BTC #ETH #BCH #LTC #Bitcoin #Bitcoin #Ethereum #BitcoinCash #Litecoin,"Paysafe, Worldpay Partner On New Payment Solution For US iGaming And Sports Betting Markets Read more: https://app.algory.io/app/cryptonews/340898/paysafe-worldpay-partner-on-new-payment &#13;#cryptocurrency #cryptonews #crypto #algory #BTC #ETH #BCH #LTC #Bitcoin #Ethereum #BitcoinCash #Litecoin"
892,BCH,down,2018-11-27 11:05:17+00:00,lover_drop,0,0,,(crypto gets 4words or less)Bitcoin_Cash[BCH]=Bitcoin clone
893,BCH,down,2018-11-27 11:06:17+00:00,cryptonews,1,1,,"Less than two weeks old Bitcoin SV (BSV), the Bitcoin Cash (BCH) fork, just pushed Monero, the most popular privacy coin, out of the top 10 biggest cryptocurrencies by market capitalization. "
894,BCH,down,2018-11-27 11:07:15+00:00,CoinNessCom,0,0,#cryptocurrency #bitcoin #bitcoin #BTC #BTC #blockchain #Crypto #finance #cryptocurrencyNews #Ethereum #fintech #digitalasset #ICO #Exchange #bitcoinnews #btcnews #bitcoincash #cryptomarket #payment,Stellar and Monero to Consolidate Their Market Cap Read more: https://www.coinness.com/news/165890 #cryptocurrency #bitcoin #BTC #blockchain #Crypto #finance #cryptocurrencyNews #Ethereum #fintech #digitalasset #ICO #Exchange #bitcoinnews #btcnews #bitcoincash #cryptomarket #payment
895,BCH,down,2018-11-27 11:07:34+00:00,Kointimes,0,0,#Bitcoin #Bitcoin #kriptopara,"Ryan Charles: #Bitcoin Cash SV, Koin Başına Bir Milyon Doları Bulabilir! #kriptopara"
896,BCH,down,2018-11-27 11:11:39+00:00,CoinZoomHQ,0,0,,Bitcoin Cash Target Level: 184.4300#CoinZoom#CoinZoomAI#blockchain#btc#crypto#bitcoin#fintech #Ethereum#AI#ETH#cryptocurrencies#tradingBitcoin Cash 
897,BCH,down,2018-11-27 11:11:43+00:00,ToddCrosland,0,1,,Bitcoin Cash Target: 184.4300 #CoinZoom#CoinZoomAI#cryptocurrencies#trading#blockchain#btc#crypto#bitcoin#fintech #Ethereum#AI#ETH 
898,BCH,down,2018-11-27 11:11:53+00:00,Jhosseph_ppc,1,0,,"Fin de la Guerra de Hash de Bitcoin Cash (BCH), ambas cadenas continuarán "
899,BCH,down,2018-11-27 11:12:14+00:00,bitcoin_vn,0,0,#Ti #Ti #Tint #GiaBitcoin #BitcoinVietnam #Bitcoin #Bitcoin #Ethereum #Dash #BitcoinCash #Ripple #Litecoin,Liệu việc chấp nhận Bitcoin của Ohio cho các khoản thanh toán thuế có làm tăng tính hợp pháp của Crypto? #Tiềnảo #Tiềnđiệntử #TintứcBitcoin #GiaBitcoin #BitcoinVietnam #Bitcoin #Ethereum #Dash #BitcoinCash #Ripple #Litecoin
900,BCH,down,2018-11-27 11:12:43+00:00,meshlift1,0,0,,bitcoincash:qqhle3rhn0yuquawz9uhugldn2nmd3kl8y2qgk5kxu?amount=582.08065740
901,BCH,down,2018-11-27 11:13:45+00:00,coingamma,0,0,#blockchain #bitcoinprice #crypto,Bitcoin $BTC Price: $3727.03 (-6.25%) XRP $XRP Price: $0.35 (-6.83%) Ethereum $ETH Price: $104.61 (-8.55%) Bitcoin Cash $BCH Price: $175.84 (-13.19%) Stellar $XLM Price: $0.14 (-9.15%) More Prices: https://goo.gl/Hb6qJN #blockchain #bitcoinprice #crypto
902,BCH,down,2018-11-27 11:14:02+00:00,UINP_Community,0,5,#UINP #airdrops #eth #BCH #btc #btc #bitcoin #bitcoin #BitcoinCash #BTC #BTC #Coinbase #cryptocurrency #technology #blockchain #blockchaintechnology #ethereum #crosschain #btcnews #Crypto #cryptocurrencies #CryptocurrencyNews #CryptoNews #Airdrop #cryptotrading,#UINP traveling the world. #airdrops #eth #BCH #btc #bitcoin #BitcoinCash #BTC #Coinbase #cryptocurrency #technology #blockchain #blockchaintechnology #ethereum #crosschain #btcnews #Crypto #cryptocurrencies #CryptocurrencyNews #CryptoNews #Airdrop #cryptotrading
903,BCH,down,2018-11-27 11:14:28+00:00,redbullinv,0,0,,Результаты чёрной пятницы. Грандиозные невиданные распродажи. Высокие объёмы. Распродажа в % от самых верхних точек: ICON: -98% Qtum: -98% Cardano: -97% NEM: -97% Lisk: -97% Bitcoin Gold: -96% NEO: -96% TRON: -96% Bitcoin Cash: -95% IOTA: -95% Dash: … 
904,BCH,down,2018-11-27 11:14:51+00:00,JustJoeJG,0,0,#BCH #aidrips #BitcoinCash #bitcoin #bitcoin #paidbooks #blockchainstats,"http://www.airdrips.com/earn/?dao_ref=CPXNV3priK Earn #BCH passively while you read, play games or check blockchain stats. #aidrips #BitcoinCash #bitcoin #paidbooks #blockchainstats"
905,BCH,down,2018-11-27 11:15:10+00:00,InvestingTR,0,1,,"Ryan Charles: Bitcoin Cash SV, Koin Başına Bir Milyon Doları Bulabilir! - https://invst.ly/9c7dh"
906,BCH,down,2018-11-27 11:15:21+00:00,ScrapeINT,0,0,,Bitcoin:$3734.48622094 Ethereum:$104.887367873 Bitcoin Cash:$175.895715815 Litecoin:$29.4398555862 XRP:$0.349688109 IOTA:$0.2653495888
907,BCH,down,2018-11-27 11:17:04+00:00,aWebAnalysis,0,0,#bch #bitcoin #bitcoin,"Bitcoin Cash BCH Current Price: $175,902 1 Hour: 0.36 % | 24 Hours: -14.19 % | 7 Days: -21.82 % #bch #bitcoin cash"
908,BCH,down,2018-11-27 11:17:15+00:00,sureshone,0,0,,ABC vs CV: Assessing the Consequences of the Bitcoin Cash War 
909,BCH,down,2018-11-27 11:17:43+00:00,Smartereum,1,0,,Bitcoin Cash SV Will Hit $1 Million According To Ryan X. Charles of Reddit - https://smartereum.com/43636/bch-hash-wars-bitcoin-cash-sv-will-hit-1-million-according-to-ryan-x-charles-of-reddit-bch-news-today/
910,BCH,down,2018-11-27 11:20:02+00:00,EarlyAdopter23,0,0,#cryptocurrencies #Bitcoin #Bitcoin #XRP #Ethereum #BitcoinCash #Stellar #instabitcoin #SmartContracts #trading,"Top 5 #cryptocurrencies Alert Time: 2018-11-27 14:20:02 #Bitcoin: $3,734.486 #XRP: $0.350 #Ethereum: $104.887 #BitcoinCash: $175.882 #Stellar: $0.141 #instabitcoin #SmartContracts #trading $JPY $QRL http://www.coincaps.ai"
911,BCH,down,2018-11-27 11:20:05+00:00,Cryptoc46572563,0,0,#Cryptocurrency #bitcoin #bitcoin,"Major Cryptocurrency latest prices(27,Nov 06:20) [Bitcoin(BTC)] 3,711.21 USD [Ethereum(ETH)] 104.04 USD [XRP(XRP)] 0.35 USD [Bitcoin Cash(BCH)] 208.51 USD [Litecoin(LTC)] 29.27 USD Learn more -&gt; https://coins.lat #Cryptocurrency #bitcoin"
912,BCH,down,2018-11-27 11:20:30+00:00,cash_en,15,47,#SatoshiVision #Bitcoin #Bitcoin,"Bitcoin #SatoshiVision sounds to me better brand than BitcoinCash. Granted, Bitcoin is cash, but “cash” conveys kind of “cheap” notion. A pity the year wasted in brand name marketing, though. And...BitcoinSV Sounds like Victory :) $BSV will be called just #Bitcoin in due time."
913,BCH,down,2018-11-27 11:21:01+00:00,bubblymiles,0,1,#bitcoincash #faketoshi,"CT be like, ‘let me draw some charts and outline 5th waves’...cuz you know $BSV to the moon. Hang on a min, it’s a bloody pump and dump in the making. Enjoy the ride whilst you can and don’t be left with the bags in the end. #bitcoincash #faketoshi"
914,BCH,down,2018-11-27 11:23:19+00:00,CoinNessCom,0,2,#cryptocurrency #bitcoin #bitcoin #BTC #BTC #blockchain #Crypto #finance #cryptocurrencyNews #Ethereum #fintech #digitalasset #ICO #Exchange #bitcoinnews #btcnews #bitcoincash,"Pyramid Schemes Hunting Tron Down, It's Time for Justin Sun to Get Down to Earth. Link: https://www.coinness.com/news/165908 #cryptocurrency #bitcoin #BTC #blockchain #Crypto #finance #cryptocurrencyNews #Ethereum #fintech #digitalasset #ICO #Exchange #bitcoinnews #btcnews #bitcoincash "
915,BCH,down,2018-11-27 11:25:31+00:00,Coinpediamarket,0,0,#litecoin #Cardano #bitcoincashfork #bitcoincashsv #Coinmarketcap #Ranking #cryptocurrencies #Tether #latestnews,Bitcoin Cash hard fork Bitcoin SV ranks at eight position in CoinMarketCap Crypto Rating. @bitcoincashsv #litecoin #Cardano #bitcoincashfork #bitcoincashsv #Coinmarketcap #Ranking #cryptocurrencies #Tether #latestnews
916,BCH,down,2018-11-27 11:26:24+00:00,LondonLiveEvent,0,1,#eventprofs #conferences #cryptocurrency #blockchain #bitcoincash #london,RT @MermaidLondon: Today's the day that CoinGeek's Bitcoin Cash conference comes to The Mermaid London! If you're travelling by via tube or train our closet station is Blackfriars http://ow.ly/o2li30mE0wq #eventprofs #conferences #cryptocurrency #blockchain #bitcoincash #london…
917,BCH,down,2018-11-27 11:27:49+00:00,bitcoin_vn,0,0,#Ti #Ti #Tint #GiaBitcoin #BitcoinVietnam #Bitcoin #Bitcoin #Ethereum #Dash #BitcoinCash #Ripple #Litecoin,"Coinbase ủng hộ vòng tài trợ 12,7 triệu đô la của Startup Token bảo mật #Tiềnảo #Tiềnđiệntử #TintứcBitcoin #GiaBitcoin #BitcoinVietnam #Bitcoin #Ethereum #Dash #BitcoinCash #Ripple #Litecoin"
918,BCH,down,2018-11-27 11:27:50+00:00,bitcoin_vn,0,0,#Ti #Ti #Tint #GiaBitcoin #BitcoinVietnam #Bitcoin #Bitcoin #Ethereum #Dash #BitcoinCash #Ripple #Litecoin,Giá Bitcoin giảm 7% khi thị trường crypto gặp khó khăn để duy trì đà tăng #Tiềnảo #Tiềnđiệntử #TintứcBitcoin #GiaBitcoin #BitcoinVietnam #Bitcoin #Ethereum #Dash #BitcoinCash #Ripple #Litecoin
919,BCH,down,2018-11-27 11:29:06+00:00,TheAlumniGroup1,0,0,,"Bitcoin Briefly Breaks Over $4,000, Bitcoin Cash Sees Gains Near 20 Percent on the Day "
920,BCH,down,2018-11-27 11:29:11+00:00,LtdDoc,0,0,,Buy Bitcoin Cash When the Dust Settles - Forbes https://www.forbes.com/sites/investor/2018/11/26/buy-bitcoin-cash-when-the-dust-settles/
921,BCH,down,2018-11-27 11:30:23+00:00,RealCoinGeek,8,21,#bitcoinsv #bitcoincash #crypto,"CoinGeek will support a permanent chain split from Bitcoin Cash (BCH), continue mining the BSV chain. http://ayre.to/owDH30mLksq #bitcoinsv #bitcoincash #crypto"
922,BCH,down,2018-11-27 11:30:42+00:00,KLoaec,0,2,,"Plutot naif je trouve, extrapolation plus qu'autre chose. Les vrais mineurs ne ferment pas boutique. Le kwh n'est pas a 2 euro (wtf??). Bitcoin cash est totalement insignifiant, Craig Wright encore plus. Le prix baisse car les gens vendent (ico aussi, vrai)."
923,BCH,down,2018-11-27 11:31:34+00:00,msdenmail,0,0,,Cloud mining. Bonus 100 GH/s. USD. Ether Classic. Ethereum. Litecoin. Bitcoin. Bitcoin Cash. Dash. Dogecoin. Zcash. @Sign Up - http://bit.ly/2OQLBDZ
924,BCH,down,2018-11-27 11:32:23+00:00,gobitcoinlive,0,0,,"I've just posted a new blog: Batalha pelo nome Bitcoin Cash termina; Apoiador do Bitcoin SV clama por ""separação permanente"" das criptomoedas - Criptomoedas Fácil https://ift.tt/2TO0F8X"
925,BCH,down,2018-11-27 11:32:25+00:00,cryptocurrency,1,5,#bitcoin #bitcoin #bitcoinprice #cryptocurrency #litecoin #ethereum #bitcoincash #ripple #cardano #EOS #Stellar #Tether,Check out our actual TOP10 CryptoCurrency price index! #bitcoin #bitcoinprice #cryptocurrency #litecoin #ethereum #bitcoincash #ripple #cardano #EOS #Stellar #Tether
926,BCH,down,2018-11-27 11:33:15+00:00,honanem,0,0,,コインチェック：BCHのハードフォークに係る一部停止機能を再開 Bitcoin ABCが参照するチェーンを、Bitcoin Cash（BCH）として表記(実際に入金開始) BCH売買再開 SVの入金対応はなし(残高反映・返金対応なし) ハードフォーク付与通貨(SV)の対応は未定 リプレイアタック対策を実施済み 
927,BCH,down,2018-11-27 11:33:29+00:00,Blockspot_io,0,0,#Coinbase #BitcoinCash #InsiderTrading,Amended Suit Against #Coinbase Details #BitcoinCash #InsiderTrading Claims https://goo.gl/zcjR4m
928,BCH,down,2018-11-27 11:34:42+00:00,kevinmonserrat,0,0,#Bitcoin #Bitcoin #Cryptocurrency,The Entire Crypto Market Sinks But #Bitcoin Cash SV Seems to be Gaining Power https://coinidol.com/entire-crypto-market-sinks/ #Cryptocurrency
929,BCH,down,2018-11-27 11:38:47+00:00,XATGtoken,0,0,,Huobi(フオビ)がBitcoin Cash ABCをBCHとして上場 
930,BCH,down,2018-11-27 11:39:33+00:00,AvocadoByProof,0,0,#BitcoinDiamond #BitcoinSV #BitcoinCash #crypto,"Results are in for the last 10 minutes: the best crypto performer is #BitcoinDiamond (0.6%), while the biggest loser is #BitcoinSV (-1.8%). ||| Greatest overall change (price or volume) is: #BitcoinCash with a 3.9% negative change in volume #crypto https://bit.ly/2zPNY7s"
931,BCH,down,2018-11-27 11:40:02+00:00,EarlyAdopter23,0,0,#cryptocurrencies #Bitcoin #Bitcoin #XRP #Ethereum #BitcoinCash #Stellar #instavenezuela #ethereum #altcoin #pumpanddump #stockmarket,"Top 5 #cryptocurrencies Alert Time: 2018-11-27 14:40:01 #Bitcoin: $3,713.989 #XRP: $0.347 #Ethereum: $104.153 #BitcoinCash: $173.769 #Stellar: $0.140 #instavenezuela #ethereum #altcoin #pumpanddump #stockmarket http://www.coincaps.ai"
932,BCH,down,2018-11-27 11:40:03+00:00,Qp3bcS0Y1DBpWGq,0,0,,"主要仮想通貨 現在の価格(11/27 19:40) [Bitcoin(BTC)] 417,575.98円 [Ethereum(ETH)] 11,772.99円 [XRP(XRP)] 38.93円 [Bitcoin Cash(BCH)] 26,441.53円 [Litecoin(LTC)] 3,282.56円 続き→https://coins.lat/ja #仮想通貨 #ビットコイン"
933,BCH,down,2018-11-27 11:45:01+00:00,jimmyzhong_iost,598,726,#BCH #BSV #Bitcoin #Bitcoin #crypto #bitcoincash,"With the end of the #BCH vs #BSV civil war, I feel it's only appropriate to ask, can the real #Bitcoin imitator please stand up? There's brilliant tech being developed in the #crypto space. Any time spent focusing on @ProfFaustus, @CalvinAyre or #bitcoincash is time wasted. "
934,BCH,down,2018-11-27 11:45:21+00:00,ScrapeINT,1,0,,Bitcoin:$3709.96897904 Ethereum:$103.979180454 Bitcoin Cash:$173.347698919 Litecoin:$29.1459445557 XRP:$0.3467648381 IOTA:$0.2632986776
935,BCH,down,2018-11-27 11:46:32+00:00,MDinda_,1,3,#samuel #bravebrother #bitcoincash #rogerver #bch #brave #bitcoin #bitcoin #kpop #manila #bravesound,"RT @BraveSoundToken: ""At the Token News Conference in Manila on Nov 25th. Happy birthday, Samuel! #samuel #サムエル #bravebrother #bitcoincash #rogerver #bch #brave #bitcoin #kpop #manila #김사무엘 #bravesound https://twitter.com/BraveSoundToken/status/1067379533995683840/photo/1"
936,BCH,down,2018-11-27 11:47:36+00:00,TreeHugginLovin,0,0,#Bitcoin #Bitcoin,This Bitcoin Cash fork is beyond ridiculous. Satoshi's vision for Bitcoin is fucking Bitcoin not Bitcoin SV or B trash #Bitcoin☇
937,BCH,down,2018-11-27 11:48:58+00:00,webnowcompany,0,0,#BTC #BTC #BCH,#BTC #BCH It’s been more than a week since the split in Bitcoin Cash (BCH) blockchain. Two opposing sides clashed over the future of BCH as an asset. The crypto mark...Read more: 
938,BCH,down,2018-11-27 11:50:02+00:00,EarlyAdopter23,0,0,#cryptocurrencies #Bitcoin #Bitcoin #XRP #Ethereum #BitcoinCash #Stellar #instaeth #instaairdrop #monero #stockmarket,"Top 5 #cryptocurrencies Alert Time: 2018-11-27 14:50:02 #Bitcoin: $3,708.653 #XRP: $0.348 #Ethereum: $103.912 #BitcoinCash: $172.956 #Stellar: $0.139 #instaeth #instaairdrop #monero $BTCEUR #stockmarket http://www.coincaps.ai"
939,BCH,down,2018-11-27 11:50:48+00:00,TickerTop,0,0,,1: Bitcoin average price is $3713.77685989 (-0.58% 1h) 2: XRP average price is $0.347246577 (-0.99% 1h) 3: Ethereum average price is $103.92196463 (-0.77% 1h) 4: Bitcoin Cash average price is $172.32329018 (-2.06% 1h) 5: Stellar average price is $0.1390373926 (-0.94% 1h)
940,BCH,down,2018-11-27 11:52:27+00:00,cot_criptomoeda,0,0,#bitcoin #bitcoin #litecoin #bitcashcoin #ethereum,"O valor médio das criptomoedas é: Bitcoin(BTC) R$14979,22 Litecoin(LTC) R$117,88 Bitcoin Cash(BCH) R$732,50 Ethereum(ETH) R$427,79 #bitcoin #litecoin #bitcashcoin #ethereum"
941,BCH,down,2018-11-27 11:52:51+00:00,ssaurel,0,0,#Bitcoin #Bitcoin #BitcoinCash #BCH #BitcoinCashABC #BitcoinCashSV #CryptoMonnaies #CryptoNews #Ethereum #RogerVer,Qui gagnera la guerre entre le Bitcoin Cash ABC et le Bitcoin Cash SV ? https://fr.quora.com/unanswered/Qui-gagnera-la-guerre-entre-le-Bitcoin-Cash-ABC-et-le-Bitcoin-Cash-SV?ch=2 @quora #Bitcoin #BitcoinCash #BCH #BitcoinCashABC #BitcoinCashSV #CryptoMonnaies #CryptoNews #Ethereum #RogerVer
942,BCH,down,2018-11-27 11:53:11+00:00,ssaurel,0,0,#Bitcoin #Bitcoin #BitcoinCash #BCH #BitcoinCashABC #BitcoinCashSV #Cryptocurrencies #CryptoNews #Ethereum #RogerVer,Who will win the war between Bitcoin Cash ABC and Bitcoin Cash SV? https://www.quora.com/unanswered/Who-will-win-the-war-between-Bitcoin-Cash-ABC-and-Bitcoin-Cash-SV?ch=2 @quora #Bitcoin #BitcoinCash #BCH #BitcoinCashABC #BitcoinCashSV #Cryptocurrencies #CryptoNews #Ethereum #RogerVer
943,BCH,down,2018-11-27 11:55:41+00:00,aBitcoinGirl,0,0,,One Week Later: The Latest Developments in the Bitcoin Cash Split .... 
944,BCH,down,2018-11-27 11:56:24+00:00,altcoinsscom,0,0,,Bitcoin Cash SV Price Keeps Rising Despite Market Pressure: There are numerous… https://goo.gl/fb/fkMWFE
945,BCH,down,2018-11-27 11:56:35+00:00,ru_olymptrade,0,0,," Биткоин продолжает консолидацию. Его средневзвешенный курс составляет $3 800, теряя 6% за сутки. Альткоины, за исключением Bitcoin SV и Bitcoin ABC (Bitcoin Cash), так же в минусе на 6–9%. Полный обзор крипторынка в нашем блоге → http://bit.ly/2P7ladj"
946,BCH,down,2018-11-27 11:57:21+00:00,bloggerviews_co,0,0,,What you need to know about the Bitcoin Cash hard fork https://iotacoin.network/what-you-need-to-know-about-the-bitcoin-cash-hard-fork/
947,BCH,down,2018-11-27 11:57:57+00:00,BTemelakiev,0,0,,Bitcoin Cash SV Will Hit $1 Million According To Ryan X. Charles of Reddit 
948,BCH,down,2018-11-27 11:59:16+00:00,Aztek_btc,60,287,#Bitcoin #Bitcoin #BitcoinXT #BitcoinUnlimited #BitcoinClassic #BitcoinCash #BitcoinABC #BitcoinSV,Attempted hijacks of #Bitcoin #BitcoinXT 2015 #BitcoinUnlimited 2016 #BitcoinClassic 2016 #BitcoinCash 2017 #BitcoinABC 2018 #BitcoinSV 2018
949,BCH,down,2018-11-27 12:00:00+00:00,CryptoGulp,0,0,,"Top 5 Cryptocurrencies - Current Prices Bitcoin $BTC: $3,702.18 -0.80% XRP $XRP: $0.347269358 -0.81% Ethereum $ETH: $103.77 -0.80% Bitcoin Cash $BCH: $172.25 -2.02% Stellar $XLM: $0.13907468 -0.80%"
950,BCH,down,2018-11-27 12:00:00+00:00,AltcoinTicker,0,0,#bitcoin #bitcoin #crypto #altcoin #bot,Today's Top 5 Coins 1. Bitcoin 3702.18402419$2. XRP 0.3472693582$3. Ethereum 103.768608298$4. Bitcoin Cash 172.252577518$5. Stellar 0.1390746795$#bitcoin #crypto #altcoin #bot #
951,BCH,down,2018-11-27 12:00:02+00:00,CoinfloorUK,0,0,#BitcoinCash,"#BitcoinCash Market Price Update BCH/GBP | Last Price: £260.00 | 24-Hour Low: £140.00, High: £260.00, Volume: 6.0714 BCH"
952,BCH,down,2018-11-27 12:00:02+00:00,BitcoinCash_ES,0,0,#BitcoinCash #Kraken #BCHEUR,Cotización del Bitcoin Cash: 148 20.€ | -1.79% | Kraken | 27/11/18 13:00 #BitcoinCash #Kraken #BCHEUR
953,BCH,down,2018-11-27 12:00:03+00:00,Economia_Forex,0,0,#BTC #BTC #bitcoin #bitcoin #ETH #ethereum #BCH #Bitcoin #Bitcoin #ltc #litecoin #XRP #ripple #XMR #monero #DSH #dash #criptovalute,#BTC #bitcoin $3754.0 #ETH #ethereum $104.55 #BCH #Bitcoin Cash $397.34 #ltc #litecoin $29.77 #XRP #ripple $0.35 #XMR #monero $53.27 #DSH #dash $88.42 #criptovalute http://valutevirtuali.com/criptovalute-principali-performance-ed-andamento-prezzo/
954,BCH,down,2018-11-27 12:00:05+00:00,stratumHKBot,0,0,#stratum #fuckthebanks,"Preços Bank To Crypto: BITCOIN: R$15.221,03 BITCOIN-CASH: R$697,95 ETHEREUM: R$442,37 SMARTCASH: R$0,08 ZCORE: R$2,53 http://bktc.com.br #stratum #fuckthebanks 27/11/18-10:00"
955,BCH,down,2018-11-27 12:00:15+00:00,XCH4NGE,8,14,#CyberMonday #XCH4NGE #UK #XRP #Bitcoin #Bitcoin #Litecoin #Ethereum #BitcoinCash,"Well #CyberMonday may be over, but crypto is still selling at bargain basement prices! Head to XCH4NGE and scoop up some XRP for just £0.33 today. #XCH4NGE #UK #XRP #Bitcoin #Litecoin #Ethereum #BitcoinCash $BTC $BCH $ETH $LTC"
956,BCH,down,2018-11-27 12:00:16+00:00,coinstats,0,0,#BitcoinCash #BCH,"BitcoinCash - BCH Price: $172.62 Change in 1h: -1.81% Market cap: $3,017,310,727.00 Ranking: 4 #BitcoinCash #BCH"
957,BCH,down,2018-11-27 12:00:20+00:00,TrackThatCrypto,0,0,#crypto #bitcoin #bitcoin #ethereum #xrp #litecoin #eos #monero #bitcoincash #steem #verge #dash #iota #cardano #cryptocurrency #altcoin #blockchain #news #CryptoBuzzTracker,TOP-12 most-mentioned #crypto this hour: 1. #bitcoin 2. #ethereum 3. #xrp 4. #litecoin 5. #eos 6. #monero 7. #bitcoincash 8. #steem 9. #verge 10. #dash 11. #iota 12. #cardano #cryptocurrency #altcoin #blockchain #news #CryptoBuzzTracker
958,BCH,down,2018-11-27 12:00:49+00:00,coinspectator,0,0,#cryptocurrency #bitcoin #bitcoin #btc #btc,Bitcoin SV Price Analysis: BSV/USD Raking In Post-Lau... #cryptocurrency #bitcoin #btc bitcoin cash fork https://coinspectator.com/news/1090803/bitcoin-sv-price-analysis-bsvusd-raking-in-post-launch-gains-despite-industry-rout
959,BCH,down,2018-11-27 12:00:52+00:00,FeesBitcoin,0,0,#Bitcoin #Bitcoin #BitcoinCash #Bitcoin #Bitcoin #BitcoinCash,"#Bitcoin $3,676.30 v #BitcoinCash $262.12 (BTC/BCH 14.0), Avg Transaction fee for #Bitcoin ~$0.59 v #BitcoinCash ~$0.01 - 2018/11/27 21:00JST"
960,BCH,down,2018-11-27 12:00:52+00:00,Hyipmonitors_24,0,3,#payinghyip #cryptocurrency #hyipinvestor #hyipmonitor #hyipnews #bitcointalk,"Alpha Fast status: Paying Plans: 102.50% after 1 days and more plan. Payment Methods: Perfect Money , Bitcoin , Payeer , Litecoin , Ethereum , Bitcoin Cash Payment Type: Manual https://buff.ly/2DZLF2V #payinghyip #cryptocurrency #hyipinvestor #hyipmonitor #hyipnews #bitcointalk"
961,BCH,down,2018-11-27 12:02:56+00:00,bch_price,0,0,#bitcoincash #bch,Price of 1 BCH to USD: $171.98 (Change: -2.21 %) Price of 1 BCH to BTC: 0.04648792 Ƀ (Change: -1.56 %) #bitcoincash #bch $bch
962,BCH,down,2018-11-27 12:03:44+00:00,Bitcoin_es,0,0,#bitcoin #bitcoin #crypto #news #noticiasbitcoin,"Estas navidades adquiere Bitcoin Cash, luego de que todo pase. https://bitcoin.es/actualidad/estas-navidades-adquiere-bitcoin-cash-luego-de-que-todo-pase/ #bitcoin #crypto #news #noticiasbitcoin"
963,BCH,down,2018-11-27 12:04:18+00:00,CryptoAmb,0,0,#ETH #Ripple #BTC #BTC #Bitcoin #Bitcoin #Ethereum #BitcoinCash #Altcoins,BEXAM steps up its game with the implementation of DAG technology and Proof of Rounds [PoR] https://ambcrypto.com/bexam-steps-up-its-game-with-the-implementation-of-dag-technology-and-proof-of-rounds-por/ $BTC #ETH $ETH #Ripple #BTC #Bitcoin #Ethereum $xrp #BitcoinCash #Altcoins
964,BCH,down,2018-11-27 12:06:06+00:00,CryptoKev710,0,1,,"& Moon Dash, Moon Bitcoin, Moon Litecoin, Moon Bitcoin Cash ..."
965,BCH,down,2018-11-27 12:06:38+00:00,Bitcoin_Win,0,1,,Bitcoin Cash Hard Fork: What You Need to Know https://bitcoinwarrior.net/2018/11/bitcoin-cash-hard-fork-what-you-need-to-know/
966,BCH,down,2018-11-27 12:06:46+00:00,hem0310,0,1,#bitcoincash #bitcoincash,"#bitcoincash is the worst thing happened to blockchain, wait a sec, I thing worst is @rogerkver and #bitcoincash is the second worst. And karma hit hard on @rogerkver"
967,BCH,down,2018-11-27 12:06:50+00:00,Bitcoin_Win,1,1,,"Bitcoin Cash is just over a year old, but its base has already become divided on the ideal future of the coin. A hard fork that was intended to serve as a routine upgrade has become a battle... https://bitcoinwarrior.net/2018/11/bitcoin-cash-hard-fork-what-you-need-to-know/"
968,BCH,down,2018-11-27 12:06:56+00:00,coinpricenow,0,0,#BTC #BTC #BCH #ETH #XRP #Bitcoin #Bitcoin #Ethereum #cryptocurrency #crypto #altcoin #Blockchain #Ripple,"1 Bitcoin ( #BTC ) Dollar: 3642.55$1 Bitcoin Cash ( #BCH ) Dollar: 1,67.88$1 Ethereum ( #ETH ) Dollar: 101.57$1 Ripple ( #XRP ) Dollar: 0.34184$Date: 27 Nov 2018 12:6 #Bitcoin #Ethereum #cryptocurrency #crypto #altcoin #Blockchain #Ripple"
969,BCH,down,2018-11-27 12:07:55+00:00,smdev3loper,0,0,,Bitcoin Cash Hard Fork: What You Need to Know - https://www.cryptosquawk.com/feed-items/bitcoin-cash-hard-fork-what-you-need-to-know/
970,BCH,down,2018-11-27 12:08:08+00:00,tarmedia,0,0,#Stellar #blockchain #Crypto #decentralization #Bitcoin #Bitcoin #cryptocurrency #Cryptocurrency #crypto #BitcoinCash #Ethereum #altcoin #Cryptocurrencies,#Stellar Free Airdrop Incoming as XLM Price Continues to Correct - BeInCrypto https://beincrypto.com/stellar-free-airdrop-incoming-as-xlm-price-continues-to-correct/#bitcoin #blockchain #Crypto #decentralization #Bitcoin #cryptocurrency #Cryptocurrency #crypto #BitcoinCash #Ethereum #altcoin #Cryptocurrencies
