,press company,date,title,url,abstract,date detail,head article,main article
136,www.coindesk.com,"Nov 8, 2017",CoinDesk's Top 10 Token Traders and Analysts of 2017,https://www.coindesk.com/coindesks-top-10-token-traders-analysts-2017,"Spencer was perhaps the first Wall Street analyst to study bitcoin and 
cryptocurrencies. This led him to jump feet first into the 
cryptocurrency ...","Nov 8, 2017 at 14:00 UTC","After the 1929 stock market crash, new regulations brought infrastructure that helped form the insular culture of Wall Street’s traders and analysts.","The creation of the U.S. Securities and Exchange Commission (SEC) ultimately meant that only a small percentage of people would qualify as accredited investors. Success within money’s inner circle bred a culture of trade secrets and information asymmetry. Analysts and traders worked their edges and guarded their insight. Information moved within closed circuits of buy-side and sell-side analysts whose work informed limited numbers of investors and traders.In contrast, the culture around cryptocurrencies looks much different. Cryptocurrency analysts and traders have taken to social media and other platforms to publicly share their insights and advice on industry trends, popular tokens, price predictions and high reward trades. Twitter is the most impactful forum, while CoinDesk guest contributors and Medium blog posts offer longer-form analysis and insight from around the world. Inspired by the shift in culture from cloistered Wall Street to the more open and transparent influencers in the crypto space, CoinDesk has established the following Top 5 Analysts and Top 5 Token Traders lists. With the final 10 selected from a total of over 30 candidates, factors for consideration included Twitter followers, analyses published, charts produced, industry experience, incumbent financial industry experience (with bonus points for having both), votes from the State of Blockchain Q3 sentiment survey, and several other data points.Spencer Bogart
@CremeDeLaCrypto
15,000 followersSpencer was perhaps the first Wall Street analyst to study bitcoin and cryptocurrencies. This led him to jump feet first into the cryptocurrency industry, where he runs research out of an early crypto investment fund, Blockchain Capital. Spencer shares much of his insight on Medium, and has also been quoted throughout the media landscape. Chris Burniske
@cburniske
32,000 followersAnother analyst to get his start on Wall Street, Chris’ work has won him one of the largest follower bases in the industry. His paper, “Ringing the Bell on a New Asset Class,” his current Amazon top-selling book, “Cryptoassets,” and his Twitter presence place his analysis behind many newly minted crypto-millionaires. Chris is also responsible for unique insights that inform the industry – blockchain forks as a type of investor activism, as an example. Willy Woo
@woonomic
31,000 followersWilly has produced some of the highest-quality and most creative charts in the industry. While his experience is mostly independent, his insights have been shared on CoinDesk, Twitter, his personal site (Woobull) and other platforms. Several of his charts have been retweeted thousands of times, including his Google Trends-BTC price correlation, which took a 10,000-year view of crypto and network value to transaction ratio. Tuur Demeester
@TuurDemeester
58,000 followersTuur drew the highest number of votes for top analyst in the State of Blockchain Q3 sentiment survey.

Another pioneer whose professional work goes back to the early days of bitcoin, Tuur looks at both the economic forces at work in cryptocurrencies, as well as the technology behind them.He’s authored opinion pieces on CoinDesk and created charts that help many navigate the volatility in bitcoin, making him one of the most heavily followed and respected people in the industry. Alex Sunnarborg 
@alexsunnarborg
4,000 followersAlex started out in institutional investment, but when bitcoin began to take off, he quit his job and launched Lawnmower, a platform designed to make cryptocurrencies easier to invest in.After a win at the Money 20/20 hackathon, Alex worked with Coinbase, and later joined CoinDesk. In addition, his work on State of Blockchain and his creative charts shared on Twitter give him some of the deepest experience in the industry.Sheba JafariSheba makes the list because of her excellent and “right on the bitcoin” price predictions. Despite her excellent analysis, she rarely shares her insight outside of what is reported by traditional financial media.Bob Voulgaris
@haralabob
119,000 followersBob is not a crypto-insider and some reading CoinDesk pages might be unfamiliar with his name. That’s because he’s too busy max-betting on NBA games as one of the most prolific sports betters in the world, with high-profile speaking engagements at the Sloan Sports Analytics Conference.Make no mistake, Bob has traded cryptocurrencies since the early days, and evangelized friend Mark Cuban from his “bitcoin is a bubble position” to investing in tokens. Peter Brandt
@PeterLBrandt
72,000 followersA veteran trader, Peter has enjoyed a wildly successful career, and now a whole new one as a bitcoin trader. Other crypto traders have been able to learn from the best charter in the game, and the crypto industry is better for the attention, thought and skills Peter has brought.He’s even taken to schooling the crypto trolls and bickerings that take up so much time and space on Twitter. Tone Vays
@ToneVays
42,000 followersTone embodies the principles of the cryptocurrency industry and has a Wall Street background that included a front row seat for the meltdown at Bear Stearns.An evangelist for the technology, Tone works to give insight into some of the political ideas around bitcoin along with trading advice through his own chart sharing.While a Twitter handle exists that points out how well traders could do by ignoring Tone’s trade advice, he could be considered a conservative trader and has taken a risk-averse approach to 2017’s ICO boom. ฿TF%$D!
@CryptoHustle
30,000 followersA not-quite pseudonymous trader, ฿TF%$D! is one of the most watched in the industry.With nearly 30,000 Twitter followers, his tweets chart some of the more obscure investment opportunities in the industry. His Crypto Hustle website is full of dives into various altcoins and how to value them and his commentary on trades extends into these same markets. CryptoCobain
@CryptoCobain
55,000 followersA pseudonymous trader, his crypto alter ego is a conceit of Kurt Cobain living, quitting Nirvana and leading the life of crypto.Besides daily commentary, and never wavering from the idea that he quit the band, CryptoCobain shares helpful insight on risk management, portfolio allocation, and which coins he thinks are due for a pump.Wolf of Poloniex, Whale PandaWolf and Panda have all the criteria filled and challenged for a spot in the top five. The only difference, in our list selection methodology, was that time spent bickering was a negative data point. While Tone Vays dabbles in the art of bickering, Wolf and Panda out-bickered him and just missed the cut.Ian Balina gets an honorable mention too, not because of his holdings or trades per say (though the author and self-promoter is doing well), but because of his habit of sharing a screenshot of his portfolio every day.Editor’s note: This Top 10 list is separate from our ongoing “Most Influential” 2017 survey.Trophy with confetti image via Shutterstock"
137,www.coindesk.com,"Dec 8, 2017",Craigslist Sellers Can Now Request Cryptocurrency Payments,https://www.coindesk.com/craigslist-sellers-can-now-request-cryptocurrency-payments,"While the site's users have been able to point out in the text of their 
posts that they may take bitcoin or another cryptocurrency, the website 
now ...","Dec 8, 2017 at 17:15 UTC",Online classifieds marketplace Craigslist has added a feature that lets users specify that they accept cryptocurrency payments.,"While the site’s users have been able to point out in the text of their posts that they may take bitcoin or another cryptocurrency, the website now allows users to more directly advertise by selecting a check-off box for “cryptocurrency ok.”First pointed out on Reddit on Dec. 7, posts with that box ticked include a note, but leaves the details about the currency to the two parties. As it stands, the feature appears to be relatively open-ended, leaving the cryptocurrency choice and the manner through which transactions are sent up to the buyer and seller.It’s not entirely clear when the feature was added, through word of it began spreading on social media yesterday. Craigslist did not immediately respond to a request for comment.Additionally, Craigslist users can also filter search results by whether a seller accepts cryptocurrency or not.It’s a small but notable development for the long-running classifieds site, which was founded in 1995, boasts more than 80 million ads monthly (a figure that accounts for reposts and renewals). Per Alexa, Craigslist is the 16th most popular website in the U.S., ranking 106th globally.Image Credit: Casimiro PT / Shutterstock"
138,www.coindesk.com,"Nov 1, 2017",Swaziland Central Bank Governor: It's 'Not Wise' to Dismiss Cryptocurrency,https://www.coindesk.com/swazilands-central-bank-is-researching-local-use-of-cryptocurrencies,"Facebook pixel Twitter pixel Alexa pixel. CoinDesk Bitcoin News. News Learn 
Research. News; Learn; Research. Events · Latest · Opinion ...","Nov 1, 2017 at 08:00 UTC","The central bank of the Kingdom of Swaziland is researching cryptocurrencies, according to its governor.","Speaking at an economic forum last week, Central Bank of Swaziland (CBS) chief Majozi Sithole struck an optimistic note about the technology, according to a report from the Swazi Observer.While he didn’t issue any definitive statements on the topic, Sithole indicated that its a topic of study at the central bank, and that officials there don’t want to impede any possible financial innovation.“It may not be wise to dismiss virtual currencies and as the CBS we are learning and we want to accept and support innovation. If this is innovation, we do not want to stifle it. We want to learn more about it,” he told event attendees.And while Sithole’s comments represent the central bank’s most significant comments on cryptocurrency to date, they aren’t the first time that the institution has publicly signaled its interest.In an internal news circular published in August, Lindokuhle Sithole Shabangu, the central bank’s senior communications officer, offered a brief overview of the technology and highlighted the research going on in this area.“In essence, the Central Bank, in line with its mandate to issue and redeem currency as well as to promote safe and accessible payment systems, continues to closely monitor developments in the financial services industry with a view to ensure that the regulatory framework remains relevant and appropriate,” she wrote.Swaziland map and pin image via Shutterstock"
139,www.coindesk.com,"Sep 24, 2017",Vivid History: 'How Money Got Free' Is the Untold Story of Bitcoin,https://www.coindesk.com/vivid-history-money-got-free-untold-story-bitcoin,"An early bitcoin developer and entrepreneur, Alex Waters served as COO and 
CIO for bitcoin exchange startup BitInstant. Later going on to start ...","Sep 24, 2017 at 11:10 UTC","An early bitcoin developer and entrepreneur, Alex Waters served as COO and CIO for bitcoin exchange startup BitInstant. Later going on to start several bitcoin ventures, he was also at the forefront of efforts to boost its regulatory compliance.","In this opinion piece, Waters reviews “How Money Got Free: Bitcoin and the Fight for the Future of Finance” (Oneworld Publications), arguing it captures the zeitgeist of the original cryptocurrency and the sprawling – all too human – movement that helped it reach the masses.I have long suspected, owing to its sheer brilliance and idiosyncratic beauty, that bitcoin was in fact brought here by aliens from another planet.Brian Patrick Eha’s vivid history of bitcoin, “How Money Got Free: Bitcoin and the Fight for the Future of Finance,” which captures in thrilling journalistic fashion what I experienced in my years working on this remarkable technology, only confirms my suspicions.I regret not recording what I saw and felt while working on bitcoin — the fleeting moments of intense joy and dismay that once seemed too meaningful ever to forget. But at the time, it was all I could do to keep up with the pace, and my life became a blur of 80-hour working weeks devoted to the engineering project of a lifetime.As the years passed, and the blockchain industry exploded, it seemed that these beautiful moments of intellectual adventure would remain only as fading memories, slowly dimming as I aged.The idea that an author could capture the essence of that stirring time seemed impossible even in my most optimistic moments. Yet, just as I had initially done with bitcoin, I came to find in reading Eha’s book that I had underestimated once again.Eha starts at the beginning, sparing no detail.The era he eloquently describes was an alternate reality which brought together the brightest, hardest-working and most ideologically extreme individuals I have ever known. We shared common goals and an outsider camaraderie that only grew stronger as we made progress in the early years of bitcoin’s ascendance. Looking back, it’s sobering to realize that some of us were imprisoned or otherwise suffered as a result of the desire to improve and promote this new kind of money.For some of my fellow pioneers, the intensity of their ideological commitments became a prison in itself.Early bitcoiners collectively witnessed the radical dismantling of tribal and national affiliations, and the formation, in their place, of a new global citizenry. The birth of bitcoin and its blockchain was an important moment in human history – one whose legacy deserves to be documented.“How Money Got Free” is precisely what I was yearning to read.The fascinating detail and precise vocabulary of Eha’s writing provide a sense of closure for me personally. It feels cathartic to now possess a tome which records the visceral thrill of bitcoin’s rise, the earthshaking import of its innovations. As I read, I felt as though I were in the room witnessing the breakthroughs made by the first bitcoin pioneers.The truth is, I have crossed paths with many of the characters depicted in the book.Some of them were in close proximity to me for nearly a decade. Until now, I didn’t know why these people had joined the bitcoin community or how fate had guided us to share in this wonderful experiment. While I was busy working on cash remittance at BitInstant, I had very little insight into what others were working on in parallel. The challenges faced by Coinbase, Blockchain, BitPay, SecondMarket and others were just brief news headlines to me at the time, like billboards flashing past on the highway.I had little appreciation for the depth of their intensity or the richness of the stories behind those headlines – all of which is conveyed in full through Eha’s narrative.Consequently, “How Money Got Free” has changed my perspective on many of those people, some of whom I once thought of as competitors. What I’ve since learned is that we were all in the same boat, whatever our individual aims. Bitcoin itself is, in some sense, our parent organization, and its furtherance benefits us all.Eha interviewed me for his book, as he did many of my former colleagues and acquaintances. When I asked what had motivated him to write it, he said that he wanted to shine a light on the pioneers and preserve the history of bitcoin’s formative years. (His book, which is both a work of investigative journalism and a tremendous feat of storytelling, focuses mainly on the period from 2009–2015, though Eha also examines bitcoin’s precursors, and an epilogue brings his narrative almost to the present day.)The martyrs, explorers, creators, and pariahs who champion new technologies and advance society, Eha told me, are often overlooked or soon fall into obscurity. While every frontier has to be settled eventually, the lessons learned during the rough-and-tumble days are important – so that future projects are inoculated against failure by the hardships of the past.“How Money Got Free” transports readers to the meeting rooms, startup couches, conference halls, online discussion boards and proverbial watercoolers where the cryptocurrency and blockchain industry took shape. It guides readers through the history of bitcoin’s implementation and explains its potential for the future.Whether you are a bitcoin believer or a skeptic, Eha’s work will arm you with a deeper knowledge not only of the technology but of the human motives behind it. It is inspiring, evocative, and imbued with empathy for the dreamers – the “crazy ones,” as Eha puts it in the book’s dedication, echoing Steve Jobs – who move society forward.As the book makes clear, bitcoin would not be where is it today had it not been for all of the people who clicked on a link, who read an article, who discussed, built, argued and invested. Small in themselves, each of these actions shaped our future; they contributed to the momentum of where we are going.Naturally, our past informs our choice of what to write, what to click, with whom to argue and what to say.Just so, early bitcoiners tended to have philosophical or political reasons for being drawn to cryptocurrency, and Eha is splendid at delving into primary sources and tracing the wellsprings of these convictions.As we express ourselves through the use of these new technologies – the Internet, email, text messaging, social networks, blockchains – we stand to benefit from weighing the long-term implications of even our smallest interactions.It is crucial for us to recognize and reflect on the journeys made and efforts undertaken to bring us our current way of life. But while some figures loom larger than others, every person who participates in bitcoin, even conceptually, is taking an implied risk. It carries social, legal, and financial consequences regardless of success. That risk and the willingness to take it, in the interest of furthering humanity, is what binds us together.Eha’s book reminds me of something Faulkner once wrote: “The past is never dead. It’s not even past.”Even now, it informs our actions, and we need to understand it if we want to understand where we are going. “How Money Got Free” conveys the essence of bitcoin’s past – not preserved in amber but alive with color and controversy.For non-geeks, reading this book may be the first step toward acceptance of our inevitable future. It can serve as a permanent record for those who weren’t around to witness the events first-hand, and as an inspiration for all the dreamers still captivated by a transcendence which rivals the internet itself.Disclosure: CoinDesk is a subsidiary of Digital Currency Group, which has ownership stake in BitPay, Blockchain and Coinbase. Old books image via Shutterstock"
140,www.coindesk.com,"Dec 8, 2017","Huobi, SBI Announce Plan for Japanese Bitcoin Exchanges",https://www.coindesk.com/huobi-sbi-announce-plan-japanese-bitcoin-exchanges,"It's a notable development for Huobi, formerly one of China's “Big Three” 
bitcoin exchanges prior to a months-long crackdown by Chinese ...","Dec 8, 2017 at 07:00 UTC",Cryptocurrency exchange Huobi is partnering with Japan-based investment group SBI to launch a pair of cryptocurrency exchanges.,"Sometime next year, the two exchanges – dubbed “SBI Virtual Currency” and “Huobi Japan” – will offer yen-denominated cryptocurrency services, according to a statement on Huobi’s website. Though a firm release date hasn’t been launched, Huobi indicated in its statement that its chairman Li Lin and SBI Group chairman Beiwei Kitao had signed a cooperation agreement establishing the exchanges.It’s a notable development for Huobi, formerly one of China’s “Big Three” bitcoin exchanges prior to a months-long crackdown by Chinese authorities. That pressure ultimately led Huobi, along with BTCC and OKCoin, to cease offering trading services in that country earlier this fall.Now, Huobi is moving to set up shop in nearby Japan, which has seen significant interest in cryptocurrency trading since the government there declared bitcoin a form of payment method earlier this year.In its announcement, Huobi hinted at additional areas of cooperation between the two firms.“In addition to setting up two subsidiaries, the two sides will flexibly mobilize technologies, knowledge, and personnel to jointly develop digital asset-related businesses in Japan and Asia through mutual complementarity and strength,” the company said.Japanese yen image via Shutterstock"
141,www.coindesk.com,"Dec 1, 2017","CME, CBOE to Begin Bitcoin Futures Trading",https://www.coindesk.com/cme-begin-trading-bitcoin-futures-december-18,"Cantor Exchange, a subsidiary of Cantor Fitzgerald, will offer bitcoin 
binary options beginning on the above date. However, in remarks, CFTC ...","Dec 1, 2017 at 13:28 UTC","U.S. financial firms CME Group, CBOE and Cantor Fitzgerald revealed today they will list financial products offering exposure to cryptocurrencies starting December 18.","First unveiled in an announcement by the U.S. Commodity Futures Trading Commission (CFTC), the regulator said all three companies will pursue a self-certified initial listing, after working with the agency to set a standard for the offerings.The reveal comes just weeks after CME indicated via its website that it would launch the product on December 11, before retracting the remarks, and months after CBOE revealed it, too, would seek to launch a futures product.Both CME and CBOE will offer cash-settled contracts that will find investors buying exposure to different reference rates that will not require custody of the asset. CME will use a custom reference rate created with partner Crypto Facilities, while CBOE intends to use data from the New York-based cryptocurrency exchange Gemini.Cantor Exchange, a subsidiary of Cantor Fitzgerald, will offer bitcoin binary options beginning on the above date.However, in remarks, CFTC Commissioner J. Christopher Giancarlo was quick to caution against the idea that the products would be regulated under its full oversight, noting its “limited statutory ability” to oversee the underlying cash markets for bitcoin trading.He said:“Market participants should take note that the relatively nascent underlying cash markets and exchanges for bitcoin remain largely unregulated markets over which the CFTC has limited statutory authority. There are concerns about the price volatility and trading practices of participants in these markets.”Elsewhere, the CFTC sought to frame itself as a participant in the launch, indicating it had held discussions with CME, Cantor and CBOE for months prior to today’s news.The regulator also indicated that it would maintain a close watch on the nascent market for bitcoin-tied financial products. The CFTC said that it intends to “assess whether further changes are required to the contract design and settlement processes and work with the [designated contract markets] to effect any changes” over time.Warnings aside, those listing the products expressed optimism about their release.In remarks, Terry Duffy, CME Group chairman and CEO, said he believes the Chicago-based exchange, as well as its peers, have put in place the necessary safeguards for the listing.“We are pleased to bring bitcoin futures to market after working closely with the CFTC and market participants to design a regulated offering that will provide investors with transparency, price discovery and risk transfer capabilities.”At launch, Duffy explained the bitcoin futures product will be subject to risk management tools, including a margin of 35 percent, position and intraday price limits. The new contract will be traded on the CME Globex platform.For more on CME’s views on its forthcoming product, view our interview with managing director of equity products, Tim McCourt, below.Live from Invest with Tim McCourt https://t.co/tdG8dJxiOf— CoinDesk (@coindesk) November 28, 2017Disclosure: CME Group is an investor in Digital Currency Group, CoinDesk’s parent company. CME image via Shutterstock"
