,press company,date,title,url,abstract,date detail,head article,main article
64,www.coindesk.com,"Nov 8, 2017",Bitcoin's Bogeyman Cometh: Why Segwit2x Is a 51% Attack,https://www.coindesk.com/bitcoins-bogeyman-cometh-segwit2x-51-attack,"Edan Yago is CEO and founder of Epiphyte, a startup performing FX funds 
settlement on the bitcoin blockchain for financial institutions. In this ...","Nov 8, 2017 at 02:30 UTC","Edan Yago is CEO and founder of Epiphyte, a startup performing FX funds settlement on the bitcoin blockchain for financial institutions. ","In this opinion piece, Yago discusses one of the biggest theoretical attacks against bitcoin, and why he believes an upcoming software change fits its definition. Follow Edan Yago on Twitter.In bitcoin’s Necronomicon of possible attacks and weaknesses, one reigns supreme – the 51% attack.If there is a fear that has played on people’s minds as the end-of-days scenario for bitcoin, it is this. Attackers who hold more than 50% of hashing power could stop transactions from confirming and even reverse some transactions. They could undermine the whole project.Bitcoin’s design and its system of economic incentives has been set up specifically to combat the destructive potential of a 51% attack. And it has worked. The 51% attack has remained a hypothetical bogeyman. Until now.By all indication, a coordinated 51% attack will begin on, or around, Nov. 16. That’s when a consortium of miners representing substantially more than 50% of the network’s hashing power and an allied group of blockchain startups will seek to increase the block size.This will require a hard fork, which while controversial, is a legitimate desire. In itself, this is not an attack.However, the consortium‘s effort has evolved beyond a simple fork. It is now being developed not simply as an effort to fork the chain, but to do so in such a way as to deliberately prevent the continued existence of the status quo chain.Specifically, the developers involved have declined to introduce replay protection.The 2x fork will create a situation where transactions performed on one fork, can be “replayed” on the second fork. In effect, users will have funds on both blockchains, but any transaction they perform on one blockchain could lead to a loss of funds on the other blockchain.Replay protection is a fairly easy-to-implement method to protect users from this risk. Network attacks are those actions taken with the intention of disrupting the protocol’s normal functioning. The 2x change, bereft of replay protection, causes massive disruption. This is by design.Without replay protection in place, a minority chain becomes less likely to survive.The preferred outcome for the consortium is that the status quo chain ceases to exist, that its transactions fail to confirm.This is the literal definition of a 51% attack. If it sounds a bit bizarre to call the consortium’s effort an attack, that’s because it is. The consortium comprises many real supporters of bitcoin, acting in what they believe is good faith. They don’t mean to be attacking bitcoin.However, without replay protection their efforts are like an autoimmune disease, having become overzealous and perverted.So, bitcoin is finally coming to come face-to-face with the mother of all attacks. This is a watershed moment. The very worst outcomes are bad indeed.Transactions could grind to a halt, faith in the system could be lost, bitcoin and by extension, the entire blockchain world could prove to be far more vulnerable to attack than we hoped.However, there is also another possible, even more likely, outcome.Bitcoin could prove resilient to the consortium’s attack and emerge battered but unbroken. In so doing, bitcoin will have proven itself resilient to even its greatest foe.It is hard to overstate how important this will be to bitcoin’s perceived reliability. Bitcoin has always been haunted by the risk that its rules might come to be dictated by special interest groups or hostile, state-sponsored parties.This risk is never going completely away, but instead of the risk being a hypothetical bogeyman, it will become a much more prosaic thing: a successfully managed risk.The 51% attack is bitcoin’s boss level. I don’t think it’s an exaggeration to say that we are now at the end of the beginning. If we successfully overcome this coming challenge, bitcoin will no longer be just an experiment, it will be a fact.But don’t expect less drama — we are now entering bitcoin’s adolescence.HODL on tight, things will get hairy.Disagree? Have your say on the Segwit2x debate. Email CoinDesk managing editor Marc Hochstein at marc@coindesk.com to pen your rebuttal.Disclosure: CoinDesk is a subsidiary of Digital Currency Group, which helped organize the Segwit2x agreement.Toy monster image via Shutterstock"
65,www.coindesk.com,"Dec 4, 2017",Bitcoin Spin-Offs Caught in a Bull-Bear Tug Of War,https://www.coindesk.com/bitcoin-spin-offs-caught-in-a-bull-bear-tug-of-war,"While bitcoin is fresh off all-time highs today, its forks are battling 
choppy markets. However, price analysis suggests that both bitcoin cash 
(BCH) ...","Dec 4, 2017 at 15:32 UTC","While bitcoin is fresh off all-time highs today, its forks are battling choppy markets.","However, price analysis suggests that both bitcoin cash (BCH) and bitcoin gold (BTG) might soon break out of the doldrums. As of writing, bitcoin cash is trading at $1,522.60, a range in which its traded for most of the past week. As per CoinMarketCap, the cryptocurrency has depreciated by 5.9 percent in the last 24 hours.That said, BCH peeped above $1,600 levels yesterday, possibly due to comments from CBOE president Chris Concannon that bitcoin cash could get its own derivatives market soon.However, a general pullback across the cryptocurrency market seems to have pushed BCH back below $1,500 levels.The above chart shows:Like bitcoin cash, bitcoin gold is witnessing a struggle between the bulls and the bears. The cryptocurrency was last seen trading at $320 levels – down 5.3 percent in the last 24 hours, also going by CoinMarketCap data.BTG fell below $300 last week as expected, but since then has been restricted to a narrow range of $280–$310.The above chart shows:Last Thursday’s doji candle and Friday’s positive candle indicate a bullish doji reversal. However, the bulls are struggling to keep the cryptocurrency above $310.Tug of war image via Shutterstock"
66,www.coindesk.com,"Oct 30, 2017",Meet Earn.com: 21 Rebrands Social Network In Shift Away ...,https://www.coindesk.com/meet-earn-com-21-rebrands-social-network-shift-away-bitcoin,"21 Inc, once a maker of bitcoin mining hardware, is rebranding to emphasize 
its new focus on using cryptocurrency to power a social network.","Oct 30, 2017 at 23:59 UTC","21 Inc, once a maker of bitcoin mining hardware, is rebranding to emphasize its new focus on using cryptocurrency to power a social network.","Effective today, the startup has changed its name to Earn.com to drive home the message users can get paid for answering emails and completing tasks, according to a company blog post. The rechristened startup also confirmed it’s on track to issue a token that would replace bitcoin as the currency it uses to incentivize people to join the network by the year’s end.Separately, the company notified customers last week that it had discontinued support for the Bitcoin Computer. The pocket-sized mining device, which initially retailed for $400, was once 21’s flagship product.Taken together, the moves underscore how far one of the best-funded startups in the blockchain space has moved from its roots.In an interview with CoinDesk, CEO Balaji Srinivasan said the new name gives people “an easier way to understand the purpose of the company.” He described Earn.com as “the first commercial social network,” combining elements of LinkedIn and Amazon’s Mechanical Turk.The advantage for users over popular social media platforms like Twitter, he said, is simple:“You’re not just wasting time, you’re making money.”Specifically, users can make money in several ways, according to the company.They can create a public profile for receiving paid messages; join lists of people with similar skills (e.g. Python programmers) to receive “microtasks” such as completing surveys; or set up an autoreply on their email encouraging senders they don’t know to pay for responses (with a whitelist, so real acquaintances can be spared the request for money).As for the senders of mass emails, who aren’t used to paying for the privilege, Earn.com claims they can get much higher response rates when recipients have a monetary incentive to write back.According to the post, offering $1 for the recipient to read and answer an email yields response rates over 30 percent within 24 hours, and $10 gets response rates over 70 percent – crushing the low-single-digit performance typical of cold emails. Senders pay only if they get a response.Stepping back, 21 raised $116 million from a group of prominent investors in multiple rounds revealed two years ago, when it was still squarely in the hardware space. The valuation reflected 21’s early success in bitcoin mining, but that business has since grown more competitive, and Srinivasan (a board partner at VC firm Andreessen Horowitz who joined 21 as CEO in 2015) has been steering the company toward a software model.According to Srinivasan, the company has plenty of capital left, and fundraising is not the purpose of the upcoming token issuance.“It’s not an ICO,” he said emphatically. Tokens will be exchanged for “labor,” not capital, he explained.Rather, the Earn.com token launch is meant to encourage users to join the network sooner. Users earn tokens just by signing up for the platform and getting verified, and the token reward for doing so will be cut in half each time Earn.com’s user base doubles. (After receiving that reward for joining, users will be able to earn additional tokens by answering emails or doing tasks, the way they earn bitcoin currently.)To give the asset scarcity, no tokens will be created after the launch, and supply is capped at 21 million, of which 54 percent will be reserved for users, according to the firm. Another 30 percent will be allocated to Earn.com employees and backers, and the remaining 16 percent will go to outside researchers and developers.Aside from their function as an internal currency to compensate users for their work, the tokens will also serve as an API key for programmatic purchases, according to Srinivasan. And since they are ERC-20 tokens, they will be eligible for listing on exchanges, giving users a way to cash out, including in bitcoin.In addition to being the company’s first day as Earn.com, Friday marked the “end of life” for server-side support of the Bitcoin Computer, 21 command line interface (CLI) and API marketplace, according to the email sent to customers last week.Despite the wind-down, the email deemed the hardware product a success – because, it said, one of the tutorials published when 21 released the device grew into the current get-paid-to-answer-emails application.“Going forward, we’re going to be putting all our energy into that product and the corresponding token launch … because we think the ability to earn digital currency by replying to emails and completing tasks will be one of the most useful applications of the blockchain,” the note said.Image via Earn.com "
67,www.coindesk.com,"Dec 6, 2017",Naval Ravikant: Bitcoin Solves 'Money Problems',https://www.coindesk.com/angellists-naval-ravikant-token-summit-bitcoin-solves-money-problems,"Bitcoin's eye-popping price movements have some observers saying the market 
is in bubble territory. But while he's not ruling it out entirely, ...","Dec 6, 2017 at 18:00 UTC",Bitcoin’s eye-popping price movements have some observers saying the market is in bubble territory.,"But while he’s not ruling it out entirely, Naval Ravikant, the co-founder of AngelList, holds a less alarmist view. “Money is a bubble that never pops,” he said at yesterday’s Token Summit II in San Francisco.He told attendees:“It’s a consensus hallucination.”And speaking to the newfound attention to bitcoin, Ravikant said people are interested in growing the wealth that they have. With most savings accounts returning zero these days – as central banks conduct what Ravikant called their “grand money printing experiment” – the general public is looking for alternative places to store their money and watch it grow.Bitcoin and other protocols seem to offer that, as even the less-developed cryptocurrencies are showing substantial returns.“I think people are looking to solve their money problems,” he said.Yet at the same time, he warned that some of the cryptocurrency industry has been overhyped. In particular, Ravikant believes the market puts way too much faith in the concept of decentralization.“One indicator we are in a very frothy environment is we have a lot of tokens trading at very high values that are junk,” he said, without specifically naming any. “Right now, I think the market isn’t distinguishing quality.”Having said that though, Ravikant concluded that the cryptocurrency economy is here to stay.In fact, he gave the audience some insight into what cryptocurrencies he’s interested in. These include bitcoin, for storing value; zcash, for transacting easily; basecoin, to act as a stable unit of account; and tezzies, to access the Tezos smart contract platform.“I think we’ll see a lot more of the money use cases realized,” he predicted, adding:“If you can redefine what money is, that’s a trillion-dollar outcome.”Disclosure: CoinDesk is a subsidiary of Digital Currency Group, which has an ownership stake in Zcash Company, the for-profit entity that develops the zcash protocol. Naval Ravikant photo by Brady Dale for CoinDesk "
68,www.coindesk.com,"Nov 22, 2017",Bitcoin Gold Wallet Scam Nets $3 Million in Illicit Earnings,https://www.coindesk.com/bitcoin-gold-wallet-scam-nets-3-million-illicit-earnings,"More than $3.3 million has been stolen as part of an elaborate scam that 
took advantage of bitcoin users seeking to claim their share of the ...","Nov 22, 2017 at 20:55 UTC",More than $3.3 million has been stolen as part of an elaborate scam that took advantage of bitcoin users seeking to claim their share of the newly created cryptocurrency bitcoin gold.,"Perpetrated by the operators of a website called mybtgwallet.com, the scheme prompted users to submit their private keys or recovery seeds as a means to generate bitcoin gold wallets, as seen on an Internet Archive snapshot. Shortly after users did so, however, the cryptocurrency holdings in their wallets were sent to different addresses.At least $30,000 in ethereum, $72,000 in litecoin, $107,000 in bitcoin gold and more than $3 million in bitcoin were confiscated, according to self-reported numbers verified by CoinDesk.In an interview, victims blamed the association of the website with the official bitcoin gold project as a source of the effectiveness of the operation.One of the victims, Mikel Martin, explained to CoinDesk:“I reached this site by following the link at [the] bitcoingold.org official website so I trusted it. Yesterday afternoon I noticed both my BTC and BTG stored in that wallet were gone.”Before the thefts became apparent, the team behind bitcoin gold – an effort to create a new version of bitcoin that would restrict the types of hardware that can be used for mining – promoted mybtgwallet.com on their Twitter account, assuring users that it was safe to use on multiple occasions.The person behind the service was, to an extent, ingratiated in the nascent BTG community, including its Slack channel. The website was developed by a user named John Dass, though it is unclear whether this is the developer’s actual name or a pseudonym.Further, the Bitcoin Gold website also included a balance checking tool based on code that was shared on GitHub on their website for a brief period of time, though the window only asked for a wallet address and included a disclaimer that users shouldn’t share private keys. The Bitcoin Gold team has clarified that the malicious code itself was never present on their official website.Yet once the thefts became apparent, the news quickly spread.An analysis of the site’s code by Reddit user Uejji four days ago found that the site stored the recovery keys, which were later sent to the site’s owner. The site claimed to be open-source, but all of the source code was changed on GitHub after the scam was initiated, said Torsten Sandor, a spokesperson for Exodus, a digital wallet whose users lost funds in the scam.Some of the victims of the scam used this wallet, which allowed the company to put together how the scam operated for one of their users, he said.“The user gave his recovery seed to the site and his wallet emptied,” he told CoinDesk, adding:“This only happened with bitcoin gold. It’s a very interesting fork … I think it’s extremely unfortunate that new investors, people who know little about crypto, started buying into it.”Representatives from the bitcoin gold say they’re moving to figure out a remedy to the situation.After first being made aware of the scam, the launched an internal investigation, according to spokesperson Edward Iskra. In a published statement, Bitcoin Gold developers said they were “working with security experts to get to the bottom of this issue,” but did not clarify who these experts were.Iskra told CoinDesk that, initially, John Dass claimed innocence during this investigation.“The investigation increasingly indicated that the original developer, ‘John Dass,’ was responsible for the fraud all along … He has dropped out of touch with us, as well,” he said.While Dass was in the bitcoin gold Slack channel with a “developer” tag, he was not a part of the project’s formal team, Iskra said.There was “no formal relationship at all. He did interact with our devs in the Slack regarding developing his open-source code [and] his web site,” he told CoinDesk. “The BTG Twitter account was simply supporting an individual in the community who was supporting BTG – that was their sole intent, at the time.”The Bitcoin Gold team will make a further announcement about their investigation within the next few days, Iskra said.Mybtgwallet image via Nikhilesh De / CoinDesk; Car with boot via ShutterstockCorrection: A previous version of this article inaccurately indicated that the fraudulent BTG wallet was embedded on their official website. This report has been updated for clarity. "
