,press company,date,title,url,abstract,date detail,head article,main article
0,www.coindesk.com,"Nov 29, 2017",It's Official: Bitcoin's Price Makes History Passing $10k,https://www.coindesk.com/10000-bitcoins-price-makes-history,"Bitcoin's market capitalization is now close to $170 billion, additional 
market data shows. At press time, the price of bitcoin is trading at 10,038.","Nov 29, 2017 at 02:26 UTC","After a day of tepid approaches toward the total, the price of bitcoin rose above $10,000 on CoinDesk’s Bitcoin Price Index (BPI) for the first time in history today.","Having scaled to $9,000 this weekend, the world’s largest cryptocurrency by market capitalization hit a new high of $10,044 at 1:45 UTC, market data shows. The move came after exchanges in South Korea saw trading above that threshold yesterday and today, though U.S. exchanges had yet to mark the milestone.However, at press time, domestic exchanges including Coinbase’s GDAX exchange, Paxos’s itBit exchange and Gemini, were all posting spot prices above the $10,000 mark.With the move, bitcoin is now up more than 900 percent on a year-to-date basis, with prices climbing 230 percent since a low of $3,000 in mid-September.The meteoric rise has pushed the combined market value for all cryptocurrencies to a new high. Bitcoin’s market capitalization is now close to $170 billion, additional market data shows.At press time, the price of bitcoin is trading at 10,038.Image via Shutterstock"
1,www.coindesk.com,"Dec 12, 2017",Bitcoin Investing: A 10000-Year View,https://www.coindesk.com/bitcoin-investing-10000-year-view,"This works like bitcoin's PE Ratio, indicating when BTC price has 
outstripped fundamental value. Like PE Ratio in equities, fast-growth 
companies ...","Dec 12, 2017 at 14:45 UTC","Willy Woo is an avid cryptocurrency trader and blogger, whose work is published at Woobull.com and via Twitter at @woonomic.","This article is an exclusive contribution to CoinDesk’s 2017 in Review opinion series.A few weeks back, I spoke to 1,000 fund managers, bankers and private equity folks in New York at the inaugural Consensus: Invest conference organized by CoinDesk.What to told them is that I don’t come from Wall Street, and I’m not a formally trained analyst. My background comes from the world of emerging tech and startups, hence my view and analysis tend to be outside the box.This is a brief overview of some of the work I presented there, including my view of where the crypto asset markets are at in Q4 2017.If you’re new to the market, there’s a lot to learn. Understanding cryptocurrencies is akin to learning about an alien species. Even our markets do not correlate to any other traditional asset class. (I published this “3 cats and a moon” fractal pattern that reliably traded for three years, and it ceased to work after publication).This leads to the first point: the bitcoin market is changing and actively changes frequently.What we’re seeing now appears to be a trend that began in Q4 2017 with the decision by U.S. regulators not to approve a bitcoin ETF. The publicity from the ETF buildup described bitcoin as a legitimate asset instead of the “drug money” rhetoric.My theory is that Wall Street investor interest mounted during this phase and the money that was denied an opportunity to enter via a regulated ETF, came in anyway directly through the exchange markets around March.We saw an uptick in price when it should have dropped lower according to existing models. Additionally, we saw bitcoin’s long-term declining volatility trend break upwards as large volumes of money started trading the swings.Bitcoin’s price chart as of Q4 2017 started carving a new fractal pattern. Fractals reflect the market’s psychological profile. By my reckoning, a new animal had arrived.The price chart was now determined by a hybrid of traditional bitcoin traders and early Wall Street trader money.But new traders are entering a market with a not insignificant history.Attempts have already been made to attempt to value cryptocurrency networks, taking inspiration from other trading tools. NVT Ratio is another invention of mine. This works like bitcoin’s PE Ratio, indicating when BTC price has outstripped fundamental value.Like PE Ratio in equities, fast-growth companies exhibit higher ratios, similarly, bitcoin exhibited higher NVT Ratio values in its early high-growth phase.But, you may be asking, growth to what? The answer is becoming a significant part of the global money supply. In 2017, all the crypto asset markets combined equal half a percent of the world’s M2 money supply, and we are at approximately 1 percent of the world’s population as users. This is an equivalent adoption level as 1996 for the internet.Bitcoin users double every 12 months in our current phase of the adoption S-curve. This was calculated with my work tracking Google Trends data on the assumption that users search BTC/USD price.If this trend continues, we are nine years away from half the world using bitcoin.That might seem like a lot to take in, but it’s supported by data.Here’s another view of bitcoin’s growth on a long-term chart where each altitude climb is a 10x increase. Though bitcoin’s share of the 0.5% seems small, but we are actually 66% of the way on our journey to usurp M1 money.Let me reiterate something that sounds radical – bitcoin is four years out from exceeding the world reserve currency’s M1 supply.If volatility continues it’s on its 9-year downward trend, we should also see bitcoin price stability near fiat FOREX levels. This means grandma can have a USD savings account earning 1 percent per year, or she can have a BTC savings account earning 1 percent per week at similar risk profiles.So let me zoom out a bit and talk about where we are in the 10,000-year view.In 2013, they called bitcoin drug money. In 2017, they called it a bubble. It’s not in a bubble. We’re on the path of digitizing the world. We are seeing the final phase of the Post-Industrial Revolution which started in the 1960s-1990s with the invention of the microprocessor through to the expansion of the internet.Bitcoin is not just money. It’s the invention of an internet-native digital scarcity. And with that breakthrough, software will eat the financial world.Blockchain assets will be bigger than the approximately $70 trillion in money, there’s another $80 trillion in equities, and I’m told well over $200 trillion in real estate. This will all be digitized.“Stealth,” “awareness,” “mania,” and “blow-off” are the stages of the investment cycle.With Bitcoin only the geek money invested in the stealth phase. Smart money was displaced to the “awareness phase.”Normally institutional money arrives during the awareness phase, but due to regulatory bars institutions were not allowed to enter. Hence we are now seeing institutional money arrive late competing with retail money in the early mania phase.It’s my belief this could create a super bull season right now in Q4 2017 and into 2018.But bitcoin’s maturity is also likely to push newer investors toward higher yields, and as expected, we have seen bitcoin itself losing its dominance over the last five years.This is a sign of the markets starting to mature. A fully digital economy should not be 95 percent money. All industries will eventually fill this economy.That last slide was the top 125 outliers, this chart shows essentially the entire market, with the darker colors moving to lighter represent the top 200, 400, 600, etc.Newer coins are outperforming older coins in general. Also buying the entire market tends to be neutral in performance.In this environment, selection and filtering is key. I suggest selecting just as a venture capitalist would. Vet the team, call them up, are they competent? Check their tech, read their source code, is the tech stack useful? How big can the market grow to? What are the token dynamics, is the token designed for high velocity or low?Successful projects will follow what I call the “Falcon 9 launch trajectory.”The goal is to ride the early steep trajectory for two to three years, then roll the investment into new projects capable of climbing steeply. It’s a venture capital model. Returns that bitcoin offered in 2011-2013 are still available today, but today there’s more work involved to find the gems.Disagree? CoinDesk is looking for submissions to its 2017 in Review series. Email news@coindesk.com to pitch your idea and make your views heard.Astronaut image via Shutterstock"
2,www.coindesk.com,"Dec 11, 2017",Bitcoin Price Back Above $17k to Set New All-Time High,https://www.coindesk.com/bitcoin-price-back-17k-set-new-time-high,"The price of bitcoin has pushed back above $17,000, hitting a new all-time 
high on CoinDesk's Bitcoin Price Index (BPI). As of press time, the ...","Dec 11, 2017 at 20:48 UTC","The price of bitcoin has pushed back above $17,000, hitting a new all-time high on CoinDesk’s Bitcoin Price Index (BPI).","As of press time, the BPI had climbed as high as $17,382.64, beating the $17,364.56 reported previously on Dec. 7. As previously reported, that day saw significant price divergences among exchanges, leading to spreads in excess of $1,000 between the world’s various marketplaces for bitcoin.According to the BPI, the price of bitcoin has surged more than $2,000 today, a development that comes less than a day after options exchange CBOE first commenced trading of its initial bitcoin futures products. Data from CNBC indicates that the contract scheduled to expire in January is trading at $18,670 as of 3:38 p.m. EST.At press time, bitcoin’s price is $17,178.96, per the BPI representing an increase of over 14 percent.Additional data from CoinMarketCap suggests that the wider cryptocurrency market is seeing gains, with several of the top-10 cryptocurrencies by market capitalization seeing price increases above 10 percent in the past 24 hours. As it stands, the total market capitalization is at roughly $456 billion, according to the service.Rollercoaster image via Shutterstock"
3,www.coindesk.com,"Nov 28, 2017","To the Moon? Time to Grow Up, Bitcoin",https://www.coindesk.com/moon-time-grow-bitcoin,"Bitcoin compared to other bubbles. There is only one which surpasses it: 
the Dutch tulip mania. The chart is from a newsletter from my long time ...","Nov 28, 2017 at 08:00 UTC",Michael J. Casey is chairman of CoinDesk’s advisory board and a senior advisor of blockchain research at MIT’s Digital Currency Initiative.,"In this opinion piece, part of a weekly series of columns, Casey suggests that bitcoin’s price might be in a bubble and that curtailing the mania around it would be good for the technology’s future.This is not “normal.”Of course, not being normal is part of bitcoin’s appeal. Bitcoin has redefined money and created the hitherto non-existent concept of a scarce digital asset. It’s hard to hold it to the standards of “normal” assets.But as someone who spent decades watching financial markets go through repeated patterns of exuberance and retrenchment, I’m quite uneasy with bitcoin’s latest runup. A 20% gain over the weekend left it up 60% over two weeks and up an eye-popping 900% year-to-date.Record-breaking gains are irrelevant in isolation. The important question is “compared to what?” And the search for an apples-to-apples comparison is especially tricky for an asset class whose binary set of outcomes might lie in an all-or-nothing range of $0 to $1 million. Cryptocurrencies don’t have any real precedent from which to establish benchmarks. That makes them hard to value.But being hard to value doesn’t get us off the hook. Investors must at least try to assign numbers to the assets they buy. And any rational assessment of something’s value must, by definition, compare it to the value of something else. Value is an inherently relative concept.Here’s a value comparison worth thinking about. Three long weeks ago, when bitcoin was only worth $7,000, Convoy Investments pointed out that, throughout history, the only other price performance for an asset class that exceeded bitcoin’s was the Netherlands’ infamous Tulip Mania of 1619-1622. As most students of finance know, that one didn’t end so well.Bitcoin compared to other bubbles. There is only one which surpasses it: the Dutch tulip mania.The chart is from a newsletter from my long time friends at Convoy investments. If you’d like to subscribe, email them at ir@convoyinvestments.com pic.twitter.com/ZdLSFXcvLn— The Long View (@HayekAndKeynes) November 8, 2017While it’s true that resorting to the Tulip Bubble analogy has been a somewhat hackneyed, knee-jerk tool for many bitcoin critics, I think the instinct among many bitcoin bulls to mock them for resorting to it is often similarly simplistic.William Mallers did it last week in an impassioned rebuttal of financial blogger John Lothian’s criticism of the CME Group’s plan to introduce bitcoin futures. The problem is that such rebuttals often resort to strawman portrayals of the critic as someone who misunderstands bitcoin’s far-reaching societal potential, as an ignoramus who thinks it’s as worthless as a tulip bulb. This misses the point. The problem with the tulip bubble wasn’t that the tulip bulbs were worth nothing, it was that a cycle of mania, speculation and FOMO (fear of missing out) pushed their price far out of line with their realizable value. It’s not unreasonable to argue that a similar phenomenon is pushing bitcoin’s price far beyond what’s justified by its unproven potential, conceivably powerful as that might be.In one of my very first articles on bitcoin four years ago, I too evoked the Tulip Bubble comparison as the BTC price was then topping $1,200. It turned out to be prescient, as the price shortly thereafter fell to around $200 and then took three years to regain the lost ground. But by then I didn’t care. Writing that column led me to explore cryptocurrencies more deeply. I became a convert, wrote a book about bitcoin, and ultimately left The Wall Street Journal to join the Digital Currency Initiative at MIT’s Media Lab.The point is that I’m not alluding to tulips out of Jamie Dimon-like ignorance. I believe, strongly, in cryptocurrency technology, and just as importantly, in its core promise of a superior, more robust and universally acceptable form of money. It’s just that I also think it’s healthy to separate that inherently hard-to-quantify aspect of its fundamental value to humanity from the particular, fleeting, quantitative expression it finds in the market.What worries me most is the cult-like mindset of the investor community, with its “to the moon” rallying cries and simplistic justifications for price performance. The notion, for example, that bitcoin’s in-built scarcity will drive its price higher ad infinitum assumes it operates in some kind of detached vacuum. The ever-present prospect of software forks, while not technically adding to the supply of bitcoin core, points to a wide set of options for investors in the future. If they find those options more appealing – and who’s to say a better idea won’t come along? – it will matter nothing that only 21 million coins will ever be produced. (For a brutal breakdown of other pro-BTC arguments, read this critique by the economist Constantin Gurgdiev, who, like me, is a believer in the underlying power of cryptocurrency technology.) The problem I have with the immaturity of bitcoin’s investing culture is not that it’s setting the market up for a correction. It’s that it constrains progress toward attaining the technology’s more fundamental social value. Speculation is unavoidable, even useful in bootstrapping innovation. But if bitcoin is to change billions of lives, it needs to become a more mainstream asset class, one that’s connected to the real world that those people occupy. As much as we might all love this quirky, abnormal “honeybadger of money,” bitcoin needs to become more normal. It needs more stability. It needs a two-way market.That two-way market is coming. And it will be brought to us by financial professionals, hordes of whom will be showing up at CoinDesk’s inaugural Consensus: Invest conference Tuesday. At the same time that venture capitalists and hedge funds are creating investment vehicles to take positive bets on bitcoin and other crypto assets, investment banks and exchanges are creating facilities that will allow other institutions to bet against it.The bitcoin bulls who’ve welcomed the CME Group’s plans to introduce bitcoin futures contracts before year-end as an easier way for institutional investors to invest in the sector might want to be more careful what they wish for. The quarterly-ROI-obsessed fund managers who will trade these contracts share none of quasi-religious mindset of bitcoin HODLers. And now they have a tool, in the futures contracts themselves, with which to short the market. If it makes sense to do so, they will gladly take actions that drive the price lower. Wall Street is pragmatic, self-interested and obsessed with its short-term bottom line. It doesn’t HODL. To be sure, it’s not clear how much of an immediate impact futures trading will have on the spot market for bitcoin – the CME’s contracts will be cash-settled, which means that neither counterparty to a trade takes physical ownership of the underlying asset. Investors will merely treat the underlying bitcoin market as a reference. But as the futures market gains liquidity, and as cross-market hedging strategies become more sophisticated, the futures price on the CME may well become a driver of spot market prices. With such an imbalance between the sizes of the institutional and retail markets, the tail could start wagging the dog.  Here’s the thing: This rite of passage is welcome. By lowering volatility, two-way institutional engagement will increase the impact that bitcoin can have on the world. It’s an important step in fulfilling bitcoin’s purpose. But it also means the moon might have to wait.Peter Pan image via Shutterstock"
4,www.coindesk.com,"Nov 26, 2017",Bitcoin Price Tops $9000 in Historic First,https://www.coindesk.com/bitcoin-price-passes-9000-first-time-ever,"The price of a bitcoin has continued to rise overnight, passing $9,000 for 
the first time this morning. Since setting new highs yesterday, prices ...","Nov 26, 2017 at 12:22 UTC",,"The price of a bitcoin has continued to rise overnight, passing $9,000 for the first time this morning.Since setting new highs yesterday, prices climbed more or less steadily until finally passing $9,000 at 06:40 UTC today. The new record of $9,043.21 was reached roughly 35 minutes later, according to CoinDesk’s Bitcoin Price Index.At press time, prices are at $8,970 levels – up 2.43 percent for the session. CoinMarketCap data indicates that bitcoin has risen 6.16 percent in 24 hours, and 16.27 percent over the last seven days.Bitcoin’s amazing gains have helped drive the combined market value for all cryptocurrencies to yet another at new high of $285 billion. Bitcoin’s market capitalization is now almost $151 billion.OMG image via Shutterstock"
5,www.coindesk.com,"Dec 15, 2017",More to Come? Bitcoin Sets Record High Near $18k,https://www.coindesk.com/more-to-come-bitcoin-sets-new-record-high-above-17800,"That said, the price chart analysis shows that bitcoin could make a push 
towards the $20,000 mark ahead of the BTC futures by listing this Sunday ...","Dec 15, 2017 at 11:25 UTC","Having successfully defended $16,000 earlier this week, bitcoin regained bid tone today and clocked a fresh record valuation above $17,800.","The cryptocurrency rose to a new lifetime high of $17,801.94 at 10:30 UTC, erasing the previous record high of $17,631.42 set on Dec. 12, as per CoinDesk’s  Bitcoin Price Index (BPI).Bitcoin (BTC) has spent a better part of the last week trading sideways amid sharp gains in alternative cryptocurrencies, falling to $16,000 at points, before rising 8 percent in the last 24 hours. Still, the repeated rebounds from $16,000 levels are likely evidence of a strong “buy the dip” mentality among traders.That said, the price chart analysis shows that bitcoin could make a push towards the $20,000 mark ahead of the BTC futures by listing this Sunday.The above chart (prices as per Coinbase) shows:Motorbike jumping image via Shutterstock"
6,www.coindesk.com,"Dec 19, 2017",Kuwait's Ministry of Finance Says It Does Not Recognize Bitcoin,https://www.coindesk.com/kuwaits-ministry-of-finance-says-it-does-not-recognize-bitcoin,"However, the sources added that neither the Ministry of Finance nor the 
central bank can regulate bitcoin trading more generally, as they do not ...","Dec 19, 2017 at 11:00 UTC","Kuwait’s Ministry of Finance has reportedly said it does not recognize bitcoin, and that financial institutions are banned from trading in the cryptocurrency.","According to Arab Times, sources from the ministry explained that the Central Bank of Kuwait does not allow financial institutions, banks and affiliated companies to trade bitcoin in the wake of the recent surge in prices.However, the sources added that neither the Ministry of Finance nor the central bank can regulate bitcoin trading more generally, as they do not recognize the cryptocurrency. Further, bitcoin trading is “out of control” of the authorities as it is managed through the internet, the sources said.With bitcoin not backed by a central authority, the central bank has previously asked the Ministry of Commerce and Industry to take measures to inform consumers over the risks of the digital currency, the sources added.The Arab Times reported on Dec. 16 that Kuwaiti citizens are at the “forefront” of trading bitcoin following the recent price gains. Sources from the public prosecution office indicated that the Kuwaiti law cannot prohibited online trading as it falls under the laws for “e-programs.”“However, the proceeds of bitcoin that are wired from abroad to Kuwait are considered as illegal and unclean money, because the Kuwaiti law does not consider those currencies,” the sources said at the time.Elsewhere in the Middle East, the Central Bank of the United Arab Emirates clarified in February this year that bitcoin is not banned in the country.That statement followed the release of a digital payments framework on Jan. 1 from the central bank, stipulating that “all virtual currencies (and any transactions thereof) are prohibited.”The bank said in its update: “These regulations do not cover ‘virtual currency’ which is defined as any type of digital unit used as a medium of exchange, unit account, or a form of stored value.”Kuwait city image via Shutterstock"
