,press company,date,title,url,abstract,date detail,head article,main article
195,www.coindesk.com,"Dec 6, 2017",Encyclopedia Blockchainica: Wikipedia Co-Founder to Disrupt His Own Creation,https://www.coindesk.com/encyclopedia-blockchainica-wikipedia-co-founder-disrupt-creation,"Instead of a centralized server, content would be hosted by nodes – similar 
to how bitcoin's ledger of transactions is held. But as has been clear ...","Dec 6, 2017 at 17:00 UTC",A co-founder of Wikipedia doesn’t like what Wikipedia has become.,"Dr. Larry Sanger has been an outspoken critic of the online encyclopedia he helped found for some time, but his latest move, joining venture-backed startup Everipedia as its chief information officer shows just how serious he is about disrupting the model.Revealed today alongside news of Sanger’s hire, Everipedia is moving the entire process of approving articles, making edits and storing information to the EOS blockchain.According to the Everipedia team, using smart contracts to record the editing workflow and store articles stands to create a truly censorship-proof system. And by incentivizing contributors with a cryptocurrency token, the company hopes it can create a platform for more accurate information.In interview, Sanger explained his decision to join the startup as part of what he considers the next evolution of online encyclopedias.He told CoinDesk:“The biggest problem with online information today is that it is centralized and controlled by a very few players, that it benefits to have the most salacious and hype-ridden information. We can do much better.”In an unpublished draft of Everipedia’s white paper provided to CoinDesk, the company details how this move to blockchain might create an improved Wikipedia.Instead of a centralized server, content would be hosted by nodes – similar to how bitcoin’s ledger of transactions is held. But as has been clear throughout this year’s scaling debates, many of the largest blockchains in the space would face significant challenges storing the amount of data needed for an online encyclopedia.In an effort to steer clear of those hurdles, Everipedia explored a number of platforms to host the smart contracts that execute the logic around contributing and editing articles, including the Plasma framework designed for ethereum.In the end, however, the startup settled on a combination of the EOS blockchain unveiled in June and the Interplanetary File System (IPFS) — a sort of decentralized server — that will be used to store the more data-heavy files including video and images.Also using the EOS blockchain, the company plans to develop a cryptocurrency token called IQ to incentivize the creation of content. Editors and curators will then “mine” that cryptocurrency by making accurate, valuable contributions to the encyclopedia.“Just like miners who find blocks get newly minted bitcoin, these editors who are voted to have a very good state-change proposal get newly minted tokens,” said Everipedia co-founder and white paper co-author Sam Kazemian.According to the white paper, which hasn’t been formalized, 50 percent of the total 100 million “IQ” tokens will be distributed in an initial coin offering (ICO) and 30 percent will be “minted” over 100 years to pay out editors and validators for their work.To supplement $1 million the company previously raised from Mucker Capital, an additional 20 percent of the tokens will be set aside to pay development costs.Similar to the mission of many blockchain startups, Everipedia set out to eliminate the bureaucracy the startups’ founders thought allowed a relatively small number of people to be gatekeepers on Wikipedia.The founder and CEO of Everipedia, Theodor Forselius, argues that contrary to Wikipedia’s original mission to tap the wisdom of the crowd, the online encyclopedia’s editorial hierarchy has resulted in a slanted view of history and a decreasing number of editors.“Essentially, a doctor from the 1800s that gets five searches a month on Google could have a Wikipedia article,” said Forselius. “But bloggers, social media stars and up-and-coming rappers that are getting hundreds of thousands of searches a month were not seen as notable enough.”Yet, Everipedia’s ostensibly more democratic process hasn’t always resulted in numbers or accuracy to compete with Wikipedia. For instance, whereas Wikipedia offers 43 million pages and has about 136 million active users, Everipedia only has about six million pages and 2.3 million unique users.While there’s a long way to go, Sanger believes the company can implement a blockchain solution to rival Wikipedia in as little as nine months.“The vision that I have for the next stage of the evolution of encyclopedias is what this team is implementing,” he said, adding:“It opens up so many doors when information is truly decentralized and offered in a protocol such as blockchain.”Dr. Larry Sanger image via Everipedia"
196,www.coindesk.com,"Sep 28, 2017",Crypto Hedge Fund Costs? Invest $100k and Here's How Much You'd Pay,https://www.coindesk.com/crypto-hedge-fund-costs-invest-100k-and-heres-how-much-youd-pay,"So, despite their investments in bitcoin, ether and other emerging digital 
assets, there are certainly no major leaps in how cryptocurrency hedge ...","Sep 28, 2017 at 11:00 UTC",Nobody works for free – least of all hedge fund managers.,"So, despite their investments in bitcoin, ether and other emerging digital assets, there are certainly no major leaps in how cryptocurrency hedge funds appear to be calculating their costs.All crypto hedge fund managers get paid in the fees they charge to investors – and, just like in traditional markets, those fees aren’t always easy to understand. Calculating the costs and possible return on your investment can prove challenging, given that fee structures are often described in ways that marry the worst aspects of legalese with the wonky accounting of tax documentation.To shine a light on how these costs work, CoinDesk obtained a copy of a fee structure for a cryptocurrency fund. The following example is loosely based on a product now actively available in the market, but greatly simplified to make its terms and conditions easier to parse.CoinDesk assumed a $100,000 investment in a fund with a vanilla “two and 20” fee structure that earns a 10 percent gross return.While the example below is just that – one example – it can still be a helpful metric to aid you in your evaluations. After all, while a cryptocurrency hedge fund may be appealing – it should also be compared to the pros and cons of your own active management.The first point to understand when looking at a fund is the management fee, which is what you pay upfront as soon as you invest in the fund.The typical management fee is 2 percent on every dollar you invest. As an example, let’s say you’ve found a fund with a solid strategy, and it has a minimum investment of $100,000. This means that on your $100,000 investment, you would get charged $2,000, meaning you’re only “putting to work” $98,000 in the investment.Right off the bat, that’s money that won’t be going directly into the market, and in cryptocurrency, where there have been historical benefits to holding, that might be something to consider.Still, that might not necessarily be a deterrent. Let’s say at the end of the year, the fund generates a 10 percent return, as in this example, you could end up with a potentially attractive profit.Depending on what you were expecting, you may be thrilled or you may be disappointed – but, either way, you’re probably not done paying fees yet.In the most basic analyses, there are two kinds of fees that hedge funds charge their investors: management fees, like the 2 percent discussed earlier, and “incentive fees” that are applied to profits.In a typical, vanilla fund scenario, investors pay around 20 percent fees on their returns. These fees are usually called incentive fees because they seek to align investor returns with the compensation of the fund managers.The percentages charged on incentive fees are typically far higher than management fees, which makes sense, because the fund’s managers or general partners are being rewarded for their product’s performance. So, the greater the return that fund managers make for their investors the greater the fees they earn for themselves.Let’s continue to assume that the fund you invested in generated a 10 percent gross return. Since you earned 10 percent profit on your investment after management fees, the gross return, before the incentive fees were charged, would be $9,800.A 20 percent fee charged against your gross return means another $1,960 in fees get assessed.So, adding it all up, you would pay a total of $3,960 in fees on your investment in the fund.Let’s take a look at the investment from a different angle — the rate of return you received on your investment.After the management fee and incentive fees get charged, investors would receive a $7,840 net return on their investment, or a 7.84 percent rate of return for the year.Whether or not that fits the bill with your expectations, is up to you as the investor. As mentioned above, given the extreme volatility of the cryptocurrency markets, there can be upside or downside in putting your money to work directly on available exchanges.Still, if you’re looking for exposure to a very volatile market, and you’re not interested in doing the legwork required to actively manage your own portfolio, the above example should give you a better sense of the potential costs – and possible returns.$100 bills image via Shutterstock"
197,www.coindesk.com,"Dec 24, 2017",My Advice for ICOs? I'm Sorry I Was Right…,https://www.coindesk.com/advice-icos-im-sorry-right,"In January 2017, I attended The North American Bitcoin Conference (TNABC) 
and sat on a legal panel with Drew Vander Hink and Adella ...","Dec 24, 2017 at 17:00 UTC","Jason Seibert, esq. leads a small law practice focusing on securities fraud, transactions and fiduciary duties, and host of the “I’m Not Your Lawyer” podcast.","The following article is an exclusive contribution to CoinDesk’s 2017 in Review.Since 2015, people have asked me what I think about all kinds of things in the crypto-securities world.After working on the SEC v. Shavers case, I had the opportunity to speak at several locations, and to consult with a lot of businesses. Each time, I would calmly explain that initial coin offerings, so-called ICOs, were securities offerings.The response would range from outrage to unmeasured vitriol.I recall speaking in Las Vegas at a conference put on by Oracle. There, I answered questions from the audience, and later in the hallway a man who helped found ethereum, came up to me and said something along the lines of, “Dude, what’s your deal, are you a fed or something?” My answer was simply, “No. I just don’t want everyone to be surprised when regulation comes down hard.”His response, “Well, they haven’t done anything yet, so that means they aren’t going to, right?” “No,” I replied simply.The discussion that followed was the same one I’ve had with many over the past couple years. They have to believe that they’ve found the magic secret to get around law and regulation. That the ultimate “AH HA!!!” happened is a dream has haunted many companies I’ve spoken with.I simply reply that:“The government is patient. The government has rules and regulations and unions. The government is not comprised of caffeinated coders that work 100 hours in two days whilst flaming newbs in chatrooms. The government has a process, and that process must be followed.”As The DAO was contemplated, I recall, specifically, having a phone call with a prominent New York bitcoiner who was gloating that The DAO had solved the Howey Test and that regulators were finally out of crypto.I disagreed, explained horizontal and vertical commonality, and noted that under several cases, including my personal favorite, SEC v. Glenn Turner, these were securities. There was nothing but laughter on the other end of the phone.*Sigh.* Then The DAO imploded.In January 2017, I attended The North American Bitcoin Conference (TNABC) and sat on a legal panel with Drew Vander Hink and Adella Toulon-Foerster in the bathroom hosted by Chris DeRose and Junseth (then Bitcoin Uncensored) and moderated by Tone Vays.I must have sat on three or four panels that weekend on the air, and figured out that through a show I could reach more people and give them the advice they NEEDED – not the advice they wanted. I started with Charlie Shrem and that ridiculous Jason Granger Mainstreet Investment and didn’t look back.I dedicated about an hour each week to breaking down ICOs and explaining how they violated securities laws or how the terms and agreements were scams.I did it all for free as pro-bono work for the industry. … doing “God’s work” as Marco Santori once commented to me about my efforts with Shavers.Then, it happened, July 25, 2017. SEC Release 81207 – Report of Investigation Pursuant to 21(a) of the Securities Exchange Act of 1934: The DAO. (*note – the SEC spent nearly two pages discussing how SEC v. Glen Turner applied)I went on the air that night and started taking calls and having discussions with various luminaries in the bitcoin world. Rhiana came home from the store while I was on the air and walked into my tiny home office carrying a cake.On the top of the cake it read, “I’m Sorry I was Right.”I laughed so hard I had to take a break. I then ate cake for the next two hours live on the air. I ended the show with my usual closing, “I’m not your lawyer, but I could be…”Since that date, I’ve advised dozens of ICOs on proper formation of utility and software tokens and am defending an SEC inquiry into an ICO from last year.I’ve worked with clients all over the world. I’ve advised legislators, drafted proposed regulations, spoken with prime ministers and visited countries I honestly didn’t know existed. It’s been a hell of a ride.I-told-you-sos aside, you may be wondering where ICOs go from here.Hard to say. I’d like to see legitimate offerings taking advantage of the quick and easy systems set up by regulators, but it seems more often than not, ICOs want to skirt regulation and dare the SEC to come after them. That’s not the best way to go.I think part of the limitation of legitimacy is that there are very few markets in existence or on the horizon where security tokens can be traded, and using those exchanges means having to identify yourself as an investor.The anonymous nature of crypto also works against compliance.I think, as I suggested many times over the past year, if the industry regulated itself, if the exchanges actually had requirements for listing (other than whether or not the coin can pay the listing fee) – like some form of diligence and verification of legitimacy – we might move in the right direction.But, in my opinion, so long as there are venues for trading ICO coins, there will be less incentive for the related projects to use a registered and compliant exchange.I hope to be wrong.Counterpoint? CoinDesk is open for opinions as part of our ongoing 2017 in Review. Email news@coindesk.com to share your take.Cake image via Shutterstock"
198,www.coindesk.com,"Oct 16, 2017",IBM's Stellar Move: Tech Giant Uses Cryptocurrency in Cross ...,https://www.coindesk.com/ibms-stellar-move-tech-giant-use-lumen-cryptocurrency-payments-rail,"Facebook pixel Twitter pixel Alexa pixel. CoinDesk Bitcoin News. News Learn 
Research. News; Learn; Research. Events · Latest · Opinion ...","Oct 16, 2017 at 04:01 UTC",Big Blue is making what could be considered its first public foray into cryptocurrency.,"In the kind of unveiling that can only come before one of the biggest events in global finance, IBM is revealing today at Sibos 2017 the results of a partnership with blockchain startup Stellar in which it successfully settled real transactions using the company’s custom cryptocurrency, lumens.While currently limited to cross-border payments involving British pounds and Fijian dollars, the early-stage platform is nonetheless designed to scale to handle seven fiat currencies in the South Pacific – including the Australian dollar, the New Zealand dollar and the Tonga pa’anga.Perhaps the platform’s most distinguishing characteristic, however, is that the project showcases how private and public blockchain technologies are increasingly being used in tandem. While IBM’s blockchain solutions are designed to complete much of the workflow around transaction clearing, the actual settlement will be conducted using Stellar’s blockchain.In this case, Stellar’s lumen serves to digitally connect fiat currencies, allowing for nearly instant exchange without the consumer or buyer ever touching the cryptocurrency itself.Stellar founder Jed McCaleb told CoinDesk:“When trading between multiple currencies, it helps to have a bridge currency to reduce the ledgers needed to maintain. Lumen provides that single ledger that can bridge currencies.”Taken together, however, this partnership goes beyond just technical implications.Not only is the partnership an outside-the-box move for IBM, which has largely focused on its own blockchain platforms, it’s a big win for Stellar, which having emerged from the Ripple founding team hasn’t had quite the same growth, perhaps attributing in part to its focus on developing markets.The partnership is also evidence of the extent of collaboration between blockchain firms and the wider financial world. To make the project work, IBM had help from partners including National Australia Bank, TD Bank and Wizdraw (HK) of WorldCom Finance.The payments themselves are conducted for the Advancement of Pacific Financial Infrastructure for Inclusion (APFII), an organization of member financial institutions founded by the United Nations and Swift, and operated by KlickEx, a privately-held direct clearing provider that specializes in cross-border digital remittances.According to IBM’s vice president of global blockchain development, Jesse Lund, getting all these players to work together is just an extension of IBM’s mission to collaborate with financial institutions to develop a blockchain ecosystem.To that end, the platform is already integrated with IBM’s Financial Transaction Manager, which itself is integrated with ACH, SEPA and other electronic transaction networks. Going forward, APFII’s confirmation receipts are expected to be published as MT103 Swift messages directly to the blockchain.“This in many ways is just an extension of that, wherein we’re providing, in collaboration with banks, and in the process developing this blockchain ecosystem,” said Lund.For now, the new project is also a balancing act – at once both a small advancement of early-stage technology and an aspirational advance toward more lofty goals.While the trial with APFII has been ongoing since last week, the CEO of ClickEx, Robert Bell, said it’s too early to provide any numbers about transaction volume. But still, he expects as much as 60 percent of the cross-border retail market in the region to be transacting on the platform once all seven currencies are added (the Australian dollar will be the next currency integrated).“For the first time, blockchain is being used in production to facilitate cross-border payments in multiple integrated currency corridors,” Bell said.IBM also sees the demo as one with implications for the digitization of central bank money – a concept that’s gotten a significant amount of attention recently as central banks around the world grow more interested in figuring out how the technology could create efficiencies.“Our long game is to support multiple different types of digital assets,” said Lund, adding:“And I’m very confident that you will be seeing central banks coming forward with their own digital asset issuances that will be a much more formidable construct of this model.”Today, that future will be discussed in greater detail on stage at Sibos in Toronto, where a panel with representatives from IBM, TD Bank and CLS will discuss the project with the CEOs of both Stellar and KlickEx.“It’s going to be a wild ride,” Lund said, concluding:“We’ve got the bankers and the renegades altogether.”Disclosure: CoinDesk is a subsidiary of Digital Currency Group, which has an ownership stake in Ripple.Fiji dollar image via Shutterstock"
199,www.coindesk.com,"Dec 14, 2017",Gibraltar to Launch License Scheme for Blockchain Startups,https://www.coindesk.com/gibraltar-to-create-license-for-blockchain-startups,"Facebook pixel Twitter pixel Alexa pixel. CoinDesk Bitcoin News. News Learn 
Research. News; Learn; Research. Events · Latest · Opinion ...","Dec 14, 2017 at 16:05 UTC",The Gibraltar Financial Services Commission (GFSC) plans to create a new a license for startups working with blockchain.,"According to  Reuters, the license would apply to firms transmitting money or assets using blockchain or distributed ledger technology. However, said GFSC head of risk and innovation Nicky Gomez, companies are looking to governments to regulate blockchain usage.Gomez told the publication:“This is the first instance of a purpose-built legislative framework for businesses that use blockchain or distributed ledger technology.”On Friday, Gibraltar will follow through by publishing its guidance on how to apply a new law passed last week that amends its Financial Services (Investment and Fiduciary Services) Act to legally define how blockchains can be used for storing and transmitting data.As CoinDesk has reported, the next steps would be to pass a bill specifically aimed at DLT platforms, as well as another potential bill regulating initial coin offerings.The Gibraltar government’s senior advisor on DLT, Sian Jones, told Reuters that the new regulations will allow businesses to more easily gain bank accounts and establish their legitimacy with potential customers.Under the framework, startups will be required to hold some capital, though the exact amount will be determined on a case-by-case basis. They will also be required to follow anti-money laundering and terrorist financing regulations, the news source reports.“We have been talking with law firms and advisors helping companies to get established here,” Jones said.Gibraltar image via Shutterstock"
