,press company,date,title,url,abstract,date detail,head article,main article
71,www.coindesk.com,"Jun 18, 2019",Bitcoin Is Hedge Against Global Liquidity Crises: Grayscale ...,https://www.coindesk.com/bitcoin-is-hedge-against-global-liquidity-crises-grayscale-study,"Bitcoin has a distinct set of properties unlike any other asset, the paper 
says, which allow it to perform well over the course of normal economic ...","Jun 18, 2019 at 01:05 UTC","Grayscale Investments, the cryptocurrency asset manager backed by Digital Currency Group, which acquired CoinDesk in 2016 – has released a report showing what it argues is bitcoin’s potential as a hedge against global liquidity crises. ","Overall, the authors suggest bitcoin ought to be considered a strategic position within long-term investment portfolios considering its transparent, immutable and global liquidity. Bitcoin has a distinct set of properties unlike any other asset, the paper says, which allow it to perform well over the course of normal economic cycles as well as market disruptions. Additionally, noting significant shifts taking place in monetary, fiscal and trade policies around the world, Grayscale alleges politicians and policymakers may find it increasingly difficult to manage their economies – thus insinuating a need for investors to take control of their own finances. The report examined five recent macroeconomic shocks in which the digital asset outperformed other investments as a store of value. The authors extrapolated from these case studies – including Grexit, Brexit, China’s structural devaluation of the renminbi and two Trump shocks – that bitcoin could be a useful tool in helping investors insulate their portfolios from any potential market failures. Below are three exegesis of bitcoin’s inherent ability to hedge against liquidity crises.In the first case study, ‘Grexit and the 3-week Greek bank shutdown,’ which spanned from April to July 2015, Greece underwent a physical liquidity crisis as default of sovereign debt seemed inevitable. In a response to financial uncertainty, the Greek government closed state banks and imposed strict capital controls on transactions, beginning on June 28, 2015. These restrictions remained in place for three weeks, while bailout terms were negotiated with international creditors, which sparked apprehensions about the unchecked power of governments over holders of centralized assets in times of crisis. Yet, “during the liquidity freeze, bitcoin emerged as one of the only means by which to transfer value in or out of Greece, reinforcing this new asset’s ability to return the power of control to the individual who holds it,” write Grayscale analysts. Leading up to the resolution to the Grexit crisis on July 13, 2015, bitcoin saw returns of 28 percent versus an average of -1.7 percent for 20 other markets and currencies.Another case study examined the People’s Bank of China’s structural devaluation of the renminbi, and China’s shift in monetary policy between August 2015 and December 2016. Amid stock market turbulence and concerns over the health of the world’s second largest economy, the Chinese government lowered the RMB-USD reference rate 1.9 percent, signaling a shift to “market-driven” pricing and an attempt to stimulate export driven growth. This policy-shift saw RMB’s largest single day drop in over twenty years, as well as a five-month selloff of global risk assets in favor of wealth preservation assets, according to researchers. Again, Grayscale notes bitcoin fared much better. “Between the day of the announcement and the trough of the drawdown, Bitcoin largely outperformed the following major markets and currencies, producing a cumulative return of 53.6 percent versus an average return of -10.1 percent.” Bitcoin was used to hedge against Chinese liquidity risk, caused by local investors sold their assets against a structural currency devaluation.The shock of the U.K.’s referendum vote to separate from the European Union was followed by a knee-jerk selloff and immediate decline in the pound sterling (GBP) and euro, as the market attempted to digest whether Brexit would portend the disintegration of the European Union. During the first one-day global selloff, the researchers found, “bitcoin was a top performing asset, boasting a return of 7.1 percent on strong volume, versus an average of -2.1 percent for the rest of the group” of currencies. Additionally, the researchers find cause to recommend, because the details of the transition plan still being worked out, global investors might consider allocating a portion of their investable assets to bitcoin to hedge against contagion stemming from the Eurozone, the world’s second largest economy.Read more in the full report. Michael Sonnenshein image via CoinDesk archives "
72,www.coindesk.com,"Jun 6, 2019","Bitcoin's 2019 Price Run Driven By Real Transaction Growth, Analysis Shows",https://www.coindesk.com/bitcoins-2019-price-run-driven-by-real-transaction-growth-analysis-shows,"Bitcoin's TAAR and Price. As is shown above, bitcoin was only able to 
escape its bear market in 2015 once its network activity picked up pace, ...","Jun 6, 2019 at 04:00 UTC","An experimental metric used to gauge the quantity and quality of activity on bitcoin’s network clocked a 28-week high last Saturday, signaling the cryptocurrency’s latest price rally may be more fundamentally driven than many expect. ","The Transaction Amount to Active Addresses Ratio (TAAR), first proposed by CoinDesk Contributor and Valiendero Digital Assets Founder Chris Brookins, divides bitcoin’s 24-hour adjusted transaction volume (USD) by the number of its active addresses to identify how much each active address spends in transactions per day on average. If TAAR is high, then it means each user (active address) is transacting in high notional values, in other words, the network “quantity” (how much is being spent i.e. transaction volume) is high per the “quality” (how many users are spending the funds i.e. active addresses). When the quantity and quality of bitcoin’s network are high, then one would expect a positive reaction in bitcoin’s market and vice versa when the ratio is low. Since April of 2013, the oldest data point available via Coinmetrics, this has proven to be the case as it has been made clear bitcoin’s price only enters sustainable trends when it is accompanied by a TAAR trend in the same direction.As is shown above, bitcoin was only able to escape its bear market in 2015 once its network activity picked up pace, made evident by the TAAR finally failing to set new lows along with bitcoin’s price and beginning to trend upwards (highlighted in the red square). This, in a sense, added fundamental validation to bitcoin’s price growth at the time, which often falls victim to pure speculation. Interestingly, bitcoin’s TAAR is once again clearly rising along with its price in a similar fashion to that seen at the end of the previous bear market, potentially suggesting bitcoin’s latest price growth may be sustainable as long as the network activity continues to rise. Corrections in price should be expected, but according to this model, bulls should only be concerned when TAAR loses significant altitude. Now, the sample size is small spanning just six years, so combining this metric in analysis with other metrics would be fruitful in order to avoid outlier signals, but nonetheless, the TAAR does show an increase in bitcoin’s network activity not seen in several months regardless of its connection to prices. Disclosure: The author holds several cryptocurrencies. Please see his author bio for more information. Bitcoin image via Shutterstock"
73,www.coindesk.com,"Jun 6, 2019","Bitcoin and Gold Prices Diverge Again, Extending 5-Month ...",https://www.coindesk.com/bitcoin-and-gold-prices-diverge-again-extending-5-month-correlation,"Bitcoin is again feeling the pull of gravity amid a rally in gold – a 
classic safe haven asset. The premiere cryptocurrency topped out at highs 
near ...","Jun 6, 2019 at 17:00 UTC",Bitcoin is again feeling the pull of gravity amid a rally in gold – a classic safe haven asset.,"The premiere cryptocurrency topped out at highs near $9,100 on May 30 to hit a 2.5-week low of $7,432 on June 4.The pullback was expected as technical charts were reporting bullish exhaustion. After all, the cryptocurrency decoupled from equity markets and rallied by nearly $4,000 in May.Even so, the correction is noteworthy as it is accompanied by a sharp rally in gold prices. The yellow metal picked up a bid at $1,275 per Oz on May 30 and climbed to $1,344 per Oz on Wednesday – the highest level since Feb. 20.As seen above, the inverse relationship has been in place since the final quarter of 2018.On Nov. 14, BTC dived below the long-held support of $6,000, reviving the bear market which had come to a halt near that psychological support in five months to October. By mid-December, BTC was trading at 15-month lows near $3,100.During the same time frame, gold went from $1,200 to $1,300 and further extended the rally to $1,346 (Feb. 20 high).However, by early May, gold was roughly down 6 percent from February highs, while BTC was trading at $5,500, representing a 76 percent rise on December lows near $3,100.The inverse correlation weakened somewhat in May with gold trading the range of $1,300-$1,270 amid BTC’s sharp rise to $9,000.The two assets, however, are again moving in opposite directions, as mentioned earlier. It is worth noting that correlation doesn’t imply causation.Gold’s recent rally is likely associated with markets aggressively pulling forward Federal Reserve (Fed) interest rate cut expectations.For instance, the probability that the Fed would cut rates in July rose to 72 percent earlier this week – up significantly from 30 percent seen in early May. Further, the Fed funds futures market is now pricing three rate cuts for this year.It is worth noting that correlation does not imply causation. While gold – a zero-yielding asset – is cheering increased prospects of a drop in US borrowing costs, bitcoin is taking a hit, possibly due to chart-driven factors.That said, the inverse relationship warrants attention and potential toppy price action in gold could be considered an advance warning of a bullish reversal in bitcoin.Disclosure: The author holds no cryptocurrency assets at the time of writing.Bitcoin image via Shutterstock; charts by Trading View"
74,www.coindesk.com,"May 10, 2019","As Bitcoin Continues Its Climb, Top Crypto Assets Tease ...",https://www.coindesk.com/as-bitcoin-continues-its-climb-top-altcoins-also-tease-breakout,"Bitcoin's (BTC) ascent continues with prices hitting new multi-month highs 
earlier today, and other top cryptocurrencies may soon join the party.","May 10, 2019 at 11:00 UTC","Bitcoin’s (BTC) ascent continues with prices hitting new multi-month highs earlier today, and other top cryptocurrencies may soon join the party.","Bitcoin violated the resistance zone of $6,055–$6,100 with a UTC close at $6,156 on Thursday and reached a six-month high of $6,336 on Bitstamp at 07:40 UTC today.Prices have now hit multi-month highs on three consecutive days – a sign of strong bullish sentiment. With every move higher, both the short- and long-term bull cases presented by several technical indicators over the last few weeks have gained strength.BTC, therefore, appears on track to test the 100-week price average, currently at $6,506 – a level that last came into play last November.As of writing, the cryptocurrency is changing hands at $6,260 on Bitstamp, representing a 3.45 percent gain on a 24-hour basis.BTC continues to establish bullish higher highs and higher lows on the daily chart (above left) with key moving averages trending north.The relative strength index (RSI) is reporting overbought conditions with above-70 reading. That signal, however, would gain credence if and when the momentum starts weakening. As of writing, the bulls are showing no signs of exhaustion.Further, the weekly RSI (above right) is currently printing the strongest bullish signal in over 15 months.On the hourly chart, the RSI has breached the ascending trendline to the downside and is rolling over from overbought levels. Hence, we may see a minor pullback to the ascending trendline support, currently at $6,140, before rising toward $6,500.While bitcoin has doubled in value over the last six weeks, altcoins have underperformed big time, as indicated by the massive depreciation of their BTC-denominated exchange rates.!function(){""use strict"";window.addEventListener(""message"",function(a){if(void 0!==a.data[""datawrapper-height""])for(var e in a.data[""datawrapper-height""]){var t=document.getElementById(""datawrapper-chart-""+e)||document.querySelector(""iframe[src*='""+e+""']"");t&&(t.style.height=a.data[""datawrapper-height""][e]+""px"")}})}(); The numbers indicate a lack of interest in altcoins despite BTC’s confirmation of the long-term bullish reversal on April 2.The battered altcoins, however, could soon find some love, as their combined market capitalization seems to have charted a bullish technical pattern.The bull flag seen in the above chart is a continuation pattern that often ends up accelerating the preceding rally.A convincing break above the upper edge of the flag, currently at $73.65 billion, would confirm a flag breakout and signal a continuation of the rise from lows near $45 billion seen in February.A flag breakout, if confirmed, could be considered a sign the much-anticipated altcoin rally has begun. As of writing, the total altcoin market cap is seen at $72 billion.Among the major altcoins, litecoin (LTC) could shine bright, as its mining reward halving is due in less than 90 days.The process aimed at curbing inflation by reducing mining rewards by half every four years tends to put a strong bid under the cryptocurrency for months in advance, according to historical data.Litecoin’s channel breakout indicates the path of least resistance is to the higher side. Prices, therefore, could rise above $100 ahead of the reward halving event.Disclosure: The author holds no cryptocurrency assets at the time of writing.Bitcoin and litecoin image via Shutterstock; charts by Trading View"
75,www.coindesk.com,"May 23, 2019",Swiss Watchmaker Franck Muller Launches 'Functional ...,https://www.coindesk.com/swiss-watchmaker-franck-muller-launches-functional-bitcoin-timepiece,"Aesthetically, the dial of the watch – launched in partnership with 
cryptocurrency trading platform Regal Assets – sports bitcoin's logo and a 
QR ...","May 23, 2019 at 10:15 UTC",Swiss luxury watchmaker Franck Muller has launched limited-edition timepiece dubbed “Encrypto” that it’s calling “the world’s first functional bitcoin watch.”,"Aesthetically, the dial of the watch – launched in partnership with cryptocurrency trading platform Regal Assets – sports bitcoin’s logo and a QR code of bitcoin’s genesis block address.The face also includes a laser-etched QR code for a public wallet address that can be used to deposit bitcoin and check its balance. An included sealed USB stick stores the private key, Regal Assets announced Wednesday.The “deep cold storage” wallet uses “offline generated, non-deterministic TRNGs (True Random Numbers Generated) that cannot be hacked,” according to the announcement.The Encrypto is currently available online and at Franck Muller’s Dubai Mall store, with accepted payment options being credit card and bank transfer, as well as bitcoin.A maximum of 500 each of men’s and women’s versions will be sold, with the cost being anywhere between $10,000-$60,000 apiece, according to information from the maker’s website. Some models also include precious metals and diamonds in the dial and frame.Franck Muller is also exploring models featuring ether (ETH) and other “top five coins”, including XRP in the future.Earlier this year, luxury Swiss watchmaker A. Favre & Fils also announced that it is developing a handcrafted mechanical timepiece with a built-in crypto-wallet. The watch will cost in the range of $102,000–$153,000, depending upon the model and its features and materials.Encrypto watch images via Regal Assets"
76,www.coindesk.com,"Apr 11, 2019",Bitcoin Drops Back to $5K Price Support After Failed Breakout,https://www.coindesk.com/bitcoin-drops-back-to-5k-support-after-failed-breakout-2,"Bitcoin (BTC) has fallen back to support at $5,000 after a failed breakout 
Wednesday. The number one cryptocurrency by market valuation made ...","Apr 11, 2019 at 10:50 UTC","Bitcoin (BTC) has fallen back to support at $5,000 after a failed breakout Wednesday.","The number one cryptocurrency by market valuation made a strong bullish break from an ascending triangle pattern yesterday evening at 18:00 UTC, reaching a peak of $5,488 on the Coinbase exchange. However, that move was quickly rejected and an increase in selling pressure on today’s open laid the pathway for bitcoin to slide, first to $5,200 overnight, then quickly to $5,018 soon before press time.At press time, bitcoin is trading at $5,068, down over 3 percent for the session, as per CoinDesk price data.The drop may now have thrown a spanner into a bullish market setup that had looked likely to propel prices to highs not seen since late last year. Had bitcoin’s triangle breakout succeeded, a measured move to $5,800 may have been on the cards. However, bitcoin fell $300 short of that target as buyer volume fell short on the day.With bitcoin taking a hit, the wider crypto market is also flashing red at press time. Other top tokens, such as ether and XRP are fairing worse than bitcoin, posting 24-hour losses of 7.46 and 5.85 percent, respectively, according to CoinMarketCap data.Disclosure: The author currently holds BTC, TRX and BTT.Bitcoin image via Shutterstock"
77,www.coindesk.com,"Jun 13, 2019",Bitcoin Price Eyes Chart Pattern That Kicked Off Bull Market in ...,https://www.coindesk.com/bitcoin-price-eyes-chart-pattern-that-kicked-off-bull-market-in-2015,"View. Bitcoin's 50- and 100-candle moving averages on the three-day chart 
look set to produce a bullish crossover – a sign of bull ...","Jun 13, 2019 at 11:00 UTC",A long-term bitcoin (BTC) price indicator is about to turn bullish for the first time in nearly four years.,"The 50-candle moving average (MA) on the three-day chart is trending north and could soon cross above the 100-candle, confirming a bullish crossover – the first since October 2015.A bullish crossover, as the same suggests, is a strong indicator of bull market momentum, according to technical analysis theory.In reality, however, both bullish and bearish crossovers tend to lag prices. After all, the MA studies are based on historical data.Even so, the upcoming bullish crossover warrants attention due to the fact that bitcoin broke into a 2.3-year long uptrend with the bullish crossover of the same averages in 2015.BTC’s bear market ran out of steam at lows near $150 in January 2015, following which the price remained largely trapped in $200-$300 range for nine months before confirming a bearish-to-bullish trend change with a move above the July 12 high of $318 on Oct. 28.Notably, the 50- and 100-candle MAs had produced a bullish crossover on Oct. 16 – twelve days before BTC broke into a bull market.The cryptocurrency then charted a steady stream of bullish higher lows and higher highs over the next two years to reach a record high of $20,000 in December 2017.More importantly, lows near $220 seen ahead of the bull cross haven’t come into play till date.The 50-candle MA could soon find acceptance above the 100-candle MA, confirming a bullish crossover.This time, however, BTC may not immediately see a sharp rally as the cryptocurrency has already gained more than 185 percent in the last six months.The relative strength index (RSI) has rolled over from overbought territory, signaling scope for a price pullback and is currently teasing a downside break of the trendline representing the uptrend from December lows. So, a temporary price pullback could be in the offing.It is worth noting that the picture was somewhat different in 2015 with BTC stuck in a $100 range for nine months to October during which the averages bottomed out.Further, the cryptocurrency was up just 67 percent from the bear market low and the RSI was reporting bullish conditions with an above 50-print when the crossover happened on Oct. 16, 2015. Put simply, BTC had room to rally on confirmation of the bullish crossover.As for the next 24 hours, BTC may remain bid, having ended an eight-day long trading range of $7,500-$8,100 with a bullish breakout on Wednesday.As of writing, the leading cryptocurrency by market capitalization is trading at $8,113 on Bitstamp, representing 1 percent gains on a 24-hour basis.BTC found acceptance above $8,100 in the U.S. trading hours yesterday, confirming twin bullish cues – a falling channel breakout and a sideways channel breakout on the 4-hour chart.As a result, the cryptocurrency has scope for a rally to $8,400. So far, however, the upside is being capped by the 100-candle MA, currently at $8,188.The case for a rise to $8,400 would weaken if the repeated rejection at the 100-candle MA ends up sending prices below the ascending trendline support, currently at $7,910.Disclosure: The author holds no cryptocurrency assets at the time of writing.Bitcoin image via CoinDesk archives; charts by Trading View"
