,press company,date,title,url,abstract,date detail,head article,main article
201,www.coindesk.com,"Jun 24, 2019","Two Israeli Brothers Arrested for Phishing Fraud, Bitfinex Hack",https://www.coindesk.com/two-israeli-brothers-arrested-for-phishing-fraud-bitfinex-hack,"The infamous Bitfinex theft of 119,756 BTC shocked the crypto market with 
the largest loss of bitcoins by an exchange since the Mt. Gox breach ...","Jun 24, 2019 at 18:00 UTC","The Israeli Police cyber unit arrested two brothers, Eli and Assaf Gigi, for allegedly perpetrating a multi-year phishing scheme and participating in a 2016 hack of Bitfinex. Israeli news outlet Ynet reports the two allegedly stole over $100 million in cryptocurrency.","The infamous Bitfinex theft of 119,756 BTC shocked the crypto market with the largest loss of bitcoins by an exchange since the Mt. Gox breach in early 2014.Earlier this month, some of the stolen bitcoin were recorded moving from wallets connected with the hack, after three years of lying dormant.Israeli crime news portal Posta reported that several several cyber units across the globe are cooperating in an effort to retrieve the missing funds. The majority of compromised accounts were from users in the U.S. and E.U. In February, Bitfinex announced that some of the stolen bitcoin – 27.66270285 – were returned after being retrieved by the U.S. government.The Gigi brothers Eli, 31, and Assaf, 21, also allegedly constructed a phishing scheme that involved luring investors from crypto trading forums, such as Telegram or Reddit, onto websites that mimicked prominent crypto exchanges. They would collect the traders’ login and wallet information and use it to transfer the funds stored on legitimate exchanges to their own accounts.Police allege they may have used other tactics as well, including dropping links to wallet management software that once downloaded would allow access to the victim’s funds.During a raid of Eli’s house the Israeli police seized one of his crypto wallets, which contained less than the suspected total of stolen funds. They also found two luxury cars.Eli is a former computer science expert in the IDF, which one reddit user said “would be Unit 8200, the largest military branch in the Israeli army. It specializes in hacking, spying and creating computer viruses (Stuxnet) – many of them are now employed by Google, Microsoft and Coinbase.”Eli said in court, as reported by Posta, “I was wrong, I came from a bad place. I’m a good boy, and I’m sorry. I’m willing to cooperate.”The investigation, which began in 2017, is ongoing.Fish hook image via Shutterstock"
202,www.coindesk.com,"Jun 20, 2019",QuadrigaCX CEO Set Up Fake Crypto Exchange Accounts With Customer Funds,https://www.coindesk.com/quadrigacx-ceo-set-up-fake-crypto-exchange-accounts-with-customer-funds,"All but 8 bitcoin were liquidated, netting some $80 million CAD ($60.4 
million USD). While this exchange is not cooperating with EY, it is ...","Jun 20, 2019 at 11:05 UTC","QuadrigaCX’s late founder and CEO used customers’ funds to trade for his own account on other cryptocurrency exchanges, the Canadian firm’s bankruptcy trustee said.","In a bombshell 70-page report released Wednesday, Ernst & Young claimed that Gerald Cotten, who apparently died last December, transferred millions of dollars in crypto out of customer accounts and into other exchanges, with the funds being used to furnish Cotten’s personal lifestyle and trading habits. Overall, it appears that Cotten effectively stole more than $200 million USD from his customers.“Significant volumes of Cryptocurrency were transferred off Platform outside Quadriga to competitor exchanges into personal accounts controlled by Mr. Cotten,” the report said. “It appears that User Cryptocurrency was traded on these exchanges and in some circumstances used as security for a margin trading account established by Mr. Cotten.”Fees and trading losses “appear to have adversely affected Quadriga’s cryptocurrency reserves,” while other sums were sent to wallets whose owners EY could not confirm.Between 2016 and the end of 2018, Cotten transferred 9,450 bitcoin, 387,738 ethereum and 239,020 litecoin out of his exchange’s accounts (respectively, $88 million, $105 million and $33 million USD at present market prices, though their values have fluctuated – and increased dramatically – over that time).Cotten also appears to have created fake accounts on Quadriga, credited them with fiat amounts that did not actually exist, and use this fake fiat to purchase actual crypto from customers, with the largest account using the name Chris Markay.Later, the report says that Cotten margin traded zcash, dash, dogecoin and omisego, where he “generated substantial losses.”An unidentified third exchange received 21,501 bitcoin ($201 million in today’s prices) into an account under Cotten’s name. All but 8 bitcoin were liquidated, netting some $80 million CAD ($60.4 million USD).While this exchange is not cooperating with EY, it is cooperating with local authorities in its jurisdiction. EY is now looking to open “formal channels” with these authorities.Evan Thomas, a litigator with Osler Hoskin & Harcourt in Canada, told CoinDesk that “based on the report, what [Cotten] did was clearly fraudulent and betrayed the trust of Quadriga users.”Cotten’s actions could not have been an accident, Thomas indicated, saying:“It’s possible that he got in over his head and was trying to trade his way out out of a deficit using other people’s money, but given that the fake accounts have existed since at least 2016 and he misappropriated funds for luxury travel and real estate investments, it seems more likely that this was a calculated and deliberate fraud.”QuadrigaCX filed for protection from creditors in January, owing customers $190 million worth of crypto and fiat, most of which it could not access because only its late CEO Gerald Cotten knew where the private keys were.EY’s hunt for the missing funds, first as court-appointed monitor and then as trustee when QuadrigaCX formally entered bankruptcy in April, has largely been fruitless.As of May, the estate had just $21 million of assets to cover $160 million in remaining liabilities, though the most recent report brings the sum closer to $24.5 million.The U.S. FBI is looking into the losses, as are Canadian authorities.EY’s report also detailed rampant mismanagement and poor practices, noting that Quadriga did not keep administrative logs and had no contingency plan for the loss of funds or its leader.What’s more, the exchange seemingly engaged in poor accounting practices.For example, the exchange paid two of its nine payment processors $11.8 million CAD (roughly $9 million USD) in fees alone.Quadriga did not maintain any documentation, however.“The Monitor has been unable to locate any accounting with respect to the pooled Quadriga Funds,” the report said. “The Monitor notes the TPP accounts were used to process User Fiat transactions, fund general Quadriga operating costs and on multiple occasions funds were directed to Mr. Cotten, parties related to Mr. Cotten or counsel/parties acting on his behalf.”It went on to add:“It appears that as and when operating expenses were required to be paid, or when Mr. Cotten desired funds to be transferred to himself or related parties, he simply instructed TPPs to issue payments with no oversight.”EY also believes that properties in Nova Scotia, properties in British Columbia, investment securities, cash holdings, a boat, an aircraft, luxury vehicles and gold and silver coins that purportedly belonged to Cotten, and now belong to his widow Jennifer Robertson were paid for using Quadriga’s customers’ funds, and therefore should be liquidated.“As Mr. Cotten’s and Ms. Robertson’s personal expenditures and the accumulation of their personal assets since 2015 was sourced from Quadriga funds, the Trustee intends to seek the recovery of the Preserved Assets subject to the Asset Preservation Order back to the Estate for immediate liquidation on the basis that the funds which Mr. Cotten directed be paid to them constitute preferences or transactions at under value under the BIA and may be subject to other causes of action asserted by the Trustee,” EY wrote.The proceeds from these sales, if successful, will go to the creditors’ estate, and could total as much as $12 million CAD ($9 million USD).In a separate filing, EY outlined the process that former QuadrigaCX users who lost money when the exchange went belly-up should follow to file claims.“Users will be requested to complete and deliver their Proofs of Claim to the Trustee prior to 5:00 p.m. (Halifax time) on August 31, 2019 (the ‘Claims Submission Date’),” EY said.EY acknowledged in the filing that creditors have encountered difficulty finding the information they need to prepare claims because Quadriga’s website has been down since January.A committee and lawyers representing users “have expressed concern with the platform site being offline as Users cannot access statement details or information necessary to complete their claims,” EY said.In response, EY says it worked with the creditors’ lawyer to help users find ways to retrieve account balance information.That process involves an online portal where users are asked to type in their QuadrigaCX account number and first name.“If a match is found, your balances will be displayed,” the EY-built web page says, warning: “Be sure to print or screen capture the results.”The auditing firm has also modified the standard form for bankruptcy claims “in order to fit Quadriga’s unique circumstances of having claims against it denominated in Cryptocurrency and Fiat,” EY said.The form, which misspells the word “ethereum” and is interrupted by a page break in the filing, looks like this:Thomas told CoinDesk that based on the new reports, there may not be much for customers to recover.“Right now, it looks like the primary source of recovery for creditors will be the fiat and the frozen assets,” he said, concluding:“The report doesn’t address potential damages claims against other parties but that may be something the trustee will consider.”Nova Scotia Supreme Court image via Nikhilesh De for CoinDesk"
203,www.coindesk.com,"Apr 24, 2019",New Code Helps Lightning Users Protect Their Bitcoin from ...,https://www.coindesk.com/new-code-helps-lightning-users-protect-their-bitcoin-from-file-corruption,"She's excited about the potential for bitcoin's lightning, a technology 
that advocates hope will bring bitcoin payments to the masses. So, even ...","Apr 24, 2019 at 21:00 UTC","Imagine this: Alice is one of the “reckless” users testing a new, risky technology.","She’s excited about the potential for bitcoin’s lightning, a technology that advocates hope will bring bitcoin payments to the masses. So, even though developers tell her it’s risky to do so, she’s running the technology on a little computer called a Raspberry Pi anyway, even using it to buy pizza.But Alice’s Raspberry Pi is having trouble, so she reboots her node to fix the problem. But when she turns it back on, she finds that a very important file had become corrupted when the computer shut down.And now, all of Alice’s funds are gone.This troubling problem with lightning has happened to at least a few users. And it’s one of the reasons using lightning today is considered not exactly safe to use. But thousands of users are ignoring this advice, sending payments across the network to see how the novel technology works in action.Luckily, the sixth major release of the lightning implementation LND, released just last week, aims to solve this problem by putting into place the change “static backup channels” as coded by Lightning Labs CTO Olaoluwa Osuntokun.As it stands, the fate of a user’s money hinges on one file.“What happens if your channel.db file gets corrupted? It’s pretty simple: All the funds in your channels are lost,” an explainer article from earlier this month by developer Patrick Lemke reads.As Suredbits CEO Chris Stewart, who has also put together research on the topic, put it in conversation with CoinDesk:“Computers are finicky. Maybe your file system is deleted and you’re like shit, how do I get this money back?”In practice, Osuntokun noted to CoinDesk that this mostly has happened to lightning enthusiasts using Raspberry Pis, which are little hardware devices that cost roughly $30 and are an easy way to stand up a lightning node at a low entry cost.Losing money in this way is not very common, Stewart notes, but he argues that developers are working on “worse case planning.”There are three main implementations of lightning so far (including Blockstream’s c-lightning and Acinq’s Eclair) all of which have implemented this sort of a backup scheme in some form or another.LND’s new technology generates a second copy of the important file, allowing users to save an extra version of their lightning wallet file elsewhere, to minimize the risk of it getting lost or “corrupted,” meaning the data was accidentally altered, like staining a drip of coffee on a white shirt.This is comparable to backing up all your computer files periodically to ensure they’re safe even if the laptop takes its last steps or gets stolen.With bitcoin, each transaction is stored in the blockchain, on thousands of nodes across the world. But with lightning, the off-chain transaction data is stored on your computer – and your computer alone. If you lose or “corrupt” the file storing state of the channels, then those funds are lost for good.Another related scenario: if you accidentally use an old version of the channel.db, which turns out to have the wrong information, then your peer will probably think you’re cheating. Thus, you’ll be penalized, losing money.That’s why this new backup code is so important. To ensure safety of funds, a user needs to save their channel.db backup file in more than one place at once.“If you run the latest version of LND your node will automatically create a backup of all the bits of information that you need to rescue your channels in case your channel.db file is lost,” Lemke explains.“We say safe, as care has been taken to ensure that there are no foot guns in this method of backing up channels, vs doing things like rsync ing or copying the channel.db file periodically. Those methods can be dangerous as one never knows if they have the latest state of a channel or not. Instead, we aim to provide a simple safe instead to allow users to recover the settled funds in their channels in the case of partial or complete data loss,” Osuntokun explains in the “pull request” where he first proposed the change.That said, Lemke stresses that users running the old lightning code are still at risk.“If you run an older version of LND your channels are not [safe] and you should be aware that you are at risk of losing your funds if your disk gets corrupted,” he wrote.So, now that this code has been pushed through, is the problem solved?Not exactly. As you can see, it’s still a bit of a process for backing up the files. While the infrastructure LND puts into place automatically generates a backup file for users, the user still has to be technical enough to configure where to put it.Not to mention, Stewart and Cohen point out one problem with the scheme: it’s not completely trustless. Using this backup scheme, a malicious node could steal a counterparty’s funds.This feature is “good for the average user who’s willing to trust that their peer is not malicious,” Suredbits software engineer Nadav Cohen told CoinDesk, while Stewart noted that the backup solution should work “99% of the time.”But Stewart also highlighted how Suredbits has been working a lot with different exchanges that are looking to eventually adopt lightning.“For exchanges, they absolutely need to a [trustless backup scheme]. They’re dealing with lots of money and don’t want to have the risk of losing a lot of funds,” Stewart said.Osuntokun has this scenario in mind too, noting that Lightning Labs developers are currently building out a feature that works even when a user is dealing with a malicious peer. In the meantime though, they released static backup channels, since they wanted to push out something that works for the most part.“This infrastructure will be built out in the near future, but until then we have this scheme which will also be a fall back in the scenario that any higher level mechanisms fail,” Osuntokun explained.In other words, there’s still building to be done.“We’re not there yet,” as Stewart puts it, arguing there will be more of a need for this kind of feature in the future once people are using the network for even more money.“With wumbo, people will start transacting more. We need to be concerned in that case,” he added, referencing a Spongebob Squarepants-inspired technology that will one day allow people to transfer even more money across lightning.But once developers get this scheme working, Cohen argues that it shouldn’t be hard to put something into place that’s easier for users.He said:“Backups are in the early stages and it’s a solvable problem. Once we have something that works and doesn’t require trust, I don’t doubt that we can make them better as far as latency.”Burning bitcoin image via Shutterstock"
204,www.coindesk.com,"Jun 13, 2019","Report: Uber, PayPal, Visa to Back Facebook's GlobalCoin ...",https://www.coindesk.com/report-uber-paypal-visa-to-back-facebooks-globalcoin-cryptocurrency,"Facebook pixel Twitter pixel Alexa pixel. CoinDesk Bitcoin News. News Learn 
Research. News; Learn; Research. Events · Latest · Opinion ...","Jun 13, 2019 at 22:34 UTC","Visa, Mastercard, PayPal and Uber are all backing Facebook’s new cryptocurrency, according to a new report.","The Wall Street Journal reported Thursday that the social media giant has signed on more than a dozen backers for its GlobalCoin cryptocurrency, a stablecoin that has been developed in secrecy for more than six months. Each of the new backers will invest roughly $10 million in the project as part of a governing consortium for the cryptocurrency.Stripe, Booking.com and MercadoLibre are part of the project, according to the Journal, though the report does not specify what their roles are.Facebook announced it was launching GlobalCoin last December, though the company indicated that it was looking at cryptocurrency as far back as the end of 2017. The crypto is expected to be a stablecoin that will operate within the company’s messaging infrastructure – WhatsApp, Instagram and Facebook Messenger.However, Facebook has been tight-lipped about what exactly GlobalCoin will be used for, though the BBC suggested that Facebook may look to retailers, allowing its users to purchase discounted goods using the cryptocurrency. The cryptocurrency would be used to transfer value directly from Facebook to the retailer, cutting out credit card companies in the middle, which BBC suggests would help the retailers’ profits.GlobalCoin is now expected to be unveiled on June 18.Facebook image via Shutterstock"
205,www.coindesk.com,"May 8, 2019",DeepDotWeb Defendants Used Bitcoin to Hide Criminal ...,https://www.coindesk.com/deepdotweb-defendants-used-bitcoin-to-hide-criminal-proceeds-say-feds,"Prosecutors allege that the pair made 8,155 bitcoins in total over a period 
of years from this activity and estimate their total haul at $15.4 million. 
“ ...","May 8, 2019 at 21:00 UTC","U.S. authorities have formally charged the alleged moderators of DeepDotWeb, the dark web comparison and news site seized by the feds, with money laundering, taking illegal kickbacks and other crimes.","Police arrested the two Israeli citizens – Tal Prihar, 37, and Michael Phan, 34 — on Monday. Prihar, who lived in Brazil, was taken in France while police arrested Phan in Israel. TechCrunch posted the just-unsealed U.S. indictment Wednesday.The authorities are calling DeepDotWeb’s affiliate system a “kickback” scheme, suggesting that the pair received cash for giving dark web exchanges more business. The two also allegedly used bitcoin to hide their tracks, and the indictment’s section on asset forfeiture says they had accounts at crypto exchanges OKCoin and Kraken and payment processor BitPay.Prosecutors allege that the pair made 8,155 bitcoins in total over a period of years from this activity and estimate their total haul at $15.4 million.“To conceal and disguise the nature and source of the illegal proceeds, totaling over $15 million, Prihar and Phan transferred their illegal kickback payments from their DDW bitcoin wallet to other bitcoin accounts and to bank accounts they controlled in the names of shell companies,” wrote prosecutors.“This is the single most significant law enforcement disruption of the dark net to date,” said Scott Brady, U.S. attorney for Western Philadelphia, in a press conference.Notably, Prihar allegedly moved to Brazil, which has constitutional protection against extradition, though not for naturalized citizens. In any event, an alleged DeepDotWeb moderator wrote, “instead of arresting Prihar in Brazil, authorities arranged for his arrest in France where Prihar would land for a connecting flight between Israel and Brazil.”Further, Brazilian authorities allegedly found $200,000 in cash and “an undisclosed amount of various cryptocurrencies, including bitcoin.” The form those currencies took is unclear. They also arrested another suspect in Brazil.Em ações simultâneas, enquanto o investigado era preso em #Paris, na #França, buscas eram realizadas em sua casa, em Brasília. Na busca foram apreendidos dispositivos utilizados para a guarda de criptomoedas e R$ 200 mil em espécie (moeda estrangeira e reais). pic.twitter.com/hNMXM40SaQ— Polícia Federal (@policiafederal) May 7, 2019Deep Dot Web Indictment by John Biggs on ScribdImage of police approaching Prihar’s home in Brazil via Medium"
206,www.coindesk.com,"May 27, 2019",Yahoo Japan-Backed Crypto Exchange Taotao Launches ...,https://www.coindesk.com/yahoo-japan-backed-crypto-exchange-taotao-launches-this-week,"According to the Taotao website, the exchange will be offering a mobile app 
alongside its online platform, and will offer trading in bitcoin (BTC) ...","May 27, 2019 at 14:20 UTC",A new crypto exchange platform in which Yahoo Japan owns a major stake is about to launch after over a year in development.,"The new platform, called Taotao, announced on Twitter Sunday that it will go live on Thursday, May 30, at midday local time.According to the Taotao website, the exchange will be offering a mobile app alongside its online platform, and will offer trading in bitcoin (BTC) and ether (ETH) at launch.The firm will also be making leverage available for interested traders, with three more cryptos added to the available options: XRP, litecoin (LTC) and bitcoin cash (BCH).Taotao is regulated as a virtual currency exchange business under Financial Services Agency, with its website proudly displaying the registration number 00001.That early registration comes via the exchange’s previous FSA-licensed iteration, the BitARG exchange, in which Yahoo Japan bought a 40-percent stake last March. It was reported at the time by Nikkei Asian Review that Yahoo Japan had taken the stake with the aim of developing a new exchange platform using BitARG’s technology.Taotao’s website indicates that Yahoo Japan does indeed hold 40 percent of the entity, via its wholly owned subsidiary Z Corporation, with CMD Lab Inc. holding the remaining 60 percent.The website also offers users “easy registration/sign in” via Yahoo accounts.Yahoo Japan image via Daniel Palmer for CoinDesk"
