,press company,date,title,url,abstract,date detail,head article,main article
134,www.coindesk.com,"Jun 14, 2019",Jack Dorsey Hints at How Square Crypto May Support ...,https://www.coindesk.com/jack-dorsey-hints-at-how-square-crypto-may-help-with-bitcoin-development,"After revealing that his payments firm Square is building a small team to 
help with bitcoin and cryptocurrency development back in March, CEO ...","Jun 14, 2019 at 14:22 UTC","After revealing that his payments firm Square is building a small team to help with bitcoin and cryptocurrency development back in March, CEO Jack Dorsey has revealed more details about the project – even though it’s still early days.","In an interview with The Next Web, Dorsey, who is also CEO of Twitter, confirmed that he’d recently hired former Google director Steve Lee to lead the team. Dorsey said that he’d interviewed “tens of candidates” for the post before arriving at Lee as his choice.The new hire will take responsibility for building the remainder of the team, as well as defining its future path, he said. Square is currently eyeing a maximum of five engineers and one designer, who will likely work on a single project rather than many.That’s because Dorsey aims to “make some step changes to various aspects of the ecosystem, versus an iteration,” he said.While one would expect devs, the choice of a designer comes as something of a surprise in such a early stage project. Dorsey put this down to the need for the need to make cryptocurrencies more accessible, as well as providing education on the technology.Joking that the team doesn’t want any “jerks,” Dorsey also said that it’s important any candidates must have good technical abilities.“We want to see significant open-source contributions to various projects. Bitcoin Core is a great example of that, but there’s others, too,” he said.As for its particular role in the crypto ecosystem, he explained that Square Crypto might conduct “grungy, but meaningful” code reviews in order to speed up development. While there are plenty of devs helping out on cryptocurrency projects, few are working on checking the correctness of the code, Dorsey said – changing that could give a “huge boost” to the space.Outside that, there’s need for work to improve efficiency and security. “There’s still a number of big flaws within the Bitcoin community right now,” Dorsey told TNW.The CEO also indicated that he wants to keep the role of Square in the mechanics of the team to a minimum, ruling out cheap stock options in favor of optional bitcoin salaries in order to build a desire to better “serve the community.”The work carried out by the team should also be open to the public. While it’s not set in stone yet, Dorsey suggested Square Crypto could operate like a traditional open-source project.Aside from the more general development work of the crypto team, Square is eyeing bitcoin technology in its products too. Back in February, Dorsey announced during an interview with podcaster Stephan Livera that there are plans to integrate the lightning network – a still early-stage bitcoin payments tech – with Square’s Cash app.Jack Dorsey image via CoinDesk archives"
135,www.coindesk.com,"May 7, 2019",Privacy Cryptocurrency Grin Receives Mysterious $300K ...,https://www.coindesk.com/privacy-cryptocurrency-grin-receives-mysterious-300k-bitcoin-donation,"Users can donate funds at any point in time to five different public 
addresses accepting Grin, bitcoin, ethereum and zcash. The most recent ...","May 7, 2019 at 17:15 UTC","The developers behind the cryptocurrency project Grin have reportedly received an anonymous donation of 50 BTC – worth an estimated $300,000.","The news, shared during a weekly meeting of developers, is notable, as Grin came to market touting what it called a “fair launch,” meaning project leaders did not raise any funds via an initial coin offering (ICO) or a private sale of the tokens that would power the technology.This means development of the Grin protocol has been entirely reliant on voluntary donations and crowd-funding. A relatively new cryptocurrency launched back in January, Grin leverages novel technology to obfuscate transaction information.One developer, Daniel Lehnberg, said about the large monetary gift:“A really big and heartfelt thanks. We’ll ensure [we] put that to good use.”Users can donate funds at any point in time to five different public addresses accepting Grin, bitcoin, ethereum and zcash. The most recent donation of 50 BTC was placed in the Grin bitcoin SegWit address and mined on the bitcoin blockchain Sunday.Still, the donation is also a sign that Grin’s funding model may be working.According to a recently released financial report, funding for the project has increased almost two-fold over the past four months from an estimated $65,237.35 to $123,423.73. Now, with the additional 50 BTC donation, the project holds roughly six times the amount of funds it started out with at the top of 2019.Going forward, funds are expected to be put towards project needs including building and deploying key infrastructure, website design and marketing development, mining hardware design and more.Grin application image via CoinDesk archives"
136,www.coindesk.com,"May 21, 2019",Dutch Man Arrested Over $2.2 Million Bitcoin Mining Fraud,https://www.coindesk.com/dutch-man-arrested-over-2-2-million-bitcoin-mining-fraud,"A 33-year-old man in the Netherlands has been arrested for bitcoin mining 
fraud worth over €2 million ($2.2 million). Dutch tax authority's ...","May 21, 2019 at 17:30 UTC",A 33-year-old man in the Netherlands has been arrested for bitcoin mining fraud worth over €2 million ($2.2 million).,"Dutch tax authority’s investigative department, FIOD, announced the news Monday, saying that the man was a director of two private limited companies where he convinced around 100 people to buy computers for mining bitcoins that he probably never purchased.The man is accused of fraud, forgery, and money laundering, the department said, adding that he allegedly spent investor money on luxury items such as cars, motorbikes, travel, and gambling.The suspect started his businesses in 2017 by promising investors return of around 0.3 bitcoin a month (currently worth around $2,389). When investors did not get the returns and their mining computers back, several of them filed complaints.Back in November 2018, the FIOD and police raided the suspect’s home and business premises and seized expensive goods such as bags, shoes, and a bike.The FIOD said fighting money laundering is the priority for the government as it is one of the “serious” crimes.Earlier this year, Dutch financial authorities were planning a licensing scheme for cryptocurrency firms to prevent money laundering and terrorism financing. De Nederlandsche Bank (DNB), the nation’s central bank, and the Netherlands Authority for the Financial Markets suggested that fiat-to-crypto exchanges and custody solution providers must be licensed as cryptocurrencies carry “high financial crime risks.”Dutch police officer image via Shutterstock"
137,www.coindesk.com,"May 27, 2019",The Cat-and-Mouse Game of Crypto Regulation Enters a New ...,https://www.coindesk.com/the-cat-and-mouse-game-of-crypto-regulation-enters-a-new-phase,"If you hold your coins with Coinbase, you will no longer be able to send or 
receive crypto to or from just any old bitcoin address if it has been ...","May 27, 2019 at 08:00 UTC",Michael J. Casey is the chairman of CoinDesk’s advisory board and a senior advisor for blockchain research at MIT’s Digital Currency Initiative.,"In the relentless cat-and-mouse game between regulators and cryptocurrency developers, the cats are about to add some serious firepower – this time in the form of a global alliance.But if you think the intergovernmental Financial Action Task Force’s forthcoming know-your-customer (KYC) compliance standards spell the end for the mice, think again. If anything, the FATF’s move, expected to be released next month, will drive developers to accelerate work on non-custodial exchanges and other tools that will make it easier for end-users to transact directly outside of regulated intermediaries.As CoinDesk managing editor Marc Hochstein explained last week , the new rules are likely to require exchanges and other custodial entities that take custody of their customers’ cryptocurrency to obtain identifying information about both parties before allowing a transaction over their platforms.Functioning much like the FATF’s “travel rule” for correspondent banks, the new regulatory approach would be backed by the task force member institutions’ unique powers to “graylist”– and ultimately blacklist – entire countries if they are judged to be non-compliant.When combined with the European Union’s forthcoming AMLD5 anti-money laundering rules for cryptocurrencies, the new framework conjures up the image of an all-encompassing global system for cryptocurrency transactions in which no one user is unaccounted for.Libertarian-minded cryptocurrency believers will view this as an abominable surveillance system that contravenes the censorship-resistant principles upon which bitcoin was built.From a practical perspective, the new rules are going to be a burdensome imposition on custody-handling exchanges. It may well spur industry consolidation as smaller players may find the compliance costs too high. Blockchain analysis firm Chainalysis, which counts regulatory agencies among its clients,  argued in a submission to the FATF that the new rules are impractical and would drive more activity in cryptocurrencies into services that make it much harder for authorities to track illicit activity.The rules could also, sadly, add to the “de-risking” problem that excludes billions of under-identified people in developing countries from the global financial system.But all is not lost. In most countries, there is nothing illegal about holding cryptocurrency itself under your own custody. And, as was clarified in  guidelines recently published by the Financial Crime Enforcement Network, or FinCEN, the world’s regulatory institutions won’t, for now at least, be imposing the same KYC requirements on providers of self-custody wallet software.What is likely to emerge, then, in parallel to the FATF-regulated ecosystem of regulated custody-taking institutions, is an entirely separate economy of peer-to-peer exchanges among people who control their own cryptocurrency.If you hold your coins with Coinbase, you will no longer be able to send or receive crypto to or from just any old bitcoin address if it has been through a KYC process. Once you move your funds into a non-custodial account, you’ll be free to send them to any self-custody address, but if you’ve never formally associated your identity with that address via a regulated entity, you won’t be able to transact with a Coinbase address or one administered by any other regulated custody provider.The point, though, is that this otherwise draconian regulatory framework still leaves room for Satoshi’s vision of a peer-to-peer payments system. And with more work on technical and business model development, that system could still become sizable.In fact, the new rules could be a catalyst for developers to more urgently tackle the core technical and logistical challenges that have limited the adoption of self-custody cryptocurrency wallets. These challenges fall under the categories of security, market coordination and fiat on-ramps, all three of which are currently showing significant progress.A key incentive for people to hold their cryptocurrency with custodial services such as Coinbase has been an unwillingness to risk either misplacing their private keys or having them stolen. Stories of hacks and loss abound and have long discouraged newbies from “being their own bank.”In recent years, secure hardware wallets such as Ledger and Trezor have made it easier for people to control their assets without exposing their private keys to online hackers.  But security experts claim to have found vulnerabilities. And the user experience is still far from convenient for the non-savvy.Still, a new generation of smartphones that employ military grade security and end-to-end encryption should make it easier to securely hold cryptocurrency, locally, on a device that easily connects to the Internet for global payments.  HTC led the way in this technology.  Samsung is now catching up.Phone makers are employing sophisticated, locally stored biometric proofs to indelibly tie control to a user. When combined with multi-signature technologies, human-friendly key recovery solutions such seed phrases kept with trusted associates, and a bit of education, the risk of loss can be reduced to an immaterial level.Other changes to the ecosystem, such as decentralized insurance programs and more aggressive measures to hold phone carriers to account for “SIM swap” attacks such as the one that led  Michael Terpin into a lengthy legal battle with a hacker and AT&T, will also boost confidence.Over time, more and more people are going to feel more comfortable managing their own key custody.The next challenge is to reduce the widespread dependence on custody-based exchanges.Cryptocurrency users need to efficiently find buyers and sellers, and until now, that has left them dependent on centralized exchanges, which are key targets of the new regulations.The answer lies in the rapidly growing field of decentralized exchanges, where custody is retained by the investor and where technologies such as atomic swaps allow seamless peer-to-peer transfer of assets without either party being able to defraud the other.As a nascent technology, DEXs currently struggle to attract the liquidity of the larger centralized exchanges, which makes them less attractive. But with Binance having launched a beta version, there is likely to be rapid development in this space.Meanwhile, Boston-based startup Arwen has launched a protocol that would give investors access to the matching engines of large centralized exchanges but allows them to retain custody through a smart contract solution that locks up their coins in escrow. KuCoin has integrated a beta version of the technology into its exchange.Even if decentralized exchanges and self-custody trading can help crypto-to-crypto transactions stay out of the regulatory net, they won’t solve the related problem of access to fiat currency. For the moment, that’s a service that has been almost solely provided by regulated, centralized exchanges.The solution lies with the new batch of stablecoins, where dollar-pegged tokens such MakerDAO’s algorithmic solution, Dai, are competing with reserves-backed stablecoins such as those of Gemini, Paxos and a consortium led by Circle and Coinbase.In theory, there’s nothing technical stopping these stable-value tokens from moving in and out of unidentified self-custody wallets, which offers a way around the fiat on-ramp problem by enabling access to de facto dollars, if not actual dollars. Only when users redeem them for actual greenbacks via the token-issuing companies will they drop into a regulated environment and have to identify themselves.Now, all these services must be underpinned by real fiat resources, which means that stablecoin providers and DEX software providers will still need bank accounts. And given banks’ ongoing reluctance to support cryptocurrency businesses, obtaining them could be a potential obstacle to startups looking to grow of this ecosystem.In this way, banks could continue to be the wedge with which regulators impose limits on the otherwise unregulated cryptocurrency industry.But as I’ve argued elsewhere , banks’ growing interest in other blockchain developments, such as in making markets in tokenized equity and bond offerings, is going to induce them to support tokenized payments. This will eventually demand a more friendly approach to some of these service providers, especially stablecoins.Most banks won’t want to cede the future of digital fiat payments to a competing bank such as JPMorgan , and they’ll be reluctant to let Facebook turn its more than 2 billion active users into an instant global payment network that bypasses banks. Ironically, that could draw them closer to rebel providers of these self-custody-enabling services.The Tom and Jerry show will continue, in other words. Don’t change the dial.Cat and mouse image via Shutterstock"
138,www.coindesk.com,"May 13, 2019",Bakkt Sets July Test Date for Bitcoin Futures,https://www.coindesk.com/bakkt-sets-july-test-date-for-bitcoin-futures,"Bitcoin futures exchange Bakkt announced Monday that it is moving forward 
with plans to launch physically-settled bitcoin futures products.","May 13, 2019 at 14:24 UTC",Bitcoin futures exchange Bakkt announced Monday that it is moving forward with plans to launch physically-settled bitcoin futures products.,"In a blog post, Bakkt CEO Kelly Loeffler wrote that Bakkt had “worked closely” with the U.S. Commodity Futures Trading Commission (CFTC), the regulatory agency in charge of overseeing derivatives products in the country, and would be testing its bitcoin futures contracts this summer.No launch date was announced, and indeed, Loeffler did not explicitly say that the company’s proposal to self-custody its bitcoin and clear through its parent company’s warehouse (Intercontinental Exchange’s ICE Clear US) had been approved.Rather, Bakkt, through ICE, will self-certify its bitcoin futures products, meaning that the CFTC will have to assess whether or not the proposals violate any laws or regulations. If the regulator does not find any issues within a 10-day deadline, the products will move forward.This is different from asking the CFTC to explicitly approve a product, which Bakkt was previously said to be doing. CME and Cboe both self-certified their bitcoin futures contracts when they were first announced in 2017.However, unlike CME and Cboe’s products, Bakkt will deliver actual bitcoin, rather than the cash equivalent, upon a contract’s expiration.The company did not announce a final launch date, but should be able to proceed should the CFTC not raise any objections.According to the CFTC’s Rules and Rule Amendments webpage, the regulator has 10 business days to review the proposed products.ICE published two documents Monday, detailing the listing and self-certification of its two new products.In the blog post, Loeffler wrote that “we’ll be working with our customers over the next several weeks to prepare for user acceptance testing (UAT) for futures and custody, which we expect to start in July.”“We expect to use UAT to ensure that customers have time to onboard and can test the trading and custody model we’ve built to their satisfaction,” she wrote, adding that future details will be shared in upcoming posts.Still, Loeffler shared some new information about Bakkt’s upcoming products.For one thing, the firm will list two different futures contracts: a daily settlement bitcoin future, “which will enable customers to transact in a same-day market,” and a monthly futures contract. This is different from the one-day futures contract that the platform originally announced.Specifically, the firm’s new products will be:Bakkt will also place $35 million of its own funding into the clearinghouse risk waterfall, which “puts our own ‘skin in the game’ and aligns our interests for market integrity and safety with market participants,” Loeffler wrote.In addition, Bakkt plans to use its own qualified custodian to provide custody services, though this remains subject to regulatory approval.Part of this effort will revolve around Bakkt’s efforts to secure a trust company license with the New York Department of Financial Services (NYDFS), rather than secure a federal license.UPDATE (May 13, 15:40 UTC): This article has been updated with additional details.Kelly Loeffler image via CoinDesk archives"
139,www.coindesk.com,"Jun 13, 2019","Could Bitcoin's Lightning Power Mobile Communications? This Startup Thinks 
So",https://www.coindesk.com/could-bitcoins-lightning-power-mobile-communications-this-startup-thinks-so,"Could Bitcoin's Lightning Power Mobile Communications? This Startup Thinks 
So. Jun 13, 2019 at 04:00 UTC.","Jun 13, 2019 at 04:00 UTC",New research from mobile mesh networking company goTenna explores how mobile communications can be decentralized with the help of bitcoin’s lightning network.,"Technologists have long explored how to use cryptocurrencies and blockchains to build programs where users are more in control of their data. GoTenna, the company behind mesh network devices for internet-less connections, is exploring a novel approach.To that end, the GoTenna team has released a new paper describing how decentralized mesh networks for sending “mobile communications” (such as text messages) could be powered by bitcoin micropayments. What’s more, they’ve establised a new subsidiary Global Mesh Labs LLC to move forward with this goal.“80 billion mobile messages are sent each day via carriers and [Internet Service Providers (ISPs)]. Mobile mesh networks offer an anti-fragile, decentralized alternative that can extend connectivity to places centralized networks can’t,” the project website argues.One hurdle to mesh network adoption is that people aren’t really incentivized to run the infrastructure required to relay data across the network, the paper argues. GoTenna attempts to fix that by describing a new “trust-minimized” protocol with bitcoin’s lightning at the center, called Lot49, which would pay users for relaying data.“Any node can earn a reward for relaying data for others and by being at the right place at the right time,” the paper, written by goTenna engineer Richard Myers, explains.The proposal is reliant on a couple of bitcoin proposals that have been widely discussed, but haven’t yet been incorporated: Schnorr and sighash_noinput. Before building and trying out the protocol, these things will need to be added, if the bitcoin community agrees that they are good changes to make.One is Schnorr, a much-anticipated, new bitcoin signature scheme that was first proposed years ago, and has seen progress recently through the release of test code.“To reduce incentive protocol overhead we propose using signature aggregation, simplex payment channel updates and payment channels formed between mesh nodes within direct communication range,” the paper explains.Light garland image via Shutterstock"
140,www.coindesk.com,"May 23, 2019",Coinstar Expands Bitcoin Buying Service to Cover 21 US States,https://www.coindesk.com/coinstar-expands-bitcoin-buying-service-to-cover-21-us-states,"The service, offered through a partnership with blockchain startup Coinme, 
now allows individuals to buy bitcoin with cash at over 2,200 ...","May 23, 2019 at 09:00 UTC","Supermarket kiosk network Coinstar has further expanded its bitcoin-buying service, adding around 100 new outlets and growing U.S. coverage to 21 states and the District of Columbia.","The service, offered through a partnership with blockchain startup Coinme, now allows individuals to buy bitcoin with cash at over 2,200 locations, Coinme announced Wednesday. As of last month, the service was available at around 2,100 locations in 19 states.The service allows purchases using U.S. dollar bills, not coins, for any amount up to $2,500.Coinstar CEO Jim Gaherity said that the service had received a positive response, seeing “overwhelming” demand from both consumers and new retailer partners. He added that Coinstar will continue expanding to new markets “in the coming months.”Currently supported cities include Boston, Chicago, Dallas-Fort Worth, Houston, Los Angeles, Philadelphia, San Diego, Seattle and Washington D.C, among others.Coinstar first partnered with Coinme in January of this year, enabling bitcoin purchases at Safeway or Albertsons stores in California, Texas and Washington states at the time. Last month, it added support for Jewel, Shaw’s, Save Mart and more.Coinme co-founder and CEO, Neil Bergquist, said:“Bitcoin and other digital currencies offer unique benefits to consumers – including the potential for more cost-effective and faster remittances to family and friends.”Overall, Coinstar said it now owns and operates over 20,000 fully automated self-service coin-counting kiosks in nine countries, with thousands in the U.S. that allow bitcoin purchases.Coinstar image via Coinme"
