,press company,date,title,url,abstract,date detail,head article,main article
0,www.coindesk.com,"Jun 21, 2019",Bitcoin Price Tops $10K for First Time Since 2018,https://www.coindesk.com/breaking-bitcoin-price-tops-10k-for-first-time-since-2018,"The price rise is backed by a 12 percent jump in trading volumes. As per 
data source CoinMarketCap, $21 billion worth of bitcoins have traded ...","Jun 21, 2019 at 23:47 UTC","Bitcoin’s price soared above $10,000 on cryptocurrency exchanges for the first time in 15 months. The price hopped the $10K barrier at 7:35pm Eastern Time.","At press time, the top cryptocurrency by market capitalization is trading at $$10,080.49 – the highest level since March 8, 2018 – representing month-to-date gains in excess of 13 percent, according to CoinDesk’s Bitcoin Price Index.  On a 24-hour basis, BTC is outshining most top 10 cryptocurrencies with 7 percent gains.The price rise is backed by a 12 percent jump in trading volumes. As per data source CoinMarketCap, $21 billion worth of bitcoins have traded across cryptocurrency exchanges in the last 24 hours. Messari, however, is reporting the “Real 10” volume at $1.4 billion.With the move above $10,000, bitcoin has erased more than 40 percent of the sell-off seen in twelve months to December 2018.  Further, prices look set to end the second quarter with triple-digit gains. As of writing, BTC is up more than 130 percent on a quarter-to-date basis.Looking forward, BTC may continue to shine bright as the cryptocurrency is set to undergo mining reward halving sometime in May 2020.The process designed to curb inflation by reducing the reward for mining on bitcoin’s blockchain is repeated every four years and leads to supply deficit.The upcoming reward halving may leave a bigger supply deficit if Facebook’s cryptocurrency Libra ends up boosting bitcoin’s appeal and adoption rate as predicted by some observers.On Tuesday, the social media giant launched the white paper to mixed reviews with pundits it a net positive development for bitcoin and cryptocurrencies in general.While bitcoin’s long-term prospects look bright, the cryptocurrency may see a pullback in the short-term. After all, prices have rallied more than 140 percent in the last 2.5-months and bulls usually take a breather following such stellar gains.Disclosure: The author holds no cryptocurrency at the time of writingHot air balloon image via Shutterstock; charts by TradingView"
1,www.coindesk.com,"Jun 17, 2019",3 Reasons Bitcoin Is Rallying Above $9K,https://www.coindesk.com/3-reasons-bitcoins-price-is-rallying-above-9k,"Bitcoin rose above $9,000 over the weekend, taking cumulative year-to-date 
gains to more than 150 percent. The leading cryptocurrency by ...","Jun 17, 2019 at 11:15 UTC","Bitcoin rose above $9,000 over the weekend, taking cumulative year-to-date gains to more than 150 percent.","The leading cryptocurrency by market value clocked a 13-month high of $9,391 on Bitstamp on Sunday and was last seen trading at $9,200, representing 22 percent gains on last Monday’s low of $7,524.Cryptocurrency market experts and investors are associating the sharp price gains seen over the last six days with a number of factors, the most prominent being Facebook’s coming foray into cryptocurrencies.The social media giant is set to unveil its very own stablecoin, reportedly called GlobalCoin on Tuesday, June 17, with a launch to follow in 2020.The project has reportedly already secured the backing of over a dozen companies and is seen boosting the pace of widespread cryptocurrency adoption by many including Barry Silbert, the founder and chief executive of Digital Currency Group.Meanwhile, Spencer Bogart, General Partner at Blockchain Capital, believes Facebook’s crypto effort is among the most bullish external tailwinds for bitcoin in 2019/2020, as it will ease the friction in acquiring digital assets by creating a circular economy.Further, there is a consensus in the investor community that Facebook’s crypto will create awareness that a private, non-central bank issued currency can exist, leading to increased adoption of bitcoin and other cryptocurrencies.The hype garnered by GlobalCoin likely put a bid under the cryptocurrency over the weekend. That, however, makes BTC vulnerable to “sell the fact” trading following the expected white paper launch on Tuesday.Binance.com, the world’s largest cryptocurrency by trading volume, updated its terms of use on June 14 to exclude all users in the U.S.The announcement led to a sharp sell-off in Binance’s very own native asset, Binance Coin (BNB). The price of BNB fell 12.8 percent to 25,209 satoshis (a satoshi being 0.00000001 of a BTC) on Friday, and hit a one-month low of 34,906 satoshis on Sunday.The slide indicates that investors have rotated money out of BNB and possibly into bitcoin, pushing the top cryptocurrency higher, as discussed by Alex Kruger – a prominent Fundamental & Technical Analyst.The upcoming litecoin (LTC) halving, set to trigger on August 5, 2019, will cut the reward gained from mining the cryptocurrency by half, meaning LTC will become a more scarce asset overall.”Halvings’ as they are known, typically result in an overall boost in value for the crypto markets, as the assets themselves become harder to obtain and therefore increase in value.Litecoin has already rallied 353 percent this year and may have added fuel to the ongoing bitcoin’s price rally. It is worth noting that litecoin led the broader markets higher in the first quarter, with 100 percent gains over the period.As noted earlier, bitcoin may see a pullback following Facebook’s announcement on Tuesday. The long duration charts, however, indicate that corrections, if any, could be short-lived.Bitcoin jumped 17.57 percent last week (above left), invalidating the bearish view put forward by the previous week’s close below $8,000.Further, the 5- and 10-week moving averages are trending north, indicating a bullish setup, while Chaikin money flow is reporting the strongest buying pressure since December with an above-0.32 reading.The bullish case looks stronger if we take into account the falling channel breakout on the monthly chart (above right).As a result, BTC could rise to $10,000 over the next few weeks. In the short-term, a price pullback cannot be ruled out.BTC printed 13-month highs above $9,300 on Sunday but failed to close above $9,097 – the high of the bearish outside reversal candle created on May 30.Another failure to secure a UTC close above $9,097 may trigger profit taking on long positions, leading to a price pullback to the 200-hour moving average (MA), currently at $8,300.Disclosure: The author holds no cryptocurrency at the time of writingBitcoin image via Shutterstock; litecoin halving counter via Litecoin Blockhalf"
2,www.coindesk.com,"Jun 11, 2019",No Man's Land: Bitcoin Price Locked in $600 Range for 7th Day,https://www.coindesk.com/no-mans-land-bitcoin-price-locked-in-600-range-for-seventh-day,"Bitcoin has been trapped largely in the $7,500–$8,100 trading range since 
June 5. A high volume falling channel breakout on the 4-hour chart, ...","Jun 11, 2019 at 11:00 UTC",Bitcoin’s (BTC) struggle for direction continues with prices locked in a tight £600 range for the seventh day running.,"The leading cryptocurrency by market value fell below $8,000 and found acceptance below the historically strong support of the 30-day price average on June 4, opening the doors for a deeper correction.However, since then, the downside has been largely restricted to levels near $7,500. Prices did print a low of $7,449 on June 6 before closing at $7,806, according to Bitstamp data. Further, Sunday’s drop to $7,511 was short-lived with prices bouncing back to levels above $8,000 yesterday.At the same time, the bulls have repeatedly failed to force a sustained break above $8,000 over the last six days.With prices largely range-bound, the immediate outlook is neutral. A convincing break above the upper edge of the range is needed to put the bulls back in a commanding position. Conversely, a break below the lower edge would again open the doors for a deeper price pullback.As of writing, BTC is changing hands at $$7,820, representing a 1.2 percent gains on the day, having hit a high of $8,057 earlier today.BTC is trapped within a falling channel on the 4-hour chart, and the price bounce from Monday’s low of $7,511 has run out of steam.Further, the moving averages (MAs) are biased bearish. For instance, the 50-candle MA is trending south, having produced a bearish crossover with the 100-candle MA on June 7. The 50-candle MA now looks set to cross below the 200-candle MA.BTC, therefore, risks falling back toward the lower end of the recent trading range of $7,500–$8,100.The case for a pullback to $7,500 looks stronger if we take into account the fact that trading volumes dropped sharply in the last 24 hours as the price recovered from $7,500 to $8,090. As seen above, volume bars have been printing lower highs since May 30.The outlook would turn bullish if BTC exits the falling channel with a high-volume move above the upper edge of the channel, currently at $8,050.The previous week’s candle closed below $8,000, validating the bullish exhaustion signaled by the preceding week’s doji candle.Despite the bearish doji reversal confirmation, BTC is flashing green this week. Prices, however, are struggling to find acceptance above $8,000 – the doji candle’s low.The bearish view would gain credence if the rejection at $8,000 is followed by a drop below $7,500. In that case, a deeper slide to levels below $7,000 could be seen.Disclosure: The author holds no cryptocurrency assets at the time of writing.Bitcoin in a vice image via CoinDesk archives; charts by Trading View"
3,www.coindesk.com,"Jun 26, 2019",Bitcoin Price Hits 17-Month High Above $12.9K,https://www.coindesk.com/bitcoin-hits-17-month-high-above-12-9k,"Bitcoin (BTC) rose above $12,900 for the first time in over 17 months 
backed by consistent levels of volume. Recent price action could set ...","Jun 26, 2019 at 05:47 UTC",Views:,"Bitcoin has risen above $12,900 for the first time since Jan. 21, 2018, touching a new high for 2019 at $12,919, according to CoinDesk’s BPI data.On June 26 at 03:00 UTC, Bitcoin broke out from a bullish pattern, rising in quick succession above $12,000 on strong momentum and high volatility. As of press time, the price has dropped back to above $12,500.The last time bitcoin (BTC) changed hands above $12,000 in January 2018, prices were on the way down, amid the beginnings of a down trending bear market. This time, things are much different.BTC continues to post impressive results up 40 percent in the month of June alone, while its year-to-year performance is up by more than 250 percent, according to data at Messari.io.The hourly chart reveals BTC’s recent movements in a bullish light as each breakout was backed by a strong showing of growing volume.As can be seen above, prices broke from an ascending triangle (typically bullish in nature) on June 25 at 21:00 UTC backed by consistent levels of growing volume, legitimizing the move on its rise northward.A secondary ascending triangle breakout brought prices well above $12,000 and continues to eye off $13,100 in the immediate short-term, as per Fibonacci Extension theory.The recent volatility may also see a short-term move to retest $12,500 given the levels of liquidity currently entering and exiting the markets in rapid succession.The weekly chart also reveals some interesting insights, detailing key levels of support and resistance at $11,500 and $13,700 respectively, whereby a close above or below those levels would dictate the direction of the trend for either a continuation or a pullback in its price.In addition, there has been a strong backing of weekly volume since the new year began, with the exception given to March, that saw below-average volume traded over the month. This is a good sign for the bulls as the moves are backed by strong liquidity and buying pressure.If momentum and market conditions maintain their current course, BTC could set its sights on $13,500 resistance in the coming days.Should prices fall below $11,500 then consider a retest of the $11,000 psychological support zone, overall the trend remains very bullish.Disclosure: The author holds no cryptocurrency at the time of writing.Bitcoin image via Shutterstock; Charts via TradingView"
4,www.coindesk.com,"Jun 24, 2019",Bitcoin Tops $11.3K to Hit Fresh 2019 Highs,https://www.coindesk.com/bitcoin-tests-11-3k-with-fresh-2019-highs,"Bitcoin has set a new price high for 2019, reaching as high as $11,304 
today before conceding a short-term period of profit taking. At 21:00 ...","Jun 24, 2019 at 01:22 UTC","Bitcoin has set a new price high for 2019, reaching as high as $11,304 today before conceding a short-term period of profit taking.","At 21:00 UTC on June 23, the world’s largest cryptocurrency by market capitalization shot upwards on the daily chart, cementing a new high beyond June 22’s peak of $11,215. The move to another 2019 high comes after bitcoin’s price dropped to as low as $10,416 on June 23 before another surge of buying pressure pushed prices back above $10,750 within the same day.From then BTC bolstered 6 percent, rising above $11,000 at around 19:00 UTC on Sunday evening and then reaching over $11,300 two hours later. It’s currently changing hands at $10,768 as per CoinDesk’s price data.BTC’s 2019 bull run has already started off with a bang in recent weeks, a likely a combination of traders buying into their own fear-of-missing-out (FOMO) as well as institutions chasing the tail end announcement of Facebook’s project Libra.However, large levels of volume failed to accompany the rally, beginning at 97.6 billion traded over a 24-hour period and continued to decrease to as low as 67.5 billion by days end, meaning that the move was unsupported and a small sell-off from that point out, was definite.Its “Real 10” volume – a metric that takes into account trading volume from exchanges reporting honest volume figures as identified in a report by Bitwise Asset Management – currently stands at $46.17 billion, a large difference, according to Messari.io.Meanwhile, the rest of the market remains relatively flat today, with but a few in the top 20 posting gains. Cadano (ADA) and UNUS SED LEO (LEO) are the only two in the green within the top 20 at CoinMarketCap and are both posting 0.4-2.4 percent growth, respectively, over a 24-hour period.In addition, the total market capitalization rose to a high of $331.8 billion, its highest point since July 31, 2018, while the market capitalization for altcoins is down $3.8 billion over a 24-hour period pointing to a preference in holding BTC above all else amongst the trading elite.Disclosure: The author holds no cryptocurrency at the time of writing.

Ferris wheel via Shutterstock"
5,www.coindesk.com,"Jun 4, 2019",Long-Term Support Level May Struggle to Revive Bitcoin ...,https://www.coindesk.com/long-term-support-level-may-struggle-to-revive-bitcoin-price-rally,"Bitcoin's (BTC) price pullback seems to have stalled near historically 
strong support, but a bounce, if any, could be shallow. The 
cryptocurrency ...","Jun 4, 2019 at 11:30 UTC","Bitcoin’s (BTC) price pullback seems to have stalled near historically strong support, but a bounce, if any, could be shallow.","The cryptocurrency market leader dived below $8,000 in the Asian trading hours today and almost tested the crucial 30-day moving average (MA) support, currently at $7,707, according to Bitstamp data.As of writing, BTC is changing hands at $7,940, representing a 5 percent drop on the day, having hit a low of $7,932 earlier today.The minor recovery from levels near the 30-day MA is hardly surprising and could be extended further. After all, the average has consistently reversed price pullbacks over the last four months.This time, however, BTC, may not be able to rise all the way back to $9,000, as the short duration technical charts are biased bearish and the weekly chart is flashing signs of buyer exhaustion, as discussed yesterday.Further, the broader market is also looking exhausted. Notably, litecoin (LTC) is struggling to decouple from BTC with a move higher, even though it is set to undergo mining reward halving in August. The supply altering event tends to put a bid under the cryptocurrency months in advance.BTC breached the 30-day MA on Feb. 8 and has established multiple bullish higher lows (marked by arrows) along that line ever since. Notably, every bounce ended up violating the preceding price high.The price is again attempting a recovery from the 30-day MA as seen above. However, the bounce will likely be shallow or the cryptocurrency could find acceptance below the average later today, as the 14-day relative strength index (RSI) has dipped below 54.50, confirming a double top breakdown – a bearish reversal pattern.The moving average convergence divergence (MACD) histogram is charting bigger bars below the zero line – a sign the bearish move is gathering strength.Further, the price drop seen in the last 24 hours validated the bullish-to-bearish trend change signaled by the bearish outside day candle created on May 30.The doji candle created last week represents buyer exhaustion. The 14-week RSI is also reporting overbought conditions with an above-70 print.Meanwhile, the money flow index – also known as volume-weighted RSI – has almost risen to 100 for the first time on record. A reading above 80 represents overbought conditions.The current print of 98, therefore, indicates the recent rally is extremely overstretched and significant correction is overdue.Disclosure: The author holds no cryptocurrency assets at the time of writing.Bitcoin image via Shutterstock; charts by Trading View"
6,www.coindesk.com,"Jun 21, 2019",Bitcoin Price Breaches $9.6K to Hit 400-Day High,https://www.coindesk.com/bitcoin-price-breaches-9-6k-to-hit-400-day-high,"Bitcoin's price has set another new high for 2019, reaching $9,599 before 
retracing slightly to end Thursday's trading. At 18:00 UTC on June 20, ...","Jun 21, 2019 at 00:21 UTC","Bitcoin’s price has set another new high for 2019, reaching $9,599 before retracing slightly to end Thursday’s trading.","At 18:00 UTC on June 20, the world’s largest cryptocurrency by market capitalization broke upwards on the daily chart, after being held beneath $9,348 for an extended period of time.The move to fresh 2019 highs comes after the bitcoin price dropped to as low as $8,919 on June 18 before a surge of buying pressure pushed prices back above $9,000 within the same day.Since then the bitcoin price has again jumped by 4 percent, rising above $9,400 around 18:28 UTC on Thursday night and then reaching over $9,500 an hour and a half later. It’s currently changing hands at $9525 as per CoinDesk’s price data.The rally was also accompanied by a large uptick in the 24-hour trading volume, an increase of $9 billion was added overall, according to data from CoinMarketCap.However, its “Real 10” volume – a metric that takes into account trading volume from exchanges reporting honest volume figures as identified in a report by Bitwise Asset Management – currently stands at $2.29 billion, a large difference, according to Messari.io.Meanwhile, the rest of the market remains relatively flat today, with only a few of the major names posting gains. Monero (XMR) and Binance Coin (BNB) are the only two in the green within the top 20 at CoinMarketCap and are both posting 4 percent growth over a 24-hour period.What’s more, the total market capitalization has risen to a high of $292.1 billion its highest point since July 31, 2018 while the market capitalization for altcoins remains relatively unchanged, down $100 million, so it would appear BTC remains king and the altcoins will have to await their season a little longer.Eyes are now firmly set on bitcoin’s new target at $9,650 resistance, last seen 13 months ago on April 30, 2018, pointing toward a very strong upward move beyond the $10,000 psychological price tag.Disclosure: The author holds no cryptocurrency at the time of writing.
Bitcoin image via Shutterstock"
7,www.coindesk.com,"Jun 7, 2019",Bitcoin Price Eyes Stronger Recovery Rally After Bounce to $8K,https://www.coindesk.com/bitcoin-price-eyes-stronger-recovery-rally-after-bounce-to-8k,"View. Bitcoin has bounced back to $8,000, forming a double bottom breakout 
– a bullish price pattern – on the 4-hour chart. The ...","Jun 7, 2019 at 10:00 UTC","Bitcoin has recovered to $8,000 after defending key support for two consecutive days and may remain well bid over the weekend.","The leading cryptocurrency by market value is currently trading at $7,990 on Bitstamp, having hit a high of $8,020 earlier today.BTC ran into offers around $7,900 in the early U.S. trading hours on Thursday and fell back to $7,450. However, much like Wednesday, the drop below the 4-hour chart’s 200-candle moving average (then located at $7,588) was short lived.With the rise back to $8,000, the cryptocurrency has charted a bullish technical pattern on one of the short-duration charts. As a result, the recovery rally may continue, with prices rising to $8,400 over the weekend.The weekly close (Sunday, as per UTC) will also be key. BTC witnessed solid two-way business last week before ending on a flat note, a sign of indecision among buyers. A short-term bearish reversal would be confirmed if prices close below last week’s low of $8,000 on Sunday.Bitcoin’s previous 4-hour candle closed out just above the resistance of $7,924, confirming a double-bottom breakout.The pattern essentially represents a bearish-to-bullish trend change. So, it seems safe to say the pullback from the May 30 high of $9,097 has ended and the path of least resistance is now to the higher side.It’s worth noting that a double-bottom breakout is usually followed by a move higher by roughly the length of the spread between the bottom and the neckline – in this case from $7,450 to $7,924, giving potential a rise of around $470.So, with breakout already confirmed, BTC could climb toward $8,400 over the weekend. On the way higher, BTC may face resistance at $8,350 – the upper edge of the falling channel representing bearish lower highs and lower lows.The rally, however, could be short lived if trading volumes remain anemic. As the above chart shows, trading volumes are locked in a downtrend despite the price recovery.BTC created a long-tailed doji candle on Thursday amid falling volume bars – another sign the pullback may be over.That said, the outlook would turn bullish only if prices see a high-volume UTC close above the 4-hour chart falling channel resistance, currently at $8,350. A channel breakout, if confirmed, would open the doors to $9,000.On the downside, the June 4 low of $7,432 is the level to beat for the bears. A violation there would put the focus back on the bearish divergence of the RSI and the downward sloping 5- and 10-day MAs and allow for a deeper drop to the 50-day MA at $6,915.The long-term outlook will remain bullish as long as prices hold above the May low of $5,263.Disclosure: The author holds no cryptocurrency assets at the time of writing.Bitcoin image via Shutterstock; charts by Trading View"
