,press company,date,title,url,abstract,date detail,head article,main article,,,,,,,,,,,,,,,,,,,,,,,,,,,,,,,,,,,,,,,,,,,,,,,,,,
0,https://cointelegraph.com,22-Nov-19,"Friday Shows Bloodbath for Crypto Markets, Bitcoin Price At $7,300",https://cointelegraph.com/news/friday-shows-bloodbath-for-crypto-markets-bitcoin-price-at-7-300,"The entire cryptocurrency market is bleeding heavily, with Bitcoin fighting 
hard to hold above the $7,000 price mark. 7736 Total views. 124 Total ...",22-Nov-19,"Friday, Nov. 22 ??Cryptocurrency prices are bleeding heavily, with some of the top-20 coins showing losses of close to 10% on the day.","Cryptocurrency market daily overview. Source: Coin360Bitcoin (BTC) started the day just above the $7,600 price mark, when it suddenly started on another sell-off towards the $7,000 price level. The coin bounced off a local low of $6,800 in recent hours, before moving up to its current trading price at $7,300, showing a loss of close to 4% on the day.The world?ôs largest cryptocurrency is down around 15% from the weekly open of $8,500 and has dragged the entire crypto market into red territory.¬†Bitcoin daily price chart. Source: Coin360Popular crypto analyst and regular Cointelegraph contributor Filb Filb recently said that after looking at the daily chart, ?úit is clear that Bitcoin has hit the bottom of the downward channel in which it has been trading since July.?ùHowever, Filb Filb pointed out that the price point of $7,600 will be a key level for the bulls to reclaim, which might turn out to be a challenge, especially in the short term. He said:?úProbability would suggest BTC/USD will need to spend a little more time testing below $7,000 before there is a significant bullish reversal.?ùPreviously Cointelegraph reported that Bitcoin tanked due to the multiple rumors currently going around about a crackdown on legitimate Chinese outposts of cryptocurrency businesses. The news appeared to rattle the crypto markets, which slipped into a downwards spiral ever since.Ether (ETH), meanwhile, saw a painful drop in sync with BTC earlier today. The number one altcoin bounced of its daily low at $141, showing double-digit losses of more than 10% on the day, before moving up to its current trading price of $154 per coin.Ether 7-day price chart. Source: Coin360XRP, the third-largest coin by market capitalization, has continued to lose ground and currently sits at $0.232 per coin, showing a loss of more than 3% at press time.¬†XRP 7-day price chart. Source: Coin360All of the top 20 coins are showing red candlesticks, with NEO taking the title of biggest loser, seeing a loss of nearly 10% on the day. Huobi Token (HT) follows closely with a loss of 9% at press time.The overall cryptocurrency market cap dropped below the 200 billion mark. It currently sits around $198.7 billion, with Bitcoin making up 66.3% of the total.",,,,,,,,,,,,,,,,,,,,,,,,,,,,,,,,,,,,,,,,,,,,,,,,,,
1,https://cointelegraph.com,21-Nov-19,Bitcoin Crashes Back to $7.4K Completely Wiping Out the October Rally,https://cointelegraph.com/news/bitcoin-crashes-back-to-74k-completely-wiping-out-the-october-rally1,"Bitcoin plummeted several hundred dollars past its 0.786 Fibonacci level to 
$7,400 on false rumors of Chinese authorities raiding Binance's ...",21-Nov-19,Bitcoin (BTC) finally dropped all the way down to the $7.4Ks in minutes as anticipated in our previous analysis if the key $7.8K level did not hold.¬†,"Cryptocurrency market daily performance. Source: Coin360Over the past week, BTC/USD has faced a slow grind down to the $8,000 price level. Now, Bitcoin also broke below its 0.786 Fibonacci retracement level as well ??its last major level before a confirmed full retrace of the Oct. 25 rally to $10,500.¬†After a short bounce, Bitcoin has bounced back to around $7,600 at press time.As Cointelegraph reported, rumors of Chinese authorities raiding Binance?ôs Shanghai offices were likely also responsible for the drop. However, the exchange said that they had not received a notice from Chinese authorities, which required Binance to detail its activities.¬†Specifically, a Binance spokesperson denied the rumors, saying:¬†?úBinance has no fixed offices in Shanghai or China, so it makes no sense that police raided on any offices and shut them down. [...] There has been a recent spike in the number of negative articles and activities against Binance in China. We wouldn't delve too much into what causes this, because we prefer to continue BUIDLing our solutions.?ùNevertheless, after several days of choppy price action, BTC/USD finally posted a decisive drop below $8,000 falling under its 0.786 Fibonacci retracement level at $7,870 and plummeting all the way down to $7,390.¬†This was the level of consolidation prior to the historic 42% price rise on Oct. 25.BTC USD daily chart. Source: TradingViewIf Bitcoin falls further below $7,307, it may indicate its bullish swing up to $10,500 on Oct. 25 was a fluke, resulting in net sideways action for the past month. Furthermore, a bearish outlook might even see BTC?ôs recent $10,500 upswing as a significant bullish correction albeit in a continuation of a general downward trend.¬†On a bullish note, however, Bitcoin did not yet breach the previous low and bounced with a fair bit of strength from $7,390 up to $7,640.¬†Market analyst Keith Wareing meanwhile anticipated the drop, shorting BTC to the $7.4K level, and then immediately taking a long position.¬†?úDecided that shorting to $7,350 was the logical move after the support on the Bollinger Bands was broken on all major time frames,??said Wareing. ?úIf $7350 wasn?ôt to hold, Willy Woo and Tone Vays would be right, and as there are no pigs in the sky or ice in hell, I knew it was the bottom.?ùIf Bitcoin continues to tumble, however, $7,230 may provide a bit of support. Although beyond that, not much buying strength exists before the $6K range.¬†If $6,000 breaks as easily as it did to the upside in May, however, significant support exists between $5,800 and $5,000 as the market spent considerable time in this region earlier in 2019.¬†Additionally, the 200-week moving average (MA) now sits at $4,890. At the bottom of the last bear market in 2018, Bitcoin?ôs 200-week MA acted as strong support near $3,200. BTC has not closed below its 200-week MA since 2015.¬†¬†¬†XTZ USD daily chart. Source: TradingViewTezos (XTZ), on the other hand, was the only standout today gaining on news that the French army is using the Tezos blockchain. But the rally didn?ôt last long. The staking-based digital asset saw a high of $1.30 before dropping down to $1.19 at press time.",,,,,,,,,,,,,,,,,,,,,,,,,,,,,,,,,,,,,,,,,,,,,,,,,,
2,https://cointelegraph.com,20-Nov-19,"Bitcoin May Hit $4,500 But Miners Have Mostly Capitulated ??Analysts",https://cointelegraph.com/news/bitcoin-may-hit-4-500-but-miners-have-mostly-capitulated-analysts,"The short-term outlook for Bitcoin could involve a 71% retracement versus 
2019 highs of $13,800, warn Tone Vays and Willy Woo. 49066 Total ...",20-Nov-19,"The Bitcoin (BTC) price has almost reached its bottom for 2019, but the threat still remains for markets to hit $4,500, according to one expert.","Well-known statistician and analyst Willy Woo delivered his analysis in a live YouTube discussion about Bitcoin?ôs future with trader Tone Vays on Nov. 20.¬†As BTC/USD hovers around the $8,000 support, analysts have recently turned more bearish on its short-term outlook, comparing current action to that which preceded 2018?ôs lows of $3,100.For Woo and Vays, this year?ôs cycle could see a drop of around 71% versus the highs of $12,800 seen several months ago.¬†That would put Bitcoin at $4,500 before next May?ôs block reward halving event, something which consensus favors as a bullish turning point for price.¬†Woo added that the market was still net long and that he was waiting for a short phase to trigger a reversal. Time was limited to secure further drops, he said, due to the proximity of the halving. Most weaker miners have already capitulated due to the previous downturn, reducing the desire to further weaken the market.¬†Regular Cointelegraph contributor filbfilb received a direct mention during the debate, thanks to the accuracy of his annual Bitcoin price outlook. For him, too, now was a time to be risk-off.?úI?ôm totally back in cash now. There doesn?ôt seem to be obvious sign of reversal. Going to sit on the sidelines until there is more indication,??he told followers of his Telegram trading channel on Wednesday.As Cointelegraph previously reported, the popular Stock-to-Flow model for charting the Bitcoin price calls for an average BTC/USD value of $8,300 until May. After that, the trajectory is open for a giant $100,000 leap by the end of 2021.¬†",,,,,,,,,,,,,,,,,,,,,,,,,,,,,,,,,,,,,,,,,,,,,,,,,,
3,https://cointelegraph.com,15-Nov-19,Bitcoin Price Back ?òOn the Edge??Says Trader After $8.8K Rejection,https://cointelegraph.com/news/bitcoin-price-back-on-the-edge-says-trader-after-88k-rejection,"A sudden attempt to crack $9,000 resistance fell through on Friday, with 
Bitcoin coming full circle in less than an hour in brief volatility.",15-Nov-19,"Bitcoin (BTC) staged a dramatic breakout of its weekly trading corridor on Nov. 15, but selling pressure rejected an attempt to break $9,000.¬†","Cryptocurrency market daily overview. Source: Coin360Data from Coin360 shows BTC/USD suddenly moving upwards on Friday, hitting $8,800 in minutes from previous levels closer to $8,550.¬†The bullish momentum failed to last, however, with Bitcoin returning to lower levels below $8,600 just thirty minutes later.¬†At press time, BTC/USD was trading at around $8,580, having come full circle in under an hour.¬†Bitcoin seven-day price chart. Source: Coin360As Cointelegraph reported, Bitcoin has become increasingly known for temporary moves up and down, with commentators citing various factors influencing the volatility.¬†In the long term, however, models suggest the largest cryptocurrency should fluctuate around an average price of $8,300 until the block size halving next May.¬†The rejection at $8,800 meanwhile lifted hopes of a return to overall bullish sentiment, as sketched out by regular Cointelegraph contributor Micha√´l van de Poppe.?úOn the edge here. Preferably I'd want to see a tick up to like $8,800 to confirm a slight trend reversal (like scenario),??he said in a Twitter update on Thursday.Continuing, van de Poppe added downward pressure could take Bitcoin the other side of its pre-halving average:¬†?úIf not, this slow bleed could accelerate to $8,200 as the next level. Sentiment; fear. Obviously.?ùAltcoins markets saw a return to mixed trading after many major cryptocurrencies lost ground on Thursday.¬†Ether (ETH), the largest altcoin by market cap, delivered mostly sideways performance, moving less than 1% versus previous levels.¬†Ether seven-day price chart. Source: Coin360Other coins fared better, with Verge (XVG) jumping 32% after news partner Pornhub was facing problems with PayPal. VeChain (VET) expanded 21.3%, with Tezos (XTZ) rising 8.5% and Cosmos (ATOM) 7%.¬†The overall cryptocurrency market cap was $237.6 billion at press time, with Bitcoin?ôs share comprising 65.8%.",,,,,,,,,,,,,,,,,,,,,,,,,,,,,,,,,,,,,,,,,,,,,,,,,,
4,https://cointelegraph.com,16-Nov-19,Bitcoin Price Risks Falling Under $8.4K If the Bulls Don?ôt Step Up Now,https://cointelegraph.com/news/bitcoin-price-risks-falling-under-84k-if-the-bulls-dont-step-up-now,"Bitcoin price is teetering on the edge of more downside and is at risk of 
crashing below $8,400 as the bulls are running out of time to step up.",16-Nov-19,"Bitcoin (BTC) price is still retracing from the massive rally two weeks ago, which leads the sentiment to turn bearish. Several signs indicate that the price needs to reverse quite soon, or the whole upwards move is deleted from the charts.","Crypto market data. Source: Coin360The daily chart shows that the price of Bitcoin once again can?ôt hold support on the 200-Day Moving Average (MA) and Exponential Moving Average (EMA). Such a move often leads to a bearish bias among traders as the 200-Day MA and EMA are crucial indicators for bull/bear perspectives.BTC USD daily chart. Source: TradingViewAlongside with a drop below the crucial moving averages, the price of Bitcoin wasn?ôt able to break the downward trendline. This trendline started at the top at nearly $14,000 in June.Breaking the trendline would provide a vital sign for bullish perspectives on the market.¬† Additionally, the $7,300 level showed bottom signals with bullish divergences and a falling wedge structure, which resulted in the historic surge to $10,500.However, this push couldn?ôt close above the crucial $9,500 resistance area and caused the price to retrace further downwards to the yellow zone. This yellow zone is classified as a potential support area since it previously served as resistance.BTC USD 12-hour chart. Source: TradingViewHowever, the price of Bitcoin is currently hanging on a few key levels. First, it?ôs the previous resistance area seen in October, which can become support if buyers step in here. But the price also retraced towards the golden ratio (0.618-0.65 Fibonacci level) of the whole upwards push from $7,300 to $10,500. This means that bulls must now step in to reverse the downward trend seen so far this month.BTC USD weekly chart. Source: TradingViewThis current market cycle is still showing many similarities with the previous one, i.e. a breakout from the bear market, causing the price to move from $3,100 to $13,900.¬†This parabolic move has led to a range-bound period and accumulation at higher levels suggesting that a breakout before the next halving is possible.¬†During the last few months, the same movements occurred as the $7,300 level was marked with similar bullish divergences. This also marked the ?úlow range??of the range-bound period, marked green in the chart.But does this mean further bullishness is warranted? No, because in the short-term, the price is retracing. However, this is a natural move for an asset that pushed 42% overnight on Oct. 25.As long as the green area holds as support and the price is moving above the 100-Week MA and EMA, investors don?ôt have anything to worry about. In fact, a potential bullish cross of these two moving averages is likely to occur, which was also a bullish signal in the previous market cycle.Total crypto market capitalization daily chart. Source: TradingviewThis chart is showing a clear breakout of the cryptocurrency markets at the end of October, as the falling wedge broke upwards. The bullish divergences were similar to the breakout in December 2018, which marked the bottom of the bear market of 2018.Right now, consolidation is needed and backtesting levels must flip to become support. As the chart shows, the red area around $220 billion must turn into support to continue the bullish trend.Another similarity with February 2019 is that a significant retracement also occurred before continuing to the upside.BTC USD 3-hour chart. Source: TradingViewSmaller time frames still show that the downtrend since Nov. 5 is still intact. Additionally, previous support levels are now becoming resistance.For example, $9,050 was broken as support, which caused the price to drop to the next support level at $8,700. This leads to a retest of the previous support at $9,050, only to confirm that it flipped to become resistance.In downtrends, this is a continuous movement and, unfortunately for the bulls, this is still occurring on the smaller timeframes.BTC USD bullish scenario. Source: TradingViewTherefore, bulls must break out of this downtrend, preferably with a double bottom confirmation or bullish divergences. After that, a breakout above $8,700 is needed in order to flip that resistance level into new support.The yellow zone is crucial here and needs to hold (as this is also the golden ratio), followed by a clearcut break of the $8,800 area, preferably with high volume.BTC USD bearish scenario. Source: TradingViewNevertheless, as short-term momentum is still favoring bears, a continuation of the downtrend is more likely to occur. In this regard, a few scenarios are possible for a bearish outlook, which both lead to the same lower level.In the first scenario, the price is unable to break out of this short downtrend and falls below the yellow zone and golden ratio. A potential bounce upwards could then provide a short opportunity. However, testing the green area around $7,400 is most likely to occur in such a move.BTC USD second bearish scenario. Source: TradingViewThe second scenario has the same conclusion as the first one, but a different approach. Here, the price is able to break out of the downtrend but lacks volume and is not able to go beyond $8,700. Such a fakeout often leads to a sharp dump during which bounces will also provide some good opportunities for shorting.The views and opinions expressed here are solely those of the author and do not necessarily reflect the views of Cointelegraph. Every investment and trading move involves risk. You should conduct your own research when making a decision.",,,,,,,,,,,,,,,,,,,,,,,,,,,,,,,,,,,,,,,,,,,,,,,,,,
5,https://cointelegraph.com,21-Nov-19,PayPal CEO Holds Bitcoin and Only Bitcoin,https://cointelegraph.com/news/paypal-ceo-hodls-bitcoin-and-only-bitcoin,"Dan Schulman, CEO of payment processor PayPal, revealed during an interview 
that he does indeed own Bitcoin (BTC). On Nov. 20, Fortune ...",21-Nov-19,"Dan Schulman, CEO of payment processor PayPal, revealed during an interview that he does indeed own Bitcoin (BTC).","On Nov. 20, Fortune reported that PayPal CEO Dan Schulman stopped by its offices where he discussed a variety of topics, including the reason for PayPal?ôs withdrawal from the Libra Association and whether he is the proud owner of any cryptocurrencies.Schulman explained that PayPal withdrew from Libra because the company decided to put its attention elsewhere. According to the CEO it was a question of ?úwhere do we want to put our attention, and what do we want to do today to advance our mission???He added:?úYou know, we think if we focus on our own roadmap, we?ôd be able to advance financial inclusion faster than if we put all these resources against Libra.?ùSchulman added that Libra will start going down a road that his company remains ?úvery interested in looking at,??and once Libra starts to figure things out, ?úwe?ôll take another look at where they are.?ùAt the beginning of October, a PayPal spokesperson told Cointelegraph that the company had officially left the association, adding that they remain supportive of Libra?ôs aspirations and continue to look forward to dialogue on ways to work together in the future.¬†PayPal?ôs CFO John Rainey said in May that the firm has teams that are working on blockchain and cryptocurrency, and that they wish to participate in that technology in whatever form it takes in the future.¬†In the Fortune interview, Schulman was reluctant to share any significant details as to what exactly PayPal is working on in the sphere, although he was quick to point out that it is not ?únecessarily competitive with Libra,??adding:?úWe think there?ôs a lot of promise to blockchain technology. It?ôs intriguing to us, but it really needs to do something that the traditional rails can?ôt do. Most people think that blockchain is about efficiency, but the system today is pretty efficient.?ùRegarding cryptocurrencies, the CEO said that it is still very volatile, and that they do not have much demand for it by merchants because merchants operate on very small margins. He said:?úUntil it becomes less volatile, it won?ôt be a currency that is widely accepted by merchants on the web ??not the dark web, but the web.?ùAs to whether he owns any cryptocurrencies himself, Schulman?ôs answer was short and straightforward:?úYes, Bitcoin. [...] Only.??
6,https://cointelegraph.com,Nov 12"," 2019""","Bitcoin Price ?òRanging??Continues as Trader Says $8,400 Could Be Next",https://cointelegraph.com/news/bitcoin-price-ranging-continues-as-trader-says-8-400-could-be-next,"Bitcoin fails to gain momentum to break $9K. Data from Coin360 showed 
BTC/USD trading between $8,700 and $8,800 on Tuesday morning, ...",12-Nov-19,"Bitcoin (BTC) was struggling to recapture $8,800 on Nov. 12 after selling pressure sent the largest cryptocurrency broadly lower late on Monday.","Cryptocurrency market daily overview. Source: Coin360Data from Coin360 showed BTC/USD trading between $8,700 and $8,800 on Tuesday morning, having fallen to local lows of $8,630 in the past 24 hours.¬†Despite volatility waning in recent days, Bitcoin remained broadly lower as the week began, losing support at $9,000.Bitcoin seven-day price chart. Source: Coin360Having exited its previous trading range, Bitcoin was now laying the foundations for further downside, analysts said.¬†In his most recent Twitter update, regular Cointelegraph contributor Micha√´l van de Poppe eyed the potential for BTC/USD to fall to around $8,400.¬†?úCould continue the ranging here. For bulls; break back above $9,050 required,??he summarized.Van de Poppe added that current price behavior signified a tussle between bull and bear forces over Bitcoin, something which nonetheless was not repeating on altcoin markets.Despite the current slide, Bitcoin remains higher than many models forecast for this year. As Cointelegraph reported, the most accurate models call for an average BTC/USD price of $8,300 until next May?ôs block reward halving event.¬†Altcoins indeed showed mixed behavior over the past 24 hours. While Bitcoin stayed mostly static, shifts of up to 5% characterized the top twenty cryptocurrencies by market cap.¬†Ether (ETH), the largest altcoin, nonetheless copied Bitcoin?ôs behavior, shedding just 0.25% to remain at $186.Ether seven-day price chart. Source: Coin360The leader was NEO (NEO), however, which rose almost 6% and extended a Chinese token run which began in late October.¬†The overall cryptocurrency market cap was $240.3 billion at press time, with Bitcoin?ôs share making up 66% of the total.",,,,,,,,,,,,,,,,,,,,,,,,,,,,,,,,,,,,,,,,,,,
