,press company,date,title,url,abstract,date detail,head article,main article,,,,,,,,,,,,,,,,,,,,,,,,,,,,,,,,,,,,,,,,,,,,,,,,,,
149,https://cointelegraph.com,08-Nov-19,"CipherTrace Urges Crypto Companies to Prepare for Anti-Money Laundering 
Compliance",https://cointelegraph.com/news/ciphertrace-urges-crypto-companies-to-prepare-for-anti-money-laundering-compliance,"Since Bitcoin's rise to mainstream prominence in 2015, there has been 
increasing recognition of digital assets from government agencies ...",08-Nov-19,"For better or for worse, the cryptocurrency space is coming of age. Since Bitcoin?ôs rise to mainstream prominence in 2015, there has been increasing recognition of digital assets from government agencies around the world. In turn, new regulations are being imposed to control the way cryptocurrency companies operate and do business globally.¬†","Most recently, the Financial Action Task Force issued new guidelines on how digital assets should be regulated. In order to raise awareness around these requirements, the blockchain security company CipherTrace hosted a conference and hackathon this week in San Francisco dedicated entirely to discussions on the FATF guidelines, also known as the ?útravel rule.?ùThe travel rule requires regulators and Virtual Asset Service Providers, such as exchanges from various countries worldwide, to collect and share personal data during transactions. Much like the guidelines followed by traditional banks under the United States Bank Secrecy Act, the travel rule being enforced for crypto firms follow the same requirements as money transmitters do to record identifying information on all parties in fund transfers made between financial institutions.Yet, unlike traditional financial firms, many cryptocurrency exchanges do not capture personally identifiable information by default. Complying with the travel rule will therefore require significant shifts for businesses operating in the crypto space.?úThe new regulations coming from FATF will ultimately change the way crypto companies operate, requiring them to track not only their own customers??transactions, but also where their customers are sending money to,??Dave Jevans, CEO of CipherTrace, told Cointelegraph.One of the main goals of the CipherTrace conference was to gather regulators, banks, crypto companies and programmers together to make sense of the new guidelines, and then build a solution that would allow organizations to easily comply with the FATF rules.?úThere are broad implications around privacy, identification of customers, how data works across various blockchains and privacy coins,??said Jevans. ?úWe need to come up with solutions to ensure that companies can easily comply with these regulations, which is what we aim to achieve here.?ùPrior to working on a compliance solution at the hackathon, a number of panels highlighted the themes and main challenges surrounding the FATF regulations. While these rules are not yet legally binding ??as the FATF said in a public statement in June that countries have until June 2020 to adopt the guidelines ??a broad theme at the CipherTrace conference was that action must be taken immediately. The¬†G-20¬†stated that it already uses the recommendations for anti-money laundering regulation of cryptocurrencies, so crypto companies that fail to comply with the new regulations are likely to face penalties.?úThe consequences for non-compliance could range from a slap on the wrist, to going to jail if a company violates the Bank Secrecy Act,??Carol Van Cleef, CEO of blockchain consulting firm Luminous Group, warned on stage during the legal requirements panel. ?úNo matter how big or small a company is, each has obligations to fulfil under the law.?ùAlthough this may be the case, John Jefferies, CipherTrace?ôs chief financial analyst, pointed out that many companies operating in the cryptocurrency sphere have yet to comply with the new regulations.?úMany U.S. exchanges may not yet be compliant, but they should be at this time,??Jefferies said. ?úMoving forward, when Binance or Coinbase completes a transaction for example, they need to send the sender recipient data at the same time with that transaction. Otherwise, they are not in compliance.?ùWhile most crypto companies are not yet compliant with the FATF regulations, Jevans, the CEO of CipherTrace, stressed the importance of getting everyone on the same page.?úEducation is the main challenge we have to tackle first,??he said. ?úWe need to know what the FATF laws are, why we should care and what can happen if companies don?ôt comply.?ùThe U.S. Treasury Department?ôs¬†Financial Crimes Enforcement Network emerging technology policy specialist, Carole House, explained the FATF guidelines during her keynote. She highlighted that the guidelines are designed to curb the use of cryptocurrencies for financial crimes by making crypto transactions more traceable, giving regulators increased visibility into both cross-border and domestic currency transfers.?úCrypto companies need to comply with the virtual currency recommendations by the end of June 2020. We?ôve already been involved with a number of people from the Digital Commerce Association to provide commentary around accomplishing this,??House stated.As the FATF regulations were brought to light, a number of challenges around ensuring compliance followed.For instance, the question of how the FATF guidelines would relate to privacy coins was a pressing issue. One of the stated goals of privacy coins such as Monero and Zcash is to ensure that users have anonymized transactions, so it is questionable how these could be compliant with the new regulations.During the privacy coin panel, Jack Gavigan, head of product and regulatory affairs at Zcash, asked, ?úIs compliance possible in relation to privacy coins??ùAnswering his own question, Gavigan stated his belief that compliance is indeed possible, as a number of privacy coins are already listed in U.S. exchanges regulated by the Financial Crimes Enforcement Network.Even though this may be the case, understanding how to abide by the FATF regulations in a way that focuses on privacy while maintaining the decentralized ethos of cryptocurrency and blockchain remains a challenge.Jake Tarnow, a security software developer at CipherTrace, aimed to solve this problem during the hackathon. His team came up with an impressive solution that aims to keep data anonymous when information is being exchanged between Virtual Asset Service Providers.?úIf VASP A is trying to send data to VASP B, we need to know how this can be done in a way that none of the information is in the clear,??Tarnow told Cointelegraph.His solution entailed using a zk-SNARK ??short for a ?úzero-knowledge succinct non-interactive argument of knowledge????a form of cryptography that allows one party to securely reveal that it possesses a piece of information, without actually exposing the information itself.?úBy using zk-SNARKs, VASPs can send this information in a bulletproof way, where no one else can pick that up and pull out their proprietary information,??explained Tarnow.During the hackathon, developers also worked closely with security software gurus to integrate the Travel Rule Information Sharing Architecture into their systems. CipherTrace announced the release of TRISA in September as an open-source, peer-to-peer design for cryptocurrency companies and blockchain projects to comply with the FATF regulations.TRISA is meant to provide secure, reliable delivery of personally identifiable information, or PII, to the correct VASP, eliminating a huge risk for exchanges. However, sharing PII is prone to spamming, a problem that developers at the CipherTrace hackathon aimed to solve.?úVarious backend systems managing PII are vulnerable to spamming, as spammers can get into these systems and start asking people to send PII,??explained Jefferies.Independent consultant Kenneth Kron and his team won first place in the hackathon for coming up with a solution that introduces PII tokens to prevent spamming in TRISA.?úWe want to solve the problem of PII spamming in TRISA by introducing PII tokens and KYC providers who can generate enhanced KYC tokens. If spammers are trying to capture personal information and get a hit, all they get back is a token in this case,??Kron told Cointelegraph.Overall, the CipherTrace conference and hackathon gathered a unique mix of individuals to discuss the future of cryptocurrency regulations. The discussions throughout the event demonstrated that action must be taken now to ensure that crypto companies are compliant with the FATF regulations by June 2020.?úWe gathered many tribes that do not typically interact, enabling experts from government, exchanges and privacy groups to understand each other?ôs diverse perspectives,??Jefferies told Cointelegraph after the conference. ?úThe conversations instilled a sense of urgency in the community and TRISA, while creating an open-source path to meet these tight regulatory deadlines and defend privacy at the same time.??
150,https://cointelegraph.com,Nov 11"," 2019""","Netherlands: Police Arrest Founder of Blockchain Startup That Raised Over 
$80M",https://cointelegraph.com/news/netherlands-police-arrest-founder-of-blockchain-startup-that-raised-over-80m,"... Barry van Mourik for fraud after he allegedly conned investors in a 
fake Bitcoin (BTC) mining operation out of ??3 million ($25 million). 
Posing ...",11-Nov-19,"Dutch police have arrested the founder of blockchain game development startup Komodore64 that allegedly raised 78 million euros ($86 million) from investors, business-focused news outlet Sprout reported on Nov.¬†","Komodore64 ??which launched in June with the objective to create a game platform where transactions are tracked on blockchain ??appeared to be a fraudulent scheme that deceived both investors and its own employees. The project and its native crypto coin K64, which have reportedly secured roughly $86 million in investments, have declared bankruptcy.Komodore64?ôs founder Sam N. allegedly lured investors claiming that the project had raised funds from a ?úwell-known investment company????American investment management firm Goldman Sachs ??when, in fact, a group of individuals impersonated a delegation from the investment firm.¬†The company?ôs employees claimed that the launch party cost tens of thousands of euros, however, neither the suppliers nor the employees received their bill. Komodore64?ôs employees filed for bankruptcy for the company.Moreover, Komodore64 curator John Dullaart said that Max Theyse, who had previously been presented as the company?ôs co-founder, never occupied that role. ?úI think that N. presented him as such. The real co-founder is someone else. This person says he is surprised that the co-founder was someone other than himself,??Dullaart told Sprout.The police seized N. at a hotel, where he had reportedly been staying because he felt threatened by angry cryptocurrency investors.This summer, Europol, in conjunction with the Dutch police, United Kingdom?ôs South West Regional Cyber Crime Unit, Eurojust, and the U.K.?ôs National Crime Agency, coordinated the arrest of six people suspected of stealing over $27 million in cryptocurrency.In May, Dutch police arrested former entrepreneur Barry van Mourik for fraud after he allegedly conned investors in a fake Bitcoin (BTC) mining operation out of ??3 million ($25 million). Posing as the operator of a mining farm, van Mourik accrued client funds while allegedly failing to purchase any equipment, instead reportedly spending the money on luxury items.",,,,,,,,,,,,,,,,,,,,,,,,,,,,,,,,,,,,,,,,,,,
151,https://cointelegraph.com,22-Nov-19,Coinbase Custody Extends Crypto Staking to Global Investors,https://cointelegraph.com/news/coinbase-custody-extends-crypto-staking-to-global-investors,"As opposed to Proof-of-Work (PoW) blockchains like Bitcoin, nodes in a PoS 
network are engaged in validating blocks rather than mining them.",22-Nov-19,The institutional asset custody arm of United States-based crypto exchange Coinbase has announced it is transitioning to an internationally-based staking service as of Nov. 21.,"In rolling out its staking services to a global investor base, Coinbase Custody appears to be leveraging its brand recognition to promote staking as a key emergent investment strategy for the blockchain and cryptocurrency space.¬†The announcement states the custodian intends to offer all of its global clients ?úappropriate access to crypto first features like staking.?ùCoinbase Custody has been offering an institution-grade staking service for Tezos (XTZ) as of March 2019 ??subject to jurisdictional eligibility requirements ??with the company?ôs flagship exchange rolling out support for XTZ staking to U.S. clients earlier this month.¬†Staking is specific to Proof-of-Stake (PoS) blockchains and essentially allows network participants to passively earn a form of ?úinterest??by depositing their tokens to both maintain the network and potentially earn rewards.As opposed to Proof-of-Work (PoW) blockchains like Bitcoin, nodes in a PoS network are engaged in validating blocks rather than mining them. A deterministic algorithm selects block validators based on the number of tokens a given node has staked in their wallet ??i.e. deposited as collateral in order to complete the addition of the next block to the chain.During the protracted crypto winter of 2018, staking was pitched as an investment ?úsurvival??strategy by crypto fund managers and analysts, with many emphasizing that HODLers going long may as well stake to reap the ?úinterest.?ù¬†Dissenting voices ??among them Bloomberg?ôs Aaron Brown ??have argued against the strategy?ôs long-term viability on the basis of the fundamental merits of PoW over PoS currencies when it comes to trust and security.¬†The narrative that staking is set to have a major impact on the industry has recently been aired by top crypto exchange Binance?ôs research arm, whose report has looked at the impact of token lock-ups on liquidity and compared the potential risk-return profile of staking as a passive investment strategy vs. active trading. Binance has itself rolled out staking services this fall.As the Ethereum network gears up for its eventual transition to PoS-based Ethereum 2.0., a senior ConsenSys executive has recently revealed that Ethereum 2.0 validators can expect to earn from 4.6% to 10.3% as rewards for staking on an annual basis.",,,,,,,,,,,,,,,,,,,,,,,,,,,,,,,,,,,,,,,,,,,,,,,,,,
152,https://cointelegraph.com,14-Nov-19,"?òRun Green Finance on Blockchain,??Encourages Chief FinTech Officer of 
Singapore?ôs Monetary Authority",https://cointelegraph.com/news/run-green-finance-on-blockchain-encourages-chief-fintech-officer-of-singapores-monetary-authority,"Bitcoin News ¬∑ Ripple News ¬∑ Ethereum News ¬∑ Litecoin News ¬∑ Altcoin News ¬∑ 
Blockchain News ¬∑ Business News ¬∑ Technology News ¬∑ Policy & ...",14-Nov-19,"Sopnendu Mohanty, Chief FinTech Officer at the Monetary Authority of Singapore, spoke at BlockShow Asia 2019 about the importance of blockchain for the economy, highlighting its indispensability for the development of green finance.","Mohanty defined green finance as follows: ?úHow to monitor, how to measure, and how to mobilize finance for green assets.??He said blockchain can unite all three components.Climate change is undoubtedly one of the hottest topics of the 21st century. This week Venice, Italy saw its biggest flood since 1966, and it caused irreversible damage to the city. The recent disaster reveals the inability of current economic initiatives to deal with climate change. Conceived in 2003 to protect the Venetian Lagoon, the MOSE project increased its initial estimated costs from $1.7 billion to $8.1 billion. Its launch has been postponed several times, while allegations of corruption keep swirling around the still-uncompleted project. Though Mohanty didn?ôt speak specifically about Venice?ôs troubles, he was clear that blockchain can solve exactly these kinds of problems.Before the United Nations Climate Change Conference (COP25) in December 2019 can mark the culmination of green technology discussions this year, different world leaders and prominent businessmen are sharing their vision for the possible future of the green economy.¬†?úI bet on sustainability,??said Mohanty. ?úRun green finance on blockchain.??
153,https://cointelegraph.com,Nov 12"," 2019""",The Importance of Supporting a Robust Developer Ecosystem,https://cointelegraph.com/news/the-importance-of-supporting-a-robust-developer-ecosystem,"The blockchain industry owes its beginnings to a community of developers 
that supported Bitcoin. As the first mover among blockchain ...",12-Nov-19,Blockchain development communities cultivate the healthy growth of an open-source software platform.,"?úIt takes a village to raise a child,??is a popular saying that emphasizes the role of a larger group to properly nurture and develop the youngest members of society.The same holds true for young businesses. Without the endorsement of its 16 million-plus backers, Kickstarter projects would not come to fruition. Twitter would surely not have evolved into one of the world?ôs most well-known social networking platforms without adoption from 330 million monthly active users.Community supporters are the lifeblood of emerging companies. So, it?ôs critical for companies to know how to respond to, and interact with, their communities. Whether made up of consumers, users or developers, brand advocates should be prioritized, engaged with, and listened to. For young businesses juggling many priorities, this can be a challenge.A defining quality of any endeavor?ôs success can often be measured in terms of support. Whether it is the capital of pioneers who first forged into an industry or the consumer adoption of a new good or service in the marketplace, without support, it would often not be possible for the ecosystem to grow beyond early adopters. As this applies to open-source blockchain products, the support of developers often represents the difference between success and mass adoption, and failure and obscurity.For the major role they play, blockchain developers are a sought-after commodity. Hired?ôs State of Software Engineers Report for 2019 shows a year-over-year 517% rise in global demand for blockchain engineers. The blockchain industry?ôs growth stems from this community?ôs diligence to test new releases and provide feedback. For up-and-coming enterprises, collaboration with developers has led to rapid growth for software and quick newcomer adoption.¬†The blockchain industry owes its beginnings to a community of developers that supported¬† Bitcoin. As the first mover among blockchain technology platforms, Bitcoin?ôs proof-of-work and encryption mechanism laid the underpinnings from which many other open-source blockchain platforms would follow. A community of minds working together made this momentum possible, and the growing support of a diverse number of developers has resulted in a more thoroughly tested ??and thereby robust ??code base.As it expanded from a handful of developers running nodes scattered across the internet, blockchain technology blossomed into a more decentralized network of validators. Although it stemmed from relatively humble beginnings, there are now at least 9,493 reachable nodes in the Bitcoin network. The growing diversity of the teams working on the network?ôs infrastructure enriched the community. Open-source code made it possible for anyone to branch off and develop their own solutions. From this creative sandbox, other networks emerged, giving rise to an ecosystem of blockchain applications. Some examples of this can be seen with the launch of Ethereum in 2015 as well as that of EOSIO in 2018.Like any other constituent, the developer community needs to be nurtured and engaged with for long-lasting benefits. These might include the establishment of a dedicated ?údeveloper relations??team that engages with the developer community through events, developer resources and training materials.Developers thrive when they have access to the latest tools, educational frameworks and reference examples that improve the learning experience to continue building on blockchain software. In turn, developer feedback is taken into consideration by the core teams who engineer many of the open-source protocols that make blockchain applications work. This feedback becomes an outlet for community input on how platforms evolve to meet the needs of a rapidly growing user base. The results of this back-and-forth are often reflected in the open-source Github repositories behind various projects.The Bitcoin Core Github repository offers a solid example of how community support ultimately stimulates growth. As the code base grew, a lack of formality in the coding style led to inconsistencies. To better manage input from a growing number of engineers, development guidelines were published that allowed for a more efficiently coordinated effort. This move simultaneously strengthened the community and Bitcoin Core?ôs code repository during a phase of growth.When open-source development communities have access to vast libraries of tools that simplify the building process, it makes it possible to more rapidly deploy projects. For Ethereum developers, a long list of open-source tools has been published to help developers get started. With numerous resources at their disposal, engineers have an easier time making their creative visions a reality.¬†One example from my company, Block.one, is the release of a Contract Development Toolkit complete with a set of utilities designed to aid EOSIO developers as they build smart contracts. The toolkit lets developers process and compile C++ code to WASM binary code to be executed on the blockchain. It also contains a more advanced set of tools to customize smart contracts to meet maximum performance and efficiency criteria.Today?ôs blockchain development community spans multiple platforms. By tapping the collective community wisdom, software companies could solve some of the thorniest tech issues. When software architects offer their support, it becomes possible to harness the potential of a robust developer ecosystem. Building connections with communities at the start may yield global inputs to bring creative answers.Serg Metelin is the head of developer relations at Block.one. Originally from Ukraine, he was one of the early pioneers of social media applications for Eastern European social network VK.com. After moving to Australia in 2009, Serg worked with digital and marketing agencies and consultancies, delivering solutions for large Australian and international brands such as Disney, Electronic Arts, Woolworths and others. In 2015, he won a Westpac-sponsored Australian national competition, ?úDisrupt@Scale,??securing seed funding for his food delivery startup HowAboutEat, which he co-founded and served as the company?ôs chief technology officer.",,,,,,,,,,,,,,,,,,,,,,,,,,,,,,,,,,,,,,,,,,,
154,https://cointelegraph.com,16-Nov-19,The aBey Foundation Introduces new Crypto-Enabled Credit Card Technology,https://cointelegraph.com/news/the-abey-foundation-introduces-new-crypto-enabled-credit-card-technology,"The co-founder revealed that aPay supports Bitcoin, Bitcoin Cash, Ethereum, 
Ethereum Classic, Litecoin, Dash, EOS, Ripple, ZCash, and a ...",16-Nov-19,"Speaking at BlockShow Asia 2019, aBey Foundation co-founder Dr. Ciprian Pungila announced aPay, a payment system that lets the cryptocurrency community use its assets for daily payments via credit card integrations.","aPay users can send their cryptocurrencies to the platform and gain access to three different credit cards that operate with UnionPay, Mastercard, and Visa. They can therefore use their cryptocurrencies for daily payments.Based on new blockchain technology developed by the aBey Foundation, aPay promises to be a speedy blockchain that introduces new architecture and high-performance computing that would enable faster transactions. ?úaBey is designed and built to be among the fastest and most flexible open source chains in the world, providing a practical solution for common e-commerce use cases,??Punglia said.The co-founder revealed that aPay supports Bitcoin, Bitcoin Cash, Ethereum, Ethereum Classic, Litecoin, Dash, EOS, Ripple, ZCash, and a native cryptocurrency built by aBey. He clarified that aPay does not require the merchant to accept cryptocurrencies. They only need to accept conventional credit card payments, and aPay's solution automatically converts the payment from crypto to fiat.Dr. Pungila added that it is still not clear how blockchain technology will impact the financial sector, but it is certain that distributed ledger applications will change the technological and financial landscape:?úThe financial technology industry has been impacted by the development of blockchain technology, but there is still not much clarity on how it will change our lives. It is certain that there is no turning back, and therefore we must build applications and solutions to accept and develop this change.?ùDr. Pungila also stated that aBey's blockchain supports high-speed transactions in order to support e-commerce needs, enabling repayable transactions, home loans, commission payments, and more.",,,,,,,,,,,,,,,,,,,,,,,,,,,,,,,,,,,,,,,,,,,,,,,,,,
