,press company,date,title,url,abstract,date detail,head article,main article,,,,,,,,,,,,,,,,,,,,,,,,,,,,,,,,,,,,,,,,,,,,,,,,,,
105,https://cointelegraph.com,09-Nov-19,10% of MoneyGram?ôs US-Mexico Business Is Crypto-Enabled,https://cointelegraph.com/news/10-of-moneygrams-us-mexico-business-is-crypto-enabled,"... units of value around the world, the same technology that powers 
Bitcoin holds great implications for the world's remittance businesses.",09-Nov-19,"An estimate by the World Bank pegged 2016?ôs global remittance market at $573 billion, and a whopping $422 billion of that went to developing countries.","The simple act of transferring money from one country to another ??more formally known as remittance ??is one economic heavyweight of a market, yet blockchain technology is poised to change its operations anyway. Already well-suited for securely transferring units of value around the world, the same technology that powers Bitcoin holds great implications for the world?ôs remittance businesses.Ripple is among the most relevant companies for those looking at this space through a fintech lens ??its On-Demand Liquidity platform and XRP cryptocurrency have been part of how mainstream remittance company MoneyGram operates since August 2019. Speaking on stage at Ripple?ôs Swell conference, MoneyGram CEO Alex Holmes let it fly earlier today that 10% of his company?ôs business between the US and Mexico happens with help from Ripple?ôs On-Demand Liquidity.The fluffy but blockchain-positive bit of publicity on Ripple?ôs website calls much more attention to the statistic. It?ôs exciting prospects if cryptocurrency technology can account for 10% of how a major remittance company does business between two countries, but when was this milestone reached, and that 10% figure accounts for what size whole? Reached for comment, Holmes went into limited detail:?úThe 10% relates to the ODL (On Demand Liquidity) platform and represents the percent of our Mexican peso volume that we trade. We take USD and buy Mexican pesos. We continue to work with Ripple to build liquidity. We now have four new corridors we are starting, including the Philippine peso and Australian dollar. True success will be determined by others joining the platform, so it?ôs early days.?ùFor not wanting to reveal the size of MoneyGram?ôs US-Mexico business, Holmes seems happy to talk about the technology?ôs potential to bring ease of international transaction to new countries.",,,,,,,,,,,,,,,,,,,,,,,,,,,,,,,,,,,,,,,,,,,,,,,,,,
106,https://cointelegraph.com,23-Nov-19,Crypto News From the German-Speaking World: Nov. 17-23,https://cointelegraph.com/news/crypto-news-from-the-german-speaking-world-nov-17-23,"Northern Bitcoin CEO Mathis Schultz said: ""With this merger, we catapult 
ourselves faster than originally planned to the world leader in the field 
of ...",23-Nov-19,"The past week has seen a range of crypto- and blockchain-related developments in the German-speaking world. The German Federal Ministry of Justice and Consumer Protection is planning to sponsor a research project of the University of Marburg on legal issues surrounding blockchain technology, the Swiss online bank Swissquote began offering its customers the trading of a real estate portfolio-covering security token, and an Austrian research project provided proof of profitability for blockchain technology-based decentralized marketplaces.","Below is the past week of crypto and blockchain news in review, as originally reported by Cointelegraph auf Deutsch.The research project ""Blockchain and Law"" from the Institute for the Law of Digitization (IRDi) at the Philipps-University in Marburg aims to eliminate ""the enormous legal uncertainties in technology"" that are currently hindering entrepreneurial initiatives.By implementing the project, the country intends to compete with the United States and Asia from within the European Union, as they have ""already become active in many issues while the EU is still in the exploratory phase"". Markus Uhl, the responsible reporter of the Committee on Budgets, said:""The blockchain and law project will focus on unexplained legal issues, such as cryptocurrency and assets or public registers, such as the suitability of blockchain for maintaining the land register and commercial register. [...] Of course, the IRDi will also define the legal nature of the blockchain and the applicable law. ""Consumers in Europe, Australia and the U.S. do not consider digital currencies an alternative to traditional money, according to a recent study by ING Bank. Less than a third of European consumers surveyed believe that digital currencies are ""the future of online payment"", while in Germany, the proportion is even lower, at just under a quarter.Interest in traditional payment accounts with cryptocurrency option is also reportedly relatively low. In Germany, around 85% of consumers do not suggest that their bank is about to offer such an account.The crypto-mining operator listed on the Frankfurt XETRA exchange agreed to merge with its U.S. competitor Whinstone. With the acquisition of Whinstone planned for the beginning of 2020, Northern Bitcoin claims to have establish itself as a world leader in Bitcoin (BTC) mining. Northern Bitcoin CEO Mathis Schultz said:""With this merger, we catapult ourselves faster than originally planned to the world leader in the field of Bitcoin mining. Whinstone's team has done a great job over the past few years, and is leading the way in the blockchain industry, not least with the construction of the largest mining facility in the world.""German securities marketplace Deutsche Boerse and Swiss state-run telecom Swisscom settled securities transactions using different blockchain protocols. In a joint proof-of-concept (PoC) involving a number of banks, the participants exchanged money in the form of cash tokens against tokenized shares.Based on blockchain technology, the joint PoC intends to show the potential of new technologies in the financial services sector and maintain Germany and Switzerland?ôs expertise in the digital asset ecosystem.The Swiss online bank Swissquote now offers its customers the ability to trade real estate portfolio-covering security token Crowdlitoken (CRT), as well as custody of the CRT tokens.The Liechtenstein startup Crowdlitoken received a license to issue bonds for blockchain real estate investments in April. Through the company's security token, investors can allocate their capital to individual properties via a bond and, at one-month intervals, convert their capital between the available real estate objects.Starting in 2020, the Bavarian state government plans to test verifiable training certificates through blockchain technology. The Chamber of Commerce and Industry of Munich and Upper Bavaria intends to issue the first digital training certificates with the Digital Ministry next spring.Employers will use an electronic key to verify the authenticity of the certificates via blockchain in the future, while applicants will send it along with a PDF file to appropriate companies.The Austrian Research Studios Austria Forschungsgesellschaft (RSA FG) provided proof of profitability for blockchain technology-based decentralized marketplaces, demonstrating that secure and smart data trading can generate profits.The beta version of a corresponding trading platform was released with Data Market Austria. Companies or institutions can offer records via the portal and conclude individual purchase agreements via license templates such as location data, climate information or data on migration movements.",,,,,,,,,,,,,,,,,,,,,,,,,,,,,,,,,,,,,,,,,,,,,,,,,,
107,https://cointelegraph.com,14-Nov-19,Dallas Mavericks CTO: Crypto Payment Option Still ?òA Cottage Industry??https://cointelegraph.com/news/dallas-mavericks-cto-crypto-payment-option-still-a-cottage-industry,"The team uses cryptocurrency payment processor BitPay to process their 
fans' Bitcoin payments. Herr said that the novelty of paying in ...",14-Nov-19,"The Dallas Mavericks pro basketball team?ôs cryptocurrency payment option has not yet caught on with the majority of fans, the team?ôs chief technical officer said in a recent interview.¬†","As sports business-focused media outlet Front Office Sports reported on Nov. 14, Mavericks CTO David Herr said that the team wants to provide its fans with a more flexible way to purchase tickets and merchandise, thus enabling them to pay with cryptocurrencies. However, Herr pointed out that the demand for such an option is still very low, saying:??Users] are pretty low, I don?ôt want to say infancy, but it?ôs a select group of people using it [...] We did some research, heard some discussions and conversations and one comment was it?ôs still complicated to 99% of the population. Until it?ôs more widely accepted, it?ôs a cottage industry or a neat way to pay.?ùAs previously reported, the Mavericks became the second NBA team to accept Bitcoin (BTC) as a means of payment for match tickets and merchandise in mid-August. The team uses cryptocurrency payment processor BitPay to process their fans??Bitcoin payments.Herr said that the novelty of paying in cryptocurrency was part of the decision to introduce the payment option, stating, ?úWe want to provide cool things for the fans and crypto was in response to some requests we?ôve had.?ùProfessional sports teams in various leagues and sports across the world have begun to dabble in blockchain and cryptocurrencies. In mid-October, the Sacramento Kings ??the first NBA basketball team to adopt cryptocurrencies ??partnered with creator of Ethereum-based Kaiju toys, CryptoKaiju, to launch crypto-collectibles. The collaboration followed the news that the team was launching a blockchain-powered rewards program within its gaming app Call the Shot.In Germany, FC Bayern Munich became the latest football club to announce blockchain-based merchandise for fans, following a partnership with Stryking Entertainment to produce digital collectibles of its players.",,,,,,,,,,,,,,,,,,,,,,,,,,,,,,,,,,,,,,,,,,,,,,,,,,,
108,https://cointelegraph.com,15-Nov-19,Binance CEO: It?ôll Be Hard for Nations to Outrun China on Blockchain,https://cointelegraph.com/news/binance-ceo-itll-be-hard-for-nations-to-outrun-china-on-blockchain,"?úYou can't learn just about blockchain without learning about 
cryptocurrencies. so I think we'll see a lot more people who understand 
Bitcoin, ...",15-Nov-19,"Changpeng Zhao, founder and CEO of crypto exchange Binance, says the Chinese President?ôs endorsement of blockchain will inevitably drive mass adoption of crypto.","In an interview with Bloomberg Markets: Asia on Nov. 15, Zhao ??better known by his industry moniker ?úCZ????gave his perspective on the likely global impact of the recent intervention by President Xi Jinping.As reported, President Xi Jinping had called this October for China to accelerate its adoption of blockchain technologies to drive innovation and industrial transformation.¬†Reflecting on the likely consequences of this high-profile endorsement and explicit declaration of a pro-blockchain strategy by the world?ôs second-largest economy, CZ said:?úIt?ôs super positive. China?ôs very pro-technology, so China will invest very heavily in blockchain technology and on the educational front as well. Given that China has now made that move, every other country in the world will have no choice but to follow or move faster. But it?ôs going to be pretty hard to move faster than China to be honest.?ùHinting at states??competing geopolitical aspirations to monopolize technology, CZ added: ?úI think we?ôre going to see a race there.?ù¬†The CEO saw the impact of the pro-blockchain stance going much further, arguing that while the president may have confined his comments to the underlying technology?ù‚ÄúYou can?ôt learn just about blockchain without learning about cryptocurrencies. so I think we?ôll see a lot more people who understand Bitcoin, Ether and other cryptocurrencies. So we?ôll see very strong adoption there.?ùWhen quizzed on Binance?ôs China strategy, CZ struck an implicit note of caution ??perhaps unsurprisingly, given the exchange had been forced to leave the country in the wake of China?ôs Sept. 2017 crackdown on crypto exchanges, relocating its headquarters to Malta. He said:?òWe want to follow the recommendations very closely and to promote blockchain technology research and development. We?ôre looking at a number of initiatives in that area. We want to help wherever we can.?ùIn Sept. 2018, Binance had made its first strategic Chinese investment since leaving the country in the wake of the crackdown, participating in a $200 million funding round for a Beijing-based crypto and blockchain publication.Earlier this month, Binance launched peer-to-peer trading for Bitcoin (BTC), Ether (ETH) and Tether (USDT) against the Chinese yuan. As noted in today?ôs Bloomberg interview, the exchange has also been involved in over-the-counter cryptocurrency trading in the country, which raked in solid profits earlier this year.Speaking yesterday at BlockShow Asia 2019, CZ predicted ??in contrast to other industry figures ??that the digital currency in development by the People?ôs Bank of China will be based on blockchain.",,,,,,,,,,,,,,,,,,,,,,,,,,,,,,,,,,,,,,,,,,,,,,,,,,
109,https://cointelegraph.com,14-Nov-19,"Canaan Creative Sets Terms, Plans to Rake in $100 Million in Upcoming US IPO",https://cointelegraph.com/news/canaan-creative-sets-terms-plans-to-rake-in-100-million-in-upcoming-us-ipo,"13, Renaissance Capital reported that Bitcoin (BTC) mining giant Canaan 
Creative announced its plans to raise $100 million by offering 10 ...",14-Nov-19,Chinese cryptocurrency mining giant Canaan Creative has announced terms for its United States initial public offering (IPO) planned for later this month.,"On Nov. 13, Renaissance Capital reported that Bitcoin (BTC) mining giant Canaan Creative announced its plans to raise $100 million by offering 10 million American depositary shares (ADS) at a price range from $9 to $11. This would potentially put the company?ôs overall market value at some $1.6 billion, with an enterprise value of $1.4 billion.An ADS is a U.S. dollar-denominated equity share of a foreign-based company available for purchase on an American stock exchange.¬†In October, Canaan Creative filed with the U.S. Securities and Exchange Commission (SEC) for an IPO intended to raise $400 million, with plans to be listed on the Nasdaq under the ticker CAN. If Canaan is successful, the mining company could become the first China-based mining firm to see public trading in the U.S.¬†As part of its registration to conduct an IPO in the United States, Canaan revealed its Q3 net profit to be 94 million yuan ($13 million). Although the company generated revenue of just over $134 million in the first nine months of 2019, weaker performance early on has still resulted in a total comprehensive income loss of around $31 million.Canaan, which is one of the three major Chinese crypto mining companies alongside Bitmain and Yibang International, previously attempted to launch an IPO in Hong Kong and China, but both attempts failed after regulators pored over their business model and financial outlook. Bitmain, which enjoys a 75% market share of the crypto hardware market worldwide, has likewise tried to complete an IPO, thus far meeting with failure.¬†In October, Bitmain¬†opened what it claimed to be the world?ôs largest facility for Bitcoin mining in Rockdale, Texas, which was completed thanks to a collaboration with the Rockdale Municipal Development District and Canadian technology firm DMG Blockchain Solutions.",,,,,,,,,,,,,,,,,,,,,,,,,,,,,,,,,,,,,,,,,,,,,,,,,,
