,press company,date,title,url,abstract,date detail,head article,main article,,,,,,,,,,,,,,,,,,,,,,,,,,,,,,,,,,,,,,,,,,,,,,,,,,
62,https://cointelegraph.com,11-Nov-19,Real Estate Magnate Sells New York Condo for $15.3M in Bitcoin,https://cointelegraph.com/news/real-estate-magnate-sells-new-york-condo-for-153m-in-bitcoin,"Real estate tycoon Ben Shaoul has sold a retail condo in Manhattan's 
prestigious Upper East Side for $15.3 million in Bitcoin. 5945 Total views.",11-Nov-19,Real estate tycoon Ben Shaoul has sold a retail condo in Manhattan?ôs prestigious Upper East Side for $15.3 million in Bitcoin (BTC). The news was reported by New York real estate magazine The Real Deal on Nov. 1.,"Shaoul ??who is president of the Magnum Real Estate Group ??sold the 11,400-square-foot property to a Taiwan-based entity ?úAffluent International LCC,??according to a person familiar with the deal.While Shaoul himself has reportedly declined to comment, Eric Hedvat ??a broker with Jet Real Estate, which represented Magnum in the deal ??characterized the transaction as ?úa seamless process.?ùMagnum reportedly went into contract with two other buyers in the same building using Bitcoin in 2018 ??one for a 624-square-foot studio at an asking price of $875,000 and the other a 989-square-foot one-bedroom at $1.48 million.Another of Shaoul?ôs residential developments had been listed with an option to purchase using Bitcoin but was eventually sold for cash to Bronx-based investor Martin Shapiro last year for $82 million.Beyond Magnum, the Real Deal notes that Brooklyn-based rental management company announced in 2018 that it would be accepting cryptocurrency as payment.A current listing for a $29 million property on the Upper East Side, marketed by Corocan, notes the seller will ?úaccept payment in Bitcoin, Ethereum, or Ripple.?ùEarlier this fall, Cointelegraph reported that a 150-year-old English church was listed for sale at $1.5 million, either in Bitcoin or fiat currency.Blockchain, the technology underpinning Bitcoin, is also increasingly being implemented to cement ownership rights for real estate and business in order to mitigate fraud in land registries.",,,,,,,,,,,,,,,,,,,,,,,,,,,,,,,,,,,,,,,,,,,,,,,,,,
63,https://cointelegraph.com,19-Nov-19,"Bitcoin Mining Firms Merge to Build World?ôs Largest Purported Mining Farm 
in 2020",https://cointelegraph.com/news/bitcoin-mining-firms-merge-to-build-worlds-largest-purported-mining-farm-in-2020,"Two Bitcoin mining firms entered a merger agreement and plan to jointly 
build the world's largest mining farm. 6131 Total views. 223 Total ...",19-Nov-19,German Bitcoin (BTC) mining firm Northern Bitcoin has entered a merger agreement with United States-based competitor Whinstone to jointly build what will supposedly be world?ôs largest mining farm.,"According to a Northern Bitcoin press release published on Nov. 18, Whinstone is already building the aforementioned facility which is expected to have a capacity of one gigawatt on an area of over 100 acres in Texas. The mining farm in question will allegedly be the largest data center in North America.The first phase of the construction ??which is expected to conclude in Q1 2020 ??will already have a capacity of 300 megawatts. Construction is expected to be completed in Q4 2020.The first two clients that will take advantage of the upcoming facility will reportedly be two publicly traded corporations that will use a significant portion of its capacity for Bitcoin mining. Still, after its completion, the data center will also allow for the acceleration of video rendering and artificial intelligence applications.Northern Bitcoin is a stock-traded company founded last year that specializes in sustainable Bitcoin mining. The firm operates a mining farm on renewable energy in Norway.The idea of placing the world?ôs largest mining facility in the U.S. is interesting, given that China has so far been at the forefront of the cryptocurrency mining industry and hosts many of the leading companies of the industry, such as Bitmain.According to a recent analysis, low power costs in addition to access to cheap hardware make China a competitive destination for cryptocurrency mining operations, despite the country?ôs legal environment.",,,,,,,,,,,,,,,,,,,,,,,,,,,,,,,,,,,,,,,,,,,,,,,,,,
64,https://cointelegraph.com,21-Nov-19,"Binance ?òBuidls??Bridge With India, Acquiring Leading Bitcoin Exchange",https://cointelegraph.com/news/binance-buidls-bridge-with-india-acquiring-leading-bitcoin-exchange,"Binance 'Buidls' Bridge With India, Acquiring Leading Bitcoin Exchange. 
Binance has acquired the well-known Indian crypto exchange WazirX, ...",21-Nov-19,"Binance has acquired the well-known Indian crypto exchange WazirX, bringing easier cryptocurrency access to a population of over one billion.","According to an announcement published on Nov. 21, users will be able to use Indian rupees (INR) to buy and sell crypto via the Binance Fiat Gateway as early as Nov. 25.During the first quarter of 2020, WazirX?ôs auto-matching engine will be integrated into the Binance Fiat Gateway so that Binance.com users will be able to directly place orders on the flagship exchange to purchase Tether (USDT) against INR. With this integration, any crypto tradeable on Binance.com will become accessible for those who purchase USDT via WazirX.In an interview with Cointelegraph, Kashif Raza ??co-founder of the Indian crypto regulatory news and analysis platform ?úCrypto Kanoon????welcomed the development, suggesting that the acquisition will provide a major morale boost to the Indian startup space at a time of deep regulatory uncertainty.This uncertainty is highly likely to have played a role in WazirX?ôs decision to join forces with a major industry incumbent like Binance, he added.Back in July 2018 ??in the aftermath of the Reserve Bank of India?ôs (RBI) controversial ban on banks' dealings with crypto-related firms ??WazirX had transformed its business model into a P2P platform so as to avoid in-house crypto-fiat conversion.Other exchanges, like Coindelta, have since been forced to terminate services altogether in light of the adverse operating climate for crypto businesses in the countryIn a statement, Binance Chief Financial Officer Wei Zhou remarked that ?úbuilding fiat-to-crypto bridges remain a key mission for Binance,??adding that the acquisition of WazirX will help Binance in this mission ?úby providing a simple and cohesive way to purchase cryptocurrencies in a country which is home to more than a billion people.""Binance?ôs chief executive Changpeng Zhao has said the move represents ?úanother step forward in achieving the freedom of money.?ù¬†As reported, the Indian government recently revealed it has opted not to introduce a draft bill on a potential cryptocurrency ban to parliament in the coming winter session.The draft bill ??entitled ?úBanning of Cryptocurrency & Regulation of Official Digital Currencies????reportedly intends not only to impose a complete ban on the use of crypto in India but also to pave the way for a ?úDigital Rupee??issued by the Reserve Bank of India.In late October, Binance launched support for deposits in Nigerian Naira (NGN), announcing that they would add support for fiat trading earlier that month, starting with the Russian ruble.¬†In mid-October, it launched p2p trading for Bitcoin (BTC), Ether (ETH) and USDT against the Chinese yuan and this month added support for the Turkish lira on its flagship exchange.To date, Binance has also launched four international crypto-fiat exchanges, including Binance Uganda, European trading platform Binance Jersey, Binance Singapore and Binance US.",,,,,,,,,,,,,,,,,,,,,,,,,,,,,,,,,,,,,,,,,,,,,,,,,,
65,https://cointelegraph.com,14-Nov-19,"Bitcoin Fixes This: PayPal Cuts Payouts to Over 100,000 Pornhub Models",https://cointelegraph.com/news/bitcoin-fixes-this-paypal-cuts-payouts-to-over-100-000-pornhub-models,"The latest in a series of seemingly arbitrary shutdowns leaves over 100,000 
models having to find an alternative payment method. 15590 Total ...",14-Nov-19,"Bitcoin (BTC) is being championed as the solution to a new payment crisis affecting the adult entertainment website Pornhub. In a blog post on Nov. 14, Pornhub revealed that payment processor PayPal had abruptly stopped servicing its models.¬†","Previously, models throughout the world received payouts via PayPal, which has not publicly stated why it cut them out of its platform.¬†?úWe are all devastated by PayPal's decision to stop payouts to over a hundred thousand performers who rely on them for their livelihoods,??the blog post reads.Pornhub is now using direct funds transfer alternatives, which models must set up themselves. The website began a deal with cryptocurrency project Verge (XVG) last year, while users can purchase products with various cryptocurrencies via Pornhub?ôs partnership with merchant gateway PumaPay.The debacle is just the latest in a string of skittish moves from PayPal, which has become well known for its seemingly arbitrary account shutdowns.¬†In each case, Bitcoin proponents highlight the benefit of using censorship-resistant cryptocurrency instead. Bitcoin transactions cannot be canceled or denied by a third party since they are peer-to-peer.Pornhub?ôs problems, despite the Verge deal, nonetheless put the lack of overall knowledge of cryptocurrency in the spotlight.¬†?úCrypto, personal portal... LOL. I don?ôt understand what that even is. I?ôm cool with just direct deposit into my bank account,??Shyla Jennings, a prominent model on the site, responded to the news on Twitter.Jennings added she did not use PayPal herself, as the service had had her ?úblacklisted for years.??
66,https://cointelegraph.com,Nov 20"," 2019""","New York Judge Grants US Government Right to Intervene in $7M Bitcoin Fraud 
Case",https://cointelegraph.com/news/new-york-judge-grants-us-government-right-to-intervene-in-7m-bitcoin-fraud-case,"New York Judge Grants US Government Right to Intervene in $7M Bitcoin Fraud 
Case. A New York district court has ruled in favor of the U.S. ...",20-Nov-19,"The New York Southern District Court has ruled in favor of the United States government to intervene in a civil case against Jon Barry Thompson, who is alleged of a $7 million Bitcoin (BTC)-related fraud.","With Judge Loretta A. Preska?ôs ruling on Nov. 19, the U.S. government ??in this case, represented by the Commodity Futures Trading Commission (CFTC) ??now has the right to intervene in civil proceedings that are running parallel to a criminal multimillion Bitcoin scam case.Thompson, a resident of Easton, Pennsylvania, is charged with ?úknowingly or recklessly making false representations to customers in connection with the purported purchase of Bitcoins worth over $7 million.??Preska stated:?úUpon the consent of all relevant parties, the Government?ôs application to intervene in the above entitled matter and to stay the matter in its entirety until the conclusion of the parallel criminal case, United States v. Jon Barry Thompson [...] is granted.?ùThe case was initiated by the CFTC in late September, which claimed that after receiving clients??funds, Thompson, the head of a Bitcoin escrow service, sent virtually all of the money to third parties. The purported Bitcoin was not delivered to clients while their funds were not safeguarded as promised.¬†The CFTC thus seeks restitution, disgorgement, civil monetary penalties, permanent trading and registration bans, and a permanent injunction against all further violations of the Commodity Exchange Act and the CFTC?ôs regulations.As reported on Nov. 6, the Office of U.S. Immigration and Customs Enforcement?ôs Homeland Security Investigations and prosecutors for the Southern District of New York indicted Asa Saint Clair for allegedly participating in a cryptocurrency scheme dubbed Igobit. Saint Clair was charged with one count of wire fraud, which carries a maximum sentence of 20 years in prison if convicted.Last month, the CEO of Delaware-registered blockchain firm Veritaseum LLC and New York-registered Veritaseum Inc., Reggie Middleton, was ordered to pay $8.4 million in disgorgement in a securities fraud case.",,,,,,,,,,,,,,,,,,,,,,,,,,,,,,,,,,,,,,,,,,,
67,https://cointelegraph.com,11-Nov-19,"Price Analysis 11/11: BTC, ETH, XRP, BCH, LTC, EOS, BNB, BSV, XLM, TRX",https://cointelegraph.com/news/price-analysis-11-11-btc-eth-xrp-bch-ltc-eos-bnb-bsv-xlm-trx,"Bitcoin (BTC) attempted to rebound off the critical support at $8,777.89 on 
Nov. 10 but the bounce fizzled out just above the $9,080 mark. This ...",11-Nov-19,The crypto markets are going through a phase of uncertainty with several cryptocurrencies failing to show a firm trend. This is because the markets lack a catalyst that can either pull prices higher or plunge them lower.¬†,"However, a developing catalyst could be the launch of the China-backed central bank digital currency (CBDC). Jack Lee, a founding partner at HCM Capital, believes that China?ôs central bank is ready and the digital currency could be launched within the next two to three months. If this experiment is successful, it would likely force the other developed nations to follow suit.Daily cryptocurrency market performance. Source: Coin360Another catalyst that could prove bullish for the crypto market is the continuous inflow of institutional money. However, this has not yet materialized due to a variety of reasons. Bakkt has announced that it has received approval from the New York Department of Financial Services to offer crypto custody services to any institution. Bakkt expects this move to increase institutional adoption.However, not everyone is bullish on the crypto space. The European Central Bank?ôs former president Jean-Claude Trichet is ?ústrongly against Bitcoin??and does not consider it as a currency.¬†¬†¬†Therefore the question must be asked. Should traders view the current dip in Bitcoin price as a buying opportunity, or can the leading cryptocurrency surprise investors with additional moves to the downside? Let?ôs study the charts to see what signals the market is providing.Bitcoin (BTC) attempted to rebound off the critical support at $8,777.89 on Nov. 10 but the bounce fizzled out just above the $9,080 mark. This shows that higher levels are attracting profit booking.¬†¬†¬†Currently, the price has again dipped to the support at $8,777.89. If this level fails to hold, the BTC/USD pair could dip to $8,467.54, which is 61.8% retracement of the most recent up move. This is an important level to watch out for because if it cracks, a drop to $7,297.21 is possible.Conversely, if the pair bounces off the 50-day SMA, the bulls will again attempt to clear the downtrend line and retest the recent highs of $10,360.89. We will wait for the pair to breakout and close (UTC time) above the downtrend line before recommending a trade.For the past few days, Ether (ETH) has been trading within the intraday high and intraday low made on Oct. 26. A breakout of $197.75 will be a positive move that can carry the price to the overhead resistance zone of $223.999 to $235.70.¬†Conversely, if the bears sink the price below the support at $173.841, it can decline to $161.056-$151.829 support zone. If this zone holds, the ETH/USD pair might remain range-bound for a few more days.¬†Our view will be invalidated if the pair breaks below $151.829. In such a case, the downtrend will resume. Therefore, traders can protect the long positions with stops at $150.XRP is looking weak as it hardly bounced after the steep fall on Nov. 7 and 8. This shows that the bulls are not using the dips to buy as they expect the price to slide further. The next support to watch on the downside is $0.24508. If this support also cracks, a retest of $0.22 will be on the cards. Therefore, traders can protect their long positions with stops at $0.24.Contrary to our assumption, if the XRP/USD pair reverses direction from the current levels and breaks out of $0.31491, it can rally to $0.34229. However, with the moving averages starting to turn down and the RSI in the negative territory, advantage is with the bears and a rally looks unlikely.Bitcoin Cash (BCH) has again hit a wall close to the neckline of the head and shoulders pattern. This suggests that the bears are aggressively defending this resistance level. If the price slips below the 20-day EMA, it can decline to $241.85. Therefore, traders can trail the stop loss on the long positions to $267.¬†However, if the BCH/USD pair turns up from the current level and sustains above the neckline, it can rise to $360. This is a significant resistance, hence, traders can book partial profits closer to $360 and keep a close stop loss on the rest of the position.¬†Litecoin (LTC) is struggling to find buyers above $62.0764. It has again dipped to the 20-day EMA. If the bears sink the price below the moving averages, the altcoin can drop to the critical support at $50. A breakdown of $47.1851 will be a huge negative and will resume the downtrend.However, if the support at $50 holds, a few days of consolidation is possible. The flattening moving averages and the RSI just above 50 level also suggests a range formation.Alternatively, if the LTC/USD pair bounces off the moving averages and rises above $66.1486, it can move up to $80.2731. The traders can protect their long positions with stops at $47. We shall trail the stops higher at the first available opportunity.EOS is sandwiched between 20-day EMA and $3.69 for the past few days. The bears are aggressively defending the downtrend line. If the altcoin breaks below $3.3137, a drop to $2.9980 is likely. A break below this level will be a huge negative as it can drag the price to $2.4001.¬†Conversely, if the EOS/USD pair bounces off the 20-day EMA and breaks out of the downtrend line, it is likely to pick up momentum and rally to $4.24 and above it to $4.8719. Traders can continue to hold their long positions with a stop loss of $2.95.Binance Coin (BNB) has been trading between the 20-day EMA and $21.2378 for the past few days. A breakout of $21.2378 can push the price to $23.5213 and above it to $30. However, if the bears sink the price below the 20-day EMA, a drop to the 50-day SMA is likely.The 50-day SMA, the horizontal support and the uptrend line are all situated close to each other. Hence, we expect the bulls to defend it aggressively. If the BNB/USD pair bounces off this support, it will consolidate between $18.30 and $21.2378 for a few days.¬†The pair will turn negative if it breaks down of the critical support and re-enters the channel. For now, traders can keep the stop loss on the long positions at $16. We will recommend trailing the stops higher within the next few days.Bitcoin SV (BSV) is trading inside a channel that is descending down marginally. The next decisive move will start after the price escapes the channel. If the bulls manage to push the price above the channel, a move to $188.69 is likely. Though there is a resistance at $155.38, we expect it to be crossed.Conversely, if the price breaks down of the channel, a drop to $107 is possible. The short-term traders can buy on a bounce off the support line of the channel and book profits closer to the resistance line of the channel. However, we suggest positional traders wait until the BSV/USD pair breaks out and closes (UTC time) above the channel for establishing any positions.¬†Stellar (XLM) bounced sharply from the 20-day EMA in the past two days. However, it is facing profit booking just above the $0.080 mark. This shows that bulls are keen to buy on dips to strong support levels and the bears are attempting to defend the overhead resistance levels. This could result in a consolidation for a few days until one party emerges victorious.The critical level to watch on the upside is $0.088708. If this level is scaled, the XLM/USD pair can move up to $0.145. On the other hand, if the pair breaks below the 20-day EMA, it can drop to the 50-day SMA. We do not find any buy setup that offers an attractive risk to reward ratio, hence, we suggest traders remain on the sidelines.Tron (TRX) has been clinging to the support for the past three days. However, the failure to bounce off it indicates a lack of urgency among buyers. If the bears sink the price below $0.0183603, a drop to the 50-day SMA is likely.Both moving averages are flattening out and the RSI has dipped close to the midpoint. This suggests a consolidation for a few days.However, if the TRX/USD pair bounces off the current levels and breaks above $0.0204880, it can move up to $0.02340. We will turn positive above $0.0204880. Until then, we remain neutral on the pair.The views and opinions expressed here are solely those of the author and do not necessarily reflect the views of Cointelegraph. Every investment and trading move involves risk. You should conduct your own research when making a decision.Market data is provided by HitBTC exchange.",,,,,,,,,,,,,,,,,,,,,,,,,,,,,,,,,,,,,,,,,,,,,,,,,,
